{
     "Tip": "Makale",
     "Dergi İsmi": "Maltepe Üniversitesi Hukuk Fakültesi Dergisi",
     "Üniversite İsmi": "",
     "Gün": "",
     "Ay": "",
     "Yıl": "2021",
     "Cilt": "",
     "Sayı": "2",
     "Başlık": "Dijital Reklamcılığın Yol Açtığı Hukuki Sorunlar ve Çözüm Önerileri",
     "Title": "Legal Problems Caused by Digital Advertising and Solution Proposals",
     "Yazar İsmi": [
          "Dr. Öğr. Üyesi Mete TEVETOĞLU",
	  "Av. Betül ÇOLAK"
     ],
     "Danışman İsmi": "",
     "Anahtar Kelimeler": [
          "Reklamcılık",
          "Dijital Reklamlar",
          "Büyük Veri",
          "Büyük Teknoloji Şirketleri",
          "Reklam Yasağı."
     ],
     "Keywords": [
          "Advertising",
          "Digital Ads",
          "Big Data",
          "BigTech",
          "Advertising Ban."
     ],
     "Özet": "Teknoloji, temas ettiği her sektörü değiştirmekte, geliştirmekte veya dönüştürmek-tedir. Reklamcılık, teknolojik gelişmelerden en çok ve en doğrudan etkilenen sektörler-dendir. Ürün ve hizmetin insanlara tanıtılmasını, onlar tarafından bilinmesini ve tercih edilmesini hedefleyen reklamlar için, teknoloji bulunmaz nimetler sunmaktadır. Özellikle Web 2.0, giderek daha yaygın şekilde kullanılan sosyal medya platformları, yeni medya araçları, reklamcılık sektörünü adeta yeniden yapılandırmıştır. Teknoloji, sadece yeni bir reklam mecrası sunmamaktadır. Aynı zamanda tüketici alışkanlıklarının izlenmesi, hedef kitle reklamcılığı ve davranışsal reklam uygulamaları ile reklamcılığı zenginleştirmekte, çeşitlendirmekte, reklamcılık üzerindeki etkisini her geçen gün arttırmaktadır. Reklamcı-lığın bu dijital evrimi, verilerin hukuka uygun bir şekilde işlenmesi, sosyal medya etkile-yicilerinin hukuki durumu, dijital reklam pazarındaki rekabet ihlalleri ve vergilendirme gibi hukuki sorunlara yol açmaktadır. Öte yandan hem genel olarak reklamlara hem de özel olarak dijital reklamlara dair yasal düzenlemeler dağınık ve uyumsuz bir görünüm-dedir. Bu sebeplerle, çalışmamızda dijital reklamcılığın yol açtığı sorunlar, önce reklam türleri ve dijital reklamcılık ele alınarak hukuki açıdan incelenmiş; ardından rekabet, veri koruma ve vergi hukuku alanlarındaki güncel sorunlara değinilmiş ve bunlara dair çözüm önerileri ele alınmıştır.",
     "Abstract": "Technology changes, develops or transforms every sector it comes into contact with. Advertising is one of the sectors utmost and most directly affected by technological developments. Technology offers golden opportunities for advertisements that aim to introduce products and services to people, to be known and preferred by them. Especially Web 2.0, intensive and widespread use of social media and new media tools have almost restructured the advertising. Technology is not only a new advertising medium, but also increases its effects day by day by enriching and diversifying advertising with monitoring consumer habits, targeted and behavioral advertising practices. While advertisements are digitized, issues such as legality of data processing, the legal status of social media influencers, violations of competition and problems of taxation in the digital advertising market draw attention as prominent legal debates. On the other hand, the regulations regarding advertisements present a scattered, broad and incompatible appearance. For these reasons, in our study, these issues caused by digital advertising were examined from a legal perspective, primarily by dealing with advertising types and digital advertising; then, current problems in the fields of competition, data protection and tax law regarding digital advertisements were mentioned and solutions for them are discussed.",
     "Metin": "REKLAM TERİMİ, GELENEKSEL VE DİJİTAL REKLAMLARTürkçe’ye,  Fransızca  réclame”  kelimesinden  geçen  reklam”  kavramı, Türk Dil Kurumu tarafından Bir şeyi halka tanıtmak, beğendirmek ve böylelikle sürümünü sağlamak için denenen her türlü yol” olarak tanımlanmaktadır.4 Oxford 3  Kocaman.4  Türk Dil Kurumu, Reklam, https://sozluk.gov.tr (erişim tarihi 26.04.2021).T.C. MALTEPE ÜNİVERSİTESİ • Hukuk Fakültesi Dergisi • 2021 / 146 Dr. Öğr. Üyesi Mete TEVETOĞLU - Av. Betül ÇOLAKAdvanced Learner’s Dictionary ise reklamı, mal veya hizmetin bildiri, resim ya da film ile insanlara tanıtılması şeklinde ifade etmektedir.5Doktrinde reklamlara ilişkin birbirinden farklı tanımlar bulunmaktadır. Zevkliler ve Özel’e göre reklam, bir plan dahilinde, diğer insanları gerek tek tek fertler olarak gerek belirli bir gruba mensup kişiler olarak etkileyerek belirli bir davranış biçimi için kazanmak üzere kullanılan araçtır.”6 Pektaş tarafından reklam; gazete, dergi, radyo, televizyon, afiş, tabela gibi medyalar aracılığıyla çeşitli mal ve hizmetlerin geniş halk kitlelerine tanıtımı” şeklinde ifade edil-miştir.7Uluslararası Ticaret Odası ise reklamı; ...mecralarda bir ücret ya da bir değer karşılığında yayımlanan her türlü pazarlama iletişimi” olarak tanımlamaktadır.8Görüldüğü üzere reklam kavramını hedef kitlesine, yayımladığı mecraya ve amacına göre farklı şekillerde tanımlamak mümkündür. O halde reklam” kısa-ca, belirli bir kişi ya da gruptan oluşan hedefe mesaj iletmeyi amaçlayan tanıtım faaliyeti olarak ifade edilebilir. Buna mukabil, 6563 sayılı Elektronik Ticaretin Düzenlenmesi Hakkında Kanun9 (ETDK) ise reklam kavramına yer vermeksizin, 2/1 maddesinin (c) bendinde ticari elektronik ileti” kavramına dair; telefon, çağrı merkezleri, faks, otomatik arama makineleri, akıllı ses kaydedici sistemler, elektronik posta, kısa mesaj hizmeti gibi vasıtalar kullanılarak elektronik ortamda gerçekleştirilen ve ticari amaçlarla gönderilen veri, ses ve görüntü içerikli iletiler” tanımını yapmaktadır. Görüldüğü üzere reklam mecra ve hedeflerine göre farklı tanımlara tabi tutulabilirken araçlarına göre tür ve şekil değiştirebilmektedir. Gö-rüşümüze göre, ticari elektronik ileti esasen reklamın elektronik bir türüdür. Fa-kat reklamın dijitalleşmesinden ötürü, kullanılan araç ve ortamın etkisiyle, hem isimlendirmesi hem de ruhu klasik reklamlara göre adeta mutasyona uğramış, reklam olarak tanınması ve hatta ETDK’da olduğu gibi reklam olarak anılması dahi önemli ölçüde terk edilmiştir. Oysa ETDK’nın bahse konu ticari elektronik ileti” kavramı ve tanımı karakteristik bir reklam vasfındadır. Elektronik olması ve örnekleri bakımından ise tam bir dijital reklam tanımı görünümündedir.5  Oxford Learner’s Dictionaries, Advertisement, https://www.oxfordlearnersdictionaries.com/us/definition/english/advertisement (erişim tarihi 26.04.2021).6  Aydın Zevkliler / Çağlar Özel, Tüketicilerin Korunması Hukuku, Seçkin Yayıncılık, Ankara, 2016, s. 418.7  Hasip Pektaş, ‘Reklâm Nedir? İşlevi ve Etkileri Nelerdir?’, Ondokuz Mayıs Üniversitesi Eğitim Fakültesi  Dergisi,  Cilt:  2,  Sayı:  1,  https://dergipark.org.tr/tr/download/article-file/188293 (erişim tarihi 26.04.2021), s. 221.8  Uluslararası Ticaret Odası, Uluslararası Reklam Uygulama Esasları, https://ird.org.tr/assets/pdf/icc-20.pdf (erişim tarihi 26.04.2021).9  RG. 05.11.2015, S. 29166.T.C. MALTEPE ÜNİVERSİTESİ • Hukuk Fakültesi Dergisi • 2021 / 1Dijital Reklamcılığın Yol Açtığı Hukuki Sorunlar ve Çözüm Önerileri 47A. Geleneksel Reklam TürleriKlasik veya geleneksel reklamlar; gazete, dergi, radyo, televizyon ve reklam panosu gibi geleneksel reklam mecraları üzerinden yayımlanan reklamlar olarak ifade edilebilir. İnternetin giderek artan kullanımı klasik reklam türlerine olan ilgiyi olumsuz etkilemektedir.10Radyo ve televizyonun icadı geleneksel reklamların kalitesini yükseltmiştir. Hem hedef kitle bakımından hem de reklam verenler için düşük maliyetli radyo reklamları uzun bir süre boyunca yüksek cazibeli ve etkili bir kanal olmuştur. Za-manla, televizyon fiyatlarının düşmesi, ses özelliğinin yanı sıra izleyicilere görüntü özelliği sunmasıyla reklam verenlerin ilgisini çekmiştir. Televizyon reklamlarının yüksek yayım maliyeti sebebiyle, hedef kitlede güvenilirlik algısı oluşturması rek-lam verenlerin bu mecrayı tercih etmesindeki bir diğer etken olmuştur.Son olarak açık hava reklamları, reklam sözleşmesinde belirtilen süre bo-yunca açık havada konumlandırılan ve hedef kitleye kesintisiz olarak ulaşabilen reklamlardır. Açık hava reklamları iyi tasarlandığında ve konumlandırıldığında hedef kitlenin ilgisini kolaylıkla çekmekte ve son derece etkili olmaktadır.11B. Dijital Reklam Türleri1. Tasnifİnternetin ve Web 2.0 teknolojisinin büyük gelişme kaydetmesi ile birlikte geleneksel reklamcılıktan dijital reklamcılığa doğru tam anlamıyla bir göç ya-şanmış; birçok sektörde olduğu gibi reklamcılık sektörü de dijital dönüşüm ve değişimi iliklerine kadar hissetmiştir. Dijital mecraların dinamik yapısı, reklam-lara ilişkin güncel bir tasnif yapmayı dahi zorlaştırmaktadır. Yine de ana hatlarıy-la dijital reklamları; arama motoru reklamları, e-posta reklamları, sosyal medya reklamları, internet sitesi reklamları, görüntüleme esaslı (display) reklamlar, viral reklamlar, oyun reklamları ve doğal reklamlar şeklinde sınıflandırmak mümkün-dür. Tabi ki doktrinde veya ETDK 2/1 maddesinin (c) bendinde olduğu gibi başka şekilde sınıflandırmalar yapmak12 her zaman mümkündür. Bu çalışma bakımından 10  Deloitte, Türkiye’de Tahmini Medya ve Reklam Yatırımları - 2020 İlk 6 Ay Raporu, 2020, s.  6.  Buna  karşın,  özellikle  basılı  kaynakları  takip  etmek  isteyenler,  internet  kullanma imkanına sahip olmayan ya da okuma yazma bilmeyen kimseler için klasik reklamlar halen önemini ve değerini korumaktadır. Klasik veya gelenekselleşmiş reklamların bölge bazında hazırlanabilmesi, güncel olması ve geniş okur kitlesi reklam verenlerin bu türü tercih etmesine yol açan sebeplerden birkaçı olarak anılabilir.11  Ahmet  Koçyiğit,  Geleneksel  Reklamcılıktan  Dijital  Reklamcılığa  Geçiş,  Sosyal  Medya Reklamcılığı ve Ortaya Çıkan Sorunlar, Yayınlanmamış Yüksek Lisans Tezi, Gazi Üniversitesi Sosyal Bilimler Enstitüsü, Ankara, 2017, https://bit.ly/37cibeP (erişim tarihi 14.07.2021), s. 101.12  İbrahim Kırcova, Standart Gif Banner Reklamlar, Rich Medya Reklamları, Brandwrap Reklam Formu, E-Posta Reklamları gibi internet reklam türleri arasında bir gruplandırma yapmıştır. Bkz. İbrahim Kırcova, İnternette Pazarlama, Beta Yayıncılık, İstanbul, 2012, s. 213.T.C. MALTEPE ÜNİVERSİTESİ • Hukuk Fakültesi Dergisi • 2021 / 148 Dr. Öğr. Üyesi Mete TEVETOĞLU - Av. Betül ÇOLAKise kapsayıcı olması sebebiyle, dijital reklamlara ilişkin yukarıda yer verdiğimiz sınıflandırmamızın, incelememizin içeriği ve kapsamı bakımından uygulamaya uygun ve güncel olacağını düşünmekteyiz.2. Arama Motoru Reklamcılığıİnternet, yaşadığımız dijital çağda, herhangi bir ürün veya hizmet hakkında araştırma yapmak için en fazla tercih edilen mecradır. Bugün araştırma için kütüp-hanelere ya da alışveriş için markete veya mağazaya gitmeye eskisi kadar gerek duyulmamaktadır. Anahtar kelimeler Google’da aranarak, ihtiyaç duyulan bilgile-re, ürün veya hizmetlere kolayca ulaşılabilmektedir. Bu durum reklam verenlerin arama motorları üzerinden yaptığı aramaların sonuçlarında üst sırada yer almak için yarışa girmesine neden olmuştur. Bu amaçla herhangi bir ücret ödemeksizin yapılan çalışmalar kısaca arama motoru optimasyonu (search engine optimizati-on-SEO) olarak adlandırılmaktadır.13 SEO, arama motorlarında aranan herhangi bir kavramın çevrimiçi ortamda bulunmasını ve ilgili kavramı içeren internet sitesinin arama sonuçlarına göre üst sıralarda yer almasını sağlamaktadır.14 Bu da hedef kit-lenin arama motorunda hangi kelimeyi arattığını, sayfada ne kadar vakit geçirdiğini ya da ne sıklıkla sayfayı ziyaret ettiğini bilmekle mümkündür.15 İşletmeler SEO çalışmalarını ücretsiz yürütürken; arama motoru pazarlamacılığı (search engine marketing-SEM) faaliyetleri için bir miktar ücret ödemektedir. Diğer bir ifade ile işletmeler, arama motorlarına ödeme yaparak reklamlarını sponsorlu duruma getir-mektedir.16 Arama motoru reklamcılığı olarak da adlandırılabilecek bu türde, işlet-meler adeta arama motorlarından kullanıcıların sıklıkla arattığı kavram ya da anah-tar kelimeleri satın almaktadır.17 Dijital reklamcılığın hukuka konu olan ilk örnek SEO uygulamalarında kendisini göstermiştir. Zira SEO uygulamalarında reklam verenlerin seçtikleri anahtar kelimenin bir marka olması durumunda, diğer yasal unsurların da mevcut olması kaydıyla, marka hakkının ihlali gündeme gelebilmek-tedir.18 Sınai Mülkiyet Kanunu madde 7/3-(d) hükmü uyarınca İşareti kullanan kişinin, işaretin kullanımına ilişkin hakkı veya meşru bağlantısı olmaması şartıy-la işaretin aynı veya benzerinin internet ortamında ticari etki yaratacak biçimde 13  Mete Tevetoğlu, Advertising Practices in Searching Engines and Arising Disputes, Prof. Dr. Mehmet Akad’a Armağan, İstanbul 2021, s. 831 vd.14  David  Meerman  Scott,  Pazarlamanın  ve  İletişimin  Yeni  Kuralları:  Alıcılara  Doğrudan Ulaşmak İçin Basın Bültenleri, Bloglar, Pod Yayını, Viral Pazarlama ve Online Medyadan Nasıl Faydalanılır?, (çev. Nadir Özata), MediaCat Yayıncılık, İstanbul, 2009, s. 254.15  Arda Süar, Sosyal Medyanın Geleneksel Reklam Araçlarına Göre Hedef Kitle Belirlemedeki Avantajları, Kocaeli Üniversitesi, Online Academic Journal of Information Technology, Sayı: 28, Yıl: 2017, Kocaeli, https://dergipark.org.tr/tr/download/article-file/1113916 (erişim tarihi 14.07.2021), s. 28.16  Süar, s. 28.17  Scott, s. 254.18  Tevetoğlu, s. 835 vd.T.C. MALTEPE ÜNİVERSİTESİ • Hukuk Fakültesi Dergisi • 2021 / 1Dijital Reklamcılığın Yol Açtığı Hukuki Sorunlar ve Çözüm Önerileri 49alan adı, yönlendirici kod, anahtar sözcük ya da benzeri biçimde kullanılması” durumunda markaya tecavüz söz konusudur. Örneğin Yargıtay, internet üzerinden çiçek siparişinde ciddi bir marka gücüne ulaşan Çicek Sepeti” markasını anahtar sözcük olarak kullanan cicekdiyari.com” web sitesi operatörüne karşı açılan diji-tal reklamdan kaynaklanan marka tecavüzü davasında, davalı taraf çiçek sepeti” ibarelerinin jenerik isimler olduğunu ileri sürmüşse de, mahkeme; anahtar sözcük seçimi dolayısıyla reklamda marka hakkı ihlalinin oluştuğuna hükmetmiştir.19Avrupa Adalet Divanı’nın (Divan) SEO konusunda dijital reklamcılığa dair ilk ve en önemli kararlarından olan Google vs Louis Vuitton davası bu bakımdan önemli bir konumdadır. Bu karar aynı zamanda madde 7/3-(d) hükmünün daya-nağı ve sebebidir. Dava konusu olayda, Louis Vuitton, Google’ın reklam veren şirketlere Louis Vuitton” markasını, imitation” ve copy” gibi sözcüklerle bir-likte anahtar kelime olarak önermesinin marka hakkının ihlali olduğunu gerek-çesiyle Paris Mahkemesi’ne başvurmuştur. Paris Mahkemesi, Google’ın arama anahtarı reklamcılığının, davacının tanınmış markasının üzerindeki hakkını ihlal ettiğine karar vermiştir. Daha sonra Fransız Yüksek Mahkemesi’ne taşınan dava, Yüksek Mahkeme tarafından Divan’a iletilmiştir. İncelemesine markanın ticari kullanımından başlayan Divan, arama motoru bakımından sadece ticari etki ya-ratan kullanımı, markasal hakkın ihlali için yeterli bulmamıştır. Böylece, arama motorunda, başkasına ait markanın reklam aracı yani arama anahtarı olarak kul-lanılmasını, tek başına, marka hakkının dijital reklamcılık yoluyla ihlaline yol açan bir markasal kullanım vasfında addetmemiştir. Ancak bu kullanımın reklam vasfında olduğunun belirtilmesi kuralı da bu karardan sonra ortaya çıkmıştır.Davalı bakımından ise durum farklıdır. Divan kararında, davalının, başkası-nın markasını meşru bir bağlantısı olmadan, ticari etki yaratacak şekilde kullana-mayacağına işaret etmiştir. Google bakımından ise arama motoru hizmetinin Av-rupa Birliği E-Ticaret Direktifi20 kapsamında bilgi toplumu hizmeti olarak değer-lendirilebileceği, bu bakımından Google’ın marka ihlalinden, ihlalden haberdar edildiği ana kadar, sorumlu tutulmaması gerektiği değerlendirilmiştir.21 Divan, dijital reklamcılık faaliyetleri bakımından, internet servis sağlayıcısının sorum-luluktan muaf olabilmesini; faaliyetinin salt teknik, otomatik ve pasif nitelikte olmasına bağlamış ve bununla sınırlandırmıştır.2219  Yargıtay 11. HD, 2016/6297 E, 2018/172 K, 10.01.2018 T (www.lexpera.com.tr).20  Directive 2000/31/EC of the European Parliament and of the Council of 8 June 2000 on certain legal aspects of information society services, in particular electronic commerce, in the Internal Market  (‘Directive  on  electronic  commerce’),  https://eur-lex.europa.eu/legal-content/EN/ALL/?uri=CELEX%3A32000L0031 (erişim tarihi 08.07.2021).21  C-236/08, Google France, para. 41, https://eur-lex.europa.eu/legal-content/EN/TXT/HTML/?uri=CELEX:62008CJ0236&from=en (erişim tarihi: 21.09.2021).22  C-236/08, Google France, para. 113, https://eur-lex.europa.eu/legal-content/EN/TXT/HTML/?uri=CELEX:62008CJ0236&from=en (erişim tarihi 21.09.2021).T.C. MALTEPE ÜNİVERSİTESİ • Hukuk Fakültesi Dergisi • 2021 / 150 Dr. Öğr. Üyesi Mete TEVETOĞLU - Av. Betül ÇOLAK3. Elektronik Postaİnternet, bireylerin araştırma yapma yöntemlerini değiştirdiği gibi iletişim kur-ma biçimlerini de değiştirmiştir. Mektuplar mazide kalan nostaljik bir iletişim metodu haline gelirken elektronik postalar (e-posta) hızlı ve zengin özellikleriyle işletmeleri müşterilerine hızlı ve doğrudan bir şekilde bağlamaktadır. İşletmeler, e-posta ile müş-terilerine veya hedef kitlesine; anında, doğrudan ve kolayca ürün ve/veya hizmetle-rini tanıtabilmekte; onlara özel teklifler sunabilmekte, kampanyalarından haberdar edebilmekte ve bülten göndererek onları bilgilendirebilmektedir. Ancak gönderilen e-postaların, e-posta reklamı olarak kabul edilebilmesi için, iletinin mevcut müşte-ri sayısını çoğaltmak ve/veya düzenli müşteri kitlesine sahip olmak amacıyla hedef kitleye sunulması ve reklam barındırması gerekmektedir.23 Buna göre, işletmelerin, müşterilerine veya hedef kitleye elektronik posta ilettiği her halde dijital reklamdan bahsedilemeyeceği gibi bu tür iletiler her hal ve şart altında ticari elektronik ileti ola-rak kabul edilmemeli, ETDK madde 2/1 (c) hükmünde aranan ticari amaç” unsuru-nu barındıranlar dijital reklam veya ticari elektronik ileti olarak ele alınmalıdır.4. Sosyal MedyaGünümüzde Facebook, YouTube, WeChat, TikTok, Snapchat, Telegram ve Twit-ter24 gibi klasik sosyal medya platformlarındaki ve vloglar, bloglar, podcastler gibi çeşitli forumlardaki kullanıcı sayısı milyarlara ulaşmıştır. Söz konusu platformlar reklam verenlere, hakkında oldukça fazla bilgi sahibi olabilecekleri geniş bir hedef kitleye ulaşma imkânı sunmaktadır. Zira hesap oluşturdukları andan itibaren kullanı-cılar, kendileri hakkındaki birçok bilgiyi kaydetmekte25 ve zaman içerisinde paylaş-tıkları gönderi (post) ve hikâyelerle (story) hesaplarını zenginleştirmektedir. Böylece sosyal medya platformları hedef kitle hakkında Büyük Veri’ye kolayca ve zahmetsiz-ce sahip olurlar. Sosyal medya reklamları kişiselleştirilebilmesinin yanı sıra Youtu-ber, Blogger, Fenomen diye adlandırılan sosyal medya etkileyicilerinin desteğinden yararlanılabilmesi bakımından da hedef kitle üzerinde oldukça etkilidir.5. Web Sitesi Reklamlarıİnternet sitesi reklamlarında, pek çok reklam aynı sayfada konumlandırıldığı için, görünürlük bakımından, işletmeler arasındaki rekabet oldukça yüksektir. Bu doğrultu-da internet sitesinde hedef kitlenin dikkatini çeken ve kolay anlaşılan reklamlar sunan 23  Yasemin Gedik, ‘E-Posta Pazarlama: Teorik Bir Bakış’, Uluslararası Yönetim Akademisi Dergisi, Cilt: 3, Sayı: 2, 2020, E-Posta Pazarlama: Teorik Bir Bakış Email Marketing: A Theoretical Perspective, Marketing_A_Theoretical_Perspective, https://bit.ly/3fiI9BX, (erişim tarihi 14.07.2021), s. 479.24  Statista, Most Popular Social Networks Worldwide as of January 2021-Ranked by Number of Active Users, https://www.statista.com/statistics/272014/global-social-networks-ranked-by-number-of-users/ (erişim tarihi 26.04.2021).25  Mary Atamaniuk, Which Company Uses the Most of Your Data?, Clario Blog, 2021, https://clario.co/blog/which-company-uses-most-data/ (erişim tarihi 26.04.2021).T.C. MALTEPE ÜNİVERSİTESİ • Hukuk Fakültesi Dergisi • 2021 / 1Dijital Reklamcılığın Yol Açtığı Hukuki Sorunlar ve Çözüm Önerileri 51işletmeler ön plana çıkacaktır.26 Dolayısıyla burada işletmelerin internet sitesi ve reklam tasarımı kadar reklamla hedefledikleri kitleyi tanıması da önem arz etmektedir.Görüntü esaslı ya da web sitesi sabit reklamları internet kullanıcıların en sık karşılaş-tıkları reklam türlerindendir. Görüntü esaslı reklamlar banner (bayrak veya kenar reklam olarak anılabilir), pop-up (açılır pencere), zenginleştirilmiş medya (ziyaretçilerin etkileşi-me geçmesini sağlayan video, ses gibi gelişmiş özellikler içeren yeni dijital reklamcılık terimidir) ya da video formatında olabilmektedir. Hedef kitle, yazılım kodları aracılığıyla hazırlanan bannerlara tıklamakla ilgili internet sitesine yönlendirilmektedir.27 Web sayfası formundaki pop-up reklamlar ise internet kullanıcısının ekranına düşerek web sayfasında-ki ziyaretini kesen reklam biçimidir.28 Pek çok internet sitesinde ya da uygulamada kullanı-cıların karşısına çıkan pop-uplar ziyaretçilerde tıklama bıkkınlığına neden olabilmekte ve reklam hukukunun temel kuralı olan önce reklam yapılacağını bildirip reklamı izlememek için seçenek sunacak süreyi tanıma kuralına aykırılık arz edebilmektedir.6. Viral Reklamlarİnternet sayesinde insanların bilgiye ulaşması kadar bilgiyi paylaşması da kolay-laşmıştır. Artık her internet kullanıcısı kendisinin ya da başkasının ürettiği içerikleri bir tıklama ile anında binlerce hatta milyonlarca kişiye ulaştırabilmektedir. İnternet ile yayılma hızı artan dijital reklamlar özellikle farklı ve şaşırtıcı içeriğe sahip ol-duğunda kullanıcılar arasındaki etkisi kartopu gibi giderek büyümektedir. Viral ya da yayılmacı reklam olarak adlandırılan bu tür reklamlarda, reklam olduğuna ilişkin bir ibare de bulunmadığından, hedef kitle reklam izlediğinin farkına varmamaktadır. Hedef kitleyi, viral reklamları kendi isteği ile paylaşmaya yönelten sebeplerden birisi de budur.29 Oldukça yaygın olan bu tür reklamlar ile video, fotoğraf, cümle ve hatta bir beste formatında karşılaşmak dahi mümkündür.30 Örneğin Cristiano Ronaldo’nun Avrupa Futbol Şampiyonası’nda (EURO 2020) Portekiz-Macaristan maçı öncesi ka-tıldığı basın toplantısında, önündeki Coca-Cola şişelerini kenera itip su şişelerini gös-termesiyle hem bu video31 hem de 2006 Dünya Kupası sırasında yer aldığı Coco-Cola reklamı32 internette hızla yayılmıştır. Her yere yayılan videolar viral reklam ihtimalini 26  Aytaç Mestçi, Tanıtım ve Pazarlamanın Yeni Rekabet Alanı: İnternette Reklamcılık, Pusula Yayıncılık, İstanbul, 2013, s. 51.27  Ramazan Aksoy, İnternet Ortamında Pazarlama, Seçkin Yayıncılık, Ankara, 2009, s. 169.28  Kırcova, s. 208, 215.29  Özlem Kalan, ‘Yeni Medyada Reklam ve Etik Sorunlar’, Atatürk İletişim Dergisi, Sayı: 10, Yıl: 2006, https://dergipark.org.tr/tr/download/article-file/397951 (erişim tarihi 14.07.2021), s. 83.30  TRT  Haber,  Arnavutluk’taki  Basın  Toplantısına  THY  Arası,  Youtube,  https://www.youtube.com/watch?v=dAphttps://www.youtube.com/watch?v=dApReSLfQV0ReSLfQV0 (erişim tarihi 08.07.2021).31  Futbol Medya, Ronaldo Shook the World! The Sponsor Lifted the Cola-Cola from the Table, Said Drink Water”, Youtube, https://www.youtube.com/watch?v=Ulw3SsFlCTs (erişim tarihi 08.07.2021).32  Spotmagazine,  Coca-Cola  by  Cristiano  Ronaldo,  Youtube,  https://www.youtube.com/watch?v=ssLdptnMAUM&t=8s (erişim tarihi 08.07.2021).T.C. MALTEPE ÜNİVERSİTESİ • Hukuk Fakültesi Dergisi • 2021 / 152 Dr. Öğr. Üyesi Mete TEVETOĞLU - Av. Betül ÇOLAKgündeme getirmekle birlikte gerçek zamanlı pazarlamaya da konu olmuştur. Olayın ardından IKEA Kanada’nın CRISTIANO” adıyla müşterilerine sunduğu su şişesi, gerçek zamanlı pazarlamaya verilebilecek iyi örneklerden biridir.337. Bilgisayar Oyunlarıİnternet açık havada ya da evde oynanan pek çok oyunu dijital dünyaya taşımıştır. Statista tarafından yapılan küresel bir anket sonucuna göre, kullanı-cılar haftada ortalama 6 saat 33 dakikasını video oyunu oynayarak geçirmek-tedir.34 Gün içerisinde saatlerce oyun oynayan kullanıcılar, çoğu kez, oyun oy-narken geçirdikleri sürenin farkında bile olmamaktadır. Karşılarında saatlerini cömertçe internette geçiren geniş bir kitle bulan işletmeler bu popülasyona ve internette geçirilen süreye odaklanmış, bunu değerlendirmiş ve reklam kam-panyalarını dijital oyunlara entegre etmiştir. Reklam verenler markalarını ya da ürünlerini oyun içerisine yerleştirerek kullanıcı ile etkileşim kurmakta ve ürünlerini oyunculara tanıtmaktadır. Oyun reklamları ürün veya markanın oyu-na yerleştirilmesi suretiyle ya da bir markanın kendi sanal oyununu üretmesi şeklinde oluşturabilmektedir.358. Doğal ReklamlarSon olarak doğal reklamlar, reklam mecrasında bulunan diğer içeriklerin yazı diline benzer şekilde oluşturulan, bulunduğu ortamın yapısına uygun tasar-lanan ve konumlandırılan reklamlardır. Kullanıcılar bu tür reklamlara kendi isteği ile ulaşmaktadır. Yani kullanıcılar aktif bir hareketle doğal reklamlara tıklayarak reklam hakkında bilgi alırlar. Dolayısıyla doğal reklamların kullanıcı ile etkileşi-minin yüksek olduğu gözlemlenmektedir.3633  Adsofteh World, Cristiano, https://www.adsoftheworld.com/media/digital/ikea_cristiano (erişim tarihi 08.07.2021).34  Statista, Average Weekly Hours Spent Playing Video Games in Selected Countries Worldwide as of January 2021, https://www.statista.com/statistics/273829/average-game-hours-per-day-of-video-gamers-in-selected-countries/ (erişim tarihi 26.04.2021).35  Hicran Özlem Ilgın tarafından sıralanan bazı markalara ait video oyunları için bkz. Dominos- Yo! Noid! (1990), Mc Donalds- M.C. Kids (1991), Cheetos- Chester Cheetah: Too Cool to Fool (1992), 7 Up- Cool Spot (1993), Pepsi cola- Pepsiman (1999), Burger King-Sneak King (2006), Pocketbike Racer (2006), Universal Studios- Tom Clancy’s Ghost Becon Advanced Warfrighter (2007), Coco Cola- Guitar Hero (2007), BMW- Gt Legend (2008)”. Hicran Özlem Ilgın, ‘Advergaming ve Marka İlişkisi’, The Turkish Online Journal of Desing, Art and Communication (TOJDAC), Cilt: 3, Sayı: 1, Yıl: 2013, https://studylibtr.com/doc/5698880/advergaming-ve-marka-ilişkisi (erişim tarihi 15.07.2021), s. 26, 28.36  Elif Arslan, Sosyal Medyada Yeni Bir Reklam Türü Olarak Kullanılan Native (Doğal) Reklam, PressAcademia Procedia, Cilt: 9, İstanbul, 2019, http://www.pressacademia.org/archives/pap/v9/50.pdf (erişim tarihi 14.07.2021), s. 271.T.C. MALTEPE ÜNİVERSİTESİ • Hukuk Fakültesi Dergisi • 2021 / 1Dijital Reklamcılığın Yol Açtığı Hukuki Sorunlar ve Çözüm Önerileri 53II. DİJİTAL REKLAMCILIĞIN HUKUKLA ETKİLEŞİMİA. Dijital Reklamcılığın Hukuken Düzenlenme Şekli1. 5651 Sayılı Kanuna Göreİnternete ilişkin ilk ve halen en genel düzenleme, 23.05.2007 tarihinde Resmî Gazete’de yayınlanarak yürürlüğe giren 5651 sayılı İnternet Ortamında Yapılan Yayınların Düzenlenmesi ve Bu Yayınlar Yoluyla İşlenen Suçlarla Mü-cadele Edilmesi Hakkında Kanun”dur. Bu Kanun’un gayesi her ne kadar doğ-rudan dijital reklamcılık hakkında düzenleme yapmak olmasa da Kanun’daki erişim sağlayıcı, yer sağlayıcı ve içerik sağlayıcı kavramları dijital reklamların yayımlandığı mecralar ve reklamlardan doğan hukuki sorumluluklar bakımından önem arz etmektedir. 5651 sayılı Kanun madde 2/1 hükmünde; erişim sağlayıcı; kullanıcılarına internet ortamına erişim olanağı sağlayan her türlü gerçek veya tüzel kişiler”, içerik sağlayıcı; internet ortamı üzerinden kullanıcılara sunulan her türlü bilgi veya veriyi üreten, değiştiren ve sağlayan gerçek veya tüzel kişi-ler” ve yer sağlayıcı; hizmet ve içerikleri barındıran sistemleri sağlayan veya işleten gerçek veya tüzel kişiler” olarak tanımlanmıştır.37Birkaç örnekle somutlaştırmak gerekirse; TTNet veya Turkcell gibi şirketler erişim sağlayıcı; Natro, Radore gibi şirketler yer sağlayıcı; Facebook, Youtube, Twitter, TikTok gibi şirketler hem içerik hem de duruma göre yer sağlayıcı; bu şirketlerin site ve uygulamalarında veriyi üreten, değiştiren ve sağlayan gerçek veya tüzel kişiler ise içerik sağlayıcıdır.38Dijital bir reklamı üreten ve sağlayanlar içerik sağlayıcı konumunda olduk-ları ölçüde, bunun hukuka aykırılığından doğrudan sorumlu iken, yer sağlayıcı-lar ise kendilerine bildirim yapılmasını takiben hukuka aykırı dijital reklama yer sağlamaya devam etmeleri halinde bu andan itibaren sorumludurlar.37  Gönenç Gürkaynak / İlay Yılmaz / Pınar Kara, Türk İnternet Hukuku Uygulamasının ve Mevzuatının Evriminin İlk Dönemini Tamamlaması İçin Öneriler ve Gözlemler, https://bit.ly/3lnZm0z (erişim tarihi 15.07.2021), s. 3; Sefer Oğuz, ‘Telif Hakkı İhlallerinden İnternet Servis Sağlayıcıların Sorumlulukları’, Ankara Hacı Bayram Veli Üniversitesi Hukuk Fakültesi Dergisi, Cilt: 12, Sayı: 1, Yıl: 2008, s. 152, 153.38  Belirtmek gerekir ki, yer sağlayıcılar, platformda yayınlanan içerikleri denetlemek zorunda olmadığı gibi bu içeriklerden de sorumlu değillerdir. Ancak, yer sağlayıcılar, kendilerine bildirim  yapıldığında  hukuka  aykırı  içeriği  yayından  kaldırmakla  yükümlü  kılınmıştır. Reklamın kişilik hakkını ihlal etmesi durumunda, kişilik hakkı ihlal edilen kişi önce içerik sağlayıcısına, içerik sağlayıcısına ulaşamaması halindeyse yer sağlayıcısına başvurup içeriğin kaldırılmasını isteyebilecektir. Bu minvalde yapılan başvurulara içerik ve/veya yer sağlayıcısı tarafından en geç yirmi dört saat içinde cevap verilmelidir. Bununla birlikte kişilik hakkı ihlal edilen kişilerin 5651 sayılı Kanun’un 9. maddesi uyarınca doğrudan Sulh Ceza Hakimliği’ne başvurması da mümkündür.T.C. MALTEPE ÜNİVERSİTESİ • Hukuk Fakültesi Dergisi • 2021 / 154 Dr. Öğr. Üyesi Mete TEVETOĞLU - Av. Betül ÇOLAK2. Haksız Rekabet BakımındanReklam içeriğinin haksız rekabet teşkil etmesi halinde Türk Ticaret Kanunu madde 58/ 1-b uyarınca; yazılı basında yayımlanan programın, görüntünün, ses veya iletinin sahibinin veya ilan verenin kim olduğunun bildirilmesinden kaçı-nıldığı” hallerde sosyal medya platformunu işletenin sorumluluğu gündeme ge-lecektir.39 Bu çerçevede, hukuka aykırı dijital reklam halinde, platformu işleten hakkında TTK’nin 56. maddesinde yer alan haksız rekabetin tespiti, men’i ve haksız rekabet sonucu oluşan maddi durumun ortadan kaldırılması” davalarını açılabilecektir.40 Aynı zamanda TTK madde 58/4 uyarınca Mahkeme, haksız rekabet eyleminin olumsuz sonuçlarının kapsamlı veya vereceği zararın büyük olacağı durumlarda ilgili hizmet sağlayıcısını da dinleyerek, haksız rekabet fiili-nin sona erdirilmesini veya önlenmesine ilişkin tedbir kararını hizmet sağlayıcı aleyhine de verebilir veya içeriğin geçici olarak kaldırılması dâhil somut olaya uyan uygulanabilir başka tedbirler alabilir.” Madde metnindeki hizmet sağla-yıcı” ifadesi 5651 sayılı Kanun bakımından erişim, içerik veya duruma göre yer sağlayıcı olarak değerlendirilmelidir.41 Bu doğrultuda, erişim, içerik ve yer sağ-layıcıların mahkemenin verdiği içerik kaldırma işlemini veya başkaca tedbirleri yerine getirmesi gerekir.423. Tüketici ve Reklam HukukuReklam hukuku acısından, mevzuatta çeşitli kanun ve yönetmeliklerde yer alan reklamlara ilişkin temel ilkeler mecra fark etmeksizin uygulanma imkânı 39  Konuya ilişkin olarak Yargıtay 11. Hukuk Dairesi’nin kararına konu olayda davacı, tüketicilerin şikayetlerini beyan ettiği bir sitede aleyhindeki gerçeği yansıtmayan anonim yorumların kendisini karalama amacıyla yapıldığını ve haksız rekabet oluşturduğunu iddia etmiştir. Daire, failin kimliğini bildirmeyen şikayet sitesi tüzel kişiliğin m.58/1-b uyarınca sorumlu olduğunu belirterek ilk derece mahkemesinin kararını bozmuştur. İlgili Karar için bkz. Yargıtay 11. HD. 2011/14366 E, 2012/21009 K, 17.12.2012 T (www.lexpera.com.tr); Semih Sırrı Özdemir / M. Zahid Doğanay, ‘Bir Mecra Olarak Sosyal Medyanın Reklam Hukuku Açısından Değerlendirilmesi’, Uyuşmazlık Mahkemesi Dergisi, Sayı: 13, Yıl: 2019, https://dergipark.org.tr/tr/download/article-file/742604 (erişim tarihi 26.04.2021), s. 312.40  Ali  Fuat  Özbakır,  İnternet  Servis  Sağlayıcılarının  Hukuki  Sorumluluğu, Yayınlanmamış Yüksek Lisans Tezi, Kadir Has Üniversitesi Sosyal Bilimler Enstitüsü, İstanbul, 2016, https://bit.ly/3ifdpna (erişim tarihi 08.07.2021), s. 37, 38. 5651 sayılı Kanun’un sorumluluk rejiminde yaptığı ayrımın TTK m.58 bakımından, maddenin hizmet sağlayıcı kavramını tercih etmesi ve terminolojisi bakımından birebir aynı ve dar şekilde yorumlanmaması gerektiği görüşündeyiz.41  5651 sayılı Kanun’un Tanımlar” başlıklı 2/1-m maddesinde Yer Sağlayıcı: Hizmet ve içerikleri barındıran sistemleri sağlayan veya işleten gerçek veya tüzel kişi” olarak tanımlanmıştır. Ayrıca bkz. İstanbul Anadolu 2. Asliye Ticaret Mahkemesi, 2016/932 E, 2018/785 K, 10.7.2018 T. Mahkeme bu kararında her ne kadar sadece yer sağlayıcıya yer vermişse de TTK m.58 uygulamasında  tercih  edilen  hizmet  sağlayıcının”  duruma  ve  olayın  özelliklerine  göre yer sağlayıcı, erişim sağlayıcı veya içerik sağlayıcı kavramlarını kapsar bir şekilde geniş yorumlanması gerektiği görüşündeyiz.42  Yargıtay 11. HD. 2019/618 E, 2019/8167 K, 16.12.2019 T (www.lexpera.com.tr).T.C. MALTEPE ÜNİVERSİTESİ • Hukuk Fakültesi Dergisi • 2021 / 1Dijital Reklamcılığın Yol Açtığı Hukuki Sorunlar ve Çözüm Önerileri 55bulmaktadır. Dolayısıyla reklamlara ilişkin temel ilkeler geleneksel reklamlar için geçerli olduğu kadar dijital reklamlar için de geçerlidir.43Ticari Reklam ve Haksız Ticari Uygulamalar Yönetmeliği’nin 4/1-ı” mad-desinde reklam mecrası tanımına internet kavramı da dahil edilmiştir. Anılan maddenin n” bendi uyarınca, ticari reklamların herhangi bir mecrada” yapıla-bileceğinin belirtilmesi dolayısıyla ticari reklamlara ilişkin hükümler internetteki ticari reklamlar için de uygulama bulacaktır.44 O halde dijital reklamlar da Ticari Reklam ve Haksız Ticari Uygulamalar Yönetmeliği’nin 5. maddesindeki temel ilkelere uygun olmalıdır.45 Ayrıca Yönetmeliğin 6 ve 7. maddeleri uyarınca ticari reklamların ayırt edilebilir olması kadar doğru ve dürüst olması aranmaktadır. Bununla birlikte reklamlar, haksız rekabete yol açmayacak, tüketicinin tecrübe ve bilgi eksikliklerini istismar etmeyecek veya onu yanıltmayacak şekilde ha-zırlanmalıdır.46 Benzer hükümler 6502 sayılı Tüketicinin Korunması Hakkında 43  İsmet Irmak, Reklam Hukuku ve Aldatıcı/Yanıltıcı Reklamlar, Yayınlanmamış Yüksek Lisans Tezi, Ege Üniversitesi Sosyal Bilimler Enstitüsü, İzmir, 2009, https://www.ulusaltezmerkezi.net/reklam-hukuku-ve-aldatici-reklamlar/ (erişim tarihi 07.07.2021), s. 80.44  Özdemir / Doğanay, s. 320.45  Ticari Reklam ve Haksız Ticari Uygulamalar Yönetmeliği’nin 5. maddesinde yer alan reklamlara ilişkin temel ilkeler şunlardır: Genel ahlak kurallarına aykırı ifade ya da görüntüler içerememe, b) Kamu sağlığını bozucu nitelikte olmama, c) Kamu düzenini bozan, şiddet hareketleri ile yasadışı veya kınanacak davranışlara yol açan, göz yuman, bu davranışları özendiren veya destekleyen unsurlar içermeme, ç) Hasta, çocuk, yaşlı ve engellileri istismar edici ifade ya da görüntüler içermeme, d) Dil, ırk, renk, cinsiyet, siyasî düşünce, felsefî inanç, din, mezhep ve benzeri özelliklere yönelik kötüleme, istismar, önyargı veya ayrımcılık içermeme, e) İnsan onuru ve kişilik haklarını zedeleyici biçimde yapılmama, f) Önceden izin alınmadan, hiç kimsenin özel ya da sosyal yaşamına dair ifade veya görüntüler içermeme; reklamlarda o kişiye atıfta bulunulmama; kişinin özel mülkü, ilgili ürüne ya da organizasyona verilmiş kişisel onay etkisi oluşturacak şekilde görüntülenmeme veya belirtilmeme, g) Tüketicilerin korkularını ve batıl inançlarını istismar etmeme, ğ) Hastaların tedavi öncesi ve sonrasına ait ifade ya da görüntüler içermeme, h) Toplumu endişeye sevk edici veya yanıltıcı biçimde; hastalık, yaralanma ve benzeri bir durumla ilgili ifade ya da görüntüler içermeme, ı) Güvenlik kurallarının gözetilmediği ve güvenlik açısından tehlike oluşturabilecek uygulama ve durumlarla ilgili hiçbir sunum ya da tanımlama içermeme”. Bkz. Ticari Reklam ve Haksız Ticari Uygulamalar Yönetmeliği, Resmî Gazete Tarihi: 10.01.2015 Resmî Gazete Sayısı: 29232.46  Ticari Reklam ve Haksız Ticari Uygulamalar Yönetmeliği’nin Reklamların ayırt edilmesi” başlıklı m.6/1 hükmünde Biçimi ve yayınlandığı mecra ne olursa olsun bir reklamın, reklam olduğu açıkça anlaşılması” gerektiği belirtilmektedir. Doğruluk ve Dürüstlük” başlıklı 7. maddesi uyarınca (1) Reklamlar doğru ve dürüst olmalıdır. (2) Reklamlar, ekonomik ve sosyal sorumluluk bilinci içinde ve haksız rekabete yol açmayacak şekilde hazırlanmalıdır. (3) Reklamlar, ortalama tüketicinin algılama düzeyi ile reklamın tüketici üzerindeki olası etkisi göz önünde bulundurularak hazırlanmalıdır. (4) Reklamlar, tüketicinin güvenini kötüye kullanamaz ya da onun tecrübe ve bilgi eksikliklerini istismar edemez. (5) Reklamlar, hiçbir konuda tüketiciyi doğrudan veya dolaylı olarak yanıltabilecek ifade ya da görüntüler içeremez.”, Bkz. Ticari Reklam ve Haksız Ticari Uygulamalar Yönetmeliği, Resmî Gazete Tarihi: 10.01.2015 Resmî Gazete Sayısı: 29232.T.C. MALTEPE ÜNİVERSİTESİ • Hukuk Fakültesi Dergisi • 2021 / 156 Dr. Öğr. Üyesi Mete TEVETOĞLU - Av. Betül ÇOLAKKanun’da (TKHK) da mevcut olup 61. maddede ticari reklamların genel ahlaka, kamu düzenine, kişilik haklarına uygun, doğru ve dürüst olması; tüketiciyi al-datıcı veya onun tecrübe ve bilgi noksanlıklarını istismar edici şekilde hazırlan-maması gerektiği belirtilmiştir.47 Aynı maddenin 7. fıkrasında ise ticari reklamlar hakkında getirilen düzenlemelerin reklam verenler, reklam ajansları ve mecra kuruluşlarını kapsadığı ifade edilmiştir.Nihayet, 6112 sayılı Radyo ve Televizyonların Kuruluş ve Yayın Hizmetleri Hakkında Kanun madde 9/3’te, gizli ticari iletişime izin verilemeyeceği” hükmü yer almaktadır. TKHK madde 61/4 - c. 2 uyarınca her türlü iletişim aracında sesli, yazılı ve görsel şekilde örtülü reklam yapılmasını yasaklamıştır. Bu doğrultuda elektronik reklam mecraları üzerinden yayımlanan viral reklamların ve örtülü reklamların da bu hükümlerde yer alan yasak kapsamında olduğu söylenebile-cektir.B. Dijital Reklam YasaklarıReklam verenler, geleneksel mecralarda sahip olmadıkları eşsiz fırsatlara di-jital reklam platformlarında kavuşmuştur.48 Buna karşın reklam hukukunun sınır ve kurallarından dijital reklamcılık aracılığıyla kaçınmak mümkün değildir. Ge-leneksel reklamlarda olduğu gibi dijital reklamlar için de temel bazı sınırlandır-maların uygulanmasındaki ana gaye tüketicileri korumak ya da reklam verenler arasındaki rekabetin hukuka uygun yürütülmesini sağlamaktır.49Ticari Reklam ve Haksız Ticari Uygulamalar Yönetmeliği’nin 22. maddesi Her türlü iletişim aracında sesli, yazılı ve görsel olarak örtülü reklam yapılma-sı yasaktır” ifadesini içermektedir. Maddedeki her türlü iletişim aracı” ifade-sinin kapsamına dijital reklam mecralarının da girdiği açıktır. TKHK madde 61 hükmü bu yaklaşıma paraleldir. Mamafih, uygulamada oldukça yaygın şekilde karşılaşılan örtülü reklamların denetimini sağlamak oldukça güçtür. Zira reklam-daki kişinin ya da paylaşanın beyanda bulunuyormuş gibi görünmesi, bu şekilde hareket etmesi, ilgili içeriğin reklam olduğunu sıklıkla anlaşılmaz kılmaktadır. Kullanıcılar, bu sebeple, bu tür reklamların yayılmasına farkında olmadan des-tek sunabilmektedirler. Özellikle sosyal medya etkileyicilerinin destek verdiği reklam kampanyalarında, örtülü reklam uygulamalarıyla karşılaşılması oldukça muhtemeldir.50 Ticaret Bakanlığı bu durumu gözeterek sosyal medya etkileyici-47  Dilek Görkey, İnternet Reklamcılığı: Etik ve Hukuk Sorunsalı, Yayınlanmamış Yüksek Lisans Tezi, İstanbul Üniversitesi Sosyal Bilimler Enstitüsü, İstanbul, 2008, https://bit.ly/2TPpqGE (erişim tarihi 11.07.2021), s. 44.48  Süar, s. 33.49  Özdemir / Doğanay, s. 302, 303.50  Örnek olarak bkz. Reklam Kurulu, 14.07.2020 T, 299 Sayılı Karar, Dosya No: 2020/501 ve Dosya No: 2020/502, https://ticaret.gov.tr/tuketici/ticari-reklamlar/reklam-kurulu-kararlari.T.C. MALTEPE ÜNİVERSİTESİ • Hukuk Fakültesi Dergisi • 2021 / 1Dijital Reklamcılığın Yol Açtığı Hukuki Sorunlar ve Çözüm Önerileri 57lerini hedef alan Sosyal Medya Etkileyicileri Tarafından Yapılan Ticari Reklam ve Haksız Ticari Uygulamalar Hakkında Kılavuzu’nu (Kılavuz) yayımlamış ve sosyal medyadaki örtülü reklamları engellemeye çalışmıştır. Bu doğrultuda, Kılavuz’un 8. maddesinde Instagram, Facebook, Twitter gibi fotoğraf ve mesaj paylaşım mecralarında paylaşılan fotoğrafın ve/veya mesajın içinde ya da altında veya açıklamalarında reklam verene ilişkin ad, marka, ticaret unvanı gibi tanıtıcı bilgilerden herhangi biriyle birlikte #Reklam, #Reklam/Tanıtım, #Sponsor, #İş-birliği” gibi ibarelere yer verilmesi gerektiği belirtilmiştir.Dijital reklamlar aldatıcı eylemler barındırdıkları hallerde bu gerekçeyle ya-saklanabilir. Aldatıcı reklamları ayırt etmedeki temel kriter, reklamlardaki bil-ginin yanlış ya da yanıltıcı olmasıdır.51 Böyle bir durum söz konusu ise mecra fark etmeksizin aldatıcı reklamlara ilişkin müeyyideler uygulama alanı bulacaktır (TKHK m.61). Reklamın yayından kaldırılması, yayının durdurulması tedbirleri, dijital platformlar üzerindeki aldatıcı reklamların yol açacağı dezenformasyon ve pazar manipülasyonunu önlemesi bakımından önem taşımaktadır. Bu tür rek-lamlarla, özellikle kurumsal internet sitesi ya da sosyal medya hesabı üzerinden verilen siparişlerde karşılaşılmaktadır. Örneğin Reklam Kurulu tarafından verilen 12.01.2021 tarihli 305 Sayılı Reklam Kurulu Toplantısı Basın Bülteninde yer alan kararda;52 tüketicinin www.mediamarkt.com.tr” adresli internet sitesi üzerinden 128 GB’lik ürünü 32GB’lik ürün fiyatına satın almasına rağmen, satın aldığı tele-fon değil 32 GB’lik telefonun gönderildiği olayda şirketin maddi hatasının oldu-ğu ifade edilmiştir. Sonuç olarak, internet sitesinde satışa sunulan ürünlere ilişkin fiyat bilgilerinde tüketicilerin eksik/yanlış bilgilendirildiği, böylece tüketicinin satın alma kararını etkileyen ana vaadin esaslı unsuru olan fiyat konusunda ya-nıltıldığı değerlendirilmiş ve anılan reklamların durdurulmasına karar vermiştir.C. Yeni Nesil Bir Yaptırım Türü: Reklam Yasağı ve Sosyal Ağ Sağlayıcıların DurumuDijital mecralarda ürün ve hizmetlere ilişkin yapılan reklamların herhangi bir reklam hukuku kuralını ihlal edip etmediğini tespit etmek, denetlemek ve hu-kuka aykırılık durumunda yaptırım uygulamak çeşitli güçlükler arz etmektedir. Söz konusu sosyal medya platformları olduğunda reklam ve reklam içerikli ya-yınları tespit etmek daha da zorlaşmaktadır. Bu sorunların aşılabilmesi için 5651 sayılı Kanun’a birtakım ek maddeler getirilmiştir.29.07.2020 tarihinde kabul edilen 7253 Sayılı İnternet Ortamında Yapılan Yayınların Düzenlenmesi ve Bu Yayınlar Yoluyla İşlenen Suçlarla Mücadele 51  Dilek Şahinci, İnternette Aldatıcı Reklam ve Reklam Verenlerin Sorumluluğu, Seçkin Yayıncılık, Ankara, 2011, s. 48.52  Reklam Kurulu, 12.01.2021 T, 305 Sayılı Karar, Dosya No: 2020/1920, https://ticaret.gov.tr/tuketici/ticari-reklamlar/reklam-kurulu-kararlari.T.C. MALTEPE ÜNİVERSİTESİ • Hukuk Fakültesi Dergisi • 2021 / 158 Dr. Öğr. Üyesi Mete TEVETOĞLU - Av. Betül ÇOLAKEdilmesi Hakkında Kanun’da Değişiklik Yapılmasına Dair Kanun (7253 Sayılı Kanun) 31.07.2020 tarihinde Resmî Gazete’de yayımlanarak yürürlüğe girmiştir. Bu düzenleme ile internet kullanıcılarının kişisel başvurularında ve kamu kurum-larının bildirimlerinde sosyal ağ sağlayıcılarla kolayca irtibata geçebilmesi amaç-lamıştır. Böylece, 7253 Sayılı Kanun’la hukuk literatüründeki internet süjeleri arasına bir yenisi daha eklenmiştir: Sosyal Ağ Sağlayıcı”.7253 Sayılı Kanun’un 1. maddesindeki tanıma göre Sosyal Ağ Sağlayıcı Sosyal etkileşim amacıyla kullanıcıların internet ortamında metin, görüntü, ses, konum gibi içerikleri oluşturmalarına, görüntülemelerine veya paylaşmalarına imkân sağlayan gerçek veya tüzel kişileri” ifade etmektedir. Aynı düzenlemenin 6. maddesiyle ise sosyal ağ sağlayıcılara birtakım yükümlülükler getirilmektedir. Bunlardan belki de en çok tartışılan ve en önemlisi, Türkiye’den günlük erişimi bir milyondan fazla olan yurt dışı kaynaklı sosyal ağ sağlayıcıları için getirilen en az bir kişiyi Türkiye’de temsilci atama yükümlülüğüdür. Bir milyondan fazla günlük erişime sahip bazı platformlar Facebook, Twitter, LinkedIn, TikTok ve Instagram olarak sıralanabilir. Sosyal ağ sağlayıcıların atayacağı temsilci gerçek veya tüzel bir kişi olabilir. Temsilci olarak atanacak kişinin gerçek kişi olması halinde bu gerçek kişinin Türk vatandaşı olması zorunlu kılınmıştır. Temsilci-ler 5651 sayılı Kanun’un 9. maddesine dayanarak kendilerine iletilecek içeriğin platformdan çıkarılması ve içeriğe erişimin engellenmesi taleplerini karşılamakla görevlidir.53Temsilci  atama  yükümlülüğünü  getiren  7253  Sayılı  Kanun’un  6.  maddesi 1/10/2020 tarihinde yürürlüğe girmiştir. Bu tarihten itibaren temsilci belirleme ve bil-dirme yükümlülüğünü yerine getirmeyen sosyal ağ sağlayıcıya, Bilgi Teknolojileri ve İletişim Kurumu (BTK) tarafından bildirimde bulunulmuştur. Bu bildirimden iti-baren otuz gün içinde bu yükümlülüğün yerine getirilmemesi halinde ilgili sosyal ağ sağlayıcıya 10 milyon Türk Lirası idari para cezası verilmesi öngörülmüştür. Nitekim BTK, 5651 sayılı Kanun’daki bu değişiklik kapsamında öngörülen temsilci belirleme yükümlülüğünü yerine getirmedikleri gerekçesiyle Kasım ayında Facebook, Youtu-be, Periscope, Instagram, Twitter ve TikTok gibi sosyal medya platformlarının her birine 10 milyon TL para cezası uygulanmasına karar vermiştir.54Verilen idari para cezasının tebliğinden itibaren otuz gün içinde bu yükümlü-lüğün yerine getirilmemesi halinde 30 milyon Türk Lirası daha idari para cezası verileceği 7253 Sayılı Kanun’da düzenlenmiştir. Bu kapsamda Facebook, Ins-53  Murat Volkan Dülger / Onur Özkan, Sosyal Medya Yasa Tasarısı Hakkında Görüşümüz, Academia.edu,  2020,  https://www.academia.edu/43729381/Sosyal_Medya_Yasa_Tasarısı_Hakkında_Görüşümüz (erişim tarihi 26.04.2021), s. 5.54  Cumhuriyet Gazetesi, Sosyal Medya Platformlarına 10’ar milyon TL Ceza, 2020, https://www.cumhuriyet.com.tr/haber/sosyal-medya-platformlarina-10ar-milyon-tl-ceza-1788376  (erişim tarihi 26.04.2021).T.C. MALTEPE ÜNİVERSİTESİ • Hukuk Fakültesi Dergisi • 2021 / 1Dijital Reklamcılığın Yol Açtığı Hukuki Sorunlar ve Çözüm Önerileri 59tagram, Youtube, Twitter ve TikTok aynı gerekçe ile ikinci kez ceza almışlardır.55 7253 Sayılı Kanun’un 6. maddesinin 2. fıkrasında para cezalarının ardından ka-demeli şekilde reklam yasağı yaptırımı yer almaktadır. Bu hükme göre; İkinci kez verilen idari para cezasının tebliğinden itibaren otuz gün içinde bu yüküm-lülüğün yerine getirilmemesi hâlinde Başkan tarafından Türkiye’de mukim vergi mükellefi olan gerçek ve tüzel kişilerin ilgili sosyal ağ sağlayıcısına yeni reklam vermesi yasaklanır, bu kapsamda yeni sözleşme kurulamaz ve buna ilişkin para transferi yapılamaz”.5651 Sayılı Kanun’la yapılan düzenlemenin önemi, sosyal medya platform-larının gelirlerinin büyük bir kısmı reklamlardan oluşmasından kaynaklanmak-tadır. Örneğin Facebook, 2020’de küresel gelirinin yaklaşık yüzde 97,9’unu rek-lamlardan elde etmiştir.56 Reklamların sosyal ağ sağlayıcıları nezdindeki yüksek değeri nedeniyle, ikinci para cezasından sonra birçok sosyal ağ sağlayıcı temsilci atama kararı almıştır. TikTok,57 Dailymotion,58 LinkedIn59 ve son olarak Facebo-ok60 temsilci atayacaklarına ilişkin açıklamada bulunmuşlardır. Twitter ise Ocak ayında aldığı reklam yasağı cezasının ardından Mart ayında temsilci atamaya ka-rar vermiştir.61 Bu sosyal ağ sağlayıcıların temsilci atama kararlarının asıl sebebi, tahsil kabiliyeti düşük olduğu için, para cezalarından ziyade, kademeli reklam yasağının uygulanmasından sakınmak şeklinde ifade edilebilir. Reklam yasağı-na rağmen temsilci atamayan sosyal ağ sağlayıcılarının ise iki aşamalı internet trafiği bant genişliğinin daraltılması yaptırımları ile karşılaşması söz konusudur. Beş aşamadan oluşan yaptırım sürecinde temsilci belirleme ve bildirme yüküm-lülüğünün daha sonra yerine getirilmesi halinde; bundan evvel verilen idari para cezalarının dörtte birinin tahsil edilmesi, reklam yasağının ise kaldırılması söz konusudur.55  T24 Elektronik Gazete, Türkiye’de Temsilci Bulundurmayan Sosyal Medya Platformlarına İkinci Ceza: 30’ar milyon TL, 2020, https://bit.ly/3j41Iis (erişim tarihi 26.04.2021).56  Hristina Tankovska, Facebook’s Advertising Revenue Worldwide from 2009 To 2020, Statista, 2021,  https://www.statista.com/statistics/271258/facebooks-advertising-revenue-worldwide/ (erişim tarihi 26.04.2021).57  Cumhuriyet  Gazetesi,  TikTok’tan,  Türkiye’ye  temsilci  atama  kararı,  2021,  https://www.cumhuriyet.com.tr/haber/tiktoktan-turkiyeye-temsilci-atama-karari-1804652  (erişim  tarihi 26.04.2021).58  NTV,  Dailymotion  Türkiye’ye  Temsilci  Atadı,  2021,  https://www.ntv.com.tr/teknoloji/dailymotion-turkiyeye-temsilci-atadi,bwsze-FDX0qZW2fUJm-Ulg (erişim tarihi 26.04.2021).59  Sputnik,  LinkedIn,  Türkiye’ye  Temsilci  Atayacak,  2021,  https://tr.sputniknews.com/turkiye/202101161043590544-linkedin-turkiyeye-temsilci-atayacak/ (erişim tarihi 26.04.2021).60  Sputnik,  Facebook:  Türkiye’ye  temsilci  atama  sürecini  başlatmaya  karar  verdik,  2021, https://tr.sputniknews.com/turkiye/202101181043600290-facebook-turkiyeye-temsilci-atama-surecini-baslatmaya-karar-verdik/ (erişim tarihi 26.04.2021).61  NTV, Twitter da Türkiye’de Temsilci Atıyor, 2021, https://www.ntv.com.tr/teknoloji/twitter-da-turkiyede-temsilci-atiyor,09VL6m45o0G-3lXPB71rWQ (erişim tarihi 26.04.2021).T.C. MALTEPE ÜNİVERSİTESİ • Hukuk Fakültesi Dergisi • 2021 / 160 Dr. Öğr. Üyesi Mete TEVETOĞLU - Av. Betül ÇOLAKReklam yasağı yaptırımı sayesinde; temsilci atama yükümlülüğünü yerine ge-tirmeyen sosyal ağ sağlayıcılarının, ülkemizden ekonomik kazanç elde etmeleri tamamen engellenmek istenmiştir. Kanunun görünen amacı, mağdur olan kişilerin karşılarında muhatap bulmalarını sağlamaktır. Tartışmalı kısmı ise ifade hürriyetinin kelepçelenmesi riskidir. Belirtmek gerekir ki sosyal ağ sağlayıcıların sadece temsilci atamış olması, bu platformlarda yapılan hukuka aykırı yayın ve reklamları sona erdir-memiştir. Açıkçası, temsilci atamama sebebiyle, bant genişliğini daraltmak suretiyle sitenin girilemez hale getirilmesi şeklindeki yaptırım, kullanıcı haklarını gözetme-mesi bakımından ölçülü değildir. Bu platformların çoğunluğu yerel mahkemelerin içerik çıkartma kararlarını uygulamaktadır. Ülkemizde yürürlükte olan reklam huku-ku düzenlemeleri ile reklamlara ilişkin yaptırım türleri incelendiğinde, hukuka aykı-rı reklamlar dolayısıyla uygulanan yaptırımların esas olarak reklam verenlere ya da içeriği yayınlayanlara ilişkin olduğu görülmektedir. 5651 sayılı Kanun ile Sosyal Ağ Sağlayıcılara yönelik olarak yürürlüğe sokulan reklam yasağı ise temsilci atamayan sosyal ağ sağlayıcılarının yanı sıra suçta ve cezada şahsilik ilkesini gözetmeksizin reklam vermek isteyen şirketleri de etkilemesi yönüyle tartışma ve eleştiriye açıktır. Söz konusu reklam yasağının, reklam verenler bakımından ülkesel mi yoksa plat-form bazlı şekilde ülke sınırlaması olmaksızın mı uygulanacağı noktası belirsizdir. Düzenlemenin amacının yerli şirketlerin bu platformlara yabancı ülkelerde reklam vermesini teşvik etmek olmadığı açıktır. Bu bakımdan, düzenleme yerel şirketlerin yurt dışında reklam ve rekabet bakımından hak kayıplarına yol açarken, yabancı iş-letmeler bu platformlarda reklam avantajı elde edebilmektedir.III. DİJİTAL REKLAMCILIK VE HUKUKİ TARTIŞMALARA. Rekabet ve Haksız Rekabet Hukuku Bakımından1. Rekabet Hukuku BakımındanE-ticaretin ön plana çıkmasıyla yayıncılık sektörünün geleneksel mecralar-dan dijital mecralara taşındığı, çevrimiçi reklamcılığın büyük bir ivme kazandı-ğı görülmektedir. Dijital reklamlar, tıpkı geleneksel reklamlar gibi hedef kitleyi bilgilendirmekte, rekabeti sağlayarak ekonomiyi canlandırmaktadır. Dijital rek-lamlar, rekabet hukuku perspektifinden incelendiğinde; sektörde ürün portföyüne bağlı olarak Facebook, Google, Amazon ve Apple62 gibi ciddi pazar gücüne sahip az sayıdaki teşebbüs, büyük miktarda kullanıcıya ve kullanıcı verisine ulaşabil-mektedir. Az sayıdaki bu teşebbüsler, bekçi (gatekeeper) işlevleriyle rekabet kar-şıtı endişeleri artırmaktadır.6362  Congressional Research Service, Antitrust and Big Tech”, 2019, https://crsreports.congress.gov/product/pdf/R/R45910 (erişim tarihi 13.07.2021), s. 1.63  U.S. House of Representative, Investigation of Competition in Digital Markets-Majority Staff Report and Recommendations, 2020, https://judiciary.house.gov/uploadedfiles/competition_in_digital_markets.pdf?utm_campaign=4493-519 (erişim tarihi 10.07.2021), s. 39-40-56.T.C. MALTEPE ÜNİVERSİTESİ • Hukuk Fakültesi Dergisi • 2021 / 1Dijital Reklamcılığın Yol Açtığı Hukuki Sorunlar ve Çözüm Önerileri 61Kullanıcılar sanal ortamda attıkları her bir adımda kendileri hakkında ipuçları verirler. Veri olarak adlandırdığımız bu ipuçları şirketler için büyük değer taşır. Zira veriler klasik tabirle çağın yeni petrolü”64 veya yeni para birimi”65 dir. Kullanıcı-lardan derlenen veriler anlamlı bilgilere dönüştürülerek ekonomik kazanç sağla-nabilir ya da algoritmalar yoluyla davranışsal reklamcılık uygulamalarına kaynak teşkil edebilir. Özellikle çerezler vasıtasıyla kişisel veriler de dahil pek çok veriyi toplayan ya da bu verileri satın alan reklam verenler, hedef kitlenin davranışlarına odaklanarak onların ilgisini çekecek reklamları karşılarına çıkarmaktadır. Örneğin bir havayolu şirketinden uçak bileti araştıran bir kimse, bu araştırmasının üstünden çok geçmeden aynı şirketin reklamlarıyla ziyaret ettiği başka sitelerde de karşıla-şabilecektir. Ya da bir internet kullanıcısının kıyafet satın alma amacıyla gezindiği sitenin reklamlarını başka sitelerde görmesi mümkündür.66 Bu da pek tabii çerezle-rin kullanıcı hakkında daha önce topladığı veriler sayesinde mümkün olmaktadır.Kârının büyük kısmını reklamlardan elde eden Google, verilerin sağladığı avantajları fark ederek algoritmalarını sürekli geliştirmiş ve bu sayede kullanıcı-lar için uygunluğunu ve tercih edilirliğini arttırmıştır. Bugün Google, AdWords programıyla çevrimiçi reklamcılık pazarının baş aktörlerinden biridir. Google’ın temel faaliyet alanı arama motoru reklamcılığıyken; sektörün diğer önemli aktörü Facebook’un temel faaliyeti ise sosyal ağ reklamcılığıdır.67 Özellikle 2015 yılın-dan sonra, her iki şirket de reklam gelirlerini hızla arttırarak İngiltere ve Ameri-ka’daki dijital reklam harcamalarının yaklaşık yüzde 70’ini toplamayı başarmış-lardır.68 Yine 2017 yılında çevrimiçi reklamlar için harcanan 88 milyar Dolar’ın yüzde 90’ından fazlası bu iki şirket arasında paylaşılmıştır.69 Sektördeki verim-64  European Parliament, Is Data the New Oil?, 2020, https://www.europarl.europa.eu/RegData/etudes/BRIE/2020/646117/EPRS_BRI(2020)646117_EN.pdf (erişim tarihi 26.04.2021), s. 4.65  Margrethe Vestager, Competition in a Big Data World, 2016, https://wayback.archive-it.org/12090/20191129204050/https://ec.europa.eu/commission/commissioners/2014-2019/vestager/announcements/competition-big-data-world_en (erişim tarihi 26.04.2021).66  Şaduman Şeyda Gökdemir / Semra Akıncı, ‘Çevrimiçi Davranışsal Reklamcılığa Yönelik Tüketici Tutumları ve Mahremiyet Endişeleri’, Erciyes İletişim Dergisi Uluslararası Dijital Çağda  İletişim  Sempozyumu  Özel  Sayısı,  Sayı:  1,  Yıl:  2019,  https://doi.org/10.17680/erciyesiletisim.483907 (erişim tarihi 14.07.2021), s. 23, 30.67  Ulrich  Dolata,  ‘Apple,  Amazon,  Google,  Facebook,  Microsoft.  Market  Concentration  - Competition - Innovation Strategies’, SOI discussion paper, Sayı: 1, Yıl: 2017, https://www.econstor.eu/bitstream/10419/152249/1/8803286020.pdf (erişim tarihi 26.04.2021), s. 14.68  Zeynep Kaban Kadıoğlu, ‘Uluslararası İletişim Düzeninde İnternet Tabanlı Küresel İletişim Şirketlerinin Rekabet Ortamları, Büyüme Stratejileri ve Toplumsal Dışsallıkları: Microsoft, Apple, Google ve Facebook’, Erciyes İletişim Dergisi Uluslararası Dijital Çağda İletişim Sempozyumu Özel Sayısı, Sayı: 1, Yıl: 2019, https://dergipark.org.tr/en/download/article-file/645249 (erişim tarihi 26.04.2021), s. 231.69  Financial Express, Google, Facebook Dominate Digital Advertising; Check How Much of the $88-Billion Market They Control, 2018, https://bit.ly/3j9Ikk4 (erişim tarihi 26.04.2021).T.C. MALTEPE ÜNİVERSİTESİ • Hukuk Fakültesi Dergisi • 2021 / 162 Dr. Öğr. Üyesi Mete TEVETOĞLU - Av. Betül ÇOLAKliliği fark eden Amazon ve Snapchat de reklam uygulamalarında ciddi sıçrama-lar yaparak, bu pastaya ortak olacaklarının sinyallerini vermişlerdir.70 Amazon ya da Snapchat yarışa zamanında katılmışsa da çok değerli şirketler bu yarıştan geri kalmıştır. Örneğin 2005 yılında Yahoo, çevrimiçi reklamcılık pazarındaki ana oyunculardan biriyken strateji değişikliğiyle arama motoru yerine medya içeriklerine odaklanmaya karar vermiştir. Bu doğrultuda, tüketici eğilimlerini ve kullanıcı deneyimini iyileştirme ihtiyacını görmezden gelerek medya içeriklerine odaklanmıştır. Zamanla Yahoo kullanıcıların içerikleri görüntüleme sayısını artır-mayı başarmışsa da ölçeklendirmek için yeterli kar elde edememiştir.71Büyük teknoloji şirketlerinin gerçekleştirdiği yoğun veri işleme faaliyeti ne-ticesinde bugün veri hakimiyeti adeta pazar hakimiyeti anlamına gelmektedir. Bu durumun farkında olan farklı rekabet otoriteleri büyük teknoloji şirketleri-nin peşine düşmüş ve yürüttükleri soruşturmalar neticesinde bu şirketlere yüksek miktarlarda para cezaları vermişlerdir.72Bu noktada Alman Rekabet Otoritesi’nin (Bundeskartellamt) Facebook’a ilişkin 6 Şubat 2019 tarihli kararı öncü niteliktedir. Bundeskartellamt, kişisel ve-rilerin piyasa tarafından sömürülmesini engellemek için rekabet kuralları ile veri koruma kurallarına uyulması gerektiğini, Avrupa Genel Veri Koruma Tüzüğü 70  John Koetsier, Digital Duopoly Declining? Facebook’s, Google’s Share of Digital Ad Dollars Dropping,  Forbes,  2018,  https://www.forbes.com/sites/johnkoetsier/2018/03/19/digital-duopoly-declining-facebooks-googles-share-of-digital-ad-dollars-dropping/?sh=780a5ebd60a8  (erişim  tarihi 26.04.2021).71  Katrina Aaslaid, 50 Examples of Corporatıons that Failed to Innovate, Valuer, 2019, https://www.valuer.ai/blog/50-examples-of-corporations-that-failed-to-innovate-and-missed-their-chance (erişim tarihi 11.07.2021). Pazardaki gelişmeler neticesinde bilgi ekonomisi” mensubu olan Amazon, Alphabet (Google) ve Facebook gibi az sayıdaki büyük şirketin elindeki büyük miktardaki verinin hâkim bir güç yarattığı ve bunu kendi lehlerine kullanmalarının ise hâkim gücün kötüye kullanıldığı yönündeki endişeleri arttırdığı söylenebilir. Nitekim veri ihlallerinde veri  koruma  kurulları  kadar  rekabet  kurumlarının  soruşturma  başlatması  ve  yaptırımlar uygulaması bu endişelerin haklılığını ifade etmektedir.72  Fedaral Ticaret  Komisyonu,  gizlilik  politikasının  tüketicilerin  mahremiyetini  ihlal  ettiği gerekçesiyle Facebook’a 5 milyar Dolar para cezası vererek hesap verebilirliği ve şeffaflığı artırması konusunda talimatlandırır. Bkz. Federal Trade Comission, FTC Imposes $5 Billion Penalty and Sweeping New Privacy Restrictions on Facebook, 2019, https://www.ftc.gov/news-events/press-releases/2019/07/ftc-imposes-5-billion-penalty-sweeping-new-privacy-restrictions (erişim tarihi 13.07.2021). Fransız Rekabet Kurumu, Google’ın çevrimiçi arama reklamcılığı pazarındaki hakim konumunu kötüye kullandığını söyleyerek Google’a 167 milyon Dolar (150 milyon €) para cezası vermiştir. Bkz. Autorité De La Concurence, L’Autorité Sanctionne Google À Hauteur De 150 M€ Pour Abus De Position Dominante, 2019, https://www.autoritedelaconcurrence.fr/fr/communiques-de-presse/lautorite-sanctionne-google-hauteur-de-150-meu-pour-abus-de-position  (erişim  tarihi  13.07.2021).  Kanada  Rekabet Bürosu, Facebook’a usulsüz gizlilik politikası nedeniyle 6,5 milyon Amerikan Dolar’ı para cezası vermiştir. Bkz. BBC News, Canada Facebook Fined $6.5m Over ‘False’ Privacy Claims, 2020, https://www.bbc.com/news/world-us-canada-52640785 (erişim tarihi 13.07.2021).T.C. MALTEPE ÜNİVERSİTESİ • Hukuk Fakültesi Dergisi • 2021 / 1Dijital Reklamcılığın Yol Açtığı Hukuki Sorunlar ve Çözüm Önerileri 63(General Data Protection Regulation-GDPR) çerçevesinde Kişisel Veri Hukuku prensipleri dikkate alındığında Facebook’un - Google+’ın ardından - yüksek pa-zar payı elde ettiğini, işlediği büyük miktardaki veriyi elinde tutarak pazara yeni aktörlerin girmesini zorlaştırdığını, ayrıca üyelerinin diğer platformlara gitmeleri mümkün olmadığından Facebook’a mecbur kaldığını, bu sebeple sektörde hakim durumda olan Facebook’un veri politikasının GDPR’ı ihlal ettiğini ve veri işleme faaliyetlerinin rekabet hukuku açısından sömürücü davranış teşkil ettiğini belirt-miş ve Facebook’u Almanya’daki kullanıcılarına sunduğu veri işleme ve çerez politikalarını on iki ay içerisinde güncellemesi konusunda talimatlandırmıştır.73 Facebook’un karara itiraz etmesinin ardından 24 Mart 2021 tarihinde görülen da-vada Alman Yüksek Mahkemesi, Bundeskartellamt’ın rekabet hukukuna ilişkin değerlendirmesi hakkında bir hüküm verilebilmesi için öncelikle Facebook’un GDPR’ı ihlal edip etmediği hususunun netlik kazanması gerektiğini belirterek, bu konunun AB hukukunun ihlaline ilişkin olması sebebiyle, kararı Avrupa Ada-let Divanı’nın74 vermesi gerektiğine hükmetmiştir.75Hâkim durumun kötüye kullanılması dışlayıcı davranışlar veya sömürücü davranışlar üzerinden gerçekleşebilmektedir. 4054 sayılı Rekabetin Korunması Hakkında Kanun’un 6. maddesinin b, c ve e bentlerinde bahsedilen haller (sö-mürücü davranışlar) rekabeti doğrudan engellemeyen durumlar olmalarına kar-şın, rekabetin tüketici menfaatine olan yönünün etkisiyle, tüketiciyi sömüren ey-lemler oldukları için yasaklanmıştır. Aynı maddenin a ve d bentlerinde belirtilen Ticarî faaliyet alanına başka bir teşebbüsün girmesine doğrudan veya dolaylı olarak engel olunması ya da rakiplerin piyasadaki faaliyetlerinin zorlaştırılma-sını amaçlayan eylemler” ve Belirli bir piyasadaki hâkimiyetin yaratmış olduğu finansal, teknolojik ve ticarî avantajlardan yararlanarak başka bir mal veya hiz-met piyasasındaki rekabet koşullarını bozmayı amaçlayan eylemler” ise dışlayıcı davranışlara klasik örnektir. Söz konusu dışlayıcı davranışlar rekabeti doğrudan kısıtlamakta, bozmakta veya engellemektedir.76Rekabet otoriteleri geçmişten beri Büyük Veri’nin kötüye kullanımını, piya-sa aktörleri üzerinde yarattığı dışlayıcı davranış dolayısıyla cezalandırma eğilimi göstermektedir. Zaman içerisinde AB nezdinde veriyi kötüye kullanmanın ceza-73  Muammer Ketizmen / Aslıhan Kart, ‘Kişisel Veri ve Rekabet Hukuku Kapsamında Big data”‘, Kişisel Verileri Koruma Dergisi, Sayı: 1, Yıl: 2019, https://dergipark.org.tr/tr/download/article-file/738261 (erişim tarihi 14.07.2021), s. 72.74  Bu çalışmanın yayına teslim tarihi itibariyle, Adalet Divanı tarafından davaya ilişkin bir karar henüz verilmemiştir.75  Natasha Lomas, Competition Challenge to Facebook’s ‘Superprofiling’ Of Users Sparks Referral  to  Europe’s  Top  Court,  Techcrunch,  2021,  https://techcrunch.com/2021/03/24/competition-challenge-to-facebooks-superprofiling-of-users-sparks-referral-to-europes-top-court/ (erişim tarihi 26.04.2021).76  Ketizmen / Kart, s. 69.T.C. MALTEPE ÜNİVERSİTESİ • Hukuk Fakültesi Dergisi • 2021 / 164 Dr. Öğr. Üyesi Mete TEVETOĞLU - Av. Betül ÇOLAKlandırılmasındaki amaç tüketicinin korunmasından daha ziyade, rekabetin korun-ması amacına doğru yönelmiştir. Verinin kötüye kullanılması eylemi; fiyatlandır-ma, sözleşme yapmayı reddetme, münhasırlık anlaşmaları, indirim sistemleri ve yahut diğer dışlayıcı davranışlardan birinin kapsamına girmediği için de bahse konu eylemi tüketici refahı üzerinden sömürücü davranış ile ilişkilendirmişlerdir. Öte yandan, bünyesinde büyük miktarda veriye sahip olan bir teşebbüsün, pazar-daki diğer aktörlerle verileri paylaşmayı kabul etmemesi ve bu duruşunun alt pa-zardaki etkin rekabeti ortadan kaldırması durumunda veriyi kullanımı bakından dışlayıcı davranış sergilediğinden söz etmek gerekir.77Rekabet otoriteleri internet ortamında faaliyet gösteren teşebbüslerin rekabe-ti bozabilecek pazar gücüne sahip olup olmadıklarını incelerken özellikle;-  Bedavaya hizmet sağlanan pazarlarda alıcıların alternatif sağlayıcıları ter-cih durumunu,-  Hâkim durumda olan bir teşebbüsün rakipleri ve müşterilerinden bağım-sız” hareket edebilmesi koşulu aranmaktaysa, bu durumda sağlayıcıların bir taraftan yeniliklere ev sahipliği yaparken diğer taraftan pazar oyuncularının yok olduğu bir çevrimiçi pazarda hâkim durumda olabilmelerinin mümkün olup olmadığını” araştırmaktadır.78Avrupa Komisyonu AT. 40411 sayılı soruşturması sonrasında Google Ad-Sense 2019 Kararı’nda, arama ağı reklam aracılık platformunda hâkim durumunu kötüye kullandığından bahisle Google’a 1.49 milyar Euro ceza vermiştir.79 Ad-Sense aracı ile reklam verenler ile site sahipleri arasında aracılık yapan Google ilgili pazarda açık ara farkla güçlü konumda” bulunmaktadır. Bunun sebebi ise aracılık hizmetlerini bireysel olarak müzakere edilen anlaşmalar yoluyla ger-çekleştirmesidir”. Nitekim Komisyon soruşturma kapsamında incelediği ilgili anlaşma hükümlerinin rakip teşebbüsler açısından kısıtlayıcı nitelikte olduğuna karar verilmiştir.Kararda, Google’ın AdSense uygulaması kapsamında, reklamların yayım-landığı  internet  siteleriyle  arasındaki  münhasırlık  sözleşmesini  kendi  lehine uyguladığı, internet sitelerinin en sık ziyaretçi veya tıklama alan bölümlerini Google’a ayırma zorunluluğu getirdiği ve rakip reklamların gösterilme biçiminde değişiklik yapmadan önce Google’dan yazılı onay alma gibi yükümlülüklere zor-ladığı ve böylece pazardaki hâkim durumunu kötüye kullandığı belirtilmektedir.77  Ketizmen / Kart, s. 70.78  Gönenç Gürkaynak / Derya Durlu Gürzumar, ‘İnternetin Ezber Bozan Ortamında ve Yenilikçi Dijital Pazarlarda Rekabet Hukuku Eğilimleri’, Rekabet Dergisi, Sayı: 2, Yıl: 2015, https://www.jurix.com.tr/article/8192 (erişim tarihi 26.04.2021), s. 55.79  European  Commission,  Antitrust:  Commission  Fines  Google  €1.49  Billion  for  Abusive Practices in Online Advertising, 2019, https://ec.europa.eu/commission/presscorner/detail/en/IP_19_1770 (erişim tarihi 26.04.2021).T.C. MALTEPE ÜNİVERSİTESİ • Hukuk Fakültesi Dergisi • 2021 / 1Dijital Reklamcılığın Yol Açtığı Hukuki Sorunlar ve Çözüm Önerileri 65Komisyon, Google’a 1.49 milyar Euro para cezasına ek olarak rakip teşeb-büslerin pazara girişini engelleyen yasa dışı davranışlarına son vermesi ve aynı veya eş değer etkiye sahip davranışları sergilemekten kaçınması yönünde uyarı-larda da bulunmuştur.80Ülkemizde Rekabet Kurulu, Google’ın genel arama hizmetlerine yönelik yaptığı algoritma güncellemeleri ve Adwords81 -yaygın kullanımıyla Google Ads- reklamları ile hâkim durumunu kötüye kullanarak pazardaki diğer teşebbüslerin faaliyetlerini zorlaştırdığı yönündeki iddiaları incelemiştir. 2 yıl süren soruştur-manın ardından Rekabet Kurulu, 12.11.2020 tarihli ve 20-49/675-295 sayılı ara kararında Google’ın, genel arama sonuçlarının en üstüne, reklam niteliği be-lirsiz olan ve sayfada yoğun şekilde yer alan metin reklamlarına yer vererek; kendisine reklam geliri getirmeyen organik sonuçların içerik hizmetleri pazarın-daki faaliyetlerini zorlaştırmak suretiyle 4054 sayılı Kanun’un 6. maddesini ihlal ettiğini” belirtmiştir. Rekabet Kurulu söz konusu ihlaller dolayısıyla 4054 sayılı Kanun madde 16 uyarınca Google Reklamcılık ve Pazarlama Ltd. Şti., Google International LLC, Google LLC, Google Ireland Limited ve Alphabet Inc.’e mü-teselsilen 196 milyon 708 bin TL idari para cezası vermiştir.Kararda ayrıca, inceleme konusu ihlali sonlandırmak ve pazardaki etkin re-kabeti tesis etmek için Google’ın, metin reklamlarını, organik sonuçları82 dışla-mayacak nitelikte, ölçekte ve/veya konumda sunmasını sağlayacak uyum tedbir-leri alması gerektiği işaret edilmiştir.Rekabet Kurulu 08.04.2021 tarihli ve 21-20/248-105 sayılı nihai kararında; Google’ın genel arama sonuç sayfasında, kendi yerel arama ve konaklama fiyatı karşılaştırma hizmetlerine, rakiplerine kıyasla konum ve gösterim bakımından avantaj sağladığını”, rakip yerel arama sitelerinin Local Unit’e girişine engel olarak, rakiplerinin faaliyetlerini zorlaştırdığını ve yerel arama hizmetleri ve ko-naklama fiyatı karşılaştırma hizmeti pazarlarındaki rekabetin bozulmasına yol açtığını” ve böylece hakim durumunu kötüye kullandığını belirterek Google’a 296.084.899,49 TL idari para cezası vermiştir.8380  European Commission, Antitrust: Commission fines Google €1.49 billion.81  Rekabet  Kurumu,  20-49/675-295  K,  12.11.2020  T,  (https://www.rekabet.gov.tr/Dosya/geneldosya/google-adwords-nihai-karar-pdf).82  Organik arama sonucu ile anlaşılması gereken bir kişinin yaptığı arama ile ilgili olduğu için Google arama motorunda çıkan ücretsiz arama sonucu listesidir. Bkz. Google, Google Ads  Yardım,  https://support.google.com/google-ads/answer/6054492?hl=tr  (erişim  tarihi 26.04.2021).83  Bununla birlikte rakiplerinin dezavantajlı konumunu iyileştirmek üzere gerekli koşulları sağlamasına ve ilk uyum tedbirinin uygulanmaya başlamasından itibaren 5 (beş) yıllık süre boyunca periyodik olarak belirtilen hususlarda Rekabet Kurumu’na rapor sunmasına karar vermiştir.T.C. MALTEPE ÜNİVERSİTESİ • Hukuk Fakültesi Dergisi • 2021 / 166 Dr. Öğr. Üyesi Mete TEVETOĞLU - Av. Betül ÇOLAK2. Haksız Rekabet Hukuku BakımındanTeşebbüsler, dijital mecralar üzerinden tüketicilere saldırgan veya aldatıcı reklamlar yaparak hem tüketicilere zarar vermekte hem de rekabet ortamını bo-zarak haksız rekabete yol açmaktadır. TTK madde 55’te, başlıca haksız rekabet halleri sayılmış ve bunlar arasında dürüstlük kuralına aykırı reklamlara yer veril-miştir. Maddenin devamında, haksız rekabete yol açan dürüstlük kuralına aykırı bu davranışlara örnekler verilmiştir. Bu davranışlar geleneksel reklam mecraları üzerinden gerçekleştirilebileceği gibi dijital reklam mecraları üzerinden de ger-çekleştirilebilir. Ayrıca bu maddede yer alan eylemler doğrudan reklam veren ta-rafından işlenebileceği gibi teşebbüs adına bir başkası (milyonlarca takipçisi olan bir fenomen vb.) tarafından da işlenebilir. Örneğin, bir sosyal medya fenomeni-nin ya da Youtuber’ın (X) markasının gözaltı kremi (Y) markasının ürününde çok daha etkili. (Y) markasınınkini kullandıktan sonra hiçbir etkisini görmemiş olmama rağmen, (X) markasınınkini bir aydır kullanıyorum ve gözaltımdaki kırı-şıklıklar neredeyse yok oldu” şeklindeki ifadesi TTK madde 55/1-a (5) uyarınca haksız rekabet teşkil edecektir. Zira fenomen bu ifade ile (Y) markasına ait ürün-leri kötüleyerek (X) markasının ürünleri ile karşılaştırmaktadır.84Fenomenlerin yürüttükleri reklam kampanyaları, tüketiciler üzerindeki yoğun etkileri de dikkate alınarak rekabet otoriteleri tarafından mercek altına alınmıştır. Ünlülerin dijital platformlar üzerinden yürüttüğü reklam faaliyetlerindeki iki ana sorun örtülü ve aldatıcı-yanıltıcı türde reklamlarda yer almalarıdır. Federal Ticaret Komisyonu, bu konuda 2017 yılında 90’dan fazla ünlüyü, sosyal medya aracılığıy-la ürün tanıtırken veya onaylayıcı beyanda bulunurken markalarla olan ilişkilerini açık ve net bir şekilde açıklamaları gerektiğini yönünde uyarmıştır.85 Birleşik Kral-lık’taki Rekabet ve Piyasa Otoritesi de ünlülerin bir menfaat karşılığında reklam yapması halinde tüketicilere bunu açıklamaları gerektiğini vurgulamıştır. Soruş-turma sonucunda herhangi bir yaptırım uygulanmamışsa da ünlülerden ve sosyal medya fenomenlerinden reklamdan menfaat elde etmeleri halinde bunu işbirliği” veya ads” gibi ifadelerle belirteceklerine dair taahhüt alınmıştır.8684  Gökçe Naz Tandoğdu, Sosyal Medya Etkileyicisinin Hukuka Aykırı Reklamları Nedeniyle Doğan Zararlardan Sorumluluğu, Yayınlanmamış Yüksek Lisans Tezi, Koç Üniversitesi Sosyal Bilimler Enstitüsü, İstanbul, 2019, https://tez.yok.gov.tr/UlusalTezMerkezi/tezDetay.jsp?id=ifNRs23GWitQNh2nbDQjPQ&no=OzczoEq2jAxAVJNMs4FMDQ (erişim tarihi 14.07.2021), s. 83.85  Federal Ticaret Komisyonu’nun özellikle dikkat ettiği iki husus ünlülerin yaptıkları reklamlarda bunların reklam olduğunu belirten işaretlere yer vermeleri ve markayla ilişkilerini belirtiyor olmalarıdır. Bkz. Fedaral Trade Commission, FTC Staff Reminds Influencers and Brands to Clearly Disclose Relationship, 2017, https://www.ftc.gov/news-events/press-releases/2017/04/ftc-staff-reminds-influencers-brands-clearly-disclose (erişim tarihi 26.04.2021).86  Competition and Markets Authority, Celebrities Pledge to Clean Up Their Act on Social Media,  2019,  https://www.gov.uk/government/news/celebrities-pledge-to-clean-up-their-act-on-social-media (erişim tarihi 26.04.2021).T.C. MALTEPE ÜNİVERSİTESİ • Hukuk Fakültesi Dergisi • 2021 / 1Dijital Reklamcılığın Yol Açtığı Hukuki Sorunlar ve Çözüm Önerileri 67Reklam verenler dışında bu eylemleri gerçekleştirebilecek bir başka kişi grubu da çalışanlardır. Örneğin Yargıtay 11. Hukuk Dairesi’nin 18.12.2017 ta-rihli E. 2016/5129 - K. 2017/73341 kararına konu olayda davalı, Facebook plat-formu üzerinden Dishe Bayan Ayakkabı” profiliyle medyada zehirli olarak ad-landırılan ayakkabıların fotoğraflarını paylaşmış, postun açıklama kısmında ise Deichmann’dan ayakkabı alanların sonu budur. Herkesi Türkiye’de üretilen ayakkabıları almaya davet ediyoruz.” şeklinde bir ifadeye yer vermiştir. Davacı vekili, söz konusu içeriğin müvekkiline karşı gerçeği yansıtmayan ağır ithamlar ve iddialar barındırdığını belirterek davalının bu içerikle müvekkilinin itibarını zedelemeyi ve tüketicileri haksız bir biçimde kendi iş yerine yönlendirerek sa-tışlarını artırmayı hedeflediğini ileri sürmüştür. Davalı müdafii ise müvekkilinin işletmeye ait Facebook hesabından kendisinin asla böyle bir paylaşımda bulun-madığını, ancak müvekkilinin iş yerindeki part-time çalışan işçilerin yapmış ola-bileceğini belirtmiştir. Ayrıca sadece 3 kişi tarafından beğenilen bu paylaşımın 15 dakika sonra kaldırıldığını ve paylaşımın davacıya zarar verecek boyutta ol-madığını belirterek davanın reddini istemiştir. Asliye Hukuk Mahkemesi davalı-nın, zehirli ayakkabılar diye tabir edilen ayakkabıların verdikleri zararlara dair hastalıklı birkaç ayak resminin oluşturduğu görsel etkiden de yararlanmak sureti ile yanlış ve yanıltıcı reklam yaptığına kanaat getirmiştir. Ayrıca bu paylaşımın haksız rekabet teşkil ettiği, davacının ürünlerinin karalandığı ve kişilik haklarına hukuka aykırı olarak saldırıda bulunulduğu gerekçeleriyle davacıya 5.000,00 TL manevi tazminat ödenmesine karar vermiştir. Asliye Hukuk Mahkemesinin kararı 11. Hukuk Dairesi tarafından onanarak kesinleşmiştir.87Reklam içeriğinin haksız rekabet iddiasına konu olması durumunda, içerik sahibinin TTK madde 58 uyarınca sorumluluğuna gidilecektir. Bir başka kullanı-cının, reklam içeriğini beğenmek ya da tekrar paylaşmak suretiyle yalnızca ona bağlantı sağlaması durumunda ise sorumluluğu gündeme gelmeyecektir. Bu du-rumda yayılmacı (viral) reklamlar veya reklam hukukuna aykırılık taşıyan ileti-leri destekleme amacı taşımaksızın paylaşılan reklamlarda kullanıcının sorumlu-luğuna gidilemeyecektir. Ancak kullanıcının reklam içeriğini sunuş biçiminden onu benimsediği ve diğer kullanıcılara da ulaştırmak istediği anlaşılıyorsa genel hükümlere göre sorumluluğu doğacaktır.8887  Yargıtay 11. HD. 2016/5129 E, 2017/7334 K, 18.12.2017 T (www.lexpera.com.tr).88  Özdemir / Doğanay, s. 326. Örneğin bir organizasyon kapsamında, reklamın planlanarak yeniden paylaşılması söz konusu ise kullanıcı da içerik sahibi gibi bu reklamdan sorumlu olacaktır. Çalışanların bağlı olduğu şirketin sosyal medya hesapları üzerinden paylaştıkları reklamlar bakımından ise TBK 66. maddesi uyarınca işverenler adam çalıştıran sıfatıyla sorumlu olacaktır. Zira Adam çalıştıran, çalışanın, kendisine verilen işin yapılması sırasında başkalarına verdiği zararı gidermekle yükümlüdür.”. Bu durumda reklam veren hakkında, TTK m.56’da yer alan davalar açılabilecektir. Ayrıca reklam verenin talimatlarına veya aralarındaki sözleşmeye aykırı hareket eden reklam ajansının da sorumluluğu doğabilecektir.T.C. MALTEPE ÜNİVERSİTESİ • Hukuk Fakültesi Dergisi • 2021 / 168 Dr. Öğr. Üyesi Mete TEVETOĞLU - Av. Betül ÇOLAKDijital platformlarda kullanıcıların veya üyelerin kimliğini tespit etmek her zaman kolay olmayabilir. Kullanıcı adı üzerinden paylaşımı yapan kişinin bilgi-lerine erişilemediği hallerde, mahkemelerce bu bilgiler platformun işleticisinden veya temsilcisinden talep edilebilecektir. Haksız rekabetin gerçekleştiği çevrimi-çi platformun işleticisi, mahkeme talep ettiği takdirde reklamı yapan kullanıcının kaydolurken sunduğu bilgileri vermekle yükümlüdür.89 Aksi takdirde TTK’nin 58/1-b maddesindeki Yazılı basında yayımlanan programın, görüntünün, ses veya iletinin sahibinin veya ilan verenin kim olduğunun bildirilmesinden kaçınılırsa” hükmü uyarınca platformun işleticisi hakkında da TTK madde 56’da yer alan da-valar açılabilecektir. Nitekim Yargıtay’ın konuya ilişkin kararında; tüketicilerin şikâyetlerini belirttiği bir sitede davacı aleyhine yapılan, gerçek dışı ve gönderici-si belli olmayan yorumların davacıyı karalama amacıyla yapıldığının, bu eylemin haksız rekabet oluşturduğunun iddia edildiği olayda, failin kimliğini bildirmeyen şikâyet sitesi tüzel kişiliğin madde 58/1-b uyarınca sorumlu olduğu belirtilmiştir.90B. Veri Koruma Kuralları BakımındanGünümüzde sosyal ağ platformları, arama motorları veya medya kuruluşları reklamlar ile finanse ettikleri çevrimiçi hizmetleri ziyaretçilerine ücretsiz olarak sunmaktadır. Bu sayede internet kullanıcıları çevrimiçi hizmetlere, reklam ve-renler de ürün ve hizmetlerini tanıtabileceği hedef kitleye kolayca ulaşmaktadır. Kişiselleştirmenin ön planda olduğu dijital çağda, reklam verenler internetin on-lara sunduğu bu imkândan yararlanarak bir terzi edasıyla kişilere özel reklamlar hazırlamaktadır.91 Bunu yaparken de yaş aralığı, cinsiyet, ilgilenilen reklamlar (tıklama), IP adresi, çevrimiçi alışveriş geçmişi, sağlık durumu ve politik görüşü92 gibi kişi hakkındaki birçok veriyi kullanarak davranışsal profillerini oluştururlar. Oluşturulan profile göre kişilerin karşısına karakterleri ve ihtiyaçları dikkate alı-narak en uygun reklamlar çıkarılır. Çevrimiçi davranışsal reklamcılık olarak ad-landırılan bu tür reklamlarda tüketicilerin karakter ve tercihleri tespit edildikten sonra her birine farklı reklam içeriği gönderilir.9389  Özdemir / Doğanay, s. 312.90  Yargıtay 11. HD. 2011/14366 E, 2012/21009 K, 17.12.2012 T (www.lexpera.com.tr).91  Sophie Boerman / Sanne Kruikemeier / Frederik Zuiderveen Borgesius, ‘Online Behavioral Advertising: A Literature Review and Research Agenda’, Journal of Advertising, Sayı: 3, Yıl: 2017, https://www.tandfonline.com/doi/full/10.1080/00913367.2017.1339368 (erişim tarihi 15.07.2021).92  Salih Polater, ‘Kişisel Verilerin Reklam Amaçlı İşlenmesinde Hukuka Uygunluk Sebepleri’, Kişisel Verileri Koruma Dergisi, Sayı: 1, Yıl: 2019, https://dergipark.org.tr/tr/download/article-file/741785 (erişim tarihi 26.04.2021), s. 2.93  Tiffany Barnett White / Debra Zahay / Helge Thorbjørnsen / Sharon Shavitt, ‘Getting Too Personal: Reactance to Highly Personalized Email Solicitations’, Marketing Letters, Sayı: 19(1), Yıl: 2008, https://www.researchgate.net/publication/5153026 (erişim tarihi 15.07.2021), s. 40. Örneğin bir öğrencinin karşısına kırtasiye ürünleri çıkarılırken, araç sahibi birinin karşısına araç bakım hizmetine ilişkin reklamlar çıkarılacaktır.T.C. MALTEPE ÜNİVERSİTESİ • Hukuk Fakültesi Dergisi • 2021 / 1Dijital Reklamcılığın Yol Açtığı Hukuki Sorunlar ve Çözüm Önerileri 69Kişisel verilere dayanan dijital reklamlarda, hedef kitle bir yandan verile-rini sunduğu bu pazarın hammaddesi konumundayken diğer yandan ürün ya da hizmet alıcısı olarak tüketici konumundadır. Bu nedenle üreten tüketiciler (pro-ducer consumer - prosumer)” olarak nitelendirilmişlerdir.94 Zaman içerisinde gi-derek artan veri işleme faaliyetleri ile reklam verenlerin ve reklam hizmeti sunan platformların hedefi haline gelen tüketiciler kişisel verilerinin ve mahremiyetle-rinin ihlal edildiği düşüncesiyle endişelenmişlerdir. Bu endişenin temelinde ise tüketicilerin kişisel verilerinin hukuka aykırı olarak elde edilmesi ve/veya üçüncü taraflara aktarılması ya da hedef kitlenin ayrımcı ya da manipülatif reklamlara maruz kalması gibi nedenler bulunmaktadır. Bu noktada reklam hukukundaki ge-nel ilkeler koruyucu olsa da yeterli değildir. Bu durum kişisel verilerin korunma-sına ilişkin kuralların dijital reklamlara da uygulanmasını gerekli kılmıştır.1. Dijital Reklamlarda İşlenen Kişisel Veriler Bakımından Hukuki GerekçeReklam faaliyetlerinin yürütülmesi ve pazarlama amacıyla gerçekleştirilen kişisel veri işleme faaliyetinin kişisel verilerin korunmasına ilişkin genel ilkelere uygun olması gerekir. Mukayeseli hukukta95 da benzer şekilde düzenlenen genel ilkeler 6698 sayılı Kişisel Verilerin Korunması Kanunu’nun (KVKK) 4. madde-sinde yer almaktadır. Buna göre kişisel veriler işlenirken;-  Hukuka ve dürüstlük kurallarına uygun olması,-  Doğru ve gerektiğinde güncel olması,-  Belirli, açık ve meşru amaçlar için işlenmesi,-  İşlendikleri amaçla bağlantılı, sınırlı ve ölçülü olması,-  İlgili mevzuatta öngörülen veya işlendikleri amaç için gerekli olan süre ka-dar muhafaza edilmesi zorunludur.Reklam amaçlı veri işleme faaliyetlerinde genel ilkelere uygunluğun yanı sıra geçerli bir hukuka uygunluk şartı da bulunmalıdır. Bu noktada KVKK madde 5 ve 6’da yer alan veri işleme şartlarından hangisine dayanılacağı hususunda doktrinde görüş birliği ve yerleşmiş bir içtihat bulunmamaktadır. Ancak ortaya atılan görüş-lerde genel olarak açık rıza”, sözleşmenin kurulması veya ifası için gereklilik” ve veri sorumlusunun meşru menfaatlerinin korunması” şartlarına dayanıldığı görül-mektedir. Bu kapsamda Kişisel Verileri Koruma Kurulu (KVK Kurulu) için açık rıza” şartı önemli bir rol oynarken, Avrupa Birliği’nin yaklaşımı veri sorumlusu-nun meşru menfaatlerinin korunmasının gerekliliği” sebebinden yana olmuştur.9694  Cambridge  Dictionary,  2021,  https://dictionary.cambridge.org/dictionary/english/prosumer (erişim tarihi 26.04.2021).95  Bkz. Avrupa Birliği Genel Veri Koruma Tüzüğü m.5 Kişisel Verilerin İşlenmesine İlişkin Genel İlkeler, https://www.kisiselverilerinkorunmasi.org/wp-content/uploads/2017/09/GDPR-Türkçe-Çeviri-AB-Bakanlığı.pdf (erişim tarihi Nisan 26.04.2021).96  Polater, s. 1.T.C. MALTEPE ÜNİVERSİTESİ • Hukuk Fakültesi Dergisi • 2021 / 170 Dr. Öğr. Üyesi Mete TEVETOĞLU - Av. Betül ÇOLAKDijital reklamcılıkta veri işleme halinde ilgili kişinin açık rızasının hukuka uygun şekilde alınmış olması sık başvurulan, önemli bir dayanaktır. Veri koruma mevzuatımızca, açık rıza ancak belirli bir konuya ilişkin, bilgilendirmeye dayalı, özgür iradeyle açıklanmış olması” şartlarını sağladığında geçerli kabul edilecektir.97 Örneğin dijital platformlara yerleştirilen çerezler sayesinde hedef kitlenin çevrimiçi durumdayken karşılaştığı reklama karşı nasıl tepki verdiği öğrenilebilmektedir.98 Söz konusu izleme aslında bir kişisel veri işleme faaliyeti olduğundan ziyaretçiler-den rıza almayı gerektirir.99 Bu hallerde alınan açık rızanın geçerli olup olmadığı konusu tartışmaya açıktır. İnternet sitesinin tüm ve temel fonksiyonlarıyla kullanı-mı ancak çerezlerin aktifleştirilmesi şartıyla mümkün hale geliyorsa, kullanıcının verdiği rızayı özgür iradesiyle açıkladığını kabul etmek mümkün değildir. Buna karşın, alternatifleri bulunduğu halde kişinin söz konusu o hizmeti tercih ederek veri işleme faaliyetine rıza gösterdiği ve bu faaliyetin kişiye ağır külfetler yükleme-diği durumlarda, hizmetin rıza şartına bağlanmasının özgür iradeyi etkilemeyeceği savunulmaktadır.100 KVK Kurulu’nun bu konudaki yaklaşımı ise açık rıza talebinin bir hizmetin dolayısıyla sözleşmenin koşulu olarak sunulmasının açık rızayı sakat-layacağı yönündedir. KVK Kurulu, 27/02/2020 tarihli ve 2020/173 sayılı kararında (Amazon Kararı) veri sorumlusu konumundaki Amazon’un sitesinde yer alan Çe-rezlerimizi engellerseniz veya reddederseniz alışveriş sepetinize ürün ekleyemez, satın alma aşamasına geçemez veya oturum açmanızı gerektiren herhangi bir Ama-zon hizmetini kullanamazsınız.” şeklindeki ifadenin kişisel verilerin işlenmesi için sunulan bir hizmet şartı niteliğinde olduğunu belirtmiştir. Hizmet şartına bağlanmış olan açık rızada özgür iradenin sakatlanacağını belirten KVK Kurulu bu durumun dürüstlük kuralına uygun olma” ve amacı ile bağlı, sınırlı ve ölçülü olma” ilkele-rine aykırılık teşkil ettiğine karar vermiştir.1012. Dijital Reklamlarda Otomatik Veri İşlemeAlgoritmalar kişisel verileri otomatik olarak işleyerek ziyaretçilerin ilgi alan-larına ya da karakterlerine göre hazırlanmış kişiselleştirilmiş reklam sunulmasını sağlar. Bu noktada algoritmaların ayrımcılık yapması, geçmişteki önyargıları yan-sıtması bir sorun olarak karşımıza çıkmaktadır. Konuya ilişkin olarak, Google’ın kullanıcılarına sunduğu Reklam Ayarları” hizmeti üzerine yapılan bir çalışmada, 97  Özellikle belirli bir hizmetin şartı olarak sunulan açık rıza taleplerini ilgili kişi onaylasa bile bu onay geçersiz sayılabilecektir.98  Merih Taşkaya / Ömür Talay, ‘Dijital Gözetimin Pazarlama Amaçlı Aracıları: Çerezler” ve Çerez Kullanımında Açık Rıza”‘, Akdeniz Üniversitesi İletişim Fakültesi Dergisi, Sayı: 31, Yıl: 2019, https://dergipark.org.tr/tr/pub/akil/article/534603 (erişim tarihi 15.07.2021), s. 365.99  European Commission, Cookies, https://wikis.ec.europa.eu/display/WEBGUIDE/04.+Cookies (erişim tarihi 26.04.2021).100  Polater, s. 12-13.101  Kişisel Verileri Koruma Kurulu, 2020/173 K, 27.02.2020 T (www.kvkk.gov.tr).T.C. MALTEPE ÜNİVERSİTESİ • Hukuk Fakültesi Dergisi • 2021 / 1Dijital Reklamcılığın Yol Açtığı Hukuki Sorunlar ve Çözüm Önerileri 71AdFisher” isimli araç ile kullanıcıların Reklam Ayarları”nda işaretlediği seçe-neklerin Google reklamlarında ayrımcılığa yol açıp açmadığı araştırılmıştır. Araş-tırma sonucunda kullanıcıların fiziksel ve karakter özelliklerinin kendilerine sunu-lan reklamları etkilediği tespit edilmiştir. Örneğin Reklam Ayarları”nda kullanı-cının cinsiyetini belirtmesi karşılaştığı reklamları değiştirmiştir. Cinsiyetini erkek olarak işaretleyen kişilerin kadın olarak işaretleyenlere göre tarayıcılarında daha yüksek ücretli işleri daha sık gördüğü ortaya çıkmıştır.102 Algoritmaların neden böy-le bir sonuca ulaştığı kara kutu problemi103 ve Google’ın gizlilik politikası nedeniyle tespit edilememiştir. Benzer bir durum Facebook platformundaki reklamlar için de söz konusudur. Reklam verenler hedef kitlesini oldukça kapsayıcı şekilde belirlese bile Facebook algoritmaları reklam verenin bütçesini ve reklam içeriğini dikkate alarak kullanıcıların karşısına ilgi düzeylerine göre reklamlar çıkarmaktadır.104Facebook’un eleştirildiği tek nokta algoritmalarının ayrımcılığa yol açma-sı değildir. Facebook aynı zamanda üyelerinin karşısına çıkardığı politik rek-lamlar dolayısıyla da eleştirilere ve hatta yüksek miktardaki para cezalarına maruz kalmaktadır. Özellikle 2016 Amerika Birleşik Devleri (ABD) Başkanlık Seçimleri’nde Facebook reklamlarının demokrasiyi tehdit ettiği gündeme gel-miştir. Donald Trump’ın seçim sürecinde danışmanlık hizmeti aldığı Cambridge Analytica isimli şirketin, Facebook’tan temin ettiği yaklaşık 50 milyon seçmenin verilerini analiz ederek bu grubun oylarını değiştirmelerini sağlayacak kişisel-leştirilmiş reklamlar hazırladığı,105 sonrasında Facebook’un seçim sürecinde de-102  Amit Datta / Michael Carl Tschantz / Anupam Datta, ‘Automated Experiments on Ad Privacy Settings: A Tale of Opacity, Choice, and Discrimination’, Proceedings on Privacy Enhancing Technologies, Sayı: 1, Yıl: 2014, https://arxiv.org/abs/1408.6491 (erişim tarihi 10.07.2021).103  Yapay zeka sistemlerindeki kara kutu problemi kısaca, sistemdeki algoritmaların yaptığı tahminlerin ve aldığı kararların nedeninin gösterilememesini ifade etmektedir. Problemin nedeni, derin sinir ağları gibi dağıtılmış öğelerin karmaşıklığı ve insanların çok yüksek boyutlu kalıpları görselleştirememesi olarak gösterilmektedir. Sistemin yaratıcılarının ve kullanıcılarının algoritmaların muhtemel etkileri hakkında önceden fikir yürütememesi, kara kutu probleminin öngörülebilirlik ilkesini zedelediğini ortaya koymaktadır. Bkz. Yavar Bathaee, ‘The Artificial Intelligence Black Box and the Failure of Intent and Causation’, Harvard Journal of Law & Technology Sayı: 2, Yıl: 2018, https://jolt.law.harvard.edu/assets/articlePDFs/v31/The-Artificial-Intelligence-Black-Box-and-the-Failure-of-Intent-and-Causation-Yavar-Bathaee.pdf (erişim tarihi 10.07.2021), s. 893, 895, 901.104  Muhammad Ali / Piotr Sapiezynski / Miranda Bogen / Aleksandra Korolova / Alan Mislove / Aaron Rieke, ‘Discrimination through optimization: How Facebook’s ad delivery can lead to skewed outcomes’, Proceedings of the ACM on Human-Computer Interaction, Sayı: 3, Yıl: 2019, https://arxiv.org/abs/1904.02095 (erişim tarihi 26.04.2021), s. 199:1. Bütçenin yanı sıra kullanıcıların cinsiyetinin ve ırkının, özellikle istihdam ve barınmaya ilişkin sunulan reklamlarda etkili olduğu görülmüştür.105  Julia Carrie Wong, Mark Zuckerberg Apologises for Facebook’s ‘Mistakes’ Over Cambridge Analytica, The Guardian, 2018, https://www.theguardian.com/technology/2018/mar/21/mark-zuckerberg-response-facebook-cambridge-analytica (erişim tarihi 26.04.2021).T.C. MALTEPE ÜNİVERSİTESİ • Hukuk Fakültesi Dergisi • 2021 / 172 Dr. Öğr. Üyesi Mete TEVETOĞLU - Av. Betül ÇOLAKzenformasyona yol açacak bu reklamları kullanıcıların akışına çıkararak seçimi manipüle ettiği iddia edilmiştir.106Benzer bir durum Brexit sürecinde de gündeme gelmiştir. Ayrıla Oy Ver (Vote Leave)” ismiyle yürütülen kampanyada, Facebook kullanıcılarının doğum tarihi, ikametgâh ve sosyal medya hesaplarında yer alan diğer verileri dikkate alarak göç ve hayvan hakları gibi spesifik konularda reklamlar hazırlanmıştır.107 Birleşik Krallık Veri Koruma Otoritesi (ICO), siyasi amaçlarla yapılan veri analitiğine ilişkin yürüttüğü soruşturmanın neticesinde, Facebook’a veri ko-ruma yasalarını ciddi şekilde ihlal ettiği için 500.000 £ para cezası vermiştir.108 Gelişmelerin ardından Facebook’un özellikle politik reklamları insan haklarına duyarlı çevrelerce halen riskli görülmektedir. Örneğin Avrupa Komisyonu bün-yesindeki Avrupa Ekonomik ve Sosyal Komitesi, politik reklamların yüksek riskli yapay zekâ uygulaması olarak kabul edilmesi gerektiğini ifade etmiştir. Raportör Catelijne Muller, Facebook’taki politik reklamların mahremiyet, sen-dikaya üye olma ve gösteri yapma hakkı gibi temel insan haklarını olumsuz etkilediğini belirtmiştir.109C. Vergi Hukuku BakımındanDijital reklamların ekonomideki payı gün geçtikçe artmaktadır. Geleneksel reklamlar uzun yıllar işletmelerin gelirlerinin artırmasında etkili olmuşken, diji-tal reklamlar bunu sürdürmekle birlikte dijital platformlara ve pazara sonradan katılan aktörlere yeni bir gelir kaynağı da oluşturmuştur. Daha önce ürettikleri ürünlerle ya da arama ve mesajlaşma gibi verdikleri hizmetlerle para kazanan di-jital platformlar artık reklamlardan da gelir elde etmeye başlamıştır. Öyle ki, rek-lamlardan elde ettikleri gelirler her geçen yıl artmış ve artık cirolarının önemli bir kısmını oluşturacak seviyeye gelmiştir. Örneğin Facebook’un 2019’daki reklam geliri 69,7 milyar ABD Dolar’ı iken 2020 yılında bu gelir yüzde 21 artışla 84,2 milyar ABD Dolar’ına yükselmiştir.110 Benzer şekilde arama motoru Google’un, 106  Olvia Solon, Facebook’s Failure: Did Fake News and Polarized Politics Get Trump Elected?, The Guardian, 2016, https://bit.ly/3CdNYdI (erişim tarihi 26.04.2021).107  BBC News, Vote Leave’s Targeted Brexit Ads Released by Facebook, 2018, https://www.bbc.com/news/uk-politics-44966969 (erişim tarihi 26.04.2021).108  The Information Commissioner’s Office, ICO issues maximum £500,000 fine to Facebook for failing to protect users’ personal information, 2018, https://bit.ly/3xpKDVd (erişim tarihi 15.07.2021).109  European Economic and Social Committee, Artificial Intelligence: EU law should set safe boundaries for high-risk applications, says EESC, 2020, https://bit.ly/3fm7quX (erişim tarihi 26.04.2021).110  Hristina Tankovska, Facebook: Annual Revenue 2009-2020, By Segment, Statista, 2021, https://www.statista.com/statistics/267031/facebooks-annual-revenue-by-segment/ (erişim tarihi 26.04.2021).T.C. MALTEPE ÜNİVERSİTESİ • Hukuk Fakültesi Dergisi • 2021 / 1Dijital Reklamcılığın Yol Açtığı Hukuki Sorunlar ve Çözüm Önerileri 732019 yılında 134.8 milyar ABD Dolar’ı olan reklam gelirleri, 2020 yılında 146,9 milyar ABD Dolar’ına yükselmiştir.111Dijital mecralar üzerinden elde edilen gelirin ve gelir elde eden kişilerin gün geçtikçe artması devletleri vergi adaletini sağlama ve muhtemel vergi kaybını ön-leme amacıyla harekete geçirmiştir. Ancak mevcut hukuk kurallarındaki bazı en-geller ve çifte vergilendirme yasağının da etkisiyle devletler bu geliri nasıl vergi-lendirecekleri konusunda geçerli bir yol bulamamıştır. Bu süreçte, pek çok ülkede fiziksel olarak iş merkezi ya da daimî temsilcisi bulunmayan büyük şirketlerin, dijital faaliyetlerinin nasıl vergilendirileceği araştırılmış; bu işlemin çifte vergi-lendirmeyi önleme anlaşmalarını ihlal etmeden nasıl sağlanacağı tartışılmıştır.112Zaman içerisinde dijital platformlar lehine oluşan vergi rekabetinin önlen-mesi, devletlerin vergi ziyaı yaşamaması ve eşit mükellefler arasında vergi ada-letsizliğine113 yol açılmaması için pek çok ülkede yeni vergi yasaları uygulamaya alınmıştır.Bugün dijital reklamlar da dahil olmak üzere dijital ortam vasıtasıyla su-nulan  çeşitli  hizmetlerin  vergilendirilmesi  işlemi  Türkiye,  Fransa,  İngiltere, Avusturya, İtalya, İspanya ve Hindistan’ın da aralarında bulunduğu pek çok ül-kede uygulanmaktadır.114 Dijital hizmetlere uygulanan vergi oranları Fransa ve İtalya’da %3, İngiltere’de %2 iken; %7,5 ile en yüksek oranın Türkiye’de uygu-landığı görülmektedir. Dijital hizmet vergisinin kapsamına giren şirketlerin çoğu ABD merkezli büyük teknoloji şirketleridir. Bu nedenle ABD, söz konusu vergiyi ABD’deki şirketleri hedef alan ayrımcı bir vergi olarak değerlendirmekte ve eleş-tirmektedir.115 Bu doğrultuda, ABD sınırları içerisinde bulunan büyük teknoloji 111  Joseph Johnson, Google: Annual Advertising Revenue 2001-2020, Statista, 2021, https://www.statista.com/statistics/266249/advertising-revenue-of-google/  (erişim  tarihi  26.04.2021).  Dijital reklamlar uluslararası teknoloji şirketleri dışında; Youtuber, Blogger, Fenomen diye adlandırdığımız sosyal medya etkileyicilerinin de dijital reklamlardan gelir elde etmesini sağlamıştır.112  Mustafa Cemil Kara / Ersan Öz, ‘Dijital Vergilendirmeye Küresel Bir Bakış’, Vergi Dünyası, Sayı: 424, Yıl: 2016, http://www.ersanoz.com/makaleler/15-12-2016-dijital-vergilendirmeye-kuresel-bir-bakis.pdf (erişim tarihi 15.07.2021), s. 32. Bu tartışmalar sırasında toplanacak verginin konusu ile ilgili bir fikir birliğine varılamamıştır.113  Coşkun Karadağ, s. 74.114  Hüseyin  Akkaya  /  Adnan  Gerçek,  ‘OECD  ve  Seçilmiş  Bazı  Ülkelerde  Dijital  Ekonominin Vergilendirilmesi: Türkiye İçin Çıkarımlar’, International Journal of Public Finance, Sayı: 2, Yıl: 2019, https://dergipark.org.tr/en/download/article-file/906759 (erişim tarihi 15.07.2021), s. 173-178.115  ABD Ticaret Temsilciliği Ofisi (US Trade Representative Office) tarafından 6 Aralık 2019’da yapılan açıklamada, Fransa tarafından uygulanan dijital hizmet vergisinin ayrımcılığa sebep olduğu ve ABD şirketlerini olumsuz etkilediği gerekçesiyle rekabet soruşturması başlatıldığı ifade edilmiştir. Bkz. US Trade Representative Office, USTR Announces Initiation of Section 301 Investigation into France’s Digital Services Tax, 2019, https://ustr.gov/about-us/policy-offices/press-office/press-releases/2019/july/ustr-announces-initiation-section-30 (erişim tarihi 26.04.2021).T.C. MALTEPE ÜNİVERSİTESİ • Hukuk Fakültesi Dergisi • 2021 / 174 Dr. Öğr. Üyesi Mete TEVETOĞLU - Av. Betül ÇOLAKşirketlerini korumak amacıyla, onlara dijital hizmet vergisi uygulayan ülkelerle ilgili rekabet soruşturması başlatmış ve bu ülkelerden ithal ettiği ürünlere karşı misilleme yapılacağını duyurmuştur.116Dijital reklamlara uygulanan özel vergi hükümleri yürürlüğe girmeden önce de ülkemizde reklam veren şirketler ya da reklam kampanyalarını yürütenler ver-gi mükellefi konumundaydı. Dijital Hizmet Vergisi, 476 Sayılı Cumhurbaşkanı Kararı gibi yeni vergi düzenlemeleri ise daha önceden vergilendirilemeyen ulus-lararası dev şirketlerin ya da sosyal medya etkileyicilerinin vergilendirilmesini mümkün hale getirmiştir. Buna göre 1 Mart 2020 tarihinde yürürlüğe giren Dijital Hizmet Vergisi Kanunu, dijital ortamda mal ve hizmet sunan işletmeler ile bun-ların satışına aracılık eden dijital platformlar için yeni bir vergi getirmiştir. Bu düzenleme uyarınca 20 milyon Türk Lirasının üstünde hasılat elde eden yerel şir-ketler ile 750 milyon Avro veya muadilinin üstünde hasılat elde eden uluslararası şirketler, Türkiye’de sunduğu dijital hizmetlerden elde ettikleri hasılat üzerinden yüzde 7.5 oranında dijital hizmet vergisi ödemekle yükümlü olmuşlardır. Her ne kadar Dijital Hizmet Vergisi’nin hasılat üzerinden alınacağı belirtilmişse de as-lında bu vergi bir harcama vergisi olarak kurgulanmıştır.117 Aksi halde bu verginin gelir vergisi kapsamında değerlendirilmesi gerekecek bu da çifte vergilendirmeyi önleme anlaşmalarına (ÇVÖA) aykırılık teşkil edecektir. Söz konusu verginin en çok Google, Facebook, Amazon gibi küresel çapta faaliyette bulunan işletmeleri etkileyeceği açıktır. Bu doğrultuda, Türkiye de ABD’nin rekabet soruşturmasıyla karşı karşıya kalan ülkeler arasında yerini almıştır.118 Dijital Hizmet Vergisi, mat-raha dahil edilen kur farkının Anayasa’nın 73. maddesinde vücut bulan verginin kanuniliği ilkesi ile hukuki belirlilik ilkesine aykırılık teşkil ettiği gerekçesiyle eleştirilmiştir.119Ulusal mevzuatımızda dijital reklamların vergilendirilmesini sağlayan bir di-ğer düzenleme ise 30630 sayılı Resmî Gazete’de yayımlanan 18/12/2018 tarihli ve 476 sayılı Cumhurbaşkanı Kararı’ (Karar) dır. Karar ile Gelir Vergisi Kanunu’nun 116  The United States Trade Representative, Initiation of Section 301 Investigations of Digital Services  Taxes,  2020,  https://ustr.gov/sites/default/files/assets/frn/FRN.pdf  (erişim  tarihi 8.07.2021); Reuters, U.S. To Announce, But Defer, Retaliation Over French Digital Tax: USTR,  2020,  https://www.reuters.com/article/us-usa-trade-france-digital-idUSKBN24A377 (erişim tarihi 8.07.2021).117  Numan Emre Ergin, Sosyal Medya Şirketlerine Kesilen Cezalar ve Vergi, Dünya Gazetesi, 2020, https://www.dunya.com/kose-yazisi/sosyal-medya-sirketlerine-kesilen-cezalar-ve-vergi/488179 (erişim tarihi 26.04.2021).118  Offıce of the United States Trade Representatıve, Report on Turkey’s Digital Services Tax, 2021, https://ustr.gov/sites/default/files/enforcement/301Investigations/Report%20on%20Turkey%E2%80%99s%20Digital%20Services%20Tax.pdf (erişim tarihi 26.04.2021), s. 3.119  Numan Emre Ergin, Dijital Hizmet Vergisi’ne İlişkin Değerlendirmeler, Dünya Gazetesi, 2020, https://www.dunya.com/kose-yazisi/dijital-hizmet-vergisine-iliskin-degerlendirmeler/468782 (erişim tarihi 26.04.2021).T.C. MALTEPE ÜNİVERSİTESİ • Hukuk Fakültesi Dergisi • 2021 / 1Dijital Reklamcılığın Yol Açtığı Hukuki Sorunlar ve Çözüm Önerileri 75(GVK) 94. maddesinin 1. fıkrasında ve Kurumlar Vergisi Kanunu’nun 15. mad-desinin 1. fıkrasında sayılanların kapsamına internet ortamında verilen reklam hizmetleri vergi kesintisi de alınmıştır.120 Karar’ın 5. maddesinde, hükümlerinin 1.1.2019 tarihinden itibaren yapılacak ödemelere uygulanacağı belirtilmektedir. Söz konusu Karar ile ilgili açıklamaların yer aldığı 1 Seri No.lu Kurumlar Vergisi Genel Tebliği’nde tam veya dar mükellef olması önem arz etmeksizin, internet ortamında reklam hizmeti veren veya bu hizmetlerin verilmesine aracılık eden gerçek kişilere yapılan ödemelerde vergi kesintisi oranı %15 olarak gösterilmek-tedir.121 Devamındaki 30.4.11.1.1.” başlıklı bölümde ise internet ortamında veri-len reklam hizmetlerine ilişkin olarak, bu hizmeti veren veya internet ortamında reklam hizmeti verilmesine aracılık eden dar mükellef kurumlara yapılan ödeme-ler üzerinden %15 oranında vergi kesintisi yapılması gerektiği ifade edilmekte-dir.122Söz konusu hükümlerde internet reklam bedellerine yüzde 15 oranında sto-paj uygulanan gerçek kişinin gelir vergisi mükellefi olup olmaması ile tam mü-kellef ya da dar mükellef olup olmamasının önem arz etmemesi dikkat çekmek-tedir. Bu düzenleme ile reklamlar üzerinden yüksek gelir elde eden sosyal medya etkileyicilerinin stopaj ile vergilendirilmesi ve böylece vergi güvenliğinin sağ-lanması amaçlanmıştır.123 Sosyal medya etkileyicilerinin dijital reklamlardan elde ettiği gelirlerin vergilendirileceği konusunda bir tartışma olmasa da bu verginin Gelir Vergisi Kanunu’nun (GVK) 2. maddesinde yer alan hangi gelir unsuruna124 dayandırılacağı konusunda tartışmalar mevcuttur. Gelir İdaresi Başkanlığı’nın (GİB) bu konuda istikrar kazanmış uygulaması, bu gelirin ticari kazanç olduğu yönündeyken; öğretide bu gelirin serbest meslek kazancı olduğu yönünde görüş-120  Gelir Vergisi  Kanunu  m.94/1  kapsamında  Kamu  idare  ve  müesseseleri,  iktisadi  kamu müesseseleri, sair kurumlar, ticaret şirketleri, iş ortaklıkları, dernekler, vakıflar, dernek ve vakıfların iktisadi işletmeleri, kooperatifler, yatırım fonu yönetenler, gerçek gelirlerini beyan etmeye mecbur olan ticaret ve serbest meslek erbabı, zirai kazançlarını bilanço veya zırai işletme hesabı esasına göre tespit eden çiftçiler” bulunmaktadır. Kurumlar Vergisi Kanunu m.15/1 kapsamında Kamu idare ve kuruluşları, iktisadî kamu kuruluşları, sair kurumlar, ticaret şirketleri, iş ortaklıkları, dernekler, vakıflar, dernek ve vakıfların iktisadî işletmeleri, kooperatifler, yatırım fonu yönetenler, gerçek gelirlerini beyan etmeye mecbur olan ticaret ve serbest meslek erbabı, ziraî kazançlarını bilânço veya ziraî işletme hesabı esasına göre tespit eden çiftçiler” bulunmaktadır.121  Kurumlar Vergisi Genel Tebliği (Seri No: 1), 15.3.11.1.1. İnternet ortamında verilen reklam hizmetlerine ilişkin ödemeler üzerinden yapılacak vergi kesintisi”, (erişim tarihi 8.07.2021).122  Kurumlar Vergisi Genel Tebliği (Seri No: 1), 30.4.11.1.1. İnternet ortamında verilen reklam hizmetlerine ilişkin ödemeler üzerinden yapılacak vergi kesintisi”, (erişim tarihi 8.07.2021).123  Coşkun Karadağ, s. 84.124  Gelir Vergisi Kanunu’nun 2. maddesine göre gelire giren kazanç ve iratlar şunlardır: Ticarî kazançlar, ziraî kazançlar, ücretler, serbest meslek kazançları, gayrimenkul sermaye iratları, menkul sermaye iratları, diğer kazanç ve iratlar.”T.C. MALTEPE ÜNİVERSİTESİ • Hukuk Fakültesi Dergisi • 2021 / 176 Dr. Öğr. Üyesi Mete TEVETOĞLU - Av. Betül ÇOLAKler de ileri sürülmüştür.125 GİB’in çeşitli kararlarında, sosyal medya platformla-rının bir çeşit ticari organizasyon olduğu, bu platformlardan sürekli şekilde elde edilen gelirin de ticari kazancın devamlılık unsuru olarak nitelendirildiği anla-şılmaktadır. Sürekliliğin olmadığı durumlarda ise arızî ticari kazanç söz konusu olacaktır. Söz konusu reklam gelirinin serbest meslek kazancı olduğunu savunan görüş ise; sosyal medya etkileyicilerinin yürüttükleri faaliyetlerin asıl unsurunun sermayeden ziyade emek, uzmanlık, şöhret gibi faktörlere dayanmasını gerekçe göstermektedir.126 Söz konusu gelirin serbest meslek kazancı olarak kabul edilme-si halinde, 2020 yılı için geliri 600.000 TL’nin altında olanlar, GVK’nın 18. mad-desindeki telif kazançları istisnasından yararlanacak ve kazancını beyan etmesi gerekmeyecektir. Yıllık geliri 600.000 TL’nin üzerinde olup telif ödemesi yapa-cak kişilerin ise Türkiye’de bulunması ve GVK’nın 94. maddesinde sayılanlar arasında yer alması halinde, telif ödemeleri üzerinden yüzde 17 oranında stopaj uygulamaları gerekmektedir.Dijital reklam bedelleri üzerinden vergi kesintisi öngören düzenlemeler dava konusu olmuştur. İlk derece mahkemeleri söz konusu reklam hizmetlerinden elde edilen geliri ticari kazanç olarak nitelendirmiş, bu nitelikteki gelir unsurunun Türkiye’de vergilendirilebilmesi için geliri elde edenin Türkiye’de bir iş yeri-nin veya daimi temsilcinin olması gerektiği ifade etmiş, Türkiye’de fiziki bir iş yeri bulunmayan ilgili kurumlara stopaj uygulanması adına uluslararası sözleş-melerde ve ulusal mevzuatta belirlenen iş yeri tanımın yorum ve kıyas yoluyla genişletilmesinin Anayasa başta olmak üzere mevcut yasal düzenlemelere aykırı olduğunu belirterek genellikle şirketler lehine karar vermişlerdir.127Diğer taraftan, 476 sayılı Cumhurbaşkanı Kararı ile 2009/14593 sayılı Ba-kanlar Kurulu Kararında yapılan değişiklik uyarınca, internet ortamında verilen reklam hizmetlerine ilişkin olarak, bu hizmeti veren veya internet ortamında bu hizmetin verilmesine aracılık eden dar mükellef kurumlara yapılan ödemeler üzerinden yüzde 15 oranında vergi kesintisi yapılması gerekecektir. Bu düzen-125  Gelir Vergisi Kanunu’nun 65. maddesinde Serbest meslek kazancı Her türlü serbest meslek faaliyetinden doğan kazanç” olarak tanımlanmıştır. Devamındaki fıkrada ise Serbest meslek faaliyeti; sermayeden ziyade şahsi mesaiye ilmi veya mesleki bilgiye veya ihtisasa dayanan ve ticari mahiyette olmayan işlerin iş verene tabi olmaksızın şahsi sorumluluk altında kendi nam ve hesabına yapılması” şeklinde ifade edilmiştir.126  Numan Emre Ergin, ‘Fenomenlerin Faaliyeti Emek ve Şöhrete Dayanıyor’, Platin, 2021, https://www.platinonline.com/yazarlar/av-dr-numan-emre-ergin/fenomenlerin-faaliyeti-emek-ve-sohrete-dayaniyor-1076527 (erişim tarihi 26.04.2021).127  Abdullah Tolu, ‘Google, Facebook, Instagram, Amazon ve Twitter Reklamlarına Stopaja Yargı Freni’, https://www.dunya.com/kose-yazisi/google-facebook-instagram-amazon-ve-twitter-reklamlarina-stopaja-yargi-freni/603464 (erişim tarihi 25.09.2021) ve orada anılan İstanbul 3. Vergi Mahkemesi, 28.01.2020 tarih ve E. 2019/1350, K. 2020/202; İstanbul 10. Vergi Mahkemesi 07.01.2020 tarih ve E. 2019/1190, K. 2020/16; İstanbul 4. Vergi Mahkemesi 22.11.2019 tarih ve E. 2019/696 K. 2019/2300; İstanbul 4. Vergi Mahkemesi 27.11.2019 tarih E. 2019/710, K. 2019/2334.T.C. MALTEPE ÜNİVERSİTESİ • Hukuk Fakültesi Dergisi • 2021 / 1Dijital Reklamcılığın Yol Açtığı Hukuki Sorunlar ve Çözüm Önerileri 77leme neticesinde söz konusu stopajın Dijital Hizmet Vergisi ile beraber uygu-lanması çifte vergilendirmeye yol açabilecektir. Zira aynı hasılat için iki farklı vergi düzenlemesi ön görülmüştür.128 Aynı zamanda söz konusu vergilendirme, Türkiye’de iş yeri bulunmayan bu platformların dijital ortamdan elde ettiği ge-lirleri vergilendirdiği için ÇVÖA’ya aykırı olacaktır.129 Zira iş yerinin mevzuatı-mızda130 ya da taraf olduğumuz ÇVÖA’da fiziki olması aranmış dijital platformlar bu kapsamda kabul edilmemiştir. Dolayısıyla ticari faaliyetler ancak iş yerinin fiziken bulunduğu kaynak ülkede vergilendirmeye konu olacaktır. Ancak aksinin yaşandığı örnekler de mevcuttur. Örneğin İtalya’da Google yetkilileri ile İtalya Maliye Bakanlığı ve Milano Savcılığı arasında uzlaşma sağlanmış ve anlaşma sonucunda Google Anonim Şirketi’ne 2008-2013 yılları arasında İtalya’dan ka-zandığı reklam gelirleri için 320 milyon Avro vergi tahakkuk ettirilmiştir.131Son olarak 01.10.2020 tarihinde yürürlüğe giren 7253 sayılı İnternet Orta-mında Yapılan Yayınların Düzenlenmesi ve Bu Yayınlar Yoluyla İşlenen Suçlar-la Mücadele Edilmesi Hakkında Kanunda Değişiklik Yapılmasına Dair Kanun, Türkiye’de fiziki iş yeri bulunmayan platformların vergilendirilmesine imkan sağladığı için, ÇVÖA’nın ihlal edilmesini engelleyebilir. OECD Çifte Vergilen-dirmeyi Önleme Model Anlaşması’nın 5. maddesinin 5. fıkrasında iş yerinin var-lığına dair hususlar düzenlenmektedir. Buna göre, başka bir ülkedeki teşebbüs adına hareket edip onun adına sözleşme imzalama yetkisine sahip olan bir kişi (temsilci) bu yetkisini mutad olarak kullandığında iş yerinin temsilcisinin bulun-duğu ülkede de varlığı kabul edilmektedir.132 Bu doğrultuda, 7253 Sayılı Kanun dolayısıyla Türkiye’de temsilci olarak atanan kişi geniş yetkilerle donatılmış ve eylemleri ile yurt dışındaki şirketin ticari faaliyetlerini etkilemekteyse, temsilci atayan şirketin Türkiye’de iş yeri bulunduğundan bahsedilebilecektir. Böylece Türkiye, topraklarında daimî temsilcisi bulunan işletmelerin ticari faaliyetlerin-den elde ettiği kazancı vergilendirebilecektir. Diğer taraftan 7253 sayılı Kanun gereğince, temsilci ataması gerektiği halde atayamayan sosyal ağ sağlayıcılarına kademeli olarak uygulanan idari para cezalarının ardından reklam yasağı uygula-ması gündeme gelecektir. Reklam yasağı kararının yayımlanması ile Türkiye’de vergi mükellefi olan şirket ve kişilerin, sosyal ağ sağlayıcıların sitelerine reklam vermesi yasaklanacaktır. Ayrıca sosyal ağ sağlayıcılar ile KOBİ’ler, büyük ölçek-128  Ergin, Dijital Hizmet Vergisi.129  Ahmet Sağlı, Türkiye’de Dijital Ekonominin Vergilendirilmesi, EY, 2020, https://www.ey.com/tr_tr/tax/turkiyede-dijital-ekonominin-vergilendirilmesi (erişim tarihi 26.04.2021).130  Bkz. 213 sayılı Vergi Usul Kanunu m.156.131  Giuseppe Fonte / Gavin Jones, Italy’s Renzi Faces Uphill Struggle Over Google Tax Plan, Reuters, 2015,  http://www.reuters.com/article/us-italy-tax-internetanalysis-idUSKCN0RU1HS20150930 (erişim tarihi 26.04.2021).132  Ergin, Sosyal Medya Şirketleri.T.C. MALTEPE ÜNİVERSİTESİ • Hukuk Fakültesi Dergisi • 2021 / 178 Dr. Öğr. Üyesi Mete TEVETOĞLU - Av. Betül ÇOLAKli şirketler ya da ajanslar reklam sözleşmesi akdedemeyecek ve buna ilişkin para transferi de yapamayacaktır. Bunun yanı sıra reklam yasağı uygulanan platform-lara reklam verenlere de ayrıca ceza kesileceğini bildirilmiştir.133 Yasağa rağmen verilen reklamların vergi matrahından indirilmesi mümkün olmayacak ve dolayı-sıyla reklam kampanyaları şirketler için daha maliyetli bir hale gelecektir.SONUÇİnternetin hayatımıza girmesiyle daha önce gazete, radyo, televizyon veya rek-lam panolarında karşılaştığımız reklamlar e-posta, sosyal medya platformları, ara-ma motorları gibi dijital mecralarda karşımıza çıkmaya; yani gelenekselden dijitale doğru form değiştirmeye başlamıştır. Dijital reklamların görüntü ve ses kalitesinin yüksek olması, içeriklerinin ilgi çekici olması hedef kitleyi daha çok etkilerken; aynı zamanda kişiselleştirilmiş olmaları dijital reklamları reklam verenler için vaz-geçilmez kılmıştır. Reklam verenler, ellerindeki Büyük Veri sayesinde hedef kitleye daha kaliteli reklam sunmayı vadeden dijital platformlara akın ederken; tüketici-ler de aldıkları hizmetten memnun oldukları için hesaplarını terk edememektedir. Konu evvela elektronik ticaret açısından yasal düzenlemeye konu edilmişse de eş zamanlı veya hemen ardından çeşitli yasal düzenlemelerle ve uygulamalarla farklı hukuki açılardan da düzenlenmeye ve uygulanmaya başlamıştır.Zaman içerisinde giderek daha fazla veriye dayanan reklamcılık sektöründe, büyük miktardaki veri setlerini elinde tutan dev teknoloji şirketleri, rekabet ve kişisel verilerin korunması süzgeçlerine takılıp dünyanın çeşitli yerlerinde soruş-turmalar geçirmiştir. Rekabet soruşturmalarının temelinde, uluslararası teknoloji şirketlerinin çeşitli araçlarla kullanıcılarının veya ziyaretçilerinin verilerini topla-yarak, ellerinde büyük miktarda veri tutmaları bulunmaktadır.Konunun kişisel verilerin korunmasına ilişkin kısmının özünde, dijital plat-formlardaki kullanıcıların mahremiyet endişesi yatmaktadır. 2016 ABD Başkanlık Seçimleri’ne kadar kullanıcıların acaba olabilir mi” diye şüphe duydukları veri ihlalleri, bu seçimin ardından davalara ve haberlere konu olmuştur. Kullanıcıların kişisel verilerinin toplanarak politik ya da ticari reklamlarla iradelerinin sakatlan-ması, sosyo-ekonomik hayatı ve insan haklarını tehdit eden bir hal almıştır. Bu nedenle dünyanın çeşitli yerlerinde özellikle Google, Amazon, Facebook gibi şir-ketlere karşı davalar açılmış ve ihlalleri önleyici düzenlemeler getirilmiştir.Dijital reklam platformlarından elde edilen gelirlerin vergilendirilmesi so-runu da pek çok ülkede gündeme gelmiştir. Bu doğrultuda ülkeler, gelirlerinin ciddi bir kısmı reklamlardan oluşan Google, Amazon, Facebook ve Apple gibi uluslararası büyük şirketler ile reklam kampanyalarını yürüten sosyal medya et-kileyicilerini vergilendirmeye başlamıştır.133  Ömer Fatih Sayan, Twitter, 2021, https://twitter.com/ofatihsayan/status/1350408379190161408?s=20 (erişim tarihi 26.04.2021).T.C. MALTEPE ÜNİVERSİTESİ • Hukuk Fakültesi Dergisi • 2021 / 1Dijital Reklamcılığın Yol Açtığı Hukuki Sorunlar ve Çözüm Önerileri 79İncelememizde ortaya konulduğu üzere dijital reklamcılık hukuki bakımdan tek yönlü değildir. Aksine dijital reklamcılık hukuk teorisi ve uygulamasında çok yönlü etkilerinden ötürü çok sayıda farklı yasal düzenlemeye, çok sayıda farklı kurumun görev alanına ve uygulamalarına konu olmuş ve olmaktadır. Elektronik ticaret, rekabet, haksız rekabet, tüketici ve reklam hukuku, veri koruma hukuku, internet yayıncılığı, sınai mülkiyet hukuku bunlardan öne çıkanlar olup her bir yasal düzenleme dijital reklamcılığı ya kendi açısından doğrudan düzenlemekte ya da dolaylı şekilde yorum yoluyla kapsayarak uygulama alanı bulmaktadır. Bu durum zaman zaman kriterlerin arasında uyumsuzluğa yol açmakta, konuya dair hukuki düzenlemelerin kapsamı ve sınırları yer yer belirsizleşmektedir. Tüm bu sebeplerle dijital reklamların hukuken ya sınırlı sayıda temel ve konuyla doğ-rudan ilgili yasalarla düzenlenmesi ve bu suretle dağınık ve uyumsuz düzenle-melerden uzaklaşılması ya da arz ettikleri giderek artan etki ve öneme binaen reklamcılık alanını hedef alan bir yasal düzenlemenin içinde bir bölüm şeklinde, kendine özgü ilkelerinin ışığında ele alınması değerlendirilmelidir.T.C. MALTEPE ÜNİVERSİTESİ • Hukuk Fakültesi Dergisi • 2021 / 180 Dr. Öğr. Üyesi Mete TEVETOĞLU - Av. Betül ÇOLAKKAYNAKÇAAASLAID, Katrina, 50 Examples of Corporatıons that Failed to Innovate, Valuer, 2019, https://www.valuer.ai/blog/50-examples-of-corporations-that-failed-to-innovate-and-missed-their-chance, erişim tarihi 11.07.2021.ADSOFTEHWORLD, IKEA Cristiano, https://www.adsoftheworld.com/media/digital/ikea_cristiano, erişim tarihi 08.07.2021.AKKAYA, Hüseyin / GERÇEK, Adnan, ‘OECD ve Seçilmiş Bazı Ülkelerde Dijital Eko-nominin Vergilendirilmesi: Türkiye İçin Çıkarımlar’, International Journal of Public Finance, Sayı: 2, Yıl: 2019, s. 166-188, https://dergipark.org.tr/en/download/article-file/906759, erişim tarihi 15.07.2021.AKSOY, Ramazan, İnternet Ortamında Pazarlama, Seçkin Yayıncılık, Ankara, 2009.ALBAY, Nurettin, ‘Geleneksel Pazarlamadan Yeni Pazarlama Yaklaşımlarına Geçiş Süreci’, Süleyman Demirel Üniversitesi İktisadi ve İdari Bilimler Fakültesi Dergisi, Sayı: 2, Yıl: 2010, s. 222, https://dergipark.org.tr/tr/download/article-file/194577, eri-şim tarihi 14.07.2021.ALI, Muhammad / SAPIEZYNSKI, Piotr / BOGEN, Miranda / KOROLOVA, Alek-sandra / MISLOVE, Alan / REIKE, Aaron, ‘Discrimination through optimization: How Facebook’s ad delivery can lead to skewed outcomes’, Proceedings of the ACM on Human-Computer Interaction, Sayı: 3, Yıl: 2019, https://arxiv.org/abs/1904.02095, erişim tarihi 26.04.2021.ARSLAN, Elif, ‘Sosyal Medyada Yeni Bir Reklam Türü Olarak Kullanılan Native (Do-ğal) Reklam’, PressAcademia Procedia, Cilt: 9, İstanbul, 2019, s. 269-273, http://www.pressacademia.org/archives/pap/v9/50.pdf, erişim tarihi 14.07.2021.ATAMANIUK, Mary, Which Company Uses the Most of Your Data?, Clario Blog, 2021, https://clario.co/blog/which-company-uses-most-data/, erişim tarihi 26.04.2021.AUTORITÉ DE LA CONCURENCE, L’Autorité Sanctionne Google À Hauteur De 150 M€ Pour Abus De Position Dominante, 2019, https://www.autoritedelaconcurrence.fr/fr/communiques-de-presse/lautorite-sanctionne-google-hauteur-de-150-meu-pour-abus-de-position, erişim tarihi 13.07.2021.BATHAEE, Yavar, ‘The Artificial Intelligence Black Box and the Failure of Intent and Causation’, Harvard Journal of Law & Technology Sayı: 2, Yıl: 2018, s. 890-938,  https://jolt.law.harvard.edu/assets/articlePDFs/v31/The-Artificial-Intelligence-Black-Box-and-the-Failure-of-Intent-and-Causation-Yavar-Bathaee.pdf, erişim tarihi 10.07.2021.BBC NEWS, Canada Facebook Fined $6.5m Over ‘False’ Privacy Claims, 2020, https://www.bbc.com/news/world-us-canada-52640785, erişim tarihi 13.07.2021.BBC NEWS, Vote Leave’s Targeted Brexit Ads Released by Facebook, 2018, https://www.bbc.com/news/uk-politics-44966969, erişim tarihi 26.04.2021.BOERMAN, Sophie / KRUIKEMEIER, Sanne / ZUIDERVEEN BORGESIUS, Fre-derik, ‘Online Behavioral Advertising: A Literature Review and Research Agenda’, Journal of Advertising, Sayı: 3, Yıl: 2017, s. 363-376, https://www.tandfonline.com/doi/full/10.1080/00913367.2017.1339368, erişim tarihi 15.07.2021.T.C. MALTEPE ÜNİVERSİTESİ • Hukuk Fakültesi Dergisi • 2021 / 1Dijital Reklamcılığın Yol Açtığı Hukuki Sorunlar ve Çözüm Önerileri 81CAMBRIDGE  DICTIONARY,  https://dictionary.cambridge.org,  erişim  tarihi 26.04.2021.COMPETITION AND MARKETS AUTHORITY, Celebrities Pledge to Clean Up Their Act on Social Media, 2019, https://www.gov.uk/government/news/celebrities-pledge-to-clean-up-their-act-on-social-media, erişim tarihi 26.04.2021.CONGRESSIONAL RESEARCH SERVICE, Antitrust and Big Tech”, 2019, https://crsreports.congress.gov/product/pdf/R/R45910, erişim tarihi 13.07.2021.COŞKUN KARADAĞ, Neslihan, İnternet Ortamında Verilen Reklam Hizmetlerinin Vergilendirilmesi, Vergi Raporu, Sayı: 236, Yıl: 2019, s. 74-89, https://vergiraporu.com.tr/upImage/org/4f523520.pdf, erişim tarihi 15.07.2021.CUMHURİYET GAZETESİ, Sosyal Medya Platformlarına 10’ar milyon TL Ceza, 2020,  https://www.cumhuriyet.com.tr/haber/sosyal-medya-platformlarina-10ar-milyon-tl-ceza-1788376, erişim tarihi 26.04.2021.CUMHURİYET GAZETESİ, TikTok’tan, Türkiye’ye temsilci atama kararı, 2021, https://www.cumhuriyet.com.tr/haber/tiktoktan-turkiyeye-temsilci-atama-kara-ri-1804652, erişim tarihi 26.04.2021.DATTA, Amit / TSCHANTZ, Michael Carl / DATTA, Anupam, ‘Automated Experi-ments on Ad Privacy Settings: A Tale of Opacity, Choice, and Discrimination’, Pro-ceedings on Privacy Enhancing Technologies, Sayı: 1, Yıl: 2014, https://arxiv.org/abs/1408.6491, erişim tarihi 10.07.2021.DELOITTE, Türkiye’de Tahmini Medya ve Reklam Yatırımları - 2020 İlk 6 Ay Raporu, 2020.DOLATA, Ulrich, ‘Apple, Amazon, Google, Facebook, Microsoft. Market Concentration - Competition - Innovation Strategies’, SOI discussion paper, Sayı: 1, Yıl: 2017, ss. 33, https://www.econstor.eu/bitstream/10419/152249/1/8803286020.pdf, erişim tarihi 26.04.2021.DÜLGER, Murat Volkan / ÖZKAN, Onur, Sosyal Medya Yasa Tasarısı Hakkında Gö-rüşümüz, Academia.edu, 2020, ss. 13, https://www.academia.edu/43729381/Sosyal_Medya_Yasa_Tasarısı_Hakkında_Görüşümüz, erişim tarihi 26.04.2021.ERGİN, Numan Emre, ‘Fenomenlerin Faaliyeti Emek ve Şöhrete Dayanıyor’, Platin, 2021, https://www.platinonline.com/yazarlar/av-dr-numan-emre-ergin/fenomenlerin-faaliyeti-emek-ve-sohrete-dayaniyor-1076527, erişim tarihi 26.04.2021.ERGİN, Numan Emre, Dijital Hizmet Vergisi’ne İlişkin Değerlendirmeler, Dünya Gaze-tesi, 2020, https://www.dunya.com/kose-yazisi/dijital-hizmet-vergisine-iliskin-deger-lendirmeler/468782, erişim tarihi 26.04.2021.ERGİN, Numan Emre, Sosyal Medya Şirketlerine Kesilen Cezalar ve Vergi, Dünya Ga-zetesi, 2020, https://www.dunya.com/kose-yazisi/sosyal-medya-sirketlerine-kesilen-cezalar-ve-vergi/488179, erişim tarihi 26.04.2021.EUROPEAN COMMISSION, Antitrust: Commission Fines Google €1.49 Billion for Abusive Practices in Online Advertising, 2019, https://ec.europa.eu/commission/presscorner/detail/en/IP_19_1770, erişim tarihi 26.04.2021.T.C. MALTEPE ÜNİVERSİTESİ • Hukuk Fakültesi Dergisi • 2021 / 182 Dr. Öğr. Üyesi Mete TEVETOĞLU - Av. Betül ÇOLAKEUROPEAN  COMMISSION,  Cookies,  https://wikis.ec.europa.eu/display/WEBGUIDE/04.+Cookies, erişim tarihi 26.04.2021.EUROPEAN ECONOMIC AND SOCIAL COMMITTEE, Artificial Intelligence: EU law should set safe boundaries for high-risk applications, says EESC, 2020, https://bit.ly/3fm7quX, erişim tarihi 26.04.2021.EUROPEAN PARLIAMENT, Is Data the New Oil?, 2020, ss. 8, https://www.europarl.europa.eu/RegData/etudes/BRIE/2020/646117/EPRS_BRI(2020)646117_EN.pdf, erişim tarihi 26.04.2021.FEDARAL TRADE COMMISSION, FTC Staff Reminds Influencers and Brands to  Clearly  Disclose  Relationship,  2017,  https://www.ftc.gov/news-events/press-releases/2017/04/ftc-staff-reminds-influencers-brands-clearly-disclose,  erişim  tarihi 26.04.2021.FEDERAL TRADE COMISSION, FTC Imposes $5 Billion Penalty and Sweeping New Privacy  Restrictions  on  Facebook,  2019,  https://www.ftc.gov/news-events/press-releases/2019/07/ftc-imposes-5-billion-penalty-sweeping-new-privacy-restrictions, erişim tarihi 13.07.2021.FINANCIAL EXPRESS, Google, Facebook Dominate Digital Advertising; Check How Much of the $88-Billion Market They Control, 2018, https://bit.ly/3j9Ikk4, erişim ta-rihi 26.04.2021.FONTE, Giuseppe / JONES, Gavin, Italy’s Renzi Faces Uphill Struggle Over Google Tax Plan, Reuters, 2015, http://www.reuters.com/article/us-italy-tax-internetanalysis-idUSKCN0RU1HS20150930, erişim tarihi 26.04.2021.FUTBOL MEDYA, Ronaldo Shook the World! The Sponsor Lifted the Cola-Cola from the Table, Said Drink Water”, https://www.youtube.com/watch?v=Ulw3SsFlCTs, erişim tarihi 08.07.2021.GEDİK, Yasemin, ‘E-Posta Pazarlama: Teorik Bir Bakış’, Uluslararası Yönetim Akade-misi Dergisi, Cilt: 3, Sayı: 2, Yıl: 2020, https://bit.ly/3fiI9BX, erişim tarihi 14.07.2021.GOOGLE, Google Ads Yardım, https://support.google.com, erişim tarihi 26.04.2021.GÖKDEMİR, Şaduman Şeyda / AKINCI, Semra, ‘Çevrimiçi Davranışsal Reklamcılığa Yönelik Tüketici Tutumları ve Mahremiyet Endişeleri’, Erciyes İletişim Dergisi Ulus-lararası Dijital Çağda İletişim Sempozyumu Özel Sayısı, Sayı: 1, Yıl: 2019, s. 21-38, https://doi.org/10.17680/erciyesiletisim.483907, erişim tarihi 14.07.2021.GÖRKEY, Dilek, İnternet Reklamcılığı: Etik ve Hukuk Sorunsalı, Yayınlanmamış Yüksek Lisans Tezi, İstanbul Üniversitesi Sosyal Bilimler Enstitüsü, İstanbul, 2008, https://bit.ly/2TPpqGE, erişim tarihi 11.07.2021.GÜRKAYNAK, Gönenç / DURLU GÜRZUMAR, Derya, ‘İnternetin Ezber Bozan Or-tamında ve Yenilikçi Dijital Pazarlarda Rekabet Hukuku Eğilimleri’, Rekabet Dergi-si, Sayı: 2, Yıl: 2015, s. 43-111, https://www.jurix.com.tr/article/8192, erişim tarihi 26.04.2021.GÜRKAYNAK, Gönenç / YILMAZ, İlay / KARA, Pınar, Türk İnternet Hukuku Uy-gulamasının ve Mevzuatının Evriminin İlk Dönemini Tamamlaması İçin Öneriler ve Gözlemler, s. 2- 12, https://bit.ly/3lnZm0z, erişim tarihi 15.07.2021.T.C. MALTEPE ÜNİVERSİTESİ • Hukuk Fakültesi Dergisi • 2021 / 1Dijital Reklamcılığın Yol Açtığı Hukuki Sorunlar ve Çözüm Önerileri 83ILGIN, Hicran Özlem, ‘Advergaming ve Marka İlişkisi’, The Turkish Online Journal of Desing, Art and Communication (TOJDAC), Cilt: 3, Sayı: 1, Yıl: 2013, s. 24-33, https://studylibtr.com/doc/5698880/advergaming-ve-marka-ilişkisi, erişim tarihi 15.07.2021.IRMAK, İsmet, Reklam Hukuku ve Aldatıcı/Yanıltıcı Reklamlar, Yayınlanmamış Yüksek Lisans Tezi, Ege Üniversitesi Sosyal Bilimler Enstitüsü, İzmir, 2009, https://www.ulusaltezmerkezi.net/reklam-hukuku-ve-aldatici-reklamlar/, erişim tarihi 07.07.2021.JOHNSON, Joseph, Google: Annual Advertising Revenue 2001-2020, Statista, 2021, https://www.statista.com/statistics/266249/advertising-revenue-of-google/, erişim ta-rihi 26.04.2021.KABAN KADIOĞLU, Zeynep, ‘Uluslararası İletişim Düzeninde İnternet Tabanlı Kü-resel İletişim Şirketlerinin Rekabet Ortamları, Büyüme Stratejileri ve Toplumsal Dış-sallıkları: Microsoft, Apple, Google ve Facebook’, Erciyes İletişim Dergisi Uluslara-rası Dijital Çağda İletişim Sempozyumu Özel Sayısı, Sayı: 1, Yıl: 2019, s. 225-244, https://dergipark.org.tr/en/download/article-file/645249, erişim tarihi 26.04.2021.KALAN, Özlem, ‘Yeni Medyada Reklam ve Etik Sorunlar’, Atatürk İletişim Dergisi, Sayı: 10, Yıl: 2006, s. 71-89, https://dergipark.org.tr/tr/download/article-file/397951, erişim tarihi 14.07.2021.KARA, Mustafa Cemil / ÖZ, Ersan, ‘Dijital Vergilendirmeye Küresel Bir Bakış’, Vergi Dünyası, Sayı: 424, Yıl: 2016, s. 30-37, http://www.ersanoz.com/makaleler/15-12-2016-dijital-vergilendirmeye-kuresel-bir-bakis.pdf, erişim tarihi 15.07.2021.KETIZMEN, Muammer / KART, Aslıhan, ‘Kişisel veri ve rekabet hukuku kapsamında Big data”‘, Kişisel Verileri Koruma Dergisi, Sayı: 1, Yıl: 2019, s. 64-76, https://dergipark.org.tr/tr/download/article-file/738261, erişim tarihi 14.07.2021.KIRCOVA, İbrahim, İnternette Pazarlama, Beta Yayıncılık, İstanbul, 2012.KOCAMAN, Berk, Zihinleri ‘Shift’ Etmenin Zamanı Geldi!, Marketing Türkiye, 2021, https://www.marketingturkiye.com.tr/haberler/berk-kocaman-yazdi-bugun-neden-farkli/, erişim tarihi 26.04.2021.KOÇYİĞİT, Ahmet, Geleneksel Reklamcılıktan Dijital Reklamcılığa Geçiş, Sosyal Medya Reklamcılığı ve Ortaya Çıkan Sorunlar, Yayınlanmamış Yüksek Lisans Tezi, Gazi Üniversitesi Sosyal Bilimler Enstitüsü, Ankara, 2017, https://bit.ly/37cibeP, eri-şim tarihi 14.07.2021.KOETSIER, John, Digital Duopoly Declining? Facebook’s, Google’s Share of Digi-tal Ad Dollars Dropping, Forbes, 2018, https://www.forbes.com/sites/johnkoetsi-er/2018/03/19/digital-duopoly-declining-facebooks-googles-share-of-digital-ad-dollars-dropping/?sh=780a5ebd60a8, erişim tarihi 26.04.2021.LOMAS, Natasha, Competition Challenge to Facebook’s ‘Superprofiling’ of Users Sparks  Referral  to  Europe’s  Top  Court,  Techcrunch,  2021,  https://techcrunch.com/2021/03/24/competition-challenge-to-facebooks-superprofiling-of-users-sparks-referral-to-europes-top-court/, erişim tarihi 26.04.2021.MESTÇİ, Aytaç, Tanıtım ve Pazarlamanın Yeni Rekabet Alanı: İnternette Reklamcılık, Pusula Yayıncılık, İstanbul, 2013.T.C. MALTEPE ÜNİVERSİTESİ • Hukuk Fakültesi Dergisi • 2021 / 184 Dr. Öğr. Üyesi Mete TEVETOĞLU - Av. Betül ÇOLAKNTV, Dailymotion Türkiye’ye Temsilci Atadı, 2021, https://www.ntv.com.tr/teknoloji/dailymotion-turkiyeye-temsilci-atadi,bwsze-FDX0qZW2fUJm-Ulg,  erişim  tarihi 26.04.2021.NTV, Twitter da Türkiye’de Temsilci Atıyor, 2021, https://www.ntv.com.tr/teknoloji/twitter-da-turkiyede-temsilci-atiyor,09VL6m45o0G-3lXPB71rWQ,  erişim  tarihi 26.04.2021.OFFICE  OF  THE  UNITED  STATES  TRADE  REPRESENTATIVE,  Re-port  on  Turkey’s  Digital  Services  Tax,  2021,  https://ustr.gov/sites/default/files/enforcement/301Investigations/Report%20on%20Turkey%E2%80%99s%20Digi-tal%20Services%20Tax.pdf, erişim tarihi 26.04.2021.OĞUZ, Sefer, ‘Telif Hakkı İhlallerinden İnternet Servis Sağlayıcıların Sorumlulukları’, Ankara Hacı Bayram Veli Üniversitesi Hukuk Fakültesi Dergisi, Cilt: 12, Sayı: 1, Yıl: 2008, s. 149-184.OXFORD LEARNER’S DICTIONARIES, www.oxfordlearnersdictionaries.com, eri-şim tarihi 26.04.2021.ÖZBAKIR, Ali Fuat, İnternet Servis Sağlayıcılarının Hukuki Sorumluluğu, Yayınlanma-mış Yüksek Lisans Tezi, Kadir Has Üniversitesi Sosyal Bilimler Enstitüsü, İstanbul, 2016, https://bit.ly/3ifdpna, erişim tarihi 08.07.2021.ÖZDEMİR, Semih Sırrı / DOĞANAY, M. Zahid, ‘Bir Mecra Olarak Sosyal Medyanın Reklam Hukuku Açısından Değerlendirilmesi’, Uyuşmazlık Mahkemesi Dergisi, Sayı: 13, Yıl: 2019, s. 295-337, https://dergipark.org.tr/tr/download/article-file/742604, eri-şim tarihi 26.04.2021.PEKTAŞ, Hasip, ‘Reklâm Nedir? İşlevi ve Etkileri Nelerdir?’, Ondokuz Mayıs Üniver-sitesi Eğitim Fakültesi Dergisi, Cilt: 2, Sayı: 1, s. 221-230, https://dergipark.org.tr/tr/download/article-file/188293, erişim tarihi 26.04.2021.POLATER, Salih, ‘Kişisel Verilerin Reklam Amaçlı İşlenmesinde Hukuka Uygunluk Se-bepleri’, Kişisel Verileri Koruma Dergisi, Sayı: 1, Yıl: 2019, s. 1-20, https://dergipark.org.tr/tr/download/article-file/741785, erişim tarihi 26.04.2021.REUTERS, U.S. to Announce, But Defer, Retaliation Over French Digital Tax: USTR, 2020, https://www.reuters.com/article/us-usa-trade-france-digital-idUSKBN24A377, erişim tarihi 8.07.2021.SAĞLI, Ahmet, Türkiye’de Dijital Ekonominin Vergilendirilmesi, EY, 2020, https://www.ey.com/tr_tr/tax/turkiyede-dijital-ekonominin-vergilendirilmesi,  erişim  tarihi 26.04.2021.SAYAN, Ömer Fatih, Twitter, 2021, https://twitter.com/ofatihsayan/status/1350408379190161408?s=20, erişim tarihi 26.04.2021.SCOTT,  David  Meerman,  Pazarlamanın  ve  İletişimin  Yeni  Kuralları:  Alıcılara Doğrudan Ulaşmak İçin Basın Bültenleri, Bloglar, Pod Yayını, Viral Pazarlama ve Online Medyadan Nasıl Faydalanılır?, (çev. ÖZATA, Nadir), MediaCat Yayıncılık, İstanbul, 2009.SOLON, Olvia, Facebook’s Failure: Did Fake News and Polarized Politics Get Trump Elected?, The Guardian, 2016, https://bit.ly/3CdNYdI, erişim tarihi 26.04.2021.T.C. MALTEPE ÜNİVERSİTESİ • Hukuk Fakültesi Dergisi • 2021 / 1Dijital Reklamcılığın Yol Açtığı Hukuki Sorunlar ve Çözüm Önerileri 85SPOTMAGAZINE,  Coca-Cola  by  Cristiano  Ronaldo,  https://www.youtube.com/watch?v=ssLdptnMAUM&t=8s, erişim tarihi 08.07.2021.SPUTNIK, Facebook: Türkiye’ye temsilci atama sürecini başlatmaya karar verdik, 2021, https://tr.sputniknews.com/turkiye/202101181043600290-facebook-turkiyeye-temsilci-atama-surecini-baslatmaya-karar-verdik/, erişim tarihi 26.04.2021.SPUTNIK, LinkedIn, Türkiye’ye Temsilci Atayacak, 2021, https://tr.sputniknews.com/turkiye/202101161043590544-linkedin-turkiyeye-temsilci-atayacak/,  erişim  tarihi 26.04.2021.STATISTA, Average Weekly Hours Spent Playing Video Games in Selected Countri-es Worldwide as of January 2021, 2021, https://www.statista.com/statistics/273829/average-game-hours-per-day-of-video-gamers-in-selected-countries/,  erişim  tarihi 26.04.2021.STATISTA, Most Popular Social Networks Worldwide as of January 2021-Ranked by Number of Active Users, 2021, https://www.statista.com/statistics/272014/global-social-networks-ranked-by-number-of-users/, erişim tarihi 26.04.2021.SÜAR, Arda, ‘Sosyal Medyanın Geleneksel Reklam Araçlarına Göre Hedef Kitle Belir-lemedeki Avantajları’, Kocaeli Üniversitesi, Online Academic Journal of Information Technology, Sayı: 28, Yıl: 2017, Kocaeli, https://dergipark.org.tr/tr/download/article-file/1113916, erişim tarihi 14.07.2021.ŞAHİNCİ, Dilek, İnternette Aldatıcı Reklam ve Reklam Verenlerin Sorumluluğu, Seçkin Yayıncılık, Ankara, 2011.T24 ELEKTRONİK GAZETE, Türkiye’de Temsilci Bulundurmayan Sosyal Medya Platformlarına İkinci Ceza: 30’ar milyon TL, 2020, https://bit.ly/3j41Iis, erişim tarihi 26.04.2021.TANDOĞDU, Gökçe Naz, Sosyal Medya Etkileyicisinin Hukuka Aykırı Reklamları Ne-deniyle Doğan Zararlardan Sorumluluğu, Yayınlanmamış Yüksek Lisans Tezi, Koç Üniversitesi Sosyal Bilimler Enstitüsü, İstanbul, 2019, https://tez.yok.gov.tr/Ulusal-TezMerkezi/tezDetay.jsp?id=ifNRs23GWitQNh2nbDQjPQ&no=OzczoEq2jAxAVJNMs4FMDQ, erişim tarihi 14.07.2021.TANKOVSKA, Hristina, Facebook’s Advertising Revenue Worldwide from 2009 To 2020,  Statista,  2021,  https://www.statista.com/statistics/271258/facebooks-adverti-sing-revenue-worldwide/, erişim tarihi 26.04.2021.TANKOVSKA, Hristina, Facebook: Annual Revenue 2009-2020, By Segment, Statis-ta,  2021,  https://www.statista.com/statistics/267031/facebooks-annual-revenue-by-segment/, erişim tarihi 26.04.2021.TAŞKAYA, Merih / TALAY, Ömür, ‘Dijital Gözetimin Pazarlama Amaçlı Aracıları: Çerezler” ve Çerez Kullanımında Açık Rıza”‘, Akdeniz Üniversitesi İletişim Fa-kültesi Dergisi, Sayı: 31, Yıl: 2019, s. 356-376, https://dergipark.org.tr/tr/pub/akil/article/534603, erişim tarihi 15.07.2021.TEVETOĞLU, Mete, ‘Advertising Practices in Searching Engines and Arising Dispu-tes’, Prof. Dr. Mehmet Akad’a Armağan, İstanbul 2021, s. 831-866.T.C. MALTEPE ÜNİVERSİTESİ • Hukuk Fakültesi Dergisi • 2021 / 186 Dr. Öğr. Üyesi Mete TEVETOĞLU - Av. Betül ÇOLAKTHE INFORMATION COMMISSIONER’S OFFICE, ICO issues maximum £500,000 fine to Facebook for failing to protect users’ personal information, 2018, https://bit.ly/3xpKDVd, erişim tarihi 15.07.2021.THE UNITED STATES TRADE REPRESENTATIVE, Initiation of Section 301 In-vestigations of Digital Services Taxes, 2020, https://ustr.gov/sites/default/files/assets/frn/FRN.pdf, erişim tarihi 8.07.2021.TOLU, Abdullah,  ‘Google,  Facebook,  Instagram,  Amazon  ve  Twitter  Reklamları-na  Stopaja  Yargı  Freni’,  https://www.dunya.com/kose-yazisi/google-facebook-instagram-amazon-ve-twitter-reklamlarina-stopaja-yargi-freni/603464 (erişim tarihi 25.09.2021).TRT HABER, Arnavutluk’taki Basın Toplantısına THY Arası, https://www.youtube.com/watch?v=dAphttps://www.youtube.com/watch?v=dApReSLfQV0ReSLfQV0, erişim tarihi 08.07.2021.TÜRK DİL KURUMU, Büyük Türkçe Sözlük, www.tdk.gov.tr, erişim tarihi 26.04.2021.U.S. HOUSE OF REPRESENTATIVE, Investigation of Competition in Digital Mar-kets-Majority Staff Report and Recommendations, 2020, https://judiciary.house.gov/uploadedfiles/competition_in_digital_markets.pdf?utm_campaign=4493-519, erişim tarihi 10.07.2021.ULUSLARARASI  TİCARET  ODASI,  Uluslararası  Reklam  Uygulama  Esasları, https://ird.org.tr/assets/pdf/icc-20.pdf, erişim tarihi 26.04.2021.US TRADE REPRESENTATIVE OFFICE, USTR Announces Initiation of Section 301 Investigation into France’s Digital Services Tax, 2019, https://ustr.gov/about-us/policy-offices/press-office/press-releases/2019/july/ustr-announces-initiation-section-30, erişim tarihi 26.04.2021.VESTAGER, Margrethe, Competition in a Big Data World, European Commission, 2016,  https://wayback.archive-it.org/12090/20191129204050/https://ec.europa.eu/commission/commissioners/2014-2019/vestager/announcements/competition-big-data-world_en, erişim tarihi 26.04.2021.WHITE, Tiffany Barnett / ZAHAY, Debra / THORBJØRNSEN, Helge / SHAVITT, Sharon, ‘Getting Too Personal: Reactance to Highly Personalized Email Solicitati-ons’, Marketing Letters, Sayı: 19(1), Yıl: 2008, s. 39-50, https://www.researchgate.net/publication/5153026, erişim tarihi 15.07.2021.WONG, Julia Carrie, Mark Zuckerberg Apologises for Facebook’s ‘Mistakes’ Over Cambridge Analytica, The Guardian, 2018, https://www.theguardian.com/techno-logy/2018/mar/21/mark-zuckerberg-response-facebook-cambridge-analytica,  erişim tarihi 26.04.2021.ZEVKLİLER, Aydın / ÖZEL, Çağlar, Tüketicilerin Korunması Hukuku, Seçkin Yayın-cılık, Ankara, 2016.T.C. MALTEPE ÜNİVERSİTESİ • Hukuk Fakültesi Dergisi • 2021 / 1",
     "Kaynakça": "AASLAID, Katrina, 50 Examples of Corporatıons that Failed to Innovate, Valuer, 2019, https://www.valuer.ai/blog/50-examples-of-corporations-that-failed-to-innovate-and-missed-their-chance, erişim tarihi 11.07.2021.ADSOFTEHWORLD, IKEA Cristiano, https://www.adsoftheworld.com/media/digital/ikea_cristiano, erişim tarihi 08.07.2021.AKKAYA, Hüseyin / GERÇEK, Adnan, ‘OECD ve Seçilmiş Bazı Ülkelerde Dijital Eko-nominin Vergilendirilmesi: Türkiye İçin Çıkarımlar’, International Journal of Public Finance, Sayı: 2, Yıl: 2019, s. 166-188, https://dergipark.org.tr/en/download/article-file/906759, erişim tarihi 15.07.2021.AKSOY, Ramazan, İnternet Ortamında Pazarlama, Seçkin Yayıncılık, Ankara, 2009.ALBAY, Nurettin, ‘Geleneksel Pazarlamadan Yeni Pazarlama Yaklaşımlarına Geçiş Süreci’, Süleyman Demirel Üniversitesi İktisadi ve İdari Bilimler Fakültesi Dergisi, Sayı: 2, Yıl: 2010, s. 222, https://dergipark.org.tr/tr/download/article-file/194577, eri-şim tarihi 14.07.2021.ALI, Muhammad / SAPIEZYNSKI, Piotr / BOGEN, Miranda / KOROLOVA, Alek-sandra / MISLOVE, Alan / REIKE, Aaron, ‘Discrimination through optimization: How Facebook’s ad delivery can lead to skewed outcomes’, Proceedings of the ACM on Human-Computer Interaction, Sayı: 3, Yıl: 2019, https://arxiv.org/abs/1904.02095, erişim tarihi 26.04.2021.ARSLAN, Elif, ‘Sosyal Medyada Yeni Bir Reklam Türü Olarak Kullanılan Native (Do-ğal) Reklam’, PressAcademia Procedia, Cilt: 9, İstanbul, 2019, s. 269-273, http://www.pressacademia.org/archives/pap/v9/50.pdf, erişim tarihi 14.07.2021.ATAMANIUK, Mary, Which Company Uses the Most of Your Data?, Clario Blog, 2021, https://clario.co/blog/which-company-uses-most-data/, erişim tarihi 26.04.2021.AUTORITÉ DE LA CONCURENCE, L’Autorité Sanctionne Google À Hauteur De 150 M€ Pour Abus De Position Dominante, 2019, https://www.autoritedelaconcurrence.fr/fr/communiques-de-presse/lautorite-sanctionne-google-hauteur-de-150-meu-pour-abus-de-position, erişim tarihi 13.07.2021.BATHAEE, Yavar, ‘The Artificial Intelligence Black Box and the Failure of Intent and Causation’, Harvard Journal of Law & Technology Sayı: 2, Yıl: 2018, s. 890-938,  https://jolt.law.harvard.edu/assets/articlePDFs/v31/The-Artificial-Intelligence-Black-Box-and-the-Failure-of-Intent-and-Causation-Yavar-Bathaee.pdf, erişim tarihi 10.07.2021.BBC NEWS, Canada Facebook Fined $6.5m Over ‘False’ Privacy Claims, 2020, https://www.bbc.com/news/world-us-canada-52640785, erişim tarihi 13.07.2021.BBC NEWS, Vote Leave’s Targeted Brexit Ads Released by Facebook, 2018, https://www.bbc.com/news/uk-politics-44966969, erişim tarihi 26.04.2021.BOERMAN, Sophie / KRUIKEMEIER, Sanne / ZUIDERVEEN BORGESIUS, Fre-derik, ‘Online Behavioral Advertising: A Literature Review and Research Agenda’, Journal of Advertising, Sayı: 3, Yıl: 2017, s. 363-376, https://www.tandfonline.com/doi/full/10.1080/00913367.2017.1339368, erişim tarihi 15.07.2021.T.C. MALTEPE ÜNİVERSİTESİ • Hukuk Fakültesi Dergisi • 2021 / 1Dijital Reklamcılığın Yol Açtığı Hukuki Sorunlar ve Çözüm Önerileri 81CAMBRIDGE  DICTIONARY,  https://dictionary.cambridge.org,  erişim  tarihi 26.04.2021.COMPETITION AND MARKETS AUTHORITY, Celebrities Pledge to Clean Up Their Act on Social Media, 2019, https://www.gov.uk/government/news/celebrities-pledge-to-clean-up-their-act-on-social-media, erişim tarihi 26.04.2021.CONGRESSIONAL RESEARCH SERVICE, Antitrust and Big Tech”, 2019, https://crsreports.congress.gov/product/pdf/R/R45910, erişim tarihi 13.07.2021.COŞKUN KARADAĞ, Neslihan, İnternet Ortamında Verilen Reklam Hizmetlerinin Vergilendirilmesi, Vergi Raporu, Sayı: 236, Yıl: 2019, s. 74-89, https://vergiraporu.com.tr/upImage/org/4f523520.pdf, erişim tarihi 15.07.2021.CUMHURİYET GAZETESİ, Sosyal Medya Platformlarına 10’ar milyon TL Ceza, 2020,  https://www.cumhuriyet.com.tr/haber/sosyal-medya-platformlarina-10ar-milyon-tl-ceza-1788376, erişim tarihi 26.04.2021.CUMHURİYET GAZETESİ, TikTok’tan, Türkiye’ye temsilci atama kararı, 2021, https://www.cumhuriyet.com.tr/haber/tiktoktan-turkiyeye-temsilci-atama-kara-ri-1804652, erişim tarihi 26.04.2021.DATTA, Amit / TSCHANTZ, Michael Carl / DATTA, Anupam, ‘Automated Experi-ments on Ad Privacy Settings: A Tale of Opacity, Choice, and Discrimination’, Pro-ceedings on Privacy Enhancing Technologies, Sayı: 1, Yıl: 2014, https://arxiv.org/abs/1408.6491, erişim tarihi 10.07.2021.DELOITTE, Türkiye’de Tahmini Medya ve Reklam Yatırımları - 2020 İlk 6 Ay Raporu, 2020.DOLATA, Ulrich, ‘Apple, Amazon, Google, Facebook, Microsoft. Market Concentration - Competition - Innovation Strategies’, SOI discussion paper, Sayı: 1, Yıl: 2017, ss. 33, https://www.econstor.eu/bitstream/10419/152249/1/8803286020.pdf, erişim tarihi 26.04.2021.DÜLGER, Murat Volkan / ÖZKAN, Onur, Sosyal Medya Yasa Tasarısı Hakkında Gö-rüşümüz, Academia.edu, 2020, ss. 13, https://www.academia.edu/43729381/Sosyal_Medya_Yasa_Tasarısı_Hakkında_Görüşümüz, erişim tarihi 26.04.2021.ERGİN, Numan Emre, ‘Fenomenlerin Faaliyeti Emek ve Şöhrete Dayanıyor’, Platin, 2021, https://www.platinonline.com/yazarlar/av-dr-numan-emre-ergin/fenomenlerin-faaliyeti-emek-ve-sohrete-dayaniyor-1076527, erişim tarihi 26.04.2021.ERGİN, Numan Emre, Dijital Hizmet Vergisi’ne İlişkin Değerlendirmeler, Dünya Gaze-tesi, 2020, https://www.dunya.com/kose-yazisi/dijital-hizmet-vergisine-iliskin-deger-lendirmeler/468782, erişim tarihi 26.04.2021.ERGİN, Numan Emre, Sosyal Medya Şirketlerine Kesilen Cezalar ve Vergi, Dünya Ga-zetesi, 2020, https://www.dunya.com/kose-yazisi/sosyal-medya-sirketlerine-kesilen-cezalar-ve-vergi/488179, erişim tarihi 26.04.2021.EUROPEAN COMMISSION, Antitrust: Commission Fines Google €1.49 Billion for Abusive Practices in Online Advertising, 2019, https://ec.europa.eu/commission/presscorner/detail/en/IP_19_1770, erişim tarihi 26.04.2021.T.C. MALTEPE ÜNİVERSİTESİ • Hukuk Fakültesi Dergisi • 2021 / 182 Dr. Öğr. Üyesi Mete TEVETOĞLU - Av. Betül ÇOLAKEUROPEAN  COMMISSION,  Cookies,  https://wikis.ec.europa.eu/display/WEBGUIDE/04.+Cookies, erişim tarihi 26.04.2021.EUROPEAN ECONOMIC AND SOCIAL COMMITTEE, Artificial Intelligence: EU law should set safe boundaries for high-risk applications, says EESC, 2020, https://bit.ly/3fm7quX, erişim tarihi 26.04.2021.EUROPEAN PARLIAMENT, Is Data the New Oil?, 2020, ss. 8, https://www.europarl.europa.eu/RegData/etudes/BRIE/2020/646117/EPRS_BRI(2020)646117_EN.pdf, erişim tarihi 26.04.2021.FEDARAL TRADE COMMISSION, FTC Staff Reminds Influencers and Brands to  Clearly  Disclose  Relationship,  2017,  https://www.ftc.gov/news-events/press-releases/2017/04/ftc-staff-reminds-influencers-brands-clearly-disclose,  erişim  tarihi 26.04.2021.FEDERAL TRADE COMISSION, FTC Imposes $5 Billion Penalty and Sweeping New Privacy  Restrictions  on  Facebook,  2019,  https://www.ftc.gov/news-events/press-releases/2019/07/ftc-imposes-5-billion-penalty-sweeping-new-privacy-restrictions, erişim tarihi 13.07.2021.FINANCIAL EXPRESS, Google, Facebook Dominate Digital Advertising; Check How Much of the $88-Billion Market They Control, 2018, https://bit.ly/3j9Ikk4, erişim ta-rihi 26.04.2021.FONTE, Giuseppe / JONES, Gavin, Italy’s Renzi Faces Uphill Struggle Over Google Tax Plan, Reuters, 2015, http://www.reuters.com/article/us-italy-tax-internetanalysis-idUSKCN0RU1HS20150930, erişim tarihi 26.04.2021.FUTBOL MEDYA, Ronaldo Shook the World! The Sponsor Lifted the Cola-Cola from the Table, Said Drink Water”, https://www.youtube.com/watch?v=Ulw3SsFlCTs, erişim tarihi 08.07.2021.GEDİK, Yasemin, ‘E-Posta Pazarlama: Teorik Bir Bakış’, Uluslararası Yönetim Akade-misi Dergisi, Cilt: 3, Sayı: 2, Yıl: 2020, https://bit.ly/3fiI9BX, erişim tarihi 14.07.2021.GOOGLE, Google Ads Yardım, https://support.google.com, erişim tarihi 26.04.2021.GÖKDEMİR, Şaduman Şeyda / AKINCI, Semra, ‘Çevrimiçi Davranışsal Reklamcılığa Yönelik Tüketici Tutumları ve Mahremiyet Endişeleri’, Erciyes İletişim Dergisi Ulus-lararası Dijital Çağda İletişim Sempozyumu Özel Sayısı, Sayı: 1, Yıl: 2019, s. 21-38, https://doi.org/10.17680/erciyesiletisim.483907, erişim tarihi 14.07.2021.GÖRKEY, Dilek, İnternet Reklamcılığı: Etik ve Hukuk Sorunsalı, Yayınlanmamış Yüksek Lisans Tezi, İstanbul Üniversitesi Sosyal Bilimler Enstitüsü, İstanbul, 2008, https://bit.ly/2TPpqGE, erişim tarihi 11.07.2021.GÜRKAYNAK, Gönenç / DURLU GÜRZUMAR, Derya, ‘İnternetin Ezber Bozan Or-tamında ve Yenilikçi Dijital Pazarlarda Rekabet Hukuku Eğilimleri’, Rekabet Dergi-si, Sayı: 2, Yıl: 2015, s. 43-111, https://www.jurix.com.tr/article/8192, erişim tarihi 26.04.2021.GÜRKAYNAK, Gönenç / YILMAZ, İlay / KARA, Pınar, Türk İnternet Hukuku Uy-gulamasının ve Mevzuatının Evriminin İlk Dönemini Tamamlaması İçin Öneriler ve Gözlemler, s. 2- 12, https://bit.ly/3lnZm0z, erişim tarihi 15.07.2021.T.C. MALTEPE ÜNİVERSİTESİ • Hukuk Fakültesi Dergisi • 2021 / 1Dijital Reklamcılığın Yol Açtığı Hukuki Sorunlar ve Çözüm Önerileri 83ILGIN, Hicran Özlem, ‘Advergaming ve Marka İlişkisi’, The Turkish Online Journal of Desing, Art and Communication (TOJDAC), Cilt: 3, Sayı: 1, Yıl: 2013, s. 24-33, https://studylibtr.com/doc/5698880/advergaming-ve-marka-ilişkisi, erişim tarihi 15.07.2021.IRMAK, İsmet, Reklam Hukuku ve Aldatıcı/Yanıltıcı Reklamlar, Yayınlanmamış Yüksek Lisans Tezi, Ege Üniversitesi Sosyal Bilimler Enstitüsü, İzmir, 2009, https://www.ulusaltezmerkezi.net/reklam-hukuku-ve-aldatici-reklamlar/, erişim tarihi 07.07.2021.JOHNSON, Joseph, Google: Annual Advertising Revenue 2001-2020, Statista, 2021, https://www.statista.com/statistics/266249/advertising-revenue-of-google/, erişim ta-rihi 26.04.2021.KABAN KADIOĞLU, Zeynep, ‘Uluslararası İletişim Düzeninde İnternet Tabanlı Kü-resel İletişim Şirketlerinin Rekabet Ortamları, Büyüme Stratejileri ve Toplumsal Dış-sallıkları: Microsoft, Apple, Google ve Facebook’, Erciyes İletişim Dergisi Uluslara-rası Dijital Çağda İletişim Sempozyumu Özel Sayısı, Sayı: 1, Yıl: 2019, s. 225-244, https://dergipark.org.tr/en/download/article-file/645249, erişim tarihi 26.04.2021.KALAN, Özlem, ‘Yeni Medyada Reklam ve Etik Sorunlar’, Atatürk İletişim Dergisi, Sayı: 10, Yıl: 2006, s. 71-89, https://dergipark.org.tr/tr/download/article-file/397951, erişim tarihi 14.07.2021.KARA, Mustafa Cemil / ÖZ, Ersan, ‘Dijital Vergilendirmeye Küresel Bir Bakış’, Vergi Dünyası, Sayı: 424, Yıl: 2016, s. 30-37, http://www.ersanoz.com/makaleler/15-12-2016-dijital-vergilendirmeye-kuresel-bir-bakis.pdf, erişim tarihi 15.07.2021.KETIZMEN, Muammer / KART, Aslıhan, ‘Kişisel veri ve rekabet hukuku kapsamında Big data”‘, Kişisel Verileri Koruma Dergisi, Sayı: 1, Yıl: 2019, s. 64-76, https://dergipark.org.tr/tr/download/article-file/738261, erişim tarihi 14.07.2021.KIRCOVA, İbrahim, İnternette Pazarlama, Beta Yayıncılık, İstanbul, 2012.KOCAMAN, Berk, Zihinleri ‘Shift’ Etmenin Zamanı Geldi!, Marketing Türkiye, 2021, https://www.marketingturkiye.com.tr/haberler/berk-kocaman-yazdi-bugun-neden-farkli/, erişim tarihi 26.04.2021.KOÇYİĞİT, Ahmet, Geleneksel Reklamcılıktan Dijital Reklamcılığa Geçiş, Sosyal Medya Reklamcılığı ve Ortaya Çıkan Sorunlar, Yayınlanmamış Yüksek Lisans Tezi, Gazi Üniversitesi Sosyal Bilimler Enstitüsü, Ankara, 2017, https://bit.ly/37cibeP, eri-şim tarihi 14.07.2021.KOETSIER, John, Digital Duopoly Declining? Facebook’s, Google’s Share of Digi-tal Ad Dollars Dropping, Forbes, 2018, https://www.forbes.com/sites/johnkoetsi-er/2018/03/19/digital-duopoly-declining-facebooks-googles-share-of-digital-ad-dollars-dropping/?sh=780a5ebd60a8, erişim tarihi 26.04.2021.LOMAS, Natasha, Competition Challenge to Facebook’s ‘Superprofiling’ of Users Sparks  Referral  to  Europe’s  Top  Court,  Techcrunch,  2021,  https://techcrunch.com/2021/03/24/competition-challenge-to-facebooks-superprofiling-of-users-sparks-referral-to-europes-top-court/, erişim tarihi 26.04.2021.MESTÇİ, Aytaç, Tanıtım ve Pazarlamanın Yeni Rekabet Alanı: İnternette Reklamcılık, Pusula Yayıncılık, İstanbul, 2013.T.C. MALTEPE ÜNİVERSİTESİ • Hukuk Fakültesi Dergisi • 2021 / 184 Dr. Öğr. Üyesi Mete TEVETOĞLU - Av. Betül ÇOLAKNTV, Dailymotion Türkiye’ye Temsilci Atadı, 2021, https://www.ntv.com.tr/teknoloji/dailymotion-turkiyeye-temsilci-atadi,bwsze-FDX0qZW2fUJm-Ulg,  erişim  tarihi 26.04.2021.NTV, Twitter da Türkiye’de Temsilci Atıyor, 2021, https://www.ntv.com.tr/teknoloji/twitter-da-turkiyede-temsilci-atiyor,09VL6m45o0G-3lXPB71rWQ,  erişim  tarihi 26.04.2021.OFFICE  OF  THE  UNITED  STATES  TRADE  REPRESENTATIVE,  Re-port  on  Turkey’s  Digital  Services  Tax,  2021,  https://ustr.gov/sites/default/files/enforcement/301Investigations/Report%20on%20Turkey%E2%80%99s%20Digi-tal%20Services%20Tax.pdf, erişim tarihi 26.04.2021.OĞUZ, Sefer, ‘Telif Hakkı İhlallerinden İnternet Servis Sağlayıcıların Sorumlulukları’, Ankara Hacı Bayram Veli Üniversitesi Hukuk Fakültesi Dergisi, Cilt: 12, Sayı: 1, Yıl: 2008, s. 149-184.OXFORD LEARNER’S DICTIONARIES, www.oxfordlearnersdictionaries.com, eri-şim tarihi 26.04.2021.ÖZBAKIR, Ali Fuat, İnternet Servis Sağlayıcılarının Hukuki Sorumluluğu, Yayınlanma-mış Yüksek Lisans Tezi, Kadir Has Üniversitesi Sosyal Bilimler Enstitüsü, İstanbul, 2016, https://bit.ly/3ifdpna, erişim tarihi 08.07.2021.ÖZDEMİR, Semih Sırrı / DOĞANAY, M. Zahid, ‘Bir Mecra Olarak Sosyal Medyanın Reklam Hukuku Açısından Değerlendirilmesi’, Uyuşmazlık Mahkemesi Dergisi, Sayı: 13, Yıl: 2019, s. 295-337, https://dergipark.org.tr/tr/download/article-file/742604, eri-şim tarihi 26.04.2021.PEKTAŞ, Hasip, ‘Reklâm Nedir? İşlevi ve Etkileri Nelerdir?’, Ondokuz Mayıs Üniver-sitesi Eğitim Fakültesi Dergisi, Cilt: 2, Sayı: 1, s. 221-230, https://dergipark.org.tr/tr/download/article-file/188293, erişim tarihi 26.04.2021.POLATER, Salih, ‘Kişisel Verilerin Reklam Amaçlı İşlenmesinde Hukuka Uygunluk Se-bepleri’, Kişisel Verileri Koruma Dergisi, Sayı: 1, Yıl: 2019, s. 1-20, https://dergipark.org.tr/tr/download/article-file/741785, erişim tarihi 26.04.2021.REUTERS, U.S. to Announce, But Defer, Retaliation Over French Digital Tax: USTR, 2020, https://www.reuters.com/article/us-usa-trade-france-digital-idUSKBN24A377, erişim tarihi 8.07.2021.SAĞLI, Ahmet, Türkiye’de Dijital Ekonominin Vergilendirilmesi, EY, 2020, https://www.ey.com/tr_tr/tax/turkiyede-dijital-ekonominin-vergilendirilmesi,  erişim  tarihi 26.04.2021.SAYAN, Ömer Fatih, Twitter, 2021, https://twitter.com/ofatihsayan/status/1350408379190161408?s=20, erişim tarihi 26.04.2021.SCOTT,  David  Meerman,  Pazarlamanın  ve  İletişimin  Yeni  Kuralları:  Alıcılara Doğrudan Ulaşmak İçin Basın Bültenleri, Bloglar, Pod Yayını, Viral Pazarlama ve Online Medyadan Nasıl Faydalanılır?, (çev. ÖZATA, Nadir), MediaCat Yayıncılık, İstanbul, 2009.SOLON, Olvia, Facebook’s Failure: Did Fake News and Polarized Politics Get Trump Elected?, The Guardian, 2016, https://bit.ly/3CdNYdI, erişim tarihi 26.04.2021.T.C. MALTEPE ÜNİVERSİTESİ • Hukuk Fakültesi Dergisi • 2021 / 1Dijital Reklamcılığın Yol Açtığı Hukuki Sorunlar ve Çözüm Önerileri 85SPOTMAGAZINE,  Coca-Cola  by  Cristiano  Ronaldo,  https://www.youtube.com/watch?v=ssLdptnMAUM&t=8s, erişim tarihi 08.07.2021.SPUTNIK, Facebook: Türkiye’ye temsilci atama sürecini başlatmaya karar verdik, 2021, https://tr.sputniknews.com/turkiye/202101181043600290-facebook-turkiyeye-temsilci-atama-surecini-baslatmaya-karar-verdik/, erişim tarihi 26.04.2021.SPUTNIK, LinkedIn, Türkiye’ye Temsilci Atayacak, 2021, https://tr.sputniknews.com/turkiye/202101161043590544-linkedin-turkiyeye-temsilci-atayacak/,  erişim  tarihi 26.04.2021.STATISTA, Average Weekly Hours Spent Playing Video Games in Selected Countri-es Worldwide as of January 2021, 2021, https://www.statista.com/statistics/273829/average-game-hours-per-day-of-video-gamers-in-selected-countries/,  erişim  tarihi 26.04.2021.STATISTA, Most Popular Social Networks Worldwide as of January 2021-Ranked by Number of Active Users, 2021, https://www.statista.com/statistics/272014/global-social-networks-ranked-by-number-of-users/, erişim tarihi 26.04.2021.SÜAR, Arda, ‘Sosyal Medyanın Geleneksel Reklam Araçlarına Göre Hedef Kitle Belir-lemedeki Avantajları’, Kocaeli Üniversitesi, Online Academic Journal of Information Technology, Sayı: 28, Yıl: 2017, Kocaeli, https://dergipark.org.tr/tr/download/article-file/1113916, erişim tarihi 14.07.2021.ŞAHİNCİ, Dilek, İnternette Aldatıcı Reklam ve Reklam Verenlerin Sorumluluğu, Seçkin Yayıncılık, Ankara, 2011.T24 ELEKTRONİK GAZETE, Türkiye’de Temsilci Bulundurmayan Sosyal Medya Platformlarına İkinci Ceza: 30’ar milyon TL, 2020, https://bit.ly/3j41Iis, erişim tarihi 26.04.2021.TANDOĞDU, Gökçe Naz, Sosyal Medya Etkileyicisinin Hukuka Aykırı Reklamları Ne-deniyle Doğan Zararlardan Sorumluluğu, Yayınlanmamış Yüksek Lisans Tezi, Koç Üniversitesi Sosyal Bilimler Enstitüsü, İstanbul, 2019, https://tez.yok.gov.tr/Ulusal-TezMerkezi/tezDetay.jsp?id=ifNRs23GWitQNh2nbDQjPQ&no=OzczoEq2jAxAVJNMs4FMDQ, erişim tarihi 14.07.2021.TANKOVSKA, Hristina, Facebook’s Advertising Revenue Worldwide from 2009 To 2020,  Statista,  2021,  https://www.statista.com/statistics/271258/facebooks-adverti-sing-revenue-worldwide/, erişim tarihi 26.04.2021.TANKOVSKA, Hristina, Facebook: Annual Revenue 2009-2020, By Segment, Statis-ta,  2021,  https://www.statista.com/statistics/267031/facebooks-annual-revenue-by-segment/, erişim tarihi 26.04.2021.TAŞKAYA, Merih / TALAY, Ömür, ‘Dijital Gözetimin Pazarlama Amaçlı Aracıları: Çerezler” ve Çerez Kullanımında Açık Rıza”‘, Akdeniz Üniversitesi İletişim Fa-kültesi Dergisi, Sayı: 31, Yıl: 2019, s. 356-376, https://dergipark.org.tr/tr/pub/akil/article/534603, erişim tarihi 15.07.2021.TEVETOĞLU, Mete, ‘Advertising Practices in Searching Engines and Arising Dispu-tes’, Prof. Dr. Mehmet Akad’a Armağan, İstanbul 2021, s. 831-866.T.C. MALTEPE ÜNİVERSİTESİ • Hukuk Fakültesi Dergisi • 2021 / 186 Dr. Öğr. Üyesi Mete TEVETOĞLU - Av. Betül ÇOLAKTHE INFORMATION COMMISSIONER’S OFFICE, ICO issues maximum £500,000 fine to Facebook for failing to protect users’ personal information, 2018, https://bit.ly/3xpKDVd, erişim tarihi 15.07.2021.THE UNITED STATES TRADE REPRESENTATIVE, Initiation of Section 301 In-vestigations of Digital Services Taxes, 2020, https://ustr.gov/sites/default/files/assets/frn/FRN.pdf, erişim tarihi 8.07.2021.TOLU, Abdullah,  ‘Google,  Facebook,  Instagram,  Amazon  ve  Twitter  Reklamları-na  Stopaja  Yargı  Freni’,  https://www.dunya.com/kose-yazisi/google-facebook-instagram-amazon-ve-twitter-reklamlarina-stopaja-yargi-freni/603464 (erişim tarihi 25.09.2021).TRT HABER, Arnavutluk’taki Basın Toplantısına THY Arası, https://www.youtube.com/watch?v=dAphttps://www.youtube.com/watch?v=dApReSLfQV0ReSLfQV0, erişim tarihi 08.07.2021.TÜRK DİL KURUMU, Büyük Türkçe Sözlük, www.tdk.gov.tr, erişim tarihi 26.04.2021.U.S. HOUSE OF REPRESENTATIVE, Investigation of Competition in Digital Mar-kets-Majority Staff Report and Recommendations, 2020, https://judiciary.house.gov/uploadedfiles/competition_in_digital_markets.pdf?utm_campaign=4493-519, erişim tarihi 10.07.2021.ULUSLARARASI  TİCARET  ODASI,  Uluslararası  Reklam  Uygulama  Esasları, https://ird.org.tr/assets/pdf/icc-20.pdf, erişim tarihi 26.04.2021.US TRADE REPRESENTATIVE OFFICE, USTR Announces Initiation of Section 301 Investigation into France’s Digital Services Tax, 2019, https://ustr.gov/about-us/policy-offices/press-office/press-releases/2019/july/ustr-announces-initiation-section-30, erişim tarihi 26.04.2021.VESTAGER, Margrethe, Competition in a Big Data World, European Commission, 2016,  https://wayback.archive-it.org/12090/20191129204050/https://ec.europa.eu/commission/commissioners/2014-2019/vestager/announcements/competition-big-data-world_en, erişim tarihi 26.04.2021.WHITE, Tiffany Barnett / ZAHAY, Debra / THORBJØRNSEN, Helge / SHAVITT, Sharon, ‘Getting Too Personal: Reactance to Highly Personalized Email Solicitati-ons’, Marketing Letters, Sayı: 19(1), Yıl: 2008, s. 39-50, https://www.researchgate.net/publication/5153026, erişim tarihi 15.07.2021.WONG, Julia Carrie, Mark Zuckerberg Apologises for Facebook’s ‘Mistakes’ Over Cambridge Analytica, The Guardian, 2018, https://www.theguardian.com/techno-logy/2018/mar/21/mark-zuckerberg-response-facebook-cambridge-analytica,  erişim tarihi 26.04.2021.ZEVKLİLER, Aydın / ÖZEL, Çağlar, Tüketicilerin Korunması Hukuku, Seçkin Yayın-cılık, Ankara, 2016.T.C. MALTEPE ÜNİVERSİTESİ • Hukuk Fakültesi Dergisi • 2021 / 1"
}