{
     "Tip": "Makale",
     "Dergi İsmi": "",
     "Üniversite İsmi": "Ankara Üniversitesi",
     "Gün": "",
     "Ay": "",
     "Yıl": "2015",
     "Cilt": "64",
     "Sayı": "1",
     "Başlık": "GAYRİMÜSLİM OSMANLI VATANDAŞLARININ HUKUKİ DURUMUNA İLİŞKİN BİR DEĞERLENDİRME",
     "Title": "A Review of the Legal Status of non Muslims in the Ottoman Empire",
     "Yazar İsmi": [
          "Belkıs KONAN"
     ],
     "Danışman İsmi": "",
     "Anahtar Kelimeler": [
          "Zimmi",
          "Gayrimüslim",
          "Millet sistemi",
          "iltizam",
          "Osmanlı Hukuku",
          "İslam Hukuku"
     ],
     "Keywords": [
          "Zimmis",
          "Ottoman Law",
          "Dhimma",
          "non-muslim",
          "the millet system",
          "Islamic Law"
     ],
     "Özet": "Çok uluslu bir devlet olan Osmanlı İmparatorluğunda, insanlar bugünkü anlamıyla milliyet ayrımı yapılmaksızın sadece mensup oldukları dinlere göre gruplara ayrılmış ve bu çerçevede, halkın neredeyse yarısını oluşturan Yahudiler,  Ermeniler  ve  Rumlar  kimliklerini  yitirmeden  ve  müslüman olmaya  zorlanmadan  devlet  sona  erene  kadar  birlikte  yaşamışlardır.  Bir İslam Devleti olan Osmanlı Devletinde, klasik dönemde müslüman olmayan gruplar  İslam  hukukunun  kurallarına  uygun  olarak  zimmet  antlaşması kapsamında  İslam  güvencesinden  yararlanmışlardır.  Tanzimat  döneminde yapılan düzenlemelerle halk arasında eşitlik sağlanmaya çalışılırken, zimmet kurumuna ilişkin bir çok kural değiştirilmiştir. Araştırmamızda gayrimüslim vatandaşlarının kamu hukuku ve özel hukuk alanlarında durumu bazı arşiv belgelerinin ışığında incelenecek, son olarak Tanzimat döneminde getirilen yeniliklere değinilecektir. Anahtar  Sözcükler:  Zimmi,  Gayrimüslim,  Millet  sistemi,  iltizam, Osmanlı Hukuku, İslam Hukuku                                                    Doç.Dr.,Ankara Üniversitesi Hukuk Fakültesi Hukuk Tarihi Anabilim Dalı Öğretim Üyesi (belkiskonan@yahoo.com). 171Gayrimüslim Osmanlı Vatandaşlarının Hukuki…   AÜHFD, 64 (1) 2015: 171-193 ABSTRACT In the multinational Ottoman Empire, people were divided into groups only according to their religion; nation concept in the modern sense did not exist and in this regard, the Jewish, the Armenians and the Rums who composed nearly the half of the population lived freely until the collapse of the state without losing their identities and being forced to convert to Islam. In the Ottoman Empire, non-Muslim groups benefited from the protection of the Islamic law due to the Treaty of Zimmet. In this study, the legal status of the individuals who lived in the Ottoman Empire, an Islamic state, and who were called  zimmis  will be examined in the light of archival documents. In our research, the rights that non-Muslims who resided in Ottoman territories had in terms of private and public law will be reviewed in the light of several archival documents.  Keywords: Zimmis, Ottoman Law, Dhimma, non-muslim, the millet system, Islamic Law  GİRİŞ İslam hukukuna göre zimmiler ve müslümanlar hukuksal, sosyal durum ve  siyasal  olarak  eşit  değillerdi.  Osmanlı  Devletinde,  İslam  hukukunun ilkelerine bağlı olarak, Müslümanların durumunu ümmet anlayışına göre düzenlenmiş, fethedilen topraklarda yaşayan zimmilerin hukuki durumları ise zimmet kurumu çerçevesinde belirlenmişti. Darülharb de yaşarken, cihat sonucu  tek  tanrılı  dinlere  inanan  topluluklar   zimmet   adı  verilen  bir antlaşma  sonucunda  İslam  devleti  tarafından  korunurlar.  Dinlerini değiştirmeden, bir İslam Devletinin koruma altına aldığı bu kişilere zimmi adı  verilir.2  Çalışmamızda,  zimmi  kelimesi,  Osmanlı  gayrimüslim vatandaşları ile aynı anlamda kullanılacaktır. Osmanlı Devleti İslam dinine göre yapılandığı için, vatandaşlık kavramında din kıstası esas alınmıştı. Bu nedenle günümüz hukuk sistemlerinden farklı olarak Osmanlı toplumunda                                                  1  Cahen, Claude. 1963a  Dhimma ,E.I  2 ,II, Leiden:E.J.Brill, 227-231, s. 227 2  Zimmiler hakkında geniş bilgi için bkz: Ahmet Özel.1982. İslam Hukukunda Milletlerarası Münasebetler ve Ülke Kavramı. İstanbul; Bozkurt, Gülnihal. 1996. Gayrimüslim Osmanlı Vatandaşlarının Hukuki Durumu, (1839-1914). Ankara: TTK Yayınları,s.7-8, Muhammed Hamidullah. 1998. İslamda Devlet İdaresi.(5. Bası).İstanbul: Beyan Yayınları, s. 395 172AÜHFD, 64 (1) 2015: 171-193   Konan vatandaşlık günümüz anlamında milliyet esasına göre değil, din esasına göre belirlenirdi. Başka bir deyişle, Müslüman olan kimseler Arap, Türk, Habeş ayrımı yapılmaksızın Müslüman milletinden sayılırken, devletin egemenliği altında  yaşayan  gayrimüslimler,  mezhep  veya  dinlerine  göre  sınıflara ayrılmış ve her topluluk millet adı verilen bir sistem içinde yönetilmiştir. Osmanlı Devletinde genel olarak üç milletten sözedilir. Yahudiler, Ermeniler ve Rumlardan oluşan bu millet sisteminde, kendi cemaati tarafından seçilen her dinin en yüksek rütbeli görevlisi kendi gurubunun işlerini düzenlemek, hukuki  işlerini  yürütmek  ve  idare  etmekle  görevliydi.  Dini  şefe  devlet tarafından verilen bir berat ile, şefin cemaati üzerindeki hukuki ve idari yetkileri belirlenirdi. Dini şefler, topluluğun malını idare etme görevinden başka, dini ayinleri, dini işleri yürütmekle ve cemaatlerinden miktarı belli olan vergileri toplamakla da görevliydiler.6 Doktrinde,  millet sistemi 7 adı verilen  bu  sistemde  ruhani  liderlere  verilen  yetkinin  dini  topluluk  için serbesti  sağladığı  genel  kabul  görmekte  ise  de,  son  40  yıldır  Osmanlı Devletinde uygulanan sistemin millet adı verilen topluluklara hiç bir şekilde otonomi sağlamadığı, bunun   iltizam sistemi  olduğuna ilişkin tartışmalar yoğunlaşmıştır.8                                                  3  Ronald,  Jennings,   Zimmis  (non-muslims)  in  Early  17.th  Century  Ottoman  Judicial Records .Journal of the Economic and Social History of the Orient, XXI, Part.3 (225-293); Bozkurt,s.,7-8;  Kamel.S., Abu Jaber.1967.  The Millet System in the Nineteenth Century Ottoman Empire , The Muslim World  LVII,(3), s. 213;  Bilal, Eryılmaz.1990.Osmanlı Devletinde Gayrimüslim Teb anın Yönetimi. İstanbul:Risale Yayınları. 4  Osmanlı zimmileri için millet kavramı içinde yer almışlardır. Ancak doktrinde zimmilerden azınlık olarak sözedenler olsa da azınlık kavramının Osmanlı hukuk literatürüne girişi 20. yüzyılda olmuştur.. Ekrem Buğra,Ekinci. 2008. Osmanlı Hukuku, Adalet ve Mülk.İstanbul: Arı Sanat Yayınları, s. 316. Ortaylı, millet sözcüğünün dini bir aidiyeti .ifade ettiğini bu nedenle günümüz anlamındaki nation sözcüğü ile eş anlamlı olmadığını belirterek, ekalliyet yani azınlık kelimesi ile de eş değer tutulamayacağını söyler. Ayrıntılı bilgi için bkz:İlber Ortaylı.2007. Osmanlı  İmparatorluğunda  Millet  Nizamı ,  Batılılaşma Yolunda.İstanbul:Merkez Kitapçılık Yayıncılık. s. 171. İlber, Ortaylı.2003. Osmanlı Barışı. İstanbul:Ufuk Yayınları. s. 48.  5  Ermeniler protestan ve Katolik olup olmamalarına göre farklı milletlere ayrılırken, Bulgar ve Rumlar Ortodoks ise Rum milletine tâbi olurlardı.  6  Engelhardt,  Rum  Patriğinin  bu  yetkilerini   İmperium  in  İmperio   .  olarak Engelhardt.1999.Türkiye ve Tanzimat. İstanbul:Kaknüs Yayıncılık. s.119 7   Aydın, Mehmet Akif.2005. Türk Hukuk Tarihi ( 5. Bası). İstanbul: Hars Yayıcılık. s. 160. 8  Millet sistemi ve iltizam sistemi ile ilgili tartışmalar için bkz: Mustafa Macit, Kenanoğlu. 2004. Osmanlı Millet Sistemi Mit ve Gerçek. İstanbul: Klasik Yayıncılık. s. 44-56; Ekinci, s.322; Benjamin, Braude. 1982  Foundations Myths of The Millet System .Christians and 173Gayrimüslim Osmanlı Vatandaşlarının Hukuki…   AÜHFD, 64 (1) 2015: 171-193 Bunun  dışında,  dini  reislerin  kendi  cemaat  üyelerinin  evlenmeleri, boşanmaları ve miras paylarını dağıtma gibi görevleri de vardı. Bir başka deyişle, aşağıda değineceğimiz ahvali şahsiye olarak nitelendirilen ve özel hukuka giren anlaşmazlıklarda dini şeflerin muhakeme yetkisi bulunurdu.9 Patrikler tarafından cemaat üyelerine bazı cezaların verilmesi ise, sadece kendi din kurallarına aykırı hallerde sözkonusu olabiliyordu. Yani, kamu düzenini  ilgilendiren  ve  takibi  devlet  tarafından  yapılan  suçlarda cezalandırma hakları yoktu. Bu nedenle verilen cezayı hukuki anlamda bir ceza  olarak  değil,  bir  disiplin  cezası  olarak  nitelendirmek  daha  uygun olacaktır.10 Dini şefler, hukuki ve idari yetkilerini devlet tarafından verilen berattan alırlardı. Ayrıca, dini liderlerin cemaatlarını yönetme yetkilerine Osmanlı memurlarınca bile müdahale edilemezdi. Bununla ilgili bir örnek, Ohri ve tevabii patrikliğine dahil kazalarında piskopos, papaz, keşiş ve sair zimmilere kimse tarafından taarruz ve müdahale olunmamasına ilişkin 1131 H. /1718 M. tarihli belgede yer alır.11 1778 yılında Rum Patrikliği tarafından verilen bir arzuhalde, Ürgüp kasabasında sakin Kuyumcu nam zimminin Samsun'da kalebend edilmesi istenmiştir.12 Arzuhalden anlaşıldığı kadarıyla                                                                                                                    Jews in the Ottoman Empire ,the Functionig of a Plural Society(I), Newyork:Holmes-Meier Publishers.s. 69 , 78.  9  Gül  Akyılmaz.2000.  Osmanlı  Devletinde  Eşitlik  Kavramının  Gelişimi,  Profesörlük Çalışması.Konya.  s.91-92;  Kenanoğlu,  zimmilerin  miras  hukuku  ile  ilgili davalarında cemaat  mahkemelerinin  değil  şeriye  mahkemelerinin  yetkili  olduğunu  bazı  arşiv belgelerine dayanarak işaret etmektedir. Yazara göre, miras taksimi  esas olarak  rızai bir işlem olup kadılar buna karışmazlar. Ancak varislerden yaşı küçük olan veya gaip olan varsa bu ihtilafa kadı bakar. Kenanoğlu,s. 252,264, 259, 397 10  Aynı görüş için bkz:Kenanoğlu, s. 238; Ekinci, s. 322. 11  B.O.A., C.ADL, 29 Z. 1131 H. (1718 M.),Dosya No: 1 Gömlek No: 60  Derkenarı ve olı geldiği üzre şurutuyla sah buyuruldu Ohri ve tevâbi‘i patrikliği sahib-i arzuhal Yuvasef nam rahibe tevcih ve yedine berat-ı alişân verilip iltizamında olan metrapolid ve sayir dahi tayifesinin senevî üzerlerine edası lazım gelen mîrî rusum ve ayazmaları ve manastır ve dükkanları cem‘i için kanun üzre zabt için emr-i şerif verilegelmişdir ol babda emr u ferman devletli ve saadetli sultanım hazretlerinindir.  12  B.O.A., C.ADL, 05 L 1192 H., Dosya No: 59, Gömlek No: 3564, arzuhal üzerine verilen hükümde , şu şekildedir.:  Zikri âtî manastırın vâki olduğu kazanın kadısına ve Yanya sancağı mütesellimine hüküm ki: İstanbul ve tevâbi‘i Rum Patriği Deraliyyem'de mukîm cemaat mukim cemaat metropolidan gelip kendi Yanya Metropolidi iltizamında nefs-i Yanya  sekenesinden  Makri  Venastaş nam  zimmî  öteden  beri  kendi  halinde  olmayıp mücerred vazifesi olmayan işlere suluk ve muğayir-i ayin harekât-ı nâ-hemvareye cesaret edip  biddefe‘ât  kendi  halinde  olmasını  tenbieh  ve  pend  nush  oldukda  ısgâ  etmeyip melanetinde ısrar ve sezavar-ı tedib olmadığın kaza-i mezbur reayasından mutemed ve ehl-i 174AÜHFD, 64 (1) 2015: 171-193   Konan Makri Venastas? Adlı zimmi  kendi halinde olmayıp  , topluluğu rahatsız edici davranışlarda bulunmuş, ruhani reis tarafından adı geçen kişiye tenbih gibi bazı müeyyidelerde bulunulmuş olsa da çevresine rahatsızlık vermeye devam  etmiştir.  Bunun  üzerine  Rum  Patrikliği  Makri nin? Cezalandırılmasını  Osmanlı  Devleti nden  istemiştir.  Bu  belge,  ruhani reislerin sadece disiplin cezası verme yetkisi olduğunu yani cezaya ilişkin davalarda tek yetkili makamın Osmanlı mahkemeleri olduğunu göstermesi açısından güzel bir örnektir.  Devlet, dini şefi, kendisine muhatap alarak bir anlamda idareye karşı sorumlu  saymış  ve  milletlerin  denetimini  mercek  altına  almayı kolaylaştırmıştır. Bu şekilde, gayrimüslim vatandaşlar belli bir serbestlik içinde  yaşarken,  devletin  onlar  üzerinde  yönetimi  birey  bazında  değil, cemaat olarak yürütülmesine imkan vermiştir. I.  Özel  Hukuk Alanında  Gayrimüslim  Osmanlı  Vatandaşlarının Hukuki Durumu Zimmiler, özel hukuku ilgilendiren işlerinde kural olarak kendi dini kurallarına  tabidirler.  Bunların  başında,  evlilik  ve  boşanma  ile  nafaka, velayet, mehir gibi konular gelmektedir. Cemaatlerinin din adamları özel hukuk içine giren aile hukuku ile ilgili hukuksal sorunları üstlenmişlerdi. Bu durum belgelerde   akdi nikah, fesh-i nikah ve münaziün fih olan iki zimmi arasına başkasının girmemesi, akd-i nikah ve fesh-i nikah maddelerinde münazaa eden iki zimmi mabeynlerinin rızalarıyla ıslah ve iktiza ederse kiliselerinde ayinleri üzerine yemin verdikte  şeklinde formüle edilmiştir. Bu nedenle  zaman  zaman  ruhani  liderler  nikahlara  müdahale  edilmemesini devletten  talep  etmişlerdir.13Aile  hukuku  davaları  cemaat  mahkemeleri tarafından  kendi  dinlerine  uygun  olarak  çözülürdü.  Ancak,  cemaat mahkemelerinin  vermiş  oldukları  hukuki  kararları  uygulamak  Osmanlı                                                                                                                    ırz  kimesneler  patrik  tarafına  ihbar  eylediklerin  bildirip  merkum  kaza-i  mezbur  ve kurâsında ve sair her ne mahalde bulunur ise sen ki mütesellim-i muma-ileyhsin marifetinle ahz ve ıslah-ı nefs zımnında Kalika vâki‘ Varadim manastırına manastır bend eyleyip ıtlakı için patrik-i mesfur tarafından istidâ olmadıkça ıtlak olunmamak babında emr-i şerif rica etmeğin vech-i meşruh üzre amel olunmak babında emr-i şerifim yazılmışdır ferman devletli sultanımındır. Evasıt-ı S sene [1]192 13  Bu başvurular karşısında, köy ve mahalle imamlarına gayrimüslimlere ilişkin nikahları kıymamaları  ve  ehl-i  örfün  bu  konuda  cebir  kullanmaması  ile  ilgili  emirlere rastlanılmaktadır. Örnekler için bkz: Kenanoğlu, s. 246 175Gayrimüslim Osmanlı Vatandaşlarının Hukuki…   AÜHFD, 64 (1) 2015: 171-193 yetkililerinin göreviydi. Ancak hemen belirtmemiz gerekir ki, bu zimmiler için  zorunlu  olmayıp,  eğer  zimmiler  isterlerse,  davalarını  Osmanlı mahkemelerinde görülmesini talep edebilirlerdi. Uygulamada, hristiyanların evlenme  ve  boşanmada  mali  yükümlülüklerden  çıkan  sorunlar  için  şer'î mahkemelere  başvurdukları  görülmüştür.  Bunun  dışında,  kendi  dinlerine göre  eşlerinden  boşanamayan  katolik  gayrimüslimlerin  de  Osmanlı mahkemelerini tercih ettiklerine vakalara rastlanılmaktadır.14 Burada, zimmilerin aile hukuk alanında hukuki durumunu incelerken, getirilen bir kısıtlamayı da kısaca hatırlatmakta fayda görüyoruz. Evlenme işlerinde, zimmi bir kadın dilerse Müslüman bir erkekle evlenebilir, ancak, Müslüman  bir  kadının  zimmi  bir  erkekle  evlenmesi  mümkün  değildir.15 Müslüman erkekle evlenmiş zimmi bir kadının boşanması halinde ise, İslam hukuku  kuralları  geçerli  olacaktır.  Yani,  özel  hukuka  giren  boşanma işleminde  kadının  bağlı  olduğu  cemaat  mahkemesi  yetkili  değildir.16 Evlenme, boşanma davaları yanında nafaka, drahoma ve cihaz davaları da cemaat  mahkemelerinde  görülürdü.  Cemaat  mahkemesinin  nafaka ödenmesine ilişkin kararlarının uygulanması ise Osmanlı yetkililerine aitti.  Miras hukuku açısından, zimmiler kendi din kurallarına tabiydiler. Eğer isterlerse  şer'î  mahkemelere  gitme  yetkileri  de  vardı.  Bunun  dışında, Müslümanlarla birbirlerine mirasçı olup olamamaları  dâr  kurallarına göre belirlenirdi. Farklı dinlere mensup olan iki zimminin birbirine mirasçı olup olamayacakları  tartışmalı  olmakla  beraber,  Osmanlı  devletinin  resmi mezhebi  olan  Hanefi  mezhebi  gayrimüslimlerin  farklı  dinlere  mensup olmaları  halinde  birbirine  mirasçı  olabileceklerini kabul  etmiştir.17  İslam hukukuna  göre  mirasçı  ile  miras  bırakılan  arasında  din  farkı  bulunması mirasçılığı engellemektedir ancak lehine vasiyet yapmayı engellemez. Bu nedenle, Müslümanlar ile zimmiler birbirlerine mirasçı olamazlar.18  Zimmilerin,  Müslümanlar  lehine  yaptıkları  vasiyetler  geçerli  olup, vasiyetname  ve  miras  konularında  yine  Müslümanlarla  eşit  olduklarını                                                  14  Ekinci,  319; Kenanoğlu, s. 246-249 15  Zimmi  kadının  Müslüman  erkekle  evlenmesi  durumunda  dinini  değiştirmesi  zorunlu değildir. Çünkü evlilik birliği içinde doğan çocuklar İslam hukukuna göre Müslüman olurlar.  16  Bozkurt(1987), s. 132; Akyılmaz, s. 95. 17  Karaman (I), s. 429 18  Müslüman erkekle zimmi kadının evliliğinden olan çocuklar Müslüman sayıldığı için annelerine mirasçı olamazlar. Ansay, s. 88  176AÜHFD, 64 (1) 2015: 171-193   Konan söyleyebiliriz.  Ölen  zimminin  mirasçısı  yoksa  malı  devlete  kalır.19 Gayrimüslimlerin mirasa ilişkin davalarının şer'î mahkemelerde görülmesine ilişkin  padişah  iradelerine  rastlanmaktadır.20  Yine  uygulamada,  Osmanlı gayrimüslimlerinin mirasa ait davalarını kendi dini şefleri yerine Osmanlı makamlarına götürdükleri görülmektedir. Örneğin, 1811 yılında, Tokad da zimmi bir Osmanlı vatandaşın, terekesine dışarıdan haksız yere dahil olmak isteyen  kişiler  için  şeriye  mahkemesine  başvurduğu  görülmüştür.  Bunun üzerine  çıkarılan  fermanda,  Tokad'da  sakin  Ohannes?  isimli  zimminin terekesinden pay almak isteyen kişilerin şer an muhakeme edilmeleri için Tokat kadısına davanın  şer ile görülmesi  emri verilmiştir.21.  Osmanlı  Devletinin  resmi  mezhebi  olan  Hanefi  mezhebine  göre, Hristiyanların  vakıf  kurmaları,  vakfedenin  mülkünü  kilise  adına  tescil ettirmemesi şartıyla kabul edilmiştir. Aynı şekilde hastane, çeşme vb. kamu hizmetleri  için  de  zimmilerin  vakıf  kurmasına  izin  verilmiştir.  Bu  ilke uyarınca,  gayrimüslim  Osmanlı  vatandaşları,  taşınmaz  mallar  ile  başka gayrimüslimler  lehine,  hatta  müslüman  Osmanlı  vatandaşları  lehine  bile vakıf  kurabilir  ancak,  ibadet  yerleri  için  vakıf  kuramazdı.  Yine gayrimüslimler, müslümanların kurduğu vakıflardan da yararlanabiliyordu. Görüldüğü gibi, aslında gayrimüslimlerin vakıf kurması için getirilen esaslar müslümanların vakıf kurmasından farklı değildi. Bu konuyla ilgili Üsküdar kadısına  yazılan  emirde,  Osmanlı  şehirlerinde  oturan  gayrimüslim vatandaşların manastır ve kiliseler için ev, dükkan ve diğer emlak ve akarları                                                  19  Ercan Yavuz.2001.Osmanlı Yönetiminde Gayrimüslimler.Ankara:Turhan Kitabevi.s. 11. 20   Zimmiler arasında ırs nizaının şer ile görülecek mevaddan olduğu   örnek için bkz: Kenanoğlu(2004), s. 257 21 B.O.A., C.ADL, 29 B 1137 H., Dosya No: 61 Gömlek No: 3655   ……….bulunduğu mahalden ahz ve mahalline ihzar ve şer‘le zimmetinde tahsili lazım gelip sübut bulan hakları tahsil ve ihkâk-ı hak ve arz ve ilam olunmak emrim olmuşdur buyurdum kiEmr-i şerifim vusul buldukda bu bâbda sadır olan emrim üzre amel dahi mesfur her hanginizin taht-ı kazâsında bulunur ise ahz ve çavuş-ı merkum mübâşeretiyle mahallinde ihzar ve bunlar ile mürâfa‘a-i şer‘ ve mukaddemâ bir defa şer‘le görülüp fasl olunmayan ahvâllerin tamam hak ve adl üzre tafahhus ve takayyud edip göresin ilam olunduğu üzre ise ol babda muktezâ-yı şer‘-i kavimle amel edip dahi vech-i meşru‘ üzre vârisleri mürd-i mesfurdan irs-i şer‘le intikal edip mesfurun hile ile hilaf-ı şer‘ ahz eylediği emval ve eşya ve nukudu her ne ise ba‘de's-subut hükm edip bî-kusur alıverip icra-yı hak olundukda keyfiyet-i ahvali vukuu ve sıhhati üzre yazıp der-i devlet medarıma arz ve ilam edip mazmun-ı emr-i şerifimle âmil olasın şöyle bilesin alâmet-i şerife itimad kılasın. Tahriren fî evahir şehr-i Recebi'l-ferd li-sene seb‘a ve selâsîn ve mi e ve elf [1137] 22 B.O.A., C.ADL, 22 R 1225 H., Dosya No: 58, Gömlek No: 3498 177Gayrimüslim Osmanlı Vatandaşlarının Hukuki…   AÜHFD, 64 (1) 2015: 171-193 vakf eylemeleri eskiden beri yasak olduğu, bu hususla ilgili olarak zaman zaman Rumeli, Anadolu ve Cezayir-i Bahri Sefid'deki bazı yerlere emirler yazıldığı belirtilmiştir. Buna rağmen bir süredir  bazı reaya taifesinin  yine manastır ve kiliselere taşınmazlarını vakıf tayin ettikleri haber alındığı, bu durumun eski adetlere ve padişahın emrine aykırı olduğu, bundan sonra bu gibi vakıfların yapılmaması hususunda padişahın kesin fermanı çıktığından bu  fermanın  sicil  defterlerine  kaydedilerek  bundan  sonra  kesinlikle  bu vakıflara müsaade edilmemesi istenmektedir. Yine, bir başka buyruldu da, Rumeli Anadolu ve Akdeniz adalarındaki zimmi reaya taifesinin manastır ve kiliselere ev, dükkan vesair emlak ve akar vakfetmemeleri ve bu konudaki yasağın muhafazasına itina gösterilmesi Üsküdar kadısından istenmiştir.23 Belgelerden  gayrimüslimlerin  vakıf  kurmalarında  bir  kısıtlama  olmadığı sadece, ev, dükkan vb. taşınmazlarını kilise üzerine kaydettiremeyecekleri açıkça  anlaşılmaktadır.  Ayrıca,  bu  konu  üzerinde  verilen  fetvalar  da gayrimüslimlerin ev, bağ, bahçe dükkan gibi mülklerini manastır ve kilise adına  vakfedemeyeceğini  sadece  manastır  ve  kilise  fakirleri  için vakfedebileceğine değinilmektedir.24 Borçlar hukuku ve  ticaret hukuku açısından zimmiler aleyhinde bir sınırlama  mevcut  değildir.  Zimmiler,  Osmanlı  topraklarında  mülkiyet hakkına sahip olup, serbestçe sözleşme yapma ve ticaret yapma hakkına sahiplerdi.  Sadece,  Müslümanlar  için  yasaklanmış  edim  konularında                                                  23 B.O.A., C.ADL, 22 R 1225 H., Dosya No: 58, Gömlek No: 3498  Üsküdar Kadısı faziletli efendi Memalik-i mahrusatü'l-mesâlik-i şâhânemde vaki medayin ve emsarda mütemekkin ehl-i zimmet re‘âyâ taifesinin nefs-i manastır ve kiliseler fukarâsı için buyût ve dekakin ve sayir emlak ve akar vakf eylemeleri öteden beri memnu‘ olan hâlâtdan olmakdan naşi bu hususa ikdam ve dikkat olunarak aralık aralık Rumeli ve Anadolu ve Cezayir-i Bahr-i Sefid'de vaki bazı mahallere mahsus evâmir-i aliyye ısdarıyla tenbih ve men‘ ve tehdid olunmakda iken bir müddetden beri o makule re‘âyâ taifesi yine manastır ve kilise fukarâsına vakf ve tayin etmekde oldukları ihbar olunmak hasebiyle bu husus kadîme ve rızâ-yı hazret-i zıllet meaba münâfî olmakdan naşi fîmâ bad o makule re‘âyânın nefs-i manastır ve kilise fukarâsına akar vakf ve tayin edememeleri hususuna irade-i kâtı‘a-i mülukane müteallik olmakla imdi işbu ferman-ı âlîyi sicill-i mahfuza kayd ittirderek min ba‘d o makule re‘âyânın nefs-i manastır ve kilise fukarâsına emlak ve akar vakf edememelerine dikkat ve suret-i irade-i seniyyeyi iktiza edenlere dahi tenbih ve tekide mübader et eyleyesin deyü buyuruldu.  24 Fetva için bkz:Ertuğrul, Düzdağ.1972. Şeyhülislam Ebusuud Efendi'nin Fetvaları Işığında 16. Asır Türk Hayatı.İstanbul:Enderun Kitabevi.s. 112 25  Çok sık verilen bir örnek şarap ve domuz etinin, Müslümanlarla yaptıkları borç ilişkilerinde edim  konusu  olamayacağıdır.  Ama  kendi  aralarındaki  borç  ve  ticaret  ilişkilerinde Müslümanlarca  yasak olan bu edimleri serbestçe  kararlaştırmalarına engel bir durum 178AÜHFD, 64 (1) 2015: 171-193   Konan Müslümanlarla sözleşme yapmaları uygun değildir. Zimmiler için borçlar hukukunda  getirilen  bir  diğer  sınırlama  ise,  Müslüman  köle bulundurmalarının yasaklanmış olmasıdır. Bir zimmi, Müslüman köle satın alamayacağı  gibi,  kölesi  sonradan  Müslüman  olursa  onu  hemen  bir müslümana satmakla mükelleftir.26 Zimmilerin kendi aralarında borçlar ve ticaret hukukuna ilişkin anlaşmazlıkları diğer özel hukuk işlerinde olduğu gibi kendi hukuklarına göre çözümlenirken, bir Müslüman ile olan davaları kadı  mahkemeleri  önünde  görülürdü.  Ancak  burada  cemaatlerin  kendi milletlerinden olan kişilerin şeriye mahkemelerine gitmelerini çok da hoş görmediğine değinmek gerekir. Bu konuda Kenanoğlu, Yahudilerin şeriye mahkemelerine gitmelerini aforoz sebebi olarak gösterdiklerine değinir.27 Duruşmalar  sırasında  gayrimüslimler  ve  müslümanlar  arasında  bir  fark gözetilmezdi. II. Selim Kanunu'nda gayrimüslimlerin davalarını rahatlıkla kadı  mahkemelerine  götürebilmeleri  konusunda  açık  bir  hüküm bulunmaktadır. Jennings, zimmilerle ilgili olarak 17. yüzyılda yapmış olduğu bir araştırmada, özel hukuk işlerinde zimmilerin şeriye mahkemelerini çok yaygın  olarak  kullanmalarından  dolayı  cemaatlerin  adli  alanda  yargı yetkilerinin çok zayıf olduğu kanısına varmıştır.28 Gayrimüslimlerin  Osmanlı  mahkemelerine  başvurdukları  başka  bir örnek, Rum Patriği tarafından başka  bir Rumu şikayet için verilmiş  bir dilekçede  yer  alır.29  Selanik'te  Aya  Anastasya  Manastırı  keşişlerinden                                                                                                                    yoktur. Hayreddin Karaman.2013. Mukayeseli İslam Hukuku, III.(8. Bası).İstanbul: İz Yayıncılık. s.273. 26  Bozkurt,(1996), s. 16. 27  Mustafa Macit, Kenanoğlu. 2005.  İslam Hukukunda Zimmiler . Türkiye Araştırmaları Literatür Dergisi, 3,(5),553-574, s. 566. 28 Jennigs, s.273 vd. 29 B.O.A., C.ADL., 28 C 1226 H (1811 M.).tarih, Dosya No:  44, Gömlek No: 2654   Devletli inayetli merhametli sultanım hazretleri sağ olsun, Bu  çâkerlerinin patrikliğine  dahil olan  manastırlardan  medine-i  Selanik'de  vâki‘  Aya Anastasya nam manastırın keşişlerinden Bakdos ve Disarpon nam keşişler kendi hallerinde olmayıp ayine muğayirce harekâta ictisar ve mübaşir-i mezkurun hâsılâtını ekl ve bel‘ fukarâ-yı manastırın mağduriyetine bâ‘is ve bâdî olup tedib ve terbiyeye sezavar idiği ihbar olunmakla merahim-i aliyyelerinden mercudur ki zikr olunan keşişin medine-i Selanik'de ve havalisinde ve sair her ne mahalde bulunur ise yasakçı marifetiyle ahz ve li-ecli't-terbiye Aynaroz  Ceziresi'nde  vâki‘  Lavra  manastırı  kulesine  bend  olunup  ıtlakları  hususuna memhur arzuhal-i âcizâne ile istida olunmadıkça müsaade-i seniyye şayan buyurulmamak üzre  hâlâ  Selanik  Mütesellimi  dergah-ı  âlî  kapıcıbaşılarından Yusuf  Bey  bendelerine hitaben bir kıta ferman-ı celilü'ş-şân inayet ve ihsan buyurulmak babında emr u ferman devletli inayetli sultanım hazretlerinindir.  Bende Patrik-i Rum İstanbul ve Asitane'de mukim cemâ‘at-i metropolitan  179Gayrimüslim Osmanlı Vatandaşlarının Hukuki…   AÜHFD, 64 (1) 2015: 171-193 Yakodis?  ve  Risaryun?  nam  keşişlerin  manastır  hasılatını  haksız  ele geçirmelerinden  dolayı  Aynaroz  adasında  kalebent  edilmeleri  hakkında İstanbul  Rum  Patriği  tarafından  verilen  arzuhal  üzerine,  Selanik mütesellimine  hüküm  yazılarak  manastır  hasılatını  gasbeden  kişilerin kalebend edilmesine karar verilmiştir.  2. Kamu Hukuku Alanında Gayrimüslim Osmanlı Vatandaşlarının Hukuki Durumu Gayrimüslim  Osmanlı  vatandaşları,  kamu  düzenini  ilgilendiren alanlarda özel hukuk alanında olduğu gibi bir serbestiye sahip değillerdi. Ancak, İslam hukuku çerçevesinde hareket edildiği taktirde, gayrimüslimlere devlet tarafından zimmet antlaşmasının hükümlerine göre davranılmış ve korunmuşlardır.  Özellikle,  ferdi  haklar  açısından  Osmanlı  yönetimi gayrimüslim vatandaşlarını, müslüman vatandaşlarından ayırt etmemiştir. En başta  zimmilere,  angarya  ve  zulüm  yapan  yöneticileri  şikayet  hakkı verilmiştir. Arşivde yer alan arz-ı hal ve arz-ı mahzarlardan, gayrimüslim reayanın,  yöneticiler  hakkındaki  yakınmalarını  merkeze  kolaylıkla iletebildikleri  ve  merkez  tarafından  da  gerekli  tedbirler  alındığı anlaşılmaktadır.30 Örnek bir arz-i mahzar da, mahkeme harcı alınmaması hakkında sadır olan Hatt-ı Hümayun'a rağmen, Bosna'nın Benaluka kasabası reayalarından harc-ı defter, katibiye ve sair namlarla aidat taleb eden kadıdan şikayetçi  olunması  konusundadır.  Şikayetin  incelenmesi  sonucunda, Rumeli'nin sol kolunda vaki mevâlî ve kadılar ve naiblere ve ayan-ı vilayet ve iş erlerine, bundan sonra kanuna aykırı bir şekilde emredilenin dışında vergi  almamaları,  kanunen  toplamaları  gereken  vergileri  alırken  zam yapmamaları emredilmiştir. Hükümde, kazada bulunan ayanların, kaza kadı ve naiplerinin kanunsuz vergi almalarına engel olmaları da emredilmiştir. Kamu  hukuku  açısından  değineceğimiz  konulardan  bir  başkası, Osmanlı  gayrimüslimlerinin  din  ve  vicdan  serbestisine  sahip  olup olmadıkları meselesidir. Osmanlı uygulamasında gayrimüslim vatandaşlar dinlerini  rahatlıkla  yaşayabilmişler,  ayin  ve  ibadetlerini  serbestçe  icra edebilmişlerdir. Bunun dışında, gayrimüslimlerin hac ziyaretlerini kolaylıkla yapmaları için devlet tarafından bazı tedbirler alınmıştır. İslam hukukunda                                                  30 B.O.A., C. ADL., Dosya No: 22 Gömlek No: 1304, 29 C 1141 H, belge ayrıntıları için bkz: Belkıs Konan. 2013.Osmanlı Devletinde İdari Yargının Gelişimi.Ankara: Statü Yayıncılık. s. 31. 180AÜHFD, 64 (1) 2015: 171-193   Konan dinde zorlama olmayacağı kuralına istinaden, zimmiler Müslüman olmaya zorlanamazlardı.31 Ancak, din değiştirme konusunda irtidat suçunun yani dinden dönmenin cezası ölüm olduğundan, bir kez Müslüman olduktan sonra eski dinlerine dönmeleri de mümkün değildi. Zimmilerin kendi aralarında mezhep değiştirmeye yönelik hareketleri ise zaman zaman çıkarılan bazı fermanlarla yasaklanmaya çalışılmıştır. Osmanlı idaresi genel tutum olarak, hıristiyanların kendi aralarında mezhep değiştirmesini uygun görmemiştir. Hatta misyonerlik yapanların cezalandırıldığı bile gözlemlenmiştir.32 Din ve ibadet özgürlüğü açısından zimmilerle ilgili karşımıza çıkan kısıtlamalar, daha çok yeni kilise yapılmasına izin verilmemesi ve mevcut ibadethanelerinin  tamiri  için  Osmanlı  yönetiminden  izin  almalarına ilişkindir. Bu kuralın sadece Osmanlı Devletine özgü olmayıp, genel olarak İslam dininde mevcut olduğunu hatırlatmakta fayda görüyoruz.33 Tamirlerin  bila-terfi ve la tevsi  yani mevcut olanı genişletmeksizin ve yükseltmeksizin yapılmasına izin verilmişse de istisnai bazı hallerde padişah kilise tamir taleplerine izin vermemiştir. Zaten Islahat Fermanı sonrasında yeni kilise yapımları çoğalmış, hatta eskisinden farklı olarak daha geniş ve yüksek  kiliseler  dahi  yapılmıştır.  Hatta,  kilisesi  veya  sinagogu  olmayan gayrimüslimler için Osmanlı Devleti'nin kendi miri arazisinden arazi tahsis ettiği dahi görülmüştür.34 Din ve vicdan özgürlüğü içinde değerlendireceğimiz konulardan biri de gayrimüslimlerin dini alametlerini serbestçe kullanmalarının mümkün olup olmadığı meselesidir. Zimmi vatandaşlar, islam dini için küfür sayılmadan ve  kendi dinlerinin propagandasını yapmadan dinleri ile ilgili alametleri kullanabiliyordu.  Yani  kiliselerinde  çan  çalabilir,  haç  işaretini dolaştırabilirlerdi.  Ebusuud  Efendi,  konu  ile  ilgili  fetvalarında gayrimüslimlerin çan yerine delikli tahtalardan yaptıkları bir alete tokmakla vurarak çıkardıkları seslerle Hristiyanları kiliseye davet edebileceğini ancak                                                  31  Bakara,2/250;  Yunus 10/99;  Hüseyin Hatemi, İslam Hukuku Dersleri, (İstanbul: Sümer Kitabevi,  2012),139-140;  Kenanoğlu(2004),s.31.  Yazar  eserinde  ,  15.  asırda  Osmanlı Devletinin  hiçbir  şekilde  islamlaştırma  politikasına  girmediğini  söyleyen  İnalcık'ın görüşüne de değinmektedir. s. 285 32  Bozkurt,1996, s.21-22. 33  Aydın, s. 155-156 34  Kenanoğlu(2004), s. 297-98. Önceden kilise olan yerlerin camiye çevrilmesine de zaman zaman rastlanılmış olup, bu  uygulama, kilise içinde ezan okunmuş şartına bağlanarak, daha önce hiç cami olmayan yerlerde bulunan kiliseler için sözkonusu olmuştur. 181Gayrimüslim Osmanlı Vatandaşlarının Hukuki…   AÜHFD, 64 (1) 2015: 171-193 bu  davetin  müslümanları  rahatsız  etmeden  yapılması  gerektiğini bildirmektedir.35 Yargılama  usulü  açısından  gayrimüslimlere  getirilen  en  önemli kısıtlama,  taraflardan  birinin  Müslüman  olması  halinde  dava  sırasında gayrimüslim bir başka vatandaşın şahitliğinin kabul edilmemesi şeklinde karşımıza çıkar. Bunun sebebi ise İslam hukukuna dayanır. İslam hukukuna göre taraflardan birinin Müslüman olduğu davalarda şahitlerin de mutlaka Müslüman  olması  gerekir. Ancak,  farklı  milletlere  mensup  olsalar  dahi, gayrimüslimlerin birbirlerine  karşı şahitliği kabul edilirdi. Yani bir Rum vatandaşı, bir Ermeni ye karşı tanıklık yapabilirdi.36 Ceza Hukuku açısından, zimmet anlaşması yaparak İslam devletinin hakimiyetine giren gayrimüslimler İslam hukukunun ceza hukuku ile ilgili hükümlerine  tabidirler.37  Buna  göre,  zimmilerin  kendi  aralarındaki  ceza davalarında (kısas ve diyete ilişkin) , kasten adam öldürme olaylarında kısas cezası uygulanmıştır. Ceza  hukuku  alanında,  bir  zimminin,  müslüman  birini  öldürmesi halinde, zimmiye kısas uygulanacağı kesin olmakla birlikte, bir müslümanın bir zimmiyi öldürmesi halinde kısasa tabi tutulup tutulamayacağı mezhepler arasında tartışma konusu olmuştur.38 Osmanlı Devletinin resmi mezhebi olan Hanefi mezhebi bu konuda, Kur an-ı Kerimin Mâide suresinde yer alan  Ey iman edenler! Öldürülenler hakkında size kısas kılındı  ayetini esas alarak, mağdurun Müslüman olup olmasına bakılmaksızın kasten adam öldürme hallerinde kısas uygulanacağını kabul etmişlerdir.39 Yaralama olaylarında ve kazayla adam öldürme hallerinde hem zimmiler, hem de Müslümanlar diyet ödemekle  yükümlüdürler.  Burada,  ikili  bir  ayrımdan  söz  etmemiz                                                  35  Düzdağ, s.95 36  Ekrem Buğra Ekinci.2011. Hukukun Serüveni, İstanbul:Arı Sanat Yayınları. s. 332; Bozkurt (1996), s. 8.  37  Fatih Kanunnamesinde, ceza ile ilgili hükümler  tek ve ve geneldir. İnalcık, bunun İslam ceza hukuku kurallarından (ukubat) doğduğunu belirtmektedir. Ukubat kuralları karşısında Müslim-gayrimüslim  tektir.  Bkz:  Halil,İnalcık.2009.  Devlet-i  Aliyye,  Osmanlı İmparatorluğu Üzerine Araştırmalar (3. Bası). İstanbul: Türkiye İş Bankası Yayınları. s. 236. 38  Şafii ve Hanbeli mezhebine göre, müslümanın zimmiyi öldürmesi halinde kısasa gerek yoktur. Hatta Malikilerde genel görüş olarak kısas uygulanmayacağı kanısındadır. Hanefi mezhebi ise kısasın bu durumda da uygulanması gerektiğini kabul eder.  bkz: Aydın, s.198 39  Yavuz, s. 10; Akyılmaz, s. 105 182AÜHFD, 64 (1) 2015: 171-193   Konan gerekmektedir. Bir zimmi, Müslüman için diyet öderken işlediği suç için gerekli diyet miktarı ne ise onu ödeyecektir. Fakat, bir Müslüman zimmiye diyet öderken diyet miktarının yarısını ödeyebileceği konusunda görüşler bulunmaktadır. Maliki ve Hanbeli mezhepleri, gayrimüslimlerin diyetinin, Müslümanların diyetinin yarısı kadar olduğunu kabul ederlerken, Hanefi mezhebi yaşam hakkının kutsallığından hareketle gayrimüslime ödenecek diyetin müslümana ödenecek diyetle aynı olması gerektiğini kabul eder. Osmanlı  Kanunnamelerine  baktığımız  zaman,  cinayet  ve  yaralama olaylarında  kısas  yerine  ödenecek   kan  cürmü   adıyla  anılan  diyetin zimmiler için Müslümanların yarısı kadar olduğunu görüyoruz.40 Öldürme ve yaralama dışındaki hadd suçlarında zimmiler yine İslam ceza hukukunun belirlediği kurallara göre ceza alırlar.41 Zimmilere hırsızlık suçunda, diğer Müslümanlara uygulanan el kesme cezası tatbik edilir. Ancak, Osmanlı  devletinde  bu  cezanın  sıklıkla  uygulanmadığını  da  hatırlatmak isteriz. 1840 yılında çıkarılan Ceza Kanunnamesinde, Osmanlı tebaasının can mal ırz ve namus güvenliği açısından eşit olduğu kabul edilerek ceza davalarında zimmi-müslüman ayrımı ortadan kalkmıştır. 42  Vergi Hukuku açısından, gayrimüslimler cizye ve örfi vergileri (tekalifi örfiyye) vermekle yükümlüydüler. Cizye, gayrimüslimlerin , İslam devleti tebaası  olmasını  gösteren  ve  gayrimüslimlere  askerlik  yapmamaları karşılığında getirilen bir vergidir. Cizye maktu cizye ve ale'r rüûs cizye olmak üzere ikiye ayrılıp, maktu cizye fetih zamanında sulhen tayin edilir. Aler rüûs cizye ise, şahıslar üzerinden ve adam başına herkesin mali gücüne göre taktir edilen cizyeye denir. Osmanlı uygulamasına baktığımız zaman, fetvalarda gayrimüslimlerin ale'r rüûs cizyesini öderken bazı kriterlere tâbi oldukları anlaşılmaktadır. Ebusuud Efendi, çalışmaya muktedir ama iki yüz dirheme  malik  olmayan  kişilerin   edna   gurubuna  girdiğini,  yani  fakir sayıldığını ve on iki dirhem vergi vereceklerini; iki yüz dirhem ile on bin dirhem arasında parası olanların  evsat  gurubuna girdiğini yani orta halli                                                  40   Eğer  bu  zikr  olunan  kazâya  kâfirden  sâdır  olsa  vech-i  mefsur  üzere  Müslüman cereminin  nısfı  alına   Müslüman  olmayan  halkın  Müslümanlara  göre  yarım  ceza ödemeleri ile ilgili örnekler için bkz: Yavuz, s. 189-191 41  Zina  suçu  işleyen  zimmiler  açısından  bu  konuda  bir  istisna  öngörülmüştür.  Bir gayrimüslimin zina suçunu işlemesi halinde recm yerine, sopa cezası uygulanacağı Hanefi mezhebince kabul edilir. Bir diğer istisna ise, içki içme halinde, zimmilere içki içme de had cezası uygulanmaz. Ekinci(2008), s. 331. 42 Bozkurt(1996),s. 98. 183Gayrimüslim Osmanlı Vatandaşlarının Hukuki…   AÜHFD, 64 (1) 2015: 171-193 sayıldığını ve  yirmi dirhem  vergi vereceklerini; on bin dirhemden  fazla parası olanların ise  a'la  gurubuna girdiğini yani zengin sayıldığını ve kırk dirhem vergi vermesi gerektiği şeklinde fetva vermiştir.43 Örfi vergiler, devlet tarafından bazı faaliyetlerde bulunmaları nedeniyle bazen de belli bir şeye izin verilmesi karşılığında konulmuş olan vergilerdi.44 Tuzculuk ve  madencilikle uğraşan zimmiler ise,  cizye  vergisinden  muaf tutulurdu.  Ayrıca,  devletin  ilk  dönemlerinde  din  adamlarından  vergi alınmamıştır. Devşirmeye tabii tutulan gayrimüslim çocukların aileleri ile, önemli  geçitlerdeki  zimmi  halktan  vergi  alınmazdı.  Ayrıca,  Divan-ı Hûmayun a  tercümanlık  yapan  kişilerin  hem  kendisinden  hem  de çocuklarından cizye alınmıyordu. Tanzimat  dönemine  kadar  cizyenin  belirlenmesi  ve  tahsilinde  bir değişiklik olmamıştı..1856 tarihli Islahat fermanı ile getirilen eşitlik ilkesi gereğince  gayrimüslimlere  askerlik  hizmeti  getirilmiş,  askerlik  yapmak istemedikleri taktirde ise  bedel-i askerî  adı verilen vergi getirildi.  Kamu hukuku açısından gayrimüslim Osmanlı vatandaşlarını incelerken değineceğimiz son konu, devlet hizmetlerine girmeleri ve siyasi haklardan yararlanmalarıdır. Gayrimüslimlerin siyasi hak kullanmaları konusunda tek yetkileri  kendi  dini  liderlerini  seçmeleriydi.  Halife  olamayacakları  gibi, kadılık  hakimlik,  komutanlık  gibi  görevleri  yapmaları  da  uygun görülmemişti. Tanzimat dönemine kadar Müslüman vatandaşlara dahi idari ve  siyasi  haklar  tanınmamış  olduğundan  Osmanlı  zimmilerinin  idari  ve siyasi haklarının bulunmamasını doğal karşılamak gerekir. Devlet tarafından, fethedilen yerlerde zimmilere tımarlar verilerek bir nevi memurluk görevi sağlanmıştır. Gayrimüslim topluluklarda, bazı zimmilerde, çeribaşılık, köy kethüdalığı ve voyvodalık gibi görevlere atanmışlardır. III.  Tanzimat  Devrinde  Zimmilerin  Hukuki  Durumuna  İlişkin Başlıca Düzenlemeler Osmanlı  Devleti'nin,  İslam  hukukundaki  zimmet  sistemine  uygun şekilde gayrimüslim halka verdiği hak ve yetkiler Tanzimat dönemine kadar                                                  43  Düzdağ, s. 97 44  Örneğin kasaplardan kasabiye adı verilen vergi, rençberlerden ise yuva harcı adı verilen vergi alınmaktaydı. Yahudiler, avarız akçesi, yave akçesi, rav akçesi denilen vergileri verirdi. 184AÜHFD, 64 (1) 2015: 171-193   Konan devam  etti.  Ancak,  19.  yüzyılda  devlet  siyasi,  askeri  ve  mali  açıdan zayıflayınca  Avrupa  devletleri  Osmanlı'daki  gayrimüslim  tebayı  koruma bahanesiyle  Osmanlı  hükümetine  baskı  yapmaya  başladı.  Bu  baskı karşısında Osmanlı Devleti bazı düzenlemeler yapmak zorunda kalmıştır. Bu dönemde II. Mahmut un   Ben tebaamın Müslümanını camide, Hıristiyanını kilisede,  Musevisini  havrada  fark  ederim.  Aralarında  başka  gûna  fark yoktur. Cümlesi hakkında muhabbet ve adaletim kavidir ve hepsi hakiki evladımdır.   sözleri  din  ve  mezhep  farkı  gözetilmeden  tebaanın  eşit olduğunu vurgulaması bakımından önem taşımaktadır. Ancak, hukuki belge bazında eşitlik ilk olarak Gülhane Hatt-ı Hûmayunu olarak geçen Tanzimat fermanında ortaya çıkar. Bir temel haklar bildirgesi olarak da nitelendirilen fermanda  Osmanlı  Devleti  içinde  herkesin  can,  mal,  ırz  ve  namus güvenliğine sahip olduğu, vergi ve askerlik işlerinin bir düzene bağlanacağı, ve  en  önemlisi  yargılanmadan  kimsenin  suçlanamayacağı  ve cezalandırılamayacağı belirtilmiştir. Tüm bu haklar istisnasız olarak bütün Osmanlı  vatandaşları  için  sözkonusu  olacaktır.  Tanzimat  fermanından hemen sonra bu eşitliği sağlamak için çıkarılan 1840 (1256 H.) tarihli Ceza Kanunnamei Hümayûnu u çok anlamlıdır. Bu kanuna göre, tüm Osmanlı vatandaşları kanun önünde istisna gözetilmeksizin eşit olarak ceza kanunu hükümleri  uygulanacaktır.461851  yılında  çıkarılan  Ceza  Kanununda  yine müslüman-gayrimüslim,  büyük  küçük  ayrımı  yapılmadan  adam  öldürme suçlarında herkese aynı hükümlerin uygulanacağı vurgulanmıştır.47  Gayrimüslimler hakkında yeni çıkarılan ceza kanunun uygulamasına ilişkin bir arşiv belgesinde, Abraham? isimli bir gayrimüslim 1268 H. ( 19 kasım 1851) tarihli verdiği arzuhal ile kardeşi Marya yı öldüren İsai nin cezasının infazını talep etmektedir. Arzuhalde, Abraham'ın Kandiye'ye bağlı Aksaray  kazasında  oturan  küçük  kardeşi  Marya  kendi  halinde  ırzıyla (halinde) yaşayıp, yine aynı kazanın Helvadere köyü halkından İsai isimli zimminin Marya'yı sana yüzme öğreteyim diye nehire götürüp öldürdüğü ve                                                  45  Münci Kapani.1972. Kamu Hürriyetleri (4. Bası).Ankara:Ankara Üniversitesi Yayınları, s. 85-86;  Ahmet Mumcu-Elif Küzeci.2001. İnsan Hakları ve Kamu Özgürlükleri (5. Bası). Ankara:Turhan Kitabevi, s. 158. 46  Ceza Kanunnamei Hümayûnu, Karakoç Serkiz, Külliyatı Kavanin Dosya No: 5 NO: 992, Türk Tarih Kurumu Kütüphanesi.  47  Kanun-ı Cedid, Karakoç Serkiz, Külliyatı Kavanin Dosya No: 7 NO: 997, Türk Tarih Kurumu Kütüphanesi. 48  B.O.A., C.ADL, 24 M. 1268 H.,Dosya No: 73, Gömlek No: 437 185Gayrimüslim Osmanlı Vatandaşlarının Hukuki…   AÜHFD, 64 (1) 2015: 171-193 yapılan  yargılama  sonucu  bu  katl  olayını  işlediğinin  sabit  olduğunu belirterek hükmün icrası için valiye yazı yazılması istenmiştir. Bu dilekçeye istinaden  verilen  buyrulduda,  kısasın  uygulanabilmesi  için  İstanbul'da meydana gelen öldürme olaylarında davanın mutlaka şeyhülislam huzurunda görülerek, suçun sabit olması ve şahitlerin güvenilirliklerinin tesbitinden sonra  gerçek  ortaya  çıkarsa  konuyla  ilgili  padişahın  fermanının  çıkması gerektiği, taşralarda  ise  memleket danışma  meclisinde  kanun  marifetiyle yazılı  şartlara  uygun  olarak  davanın  görülüp  hazırlanan  ilam  ve  meclis mazbatasının Dersaadet'e gönderilmesi ve dava sonucu fetvahanede tasdik olunduktan  sonra  padişah  fermanı  alınması  gerektiği  belirtilmektedir. İncelediğimiz  bu  belge,  iki  açıdan  önemlidir.  Birincisi,  adam  öldürme suçlarında  failin  Müslüman  veya  zimmi  olmasına  bakılmadan  yine  şeri hükme göre yani kısasın uygulanacaktır. Ancak kısas cezası uygulanabilmesi için  mutlaka  ferman-ı  âli  olması  gerekmektedir.  İkinci  olarak  ceza davalarında, müslüman ve gayrimüslim halk arasında usul yönünden de hiç bir farklılık olmadığını herkesin eşit tutulduğunu göstermektedir.  Gayrimüslim Osmanlı vatandaşlarının hukuki statüsünün belirlenmesi açısından  en  önemli  gelişme  ise  kuşkusuz  Islahat  Fermanının  ilanıdır. Fermanda  gayrimüslimlerin  aslında  daha  öncede  sahip  oldukları  haklar vurgulanarak,  bazı  yeniliklerde  getirilmiştir. Tüm  Osmanlı  vatandaşları devlet  hizmetlerine,  askeri  ve  mülki  okullara  herhangi  bir  ayrım yapılmaksızın alınabilecekti. Getirilen bir başka yenilik ise Müslümanlar ve gayrimüslimler  arasında  çıkan  ticari  ve  ceza  davalarının  karma mahkemelerde  görülecek  olmasıdır.  Müslümanlarla  zimmiler  arasındaki davalara karma mahkemelerde bakılması ve gayrimüslimlerin şahitliğinin kabul edilmesi açıkça İslam hukukuna aykırılık teşkil etmektedir.50 . Islahat Fermanı ile aslında, devleti kurtarmak amacıyla Osmanlılık kavramından hareket  edilmiş,  din  ayrımı  yapılmaksızın  mutlak  bir  eşitlik  kavramı                                                  49  Gayrimüslim Osmanlı vatandaşları din ve ibadet özgürlüğüne sahip olup, din ve mezhep değiştirmeye zorlanamayacak ayrıca kendi dini şeflerini seçebileceklerdi. Eskisinden farklı olarak ise, yeni kurulacak olan ve din adamlarıyla laik kişilerden mürekkep meclislerde cemaat işlerinin yürütüleceği hükme bağlanmıştır.  Kapani, ayrıca Islahat Fermanı ile getirilen din ve vicdan özgürlüğünün,  gerçek bir özgürlük olmadığını, çünkü amacın sadece hristiyan tebaaya dini ayin ve ibadet özgürlüğü vermek olduğunu, bunun gerçek bir inanç ve kanaat hürriyetine sahip olmak manasına gelmediğini ileri sürmektedir. Kapani, s. 88.  50 Engelhardt, s. 137-138; Mumcu,s. 160. Akyılmaz, s.129. 186AÜHFD, 64 (1) 2015: 171-193   Konan yaratılmaya  çalışılmıştır. Ancak bir yanda  eşitlik sağlanmaya  çalışılırken diğer  yanda  zimmilere  ve  yabancılara  tanınan  ayrıcalıklar  yüzünden amaçlanan hukuk birliği sağlanamamıştır. Görüldüğü gibi Islahat Fermanı ile, millet sistemi yeniden düzenlenerek gayrimüslimlere  geniş  ayrıcalıklar  tanınmıştır.  Bunun  için  her  milletten kurulacak  bir  komisyona  bu  konu  ile  ilgili  metinleri  hazırlama  yetkisi verilmiştir. Yapılan yenilikler aslında hükümet ile ruhani reisler arasındaki ilişkilerin yeniden şekillendirilmesinden ibaretti. Ruhani reislerin yetkileri kısıtlanmış, her millet için oluşturulan bu komisyon ve meclislere yetkilerin bir kısmı devredilmişti. Tanzimat Dönemine kadar imparatorluk içinde en imtiyazlı sınıf olan Rum milleti diğer milletlerle aynı seviyede tutulmayı bir aşağılama olarak görmüştü. Rum Patrikliği, hem bu nedenden dolayı hem de halktan  vergi  toplama  yetkisinin  halk  meclislerine  devrinden  memnun kalmadığı için Tanzimat ve Islahat fermanları ile getirilen yeniliklere karşı çıktı. Hatta, Rumlardan bazı kimseler   Devlet bizi Yahudilerle beraber etti. Biz islamın tefevvukuna razı idik.   şeklinde itiraz etmişlerdi.   1861  (1277  H.)  yılında  Rum  Patrikliği  Nizamnamesi  çıkarıldı.  Bu nizamname ile, ruhani meclis yanında okul, hastane, eğitim gibi din dışında kalan günlük işlerle uğraşmak üzere bir meclis oluşturuldu. Yeni oluşturulan bu  cismani  meclisin  üyelerinin  çoğu  halk  tarafından  seçilmiş  kişilerdi. Bundan sonra iki meclis toplanarak drahoma akçesi, cihaza ilişkin davalar ile, manastır ve kiliselerin gelirlerine dair vasiyetname ve vakfiyelere ilişkin davalara birlikte bakacaktı. Bunun dışında, 1879 yılında önceden Hariciye Nezaretine bağlı olan ruhani reislikler Adliye Nezaretine bağlandı. Artık piskoposların  cemaat  mahkemelerinde  değil  şeriye  mahkemelerinde yargılanarak, Osmanlı memurları tarafından tutuklanabilecekti.51  1863  (1279  H.)  yılında  ise,  Ermeni  Patrikliği  Nizamnamesi yayınlandı.52  Ermeni  Patrikhanesinde  de  Rumlarda  olduğu  gibi,  ruhani meclis yanında kendi cemaatleri içinden seçilen kişilerden oluşan bir meclis (cismani meclis) daha kuruldu. Ardından 1865 yılında (1281 H.) Hahamhane Nizamnamesi 53yayınlanarak Hahamhane içinde de dini ve laik meclisler oluşturuldu. Bu Nizamname ile İstanbul daki hahambaşı Osmanlı Devleti                                                  51 Bozkurt, s. 172 52 Düstur, I. Tertip, C. 4, s. 938-961. 53 Düstur, I. Tertip, C.4, s. 962-975. 187Gayrimüslim Osmanlı Vatandaşlarının Hukuki…   AÜHFD, 64 (1) 2015: 171-193 içindeki tüm Musevilerin ruhani reisi olarak tanındı. Osmanlı Devleti, 1831 yılında İstanbul da kurulan Katolik Ermeni Patrikliğini tanımış, yine, 1878 Nizamnamesi  ile  ülkesi  içindeki  Protestanları  bir  millet  olarak  kabul etmiştir.54 Tanzimat  Döneminde  gayrimüslimler  hakkında  yapılan  önemli düzenlemelerden  biri  de  Vilayet  Nizamnamesi  ile  zimmilere  vilayet meclislerinde temsil hakkı tanınmasıdır. 551869 yılında çıkarılan Tabiiyet-i Osmaniye  Kanunnamesinin  9.  maddesi  ile  artık  Osmanlı  Devleti nde zimmilik statüsü tamamen kaldırılarak yerine Osmanlı vatandaşlığı kavramı konmuştur.  Bu  kanunla,  İslam  hukukundaki  din  kıstasına  dayanan vatandaşlık kavramı yerine dinsel ilkelerden arındırılmış, modern uyrukluk kavramı getirilmiştir.  1876 anayasasında yer alan  Osmanlı tabiiyetinde bulunan herkes hangi din ve mezhepten olursa olsun istisnasız  Osmanlı  tabir olunur  maddesi, müslüman-gayrimüslim vatandaş ayrımının kalktığını göstermektedir.  1917  tarihinde  çıkarılan  Hukuk-ı  Aile  Kararnamesi  58  ile  cemaat mahkemelerin  kazai  yetkisine  son  verilerek  şer'iye  mahkemeleri  ahval-i şahsiye alanında tek yetkili mahkeme kılınmıştır. Kararnâmede bu durum  Rûhâni reislerin (gayrimüslim din görevlilerinin) akit ve nikâhın feshi ile onun  tamamlayıcısı  eşlerin  nafakası,  drahoma  ve  çeyiz  hakkında  yargı yetkileri  ilga  edilmiştir. Ancak,  Hukuk-ı Aile  Kararnamesi  1919  yılında kaldırılınca  cemaat  mahkemelerinin  kazai  yetkileri  kendilerine  geri verilmiştir. Sonuç olarak gayrimüslimlerin ahval-i şahsiyeye ilişkin davaları devlet sona erene kadar kendi cemaat mahkemelerinde görülmüştür. Osmanlı Devleti nin  yıkılmasından  sonra  da  Türkiye  Cumhuriyetinin  imzaladığı Lozan Barış Antlaşması ile gayrimüslimlerin başta adli olmak üzere tüm hakları güvence altına alınmıştır.                                                  54 Düstur, I. Tertip, C. 4,s. 652-654 55 Akyılmaz, s. 132. 56 Kanunnamenin tamamı için bkz: 7 Şevval 1285, 8 Kanun-ı sani 1284 H., Serkiz Karakoç, Tahşiyeli Kavanin, C.II., Cihan Matbaası, 1341/1343, s. 3-8. 57  9. Madde: Memalik-i mahrusa-i padişahi de ikamet eden her bir şahıs tebaayı Devlet-i Aliyyeden madud olup hakkında devlet-i aliye tabi muamelesi icra olunur. Eğer kendisi tebaayı ecnebiyeden ise tabiiyetini usulen isbat etmesi lazım gelir. 58  Düstur,II.Tertip, C.9, s. 762-781;Orhan Çeker. 1999. Osmanlı Hukuk-ı Aile Kararnamesi. Konya: Mehir Vakfı Yayınları. s.23-104: Mehmet Akif Aydın.1985.  İslam-Osmanlı Aile Hukuku. İstanbul: Marmara Üniversitesi Yayınları.s. 245 vd.  188AÜHFD, 64 (1) 2015: 171-193   Konan Araştırmamızı  sonlandırmadan  önce,  Osmanlı  Devletinin gayrimüslimlere  yaklaşımını  göstermesi  açısından,  Tanzimat  Döneminde çıkarılan 1898 tarihli bir ilannameye yer vermek istiyoruz.59   Padişah hazretlerinin memleket ve milletin kurtuluşuna sebep olacak güzel işlerinden biri de Osmanlı vatandaşlarının birbiriyle kaynaşarak tam bir  huzur  ve  rahat  içinde  hayat  sürmeleri,  hiç  kimsenin  dışarıda bırakılmadan adalet nimetinden faydalanmaları ve bütün memurların bu hususa dikkat etmekle beraber güvenliğin korunması gibi önemli bir konuda gece gündüz demeden gayret göstermeleridir. Konuyla ilgili olarak daha önce padişah emirleri Babıâli'ye tebliğ edilmiştir. Bu emirlere göre valiler vilayete bağlı yerleri devamlı bir surette dolaşıp teftiş ile hükümetin rızasına aykırı  uygunsuz  durumların  ortaya  çıkmaması  ve  kimsenin  zulme uğramaması hususunda gerekli önlemleri alacaklardır. Öyle ki çok adi bir suç  ortaya  çıktığında  bile  suçluyu  takip  ederek  mahkemeye  sevk  etmek suretiyle adaleti hakkıyla temin etmeleri için padişah tarafından defalarca emirler çıkarılarak Sadaret'e ayrıntılı bir şekilde tebliğ edilmiştir. Bütün bu emirlere  uyularak  vilayetlerce  toplumun  refah  ve  mutluluğunun gerçekleşmesi ile asayişin korunması ve halk arasındaki iyi ilişkilere özen gösterildiği halde şu sıralar bazı yabancı gazetelerde bir takım uygunsuz makaleler göze çarpmaktadır. Bu makalelerde Rumeli tarafında bazı halk unsurlarının diğerleri aleyhinde düşmanca tavırlar besledikleri ve devletine bağlı vatandaşlar aleyhinde çeşitli tabirler ile yazı ve tasvirler yapılması padişah  tarafından  üzüntü  ile  takip  edilmektedir.  Halbuki  Osmanlı Devleti'nin  yürürlükteki  kanun  ve  nizamları  zaten  halkın  durumu  ve çeşitliliği  göz  önünde  bulundurularak  düzenlenmekle  beraber  uygulanan hükümler  ve  mevzuat  eskiden  beri  gerektiği  zaman  gerekli  tadilatlar yapılarak yürütülmüş olduğundan her yönden mükemmeliyet ve genişliğe sahip olmuştur. Hal böyle olunca devletin kanun ve nizamlarının hakkıyla tatbik  ve  hükümlerinin  uygulanmasına  dikkatle  hiçbir  uygunsuz  durum meydana  gelmemesi  ve  en  küçük  basit  bir  suç  vukuunda  bile  derhal mahkemeye sevkiyle kanun hükmünün yerine getirilebilmesi için valilerin vilayetleri dolaşıp kontrol ederek hükümetin umum hakkındaki hissiyat ve iyi niyetini ahaliye anlatmaları gerekmektedir. Bir vatanda yaşayan insanların hiçbir  şekilde  diğeri  aleyhinde  bulunmalarının  uygun  olmadığı  ve birbirleriyle  iyi  geçinerek  hükümete  bağlılık  göstermeleri  gerekmektedir.                                                  59  B.O.A., 28 L 1316 H., İ.HUS, Dosya No:73 Gömlek No: 46 189Gayrimüslim Osmanlı Vatandaşlarının Hukuki…   AÜHFD, 64 (1) 2015: 171-193 Buna aykırı hareketleri görülenlerin hangi cemaate bağlı olurlarsa olsunlar bir  uygunsuzluk  ortaya  koyduklarında  kanuni  cezaya  uğrayacaklarının müslüman halka  muhtarlar  vasıtasıyla, Hristiyan  halka  da diğer ruhani reisleri tarafından anlatılması için ilgili vilayetlere tebliğat yapılması ve bu durumun yerel gazetelerde neşri hususlarında gereği yapılacaktır.  şeklinde yazılan ilanname, Sadaret makamı tarafından Kosova, Manastır, Selanik ve Yanya vilayetlerine de gönderilmiştir. Sözkonusu ilannamede, devletin amacının, gayrimüslim vatandaşlar ile müslüman vatandaşların beraberlik ve uyum içinde yaşamasını sağlamak olduğu  belirtilirken,  aynı  zamanda  kanunların  herkese  eşit  uygulanacağı vurgulamıştır. SONUÇ Kuruluşundan  itibaren  Osmanlı  Devletinde  müslümanlar  ve gayrimüslimler  birlikte  yaşamışlardır.  Aslında  gayrimüslimlerin  hukuki statülerinin tespit edilmesi ve sınırlarının saptanması oldukça zordur. Ancak çok  genel  bir  değerlendirme  yapmak  gerekirse,  Osmanlı  Devleti nin gayrimüslim vatandaşlarına İslam hukukundaki zimmet anlayışına uygun davrandığını söyleyebiliriz. Devlet, din ve vicdan özgürlüğü çerçevesinde gayrimüslim vatandaşlarına bir taraftan geniş yetkiler tanırken, bir taraftan da ruhani liderler aracılığı ile onları denetleme yoluna gitmiştir. Özel hukuk alanında  özellikle  evlenme,  boşanma,  nafaka,ile  yine  ahval-i  şahsiyeye ilişkin sayılan miras ve  vasiyet konularında  kural olarak gayrimüslimler davalarını cemaatleri içinde çözebilmişlerdir. Ancak yukarıda işaret ettiğimiz gibi,  bu  durum  yargılamadan  çok,  hakemliğe  benzemektedir.  Çünkü, gayrimüslimlerin bu konuda şer'î mahkemelere başvurma hakları her zaman mevcuttu.  Arşivde  yer  alan  belgelerden  de  bu  haklarını  sıklıkla kullandıklarını gözlemledik. Kamuya ilişkin alanlarda ise esas olan Osmanlı hukukunun mülkiliği ilkesiydi. Klasik  dönemde  amaç,  eşitliğin  sağlanması  değil,  belki  de  eşit olmayanların  bir  arada  hoşgörü  ile  yaşamasını  sağlamaktı.  Tanzimat döneminden itibaren çıkartılan yasalar ile din kıstası kaldırılarak devletin tüm  vatandaşları  din,  dil  ırk  mezhep  ayrımı  olmaksızın  eşit  kılınmaya çalışılmıştır. Kanımızca, Osmanlı nın uyguladığı siyaset, yönetimi altında bulunan farklı dinlere mensup kişileri eritmek değil, aksine onları Osmanlı adı verilen büyük bir vücudun birer organı yapmaya yöneliktir. 190AÜHFD, 64 (1) 2015: 171-193   Konan KAYNAKÇA Akyılmaz,  Gül.  2000.  Osmanlı  Devletinde  Eşitlik  Kavramının  Gelişimi. Profesörlük Çalışması.Konya. Ansay, Sabri Şakir.2002. Hukuk Tarihinde İslam Hukuku(4. Bası).Ankara: Turhan Yayınevi. Abu Jaber, Kamel.S.1967. The Millet System in the Nineteenth Century Ottoman Empire , The Muslim World LVII,(3) Aydın, Mehmet Akif.1985. İslam-Osmanlı Aile Hukuku. İstanbul: Marmara Üniversitesi Yayınları. Aydın,  Mehmet  Akif.2005.  Türk  Hukuk  Tarihi.  (5.Bası).  İstanbul:  Hars Yayıncılık. Bozkurt,Gülnihal.1987.  İslam Hukukunda Zimmilerin Hukuki Statüleri . Dokuz  Eylül  Üniversitesi  Hukuk  Fakültesi  Kudret Ayiter Armağanı, III.(14). Ankara. Bozkurt,Gülnihal.  1996.  Gayrimüslim  Osmanlı  Vatandaşlarının  Hukuki Durumu, (1839-1914). Ankara: TTK Yayınları Braude,  Benjamin.1982   Foundations  Myths  of  The  Millet System .Christians and Jews in the Ottoman Empire ,the Functionig of a Plural Society(I), Newyork:Holmes-Meier Publishers. Cahen, Claude. 1963a  Dhimma ,E.I 2 ,II, Leiden:E.J.Brill, 227-231. Cahen, Claude. 1963b  Djizya , E.I.2 ,II, Leiden: E.J.Brill, 559-562. Çeker,Orhan. 1999. Osmanlı Hukuk-ı Aile Kararnamesi. Konya: Mehir Vakfı Yayınları. Düzdağ,Ertuğrul.1972. Şeyhülislam Ebusuud Efendi'nin Fetvaları Işığında 16. Asır Türk Hayatı, İstanbul:Enderun Kitabevi Ekinci, Ekrem Buğra. 2008. Osmanlı Hukuku, Adalet ve Mülk.İstanbul: Arı Sanat Yayınları. Ekinci, Ekrem Buğra.2011. Hukukun Serüveni, İstanbul:Arı Sanat Yayınları. Engelhardt,Ed. 1999.Türkiye ve Tanzimat.İstanbul: Kaknüs Yayıncılık. 191Gayrimüslim Osmanlı Vatandaşlarının Hukuki…   AÜHFD, 64 (1) 2015: 171-193 Eryılmaz,  Bilal.  1990.Osmanlı  Devletinde  Gayrimüslim  Teb anın Yönetimi.İstanbul:Risale Yayınları. Gıbb,H.A.R. /Bowen,Harold.1957. Islamic Society and The West I, London: Oxford University Press. Hamidullah, Muhammed. 1998. İslamda Devlet İdaresi.(5. Bası).İstanbul: Beyan Yayınları. Hatemi, Hüseyin. 2012. İslam Hukuku Dersleri. İstanbul: Sümer Kitabevi. İnalcık,Halil.  2009.  Devlet-i  Aliyye,  Osmanlı  İmparatorluğu  Üzerine Araştırmalar. İstanbul:Türkiye İş Bankası Yayınları. Jennings, Ronald,C. 1978.  Zimmis (non-muslims) in Early 17.th Century Ottoman Judicial Records , Journal of the Economic and Social History of the Orient, XXI, (3) ,225-293. Münci  Kapani.1972.  Kamu  Hürriyetleri  (4.  Bası).Ankara:Ankara Üniversitesi Yayınları. Karakoç,Serkiz.1341 H.. Tahşiyeli Kavanin II, Dersaadet:Cihan Matbaası. Karakoç  Serkiz,  Külliyatı  Kavanin  Dosya  No:  5  NO:  992,  Türk  Tarih Kurumu Kütüphanesi. Karakoç  Serkiz,  Külliyatı  Kavanin  Dosya  No:  7  NO:  997,  Türk  Tarih Kurumu Kütüphanesi. Karaman, Hayrettin. 2013. Mukayeseli İslam Hukuku I,( 8. Bası).İstanbul:İz Yayıncılık. Hayreddin Karaman.2013. Mukayeseli İslam Hukuku, III.(8. Bası).İstanbul: İz Yayıncılık. Kenanoğlu, Mustafa Macit. 2004. Osmanlı Millet Sistemi Mit ve Gerçek. İstanbul:Klasik Yayıncılık. Kenanoğlu, Mustafa Macit. 2005.  İslam Hukukunda Zimmiler . Türkiye Araştırmaları Literatür Dergisi, 3,(5).553-574. Konan,  Belkıs.  2013,Osmanlı  Devletinde  İdari  Yargının  Gelişimi. Ankara:Statü Yayıncılık. 192AÜHFD, 64 (1) 2015: 171-193   Konan Mumcu Ahmet./ Küzeci, Elif.2001. İnsan Hakları ve Kamu Özgürlükleri. Ankara:Turhan Kitabevi. Ortaylı,İlber.2003. Osmanlı Barışı. İstanbul:Ufuk Yayınları. Ortaylı,İlber.2007. Osmanlı İmparatorluğunda Millet Nizamı , Batılılaşma Yolunda.İstanbul:Merkez Kitapçılık Yayıncılık. Özel,Ahmet.1982.İslam  Hukukunda  Milletlerarası  Münasebetler  ve  Ülke Kavramı. İstanbul. Özkaya,Yücel.  2010.  18.Yüzyılda  Osmanlı  Toplumu.  İstanbul:Yapı  Kredi Yayınları. Yavuz,Ercan.2001.Osmanlı  Yönetiminde  Gayrimüslimler  Ankara:Turhan Kitabevi. ARŞİV BELGELERİ (BAŞBAKANLIK OSMANLI ARŞİVİ) B.O.A., C.ADL, 29 Z. 1131 H. (1718 M.),Dosya No: 1 Gömlek No: 60. B.O.A., C.ADL, 29 B 1137 H., Dosya No: 61 Gömlek No: 3655. B.O.A., C.ADL, 22 R 1225 H., Dosya No: 58, Gömlek No: 3498. B.O.A., C.ADL., 28 C 1226 H (1811 M.).tarih, Dosya No: 44, Gömlek No: 2654. B.O.A., C. ADL., Dosya No: 22 Gömlek No: 1304, 29 C 1141 H. B.O.A., C.ADL, 24 M. 1268 H.,Dosya No: 73, Gömlek No: 437. B.O.A., C.ADL, 05 L 1192 H., Dosya No: 59, Gömlek No: 3564. B.O.A., 28 L 1316 H., İ.HUS, Dosya No:73 Gömlek No: 46.       193Gayrimüslim Osmanlı Vatandaşlarının Hukuki…   AÜHFD, 64 (1) 2015: 171-193         194",
     "Abstract": "In the multinational Ottoman Empire, people were divided into groups only according to their religion; nation concept in the modern sense did not exist and in this regard, the Jewish, the Armenians and the Rums who composed nearly the half of the population lived freely until the collapse of the state without losing their identities and being forced to convert to Islam. In the Ottoman Empire, non-Muslim groups benefited from the protection of the Islamic law due to the Treaty of Zimmet. In this study, the legal status of the individuals who lived in the Ottoman Empire, an Islamic state, and who were called  zimmis  will be examined in the light of archival documents. In our research, the rights that non-Muslims who resided in Ottoman territories had in terms of private and public law will be reviewed in the light of several archival documents.",
     "Metin": "İslam hukukuna göre zimmiler ve müslümanlar hukuksal, sosyal durum ve  siyasal  olarak  eşit  değillerdi.  Osmanlı  Devletinde,  İslam  hukukunun ilkelerine bağlı olarak, Müslümanların durumunu ümmet anlayışına göre düzenlenmiş, fethedilen topraklarda yaşayan zimmilerin hukuki durumları ise zimmet kurumu çerçevesinde belirlenmişti. Darülharb de yaşarken, cihat sonucu  tek  tanrılı  dinlere  inanan  topluluklar   zimmet   adı  verilen  bir antlaşma  sonucunda  İslam  devleti  tarafından  korunurlar.  Dinlerini değiştirmeden, bir İslam Devletinin koruma altına aldığı bu kişilere zimmi adı  verilir.2  Çalışmamızda,  zimmi  kelimesi,  Osmanlı  gayrimüslim vatandaşları ile aynı anlamda kullanılacaktır. Osmanlı Devleti İslam dinine göre yapılandığı için, vatandaşlık kavramında din kıstası esas alınmıştı. Bu nedenle günümüz hukuk sistemlerinden farklı olarak Osmanlı toplumunda                                                  1  Cahen, Claude. 1963a  Dhimma ,E.I  2 ,II, Leiden:E.J.Brill, 227-231, s. 227 2  Zimmiler hakkında geniş bilgi için bkz: Ahmet Özel.1982. İslam Hukukunda Milletlerarası Münasebetler ve Ülke Kavramı. İstanbul; Bozkurt, Gülnihal. 1996. Gayrimüslim Osmanlı Vatandaşlarının Hukuki Durumu, (1839-1914). Ankara: TTK Yayınları,s.7-8, Muhammed Hamidullah. 1998. İslamda Devlet İdaresi.(5. Bası).İstanbul: Beyan Yayınları, s. 395 172AÜHFD, 64 (1) 2015: 171-193   Konan vatandaşlık günümüz anlamında milliyet esasına göre değil, din esasına göre belirlenirdi. Başka bir deyişle, Müslüman olan kimseler Arap, Türk, Habeş ayrımı yapılmaksızın Müslüman milletinden sayılırken, devletin egemenliği altında  yaşayan  gayrimüslimler,  mezhep  veya  dinlerine  göre  sınıflara ayrılmış ve her topluluk millet adı verilen bir sistem içinde yönetilmiştir. Osmanlı Devletinde genel olarak üç milletten sözedilir. Yahudiler, Ermeniler ve Rumlardan oluşan bu millet sisteminde, kendi cemaati tarafından seçilen her dinin en yüksek rütbeli görevlisi kendi gurubunun işlerini düzenlemek, hukuki  işlerini  yürütmek  ve  idare  etmekle  görevliydi.  Dini  şefe  devlet tarafından verilen bir berat ile, şefin cemaati üzerindeki hukuki ve idari yetkileri belirlenirdi. Dini şefler, topluluğun malını idare etme görevinden başka, dini ayinleri, dini işleri yürütmekle ve cemaatlerinden miktarı belli olan vergileri toplamakla da görevliydiler.6 Doktrinde,  millet sistemi 7 adı verilen  bu  sistemde  ruhani  liderlere  verilen  yetkinin  dini  topluluk  için serbesti  sağladığı  genel  kabul  görmekte  ise  de,  son  40  yıldır  Osmanlı Devletinde uygulanan sistemin millet adı verilen topluluklara hiç bir şekilde otonomi sağlamadığı, bunun   iltizam sistemi  olduğuna ilişkin tartışmalar yoğunlaşmıştır.8                                                  3  Ronald,  Jennings,   Zimmis  (non-muslims)  in  Early  17.th  Century  Ottoman  Judicial Records .Journal of the Economic and Social History of the Orient, XXI, Part.3 (225-293); Bozkurt,s.,7-8;  Kamel.S., Abu Jaber.1967.  The Millet System in the Nineteenth Century Ottoman Empire , The Muslim World  LVII,(3), s. 213;  Bilal, Eryılmaz.1990.Osmanlı Devletinde Gayrimüslim Teb anın Yönetimi. İstanbul:Risale Yayınları. 4  Osmanlı zimmileri için millet kavramı içinde yer almışlardır. Ancak doktrinde zimmilerden azınlık olarak sözedenler olsa da azınlık kavramının Osmanlı hukuk literatürüne girişi 20. yüzyılda olmuştur.. Ekrem Buğra,Ekinci. 2008. Osmanlı Hukuku, Adalet ve Mülk.İstanbul: Arı Sanat Yayınları, s. 316. Ortaylı, millet sözcüğünün dini bir aidiyeti .ifade ettiğini bu nedenle günümüz anlamındaki nation sözcüğü ile eş anlamlı olmadığını belirterek, ekalliyet yani azınlık kelimesi ile de eş değer tutulamayacağını söyler. Ayrıntılı bilgi için bkz:İlber Ortaylı.2007. Osmanlı  İmparatorluğunda  Millet  Nizamı ,  Batılılaşma Yolunda.İstanbul:Merkez Kitapçılık Yayıncılık. s. 171. İlber, Ortaylı.2003. Osmanlı Barışı. İstanbul:Ufuk Yayınları. s. 48.  5  Ermeniler protestan ve Katolik olup olmamalarına göre farklı milletlere ayrılırken, Bulgar ve Rumlar Ortodoks ise Rum milletine tâbi olurlardı.  6  Engelhardt,  Rum  Patriğinin  bu  yetkilerini   İmperium  in  İmperio   .  olarak Engelhardt.1999.Türkiye ve Tanzimat. İstanbul:Kaknüs Yayıncılık. s.119 7   Aydın, Mehmet Akif.2005. Türk Hukuk Tarihi ( 5. Bası). İstanbul: Hars Yayıcılık. s. 160. 8  Millet sistemi ve iltizam sistemi ile ilgili tartışmalar için bkz: Mustafa Macit, Kenanoğlu. 2004. Osmanlı Millet Sistemi Mit ve Gerçek. İstanbul: Klasik Yayıncılık. s. 44-56; Ekinci, s.322; Benjamin, Braude. 1982  Foundations Myths of The Millet System .Christians and 173Gayrimüslim Osmanlı Vatandaşlarının Hukuki…   AÜHFD, 64 (1) 2015: 171-193 Bunun  dışında,  dini  reislerin  kendi  cemaat  üyelerinin  evlenmeleri, boşanmaları ve miras paylarını dağıtma gibi görevleri de vardı. Bir başka deyişle, aşağıda değineceğimiz ahvali şahsiye olarak nitelendirilen ve özel hukuka giren anlaşmazlıklarda dini şeflerin muhakeme yetkisi bulunurdu.9 Patrikler tarafından cemaat üyelerine bazı cezaların verilmesi ise, sadece kendi din kurallarına aykırı hallerde sözkonusu olabiliyordu. Yani, kamu düzenini  ilgilendiren  ve  takibi  devlet  tarafından  yapılan  suçlarda cezalandırma hakları yoktu. Bu nedenle verilen cezayı hukuki anlamda bir ceza  olarak  değil,  bir  disiplin  cezası  olarak  nitelendirmek  daha  uygun olacaktır.10 Dini şefler, hukuki ve idari yetkilerini devlet tarafından verilen berattan alırlardı. Ayrıca, dini liderlerin cemaatlarını yönetme yetkilerine Osmanlı memurlarınca bile müdahale edilemezdi. Bununla ilgili bir örnek, Ohri ve tevabii patrikliğine dahil kazalarında piskopos, papaz, keşiş ve sair zimmilere kimse tarafından taarruz ve müdahale olunmamasına ilişkin 1131 H. /1718 M. tarihli belgede yer alır.11 1778 yılında Rum Patrikliği tarafından verilen bir arzuhalde, Ürgüp kasabasında sakin Kuyumcu nam zimminin Samsun'da kalebend edilmesi istenmiştir.12 Arzuhalden anlaşıldığı kadarıyla                                                                                                                    Jews in the Ottoman Empire ,the Functionig of a Plural Society(I), Newyork:Holmes-Meier Publishers.s. 69 , 78.  9  Gül  Akyılmaz.2000.  Osmanlı  Devletinde  Eşitlik  Kavramının  Gelişimi,  Profesörlük Çalışması.Konya.  s.91-92;  Kenanoğlu,  zimmilerin  miras  hukuku  ile  ilgili davalarında cemaat  mahkemelerinin  değil  şeriye  mahkemelerinin  yetkili  olduğunu  bazı  arşiv belgelerine dayanarak işaret etmektedir. Yazara göre, miras taksimi  esas olarak  rızai bir işlem olup kadılar buna karışmazlar. Ancak varislerden yaşı küçük olan veya gaip olan varsa bu ihtilafa kadı bakar. Kenanoğlu,s. 252,264, 259, 397 10  Aynı görüş için bkz:Kenanoğlu, s. 238; Ekinci, s. 322. 11  B.O.A., C.ADL, 29 Z. 1131 H. (1718 M.),Dosya No: 1 Gömlek No: 60  Derkenarı ve olı geldiği üzre şurutuyla sah buyuruldu Ohri ve tevâbi‘i patrikliği sahib-i arzuhal Yuvasef nam rahibe tevcih ve yedine berat-ı alişân verilip iltizamında olan metrapolid ve sayir dahi tayifesinin senevî üzerlerine edası lazım gelen mîrî rusum ve ayazmaları ve manastır ve dükkanları cem‘i için kanun üzre zabt için emr-i şerif verilegelmişdir ol babda emr u ferman devletli ve saadetli sultanım hazretlerinindir.  12  B.O.A., C.ADL, 05 L 1192 H., Dosya No: 59, Gömlek No: 3564, arzuhal üzerine verilen hükümde , şu şekildedir.:  Zikri âtî manastırın vâki olduğu kazanın kadısına ve Yanya sancağı mütesellimine hüküm ki: İstanbul ve tevâbi‘i Rum Patriği Deraliyyem'de mukîm cemaat mukim cemaat metropolidan gelip kendi Yanya Metropolidi iltizamında nefs-i Yanya  sekenesinden  Makri  Venastaş nam  zimmî  öteden  beri  kendi  halinde  olmayıp mücerred vazifesi olmayan işlere suluk ve muğayir-i ayin harekât-ı nâ-hemvareye cesaret edip  biddefe‘ât  kendi  halinde  olmasını  tenbieh  ve  pend  nush  oldukda  ısgâ  etmeyip melanetinde ısrar ve sezavar-ı tedib olmadığın kaza-i mezbur reayasından mutemed ve ehl-i 174AÜHFD, 64 (1) 2015: 171-193   Konan Makri Venastas? Adlı zimmi  kendi halinde olmayıp  , topluluğu rahatsız edici davranışlarda bulunmuş, ruhani reis tarafından adı geçen kişiye tenbih gibi bazı müeyyidelerde bulunulmuş olsa da çevresine rahatsızlık vermeye devam  etmiştir.  Bunun  üzerine  Rum  Patrikliği  Makri nin? Cezalandırılmasını  Osmanlı  Devleti nden  istemiştir.  Bu  belge,  ruhani reislerin sadece disiplin cezası verme yetkisi olduğunu yani cezaya ilişkin davalarda tek yetkili makamın Osmanlı mahkemeleri olduğunu göstermesi açısından güzel bir örnektir.  Devlet, dini şefi, kendisine muhatap alarak bir anlamda idareye karşı sorumlu  saymış  ve  milletlerin  denetimini  mercek  altına  almayı kolaylaştırmıştır. Bu şekilde, gayrimüslim vatandaşlar belli bir serbestlik içinde  yaşarken,  devletin  onlar  üzerinde  yönetimi  birey  bazında  değil, cemaat olarak yürütülmesine imkan vermiştir. I.  Özel  Hukuk Alanında  Gayrimüslim  Osmanlı  Vatandaşlarının Hukuki Durumu Zimmiler, özel hukuku ilgilendiren işlerinde kural olarak kendi dini kurallarına  tabidirler.  Bunların  başında,  evlilik  ve  boşanma  ile  nafaka, velayet, mehir gibi konular gelmektedir. Cemaatlerinin din adamları özel hukuk içine giren aile hukuku ile ilgili hukuksal sorunları üstlenmişlerdi. Bu durum belgelerde   akdi nikah, fesh-i nikah ve münaziün fih olan iki zimmi arasına başkasının girmemesi, akd-i nikah ve fesh-i nikah maddelerinde münazaa eden iki zimmi mabeynlerinin rızalarıyla ıslah ve iktiza ederse kiliselerinde ayinleri üzerine yemin verdikte  şeklinde formüle edilmiştir. Bu nedenle  zaman  zaman  ruhani  liderler  nikahlara  müdahale  edilmemesini devletten  talep  etmişlerdir.13Aile  hukuku  davaları  cemaat  mahkemeleri tarafından  kendi  dinlerine  uygun  olarak  çözülürdü.  Ancak,  cemaat mahkemelerinin  vermiş  oldukları  hukuki  kararları  uygulamak  Osmanlı                                                                                                                    ırz  kimesneler  patrik  tarafına  ihbar  eylediklerin  bildirip  merkum  kaza-i  mezbur  ve kurâsında ve sair her ne mahalde bulunur ise sen ki mütesellim-i muma-ileyhsin marifetinle ahz ve ıslah-ı nefs zımnında Kalika vâki‘ Varadim manastırına manastır bend eyleyip ıtlakı için patrik-i mesfur tarafından istidâ olmadıkça ıtlak olunmamak babında emr-i şerif rica etmeğin vech-i meşruh üzre amel olunmak babında emr-i şerifim yazılmışdır ferman devletli sultanımındır. Evasıt-ı S sene [1]192 13  Bu başvurular karşısında, köy ve mahalle imamlarına gayrimüslimlere ilişkin nikahları kıymamaları  ve  ehl-i  örfün  bu  konuda  cebir  kullanmaması  ile  ilgili  emirlere rastlanılmaktadır. Örnekler için bkz: Kenanoğlu, s. 246 175Gayrimüslim Osmanlı Vatandaşlarının Hukuki…   AÜHFD, 64 (1) 2015: 171-193 yetkililerinin göreviydi. Ancak hemen belirtmemiz gerekir ki, bu zimmiler için  zorunlu  olmayıp,  eğer  zimmiler  isterlerse,  davalarını  Osmanlı mahkemelerinde görülmesini talep edebilirlerdi. Uygulamada, hristiyanların evlenme  ve  boşanmada  mali  yükümlülüklerden  çıkan  sorunlar  için  şer'î mahkemelere  başvurdukları  görülmüştür.  Bunun  dışında,  kendi  dinlerine göre  eşlerinden  boşanamayan  katolik  gayrimüslimlerin  de  Osmanlı mahkemelerini tercih ettiklerine vakalara rastlanılmaktadır.14 Burada, zimmilerin aile hukuk alanında hukuki durumunu incelerken, getirilen bir kısıtlamayı da kısaca hatırlatmakta fayda görüyoruz. Evlenme işlerinde, zimmi bir kadın dilerse Müslüman bir erkekle evlenebilir, ancak, Müslüman  bir  kadının  zimmi  bir  erkekle  evlenmesi  mümkün  değildir.15 Müslüman erkekle evlenmiş zimmi bir kadının boşanması halinde ise, İslam hukuku  kuralları  geçerli  olacaktır.  Yani,  özel  hukuka  giren  boşanma işleminde  kadının  bağlı  olduğu  cemaat  mahkemesi  yetkili  değildir.16 Evlenme, boşanma davaları yanında nafaka, drahoma ve cihaz davaları da cemaat  mahkemelerinde  görülürdü.  Cemaat  mahkemesinin  nafaka ödenmesine ilişkin kararlarının uygulanması ise Osmanlı yetkililerine aitti.  Miras hukuku açısından, zimmiler kendi din kurallarına tabiydiler. Eğer isterlerse  şer'î  mahkemelere  gitme  yetkileri  de  vardı.  Bunun  dışında, Müslümanlarla birbirlerine mirasçı olup olamamaları  dâr  kurallarına göre belirlenirdi. Farklı dinlere mensup olan iki zimminin birbirine mirasçı olup olamayacakları  tartışmalı  olmakla  beraber,  Osmanlı  devletinin  resmi mezhebi  olan  Hanefi  mezhebi  gayrimüslimlerin  farklı  dinlere  mensup olmaları  halinde  birbirine  mirasçı  olabileceklerini kabul  etmiştir.17  İslam hukukuna  göre  mirasçı  ile  miras  bırakılan  arasında  din  farkı  bulunması mirasçılığı engellemektedir ancak lehine vasiyet yapmayı engellemez. Bu nedenle, Müslümanlar ile zimmiler birbirlerine mirasçı olamazlar.18  Zimmilerin,  Müslümanlar  lehine  yaptıkları  vasiyetler  geçerli  olup, vasiyetname  ve  miras  konularında  yine  Müslümanlarla  eşit  olduklarını                                                  14  Ekinci,  319; Kenanoğlu, s. 246-249 15  Zimmi  kadının  Müslüman  erkekle  evlenmesi  durumunda  dinini  değiştirmesi  zorunlu değildir. Çünkü evlilik birliği içinde doğan çocuklar İslam hukukuna göre Müslüman olurlar.  16  Bozkurt(1987), s. 132; Akyılmaz, s. 95. 17  Karaman (I), s. 429 18  Müslüman erkekle zimmi kadının evliliğinden olan çocuklar Müslüman sayıldığı için annelerine mirasçı olamazlar. Ansay, s. 88  176AÜHFD, 64 (1) 2015: 171-193   Konan söyleyebiliriz.  Ölen  zimminin  mirasçısı  yoksa  malı  devlete  kalır.19 Gayrimüslimlerin mirasa ilişkin davalarının şer'î mahkemelerde görülmesine ilişkin  padişah  iradelerine  rastlanmaktadır.20  Yine  uygulamada,  Osmanlı gayrimüslimlerinin mirasa ait davalarını kendi dini şefleri yerine Osmanlı makamlarına götürdükleri görülmektedir. Örneğin, 1811 yılında, Tokad da zimmi bir Osmanlı vatandaşın, terekesine dışarıdan haksız yere dahil olmak isteyen  kişiler  için  şeriye  mahkemesine  başvurduğu  görülmüştür.  Bunun üzerine  çıkarılan  fermanda,  Tokad'da  sakin  Ohannes?  isimli  zimminin terekesinden pay almak isteyen kişilerin şer an muhakeme edilmeleri için Tokat kadısına davanın  şer ile görülmesi  emri verilmiştir.21.  Osmanlı  Devletinin  resmi  mezhebi  olan  Hanefi  mezhebine  göre, Hristiyanların  vakıf  kurmaları,  vakfedenin  mülkünü  kilise  adına  tescil ettirmemesi şartıyla kabul edilmiştir. Aynı şekilde hastane, çeşme vb. kamu hizmetleri  için  de  zimmilerin  vakıf  kurmasına  izin  verilmiştir.  Bu  ilke uyarınca,  gayrimüslim  Osmanlı  vatandaşları,  taşınmaz  mallar  ile  başka gayrimüslimler  lehine,  hatta  müslüman  Osmanlı  vatandaşları  lehine  bile vakıf  kurabilir  ancak,  ibadet  yerleri  için  vakıf  kuramazdı.  Yine gayrimüslimler, müslümanların kurduğu vakıflardan da yararlanabiliyordu. Görüldüğü gibi, aslında gayrimüslimlerin vakıf kurması için getirilen esaslar müslümanların vakıf kurmasından farklı değildi. Bu konuyla ilgili Üsküdar kadısına  yazılan  emirde,  Osmanlı  şehirlerinde  oturan  gayrimüslim vatandaşların manastır ve kiliseler için ev, dükkan ve diğer emlak ve akarları                                                  19  Ercan Yavuz.2001.Osmanlı Yönetiminde Gayrimüslimler.Ankara:Turhan Kitabevi.s. 11. 20   Zimmiler arasında ırs nizaının şer ile görülecek mevaddan olduğu   örnek için bkz: Kenanoğlu(2004), s. 257 21 B.O.A., C.ADL, 29 B 1137 H., Dosya No: 61 Gömlek No: 3655   ……….bulunduğu mahalden ahz ve mahalline ihzar ve şer‘le zimmetinde tahsili lazım gelip sübut bulan hakları tahsil ve ihkâk-ı hak ve arz ve ilam olunmak emrim olmuşdur buyurdum kiEmr-i şerifim vusul buldukda bu bâbda sadır olan emrim üzre amel dahi mesfur her hanginizin taht-ı kazâsında bulunur ise ahz ve çavuş-ı merkum mübâşeretiyle mahallinde ihzar ve bunlar ile mürâfa‘a-i şer‘ ve mukaddemâ bir defa şer‘le görülüp fasl olunmayan ahvâllerin tamam hak ve adl üzre tafahhus ve takayyud edip göresin ilam olunduğu üzre ise ol babda muktezâ-yı şer‘-i kavimle amel edip dahi vech-i meşru‘ üzre vârisleri mürd-i mesfurdan irs-i şer‘le intikal edip mesfurun hile ile hilaf-ı şer‘ ahz eylediği emval ve eşya ve nukudu her ne ise ba‘de's-subut hükm edip bî-kusur alıverip icra-yı hak olundukda keyfiyet-i ahvali vukuu ve sıhhati üzre yazıp der-i devlet medarıma arz ve ilam edip mazmun-ı emr-i şerifimle âmil olasın şöyle bilesin alâmet-i şerife itimad kılasın. Tahriren fî evahir şehr-i Recebi'l-ferd li-sene seb‘a ve selâsîn ve mi e ve elf [1137] 22 B.O.A., C.ADL, 22 R 1225 H., Dosya No: 58, Gömlek No: 3498 177Gayrimüslim Osmanlı Vatandaşlarının Hukuki…   AÜHFD, 64 (1) 2015: 171-193 vakf eylemeleri eskiden beri yasak olduğu, bu hususla ilgili olarak zaman zaman Rumeli, Anadolu ve Cezayir-i Bahri Sefid'deki bazı yerlere emirler yazıldığı belirtilmiştir. Buna rağmen bir süredir  bazı reaya taifesinin  yine manastır ve kiliselere taşınmazlarını vakıf tayin ettikleri haber alındığı, bu durumun eski adetlere ve padişahın emrine aykırı olduğu, bundan sonra bu gibi vakıfların yapılmaması hususunda padişahın kesin fermanı çıktığından bu  fermanın  sicil  defterlerine  kaydedilerek  bundan  sonra  kesinlikle  bu vakıflara müsaade edilmemesi istenmektedir. Yine, bir başka buyruldu da, Rumeli Anadolu ve Akdeniz adalarındaki zimmi reaya taifesinin manastır ve kiliselere ev, dükkan vesair emlak ve akar vakfetmemeleri ve bu konudaki yasağın muhafazasına itina gösterilmesi Üsküdar kadısından istenmiştir.23 Belgelerden  gayrimüslimlerin  vakıf  kurmalarında  bir  kısıtlama  olmadığı sadece, ev, dükkan vb. taşınmazlarını kilise üzerine kaydettiremeyecekleri açıkça  anlaşılmaktadır.  Ayrıca,  bu  konu  üzerinde  verilen  fetvalar  da gayrimüslimlerin ev, bağ, bahçe dükkan gibi mülklerini manastır ve kilise adına  vakfedemeyeceğini  sadece  manastır  ve  kilise  fakirleri  için vakfedebileceğine değinilmektedir.24 Borçlar hukuku ve  ticaret hukuku açısından zimmiler aleyhinde bir sınırlama  mevcut  değildir.  Zimmiler,  Osmanlı  topraklarında  mülkiyet hakkına sahip olup, serbestçe sözleşme yapma ve ticaret yapma hakkına sahiplerdi.  Sadece,  Müslümanlar  için  yasaklanmış  edim  konularında                                                  23 B.O.A., C.ADL, 22 R 1225 H., Dosya No: 58, Gömlek No: 3498  Üsküdar Kadısı faziletli efendi Memalik-i mahrusatü'l-mesâlik-i şâhânemde vaki medayin ve emsarda mütemekkin ehl-i zimmet re‘âyâ taifesinin nefs-i manastır ve kiliseler fukarâsı için buyût ve dekakin ve sayir emlak ve akar vakf eylemeleri öteden beri memnu‘ olan hâlâtdan olmakdan naşi bu hususa ikdam ve dikkat olunarak aralık aralık Rumeli ve Anadolu ve Cezayir-i Bahr-i Sefid'de vaki bazı mahallere mahsus evâmir-i aliyye ısdarıyla tenbih ve men‘ ve tehdid olunmakda iken bir müddetden beri o makule re‘âyâ taifesi yine manastır ve kilise fukarâsına vakf ve tayin etmekde oldukları ihbar olunmak hasebiyle bu husus kadîme ve rızâ-yı hazret-i zıllet meaba münâfî olmakdan naşi fîmâ bad o makule re‘âyânın nefs-i manastır ve kilise fukarâsına akar vakf ve tayin edememeleri hususuna irade-i kâtı‘a-i mülukane müteallik olmakla imdi işbu ferman-ı âlîyi sicill-i mahfuza kayd ittirderek min ba‘d o makule re‘âyânın nefs-i manastır ve kilise fukarâsına emlak ve akar vakf edememelerine dikkat ve suret-i irade-i seniyyeyi iktiza edenlere dahi tenbih ve tekide mübader et eyleyesin deyü buyuruldu.  24 Fetva için bkz:Ertuğrul, Düzdağ.1972. Şeyhülislam Ebusuud Efendi'nin Fetvaları Işığında 16. Asır Türk Hayatı.İstanbul:Enderun Kitabevi.s. 112 25  Çok sık verilen bir örnek şarap ve domuz etinin, Müslümanlarla yaptıkları borç ilişkilerinde edim  konusu  olamayacağıdır.  Ama  kendi  aralarındaki  borç  ve  ticaret  ilişkilerinde Müslümanlarca  yasak olan bu edimleri serbestçe  kararlaştırmalarına engel bir durum 178AÜHFD, 64 (1) 2015: 171-193   Konan Müslümanlarla sözleşme yapmaları uygun değildir. Zimmiler için borçlar hukukunda  getirilen  bir  diğer  sınırlama  ise,  Müslüman  köle bulundurmalarının yasaklanmış olmasıdır. Bir zimmi, Müslüman köle satın alamayacağı  gibi,  kölesi  sonradan  Müslüman  olursa  onu  hemen  bir müslümana satmakla mükelleftir.26 Zimmilerin kendi aralarında borçlar ve ticaret hukukuna ilişkin anlaşmazlıkları diğer özel hukuk işlerinde olduğu gibi kendi hukuklarına göre çözümlenirken, bir Müslüman ile olan davaları kadı  mahkemeleri  önünde  görülürdü.  Ancak  burada  cemaatlerin  kendi milletlerinden olan kişilerin şeriye mahkemelerine gitmelerini çok da hoş görmediğine değinmek gerekir. Bu konuda Kenanoğlu, Yahudilerin şeriye mahkemelerine gitmelerini aforoz sebebi olarak gösterdiklerine değinir.27 Duruşmalar  sırasında  gayrimüslimler  ve  müslümanlar  arasında  bir  fark gözetilmezdi. II. Selim Kanunu'nda gayrimüslimlerin davalarını rahatlıkla kadı  mahkemelerine  götürebilmeleri  konusunda  açık  bir  hüküm bulunmaktadır. Jennings, zimmilerle ilgili olarak 17. yüzyılda yapmış olduğu bir araştırmada, özel hukuk işlerinde zimmilerin şeriye mahkemelerini çok yaygın  olarak  kullanmalarından  dolayı  cemaatlerin  adli  alanda  yargı yetkilerinin çok zayıf olduğu kanısına varmıştır.28 Gayrimüslimlerin  Osmanlı  mahkemelerine  başvurdukları  başka  bir örnek, Rum Patriği tarafından başka  bir Rumu şikayet için verilmiş  bir dilekçede  yer  alır.29  Selanik'te  Aya  Anastasya  Manastırı  keşişlerinden                                                                                                                    yoktur. Hayreddin Karaman.2013. Mukayeseli İslam Hukuku, III.(8. Bası).İstanbul: İz Yayıncılık. s.273. 26  Bozkurt,(1996), s. 16. 27  Mustafa Macit, Kenanoğlu. 2005.  İslam Hukukunda Zimmiler . Türkiye Araştırmaları Literatür Dergisi, 3,(5),553-574, s. 566. 28 Jennigs, s.273 vd. 29 B.O.A., C.ADL., 28 C 1226 H (1811 M.).tarih, Dosya No:  44, Gömlek No: 2654   Devletli inayetli merhametli sultanım hazretleri sağ olsun, Bu  çâkerlerinin patrikliğine  dahil olan  manastırlardan  medine-i  Selanik'de  vâki‘  Aya Anastasya nam manastırın keşişlerinden Bakdos ve Disarpon nam keşişler kendi hallerinde olmayıp ayine muğayirce harekâta ictisar ve mübaşir-i mezkurun hâsılâtını ekl ve bel‘ fukarâ-yı manastırın mağduriyetine bâ‘is ve bâdî olup tedib ve terbiyeye sezavar idiği ihbar olunmakla merahim-i aliyyelerinden mercudur ki zikr olunan keşişin medine-i Selanik'de ve havalisinde ve sair her ne mahalde bulunur ise yasakçı marifetiyle ahz ve li-ecli't-terbiye Aynaroz  Ceziresi'nde  vâki‘  Lavra  manastırı  kulesine  bend  olunup  ıtlakları  hususuna memhur arzuhal-i âcizâne ile istida olunmadıkça müsaade-i seniyye şayan buyurulmamak üzre  hâlâ  Selanik  Mütesellimi  dergah-ı  âlî  kapıcıbaşılarından Yusuf  Bey  bendelerine hitaben bir kıta ferman-ı celilü'ş-şân inayet ve ihsan buyurulmak babında emr u ferman devletli inayetli sultanım hazretlerinindir.  Bende Patrik-i Rum İstanbul ve Asitane'de mukim cemâ‘at-i metropolitan  179Gayrimüslim Osmanlı Vatandaşlarının Hukuki…   AÜHFD, 64 (1) 2015: 171-193 Yakodis?  ve  Risaryun?  nam  keşişlerin  manastır  hasılatını  haksız  ele geçirmelerinden  dolayı  Aynaroz  adasında  kalebent  edilmeleri  hakkında İstanbul  Rum  Patriği  tarafından  verilen  arzuhal  üzerine,  Selanik mütesellimine  hüküm  yazılarak  manastır  hasılatını  gasbeden  kişilerin kalebend edilmesine karar verilmiştir.  2. Kamu Hukuku Alanında Gayrimüslim Osmanlı Vatandaşlarının Hukuki Durumu Gayrimüslim  Osmanlı  vatandaşları,  kamu  düzenini  ilgilendiren alanlarda özel hukuk alanında olduğu gibi bir serbestiye sahip değillerdi. Ancak, İslam hukuku çerçevesinde hareket edildiği taktirde, gayrimüslimlere devlet tarafından zimmet antlaşmasının hükümlerine göre davranılmış ve korunmuşlardır.  Özellikle,  ferdi  haklar  açısından  Osmanlı  yönetimi gayrimüslim vatandaşlarını, müslüman vatandaşlarından ayırt etmemiştir. En başta  zimmilere,  angarya  ve  zulüm  yapan  yöneticileri  şikayet  hakkı verilmiştir. Arşivde yer alan arz-ı hal ve arz-ı mahzarlardan, gayrimüslim reayanın,  yöneticiler  hakkındaki  yakınmalarını  merkeze  kolaylıkla iletebildikleri  ve  merkez  tarafından  da  gerekli  tedbirler  alındığı anlaşılmaktadır.30 Örnek bir arz-i mahzar da, mahkeme harcı alınmaması hakkında sadır olan Hatt-ı Hümayun'a rağmen, Bosna'nın Benaluka kasabası reayalarından harc-ı defter, katibiye ve sair namlarla aidat taleb eden kadıdan şikayetçi  olunması  konusundadır.  Şikayetin  incelenmesi  sonucunda, Rumeli'nin sol kolunda vaki mevâlî ve kadılar ve naiblere ve ayan-ı vilayet ve iş erlerine, bundan sonra kanuna aykırı bir şekilde emredilenin dışında vergi  almamaları,  kanunen  toplamaları  gereken  vergileri  alırken  zam yapmamaları emredilmiştir. Hükümde, kazada bulunan ayanların, kaza kadı ve naiplerinin kanunsuz vergi almalarına engel olmaları da emredilmiştir. Kamu  hukuku  açısından  değineceğimiz  konulardan  bir  başkası, Osmanlı  gayrimüslimlerinin  din  ve  vicdan  serbestisine  sahip  olup olmadıkları meselesidir. Osmanlı uygulamasında gayrimüslim vatandaşlar dinlerini  rahatlıkla  yaşayabilmişler,  ayin  ve  ibadetlerini  serbestçe  icra edebilmişlerdir. Bunun dışında, gayrimüslimlerin hac ziyaretlerini kolaylıkla yapmaları için devlet tarafından bazı tedbirler alınmıştır. İslam hukukunda                                                  30 B.O.A., C. ADL., Dosya No: 22 Gömlek No: 1304, 29 C 1141 H, belge ayrıntıları için bkz: Belkıs Konan. 2013.Osmanlı Devletinde İdari Yargının Gelişimi.Ankara: Statü Yayıncılık. s. 31. 180AÜHFD, 64 (1) 2015: 171-193   Konan dinde zorlama olmayacağı kuralına istinaden, zimmiler Müslüman olmaya zorlanamazlardı.31 Ancak, din değiştirme konusunda irtidat suçunun yani dinden dönmenin cezası ölüm olduğundan, bir kez Müslüman olduktan sonra eski dinlerine dönmeleri de mümkün değildi. Zimmilerin kendi aralarında mezhep değiştirmeye yönelik hareketleri ise zaman zaman çıkarılan bazı fermanlarla yasaklanmaya çalışılmıştır. Osmanlı idaresi genel tutum olarak, hıristiyanların kendi aralarında mezhep değiştirmesini uygun görmemiştir. Hatta misyonerlik yapanların cezalandırıldığı bile gözlemlenmiştir.32 Din ve ibadet özgürlüğü açısından zimmilerle ilgili karşımıza çıkan kısıtlamalar, daha çok yeni kilise yapılmasına izin verilmemesi ve mevcut ibadethanelerinin  tamiri  için  Osmanlı  yönetiminden  izin  almalarına ilişkindir. Bu kuralın sadece Osmanlı Devletine özgü olmayıp, genel olarak İslam dininde mevcut olduğunu hatırlatmakta fayda görüyoruz.33 Tamirlerin  bila-terfi ve la tevsi  yani mevcut olanı genişletmeksizin ve yükseltmeksizin yapılmasına izin verilmişse de istisnai bazı hallerde padişah kilise tamir taleplerine izin vermemiştir. Zaten Islahat Fermanı sonrasında yeni kilise yapımları çoğalmış, hatta eskisinden farklı olarak daha geniş ve yüksek  kiliseler  dahi  yapılmıştır.  Hatta,  kilisesi  veya  sinagogu  olmayan gayrimüslimler için Osmanlı Devleti'nin kendi miri arazisinden arazi tahsis ettiği dahi görülmüştür.34 Din ve vicdan özgürlüğü içinde değerlendireceğimiz konulardan biri de gayrimüslimlerin dini alametlerini serbestçe kullanmalarının mümkün olup olmadığı meselesidir. Zimmi vatandaşlar, islam dini için küfür sayılmadan ve  kendi dinlerinin propagandasını yapmadan dinleri ile ilgili alametleri kullanabiliyordu.  Yani  kiliselerinde  çan  çalabilir,  haç  işaretini dolaştırabilirlerdi.  Ebusuud  Efendi,  konu  ile  ilgili  fetvalarında gayrimüslimlerin çan yerine delikli tahtalardan yaptıkları bir alete tokmakla vurarak çıkardıkları seslerle Hristiyanları kiliseye davet edebileceğini ancak                                                  31  Bakara,2/250;  Yunus 10/99;  Hüseyin Hatemi, İslam Hukuku Dersleri, (İstanbul: Sümer Kitabevi,  2012),139-140;  Kenanoğlu(2004),s.31.  Yazar  eserinde  ,  15.  asırda  Osmanlı Devletinin  hiçbir  şekilde  islamlaştırma  politikasına  girmediğini  söyleyen  İnalcık'ın görüşüne de değinmektedir. s. 285 32  Bozkurt,1996, s.21-22. 33  Aydın, s. 155-156 34  Kenanoğlu(2004), s. 297-98. Önceden kilise olan yerlerin camiye çevrilmesine de zaman zaman rastlanılmış olup, bu  uygulama, kilise içinde ezan okunmuş şartına bağlanarak, daha önce hiç cami olmayan yerlerde bulunan kiliseler için sözkonusu olmuştur. 181Gayrimüslim Osmanlı Vatandaşlarının Hukuki…   AÜHFD, 64 (1) 2015: 171-193 bu  davetin  müslümanları  rahatsız  etmeden  yapılması  gerektiğini bildirmektedir.35 Yargılama  usulü  açısından  gayrimüslimlere  getirilen  en  önemli kısıtlama,  taraflardan  birinin  Müslüman  olması  halinde  dava  sırasında gayrimüslim bir başka vatandaşın şahitliğinin kabul edilmemesi şeklinde karşımıza çıkar. Bunun sebebi ise İslam hukukuna dayanır. İslam hukukuna göre taraflardan birinin Müslüman olduğu davalarda şahitlerin de mutlaka Müslüman  olması  gerekir. Ancak,  farklı  milletlere  mensup  olsalar  dahi, gayrimüslimlerin birbirlerine  karşı şahitliği kabul edilirdi. Yani bir Rum vatandaşı, bir Ermeni ye karşı tanıklık yapabilirdi.36 Ceza Hukuku açısından, zimmet anlaşması yaparak İslam devletinin hakimiyetine giren gayrimüslimler İslam hukukunun ceza hukuku ile ilgili hükümlerine  tabidirler.37  Buna  göre,  zimmilerin  kendi  aralarındaki  ceza davalarında (kısas ve diyete ilişkin) , kasten adam öldürme olaylarında kısas cezası uygulanmıştır. Ceza  hukuku  alanında,  bir  zimminin,  müslüman  birini  öldürmesi halinde, zimmiye kısas uygulanacağı kesin olmakla birlikte, bir müslümanın bir zimmiyi öldürmesi halinde kısasa tabi tutulup tutulamayacağı mezhepler arasında tartışma konusu olmuştur.38 Osmanlı Devletinin resmi mezhebi olan Hanefi mezhebi bu konuda, Kur an-ı Kerimin Mâide suresinde yer alan  Ey iman edenler! Öldürülenler hakkında size kısas kılındı  ayetini esas alarak, mağdurun Müslüman olup olmasına bakılmaksızın kasten adam öldürme hallerinde kısas uygulanacağını kabul etmişlerdir.39 Yaralama olaylarında ve kazayla adam öldürme hallerinde hem zimmiler, hem de Müslümanlar diyet ödemekle  yükümlüdürler.  Burada,  ikili  bir  ayrımdan  söz  etmemiz                                                  35  Düzdağ, s.95 36  Ekrem Buğra Ekinci.2011. Hukukun Serüveni, İstanbul:Arı Sanat Yayınları. s. 332; Bozkurt (1996), s. 8.  37  Fatih Kanunnamesinde, ceza ile ilgili hükümler  tek ve ve geneldir. İnalcık, bunun İslam ceza hukuku kurallarından (ukubat) doğduğunu belirtmektedir. Ukubat kuralları karşısında Müslim-gayrimüslim  tektir.  Bkz:  Halil,İnalcık.2009.  Devlet-i  Aliyye,  Osmanlı İmparatorluğu Üzerine Araştırmalar (3. Bası). İstanbul: Türkiye İş Bankası Yayınları. s. 236. 38  Şafii ve Hanbeli mezhebine göre, müslümanın zimmiyi öldürmesi halinde kısasa gerek yoktur. Hatta Malikilerde genel görüş olarak kısas uygulanmayacağı kanısındadır. Hanefi mezhebi ise kısasın bu durumda da uygulanması gerektiğini kabul eder.  bkz: Aydın, s.198 39  Yavuz, s. 10; Akyılmaz, s. 105 182AÜHFD, 64 (1) 2015: 171-193   Konan gerekmektedir. Bir zimmi, Müslüman için diyet öderken işlediği suç için gerekli diyet miktarı ne ise onu ödeyecektir. Fakat, bir Müslüman zimmiye diyet öderken diyet miktarının yarısını ödeyebileceği konusunda görüşler bulunmaktadır. Maliki ve Hanbeli mezhepleri, gayrimüslimlerin diyetinin, Müslümanların diyetinin yarısı kadar olduğunu kabul ederlerken, Hanefi mezhebi yaşam hakkının kutsallığından hareketle gayrimüslime ödenecek diyetin müslümana ödenecek diyetle aynı olması gerektiğini kabul eder. Osmanlı  Kanunnamelerine  baktığımız  zaman,  cinayet  ve  yaralama olaylarında  kısas  yerine  ödenecek   kan  cürmü   adıyla  anılan  diyetin zimmiler için Müslümanların yarısı kadar olduğunu görüyoruz.40 Öldürme ve yaralama dışındaki hadd suçlarında zimmiler yine İslam ceza hukukunun belirlediği kurallara göre ceza alırlar.41 Zimmilere hırsızlık suçunda, diğer Müslümanlara uygulanan el kesme cezası tatbik edilir. Ancak, Osmanlı  devletinde  bu  cezanın  sıklıkla  uygulanmadığını  da  hatırlatmak isteriz. 1840 yılında çıkarılan Ceza Kanunnamesinde, Osmanlı tebaasının can mal ırz ve namus güvenliği açısından eşit olduğu kabul edilerek ceza davalarında zimmi-müslüman ayrımı ortadan kalkmıştır. 42  Vergi Hukuku açısından, gayrimüslimler cizye ve örfi vergileri (tekalifi örfiyye) vermekle yükümlüydüler. Cizye, gayrimüslimlerin , İslam devleti tebaası  olmasını  gösteren  ve  gayrimüslimlere  askerlik  yapmamaları karşılığında getirilen bir vergidir. Cizye maktu cizye ve ale'r rüûs cizye olmak üzere ikiye ayrılıp, maktu cizye fetih zamanında sulhen tayin edilir. Aler rüûs cizye ise, şahıslar üzerinden ve adam başına herkesin mali gücüne göre taktir edilen cizyeye denir. Osmanlı uygulamasına baktığımız zaman, fetvalarda gayrimüslimlerin ale'r rüûs cizyesini öderken bazı kriterlere tâbi oldukları anlaşılmaktadır. Ebusuud Efendi, çalışmaya muktedir ama iki yüz dirheme  malik  olmayan  kişilerin   edna   gurubuna  girdiğini,  yani  fakir sayıldığını ve on iki dirhem vergi vereceklerini; iki yüz dirhem ile on bin dirhem arasında parası olanların  evsat  gurubuna girdiğini yani orta halli                                                  40   Eğer  bu  zikr  olunan  kazâya  kâfirden  sâdır  olsa  vech-i  mefsur  üzere  Müslüman cereminin  nısfı  alına   Müslüman  olmayan  halkın  Müslümanlara  göre  yarım  ceza ödemeleri ile ilgili örnekler için bkz: Yavuz, s. 189-191 41  Zina  suçu  işleyen  zimmiler  açısından  bu  konuda  bir  istisna  öngörülmüştür.  Bir gayrimüslimin zina suçunu işlemesi halinde recm yerine, sopa cezası uygulanacağı Hanefi mezhebince kabul edilir. Bir diğer istisna ise, içki içme halinde, zimmilere içki içme de had cezası uygulanmaz. Ekinci(2008), s. 331. 42 Bozkurt(1996),s. 98. 183Gayrimüslim Osmanlı Vatandaşlarının Hukuki…   AÜHFD, 64 (1) 2015: 171-193 sayıldığını ve  yirmi dirhem  vergi vereceklerini; on bin dirhemden  fazla parası olanların ise  a'la  gurubuna girdiğini yani zengin sayıldığını ve kırk dirhem vergi vermesi gerektiği şeklinde fetva vermiştir.43 Örfi vergiler, devlet tarafından bazı faaliyetlerde bulunmaları nedeniyle bazen de belli bir şeye izin verilmesi karşılığında konulmuş olan vergilerdi.44 Tuzculuk ve  madencilikle uğraşan zimmiler ise,  cizye  vergisinden  muaf tutulurdu.  Ayrıca,  devletin  ilk  dönemlerinde  din  adamlarından  vergi alınmamıştır. Devşirmeye tabii tutulan gayrimüslim çocukların aileleri ile, önemli  geçitlerdeki  zimmi  halktan  vergi  alınmazdı.  Ayrıca,  Divan-ı Hûmayun a  tercümanlık  yapan  kişilerin  hem  kendisinden  hem  de çocuklarından cizye alınmıyordu. Tanzimat  dönemine  kadar  cizyenin  belirlenmesi  ve  tahsilinde  bir değişiklik olmamıştı..1856 tarihli Islahat fermanı ile getirilen eşitlik ilkesi gereğince  gayrimüslimlere  askerlik  hizmeti  getirilmiş,  askerlik  yapmak istemedikleri taktirde ise  bedel-i askerî  adı verilen vergi getirildi.  Kamu hukuku açısından gayrimüslim Osmanlı vatandaşlarını incelerken değineceğimiz son konu, devlet hizmetlerine girmeleri ve siyasi haklardan yararlanmalarıdır. Gayrimüslimlerin siyasi hak kullanmaları konusunda tek yetkileri  kendi  dini  liderlerini  seçmeleriydi.  Halife  olamayacakları  gibi, kadılık  hakimlik,  komutanlık  gibi  görevleri  yapmaları  da  uygun görülmemişti. Tanzimat dönemine kadar Müslüman vatandaşlara dahi idari ve  siyasi  haklar  tanınmamış  olduğundan  Osmanlı  zimmilerinin  idari  ve siyasi haklarının bulunmamasını doğal karşılamak gerekir. Devlet tarafından, fethedilen yerlerde zimmilere tımarlar verilerek bir nevi memurluk görevi sağlanmıştır. Gayrimüslim topluluklarda, bazı zimmilerde, çeribaşılık, köy kethüdalığı ve voyvodalık gibi görevlere atanmışlardır. III.  Tanzimat  Devrinde  Zimmilerin  Hukuki  Durumuna  İlişkin Başlıca Düzenlemeler Osmanlı  Devleti'nin,  İslam  hukukundaki  zimmet  sistemine  uygun şekilde gayrimüslim halka verdiği hak ve yetkiler Tanzimat dönemine kadar                                                  43  Düzdağ, s. 97 44  Örneğin kasaplardan kasabiye adı verilen vergi, rençberlerden ise yuva harcı adı verilen vergi alınmaktaydı. Yahudiler, avarız akçesi, yave akçesi, rav akçesi denilen vergileri verirdi. 184AÜHFD, 64 (1) 2015: 171-193   Konan devam  etti.  Ancak,  19.  yüzyılda  devlet  siyasi,  askeri  ve  mali  açıdan zayıflayınca  Avrupa  devletleri  Osmanlı'daki  gayrimüslim  tebayı  koruma bahanesiyle  Osmanlı  hükümetine  baskı  yapmaya  başladı.  Bu  baskı karşısında Osmanlı Devleti bazı düzenlemeler yapmak zorunda kalmıştır. Bu dönemde II. Mahmut un   Ben tebaamın Müslümanını camide, Hıristiyanını kilisede,  Musevisini  havrada  fark  ederim.  Aralarında  başka  gûna  fark yoktur. Cümlesi hakkında muhabbet ve adaletim kavidir ve hepsi hakiki evladımdır.   sözleri  din  ve  mezhep  farkı  gözetilmeden  tebaanın  eşit olduğunu vurgulaması bakımından önem taşımaktadır. Ancak, hukuki belge bazında eşitlik ilk olarak Gülhane Hatt-ı Hûmayunu olarak geçen Tanzimat fermanında ortaya çıkar. Bir temel haklar bildirgesi olarak da nitelendirilen fermanda  Osmanlı  Devleti  içinde  herkesin  can,  mal,  ırz  ve  namus güvenliğine sahip olduğu, vergi ve askerlik işlerinin bir düzene bağlanacağı, ve  en  önemlisi  yargılanmadan  kimsenin  suçlanamayacağı  ve cezalandırılamayacağı belirtilmiştir. Tüm bu haklar istisnasız olarak bütün Osmanlı  vatandaşları  için  sözkonusu  olacaktır.  Tanzimat  fermanından hemen sonra bu eşitliği sağlamak için çıkarılan 1840 (1256 H.) tarihli Ceza Kanunnamei Hümayûnu u çok anlamlıdır. Bu kanuna göre, tüm Osmanlı vatandaşları kanun önünde istisna gözetilmeksizin eşit olarak ceza kanunu hükümleri  uygulanacaktır.461851  yılında  çıkarılan  Ceza  Kanununda  yine müslüman-gayrimüslim,  büyük  küçük  ayrımı  yapılmadan  adam  öldürme suçlarında herkese aynı hükümlerin uygulanacağı vurgulanmıştır.47  Gayrimüslimler hakkında yeni çıkarılan ceza kanunun uygulamasına ilişkin bir arşiv belgesinde, Abraham? isimli bir gayrimüslim 1268 H. ( 19 kasım 1851) tarihli verdiği arzuhal ile kardeşi Marya yı öldüren İsai nin cezasının infazını talep etmektedir. Arzuhalde, Abraham'ın Kandiye'ye bağlı Aksaray  kazasında  oturan  küçük  kardeşi  Marya  kendi  halinde  ırzıyla (halinde) yaşayıp, yine aynı kazanın Helvadere köyü halkından İsai isimli zimminin Marya'yı sana yüzme öğreteyim diye nehire götürüp öldürdüğü ve                                                  45  Münci Kapani.1972. Kamu Hürriyetleri (4. Bası).Ankara:Ankara Üniversitesi Yayınları, s. 85-86;  Ahmet Mumcu-Elif Küzeci.2001. İnsan Hakları ve Kamu Özgürlükleri (5. Bası). Ankara:Turhan Kitabevi, s. 158. 46  Ceza Kanunnamei Hümayûnu, Karakoç Serkiz, Külliyatı Kavanin Dosya No: 5 NO: 992, Türk Tarih Kurumu Kütüphanesi.  47  Kanun-ı Cedid, Karakoç Serkiz, Külliyatı Kavanin Dosya No: 7 NO: 997, Türk Tarih Kurumu Kütüphanesi. 48  B.O.A., C.ADL, 24 M. 1268 H.,Dosya No: 73, Gömlek No: 437 185Gayrimüslim Osmanlı Vatandaşlarının Hukuki…   AÜHFD, 64 (1) 2015: 171-193 yapılan  yargılama  sonucu  bu  katl  olayını  işlediğinin  sabit  olduğunu belirterek hükmün icrası için valiye yazı yazılması istenmiştir. Bu dilekçeye istinaden  verilen  buyrulduda,  kısasın  uygulanabilmesi  için  İstanbul'da meydana gelen öldürme olaylarında davanın mutlaka şeyhülislam huzurunda görülerek, suçun sabit olması ve şahitlerin güvenilirliklerinin tesbitinden sonra  gerçek  ortaya  çıkarsa  konuyla  ilgili  padişahın  fermanının  çıkması gerektiği, taşralarda  ise  memleket danışma  meclisinde  kanun  marifetiyle yazılı  şartlara  uygun  olarak  davanın  görülüp  hazırlanan  ilam  ve  meclis mazbatasının Dersaadet'e gönderilmesi ve dava sonucu fetvahanede tasdik olunduktan  sonra  padişah  fermanı  alınması  gerektiği  belirtilmektedir. İncelediğimiz  bu  belge,  iki  açıdan  önemlidir.  Birincisi,  adam  öldürme suçlarında  failin  Müslüman  veya  zimmi  olmasına  bakılmadan  yine  şeri hükme göre yani kısasın uygulanacaktır. Ancak kısas cezası uygulanabilmesi için  mutlaka  ferman-ı  âli  olması  gerekmektedir.  İkinci  olarak  ceza davalarında, müslüman ve gayrimüslim halk arasında usul yönünden de hiç bir farklılık olmadığını herkesin eşit tutulduğunu göstermektedir.  Gayrimüslim Osmanlı vatandaşlarının hukuki statüsünün belirlenmesi açısından  en  önemli  gelişme  ise  kuşkusuz  Islahat  Fermanının  ilanıdır. Fermanda  gayrimüslimlerin  aslında  daha  öncede  sahip  oldukları  haklar vurgulanarak,  bazı  yeniliklerde  getirilmiştir. Tüm  Osmanlı  vatandaşları devlet  hizmetlerine,  askeri  ve  mülki  okullara  herhangi  bir  ayrım yapılmaksızın alınabilecekti. Getirilen bir başka yenilik ise Müslümanlar ve gayrimüslimler  arasında  çıkan  ticari  ve  ceza  davalarının  karma mahkemelerde  görülecek  olmasıdır.  Müslümanlarla  zimmiler  arasındaki davalara karma mahkemelerde bakılması ve gayrimüslimlerin şahitliğinin kabul edilmesi açıkça İslam hukukuna aykırılık teşkil etmektedir.50 . Islahat Fermanı ile aslında, devleti kurtarmak amacıyla Osmanlılık kavramından hareket  edilmiş,  din  ayrımı  yapılmaksızın  mutlak  bir  eşitlik  kavramı                                                  49  Gayrimüslim Osmanlı vatandaşları din ve ibadet özgürlüğüne sahip olup, din ve mezhep değiştirmeye zorlanamayacak ayrıca kendi dini şeflerini seçebileceklerdi. Eskisinden farklı olarak ise, yeni kurulacak olan ve din adamlarıyla laik kişilerden mürekkep meclislerde cemaat işlerinin yürütüleceği hükme bağlanmıştır.  Kapani, ayrıca Islahat Fermanı ile getirilen din ve vicdan özgürlüğünün,  gerçek bir özgürlük olmadığını, çünkü amacın sadece hristiyan tebaaya dini ayin ve ibadet özgürlüğü vermek olduğunu, bunun gerçek bir inanç ve kanaat hürriyetine sahip olmak manasına gelmediğini ileri sürmektedir. Kapani, s. 88.  50 Engelhardt, s. 137-138; Mumcu,s. 160. Akyılmaz, s.129. 186AÜHFD, 64 (1) 2015: 171-193   Konan yaratılmaya  çalışılmıştır. Ancak bir yanda  eşitlik sağlanmaya  çalışılırken diğer  yanda  zimmilere  ve  yabancılara  tanınan  ayrıcalıklar  yüzünden amaçlanan hukuk birliği sağlanamamıştır. Görüldüğü gibi Islahat Fermanı ile, millet sistemi yeniden düzenlenerek gayrimüslimlere  geniş  ayrıcalıklar  tanınmıştır.  Bunun  için  her  milletten kurulacak  bir  komisyona  bu  konu  ile  ilgili  metinleri  hazırlama  yetkisi verilmiştir. Yapılan yenilikler aslında hükümet ile ruhani reisler arasındaki ilişkilerin yeniden şekillendirilmesinden ibaretti. Ruhani reislerin yetkileri kısıtlanmış, her millet için oluşturulan bu komisyon ve meclislere yetkilerin bir kısmı devredilmişti. Tanzimat Dönemine kadar imparatorluk içinde en imtiyazlı sınıf olan Rum milleti diğer milletlerle aynı seviyede tutulmayı bir aşağılama olarak görmüştü. Rum Patrikliği, hem bu nedenden dolayı hem de halktan  vergi  toplama  yetkisinin  halk  meclislerine  devrinden  memnun kalmadığı için Tanzimat ve Islahat fermanları ile getirilen yeniliklere karşı çıktı. Hatta, Rumlardan bazı kimseler   Devlet bizi Yahudilerle beraber etti. Biz islamın tefevvukuna razı idik.   şeklinde itiraz etmişlerdi.   1861  (1277  H.)  yılında  Rum  Patrikliği  Nizamnamesi  çıkarıldı.  Bu nizamname ile, ruhani meclis yanında okul, hastane, eğitim gibi din dışında kalan günlük işlerle uğraşmak üzere bir meclis oluşturuldu. Yeni oluşturulan bu  cismani  meclisin  üyelerinin  çoğu  halk  tarafından  seçilmiş  kişilerdi. Bundan sonra iki meclis toplanarak drahoma akçesi, cihaza ilişkin davalar ile, manastır ve kiliselerin gelirlerine dair vasiyetname ve vakfiyelere ilişkin davalara birlikte bakacaktı. Bunun dışında, 1879 yılında önceden Hariciye Nezaretine bağlı olan ruhani reislikler Adliye Nezaretine bağlandı. Artık piskoposların  cemaat  mahkemelerinde  değil  şeriye  mahkemelerinde yargılanarak, Osmanlı memurları tarafından tutuklanabilecekti.51  1863  (1279  H.)  yılında  ise,  Ermeni  Patrikliği  Nizamnamesi yayınlandı.52  Ermeni  Patrikhanesinde  de  Rumlarda  olduğu  gibi,  ruhani meclis yanında kendi cemaatleri içinden seçilen kişilerden oluşan bir meclis (cismani meclis) daha kuruldu. Ardından 1865 yılında (1281 H.) Hahamhane Nizamnamesi 53yayınlanarak Hahamhane içinde de dini ve laik meclisler oluşturuldu. Bu Nizamname ile İstanbul daki hahambaşı Osmanlı Devleti                                                  51 Bozkurt, s. 172 52 Düstur, I. Tertip, C. 4, s. 938-961. 53 Düstur, I. Tertip, C.4, s. 962-975. 187Gayrimüslim Osmanlı Vatandaşlarının Hukuki…   AÜHFD, 64 (1) 2015: 171-193 içindeki tüm Musevilerin ruhani reisi olarak tanındı. Osmanlı Devleti, 1831 yılında İstanbul da kurulan Katolik Ermeni Patrikliğini tanımış, yine, 1878 Nizamnamesi  ile  ülkesi  içindeki  Protestanları  bir  millet  olarak  kabul etmiştir.54 Tanzimat  Döneminde  gayrimüslimler  hakkında  yapılan  önemli düzenlemelerden  biri  de  Vilayet  Nizamnamesi  ile  zimmilere  vilayet meclislerinde temsil hakkı tanınmasıdır. 551869 yılında çıkarılan Tabiiyet-i Osmaniye  Kanunnamesinin  9.  maddesi  ile  artık  Osmanlı  Devleti nde zimmilik statüsü tamamen kaldırılarak yerine Osmanlı vatandaşlığı kavramı konmuştur.  Bu  kanunla,  İslam  hukukundaki  din  kıstasına  dayanan vatandaşlık kavramı yerine dinsel ilkelerden arındırılmış, modern uyrukluk kavramı getirilmiştir.  1876 anayasasında yer alan  Osmanlı tabiiyetinde bulunan herkes hangi din ve mezhepten olursa olsun istisnasız  Osmanlı  tabir olunur  maddesi, müslüman-gayrimüslim vatandaş ayrımının kalktığını göstermektedir.  1917  tarihinde  çıkarılan  Hukuk-ı  Aile  Kararnamesi  58  ile  cemaat mahkemelerin  kazai  yetkisine  son  verilerek  şer'iye  mahkemeleri  ahval-i şahsiye alanında tek yetkili mahkeme kılınmıştır. Kararnâmede bu durum  Rûhâni reislerin (gayrimüslim din görevlilerinin) akit ve nikâhın feshi ile onun  tamamlayıcısı  eşlerin  nafakası,  drahoma  ve  çeyiz  hakkında  yargı yetkileri  ilga  edilmiştir. Ancak,  Hukuk-ı Aile  Kararnamesi  1919  yılında kaldırılınca  cemaat  mahkemelerinin  kazai  yetkileri  kendilerine  geri verilmiştir. Sonuç olarak gayrimüslimlerin ahval-i şahsiyeye ilişkin davaları devlet sona erene kadar kendi cemaat mahkemelerinde görülmüştür. Osmanlı Devleti nin  yıkılmasından  sonra  da  Türkiye  Cumhuriyetinin  imzaladığı Lozan Barış Antlaşması ile gayrimüslimlerin başta adli olmak üzere tüm hakları güvence altına alınmıştır.                                                  54 Düstur, I. Tertip, C. 4,s. 652-654 55 Akyılmaz, s. 132. 56 Kanunnamenin tamamı için bkz: 7 Şevval 1285, 8 Kanun-ı sani 1284 H., Serkiz Karakoç, Tahşiyeli Kavanin, C.II., Cihan Matbaası, 1341/1343, s. 3-8. 57  9. Madde: Memalik-i mahrusa-i padişahi de ikamet eden her bir şahıs tebaayı Devlet-i Aliyyeden madud olup hakkında devlet-i aliye tabi muamelesi icra olunur. Eğer kendisi tebaayı ecnebiyeden ise tabiiyetini usulen isbat etmesi lazım gelir. 58  Düstur,II.Tertip, C.9, s. 762-781;Orhan Çeker. 1999. Osmanlı Hukuk-ı Aile Kararnamesi. Konya: Mehir Vakfı Yayınları. s.23-104: Mehmet Akif Aydın.1985.  İslam-Osmanlı Aile Hukuku. İstanbul: Marmara Üniversitesi Yayınları.s. 245 vd.  188AÜHFD, 64 (1) 2015: 171-193   Konan Araştırmamızı  sonlandırmadan  önce,  Osmanlı  Devletinin gayrimüslimlere  yaklaşımını  göstermesi  açısından,  Tanzimat  Döneminde çıkarılan 1898 tarihli bir ilannameye yer vermek istiyoruz.59   Padişah hazretlerinin memleket ve milletin kurtuluşuna sebep olacak güzel işlerinden biri de Osmanlı vatandaşlarının birbiriyle kaynaşarak tam bir  huzur  ve  rahat  içinde  hayat  sürmeleri,  hiç  kimsenin  dışarıda bırakılmadan adalet nimetinden faydalanmaları ve bütün memurların bu hususa dikkat etmekle beraber güvenliğin korunması gibi önemli bir konuda gece gündüz demeden gayret göstermeleridir. Konuyla ilgili olarak daha önce padişah emirleri Babıâli'ye tebliğ edilmiştir. Bu emirlere göre valiler vilayete bağlı yerleri devamlı bir surette dolaşıp teftiş ile hükümetin rızasına aykırı  uygunsuz  durumların  ortaya  çıkmaması  ve  kimsenin  zulme uğramaması hususunda gerekli önlemleri alacaklardır. Öyle ki çok adi bir suç  ortaya  çıktığında  bile  suçluyu  takip  ederek  mahkemeye  sevk  etmek suretiyle adaleti hakkıyla temin etmeleri için padişah tarafından defalarca emirler çıkarılarak Sadaret'e ayrıntılı bir şekilde tebliğ edilmiştir. Bütün bu emirlere  uyularak  vilayetlerce  toplumun  refah  ve  mutluluğunun gerçekleşmesi ile asayişin korunması ve halk arasındaki iyi ilişkilere özen gösterildiği halde şu sıralar bazı yabancı gazetelerde bir takım uygunsuz makaleler göze çarpmaktadır. Bu makalelerde Rumeli tarafında bazı halk unsurlarının diğerleri aleyhinde düşmanca tavırlar besledikleri ve devletine bağlı vatandaşlar aleyhinde çeşitli tabirler ile yazı ve tasvirler yapılması padişah  tarafından  üzüntü  ile  takip  edilmektedir.  Halbuki  Osmanlı Devleti'nin  yürürlükteki  kanun  ve  nizamları  zaten  halkın  durumu  ve çeşitliliği  göz  önünde  bulundurularak  düzenlenmekle  beraber  uygulanan hükümler  ve  mevzuat  eskiden  beri  gerektiği  zaman  gerekli  tadilatlar yapılarak yürütülmüş olduğundan her yönden mükemmeliyet ve genişliğe sahip olmuştur. Hal böyle olunca devletin kanun ve nizamlarının hakkıyla tatbik  ve  hükümlerinin  uygulanmasına  dikkatle  hiçbir  uygunsuz  durum meydana  gelmemesi  ve  en  küçük  basit  bir  suç  vukuunda  bile  derhal mahkemeye sevkiyle kanun hükmünün yerine getirilebilmesi için valilerin vilayetleri dolaşıp kontrol ederek hükümetin umum hakkındaki hissiyat ve iyi niyetini ahaliye anlatmaları gerekmektedir. Bir vatanda yaşayan insanların hiçbir  şekilde  diğeri  aleyhinde  bulunmalarının  uygun  olmadığı  ve birbirleriyle  iyi  geçinerek  hükümete  bağlılık  göstermeleri  gerekmektedir.                                                  59  B.O.A., 28 L 1316 H., İ.HUS, Dosya No:73 Gömlek No: 46 189Gayrimüslim Osmanlı Vatandaşlarının Hukuki…   AÜHFD, 64 (1) 2015: 171-193 Buna aykırı hareketleri görülenlerin hangi cemaate bağlı olurlarsa olsunlar bir  uygunsuzluk  ortaya  koyduklarında  kanuni  cezaya  uğrayacaklarının müslüman halka  muhtarlar  vasıtasıyla, Hristiyan  halka  da diğer ruhani reisleri tarafından anlatılması için ilgili vilayetlere tebliğat yapılması ve bu durumun yerel gazetelerde neşri hususlarında gereği yapılacaktır.  şeklinde yazılan ilanname, Sadaret makamı tarafından Kosova, Manastır, Selanik ve Yanya vilayetlerine de gönderilmiştir. Sözkonusu ilannamede, devletin amacının, gayrimüslim vatandaşlar ile müslüman vatandaşların beraberlik ve uyum içinde yaşamasını sağlamak olduğu  belirtilirken,  aynı  zamanda  kanunların  herkese  eşit  uygulanacağı vurgulamıştır. SONUÇ Kuruluşundan  itibaren  Osmanlı  Devletinde  müslümanlar  ve gayrimüslimler  birlikte  yaşamışlardır.  Aslında  gayrimüslimlerin  hukuki statülerinin tespit edilmesi ve sınırlarının saptanması oldukça zordur. Ancak çok  genel  bir  değerlendirme  yapmak  gerekirse,  Osmanlı  Devleti nin gayrimüslim vatandaşlarına İslam hukukundaki zimmet anlayışına uygun davrandığını söyleyebiliriz. Devlet, din ve vicdan özgürlüğü çerçevesinde gayrimüslim vatandaşlarına bir taraftan geniş yetkiler tanırken, bir taraftan da ruhani liderler aracılığı ile onları denetleme yoluna gitmiştir. Özel hukuk alanında  özellikle  evlenme,  boşanma,  nafaka,ile  yine  ahval-i  şahsiyeye ilişkin sayılan miras ve  vasiyet konularında  kural olarak gayrimüslimler davalarını cemaatleri içinde çözebilmişlerdir. Ancak yukarıda işaret ettiğimiz gibi,  bu  durum  yargılamadan  çok,  hakemliğe  benzemektedir.  Çünkü, gayrimüslimlerin bu konuda şer'î mahkemelere başvurma hakları her zaman mevcuttu.  Arşivde  yer  alan  belgelerden  de  bu  haklarını  sıklıkla kullandıklarını gözlemledik. Kamuya ilişkin alanlarda ise esas olan Osmanlı hukukunun mülkiliği ilkesiydi. Klasik  dönemde  amaç,  eşitliğin  sağlanması  değil,  belki  de  eşit olmayanların  bir  arada  hoşgörü  ile  yaşamasını  sağlamaktı.  Tanzimat döneminden itibaren çıkartılan yasalar ile din kıstası kaldırılarak devletin tüm  vatandaşları  din,  dil  ırk  mezhep  ayrımı  olmaksızın  eşit  kılınmaya çalışılmıştır. Kanımızca, Osmanlı nın uyguladığı siyaset, yönetimi altında bulunan farklı dinlere mensup kişileri eritmek değil, aksine onları Osmanlı adı verilen büyük bir vücudun birer organı yapmaya yöneliktir. 190AÜHFD, 64 (1) 2015: 171-193   Konan",
     "Kaynakça": "Akyılmaz,  Gül.  2000.  Osmanlı  Devletinde  Eşitlik  Kavramının  Gelişimi. Profesörlük Çalışması.Konya. Ansay, Sabri Şakir.2002. Hukuk Tarihinde İslam Hukuku(4. Bası).Ankara: Turhan Yayınevi. Abu Jaber, Kamel.S.1967. The Millet System in the Nineteenth Century Ottoman Empire , The Muslim World LVII,(3) Aydın, Mehmet Akif.1985. İslam-Osmanlı Aile Hukuku. İstanbul: Marmara Üniversitesi Yayınları. Aydın,  Mehmet  Akif.2005.  Türk  Hukuk  Tarihi.  (5.Bası).  İstanbul:  Hars Yayıncılık. Bozkurt,Gülnihal.1987.  İslam Hukukunda Zimmilerin Hukuki Statüleri . Dokuz  Eylül  Üniversitesi  Hukuk  Fakültesi  Kudret Ayiter Armağanı, III.(14). Ankara. Bozkurt,Gülnihal.  1996.  Gayrimüslim  Osmanlı  Vatandaşlarının  Hukuki Durumu, (1839-1914). Ankara: TTK Yayınları Braude,  Benjamin.1982   Foundations  Myths  of  The  Millet System .Christians and Jews in the Ottoman Empire ,the Functionig of a Plural Society(I), Newyork:Holmes-Meier Publishers. Cahen, Claude. 1963a  Dhimma ,E.I 2 ,II, Leiden:E.J.Brill, 227-231. Cahen, Claude. 1963b  Djizya , E.I.2 ,II, Leiden: E.J.Brill, 559-562. Çeker,Orhan. 1999. Osmanlı Hukuk-ı Aile Kararnamesi. Konya: Mehir Vakfı Yayınları. Düzdağ,Ertuğrul.1972. Şeyhülislam Ebusuud Efendi'nin Fetvaları Işığında 16. Asır Türk Hayatı, İstanbul:Enderun Kitabevi Ekinci, Ekrem Buğra. 2008. Osmanlı Hukuku, Adalet ve Mülk.İstanbul: Arı Sanat Yayınları. Ekinci, Ekrem Buğra.2011. Hukukun Serüveni, İstanbul:Arı Sanat Yayınları. Engelhardt,Ed. 1999.Türkiye ve Tanzimat.İstanbul: Kaknüs Yayıncılık. 191Gayrimüslim Osmanlı Vatandaşlarının Hukuki…   AÜHFD, 64 (1) 2015: 171-193 Eryılmaz,  Bilal.  1990.Osmanlı  Devletinde  Gayrimüslim  Teb anın Yönetimi.İstanbul:Risale Yayınları. Gıbb,H.A.R. /Bowen,Harold.1957. Islamic Society and The West I, London: Oxford University Press. Hamidullah, Muhammed. 1998. İslamda Devlet İdaresi.(5. Bası).İstanbul: Beyan Yayınları. Hatemi, Hüseyin. 2012. İslam Hukuku Dersleri. İstanbul: Sümer Kitabevi. İnalcık,Halil.  2009.  Devlet-i  Aliyye,  Osmanlı  İmparatorluğu  Üzerine Araştırmalar. İstanbul:Türkiye İş Bankası Yayınları. Jennings, Ronald,C. 1978.  Zimmis (non-muslims) in Early 17.th Century Ottoman Judicial Records , Journal of the Economic and Social History of the Orient, XXI, (3) ,225-293. Münci  Kapani.1972.  Kamu  Hürriyetleri  (4.  Bası).Ankara:Ankara Üniversitesi Yayınları. Karakoç,Serkiz.1341 H.. Tahşiyeli Kavanin II, Dersaadet:Cihan Matbaası. Karakoç  Serkiz,  Külliyatı  Kavanin  Dosya  No:  5  NO:  992,  Türk  Tarih Kurumu Kütüphanesi. Karakoç  Serkiz,  Külliyatı  Kavanin  Dosya  No:  7  NO:  997,  Türk  Tarih Kurumu Kütüphanesi. Karaman, Hayrettin. 2013. Mukayeseli İslam Hukuku I,( 8. Bası).İstanbul:İz Yayıncılık. Hayreddin Karaman.2013. Mukayeseli İslam Hukuku, III.(8. Bası).İstanbul: İz Yayıncılık. Kenanoğlu, Mustafa Macit. 2004. Osmanlı Millet Sistemi Mit ve Gerçek. İstanbul:Klasik Yayıncılık. Kenanoğlu, Mustafa Macit. 2005.  İslam Hukukunda Zimmiler . Türkiye Araştırmaları Literatür Dergisi, 3,(5).553-574. Konan,  Belkıs.  2013,Osmanlı  Devletinde  İdari  Yargının  Gelişimi. Ankara:Statü Yayıncılık. 192AÜHFD, 64 (1) 2015: 171-193   Konan Mumcu Ahmet./ Küzeci, Elif.2001. İnsan Hakları ve Kamu Özgürlükleri. Ankara:Turhan Kitabevi. Ortaylı,İlber.2003. Osmanlı Barışı. İstanbul:Ufuk Yayınları. Ortaylı,İlber.2007. Osmanlı İmparatorluğunda Millet Nizamı , Batılılaşma Yolunda.İstanbul:Merkez Kitapçılık Yayıncılık. Özel,Ahmet.1982.İslam  Hukukunda  Milletlerarası  Münasebetler  ve  Ülke Kavramı. İstanbul. Özkaya,Yücel.  2010.  18.Yüzyılda  Osmanlı  Toplumu.  İstanbul:Yapı  Kredi Yayınları. Yavuz,Ercan.2001.Osmanlı  Yönetiminde  Gayrimüslimler  Ankara:Turhan Kitabevi."
}