{
     "Tip": "Makale",
     "Dergi İsmi": "",
     "Üniversite İsmi": "Ankara Üniversitesi",
     "Gün": "",
     "Ay": "",
     "Yıl": "2015",
     "Cilt": "64",
     "Sayı": "1",
     "Başlık": "HUKUKUN İÇ AHLAKI: LON L. FULLER’IN GÖRÜŞLERİ ÇERÇEVESİNDE BİR İNCELEME",
     "Title": "The Inner Morality of Law: An Examination within the Framework of Lon L. Fuller’s Theory",
     "Yazar İsmi": [
          "E. İrem AKI"
     ],
     "Danışman İsmi": "",
     "Anahtar Kelimeler": [
          "Lon Luvois Fuller",
          "ahlâk",
          "hukukun iç ahlâkı",
          "kuralların genelliği",
          "idari emir"
     ],
     "Keywords": [
          "Lon Luvois Fuller",
          "morality",
          "inner morality of law",
          "generality of rules managerial direction"
     ],
     "Özet": "Hukuk-ahlâk ilişkisi hukuki pozitivistler ve doğal hukukçular arasındaki en tartışmalı konulardan biridir. Bununla birlikte Lon Luvois Fuller bu iki akımdan da farklı olarak, hukuk ve ahlâk arasında alışılmışın dışında bir bağlantı  kurmaktadır.  Fuller ın  kurduğu  bağlantının  alışılmışın  dışında olmasının nedeni, hukuk kurallarının içeriğinin ahlâki niteliğinden bağımsız olarak, hukukun kendine özgü bir ahlâkı olduğunu iddia etmesidir. Fuller sekiz ilke ileri sürer ve bu ilkelerin hukukun iç ahlâkını oluşturduğunu iddia eder. Bu sekiz ilke ise kanun koyucunun kuralları yaparken uyması gereken ilkeleridir: Hukuk kuralları genel, kamusal, geleceğe yönelik, açık, mantıksal olarak  tutarlı,  uygulanabilir,  zaman  içinde  tutarlı  olmalı  ve  yayımlanan kurallar ile onların fiili uygulaması arasında uyum olmadır. Dolayısıyla sekiz ilke  hukuk  kurallarının  içeriğine  yönelik  ilkeler  değildir,  örneğin  eşitlik ilkesi  gibi.  Bu  noktada  da  tartışılması  gereken  soru,  hukuk  kurallarının içeriğinden bağımsız olarak hukukun bir iç ahlâka sahip olup olmadığıdır. Diğer  bir  ifadeyle,  bu  çalışmanın  hedefindeki  soru,  hukuk  kavramının                                                    Bu makale yazarın doktora tez çalışmasından üretilmiştir.  Ankara  Üniversitesi  Hukuk  Fakültesi,  Hukuk  Felsefesi  ve  Sosyolojisi  Anabilim  Dalı Araştırma Görevlisi (iremaki@gmail.com)   1AÜHFD, 64 (1) 2015: 1-35 kendisinin içinde kalarak, hukuk kavramının dışına çıkmayarak bir hukukahlâk ilişkisinin kurulup kurulamayacağıdır. Anahtar  Sözcükler:  Lon  Luvois  Fuller,  ahlâk,  hukukun  iç  ahlâkı, kuralların genelliği, idari emir ABSTRACT The  relationship  between  law  and  morality  is  one  of  the  most controversial topics between legal positivists and natural lawyers. However Lon  Luvois  Fuller  makes  an  unfamiliar  connection  between  law  and morality that is different from both legal positivism and natural law theory. And this because Fuller argues that, without reference to the moral quality of the content of rules, law has its own internal morality. Fuller offers eight principles and argues that these principles constitute the inner morality of law. These eight principles are the principles that legislators must obey when creating rules. Rules should be general, published, non-retroactive, clear, non-contradictory, must not require the impossible, be constant through time, and there must be congruence between official action and declared rules. Therefore, the eight principles are not devoted to the content of rules, like, for example, the principle of equality. This article looks at the question whether law has its own morality unrelated to the content of rules. In other words, the main question of this work is whether a connection can be made between law and morality while being inside law, or else, without exiting law. Keywords:  Lon  Luvois  Fuller,  morality,  inner  morality  of  law, generality of rules managerial direction.  Giriş Fuller hukuk ve ahlâk arasında zorunlu bir ilişki olduğunu iddia eden, 1902 ve 1978 yılları arasında yaşamış Amerikalı bir hukuk felsefecisidir.1 Bununla birlikte Fuller ın hukuk ve ahlâk arasında kurduğu ilişki, hukuk felsefesinin  geleneksel  bir  şekilde  tartıştığı  hukuk  ve  ahlâk  ilişkisinden farklıdır.  Hatta,  Fuller ın  hukuk  ve  ahlâk  arasında  kurduğu  bağlantının                                                  1  Summers, 1984, s.3, 13. 2AÜHFD, 64 (1) 2015: 1-35                                                                                                    Akı bugün bile alışılmışın dışında olduğu iddia edilebilir. Zira hukuk felsefesi geleneğinde,  hukuk  ve  ahlâk  arasındaki  bağlantı  hukuk  kurallarının içeriğinin ahlâki niteliğine göre tartışılmaktadır. Hukuk felsefesi geleneği derken hukuk teorisinde mevcut iki yaklaşım, yani  hukuki  pozitivizm  ve  doğal  hukuk  akımı  arasındaki  tartışma  kast edilmektedir.2  Hukuki  pozitivizm  akımının  kuramcıları  arasında  John Austin, Jeremy Bentham, Hans Kelsen ve H.L.A Hart sayılabilir. Hukuki pozitivizmin  temel  özelliği,  hukukun  toplumdaki  insanların  kararıyla çıkarılmış olduğunu ileri sürmesidir.3 Hukuk kurallarının insanların kararıyla çıkarılmış olmasının anlamı, hukukun sosyal olarak yaratılmış ve üretilmiş bir  kavram  oluşudur.4  Pozitivizmin  bu  özelliği,  hukuku  koyan  kaynağa bakarak açıklamasıyla ilgilidir. Bu teze sosyal kaynaklar tezi adı verilir.5 Hukuki pozitivizmin bir diğer önemli tezi konvansiyonellik tezidir. Bu teze göre, hukukun varlığı,  bir normun toplumun hukukunun parçası olabilmesi için gereken şartları   düzenleyen  tanıma  kuralının,6  hukuk sistemindeki yetkililer  tarafından  kabul  edilmesi,  yani  bir  konvansiyonla  kurulmasına bağlıdır.7  Hukuki  pozitivizmin  kabul  ettiği  bir  diğer  tez  ise ayırma/ayrılabilirlik tezidir. Ayırma tezi hukuk ve ahlâk arasında bir ilişki kurulamayacağını  belirtirken,  ayrılabilirlik  tezi, hukuk  ve  ahlâk  arasında zorunlu hiçbir ilişki kurulmayacağını ileri sürmektedir.8 Diğer bir ifadeyle bu tez, hukukun ve ahlâkın kavramsal olarak ayrı şeyler olduklarını iddia etmektedir.9  Hukuk  ve  ahlâkın  ayrı  kavramlar  olmasının  anlamı,  neyin hukuk olduğunu neyin hukuk olmadığını belirleyen tanıma kuralında veya hukuki geçerlilik kriterinde ahlâka yer verilmemesidir. Diğer bir ifadeyle, bir hukuk normunun geçerliliği onun ahlâka uygun olmasına bağlı değildir.10                                                  2  Burada sadece geleneksel hukuk felsefesindeki tartışmaya yer verilmiştir zira Eleştirel Hukuk Çalışmaları, Feminist Hukuk Teorisi gibi  yaklaşımlar  hukuk sistemine ilişkin yapısal eleştirilerde bulunmaktadır.  3  Uygur, 2003, s. 146. Hukuki pozitivizm akımı için ayrıca bkz. Keyman, 1978, s.17-55. 4  Himma, s.16. 5  Uygur, 2003, s.146. 6  Uygur, 2003, s.148. Tanıma kuralı için bkz. Surlu, 2008. 7  Ceylan, s.217-218; Himma, s.21. Zayıf ve güçlü konvansiyonelik tezleri için bkz. Ceylan, s.217-218; Himma, s.20-28. 8  Uygur, 2003, s.152. Dolayısıyla bugün hukuki pozitivizmin bazı temel özellikleri açısından türlere ayrıldığının, kapsayıcı ve dışlayıcı pozitivizm gibi, farkında olmak gerekmektedir. Bkz. Uygur, 2003,s.152; Himma, s.13. 9  Himma, s.28. 10  Ceylan, s.219.   3Hukukun İç Ahlâkı                                                      AÜHFD, 64 (1) 2015: 1-35 Doğal hukuk akımı ise hukuki pozitivizmin karşıtı olarak, hukuk ve ahlâk arasında hukuki geçerlilik kriteri bakımından kavramsal, mantıksal ve zorunlu olarak temel bir bağlantı olduğunu iddia etmektedir.11 Hukuk ve ahlâk arasında zorunlu bir bağlantı olmasının sonucu  adil olmayan hukuk, hukuk değildir  anlayışının ortaya çıkmasıdır.12 Dolayısıyla doğal hukuk açısından  hukuk  kurallarının  içeriğinin  ahlâka  uygun  olması  gerektiği belirtilebilir.13 Fuller ise hukuk kavramının kendisine içkin veya hukuk kavramının kendisine özel bir ahlâk kavramının arayışındadır. Diğer bir ifadeyle Fuller, hukuk  kurallarının  ahlâki  içeriğiyle  ilgilenmemektedir.  Bununla  birlikte Fuller, hukuk felsefesinin bu konuyla ilgilenmemesi gerektiğini düşünüyor da  değildir.  Fuller,  hukukun  içeriğiyle  ilgilenen  doğal  hukuk  akımının, hukuk  teorisinde  bırakmış  olduğu  boşluğu  doldurmak  istemektedir. Dolayısıyla bu çalışmanın hedefindeki soru yanıtlanırken Fuller ın hukuki düzenlemelerin  içeriğinin  ahlâki  niteliğinden  bahsetmediğinin  farkında olmak  gerekmektedir.  Daha  açık  bir  ifadeyle  Fuller  hukukun  iç  ahlâkı olduğunu  ileri  sürerken  hukuki  düzenlemelerin  örneğin  anayasaların, kanunların  temel  hak  ve  özgürlükleri  koruması  gerekliliğinden  veya  ne dereceye kadar koruyor olduğundan bahsediyor değildir.  Ayrıca Fuller ın teorisi açısından göz önünde bulundurulması gereken bir nokta daha söz konusudur: Fuller a göre hukuk teorisi  belirli hukuk kurallarına  değil,  hukuk sistemlerine  odaklanmalıdır. Burada önemli olan nokta, Fuller ın, doğal hukuku eleştirenlerin  belirli kurallar ahlâki olmasa bile hukuktur  şeklindeki düşüncelerini haklı bulmasıdır. Diğer bir ifadeyle doğal hukukçuların  adil olmayan kanun, kanun değildir  iddiasına karşılık, Fuller ın  teorisi  belirli  bir  hukuk  kuralına  değil,   hukuk  sisteminin  kendisine odaklanmaktadır.14 Netice olarak Fuller ın, hukuk ve ahlâk arasında alışılmışın dışında bir bağlantı kurarken, bunu hukuki pozitivizm/doğal hukuk karşıtlığı üzerinden                                                  11  Murphy, Coleman, s.11. Ayrıca bkz. Yücel, s.76; Keyman, 1998, s.32-33. 12  Wacks, s.3. Bununla birlikte  adil olmayan hukuk, hukuk değildir  sözünü, Aquanis ın hiçbir zaman bu şekilde ifade etmediğine yönelik bir iddia da mevcuttur. Wacks, s.4; Bix, 2004(a), s.68. Ayrıca bugün doğal hukuk akımının geleneksel ve modern olmak üzere ikiye ayrıldığını belirtmek gerekmektedir. Bkz. Bix, 2004(b), s.291-343. 13  Uslu, s.227; Aktaş, 2004, s.5. 14  Murphy, Coleman, s.38. 4AÜHFD, 64 (1) 2015: 1-35                                                                                                    Akı yapmamış olduğuna dikkat çekmek gerekmektedir. Daha açık bir ifadeyle, Fuller bu bağlantıyı kurarken, hem hukuki pozitivizme hem de doğal hukuk akımına yönelik eleştirilerini dile getirmiştir.15 Fuller bu alışılmışın dışında olan hukuk-ahlâk ilişkisini ise sekiz ilke aracılığıyla  kurmaktadır.  Diğer  bir  ifadeyle  Fuller  kanun  koymanın  iç ahlâkı olarak adlandırdığı sekiz ilke getirmektedir. Bu ilkeler:  1.Kurallar genel olmalıdır 2.Kurallar yayımlanmış olmalıdır 3.Kurallar geçmişe yürür olmamalıdır 4.Kurallar açık olmalıdır 5.Kurallar çelişmemelidir 6.Kurallar imkansızı talep etmemelidir 7.Kurallar zaman içinde tutarlı olmalıdır (sabitlik) 8. Yetkililerin eylemi ve yayımlanmış kurallar arasında uyum olmalıdır Fuller a  göre  kanun  koyucunun  bir  hukuk  sistemi  oluşturmak  için yerine getirmesi gereken bu sekiz ilke hukukun iç ahlâkını oluşturmaktadır. Bu  noktada  da  tartışılması  gereken  soru,  hukuk  kurallarının  içeriğinden bağımsız olarak hukukun bir iç ahlâka sahip olup olmadığıdır. Diğer bir ifadeyle,  bu  çalışmanın  hedefindeki  soru,  hukuk  kavramının  kendisinin içinde  kalarak,  hukuk  kavramının  dışına  çıkmayarak  bir  hukuk-ahlâk ilişkisinin kurulup kurulamayacağıdır.  I.  Ahlâk Kavramı ve Anlamları Bu  soru  yanıtlanırken  ilk  olarak   ahlâk ın  hangi  anlamından bahsedildiğinin ortaya konulması gerekmektedir. Çünkü ahlâk kavramıyla pek çok bağlamda karşılaşılmasına ve ahlâk kavramının açık bir kavram                                                  15  Rundle, 2012, s.2-3. 16  Bu aşamada terimlerle ilgili bir noktayı açıklamak gerekmektedir. Fuller, The Morality of Law da, kanun koymanın iç ahlâkından değil, hukukun iç ahlâkından bahsetmektedir. Kenneth I. Winston a göre hukukun iç ahlâkındaki  hukuk  kelimesi bir sosyal düzenleme modeli olarak kanun koyma (legislation) faaliyetini belirtmektedir; yoksa bir bütün olarak hukuk  kavramını  değil.  Winston,  s.44,  dipnot  33.  Zira  Fuller a  göre  hukuk,  kanun koymanın da dahil olduğu çeşitli sosyal düzenleme modellerini içermektedir. Kanun koyma bunlardan  sadece  bir  tanesidir.  Sosyal  düzenleme  modelleri  için  aşağıda  bkz.  s.15, dipnot.80.    5Hukukun İç Ahlâkı                                                      AÜHFD, 64 (1) 2015: 1-35 olduğu düşünülmesine rağmen, ahlâk kavramı açık bir kavram değildir.17  Sözcüğün  anlamında,  kullanıldığı  bağlamlara  göre  kimi  farklılıkların olduğu; buna karşılık kimi özelliklerinin hep aynı kaldığı görülmektedir. 18 Dahası  Fuller  da  ahlâkın  hangi  anlamını  kullandığını  açıkça  ortaya koymamaktadır.19 Bununla  paralel  olarak,  hukuk  felsefesi  literatüründe  de,  iki  farklı ahlâkilik olduğu belirtilmelidir.20 Bu iki ahlâkilik arasındaki ayrımı Hart, literatürde Devlin-Hart tartışması olarak bilinen tartışma çerçevesinde ortaya koymuştur. İki tür ahlâkilikten ilki, pozitif ahlâktır, yani  belli bir toplumsal grup  tarafından  fiilen  benimsenen  ve  paylaşılan  ahlâk tır.21  İki  tür ahlâkilikten ikincisi eleştirel ahlâktır. Eleştirel ahlâk,  pozitif ahlâk da dahil olmak üzere mevcut toplumsal kurumları eleştirmekte kullanılan genel ahlâk ilkeleridir. 22 Bu  ayrım  yanında,  Ioanna  Kuçuradi nin  yaptığı  ahlâkın  farklı anlamlarına bakılabilir. Buna göre ahlâkın ilk anlamı toplumdaki  değer yargıları   dır.23  Değer  yargıları,   yüklemleri  iyi  –  kötü,  güzel  –  çirkin, faydalı – zararlı, doğru – yanlış, günah – sevap ve bu gibi sıfatlar olan,  normlardır.24  Örneğin,   büyüklerin  önünde  sigara  içmek  kötüdür ,   içki içmek  kötüdür ,   büyüklerin elini  öpmek  iyidir   gibi.   Bu  bağlamlarda ahlâktan söz edilirken dile getirilmek istenen, hep, insanlararası ilişkilerde kişilerin  uymaları  beklenen  - talep  edilen  -  davranışlardır.  Yapılması  – yapılmaması gereken (izin verilen – verilmeyen; teşvik edilen – yasaklanan) davranışlardır; başka bir deyişle belirli bir grupta ya da genel olarak iyi sayılan  –  kötü  sayılan  davranışlardır. 25  Bu  türden  değer  yargılarının özelliği, toplumdan topluma veya zaman içinde değişiklik göstermesidir. Zira  Türkiye de  içki  içmek  kötü  bir  davranış  olarak  kabul  edilirken, Almanya da  bu  değer  yargısı  geçerli  değildir.  Diğer  yandan,  değer                                                  17  Tepe, 2011, s.14. 18  Tepe, 2011, s.14; Tepe, 1998, s.12. 19  Summers,1965, s.3. 20  Uygur, 2014, s.163-164. 21  Hart, 2011, s.28. Devlin-Hart tartışması için bkz. Uzun, s.152-71.  22  Hart, 2011, s.28. Pozitif ahlâkın çeşitli anlamları için bkz. Uygur, 2014, s.164; Uygur, 2006, s.3. 23  Ahlâkın bu anlamı Hart ın ileri sürdüğü pozitif ahlâk tanımına denk düşmektedir. 24  Kuçuradi, 1998, s.29. 25  Kuçuradi, 1988, s.21. 6AÜHFD, 64 (1) 2015: 1-35                                                                                                    Akı yargılarının tek türü zamana ve yere göre değişiklik gösteren değer yargıları değildir.  Örneğin   yalan  söylemek  kötüdür ,   işkence  kötüdür ,   eşitsiz muamele kötüdür  gibi değer yargıları da vardır. Bunların birinci türden değer yargılarından farkı, her zaman-her yerde iyi veya kötü sayılmalarıdır.26 Dolayısıyla   …  ahlâk  denen  olgu,  yaşamda  çeşitli  ahlâklar  olarak karşımıza çıkıyor; ama bu çeşitli ahlâklar, bir kısmı değişik ve değişken olan davranış  kuralları  ve  değer  yargıları,  bir  kısmı  ise  pek  değişiklik göstermeyen davranış kuralları ve değer yargılarından oluşuyor. 27 Netice itibariyle her iki türden değer yargılarına da uyulmaları bekleniyor ve bu değer yargılarına göre kişi eylemleri değerlendiriliyor.28 Kuçuradi değer yargılarının yanında, kişilerin eylemlerini belirlemeleri beklenen  kurallar  ve  ilkelerin  de  ahlâk  terimiyle  ifade  edilebileceğini belirtmektedir. Örneğin,  ırk ayrımı yapmamak gerekir ,  sözünde durmak gerekir ,   büyüklerin ellerini öpmek gerekir  gibi.29 Eylemleri belirlemeleri beklenen kurallar ve ilkeler aslında değer yargılarının, eylemi belirlemesi beklenen kural veya ilkeye dönüşmüş halidir. Örneğin,  içki içmek kötüdür  değer yargısı,  içki içmemek gerekir  normuna dönüşmektedir. Ancak  içki içmek kötüdür  değerlendirme normuyken,  içki içmemek gerekir  davranış normudur.30 Fuller ın  ileri  sürdüğü  ilkeler  de  ( kurallar  genel  olmalıdır   veya  kuralları genel yapmak gerekir ,  kuralları anlaşılabilir yapmak gerekir ,  kuralları geçmişe yürür yapmamak gerekir  vb.) kanun koyucuların hukuk kuralları  oluştururken  nasıl  davranmaları  gerektiğini  bildiren  normlardır. Daha kısa bir ifadeyle Fuller ın ileri sürdüğü ilkeler, kanun koyucuların eylemelerine  ilişkin  gereklilik  dile  getiren  normlar;  yani  davranış normlarıdır.31 Bu gereklilik bildiren kurallar veya ilkeler (hem Fuller ın ileri                                                  26  Kuçuradi, 1988, s.22. 27  Kuçuradi, 1988, s.22. 28  Kuçuradi, 1988, s.22. 29  Kuçuradi, 1988, s.27.  30  Bu ayrımı kavramamı sağladığı için Prof. Dr. Abdullah Kaygı ya çok teşekkür ederim. 31   Normlar, değerlendirmeye yarayan -bir eylemi, bir sanat yapıtını, bir düşünceyi, bir kavramı  vb.  değerlendirmeye  yarayan-  ve  genel  ya  da  geçer  olma  iddiasında  olan önermelerdir.  Kuçuradi, 2009, s.175-176. Kuçuradi norm kavramının altına  a) bütün değer  yarılarının,  b)  her  türlü  buyruğu  ve  c)  bütün  patrik  kuralları-ilkeleri  koyabileceğimizi belirtmektedir. Kuçuradi, 2009, s.176.   7Hukukun İç Ahlâkı                                                      AÜHFD, 64 (1) 2015: 1-35 sürdükleri hem de verilen diğer örnekler) kişilerin eylemlerini belirlemeleri beklenen normlardır.32 Bununla  birlikte,   ırk  ayrımı  yapmamak  gerekir   veya   büyüklerin ellerini öpmek gerekir  ya da  kuralları genel yapmak gerekir  normlarının, farklı türden normlar olduğu görülebilir. Bu normların farklı türden normlar olması,  türetildiklerin  kaynakların  farklılığından  ileri  gelmektedir.  Bir normun türetildiği kaynağı tespit etmek ise normların temellendirilmesiyle ilgilidir.  Bir  normun  temellendirilmesi,  normun   devşirildiği,  çıkarıldığı yerin gösterilebilmesi demektir; ona h e r h a n g i bir temelin bulunabilmesi değil. 33 Dolayısıyla, normun dile getirdiği gerekliliğe  neden… yapmak gerekir?  sorusu sorulduğunda ve bu soru bir bilgiyle yanıtlandığı zaman, söz konusu olan norm temellendirilebilir bir normdur.34  Normların dile getirdikleri gereklerin ise Kuçuradi ye göre  iki farklı kaynaktan -biri deney, diğeri de insanın değerinin bilgisi olmak üzere iki ayrı  kaynaktan-  ve  farklı  yollardan  -farklı  çeşitten  akıl  yürütmelerle  induksyon ve reductio ad absudum ile- türetildiği görülüyor. 35  Kaynağı  deney  olan  kuralların  bir  kısmı  farklı  çevrelerdeki  doğaltoplumsal  koşullardan  ve  farklı  kültürlerden  kaynaklanan  düzen  kurucu davranış kurallarıdır. Bu kurallar değer koruyucu olduğu gibi değer harcayıcı da olabilmektedir.36 Kaynağı deney olan bazı normlar da indüksiyon yoluyla türetilmektedir. Bu tür normlar tek tek davranışlardan yapılan ve yarar-zarar gözetilerek  yapılan  çıkarımlardır.  Örneğin   savurgan  olmamak  gerekir, kırmızı ışıkta geçmemek gerekir  gibi.37  Kaynağı insanın değerinin bilgisi olan normlara ise ilke denilmektedir. Kuçuradi ye göre, insanın değerinin bilgisinden türetilen  ilke ler Türkçe de ahlâk kavramına yüklenen ikinci anlama denk gelmektedir. Bu doğrultuda,                                                  32  Kuçuradi, 1988, s.27. Ancak Fuller ın dile getirdiği ilkelerin bir diğer özelliği normların yapımı hakkında normlar olmalarıdır. Diğer bir ifadeyle meta normlar olarak da ifade edilebilir. Hart ın terimleriyle ifade edilecek olursa, kurallar hakkındaki kurallardır. Ancak Hart ın görüşlerinden farklı olarak, Fuller ın ileri sürdüğü ilkeler bir geçerlilik kriteri oluşturmamaktadır. 33  Kuçuradi, 2009, s.178. 34 Kuçuradi, 1988, s.27; Kuçuradi, 2009, s.179. 35 Kuçuradi, 1988, s.27. 36 Kuçuradi, 1988, s.27-28. 37 Kuçuradi, 1988, s.28. 8AÜHFD, 64 (1) 2015: 1-35                                                                                                    Akı Kuçuradi ye göre, bu tür ilkelere  ahlâk ilkeleri  demek yerine, ahlâklılık ilkeleri veya etik ilkeler demek daha uygun görünmektedir.38  Kuçuradi ye göre etik ilkelerin  bir kısmı, insanın değerinin bilgisinden doğrudan  doğruya  yapılan  çıkarımlardır:  ‘insanlara,  insan  olarak,  eşit muamele  yapmak  gerekir , ‘sözünde  durmak  gerekir  gibi; bir  kısmı da dolaylı olarak –bu değeri harcıyan tarihsel koşullar aracılığıyla: örneğin ‘ırk ayrımı yapmamak gerek , ‘işkence yapmamak gerek  gibi. Kuçuradi ye göre, bu tür çıkarımlar şu şekilde yapılır: insanın değeri buysa (: insanın, tür olarak yapısal olanakları bunlarsa); demek ki, hiçbir insan (: insan türüne ait  hiçbir  varlık)  bu  değere  zarar  verecek  (:  bu  olanakların gerçekleşebilmesini engelleyecek) bir şey yapmamalı: söz gelişi insanları kandırmamalı, insanlara işkence yapmamalı. 39 Yukarıda yapılan açıklamalar ışığında sekiz ilkenin türetilme kaynağını ortaya koymak, sekiz ilkenin niteliğini belirlemek bakımından önemlidir. Zira  bu  ilkelerin  türetildiği  kaynağa  göre,  bu  ilkelerin  etik  ilkeler  olup olmadıkları ortaya konulabilir. Bu doğrultuda bu makalenin temel sorusu olan  Fuller ın  görüşleri  çerçevesinde  hukukun  iç  ahlâkından  söz  edilip edilemeyeceği sorusu, onun getirdiği ilkelerin etik  ilkeler olup olmadığı sorusunun cevabına bağlıdır. Yukarıda da belirtildiği gibi bir ilkenin etik ilke olup  olmadığı  ise,  ilkenin  insan  değerinin  bilgisinden  türetilip türetilmediğine bağlıdır. Daha açık bir ifadeyle eğer sekiz ilkenin insanın değerin bilgisinden türetildiği gösterilebilirse, bu ilkelerin etik ilkeler olduğu ve dolayısıyla hukukun kendine özgü bir ahlâkı olduğu iddia edilebilecektir. Eğer  bu  gösterilemezse  bu  ilkelerin  yalnızca  kanun  koyucuya  yönelik form/şekil ilkeleri olduğu ileri sürülebilecektir.  Ancak  bu  noktanın  açıklanabilmesi  için  ,   değerler   ve  tür  olarak  insanın değeri ne, bu çalışmanın konusunu aşmakla beraber, sekiz ilkenin niteliğini belirlemeyle ilgisinde yer verilmelidir. İnsanın değerinin anlamını ortaya  koyabilmek  için  öncelikle   değerler e  bakmak  gerekmektedir. Kuçuradi ye göre değerler taşıyıcılarına göre üçe ayrılır; insanın değerleri, etik değerler ve toplumsal değerler olmak üzere.                                                  38  Kuçuradi, 1988, s.30. Çalışmanın geri kalanında bu tür ilkeler kast edildiği zaman  etik ilkeler  terimi kullanılacaktır. 39 Kuçuradi, 1988, s.29.   9Hukukun İç Ahlâkı                                                      AÜHFD, 64 (1) 2015: 1-35   İnsanın  değerleri  amaçlarına  uygun  şekilde  gerçekleştirilen  insan etkinlikleridir ;40 bilim, felsefe, sanat, hukuk gibi. Bu etkinlikler kişilerce gerçekleştirilirler ve insanda olanak olarak vardırlar. Etik değerler ise ikiye ayrılır, etik kişi değerleri ve etik ilişki değerleri olmak üzere. Toplumsal değerler  ise  laiklik  idesi,  eşitlik  idesi,  adalet  idesi,  özgürlük  idesi  gibi idelerdir.41 İnsanın değeri ise insanın diğer türler arasındaki yeridir.42 İnsanın diğer türlere ilişkin yerine baktığımızda insanın  değerler e sahip olması onun yerini belirtmektedir.43  Değerleri -: b ö y l e etkinlikleri- dir insanı değer l i kılan.  Böylece  insanın  değerinin  bilgisi,  böyle  etkinlikleri  ve  ürünleri aracılığıyla edindiğimiz, insanın bu olanaklarının bilgisinden başka bir şey değildir. 44 İnsanın değerinin bilgisi de ortaya konulduktan sonra, sekiz ilkenin insan  değerinin  bilgisinden  türetilip  türetilmediğinin  belirlenmesi gerekmektedir.  Sekiz  ilkenin  insanın  değerinin  bilgisinden  türetilip türetilmediğinin açıklığa kavuşmasından sonra, hukukun iç ahlâkından söz edilip  edilmeyeceği  veya  bu  ilkelerin  etik  ilkeler  olup  olmadığı  ortaya konulabilir.45Bu  noktanın  açıklanabilmesi  için  de  ilk  olarak  hukukun  iç ahlâkının  sekiz  ilkesinin  köklerinin  neye  dayandığını  ortaya  koymak gerekmektedir. II. Sekiz İlkenin Temellendirilmesi Fuller ın ileri sürdüğü sekiz ilkenin türetilme yolunu ve kaynağını tespit edebilmek  için   neden  kuralları  sekiz  ilkeye  uygun  olarak  oluşturmak gerekir?  sorusu sorulmalıdır. Bu sorunun cevabı ise kurmaca kral Rex in hikayesi aracılığıyla verilebilir.  Fuller, The Morality of Law da bize bir monarkın hikayesini sunar. Aslında bu hikaye Fuller ın Positivism and Fidelity to Law: A Reply to Prof. Hart başlıklı makalesinde sunduğu monarkın hikayesinin daha ayrıntılı ve                                                  40 Kuçuradi, 2006, s.170. 41 Kuçuradi, 2006, s.169-180.   42 Kuçuradi, 2007, s.72.  43 Kuçuradi, 2006, s.170. 44 Kuçuradi, 2006, s.170-171. 45  Ancak bu noktada sekiz ilkenin Hart ın ileri sürdüğü pozitif ahlâk veya Kuçuradi nin ileri sürdüğü değer yargılarıyla ilgili olmadığı belirtilebilir. 46 Fuller, 1958, s.644-645. 10AÜHFD, 64 (1) 2015: 1-35                                                                                                    Akı sistematik  bir  halidir.47  Bu  hikaye  Rex  isimli  monarkın  mutsuz hükümranlığını  anlatmaktadır.  Bu  hikayede  Rex,  bir  reformcunun gayretkeşliğiyle  tahta  çıkar.  Ona  göre  ondan  önce  gelenlerin  en  büyük başarısızlığı,  hukuk  alanında  olmuştur.  Davalara  ilişkin  prosedürler  çok yavaş ve elverişsizdir, kuralların dili sanki başka bir çağa ait gibidir, adalet pahalıdır vs. Rex bütün bu sorunları çözümlemeye ve kendi  ismini tarihe büyük bir kanun koyucu  olarak yazdırmaya karar vermiş olmasına rağmen, bariz bir şekilde başarısız olmuştur. Rex in başarısızlığı gerekli reformları gerçekleştirmemiş  olmasından  değil; hukuk oluşturmada (iyi olsun,  kötü olsun) tamamen başarısız olmasından kaynaklanmıştır.48 Rex in neden ve nasıl başarısız olduğunu görebilmek için hikayesine daha yakından bakalım:  Rex  tahta  geçtiğinde,  yaptığı  ilk  şey  var  olan  kuralları  yürürlükten kaldırmak olur. Rex daha sonra yeni bir kanun hazırlamaya girişir. Fakat en basit genellemeleri yapmak konusunda bile kabiliyetsiz olduğunu fark eder. Rex, genelleme konusunda pek çok ders aldıktan sonra bir kanun hazırlar ve artık  uyuşmazlıkların  bu  kanuna  göre  çözümleneceğini,  fakat  kuralların içeriğinin devlet sırrı olarak kalacağını ilan eder. Rex in bu kararı, ona tabi olanları  kızdırır.  Çünkü  ne  olduklarını  bilmedikleri  kuralların  onlara uygulanması söz konusudur.49 Rex, bu itiraz karşısında hayattan aldığı önemli bir dersin, edinilmiş tecrübenin verdiği avantajla karar vermek olduğunu düşünür ve yeni takvim yılının başında geçmiş olan yılın bütün uyuşmazlıklarını çözümleyeceğini, ayrıca  verdiği  kararları  ve  bu  kararlara  dayanak  olmuş  olan  kuralları yayımlayacağını ilan eder. Buna cevaben Rex e tabi olanlar kuralları bilmek istediklerini  söylerken,  bu  kuralları  önceden  bilmeyi  ve  onlara  göre davranışlarını belirleyebilmeyi kastettiklerini söylerler.50 Rex bu eleştiriler üzerine  yeni  bir  kanun  hazırlar.  Fakat  Rex in  hazırladığı  yeni  kanun yayımlandığı zaman anlaşılır ki bu kanun belirsizliklerle doludur. Kanunda sıradan  vatandaşın  veya  hukukçuların  anlayabileceği  tek  bir  cümle  dahi yoktur.51                                                  47 Rundle, 2012, s.88. 48 Fuller, 1969, s.33-34. 49 Fuller, 1969, s.34-35. 50 Fuller, 1969, s.35. İtalik Fuller a ait. 51 Fuller, 1969, s.36.   11Hukukun İç Ahlâkı                                                      AÜHFD, 64 (1) 2015: 1-35 Kanun hemen yürürlükten kaldırılır. Bunun üzerine Rex, uzmanlara kanunun esasına dokunmadan hükümleri açık hale getirmelerini emreder. Fakat  kanun  metnine  açıklık  kazandırılması,  kanun  maddelerinin birbirleriyle çeliştiği gerçeğini ortaya çıkarır.52 Bir kez daha kanun yürürlükten kaldırılır. Bu arada Rex in onlar için yaptığı her şeyden şikayet eden tebaasına karşı sabrı tükenmiştir. Bu nedenle Rex, onlara bir ders vermeye karar verir. Uzmanlara kanundaki çelişkileri kaldırmalarını, ama aynı zamanda kanunları sertleştirmelerini ve yeni suçlar eklemelerini  emreder.  Bu  yeni  düzenlemelerle,  daha  önce  krala  rapor sunmak için on gün verilirken, şimdi bu süre on saniyeye inmiştir. Kralın önünde öksürmek, hıçkırmak, hapşırmak, bayılmak on yıllık hapis cezası öngören  bir  suç  olmuştur.  Sonuç  olarak,  bu  kanun  yayımlandığı  zaman neredeyse  bir  devrim  baş  göstermiştir.  Öncülük  eden  vatandaşlar,  bu kanunları reddettiklerini bildirmişlerdir. Daha sonra krala üzerinde şu not yazan  yüzlerce  dilekçe  gönderilmiştir:   Yapılamayacak  olanı  emretmek hukuk yapmak değildir, hukuk yapmamaktır, uyulamayacak bir emir hiçbir amaca hizmet etmez; karışıklık, korku ve kaostan başka. 53 Kanun yine yürürlükten kaldırılır ve bir grup uzman kanunu gözden geçirmek üzere tayin edilir. Uzmanlar kanun üzerinde çalışır, neredeyse her madde  yeniden  yazılır  ve  sonunda  açık,  tutarlı,  vatandaştan  gücünün ötesinde bir şey talep etmeyen bir kanun hazırlanır ve kanun metni her sokak başında  dağıtılır.  Bununla  birlikte  Rex in  hazırladığı  taslaktan  bu  yana ülkede  pek  çok  değişiklik  olmuştur.  Bu  nedenle  de  Rex in  hazırladığı taslağın  içeriğinde  bir  takım  değişikliklerin  yapılması  gerektiği  fark edilmiştir.  Bunun  üzerine  uzmanların  hazırladığı  kanunun  yürürlüğe girmesinden kısa bir süre sonra, uzmanlar bir dizi değişiklik eklemişlerdir. Sonuç olarak yine bir hoşnutsuzluk oluşmuş ve sokaklarda anonim bir broşür dolaşmaya  başlamıştır:   Her  gün  değişen  bir  hukuk,  hiç  hukuk olmamasından daha kötüdür. 54 Kanuna ilişkin değişikliklerin hızı yavaşlayınca, bu sorun çözülmüş olur. Bunun üzerine Rex, bundan önceki sorunların uzmanlarından aldığı kötü  nasihatlerden  kaynaklandığı  ve  artık  kendisinin  yargı  yetkisini                                                  52 Fuller, 1969, s.36. 53 Fuller, 1969, s.36-37. 54 Fuller, 1969, s.37. 12AÜHFD, 64 (1) 2015: 1-35                                                                                                    Akı üstlendiğini bildirir. Nihayet, Rex in tebaasının kendi davranışlarını tutarlı bir kurallar bütününe uyumlu kılabilmesine olanak sağlayan yeni bir dönem başladığı düşünülürken sonuç hiç de umulduğu gibi olmaz. Bir süre sonra Rex in verdiği kararlar ve o kararlara uygulanması beklenen kanun arasında herhangi  bir  bağlantı  olmadığı  fark  edilir.  Rex in  verdiği  kararlar  ile yayımlanmış kanunlar arasında bir uyum yoktur. Sonunda vatandaşlar Rex i tahttan indirmek için ne tür önlemler alınabileceğini düşünürken Rex ölür.55 Hikayede görüldüğü gibi Rex adını tarihe büyük bir kanun koyucu olarak  yazdırmak  isterken,  bir  hukuk  sistemi  oluşturamadan  ölmüştür. Kristen Rundle a göre bu hikayenin önemi, Fuller ın hukuki patoloji veya başarısızlık  sunarak  ve  nasıl  bir  hukuk  sistemi  oluşturulamayacağını  ve sürdürülemeyeceğini  göstererek,  bu  başarısızlığın  nasıl  başarıyla  yer değiştirebileceği hakkında düşünmeye davet etmesidir.56 Buna göre hukuk sistemi oluşturmada ilk başarısızlık, kural yaratmayı bile becerememekte, genelleme  yapmada  başarısızlıktır.  Hukuk  sistemi  oluşturmada  ikinci başarısızlık,  kuralları  yayımlamak  konusunda  başarısız  olmaktır.  Üçüncü başarısızlık,  geçmişe  yürür  kanun  yapmayı  kötüye  kullanmaktan kaynaklanan  başarısızlıktır.  Hukuk  sistemi  oluşturmada  dördüncü başarısızlık, kuralları anlaşılabilir yapmak bakımından başarısızlık, beşinci başarısızlık  da  birbiriyle  çelişmeyen  kurallar  yapmak  bakımından başarısızlıktır.  Bir  hukuk  sistemi  oluşturmada  altıncı  başarısızlık, vatandaştan imkansızı talep etmekten kaynaklanan başarısızlıktır. Yedincisi çok  sık  değişiklik  yapmak  olup,  bunun  neticesinde  kurallara  uymakla yükümlü  olanların  kurallara  uyum  sağlayamamaları  söz  konusudur. Sekizinci  başarısızlık,  yayımlanmış  kurallar  ile  onların  fiili  uygulaması arasındaki uyumda başarısızlıktır.57 Sonuç olarak, Rex in bir hakim ve kanun koyucu olarak kariyeri bir kural sistemi oluşturmada ve sürdürmede en azından sekiz açıdan başarısız olunabileceğini göstermiş ve Fuller bu başarısızlıklardan kanun koyucunun hukuk  oluşturmak  için  uyması  gereken  sekiz  ilkeye  ulaşmıştır.60  Hukuk                                                  55 Fuller, 1969, s.38. 56 Rundle, 2012, s.89. 57 Fuller, 1969, s.39; Rundle,2012, s.89. 58 İtalik bana ait. 59  Fuller, 1969, s.38. 60 Van der Burg, 2014(a), s.55; Van der Burg, 2014(b), s.60.   13Hukukun İç Ahlâkı                                                      AÜHFD, 64 (1) 2015: 1-35 kuralları genel, kamusal, geleceğe yönelik, açık, mantıksal olarak tutarlı, uygulanabilir, zaman içinde tutarlı olmalı ve yayımlanan kurallar ile onların fiili uygulaması arasında uyum olmadır.61Fuller a göre bu  sekiz noktanın herhangi  birinde  bütünüyle  (total)  başarısızlık,  sadece  kötü  bir  hukuk sistemine  yol  açmayacaktır;  tam  anlamıyla  hukuk  sistemi  olarak adlandırılabilecek  (is  not  properly  called  legal  system)  bir  şey  dahi yoktur. 62 Dolayısıyla Rex in hikayesi  neden kuralları sekiz ilkeye uygun olarak oluşturmak gerekir?  sorusuna bir cevap sunmaktadır: Eğer kanun koyucular bir  hukuk  sistemi  oluşturmak  istiyorsa  bu  sekiz  ilkeye  riayet  etmeleri gerekmektedir. Aksi halde hukuk kuralları insan davranışına yön verememiş ve dolayısıyla bir hukuk sistemi oluşturulamamış olur.63 Rex in hikayesinin gösterdiği bir diğer şey ise, sekiz ilkeye riayet etmeyen bir hukuk sisteminde vatandaşın da kurallara uymak konusunda bir nedeninin kalmamasıdır. Zira Fuller a göre,  bir insanın yayımlanmamış bir kurala veya ondan gizlenen ya da o fiilini gerçekleştirdikten sonra oluşturulan veya rasyonel olmayan ya da                                                  61 Fuller, 1969, s.39. 62 Fuller, 1969, s.39. 63  Rex in  hikayesinin  bir  diğer  önemli  yönü  ise,  hukuk  yapma  sürecinin  kendisine odaklanılması  gerektiğini  göstermesidir.  Oysaki  geleneksel  hukuk  felsefesi  kanun koyuculuk faaliyeti neticesinde çıkan ürüne, yani kanuna odaklanmaktadır. Van der Burg, 2014(a), s.54. Fuller ise kanun yapma sürecine ve girişimine odaklanmıştır. Luban, 2008, s.102;Van der Burg, 2014(a), s.56. Bu doğrultuda Fuller a göre kanun koyucu, eğer hukuk olarak  adlandırılacak  bir  yönetim  formu  oluşturmak  ve  bunu takiben  hukukun  insan davranışına yön veren bir yol işareti olarak hizmet etmesini istiyorsa, bu prosedürel sekiz ilkeye uyması gerekmektedir. Van der Burg, s.55. Fuller teorisini prosedürel doğal hukuk teorisi  olarak  nitelendirirken,  onu  eleştiren  pek  çok  hukuki  pozitivist,  onun  teorisini geleneksel doğal hukuk teorisi olarak görüp, bu ilkelerin hukuk kurallarının içeriğine ilişkin bir sınırlama getirip getirmediğini tartışmışlardır. Van der Burg, 2014(a), s.55. Halbuki Fuller, kanun yapma sürecinin bizatihi kendisine ve bu süreçte kanun koyucunun yerine getirmesi gereken sorumluluğa (sekiz ilkenin yerine getirilmesi) odaklanıp bu sorumluluğu  hukukun iç ahlâkı  ifadesiyle açıklamaya çalışmaktadır. Fuller, 1969, s.223. Bu noktayı, Fuller ın Philip Selznick e yazmış olduğu bir mektupta, ahlâk terimini ethos veya belirli rollere eşlik eden, belirli ahlâki sorumlulukları ifade eden bir terimle değiştirmeyi istediğini belirtmiş olması da doğrulamaktadır. Fuller, aynı şekilde yazdığı bir diğer mektupta şu fikri ileri  sürer:   Eğer  kitabımı  The  Morality  of  Law  olarak  adlandırmak  yerine,  Hukuk Yapmanın  Ahlâkı  (The  Morality  of  Lawing)  olarak  adlandırsaydım,  pek  çok  yanlış anlaşılmadan kaçınılabilecekti,  çünkü  hukuk sözcüğü raflarda durağan bir biçimde yatan kitapları akla getirirken,  hukuk yapma (lawing) terimi birbiriyle etkileşim halindeki insanları ve etkileşimin uygun bir şekilde devam etmesini akla getirmektedir. Rundle, 2012, s.115. 14AÜHFD, 64 (1) 2015: 1-35                                                                                                    Akı hukuk sistemi içindeki diğer kurallarla çelişen veya her dakika değişen bir kurala  uymasına  ilişkin  ahlâki  bir  yükümlüğü  yoktur. 64  Fuller,  kuralı uygulamakla  yükümlü  kişinin  kuralı  görmezden  gelmesinin  veya uygulamamasının,  vatandaşın  kurala  uymasını  imkansız  kılmayacağını,65 ama bir noktadan sonra kurala itaatin de vatandaş açısından boşuna olacağını belirtir ve sosyolog Georg Simmel den alıntı yaparak, vatandaş ve hükümet arasında  kuralların  uygulanmasına  saygı  açısından  bir  karşılıklılık olduğunu belirtir.67 Hükümet vatandaşa şunu demektedir:  Bunlar senden uymanı beklediğimiz kurallardır. Eğer bu kurallara uyarsan, bu kuralların davranışına  uygulanacak  olan  kurallar  olacağını  garanti  ediyoruz. 68 Fuller a göre, bu karşılıklılık bağı hükümet tarafından tamamıyla koparıldığı zaman, vatandaş açısından kurallara itaat ödevini yerine getirme belirli bir temelden yoksun kalmaktadır. Yani, vatandaşın kurallara uymak için bir nedeni  kalmamaktadır.69  Bir  başka  ifadeyle,  hukuki  öznenin  hukuka bağlılığının  söz  konusu  olabilmesi  için  kanun  koyucunun  onunla  bir karşılıklılık içinde olması lazımdır.70  Netice olarak Rex in hikayesi, sekiz ilkeye riayet etmeyen bir kanun koyucu örneği sunarak, bir hukuk sistemi oluşturmak için sekiz ilkeye neden riayet edilmesi  gerektiğini  aksiyle  kanıt  (reductio  ad  absurdum)  yoluyla ortaya  koymuş  olmaktadır.  Buna  göre  kanun  koyucuların  insanların davranışlarına yön vermek, vatandaşların kurallara uymasını sağlamak yani bir hukuk sistemi oluşturmak için bu sekiz ilkeye uyması gerektiği iddia edilebilir.  Böyle  bir  cevap  sekiz  ilkenin,  etik  ilkeler  olmadığı,  kanun koyucunun işini kolaylaştıran (daha etkili kılan) ilkeler, davranış normları olduğu sonucuna varılmasına neden olabilir. Ancak Fuller ın teorisinin bir başka yönüne bakıldığında bu cevabın eksik bir cevap olduğu görülebilir. Zira Fuller ın teorisinde saklı bir insan görüşü vardır:  Şimdi  en  önemli  hususa  gelmiş  bulunuyorum.  Bu  önemli husus  da  hukuki  ahlâkın  taleplerine  riayet  edilmesiyle  insan                                                  64 Fuller, 1969, s.39. 65 İtalik bana ait. 66 İtalik bana ait. 67 Fuller, 1969, s.39. 68 Fuller, 1969, s.40. 69 Fuller, 1969, s.40. 70 Rundle, 2012, s.89.   15Hukukun İç Ahlâkı                                                      AÜHFD, 64 (1) 2015: 1-35 hayatının  genel  olarak  daha  büyük  amaçlarına  hizmet edilebileceğidir. Bu hukukun iç ahlâkında saklı insan görüşüne dayanır.  Hukuki  ahlâkın  pek  çok  etik  meseleye  karşı  nötr olduğunun söylenebileceğini defalarca gözlemledim. Hukuki ahlâk kendi içindeki insan görüşüne karşı nötr olamaz. İnsan davranışını kuralların  yönetimine  tabi  kılma  girişimi  insanın  sorumlu  bir eyleyen, kuralları anlama ve takip edebilme yetisine sahip ve kendi hatalarından sorumlu olduğu veya olabileceği görüşüne zorunlu bir bağlılık içerir. Hukukun iç ahlâkından her bir ayrılış, sorumlu bir hukuki özne  olarak  insanın  onuruna  hakaret  etmek  demektir.  Onun davranışlarını  yayımlanmamış  veya  geçmişe  yürür  kurallarla yargılamak ya da ona yerine getiremeyeceği emirler vermek, onun özerkliğine  karşı  kayıtsızlığı  ortaya  koymaktır.  Bunun  aksine, insanın sorumlu eylem yetisi olmadığı kabul edildiğinde, hukuki ahlâk  (legal  morality)  var  olma  nedenini  kaybedecektir.  Onun davranışlarını,  yayımlanmamış  veya  geçmişe  yürür  kurallarla yargılamak artık bir hakaret olmayacaktır, çünkü artık bir hakaret yoktur – hatta bu bağlamda yargılamak sözü de yersiz olacaktır; biz  artık  bir  insanı  yargılamıyoruz,  onu  kontrol  (act  upon) ediyoruz. 71 Bu doğrultuda, sekiz ilkenin türetildiği kaynağın, insanın akıl sahibi ve kendi kararlarını, seçimlerini yapabilen birey olduğu ileri sürülebilir. Bu iddia ise hukukun iç ahlâkını açıklamada önemli bir yerde durmaktadır.  III. Hukuk ve Ahlâk Arasındaki Bağlantı Dolayısıyla  hukuk  ve  ahlâk  arasındaki  zorunlu  bağlantı  ilk  olarak, hukuka  tabi  vatandaşın  yani  hukuki  öznenin  özerk  bir  birey  olmasıyla açıklanabilir.  Bugün  Fuller  yanlısı  teorisyenler  de  hukukun  insanın özerkliğine saygı duymasını, sekiz ilkenin ahlâki ilkeler olduğu savunusunda gerekçe olarak kullanmaktadır.  Fuller  yanlısı  teorisyenlerden  Jeremy  Waldron,  Fuller ın  yukarıda aktarılan  iki  paragrafta  hukukun  özel  bir  yönüne  işaret  ettiğini  ileri sürmektedir. Bu özel yön de hukuk veya kurallarla yönetimin, kişinin kendi                                                  71 Fuller, 1969, s.162. 16AÜHFD, 64 (1) 2015: 1-35                                                                                                    Akı davranışına  kuralları  uygulayabilme  (self-application)  yetisine  dayanıyor olmasıdır. Yani, hukukla yönetim çerçevesinde, insanlar, devlet tarafından uygulanacak  zorlayıcı  bir  güç  neticesinde  kurallara  uymaktansa,  kendi davranışlarına  normları  uygulamakta  ve  buna  göre  davranmakta, davranışlarını düzenlemekte, kısaca normlara göre hareket etmektedir.72 Bu husus, Waldron a göre, işleyen bir hukuk sisteminin en önemli özelliğidir. Hukuk sistemleri, insanların normları anlama ve kavrama yetilerine, kendi kendilerini  kontrol  etmelerine,  denetlemelerine  ve  kendi  davranışlarını ayarlama yetilerine güvenmektedir.73 Bu iddiayla paralel olarak, Fuller ın teorisinde belirli bir insan görüşü söz konusudur. Buna göre, Fuller eyleyenden bahsettiği zaman, amaçsal eylemi gerçekleştirme yetisine sahip ve kendisinin amaç olduğu bilincine sahip kişiden bahsetmektedir. Buna göre sadece kanun koyucunun verdiği direktifleri takip eden biri değil, bir onur taşıyıcısı, kendi kendine karar verme yetisine sahip birinden söz etmektedir.74 Aynı zamanda, Fuller için hukuki özne ise,  onlara söyleneni yapmaya hazır, boyun eğen bir kitlenin  üyesi olmak değildir. Fuller için hukuki özne, bir eyleyen (agent) olarak saygı duyulan biri olmak ve ayırt edici özelliği olan bir düzenin üyesi olmak anlamına gelmektedir.75 Dahası Rundle a göre hukuki özne, sadece kendi çıkarları açısından seçimleri ve planları olan bir birey değil, Antik Yunan tarzı vatandaşa benzer olarak hukuk düzeninin aktif katılımcısıdır.76 Bu insan görüşünden hareket eden Rundle a göre hukuk doğası gereği ahlâkidir. Zira hukukun formu, yani  genel kurallar aracılığıyla yönetim, hukuki  öznenin  statüsünü  sorumlu  bir  varlık  olarak  kabul  etmekte  ve sorumlu bir eyleyen olarak insana saygı duymaktadır.77 Yani Fuller ın teorisi çerçevesinde  insan,  genel  kurallarla  etkileşime  girebilen  sorumlu  bir eyleyendir. Bu doğrultuda hukuki özneye talimat veren veya hukuki özneye dayatılan  bir  kurallar  sistemi,  hukuk  sistemi  olarak  adlandırılamaz.78                                                  72 Waldron, 2012, s.206. 73 Waldron, 2012, s.206; Luban, 2010, s.42, 43. 74 Rundle, 2012, s.99. 75  Rundle, 2012,s.2. Rundle aynen alıntıyı Fuller ın yayımlanmamış metinlerinden almıştır, Harvard Law School Library, Box 12. Ayrıca bkz. Rundle, 2013, s.771. 76 Rundle, 2012, s.99-100. 77  Rundle, 2012, s.3. İtalik bana ait. Rundle a göre, genellik ilkesi daha sonra, Fuller ın kendisini eleştirenlere yönelik fikirlerini geliştirirken hukukun neden içsel (internally) olarak ahlâki olduğunu göstermede büyük bir yer tutacaktır. Rundle, 2012, s.90. 78 Rundle, 2012, s.10.   17Hukukun İç Ahlâkı                                                      AÜHFD, 64 (1) 2015: 1-35 Özellikle bu noktada genel kurallar, yani hukuk aracılığıyla yönetim ve idari emir arasındaki fark önemlidir.79 Zira hukuk kurallarıyla, yani genel kurallar aracılığıyla  yönetim,  hukuki  öznenin  hukuk  çerçevesinde  eyleyebilme kapasitesine  dayanmaktadır.80  Daha  da  ötesi,  Fuller  hukukun  formunun öznenin statüsüne saygı göstermenin ötesinde, bunu önceden varsaydığını da iddia  etmektedir.  Zira  Fuller ın  The  Morality  of  Law da  belirttiği  gibi, hukuka bağlılık belirli bir insan anlayışını gerektirmektedir.81 Hukuk ve ahlâk arasındaki zorunlu bağlantıyı açıklamanın bir diğer yolu ise Fuller ın görüşleri çerçevesinde, sekiz ilkenin kanun koyucu ve vatandaş arasında bir karşılıklılık ilişkisi oluşturmasıdır. Yukarıda belirtildiği gibi, kanun koyucu ve vatandaş arasındaki karşılıklılık şuna dayanır: Bir yandan  kanun  koyucu  vatandaşların  bir  bütün  olarak  kendisinin  yaptığı kuralları hukuk olarak kabul ettiğini ve bunlara uyacağını umacak; diğer yandan da  vatandaşlar kanun  koyucunun  kendi yapmış  olduğu kurallara bağlı kalacağını (özellikle vatandaşların davranışları yargılanacağı zaman) umacaklardır.82 Fuller a göre, bunun anlamı, vatandaşların ellerinde kanun kitaplarıyla  dolaşıp,  kanun  koyucuların  bunlara  uygun  hareket  edip                                                  79  Hukuk  aracılığıyla  yönetim  ile  idari  emir  arasındaki  fark  Fuller ın  eunomics  projesi çerçevesinde açıklanabilir. Eunomics Fuller ın geliştirdiği bir terimdir. Fuller eunomics terimini şu şekilde tanımlamaktadır:  iyi düzenin veya işleyebilecek (workable) sosyal düzenlemelerin bilimi, teorisi veya çalışması.  Fuller, 2001(b), s.62. Fuller 1950 ve 1960 yılları arasında Principles of Social Order başlığı altında eunomicsle ilgili sistematik bir eser yazmayı planlamış, fakat sadece Means and Ends i bir giriş olarak yazmıştır. Kitap her ne kadar yazılmamış olsa da, Means and Ends in yayımının ardından geçen on yılda, Fuller sosyal düzenleme modelleri ve onların tezahürlerine büyük ilgi göstermiştir. Fuller, bütün sosyal düzenleme modellerini kapsayan bir eser yazmamıştır. Her bir sosyal düzenleme modeli için makaleleri bulunmaktadır. Bu makaleleri de Winston, Principles of Social Order  adlı  kitapta  bir  araya  getirmiştir.  Winston,  s.29.  Fuller ın  ilgilendiği  sosyal düzenleme modellerini bir liste olarak sunmak mümkün olmasa da, bunlar arasında hüküm verme (adjudication), arabuluculuk, kanun koyma, sözleşme ve idari emir (managerial direction) belirtilebilir. Fuller a göre her bir sosyal düzenleme modeli kendi iç ahlâkını içermektedir. Örneğin, kanun koyma genel kurallara uygun olarak yönetme girişimi olup, bu  girişim  sekiz  ilke  aracılığıyla  gerçekleştirilmektedir.  Diğer  sosyal  düzenleme modellerine göre, örneğin arabuluculuk ve sözleşmeye ilişkin ahlâki ilkeler  farklıdır. Winston, s.42. Dolayısıyla, kanun koyma yani genel kurallar aracılığıyla yönetim ve idari emir birbirinden farklı sosyal düzenleme formlarıdır. Bu ikisi arasındaki fark hukukun iç ahlâkını açıklamada önemli bir yerde durmaktadır. İkisi arasındaki fark aşağıda ayrıntılı olarak açıklanacaktır.  80 Rundle, 2012, s.10. 81 Rundle, 2012, s.10. İtalik bana ait. 82 Fuller, 2001(a), s.254-255; Fuller, 1969, s.39-40. 18AÜHFD, 64 (1) 2015: 1-35                                                                                                    Akı etmediğini  tespit  etmesi  demek  değildir.83  Burada  önemli  olan  nokta, vatandaşın  hükümetinin bu hukuk oyununu adil bir şekilde oynadığına dair bir inancının (faith)  olmasıdır.84 Fuller a göre işleyen bir hukuk sisteminde vatandaşların  bu inanca  sahip olması çok  büyük  bir  önem  taşıdığından, buradaki önemli bir düş kırıklığı hem vatandaş açısından hem de yöneticiler açısından bir hukuk düzeninin  ahlâki temellerini  zedeleyecektir.85 Dolayısıyla  kanun  koymanın  iç  ahlâkının  ahlâki  boyutu,  kuralların uygulanması bakımından kanun koyucu ve vatandaş arasındaki karşılıklı beklentiye dayanmaktadır. Kanun koyucunun kurallara uygun olarak hareket etmesi  için  de  öncelikle  genel  nitelikte  kuralların  olması,  bu  kuralların anlaşılabilir olması, yayımlanmış  olması yani sekiz ilkeye uygun olarak oluşturulması gerekmektedir. Bu doğrultuda hukukla yönetilen vatandaşların beklentisi  de  genel,  yayımlanmış  olan,  açık,  yerine  getirilebilir,  tutarlı, zaman  içinde  çok  sık  değişmeyen  ve  geçmişe  yürümeyen  kurallarla yönetilmektir. Daha açık bir ifadeyle vatandaşlar, kendi davranışlarına ve yetkililerin davranışlarına bu kuralların uygulanacağı beklentisi içindedirler. Bu beklenti ise bir sosyal düzenleme modeli olarak hukukun amacından kaynaklanmaktadır.  Fuller a  göre  hukukun  amacı,  insan davranışına  yön vermektir.86  Bu  doğrultuda  da  hukuka  tabi  olan  vatandaş,  bir  hukuk sistemindeki kuralların insan davranışına yön vereceği beklentisi içindedir. Dolayısıyla  hukukun  sekiz  ilkeye  uygun  olarak  oluşturulacağı  beklentisi içindedir. Kanun koyucunun beklentisi ise kurallara tabi olan vatandaşın bu kuralları anlama, takip edebilme yetisine sahip özerk bireyler olmasıdır. Sekiz ilkenin bir sosyal düzenleme modeli olarak hukukun amacından kaynaklandığı iddiası ise bu ilkelerin neden hukukun veya kanun koymanın  iç  (inner, internal) ahlâkı olarak kabul edilmesi gerektiğini açıklar. Bu ilkelerin hukukun  iç  ahlâkının ilkeleri olarak adlandırılmasının sebebi, hukukun  dışından  dayatılan  bir  takım  amaçlar  veya  gerekliliklerden kaynaklanmıyor  oluşu,  hukuk  düzeninin  bizatihi  kendi  amacından                                                  83 Fuller, 2001(a), s.255. 84 Fuller, 2001(a), s.255. 85 Fuller, 2001(a), s.255. 86 Fuller, 1969, s.106. 87 Bu noktada da Winston un yaptığı bir ayrım önemlidir; her bir sosyal düzenleme modelinin iç ve dış amacı. Sosyal düzenleme modelinin iç amacı, idari emir ve hukuk arasındaki farkla ilgilidir. Sosyal düzenleme modelinin iç amaçlarından bahsedildiği zaman sorulması   19Hukukun İç Ahlâkı                                                      AÜHFD, 64 (1) 2015: 1-35 kaynaklanıyor oluşudur. Daha açık bir ifadeyle, hukukla yönettiğini iddia eden her yönetim sekiz ilkeye riayet etmelidir. Zira hukukun amacını -insan davranışına  kurallar  aracılığıyla  yön  vermek-  gerçekleştirmeye  olanak sağlayan ve hukuku hukuk yapan sekiz ilkedir. Dolayısıyla Fuller ın görüşleri çerçevesinde hukukla yönetim, kanun koyucu ve vatandaş arasında bir karşılıklılık ilişkisine dayanır. Bu ilişki bir hukuk sisteminin ahlâki temelidir. Böyle bir ilişki Fuller ın hukukun kendine özgü bir ahlâkı olduğu iddiasının temelidir. Hukuk sisteminin vatandaş ve kanun koyucu arasındaki karşılıklı ilişkiye dayanmasının neden ahlâk olarak kabul edilmesi gerektiği, bir  verdiğin sözü tutma  veya  güven ilişkisi  olarak görülebilir. Hukukla yönettiğini iddia eden kanun koyucular, hukukla yönetimin  bir  gereği  olarak  sekiz  ilkeye  riayet  etme  sözü  vermiş olmaktadırlar. Vatandaş da böyle bir beklenti içindedir. Dolayısıyla sekiz ilkeye riayet etme zorunluluğu, hukuka tabi olan tarafı yani vatandaşı da hukukun bir parçası olarak görmekle ilgilidir. Kanun koyucular bir hukuk sistemi oluşturmayı amaçladıkları takdirde, vatandaşın kurallara uygun bir şekilde hareket edebileceği bir sistem yaratmak zorundadırlar. Zira Fuller ın görüşleri çerçevesinde kanun koyucu hukuk oluşturmak istiyorsa, dilediği her düzenlemeyi hukuk olarak kabul edemez; ancak vatandaşın kurallara uygun  olarak  davranışını  belirleyen,  yani  sekiz  ilkeye  uygun  olarak oluşturulmuş, düzenlemeler hukuk olarak kabul edilebilir. Dolayısıyla bir sosyal  düzenleme  modeli  olarak  hukuk,  karşılıklı  olarak  verilen  (kanun koyucu ve vatandaş tarafından) sözleri tutmak bakımından ahlâki bir düzen olarak görülebilir.  Ayrıca sekiz ilkeye uygun bir şekilde inşa edilen ve sürdürülen rejimler vatandaşları korku, tedirginlik ve belirsiz durumlardan uzak tuttuğu, belirli bir  kötülükten  kaçınmayı  sağladığı  için  de  ahlâki  bir  boyuta  sahiptir. Dolayısıyla sekiz ilkenin etik ilkeleri olarak kabul edilebilmesinin bir diğer nedeni,  keyfiliği  önlemeleri  ve  belirli  tür  kötülüklerin  önüne geçebilmeleridir.  İlkelerin  belirli  kötülüklerden  kaçınmayı  sağlaması, insanların belirsiz ve öngörülemeyen ve kaostan uzak bir hayat sürdürmesini                                                                                                                    gereken  soru,  bu  süreci  kullanmadaki  amaç  (point)  nedir  sorusudur.  Örneğin  hangi durumda neden o hukuki sürecin yani neden arabuluculuk veya idari emrin değil de kanun yapmanın kullanıldığı meselesidir. Fakat eğer hukuki sürecin dış amacını sorgularsak bu defa soru bu süreci kullanarak neyin elde edilebileceğidir. Mesela dar gelirli öğrencilere üniversite eğitimini gerçekleştirmek için burs sağlanması gibi. Winston, s.53. 20AÜHFD, 64 (1) 2015: 1-35                                                                                                    Akı olanaklı kılmalarıyla ilgilidir. Bu ilkeler aracılığıyla ne tür bir kötülükten kaçınılabileceği  ise  bu  ilkelerin  yerine  getirilmediği  bir  sistem  altında yaşamayı tahayyül etmekle ortaya konulabilir.88 Kuralların  yayımlanmadığı,  belirsiz  ve  yerine  getirilmesi  imkansız talepleri içerdiği rejimlerde, vatandaşlar devamlı bir tehlike korku ve kaos altında  yaşamaktadır.89Fuller  geçmişte  bazı  hükümetlerin  kaos  ve  korku yaratarak bazı gizli amaçlarını gerçekleştirmeye çalıştıklarının farkındadır.90 Çünkü yerine getirilmesi mümkün olmayan veya ne anlama geldiği açık olmayan kurallara uymak zorunda olmak, vatandaşı çok geniş ve hatta keyfi bir takdir yetkisine sahip bir yönetimle karşı karşıya getirmektedir. Belirsiz kurallar,  yönetenlerin  vatandaşlara  karşı  istediğini  yapabilmesini sağlamaktadır.  Bu  tür  kurallar,  yetkililere  istediği  kişiler  hakkında kovuşturma açma imkânı sunmaktadır. Böyle bir yönetimle karşı karşıya kalan vatandaşlar ise hayal kırıklığına uğramanın da ötesinde artık plan da yapamamakta  ve  korku  ve  tedirginliğin  yanı  sıra  hükümetleri kızdırmamaya  ve  muhalefet  etmemeye  çalışmak  durumunda kalmaktadırlar.92 Bu  tür  rejimlerde  söz  konusu  olan   kayıp  insanlar   da  muhalefeti korkutmanın veya insanları korku içinde bırakmanın örneklerinden biridir.93 Kayıp insanların söz konusu olduğu rejimlerde, sekizinci ilkenin ihlali çok açıktır. Burada amaç, insanlara korku aşılamak ve muhalefeti baskılamaktır. Aynı  şekilde,  kaybolanların  yakınları  açısından  da  durum  çok kötüdür.94Evan  Fox-Decent e  göre,  kaybolma  durumunda  devlet  yanlış yaptığı şeyleri reddetmekte ve kaybolan kişinin vücudu bulunamamakta ve yakınları da sonsuz bir keder ve ümitsiz bir beklenti içine düşmektedir. Bununla  birlikte,  hukuk  devleti  yani  sekiz  ilkeye  riayet  eden  bir  rejim tarafından güvence altına alınan saydamlık, kaybolmanın yol açtığı terörü engelleyebilir;  çünkü  kötülük  bunların  gizli  bir  şekilde  yapılmasından kaynaklanmaktadır.95                                                  88 Luban, 2010, s.39. 89 Luban, 2010, s.39; Waldron, 1994, s.263. 90  Waldron, 1994, s.263. Örneğin Hitler hükümeti, vatandaşları belirli bir acizlik ve korku içinde bırakmaktaydı. Waldron, 1994, s.263. 91 Waldron, 2008, s.7. 92 Luban, 2010, s.40. 93 Decent, s.573-574. 94 Decent, s.574. 95 Decent, s.574.   21Hukukun İç Ahlâkı                                                      AÜHFD, 64 (1) 2015: 1-35 Toparlayacak olursak Fuller ın dile getirdiği ilkeler kanun koyucuya yönelik bir takım davranış normları getirmektedir. Bu davranış normları kanun koyucu ve vatandaş arasında kuralların uygulanması bakımından bir karşılıklılık ilişkisi yaratması, kişinin özerkliğine saygı gösterilmesinin bir yolu olması bakımından ahlâk i bir niteliğe sahiptir. Daha da önemlisi sekiz ilkeye  uygun bir  şekilde  inşa edilen  ve  sürdürülen rejimler vatandaşları korku, tedirginlik ve belirsiz durumlardan uzak tuttuğu, belirli bir kötülükten kaçınmayı sağladığı için de ahlâki bir boyuta sahiptir.  IV.  Kişinin  Özerkliği  ve  Hukuk  Arasındaki  İlişkiye  Dair Sorgulamalar: Waldron Waldron a göre kurallarla yönetim, her ne kadar, insanın kendi kendine karar verme ve bunun neticesinde kurallara uyma veya uymama yetisine dayansa da, bir sosyal düzenleme modeli olarak hukuka ilişkin üç hususun daha tartışılması gerekmektedir. Birincisi hukuk sadece normlardan değil, aynı  zamanda  da  standartlardan  oluşmaktadır.  Dolayısıyla  vatandaşların karşısında her zaman onlara ne yapmalarını veya ne yapmamalarını söyleyen açık kurallar yoktur. Örneğin  gereken özen  kavramı gibi. Waldron a göre, bazı  düşünürler  sadece  yetkililer  tarafından  anlamı  belirlendiği  takdirde standartların insan davranışına rehber olabileceğini kabul etmektedir. Ancak Waldron a  göre,  bu  durumlarda  dahi  hukuk  insanlara,  standartların  ne anlama  geldiğini  belirlemek  konusunda  yetkililere  güvendiği  gibi güvenmektedir.  Dolayısıyla  hukuk,  normları  kendi  davranışlarına uygulayacağı  ve  normların  kendi  davranışları  üzerindeki  etkisini anlayabileceği noktasında insanlara güvenmektedir.96 İkinci  husus,  genel  kuralların  her  zaman  uygulanmasının  mümkün olmamasıdır.  Bunun  nedeni  uygulama  konusundaki  bir  uyuşmazlık olabileceği gibi, hukuk kurallarının uygulamasının bir yetkili aracılığıyla mümkün olması olabilir.97 Ama bu durumlarda da Waldron a göre, hukuk insanların  kuralları  kendi  davranışına  uygulayabilme  yetisine güvenmektedir. Örneğin, bir özel hukuk davasında belirli bir para ödemeye mahkum edilen kişinin evine doğrudan icra memurunun gitmesinden önce, kişinin parayı rızasıyla ödemesi beklenmektedir.98                                                  96 Waldron, 2012, s. 208. 97 Waldron, 2012, s.206. 98 Waldron, 2012, s.206. 22AÜHFD, 64 (1) 2015: 1-35                                                                                                    Akı Üçüncü husus ise hukukun zorlayıcı karakteriyle ilgilidir. Waldron ve diğer düşünürler insanın özerkliği ve kendi hayatı üzerinde karar verme yetisi üzerinde dursa da, Waldron hukukun zorlayıcı karakterinin, insanın özerkliği  ve  genel  kurallar  ilişkisine  nasıl  bir  etkide  bulunacağını sorgulamamıza  olanak  sağlar.  Waldron,  hukukun  zorlayıcılığının farkındadır. Amacı da hukukun zorlayıcı karakterini inkar etmek değildir;99 çünkü  hukuk insanları öldürür, iflas ettirir, güç kullanır, ceza verir. Bunlar hukukun  karakteristik  olarak  yaptığı  şeylerdir. 100  Ancak  hukuk  güç uygularken,  Waldron a  göre,  bunu  formlar  ve  kurumlar  aracılığıyla yapmaktadır  ve  hukukla  yönetimin  en  temel  özelliği  de  budur.101  Bu doğrultuda, hukukun normlar aracılığıyla ileri sürdüğü talepler, her ne kadar yerine  getirilmesi  gereken  talepler  olsa  da,  insanların  normu  kendi davranışlarına  uygulama  ve  izleme  (monitör)  yetisine  bir  alan bırakmaktadır.102 Dahası,  Waldron a  göre  hukukun  güç  uyguladığı  durumlarda  bile, hukukun her istediğini istediği şekilde yapması söz konusu değildir. Hukuk, insanlar hukuki yaptırımlardan korksa, çekinse veya hukuk insanların aksi takdirde gitmek istemeyeceği yerlerde veya durumlarda bulunmasına neden olsa bile, böyle bir durum sürü  gütmekten  farklı bir şeydir. Bunun yerine, hukuk  ve  insan  onuruna  saygı  arasındaki  ilişkiden  söz  edilmelidir.  Bu doğrultuda  hukukun  güç  kullandığı  ve  insanların  en  savunmasız  olduğu zamanlarda bile, insan onuruna saygı duyulması söz konusudur.103 Hukukun insanlar üzerinde zorlayıcılığını kullanmasının bir örneği kişinin ciddi bir suçla  yargılanmasıdır. Bu durumda  kişi istese  de  istemese  de  mahkeme salonuna zorla getirilmekte, ceza almakta, cezaevine götürülmekte ve bütün bunlar  zorla  yaptırılmaktadır.  Ancak  Waldron a  göre,  bu  zorlama  onu ‘barbarca  umutsuz  bir  dehşetten  titreyen 104  biri  haline indirgememektedir.105                                                  99 Waldron, 2012, s.206. 100 Waldron, 2012, s.217. 101 Waldron, 2012, s.217. 102 Waldron, 2012, s.217. 103 Waldron, 2012, s.218. 104  Hannah  Arendt,  The  Origins of  Totalitarianism,  New  York,  1973,  441 den  aktaran Waldron, 2012, s.218. 105 Waldron, 2012, s.218.   23Hukukun İç Ahlâkı                                                      AÜHFD, 64 (1) 2015: 1-35 Ayrıca Waldron a göre, hukuk tarafından davranışların sıkıca kontrol altına alındığı durumlarda bile, kişiler dik durabilmeli ve hareket etmekten acizlermiş  gibi  yerlerde  sürüklenmekte  ziyade  emirlere  cevap  verebilen durumunda olmalıdırlar. Waldron bunların belki önemsiz meseleler veya ayrıntılar  olarak  görülebileceğini  ve  bazılarının  şu  soruları   Eğer  birisi idama  mahkum  edilmişse  onun  hücreye  nasıl  götürüldüğünün  ne  önemi vardır?    Eğer  birisi  tutukluysa  onun  ayakta  mı  yoksa  sürüklenerek götürüldüğünün  ne  önemi  vardır 106  sorabileceğini  belirtir.  Ancak Waldron a göre, aşağılama veya itibarsızlaştırma durumunda bu detaylar öne çıkmakta veya gözaltı durumunda bu tür detaylar ile insan onuru ilişkisi doğrudan söz konusu  olmaktadır. Waldron a göre, onurun dik durmayla önemli bir ilişkisi vardır ve bu önemsiz meselelerdeki onur kırıcı durum (indignity) esasa ilişkin hakaretin bir habercisi olabilir. Zira,  Terörle olan savaşın başında, Guantanamo daki tutukluların yürüyerek götürülmesinden ziyade, el arabası üzerinde götürülmesi, sonradan yaşanacakların habercisi değil midir? 107 Sonuç  olarak  bütün  bunlar  Waldron a  göre,  hukukla  yönetimi,  bir çubukla veya köpekle bir hayvan sürüsünü gütmekten farklı bir şey yapar. İnsanların kuralları kendi davranışlarına uygulayabilmesi (self-application) hukuku  hukuk  yapan  özelliktir.  Bu  özellik  hukuku,  tehdit  ve  şiddet aracılığıyla gerçekleştiren yönetimden farklı kılar. Fuller ın da gösterdiği gibi,  insanların  kuralları  kendi  davranışlarına  uygulayabilmesi  (selfapplication) hukukun insan onuruna saygısının bir göstergesidir.108 V. Fuller ın Teorisine Yöneltilen Eleştiriler Fuller ın hukukun kendine özgü bir iç ahlâkı olduğu iddiası literatürde, o  dönemde,  ciddi  eleştirilere  maruz  kalmıştır.  Bu  eleştirilerden  ilki  bu ilkelerin  ahlâki  ilkeler  olmadıkları,  etkili  bir  kanun  koymanın  ilkeleri olduğudur.109 Fuller bu eleştiriye A Reply to Critics te idari emir ve genel kurallar  aracılığıyla  yönetim  ayrımı  çerçevesinde  cevap  vermiştir.110  Bu noktada da idari emir ve hukukun (genel kurallarla yönetim) farkı ortaya                                                  106 Waldron, 2012, s.219. 107 Waldron, 2012, s.219. 108 Waldron, 2012, s.206. 109 Hart, 1983, s.343-364. Raz, 2008, s.163. 110 Fuller, 1969, s.208. 24AÜHFD, 64 (1) 2015: 1-35                                                                                                    Akı konulmalıdır. Bununla birlikte Fuller bu iki sosyal düzenleme formunun gerçek hayatta birbirine girmiş olduğunu belirtir. Fuller açıklamada kolaylık sağlamak için bunların ideal tiplerinin özelliklerini ortaya koyar.111Ayrıca Rundle da idari emir ve hukuk arasındaki ayrımı abartmamak gerektiğini, zira  Fuller a  göre  hukukun  varlığının  bir  derece  meselesi  olduğunu belirtir.112 İkisi arasındaki farkı belirtmeden önce, bu iki sosyal düzenleme formu arasındaki benzer özellikler üzerinde durmak gerekmektedir. Buna göre hem hukuk hem idari emir, insan davranışını yönlendirmeyi ve kontrol etmeyi içine almaktadır. Her ikisi de otoriteye bağlılığa işaret etmektedir. İki sosyal düzenleme formunun da kullandığı terimler benzerdir; otorite, kontrol, yetki, itaat, rıza gösterme, meşruiyet gibi.113 Bununla birlikte Fuller a göre ikisi arasındaki  farklar  şu  şekildedir:   hukukun  en  temel  karakteristiği genelliğinde yatmaktadır. 114 Bunun anlamı hukukun genel kurallar koyması veya hukukun genel kurallar aracılığıyla yönetimle ilgili olmasıdır. Buna karşılık idari emir spesifik emirlerle  (directives) ilerlemektedir:  Burada bunu yap   A, B ile yer değiştirsin.   Yarın sekiz buçukta raporu hazır et gibi. 115  Ayrıca,  emirler  (directives)  üst  tarafından  belirlenen  bir  amaca hizmet etmek için  ast  tarafından uygulanmaktadır. Buna karşılık hukuka bağlı  vatandaş,  kanun  koyucu  tarafından  belirlenen  amaçlara  hizmet amacıyla  kuralları  uygulamamakta,  fakat  kendi  ilişkileri  (affair) çerçevesinde kuralları takip etmektedir. İdari emirler, ast/üst arasında ve tamamlayıcı bir şekilde  ast ın üçüncü kişilerle ilişkileri arasındadır. Bir hukuk  sisteminin  kuralları  ise  daha  çok  vatandaşların  birbirleriyle  ilişki kurmalarına, tamamlayıcı bir şekilde kurallardan kaynaklı olarak otoriteyle ilişki kurmalarına hizmet etmektedir. Fuller a göre ceza hukuku alanında bile  bu  böyledir.  Ceza  hukukunun  temel  fonksiyonu,  vatandaşların birbirleriyle  etkileşime  girebilmeleri için sağlam ve durağan  bir çerçeve yaratmaktır.116                                                  111 Fuller, 1969, s.208. 112 Rundle, 2012, s.137. 113 Fuller, 1969, s.207. 114 Fuller, 2001(a), s.254. 115 Fuller, 2001(a), s.254. 116 Fuller, 1969, s.207-208.   25Hukukun İç Ahlâkı                                                      AÜHFD, 64 (1) 2015: 1-35 Bununla  birlikte  Fuller  genellik  ilkesinin  idari  emirle  yönetim modelinde  de  kullanılabileceğinin  farkındadır.  Diğer  bir  ifadeyle   üst   ast ını genel kurallar aracılığıyla yönetebilir. Ancak bir sosyal düzenleme modeli  olarak  hukuktan  farklı  olarak  idari  emir  söz  konusu  olduğunda genellik ilkesi  üst  ün menfaati (expediency) gereği kabul edilmiştir.117 Diğer bir ifadeyle üst eğer genel kurallar aracılığıyla  ast la ilişki içinde ise bunun  nedeni,  her  seferinde  direktif  veya  emir  verme  zahmetinden kurtulmaktır.  Örneğin  ast/üst  ilişkisi  içinde  olan  iki  kitabevi  çalışanını düşünelim. Üst konumunda  olanın,  ast a her hafta raflardaki kitapların alfabetik sıraya uygun olup olmadığını kontrol etmesini söylemektense  her Pazartesi kitapların alfabetik sıraya uygunluğunu düzenle.  diye bir genel kural koyduğu varsayılsın. Fuller a göre buradaki genel kuralın hukukla yönetimden  farkı,  böyle  bir  genel  kuralın   üst ün  işini  kolaylaştırıyor oluşudur. Bunun anlamı,  üst ün genel kuraldan sapması halinde  ast ın şikayet etme hakkı olmamasıdır. Örneğin  üst  astına  bu hafta Çarşamba günü de kitapların alfabetik sıraya uygun olup olmadığını kontrol edeceksin  dediğinde,  ast ın  ama bu işi sadece Pazartesi yapıyordum  demeye hakkı yoktur.  Bu  durumda   üst ün  genel  kural  koymasının  tek  nedeni,  genel kuralla yönetimin kendisine sağladığı kolaylıktır. Bu nedenle  üst ün kendi koymuş olduğu genel kurala uyma yükümlülüğü de yoktur. Dolayısıyla idari emirde, genel kurallar koyulması,  üst ün menfaatleriyle ilgili olduğu için, sekizinci ilke, yani yayımlanan kural ile fiili uygulaması arasındaki uyum ilkesi de anlamını kaybetmektedir.  Fuller  bu  analizinin  neticesinde,  idari  emir  açısından  hukukun  iç ahlâkının sekiz ilkesinin, gerçekten etkililiğin ilkeleri olduğu ve buradaki ilişkinin tek  yönlü  olduğunu  dile  getirir.  Bu  ilkeler,  Fuller a  göre,   üst konumundaki  kişinin  amaçlarının  başarısını  sağlamaya  yönelik vasıtalar dır.118 Fuller a  göre  hukukun  en  karakteristik  özelliği  genel  kurallarla yönetime  dayanıyor oluşudur. İdari emir ise belirli emirlere, direktiflere dayanmaktadır. İdari emirde,  ast   üst ün belirli amaçlarını gerçekleştirmek için direktiflere uyuyordur. Bu doğrultuda emir veren  üst  verdiği emrin etkili bir şekilde gerçekleştirilmesini ve amaçladığı şeyin etkili bir şekilde                                                  117 Fuller, 1969, s.208. 118 Fuller, 1969, s.209.  26AÜHFD, 64 (1) 2015: 1-35                                                                                                    Akı gerçekleştirilmesini  istiyorsa  emirlerinin  açık,  tutarlı,  yerine  getirilebilir, yayımlanmış  olması  ve  birbiriyle  çelişmemesi  gerekmektedir.119  Ancak hukukla  ve  genel  kurallarla  yönetim  söz  konusu  olduğunda,  yöneten yönetilenin kuralları anlama kapasitesine ve özerkliğine saygı duymaktadır. Kişilerin  özerkliğine  saygı  duyularak,  kurallara  uygun  davranıp davranmamak kişilere bırakılmakta ve hukukla yönetim adına etkililikten taviz  verilmektedir.120  Dolayısıyla  hukukla  yönetimin  amacı  insan davranışına  yön  vermektir,  kanun  koyucunun  kişisel  çıkarlarını gerçekleştirmek değil. Bu nedenle hukukla yönetim söz konusu olduğunda bu ilkeler etkililiğin ilkeleri olarak görülmemelidir. Dahası Sururi Aktaş ın da  vurguladığı  gibi,  eğer  kanun  koyucular  amaçlarını  gerçekleştirmek istiyorlarsa, sekiz ilke bu amaçların etkili bir şekilde gerçekleştirilmesini engelliyor  olabilir.121  Ayrıca,  kanun  koyucu  kendi  amaçlarını gerçekleştirmeye çalıştığında, zaten artık hukukla yönetim değil, idari emirle yönetim  söz  konusudur.122  Örneğin,  kural  koyanların  amacı,  insan davranışını  kuralların  yönetimine  tabi  kılmaktansa,  muhaliflerden kurtulmaksa, bu amacı etkili bir şekilde gerçekleştirebilmek için geçmişe yürür kural çıkarabileceklerdir.  Fuller ı  eleştirenlerin  bir diğer  iddiası  ise  bu ilkelere  uygun  hukuk sistemlerinin, adil sistemler olmak zorunda olmadığı iddiasıdır.123 Fuller bu iddiaya  farklı  eserlerinde  cevap  vermeye  çalışmıştır.  Ancak  Fuller  bu sorunun onun teorisiyle ilgili olmadığı iddia etseydi, Hart ın ve diğerlerinin eleştirilerini bertaraf edebilirdi. Zira hukuki pozitivizmin iddia ettiği gibi hukukun iç ahlâkının sekiz ilkesine riayet eden ve aynı zamanda adaletsiz rejimler  olabilir.  Ancak  Fuller ın  temel  amacı  sekiz  ilkenin  nasıl adaletsizliklerin  önüne  geçebileceğini  açıklamak  değildir.124  Zira  Fuller açıkça  hukukun  iç  ahlâkı  ve  dış  ahlâkı  ayrımı  yapmaktadır.125   Hukuki                                                  119 Fuller, 1969, s.208. 120 Luban, 2008, s.112. 121 Aktaş, 2011, s.44-50 122 Nadler, s.32. 123 Hart, 1997, s.207; Dworkin, 1964-1965, s. 671,673. 124 Rundle, 2012, s.4. 125 Fuller, 1969, s.96. Hukukun dış ahlâkı da Fuller tarafından kullanılan bir terimdir. Fuller bu terimle hukuk kurallarının içeriğine yönelik bir ahlâk kavramı ileri sürmektedir. Diğer bir  ifadeyle   hukukun  dış  ahlâkı    maddi  anlamda  doğal  hukuk   kavramına  denk düşmektedir. Aktaş, 2011, s.10.    27Hukukun İç Ahlâkı                                                      AÜHFD, 64 (1) 2015: 1-35 ahlâkın  pek  çok  etik  meseleye  karşı  nötr  olduğunun  söylenebileceğini defalarca  gözlemledim.   126  cümlesindeki  ifadesi  de  çok  nettir.  Ayrıca Ronald Dworkin ve Marshall Cohen e yazdığı cevapta da düşünceleri çok açıktır:  Ben hiçbir zaman, hukukiliğin bütün taleplerine tamamıyla uyumlu vasıtalarla kötülüğü gerçekleştirmek, en azından bazı tür kötülükler, fikrinde mantıksal bir tutarsızlık olduğunu söylemedim… 127 Fuller, bu sözleriyle paralel bir şekilde hukukun iç ahlâkı, bir sosyal düzenleme modeli olarak hukukun kendine özgü bir ahlâkı olup olmadığı sorusuyla ilgilidir; hukuk kurallarının içeriğinin ahlâki niteliğiyle değil. Bu nedenle pozitivizmin bu eleştirisi ve Joseph Raz ın etkililik iddiaları Fuller ın teorisine zarar verir görünmemektedir.  Sonuç Yukarıda belirtildiği gibi Fuller ın teorisi o dönemde yoğun eleştirilere maruz kalmıştır. Bunun da ötesinde, Fuller ı asıl rahatsız eden hukukun iç ahlâk ının olup olmadığı sorusunun, sekiz ilkenin etkililiğin ilkeleri olup olmadığı  sorusuna  indirgenmesidir.  Fuller  hukukun  iç  ahlâk  ına  ilişkin görüşlerinin etkililik meselesine indirgenmesinin sorumlusu da olarak da Hart ı  görmektedir.129  Fuller ın  teorisi  her  ne  kadar  yaşandığı  dönemde anlaşılmamışsa da bugün bu durumun değiştiği ileri sürülebilir. Yukarıda                                                  126 Fuller, 1969, s.162. 127 Fuller, 1965, s.664. 128 Raz, s.163. 129 Rundle, 2012, s.107. 130  Girişte  de  belirtildiği  gibi  Fuller  hukuk  kurallarının  içeriğinin  ahlâk  i  niteliğiyle ilgilenmemektedir. Ancak Hart ın bu ilkelerin etkili bir kanun koymanın ilkeleri olduğu iddiası, tartışmayı hukuk kurallarının içeriğinin ahlâk i niteliğine çekmiştir. Dolayısıyla Fuller ın teorisi veya tartışmak istedikleri Hart ın eleştirilerinin gölgesinde kalmıştır. Rundle, 2012, s.3-4. Rundle a göre Fuller ın kendisi de Hart ın gündemine saplanmıştır. Fuller A Reply to Critics te, Hart ın gündeminden kaçmayı başarmışsa da, Rundle a göre bu cevap geç kalmış ve yetersiz bir cevaptır. Rundle, 2012, s.5. Hart ve Fuller arasındaki tartışma için bkz: H.L.A Hart  Positivism and the Separation of Law and Morals,  Harvard Law Review, C.71, S.4, 1958, s.593-629; Lon L. Fuller,  Positivism and Fidelity to Law: A Reply to Prof. Hart, Harvard Law Review, C.71, S.4, 1958, s.630-672. Fuller ın 1958 deki eleştirilerine karşılık, Hart 1961 de yazmış olduğu kitabında, Fuller a birkaç cümleyle cevap verir: H.L.A Hart, The Concept of Law, Clarendon Press, Oxford, 1961, s.202. Hart ın The Concept of Law daki iddiasına karşılık, FullerThe Morality of Law ın birinci baskısında The Concept of Law a bir bölüm ayırır: Fuller, The Morality of Law, s.133-145. The Morality of Law ın basılmasının ardından, Hart, The Morality of Law a bir kitap eleştirisi yazar. H.L.A Hart ‘Lon L. Fuller: The Morality of Law, 78 Harvard Law Review,  1965,  1281-1286.Tekrar  basım,  H.L.A.  Hart  Essays  in  Jurisprudence  and 28AÜHFD, 64 (1) 2015: 1-35                                                                                                    Akı görüşleri aktarılan Winston, Luban, Waldron, Rundle gibi isimler hukukun iç  ahlâk  ını  Hart ın  eleştirilerinden  sıyırarak  anlamlandırmışlardır.  Bu çalışmada da hukukun iç ahlâk ı veya Fuller ın ileri sürdüğü hukuk-ahlâk ilişkisi  Hart ın  iddiaları  çerçevesinde  yani  bu  ilkelerin  etkili  bir  kanun koymanın ilkeleri olup olmadığı sorusu çerçevesinde ele alınmamıştır.  Bu doğrultuda da Fuller ın ileri sürdüğü hukukun kendine özgü bir ahlâkı  olduğu  iddiası,  yukarıda  belirtildiği  gibi,  hukuk  kurallarının içeriğinden bağımsız olarak, vatandaşın veya hukuki öznenin özerk bir birey olmasıyla, kanun koyucu ve vatandaş arasındaki karşılıklı ilişkiyle ve sekiz ilkenin vatandaşı korku, tedirginlikten uzak tutmasıyla açıklanabilir. Ancak sekiz ilkenin vatandaşı korku, tedirginlikten uzak tutması iddiasına karşılık, bu tür rejimlerde muhaliflerin kaybolmalarının insan hakkı ihlali olduğu ve Fuller ın  teorisine  gerek  kalmadığı  iddia  edilebilir.131  Ancak,  Colleen Murphy nin de belirttiği gibi, Fuller ın teorisi aracılığıyla yetkililerin hukuk sisteminin  kurumsal  işleyişindeki  etkisine  ve  hukuk  kurumu  aracılığıyla oluşturulan yetkililer ve vatandaşlar arasındaki ilişkiye odaklanılabilir.132 Bu doğrultuda, Fuller ın teorisi, ahlâk dışı olan bazı davranışların, neden aynı zamanda hükümet ve vatandaş arasındaki sağlıklı bir ilişkinin temeli olan güven  ve  karşılıklılığa  zarar  verdiğini  göstermektedir.133  Bu  tür  ihlaller, ahlâki olarak problemlidir; çünkü vatandaşın ve yetkililerin birbirine karşı olan  ahlâki  sorumluluklarının  temelinde  yer  alan  karşılıklılığı  ortadan kaldırır. Murphy e  göre, bu ihlaller bireylerin hak ihlallerinin yanı sıra, kendine özgü ahlâki bir yanlışlıktır da.134 Bu çerçevede Fuller ın görüşleri, yetkililer ve vatandaş arasındaki karşılılıkta var olan yükümlülüklerin ahlâki temelinin görülmesini sağlar.135                                                                                                                    Philosophy, Clarendon Press, 1983, s.343-364. The Morality of Law ın aldığı eleştiriler karşısında, Fuller The Morality of Law ın ikinci baskısına A Reply to Criticis bölümünü ekler. Bu bölümde onu eleştirenlere olan eleştirilerini dile getirir: Fuller, The Morality of Law,  A Reply to Critics , s.187-242. 1958 yılında başlamış olan tartışma böylelikle 1969 yılında son bulur. 131  Dworkin in Fuller a karşı ileri sürdüğü eleştirilerden bir tanesi de budur. Dworkin, 19641965, s.674-675; Dworkin, 1965, s.636. 132 Murphy, s.245. 133 Murphy, s.245. 134 Murphy, s.246. 135 Murphy, s.249.    29Hukukun İç Ahlâkı                                                      AÜHFD, 64 (1) 2015: 1-35 Ancak bu iddialar sekiz ilkenin etik ilkeler olduğunu iddia etmek için yeterli  midir?  Yukarıda  belirtildiği  gibi,  etik  ilkeler  insanın  değerinin bilgisinden  türetilen  ilkelerdir.   İnsanın  değerinin  bilgisine  dayanarak çıkarılan ilkeler, reductio ad absurdum yoluyla temellendirilebilir. Böyle bir ilkenin bize bildirdiği ise şöyle bir şeydir: bir insan şöyle şöyle davranırsa (ya  da  davranmazsa),  insanın  yapısal  olanaklarının  gerçekleşmesini engellememesi olasılığı artar.  Tersini yapmak, gerçekten bu olanakların gerçekleşmesini  engelliyorsa  -bu  gösterilebiliyorsa-,  ilkenin  gerekliliği temellendirilmiş  olur. 136  O  halde  kanun  koyucular  sekiz  ilkeye  uygun davranıyorsa,  insanın  yapısal  olanaklarının  gerçekleşmesinin engellenmemesi olasılığı artmakta mıdır? Sekiz ilkeye riayet eden hukuk sistemlerinde  insanının  yapısal  olanaklarının  engellenmeme  olasılığının arttığı  ileri  sürülebilir.  Ancak  bunun  kavramsal  olarak  böyle  olması gerekmemektedir.  Daha  açık  bir  ifadeyle  kavramsal  olarak  sekiz  ilkeye riayet  eden  ve  insanın  yapısal  olanaklarını  engelleyen  hukuki  sistemler olabilir.  Dolayısıyla  yapısal  olanakları  engellememe  hususu,  hukuk kurallarının içeriğine yönelik ilkelerle ilgilidir, işkence yasağı yapmamak gerekir veya ırk ayrımı yapmamak gerekir gibi. Fuller ın ileri sürdüğü sekiz ilke ise kanun yapma sürecine ilişkin ilkelerdir. Ancak sekiz ilkenin insanın yapısal olanaklarının gelişimine hiçbir şekilde etki etmediğini iddia etmek doğru  değildir.  Zira  yukarıda  da  belirtildiği  gibi,  sekiz  ilke  aracılığıyla vatandaşlar hukuk sisteminin bir parçası haline gelmektedir. Daha da ötesi sekiz ilke aracılığıyla belirsizlikten ve kaostan uzak bir düzen kurulmaya çalışılmaktadır. Böyle bir hukuki düzen öngörülebilir bir düzendendir ve kanun  koyucuların  keyfi  davranışlarının  önüne  geçmektedir.  Dahası öngörülebilir bir ortam adaletsiz kanunların eleştirilmesi ve değiştirilmesi için  de  bir  zemin  hazırlamaktadır.137  Bütün  bu  iddiaların  yanında,  adil, haklara saygılı, geliri eşit bir biçimde dağıtmayı hedefleyen rejimlerin de, hedefledikleri bu  iyi  amaçları sekiz ilkeye uygun bir şekilde inşa edilmiş hukuk sistemleri aracılığıyla gerçekleştirebilecekleri unutulmamalıdır.138 Netice  olarak,  etik  ilkeler  insanın  yapısal  olanaklarını gerçekleştirmesiyle ilgili ilkeler ise, Fuller ın ileri sürdüğü ilkeler etik ilkeler olarak  kabul  edilebilecek  midir?  Sekiz  ilke  kişinin  özerkliğine  saygı                                                  136 Kuçuradi, 2009, s.179. 137 Bu konuda bkz. Decent, s.573. 138 Waldron, 1994, s.266. 30AÜHFD, 64 (1) 2015: 1-35                                                                                                    Akı göstererek, öngörülebilir bir çerçeve sağlayarak, vatandaşı korku ve kaostan uzak  tutarak,  aslında  insanın  yapısal  olanaklarını  geliştirmesine  dolaylı yoldan hizmet ettiği için etik ilkelerle ilişkili ilkeler olarak kabul edilebilir. Ayrıca sekiz ilkenin, insanın yapısal olanaklarının gelişimine hizmet eden bir hukuk sistemi oluşturmak için etik ilkeler yanında gerekli ilkeler olduğu da unutulmamalıdır.                        31Hukukun İç Ahlâkı                                                      AÜHFD, 64 (1) 2015: 1-35 KAYNAKÇA Aktaş, Sururi.(2004). Modern Doğal Hukuk Bağlamında John Finnish in Hukuk Teorisi. Atatürk Üniversitesi Erzincan Hukuk Fakültesi Dergisi, 8(1-2), 3-22. Aktaş, Sururi. (2011).  Prosedürel Doğal Hukuk Lon L. Fuller in Hukuk Kavramı. İstanbul: XII Levha Yayınları. Bix, Brian H. (2004a). Doğal Hukuk: Modern Gelenek. çev. Ertuğrul Uzun, Dokuz Eylül Üniversitesi Hukuk Fakültesi, 6(2), 291-343. Bix,  Brian.  (2004b).  Jurisprudence  Theory  and  Context.  Durham  Nort Carolina: Carolina Academic Press. Ceylan, Şule Şahin. (2014). H.L.A Hart ın Hukuk Kavramı. İstanbul: XII Levha Yayıncılık.  Decent, Evan Fox. (2008). Is The Rule of Law Really Indiffernt to Human Rights?. Law and Philosophy, 27(6), 533-581. Dworkin,  Ronald.  (1964-1965).  Philosophy,  Morality,  And  LawObservations Prompted by Professor Fuller s Novel Claim. University of Pennsylvania Law Review, 113, 668-690. Dworkin, Ronald. (1965). The Elusive  Morality of Law.  Villanova  Law Review, 10, 631-639. Fuller, Lon L. (1958). Positivism and Fidelity to Law - A Reply to Professor Hart. Harvard Law Review, 71(4), 630-672. Fuller, Lon L. (1965). A Reply to Professors Cohen and Dworkin. Villanova Law Review, 10(4), 655-666. Fuller, Lon L. (1969). The Morality of Law. New Haven: Yale University Press. Fuller, Lon L. (2001a). Human Interaction and the Law. Principles of Social Order  Selected  Essays  of  Lon.  L.  Fuller.  Ed.  Kenneth  I  Winston, Oxford-Portland Oregon: Hart Publishing, 231- 266. Fuller, Lon L. (2001b). Means and Ends. Principles of Social Order Selected Essays  of  Lon.  L.  Fuller.  Ed.  Kenneth  I Winston,  Oxford-Portland Oregon: Hart Publishing, 61-78. 32AÜHFD, 64 (1) 2015: 1-35                                                                                                    Akı Hart, H.L.A. (1958). Positivism and the Separation of Law and Morals. Harvard Law Review, 71(4), 593-629. Hart,  H.L.A.  (1983).  Lon  L.  Fuller:  The  Morality  of  Law.  Essays  in Jurisprudence and Philosophy. Clarendon Press, 343-364. Hart, H.L.A. (1997). The Concept of Law. Oxford University Press. Hart, H.L.A. (2011). Hukuk, Özgürlük ve Ahlâk. Ankara: Dost Kitabevi. Himma, Kennneth Einar. (2010). Hukukun Ahlâki Kriterleri Kapsayıcı ve Dışlayıcı  Pozitivistler Arasındaki Tartışma.  çev.  Saim  Üye, Ankara: Bilge Su Yayınları. Keyman,  Selahaddin.  (1978).  Hukuki  Pozitivizm.  Ankara  Üniversitesi Hukuk Fakültesi Dergisi, 35(1-5), 17-55. Keyman, Selahaddin. (1998). Tabii Hukuk Doktrinin Epistemolojik Tahlili. Ankara Üniversitesi Hukuk Fakültesi Dergisi, 47(1-4), 17-36. Kramer, Matthew. (1999). Scrupulousness without Scruples: a Critique of Lon Fuller and his Defenders. In Defense of Legal Positivism. Oxford University Press, 37-77. Kuçuradi,  Ioanna.  (1988).  Ahlâk  ve  Kavramları.  Uludağ  Konuşmaları. Ankara: Türkiye Felsefe Kurumu Yayını, 20-36. Kuçuradi,  Ioanna.  (1998).  İnsan  ve  Değerleri. Ankara:  Türkiye  Felsefe Kurumu Yayını. Kuçuradi, Ioanna. (2006). Etik. Ankara: Türkiye Felsefe Kurumu Yayınları. Kuçuradi, Ioanna. (2007). İnsan Onuru Kavramı ve İnsan Hakları, İnsan Hakları  Kavramları  ve  Sorunları. Ankara: Türkiye  Felsefe  Kurumu Yayını, 69-76. Kuçuradi, Ioanna. (2009). Normların Bilimsel Temellendirilebilirliği. Çağın Olayları Arasında. Ankara: Türkiye Felsefe Kurumu Yayınları, 175182. Luban,  David.(2008).  Legal  Ethics  and  Human  Dignity.  Cambridge University Press.   33Hukukun İç Ahlâkı                                                      AÜHFD, 64 (1) 2015: 1-35 Luban, David. (2010).The Rule of Law and Human Dignity: Re-examining Fuller s Canons. Hague Journal on the Rule of Law, (2), 29-47. Murphy, Colleen. (2005). Lon Fuller and The Moral Value of Rule of Law. Law and Philosophy, 24(3), 239-262. Murphy, Jeffrie G., Coleman, Jules. (1990). Philosophy of Law. Oxford: Westview Press. Nadler, Jeniffer. (2008). Hart, Fuller and the Connection Between Law and Justice. Law and Philosophy, 27(1), 1-34. Raz, Joseph. (2008). Hukuk Devleti ve Erdemi. çev. Bilal Canatan, Hukuk Devleti, Hukuki Bir İlke Siyasi Bir İdeal. Editörler: Ali Rıza Çoban, Bilal Canatan, Adnan Küçük, Ankara: Adres Yayınları, 149-166. Rundle, Kristen. (2012). Forms Liberate. Oxford: Hart Publishing.  Rundle, Kristen. (2013). Form and Agency in Raz s Legal Positivism. Law and Philosophy, 32(6), 767-791. Summers, Robert S. (1965). Professor Fuller on Morality and Law. Journal of Legal Education, 18(1), 1-27. Summers, Robert S. (1984). Lon L. Fuller. Edward Arnold. Surlu, Aydan Ömür.(2008). H.L.A Hart ta Tanıma Kuralı. Yayımlanmamış Doktora Tezi. Tepe, Harun. (1998). Bir Felsefe Dalı Olarak Etik: ‘Etik  Kavramı, Tarihçesi ve Günümüzde Etik. Doğu Batı, S.4, Ağustos, Eylül, Ekim, 11-28. Tepe, Harun. (2011). Etik ve Metaetik. Ankara: Türkiye Felsefe Kurumu. Uslu,  Cennet.  (2009).  Doğal  Hukuk  ve  Doğal  Haklar. Ankara:  Liberte Yayınları. Uygur, Gülriz. (2003). Hukuki Pozitivizmin Değişen Yüzü Mü?. Ankara Üniversitesi Hukuk Fakültesi Dergisi, 52(3), 145-176. Uygur, Gülriz. (2006). Hukuk, Etik ve İlkeler. Ankara: Siyasal Kitabevi. Uygur, Gülriz. (2014). Ioanna Kuçuradi nin Görüşlerinden Hareketle Hukuk Normlarının Türetilmesindeki Temel Problem: Etik Mi? Ahlâk Mı?. Ioanna  Kuçuradi  Çağın  Olayları  Arasında.  Ioanna  Kuçuradi ye 34AÜHFD, 64 (1) 2015: 1-35                                                                                                    Akı Armağan. Editörler: Betül Çotuksöken, Gülriz Uygur, Hülya Şimga, İstanbul: Tarihçi Kitabevi, 163-172. Uzun,  Ertuğrul.  (2005).  Ahlâksızlığın  Cezalandırılması:  Devlin-Hart Tartışması. Eskişehir Barosu Dergisi, S.6, 52-71. Van der Burg, Wibren. (2014a).  The Dynamics of Law and Morality A Pluralist Account of Legal Interactionism. Ashgate. Van der Burg, Wibren. (2014b) Lon L. Fuller dan Yasa Koyuculara Dersler. çev. E. İrem Akı, Hukuk Kuramı, 1(3), 58-64. Wacks, Raywond. (2013). Hukuk Felsefesine Kısa Bir Giriş. çev. Engin Arıkan, İstanbul: Tekin Yayınevi. Waldron, Jeremy. (1994). Why Law- Efficacy, Freedom, or Fidelity. Law and Philosophy, Special Issue on Lon L. Fuller,13(3), 259-284. Waldron, Jeremy. (2008). The Concept and The Rule of Law. Georgia Law Review, 1(43), 1-61. Waldron, Jeremy. (2012). How Law Protects Dignity. The Cambridge Law Journal, 71(1), 220-222. Winston,  Kenneth  I.  (2001).  Introduction.  Principles  of  Social  Order Selected Essays of Lon. L. Fuller. Editör: Kenneth I Winston, OxfordPortland Oregon: Hart Publishing, 25-58. Yücel,  Mustafa  Tören.  (2005).  Hukuk  Felsefesi. Ankara:  Başkent  Klişe Matbaası.           35Hukukun İç Ahlâkı                                                      AÜHFD, 64 (1) 2015: 1-35                  36",
     "Abstract": "The  relationship  between  law  and  morality  is  one  of  the  most controversial topics between legal positivists and natural lawyers. However Lon  Luvois  Fuller  makes  an  unfamiliar  connection  between  law  and morality that is different from both legal positivism and natural law theory. And this because Fuller argues that, without reference to the moral quality of the content of rules, law has its own internal morality. Fuller offers eight principles and argues that these principles constitute the inner morality of law. These eight principles are the principles that legislators must obey when creating rules. Rules should be general, published, non-retroactive, clear, non-contradictory, must not require the impossible, be constant through time, and there must be congruence between official action and declared rules. Therefore, the eight principles are not devoted to the content of rules, like, for example, the principle of equality. This article looks at the question whether law has its own morality unrelated to the content of rules. In other words, the main question of this work is whether a connection can be made between law and morality while being inside law, or else, without exiting law.",
     "Metin": "Fuller hukuk ve ahlâk arasında zorunlu bir ilişki olduğunu iddia eden, 1902 ve 1978 yılları arasında yaşamış Amerikalı bir hukuk felsefecisidir.1 Bununla birlikte Fuller ın hukuk ve ahlâk arasında kurduğu ilişki, hukuk felsefesinin  geleneksel  bir  şekilde  tartıştığı  hukuk  ve  ahlâk  ilişkisinden farklıdır.  Hatta,  Fuller ın  hukuk  ve  ahlâk  arasında  kurduğu  bağlantının                                                  1  Summers, 1984, s.3, 13. 2AÜHFD, 64 (1) 2015: 1-35                                                                                                    Akı bugün bile alışılmışın dışında olduğu iddia edilebilir. Zira hukuk felsefesi geleneğinde,  hukuk  ve  ahlâk  arasındaki  bağlantı  hukuk  kurallarının içeriğinin ahlâki niteliğine göre tartışılmaktadır. Hukuk felsefesi geleneği derken hukuk teorisinde mevcut iki yaklaşım, yani  hukuki  pozitivizm  ve  doğal  hukuk  akımı  arasındaki  tartışma  kast edilmektedir.2  Hukuki  pozitivizm  akımının  kuramcıları  arasında  John Austin, Jeremy Bentham, Hans Kelsen ve H.L.A Hart sayılabilir. Hukuki pozitivizmin  temel  özelliği,  hukukun  toplumdaki  insanların  kararıyla çıkarılmış olduğunu ileri sürmesidir.3 Hukuk kurallarının insanların kararıyla çıkarılmış olmasının anlamı, hukukun sosyal olarak yaratılmış ve üretilmiş bir  kavram  oluşudur.4  Pozitivizmin  bu  özelliği,  hukuku  koyan  kaynağa bakarak açıklamasıyla ilgilidir. Bu teze sosyal kaynaklar tezi adı verilir.5 Hukuki pozitivizmin bir diğer önemli tezi konvansiyonellik tezidir. Bu teze göre, hukukun varlığı,  bir normun toplumun hukukunun parçası olabilmesi için gereken şartları   düzenleyen  tanıma  kuralının,6  hukuk sistemindeki yetkililer  tarafından  kabul  edilmesi,  yani  bir  konvansiyonla  kurulmasına bağlıdır.7  Hukuki  pozitivizmin  kabul  ettiği  bir  diğer  tez  ise ayırma/ayrılabilirlik tezidir. Ayırma tezi hukuk ve ahlâk arasında bir ilişki kurulamayacağını  belirtirken,  ayrılabilirlik  tezi, hukuk  ve  ahlâk  arasında zorunlu hiçbir ilişki kurulmayacağını ileri sürmektedir.8 Diğer bir ifadeyle bu tez, hukukun ve ahlâkın kavramsal olarak ayrı şeyler olduklarını iddia etmektedir.9  Hukuk  ve  ahlâkın  ayrı  kavramlar  olmasının  anlamı,  neyin hukuk olduğunu neyin hukuk olmadığını belirleyen tanıma kuralında veya hukuki geçerlilik kriterinde ahlâka yer verilmemesidir. Diğer bir ifadeyle, bir hukuk normunun geçerliliği onun ahlâka uygun olmasına bağlı değildir.10                                                  2  Burada sadece geleneksel hukuk felsefesindeki tartışmaya yer verilmiştir zira Eleştirel Hukuk Çalışmaları, Feminist Hukuk Teorisi gibi  yaklaşımlar  hukuk sistemine ilişkin yapısal eleştirilerde bulunmaktadır.  3  Uygur, 2003, s. 146. Hukuki pozitivizm akımı için ayrıca bkz. Keyman, 1978, s.17-55. 4  Himma, s.16. 5  Uygur, 2003, s.146. 6  Uygur, 2003, s.148. Tanıma kuralı için bkz. Surlu, 2008. 7  Ceylan, s.217-218; Himma, s.21. Zayıf ve güçlü konvansiyonelik tezleri için bkz. Ceylan, s.217-218; Himma, s.20-28. 8  Uygur, 2003, s.152. Dolayısıyla bugün hukuki pozitivizmin bazı temel özellikleri açısından türlere ayrıldığının, kapsayıcı ve dışlayıcı pozitivizm gibi, farkında olmak gerekmektedir. Bkz. Uygur, 2003,s.152; Himma, s.13. 9  Himma, s.28. 10  Ceylan, s.219.   3Hukukun İç Ahlâkı                                                      AÜHFD, 64 (1) 2015: 1-35 Doğal hukuk akımı ise hukuki pozitivizmin karşıtı olarak, hukuk ve ahlâk arasında hukuki geçerlilik kriteri bakımından kavramsal, mantıksal ve zorunlu olarak temel bir bağlantı olduğunu iddia etmektedir.11 Hukuk ve ahlâk arasında zorunlu bir bağlantı olmasının sonucu  adil olmayan hukuk, hukuk değildir  anlayışının ortaya çıkmasıdır.12 Dolayısıyla doğal hukuk açısından  hukuk  kurallarının  içeriğinin  ahlâka  uygun  olması  gerektiği belirtilebilir.13 Fuller ise hukuk kavramının kendisine içkin veya hukuk kavramının kendisine özel bir ahlâk kavramının arayışındadır. Diğer bir ifadeyle Fuller, hukuk  kurallarının  ahlâki  içeriğiyle  ilgilenmemektedir.  Bununla  birlikte Fuller, hukuk felsefesinin bu konuyla ilgilenmemesi gerektiğini düşünüyor da  değildir.  Fuller,  hukukun  içeriğiyle  ilgilenen  doğal  hukuk  akımının, hukuk  teorisinde  bırakmış  olduğu  boşluğu  doldurmak  istemektedir. Dolayısıyla bu çalışmanın hedefindeki soru yanıtlanırken Fuller ın hukuki düzenlemelerin  içeriğinin  ahlâki  niteliğinden  bahsetmediğinin  farkında olmak  gerekmektedir.  Daha  açık  bir  ifadeyle  Fuller  hukukun  iç  ahlâkı olduğunu  ileri  sürerken  hukuki  düzenlemelerin  örneğin  anayasaların, kanunların  temel  hak  ve  özgürlükleri  koruması  gerekliliğinden  veya  ne dereceye kadar koruyor olduğundan bahsediyor değildir.  Ayrıca Fuller ın teorisi açısından göz önünde bulundurulması gereken bir nokta daha söz konusudur: Fuller a göre hukuk teorisi  belirli hukuk kurallarına  değil,  hukuk sistemlerine  odaklanmalıdır. Burada önemli olan nokta, Fuller ın, doğal hukuku eleştirenlerin  belirli kurallar ahlâki olmasa bile hukuktur  şeklindeki düşüncelerini haklı bulmasıdır. Diğer bir ifadeyle doğal hukukçuların  adil olmayan kanun, kanun değildir  iddiasına karşılık, Fuller ın  teorisi  belirli  bir  hukuk  kuralına  değil,   hukuk  sisteminin  kendisine odaklanmaktadır.14 Netice olarak Fuller ın, hukuk ve ahlâk arasında alışılmışın dışında bir bağlantı kurarken, bunu hukuki pozitivizm/doğal hukuk karşıtlığı üzerinden                                                  11  Murphy, Coleman, s.11. Ayrıca bkz. Yücel, s.76; Keyman, 1998, s.32-33. 12  Wacks, s.3. Bununla birlikte  adil olmayan hukuk, hukuk değildir  sözünü, Aquanis ın hiçbir zaman bu şekilde ifade etmediğine yönelik bir iddia da mevcuttur. Wacks, s.4; Bix, 2004(a), s.68. Ayrıca bugün doğal hukuk akımının geleneksel ve modern olmak üzere ikiye ayrıldığını belirtmek gerekmektedir. Bkz. Bix, 2004(b), s.291-343. 13  Uslu, s.227; Aktaş, 2004, s.5. 14  Murphy, Coleman, s.38. 4AÜHFD, 64 (1) 2015: 1-35                                                                                                    Akı yapmamış olduğuna dikkat çekmek gerekmektedir. Daha açık bir ifadeyle, Fuller bu bağlantıyı kurarken, hem hukuki pozitivizme hem de doğal hukuk akımına yönelik eleştirilerini dile getirmiştir.15 Fuller bu alışılmışın dışında olan hukuk-ahlâk ilişkisini ise sekiz ilke aracılığıyla  kurmaktadır.  Diğer  bir  ifadeyle  Fuller  kanun  koymanın  iç ahlâkı olarak adlandırdığı sekiz ilke getirmektedir. Bu ilkeler:  1.Kurallar genel olmalıdır 2.Kurallar yayımlanmış olmalıdır 3.Kurallar geçmişe yürür olmamalıdır 4.Kurallar açık olmalıdır 5.Kurallar çelişmemelidir 6.Kurallar imkansızı talep etmemelidir 7.Kurallar zaman içinde tutarlı olmalıdır (sabitlik) 8. Yetkililerin eylemi ve yayımlanmış kurallar arasında uyum olmalıdır Fuller a  göre  kanun  koyucunun  bir  hukuk  sistemi  oluşturmak  için yerine getirmesi gereken bu sekiz ilke hukukun iç ahlâkını oluşturmaktadır. Bu  noktada  da  tartışılması  gereken  soru,  hukuk  kurallarının  içeriğinden bağımsız olarak hukukun bir iç ahlâka sahip olup olmadığıdır. Diğer bir ifadeyle,  bu  çalışmanın  hedefindeki  soru,  hukuk  kavramının  kendisinin içinde  kalarak,  hukuk  kavramının  dışına  çıkmayarak  bir  hukuk-ahlâk ilişkisinin kurulup kurulamayacağıdır.  I.  Ahlâk Kavramı ve Anlamları Bu  soru  yanıtlanırken  ilk  olarak   ahlâk ın  hangi  anlamından bahsedildiğinin ortaya konulması gerekmektedir. Çünkü ahlâk kavramıyla pek çok bağlamda karşılaşılmasına ve ahlâk kavramının açık bir kavram                                                  15  Rundle, 2012, s.2-3. 16  Bu aşamada terimlerle ilgili bir noktayı açıklamak gerekmektedir. Fuller, The Morality of Law da, kanun koymanın iç ahlâkından değil, hukukun iç ahlâkından bahsetmektedir. Kenneth I. Winston a göre hukukun iç ahlâkındaki  hukuk  kelimesi bir sosyal düzenleme modeli olarak kanun koyma (legislation) faaliyetini belirtmektedir; yoksa bir bütün olarak hukuk  kavramını  değil.  Winston,  s.44,  dipnot  33.  Zira  Fuller a  göre  hukuk,  kanun koymanın da dahil olduğu çeşitli sosyal düzenleme modellerini içermektedir. Kanun koyma bunlardan  sadece  bir  tanesidir.  Sosyal  düzenleme  modelleri  için  aşağıda  bkz.  s.15, dipnot.80.    5Hukukun İç Ahlâkı                                                      AÜHFD, 64 (1) 2015: 1-35 olduğu düşünülmesine rağmen, ahlâk kavramı açık bir kavram değildir.17  Sözcüğün  anlamında,  kullanıldığı  bağlamlara  göre  kimi  farklılıkların olduğu; buna karşılık kimi özelliklerinin hep aynı kaldığı görülmektedir. 18 Dahası  Fuller  da  ahlâkın  hangi  anlamını  kullandığını  açıkça  ortaya koymamaktadır.19 Bununla  paralel  olarak,  hukuk  felsefesi  literatüründe  de,  iki  farklı ahlâkilik olduğu belirtilmelidir.20 Bu iki ahlâkilik arasındaki ayrımı Hart, literatürde Devlin-Hart tartışması olarak bilinen tartışma çerçevesinde ortaya koymuştur. İki tür ahlâkilikten ilki, pozitif ahlâktır, yani  belli bir toplumsal grup  tarafından  fiilen  benimsenen  ve  paylaşılan  ahlâk tır.21  İki  tür ahlâkilikten ikincisi eleştirel ahlâktır. Eleştirel ahlâk,  pozitif ahlâk da dahil olmak üzere mevcut toplumsal kurumları eleştirmekte kullanılan genel ahlâk ilkeleridir. 22 Bu  ayrım  yanında,  Ioanna  Kuçuradi nin  yaptığı  ahlâkın  farklı anlamlarına bakılabilir. Buna göre ahlâkın ilk anlamı toplumdaki  değer yargıları   dır.23  Değer  yargıları,   yüklemleri  iyi  –  kötü,  güzel  –  çirkin, faydalı – zararlı, doğru – yanlış, günah – sevap ve bu gibi sıfatlar olan,  normlardır.24  Örneğin,   büyüklerin  önünde  sigara  içmek  kötüdür ,   içki içmek  kötüdür ,   büyüklerin elini  öpmek  iyidir   gibi.   Bu  bağlamlarda ahlâktan söz edilirken dile getirilmek istenen, hep, insanlararası ilişkilerde kişilerin  uymaları  beklenen  - talep  edilen  -  davranışlardır.  Yapılması  – yapılmaması gereken (izin verilen – verilmeyen; teşvik edilen – yasaklanan) davranışlardır; başka bir deyişle belirli bir grupta ya da genel olarak iyi sayılan  –  kötü  sayılan  davranışlardır. 25  Bu  türden  değer  yargılarının özelliği, toplumdan topluma veya zaman içinde değişiklik göstermesidir. Zira  Türkiye de  içki  içmek  kötü  bir  davranış  olarak  kabul  edilirken, Almanya da  bu  değer  yargısı  geçerli  değildir.  Diğer  yandan,  değer                                                  17  Tepe, 2011, s.14. 18  Tepe, 2011, s.14; Tepe, 1998, s.12. 19  Summers,1965, s.3. 20  Uygur, 2014, s.163-164. 21  Hart, 2011, s.28. Devlin-Hart tartışması için bkz. Uzun, s.152-71.  22  Hart, 2011, s.28. Pozitif ahlâkın çeşitli anlamları için bkz. Uygur, 2014, s.164; Uygur, 2006, s.3. 23  Ahlâkın bu anlamı Hart ın ileri sürdüğü pozitif ahlâk tanımına denk düşmektedir. 24  Kuçuradi, 1998, s.29. 25  Kuçuradi, 1988, s.21. 6AÜHFD, 64 (1) 2015: 1-35                                                                                                    Akı yargılarının tek türü zamana ve yere göre değişiklik gösteren değer yargıları değildir.  Örneğin   yalan  söylemek  kötüdür ,   işkence  kötüdür ,   eşitsiz muamele kötüdür  gibi değer yargıları da vardır. Bunların birinci türden değer yargılarından farkı, her zaman-her yerde iyi veya kötü sayılmalarıdır.26 Dolayısıyla   …  ahlâk  denen  olgu,  yaşamda  çeşitli  ahlâklar  olarak karşımıza çıkıyor; ama bu çeşitli ahlâklar, bir kısmı değişik ve değişken olan davranış  kuralları  ve  değer  yargıları,  bir  kısmı  ise  pek  değişiklik göstermeyen davranış kuralları ve değer yargılarından oluşuyor. 27 Netice itibariyle her iki türden değer yargılarına da uyulmaları bekleniyor ve bu değer yargılarına göre kişi eylemleri değerlendiriliyor.28 Kuçuradi değer yargılarının yanında, kişilerin eylemlerini belirlemeleri beklenen  kurallar  ve  ilkelerin  de  ahlâk  terimiyle  ifade  edilebileceğini belirtmektedir. Örneğin,  ırk ayrımı yapmamak gerekir ,  sözünde durmak gerekir ,   büyüklerin ellerini öpmek gerekir  gibi.29 Eylemleri belirlemeleri beklenen kurallar ve ilkeler aslında değer yargılarının, eylemi belirlemesi beklenen kural veya ilkeye dönüşmüş halidir. Örneğin,  içki içmek kötüdür  değer yargısı,  içki içmemek gerekir  normuna dönüşmektedir. Ancak  içki içmek kötüdür  değerlendirme normuyken,  içki içmemek gerekir  davranış normudur.30 Fuller ın  ileri  sürdüğü  ilkeler  de  ( kurallar  genel  olmalıdır   veya  kuralları genel yapmak gerekir ,  kuralları anlaşılabilir yapmak gerekir ,  kuralları geçmişe yürür yapmamak gerekir  vb.) kanun koyucuların hukuk kuralları  oluştururken  nasıl  davranmaları  gerektiğini  bildiren  normlardır. Daha kısa bir ifadeyle Fuller ın ileri sürdüğü ilkeler, kanun koyucuların eylemelerine  ilişkin  gereklilik  dile  getiren  normlar;  yani  davranış normlarıdır.31 Bu gereklilik bildiren kurallar veya ilkeler (hem Fuller ın ileri                                                  26  Kuçuradi, 1988, s.22. 27  Kuçuradi, 1988, s.22. 28  Kuçuradi, 1988, s.22. 29  Kuçuradi, 1988, s.27.  30  Bu ayrımı kavramamı sağladığı için Prof. Dr. Abdullah Kaygı ya çok teşekkür ederim. 31   Normlar, değerlendirmeye yarayan -bir eylemi, bir sanat yapıtını, bir düşünceyi, bir kavramı  vb.  değerlendirmeye  yarayan-  ve  genel  ya  da  geçer  olma  iddiasında  olan önermelerdir.  Kuçuradi, 2009, s.175-176. Kuçuradi norm kavramının altına  a) bütün değer  yarılarının,  b)  her  türlü  buyruğu  ve  c)  bütün  patrik  kuralları-ilkeleri  koyabileceğimizi belirtmektedir. Kuçuradi, 2009, s.176.   7Hukukun İç Ahlâkı                                                      AÜHFD, 64 (1) 2015: 1-35 sürdükleri hem de verilen diğer örnekler) kişilerin eylemlerini belirlemeleri beklenen normlardır.32 Bununla  birlikte,   ırk  ayrımı  yapmamak  gerekir   veya   büyüklerin ellerini öpmek gerekir  ya da  kuralları genel yapmak gerekir  normlarının, farklı türden normlar olduğu görülebilir. Bu normların farklı türden normlar olması,  türetildiklerin  kaynakların  farklılığından  ileri  gelmektedir.  Bir normun türetildiği kaynağı tespit etmek ise normların temellendirilmesiyle ilgilidir.  Bir  normun  temellendirilmesi,  normun   devşirildiği,  çıkarıldığı yerin gösterilebilmesi demektir; ona h e r h a n g i bir temelin bulunabilmesi değil. 33 Dolayısıyla, normun dile getirdiği gerekliliğe  neden… yapmak gerekir?  sorusu sorulduğunda ve bu soru bir bilgiyle yanıtlandığı zaman, söz konusu olan norm temellendirilebilir bir normdur.34  Normların dile getirdikleri gereklerin ise Kuçuradi ye göre  iki farklı kaynaktan -biri deney, diğeri de insanın değerinin bilgisi olmak üzere iki ayrı  kaynaktan-  ve  farklı  yollardan  -farklı  çeşitten  akıl  yürütmelerle  induksyon ve reductio ad absudum ile- türetildiği görülüyor. 35  Kaynağı  deney  olan  kuralların  bir  kısmı  farklı  çevrelerdeki  doğaltoplumsal  koşullardan  ve  farklı  kültürlerden  kaynaklanan  düzen  kurucu davranış kurallarıdır. Bu kurallar değer koruyucu olduğu gibi değer harcayıcı da olabilmektedir.36 Kaynağı deney olan bazı normlar da indüksiyon yoluyla türetilmektedir. Bu tür normlar tek tek davranışlardan yapılan ve yarar-zarar gözetilerek  yapılan  çıkarımlardır.  Örneğin   savurgan  olmamak  gerekir, kırmızı ışıkta geçmemek gerekir  gibi.37  Kaynağı insanın değerinin bilgisi olan normlara ise ilke denilmektedir. Kuçuradi ye göre, insanın değerinin bilgisinden türetilen  ilke ler Türkçe de ahlâk kavramına yüklenen ikinci anlama denk gelmektedir. Bu doğrultuda,                                                  32  Kuçuradi, 1988, s.27. Ancak Fuller ın dile getirdiği ilkelerin bir diğer özelliği normların yapımı hakkında normlar olmalarıdır. Diğer bir ifadeyle meta normlar olarak da ifade edilebilir. Hart ın terimleriyle ifade edilecek olursa, kurallar hakkındaki kurallardır. Ancak Hart ın görüşlerinden farklı olarak, Fuller ın ileri sürdüğü ilkeler bir geçerlilik kriteri oluşturmamaktadır. 33  Kuçuradi, 2009, s.178. 34 Kuçuradi, 1988, s.27; Kuçuradi, 2009, s.179. 35 Kuçuradi, 1988, s.27. 36 Kuçuradi, 1988, s.27-28. 37 Kuçuradi, 1988, s.28. 8AÜHFD, 64 (1) 2015: 1-35                                                                                                    Akı Kuçuradi ye göre, bu tür ilkelere  ahlâk ilkeleri  demek yerine, ahlâklılık ilkeleri veya etik ilkeler demek daha uygun görünmektedir.38  Kuçuradi ye göre etik ilkelerin  bir kısmı, insanın değerinin bilgisinden doğrudan  doğruya  yapılan  çıkarımlardır:  ‘insanlara,  insan  olarak,  eşit muamele  yapmak  gerekir , ‘sözünde  durmak  gerekir  gibi; bir  kısmı da dolaylı olarak –bu değeri harcıyan tarihsel koşullar aracılığıyla: örneğin ‘ırk ayrımı yapmamak gerek , ‘işkence yapmamak gerek  gibi. Kuçuradi ye göre, bu tür çıkarımlar şu şekilde yapılır: insanın değeri buysa (: insanın, tür olarak yapısal olanakları bunlarsa); demek ki, hiçbir insan (: insan türüne ait  hiçbir  varlık)  bu  değere  zarar  verecek  (:  bu  olanakların gerçekleşebilmesini engelleyecek) bir şey yapmamalı: söz gelişi insanları kandırmamalı, insanlara işkence yapmamalı. 39 Yukarıda yapılan açıklamalar ışığında sekiz ilkenin türetilme kaynağını ortaya koymak, sekiz ilkenin niteliğini belirlemek bakımından önemlidir. Zira  bu  ilkelerin  türetildiği  kaynağa  göre,  bu  ilkelerin  etik  ilkeler  olup olmadıkları ortaya konulabilir. Bu doğrultuda bu makalenin temel sorusu olan  Fuller ın  görüşleri  çerçevesinde  hukukun  iç  ahlâkından  söz  edilip edilemeyeceği sorusu, onun getirdiği ilkelerin etik  ilkeler olup olmadığı sorusunun cevabına bağlıdır. Yukarıda da belirtildiği gibi bir ilkenin etik ilke olup  olmadığı  ise,  ilkenin  insan  değerinin  bilgisinden  türetilip türetilmediğine bağlıdır. Daha açık bir ifadeyle eğer sekiz ilkenin insanın değerin bilgisinden türetildiği gösterilebilirse, bu ilkelerin etik ilkeler olduğu ve dolayısıyla hukukun kendine özgü bir ahlâkı olduğu iddia edilebilecektir. Eğer  bu  gösterilemezse  bu  ilkelerin  yalnızca  kanun  koyucuya  yönelik form/şekil ilkeleri olduğu ileri sürülebilecektir.  Ancak  bu  noktanın  açıklanabilmesi  için  ,   değerler   ve  tür  olarak  insanın değeri ne, bu çalışmanın konusunu aşmakla beraber, sekiz ilkenin niteliğini belirlemeyle ilgisinde yer verilmelidir. İnsanın değerinin anlamını ortaya  koyabilmek  için  öncelikle   değerler e  bakmak  gerekmektedir. Kuçuradi ye göre değerler taşıyıcılarına göre üçe ayrılır; insanın değerleri, etik değerler ve toplumsal değerler olmak üzere.                                                  38  Kuçuradi, 1988, s.30. Çalışmanın geri kalanında bu tür ilkeler kast edildiği zaman  etik ilkeler  terimi kullanılacaktır. 39 Kuçuradi, 1988, s.29.   9Hukukun İç Ahlâkı                                                      AÜHFD, 64 (1) 2015: 1-35   İnsanın  değerleri  amaçlarına  uygun  şekilde  gerçekleştirilen  insan etkinlikleridir ;40 bilim, felsefe, sanat, hukuk gibi. Bu etkinlikler kişilerce gerçekleştirilirler ve insanda olanak olarak vardırlar. Etik değerler ise ikiye ayrılır, etik kişi değerleri ve etik ilişki değerleri olmak üzere. Toplumsal değerler  ise  laiklik  idesi,  eşitlik  idesi,  adalet  idesi,  özgürlük  idesi  gibi idelerdir.41 İnsanın değeri ise insanın diğer türler arasındaki yeridir.42 İnsanın diğer türlere ilişkin yerine baktığımızda insanın  değerler e sahip olması onun yerini belirtmektedir.43  Değerleri -: b ö y l e etkinlikleri- dir insanı değer l i kılan.  Böylece  insanın  değerinin  bilgisi,  böyle  etkinlikleri  ve  ürünleri aracılığıyla edindiğimiz, insanın bu olanaklarının bilgisinden başka bir şey değildir. 44 İnsanın değerinin bilgisi de ortaya konulduktan sonra, sekiz ilkenin insan  değerinin  bilgisinden  türetilip  türetilmediğinin  belirlenmesi gerekmektedir.  Sekiz  ilkenin  insanın  değerinin  bilgisinden  türetilip türetilmediğinin açıklığa kavuşmasından sonra, hukukun iç ahlâkından söz edilip  edilmeyeceği  veya  bu  ilkelerin  etik  ilkeler  olup  olmadığı  ortaya konulabilir.45Bu  noktanın  açıklanabilmesi  için  de  ilk  olarak  hukukun  iç ahlâkının  sekiz  ilkesinin  köklerinin  neye  dayandığını  ortaya  koymak gerekmektedir. II. Sekiz İlkenin Temellendirilmesi Fuller ın ileri sürdüğü sekiz ilkenin türetilme yolunu ve kaynağını tespit edebilmek  için   neden  kuralları  sekiz  ilkeye  uygun  olarak  oluşturmak gerekir?  sorusu sorulmalıdır. Bu sorunun cevabı ise kurmaca kral Rex in hikayesi aracılığıyla verilebilir.  Fuller, The Morality of Law da bize bir monarkın hikayesini sunar. Aslında bu hikaye Fuller ın Positivism and Fidelity to Law: A Reply to Prof. Hart başlıklı makalesinde sunduğu monarkın hikayesinin daha ayrıntılı ve                                                  40 Kuçuradi, 2006, s.170. 41 Kuçuradi, 2006, s.169-180.   42 Kuçuradi, 2007, s.72.  43 Kuçuradi, 2006, s.170. 44 Kuçuradi, 2006, s.170-171. 45  Ancak bu noktada sekiz ilkenin Hart ın ileri sürdüğü pozitif ahlâk veya Kuçuradi nin ileri sürdüğü değer yargılarıyla ilgili olmadığı belirtilebilir. 46 Fuller, 1958, s.644-645. 10AÜHFD, 64 (1) 2015: 1-35                                                                                                    Akı sistematik  bir  halidir.47  Bu  hikaye  Rex  isimli  monarkın  mutsuz hükümranlığını  anlatmaktadır.  Bu  hikayede  Rex,  bir  reformcunun gayretkeşliğiyle  tahta  çıkar.  Ona  göre  ondan  önce  gelenlerin  en  büyük başarısızlığı,  hukuk  alanında  olmuştur.  Davalara  ilişkin  prosedürler  çok yavaş ve elverişsizdir, kuralların dili sanki başka bir çağa ait gibidir, adalet pahalıdır vs. Rex bütün bu sorunları çözümlemeye ve kendi  ismini tarihe büyük bir kanun koyucu  olarak yazdırmaya karar vermiş olmasına rağmen, bariz bir şekilde başarısız olmuştur. Rex in başarısızlığı gerekli reformları gerçekleştirmemiş  olmasından  değil; hukuk oluşturmada (iyi olsun,  kötü olsun) tamamen başarısız olmasından kaynaklanmıştır.48 Rex in neden ve nasıl başarısız olduğunu görebilmek için hikayesine daha yakından bakalım:  Rex  tahta  geçtiğinde,  yaptığı  ilk  şey  var  olan  kuralları  yürürlükten kaldırmak olur. Rex daha sonra yeni bir kanun hazırlamaya girişir. Fakat en basit genellemeleri yapmak konusunda bile kabiliyetsiz olduğunu fark eder. Rex, genelleme konusunda pek çok ders aldıktan sonra bir kanun hazırlar ve artık  uyuşmazlıkların  bu  kanuna  göre  çözümleneceğini,  fakat  kuralların içeriğinin devlet sırrı olarak kalacağını ilan eder. Rex in bu kararı, ona tabi olanları  kızdırır.  Çünkü  ne  olduklarını  bilmedikleri  kuralların  onlara uygulanması söz konusudur.49 Rex, bu itiraz karşısında hayattan aldığı önemli bir dersin, edinilmiş tecrübenin verdiği avantajla karar vermek olduğunu düşünür ve yeni takvim yılının başında geçmiş olan yılın bütün uyuşmazlıklarını çözümleyeceğini, ayrıca  verdiği  kararları  ve  bu  kararlara  dayanak  olmuş  olan  kuralları yayımlayacağını ilan eder. Buna cevaben Rex e tabi olanlar kuralları bilmek istediklerini  söylerken,  bu  kuralları  önceden  bilmeyi  ve  onlara  göre davranışlarını belirleyebilmeyi kastettiklerini söylerler.50 Rex bu eleştiriler üzerine  yeni  bir  kanun  hazırlar.  Fakat  Rex in  hazırladığı  yeni  kanun yayımlandığı zaman anlaşılır ki bu kanun belirsizliklerle doludur. Kanunda sıradan  vatandaşın  veya  hukukçuların  anlayabileceği  tek  bir  cümle  dahi yoktur.51                                                  47 Rundle, 2012, s.88. 48 Fuller, 1969, s.33-34. 49 Fuller, 1969, s.34-35. 50 Fuller, 1969, s.35. İtalik Fuller a ait. 51 Fuller, 1969, s.36.   11Hukukun İç Ahlâkı                                                      AÜHFD, 64 (1) 2015: 1-35 Kanun hemen yürürlükten kaldırılır. Bunun üzerine Rex, uzmanlara kanunun esasına dokunmadan hükümleri açık hale getirmelerini emreder. Fakat  kanun  metnine  açıklık  kazandırılması,  kanun  maddelerinin birbirleriyle çeliştiği gerçeğini ortaya çıkarır.52 Bir kez daha kanun yürürlükten kaldırılır. Bu arada Rex in onlar için yaptığı her şeyden şikayet eden tebaasına karşı sabrı tükenmiştir. Bu nedenle Rex, onlara bir ders vermeye karar verir. Uzmanlara kanundaki çelişkileri kaldırmalarını, ama aynı zamanda kanunları sertleştirmelerini ve yeni suçlar eklemelerini  emreder.  Bu  yeni  düzenlemelerle,  daha  önce  krala  rapor sunmak için on gün verilirken, şimdi bu süre on saniyeye inmiştir. Kralın önünde öksürmek, hıçkırmak, hapşırmak, bayılmak on yıllık hapis cezası öngören  bir  suç  olmuştur.  Sonuç  olarak,  bu  kanun  yayımlandığı  zaman neredeyse  bir  devrim  baş  göstermiştir.  Öncülük  eden  vatandaşlar,  bu kanunları reddettiklerini bildirmişlerdir. Daha sonra krala üzerinde şu not yazan  yüzlerce  dilekçe  gönderilmiştir:   Yapılamayacak  olanı  emretmek hukuk yapmak değildir, hukuk yapmamaktır, uyulamayacak bir emir hiçbir amaca hizmet etmez; karışıklık, korku ve kaostan başka. 53 Kanun yine yürürlükten kaldırılır ve bir grup uzman kanunu gözden geçirmek üzere tayin edilir. Uzmanlar kanun üzerinde çalışır, neredeyse her madde  yeniden  yazılır  ve  sonunda  açık,  tutarlı,  vatandaştan  gücünün ötesinde bir şey talep etmeyen bir kanun hazırlanır ve kanun metni her sokak başında  dağıtılır.  Bununla  birlikte  Rex in  hazırladığı  taslaktan  bu  yana ülkede  pek  çok  değişiklik  olmuştur.  Bu  nedenle  de  Rex in  hazırladığı taslağın  içeriğinde  bir  takım  değişikliklerin  yapılması  gerektiği  fark edilmiştir.  Bunun  üzerine  uzmanların  hazırladığı  kanunun  yürürlüğe girmesinden kısa bir süre sonra, uzmanlar bir dizi değişiklik eklemişlerdir. Sonuç olarak yine bir hoşnutsuzluk oluşmuş ve sokaklarda anonim bir broşür dolaşmaya  başlamıştır:   Her  gün  değişen  bir  hukuk,  hiç  hukuk olmamasından daha kötüdür. 54 Kanuna ilişkin değişikliklerin hızı yavaşlayınca, bu sorun çözülmüş olur. Bunun üzerine Rex, bundan önceki sorunların uzmanlarından aldığı kötü  nasihatlerden  kaynaklandığı  ve  artık  kendisinin  yargı  yetkisini                                                  52 Fuller, 1969, s.36. 53 Fuller, 1969, s.36-37. 54 Fuller, 1969, s.37. 12AÜHFD, 64 (1) 2015: 1-35                                                                                                    Akı üstlendiğini bildirir. Nihayet, Rex in tebaasının kendi davranışlarını tutarlı bir kurallar bütününe uyumlu kılabilmesine olanak sağlayan yeni bir dönem başladığı düşünülürken sonuç hiç de umulduğu gibi olmaz. Bir süre sonra Rex in verdiği kararlar ve o kararlara uygulanması beklenen kanun arasında herhangi  bir  bağlantı  olmadığı  fark  edilir.  Rex in  verdiği  kararlar  ile yayımlanmış kanunlar arasında bir uyum yoktur. Sonunda vatandaşlar Rex i tahttan indirmek için ne tür önlemler alınabileceğini düşünürken Rex ölür.55 Hikayede görüldüğü gibi Rex adını tarihe büyük bir kanun koyucu olarak  yazdırmak  isterken,  bir  hukuk  sistemi  oluşturamadan  ölmüştür. Kristen Rundle a göre bu hikayenin önemi, Fuller ın hukuki patoloji veya başarısızlık  sunarak  ve  nasıl  bir  hukuk  sistemi  oluşturulamayacağını  ve sürdürülemeyeceğini  göstererek,  bu  başarısızlığın  nasıl  başarıyla  yer değiştirebileceği hakkında düşünmeye davet etmesidir.56 Buna göre hukuk sistemi oluşturmada ilk başarısızlık, kural yaratmayı bile becerememekte, genelleme  yapmada  başarısızlıktır.  Hukuk  sistemi  oluşturmada  ikinci başarısızlık,  kuralları  yayımlamak  konusunda  başarısız  olmaktır.  Üçüncü başarısızlık,  geçmişe  yürür  kanun  yapmayı  kötüye  kullanmaktan kaynaklanan  başarısızlıktır.  Hukuk  sistemi  oluşturmada  dördüncü başarısızlık, kuralları anlaşılabilir yapmak bakımından başarısızlık, beşinci başarısızlık  da  birbiriyle  çelişmeyen  kurallar  yapmak  bakımından başarısızlıktır.  Bir  hukuk  sistemi  oluşturmada  altıncı  başarısızlık, vatandaştan imkansızı talep etmekten kaynaklanan başarısızlıktır. Yedincisi çok  sık  değişiklik  yapmak  olup,  bunun  neticesinde  kurallara  uymakla yükümlü  olanların  kurallara  uyum  sağlayamamaları  söz  konusudur. Sekizinci  başarısızlık,  yayımlanmış  kurallar  ile  onların  fiili  uygulaması arasındaki uyumda başarısızlıktır.57 Sonuç olarak, Rex in bir hakim ve kanun koyucu olarak kariyeri bir kural sistemi oluşturmada ve sürdürmede en azından sekiz açıdan başarısız olunabileceğini göstermiş ve Fuller bu başarısızlıklardan kanun koyucunun hukuk  oluşturmak  için  uyması  gereken  sekiz  ilkeye  ulaşmıştır.60  Hukuk                                                  55 Fuller, 1969, s.38. 56 Rundle, 2012, s.89. 57 Fuller, 1969, s.39; Rundle,2012, s.89. 58 İtalik bana ait. 59  Fuller, 1969, s.38. 60 Van der Burg, 2014(a), s.55; Van der Burg, 2014(b), s.60.   13Hukukun İç Ahlâkı                                                      AÜHFD, 64 (1) 2015: 1-35 kuralları genel, kamusal, geleceğe yönelik, açık, mantıksal olarak tutarlı, uygulanabilir, zaman içinde tutarlı olmalı ve yayımlanan kurallar ile onların fiili uygulaması arasında uyum olmadır.61Fuller a göre bu  sekiz noktanın herhangi  birinde  bütünüyle  (total)  başarısızlık,  sadece  kötü  bir  hukuk sistemine  yol  açmayacaktır;  tam  anlamıyla  hukuk  sistemi  olarak adlandırılabilecek  (is  not  properly  called  legal  system)  bir  şey  dahi yoktur. 62 Dolayısıyla Rex in hikayesi  neden kuralları sekiz ilkeye uygun olarak oluşturmak gerekir?  sorusuna bir cevap sunmaktadır: Eğer kanun koyucular bir  hukuk  sistemi  oluşturmak  istiyorsa  bu  sekiz  ilkeye  riayet  etmeleri gerekmektedir. Aksi halde hukuk kuralları insan davranışına yön verememiş ve dolayısıyla bir hukuk sistemi oluşturulamamış olur.63 Rex in hikayesinin gösterdiği bir diğer şey ise, sekiz ilkeye riayet etmeyen bir hukuk sisteminde vatandaşın da kurallara uymak konusunda bir nedeninin kalmamasıdır. Zira Fuller a göre,  bir insanın yayımlanmamış bir kurala veya ondan gizlenen ya da o fiilini gerçekleştirdikten sonra oluşturulan veya rasyonel olmayan ya da                                                  61 Fuller, 1969, s.39. 62 Fuller, 1969, s.39. 63  Rex in  hikayesinin  bir  diğer  önemli  yönü  ise,  hukuk  yapma  sürecinin  kendisine odaklanılması  gerektiğini  göstermesidir.  Oysaki  geleneksel  hukuk  felsefesi  kanun koyuculuk faaliyeti neticesinde çıkan ürüne, yani kanuna odaklanmaktadır. Van der Burg, 2014(a), s.54. Fuller ise kanun yapma sürecine ve girişimine odaklanmıştır. Luban, 2008, s.102;Van der Burg, 2014(a), s.56. Bu doğrultuda Fuller a göre kanun koyucu, eğer hukuk olarak  adlandırılacak  bir  yönetim  formu  oluşturmak  ve  bunu takiben  hukukun  insan davranışına yön veren bir yol işareti olarak hizmet etmesini istiyorsa, bu prosedürel sekiz ilkeye uyması gerekmektedir. Van der Burg, s.55. Fuller teorisini prosedürel doğal hukuk teorisi  olarak  nitelendirirken,  onu  eleştiren  pek  çok  hukuki  pozitivist,  onun  teorisini geleneksel doğal hukuk teorisi olarak görüp, bu ilkelerin hukuk kurallarının içeriğine ilişkin bir sınırlama getirip getirmediğini tartışmışlardır. Van der Burg, 2014(a), s.55. Halbuki Fuller, kanun yapma sürecinin bizatihi kendisine ve bu süreçte kanun koyucunun yerine getirmesi gereken sorumluluğa (sekiz ilkenin yerine getirilmesi) odaklanıp bu sorumluluğu  hukukun iç ahlâkı  ifadesiyle açıklamaya çalışmaktadır. Fuller, 1969, s.223. Bu noktayı, Fuller ın Philip Selznick e yazmış olduğu bir mektupta, ahlâk terimini ethos veya belirli rollere eşlik eden, belirli ahlâki sorumlulukları ifade eden bir terimle değiştirmeyi istediğini belirtmiş olması da doğrulamaktadır. Fuller, aynı şekilde yazdığı bir diğer mektupta şu fikri ileri  sürer:   Eğer  kitabımı  The  Morality  of  Law  olarak  adlandırmak  yerine,  Hukuk Yapmanın  Ahlâkı  (The  Morality  of  Lawing)  olarak  adlandırsaydım,  pek  çok  yanlış anlaşılmadan kaçınılabilecekti,  çünkü  hukuk sözcüğü raflarda durağan bir biçimde yatan kitapları akla getirirken,  hukuk yapma (lawing) terimi birbiriyle etkileşim halindeki insanları ve etkileşimin uygun bir şekilde devam etmesini akla getirmektedir. Rundle, 2012, s.115. 14AÜHFD, 64 (1) 2015: 1-35                                                                                                    Akı hukuk sistemi içindeki diğer kurallarla çelişen veya her dakika değişen bir kurala  uymasına  ilişkin  ahlâki  bir  yükümlüğü  yoktur. 64  Fuller,  kuralı uygulamakla  yükümlü  kişinin  kuralı  görmezden  gelmesinin  veya uygulamamasının,  vatandaşın  kurala  uymasını  imkansız  kılmayacağını,65 ama bir noktadan sonra kurala itaatin de vatandaş açısından boşuna olacağını belirtir ve sosyolog Georg Simmel den alıntı yaparak, vatandaş ve hükümet arasında  kuralların  uygulanmasına  saygı  açısından  bir  karşılıklılık olduğunu belirtir.67 Hükümet vatandaşa şunu demektedir:  Bunlar senden uymanı beklediğimiz kurallardır. Eğer bu kurallara uyarsan, bu kuralların davranışına  uygulanacak  olan  kurallar  olacağını  garanti  ediyoruz. 68 Fuller a göre, bu karşılıklılık bağı hükümet tarafından tamamıyla koparıldığı zaman, vatandaş açısından kurallara itaat ödevini yerine getirme belirli bir temelden yoksun kalmaktadır. Yani, vatandaşın kurallara uymak için bir nedeni  kalmamaktadır.69  Bir  başka  ifadeyle,  hukuki  öznenin  hukuka bağlılığının  söz  konusu  olabilmesi  için  kanun  koyucunun  onunla  bir karşılıklılık içinde olması lazımdır.70  Netice olarak Rex in hikayesi, sekiz ilkeye riayet etmeyen bir kanun koyucu örneği sunarak, bir hukuk sistemi oluşturmak için sekiz ilkeye neden riayet edilmesi  gerektiğini  aksiyle  kanıt  (reductio  ad  absurdum)  yoluyla ortaya  koymuş  olmaktadır.  Buna  göre  kanun  koyucuların  insanların davranışlarına yön vermek, vatandaşların kurallara uymasını sağlamak yani bir hukuk sistemi oluşturmak için bu sekiz ilkeye uyması gerektiği iddia edilebilir.  Böyle  bir  cevap  sekiz  ilkenin,  etik  ilkeler  olmadığı,  kanun koyucunun işini kolaylaştıran (daha etkili kılan) ilkeler, davranış normları olduğu sonucuna varılmasına neden olabilir. Ancak Fuller ın teorisinin bir başka yönüne bakıldığında bu cevabın eksik bir cevap olduğu görülebilir. Zira Fuller ın teorisinde saklı bir insan görüşü vardır:  Şimdi  en  önemli  hususa  gelmiş  bulunuyorum.  Bu  önemli husus  da  hukuki  ahlâkın  taleplerine  riayet  edilmesiyle  insan                                                  64 Fuller, 1969, s.39. 65 İtalik bana ait. 66 İtalik bana ait. 67 Fuller, 1969, s.39. 68 Fuller, 1969, s.40. 69 Fuller, 1969, s.40. 70 Rundle, 2012, s.89.   15Hukukun İç Ahlâkı                                                      AÜHFD, 64 (1) 2015: 1-35 hayatının  genel  olarak  daha  büyük  amaçlarına  hizmet edilebileceğidir. Bu hukukun iç ahlâkında saklı insan görüşüne dayanır.  Hukuki  ahlâkın  pek  çok  etik  meseleye  karşı  nötr olduğunun söylenebileceğini defalarca gözlemledim. Hukuki ahlâk kendi içindeki insan görüşüne karşı nötr olamaz. İnsan davranışını kuralların  yönetimine  tabi  kılma  girişimi  insanın  sorumlu  bir eyleyen, kuralları anlama ve takip edebilme yetisine sahip ve kendi hatalarından sorumlu olduğu veya olabileceği görüşüne zorunlu bir bağlılık içerir. Hukukun iç ahlâkından her bir ayrılış, sorumlu bir hukuki özne  olarak  insanın  onuruna  hakaret  etmek  demektir.  Onun davranışlarını  yayımlanmamış  veya  geçmişe  yürür  kurallarla yargılamak ya da ona yerine getiremeyeceği emirler vermek, onun özerkliğine  karşı  kayıtsızlığı  ortaya  koymaktır.  Bunun  aksine, insanın sorumlu eylem yetisi olmadığı kabul edildiğinde, hukuki ahlâk  (legal  morality)  var  olma  nedenini  kaybedecektir.  Onun davranışlarını,  yayımlanmamış  veya  geçmişe  yürür  kurallarla yargılamak artık bir hakaret olmayacaktır, çünkü artık bir hakaret yoktur – hatta bu bağlamda yargılamak sözü de yersiz olacaktır; biz  artık  bir  insanı  yargılamıyoruz,  onu  kontrol  (act  upon) ediyoruz. 71 Bu doğrultuda, sekiz ilkenin türetildiği kaynağın, insanın akıl sahibi ve kendi kararlarını, seçimlerini yapabilen birey olduğu ileri sürülebilir. Bu iddia ise hukukun iç ahlâkını açıklamada önemli bir yerde durmaktadır.  III. Hukuk ve Ahlâk Arasındaki Bağlantı Dolayısıyla  hukuk  ve  ahlâk  arasındaki  zorunlu  bağlantı  ilk  olarak, hukuka  tabi  vatandaşın  yani  hukuki  öznenin  özerk  bir  birey  olmasıyla açıklanabilir.  Bugün  Fuller  yanlısı  teorisyenler  de  hukukun  insanın özerkliğine saygı duymasını, sekiz ilkenin ahlâki ilkeler olduğu savunusunda gerekçe olarak kullanmaktadır.  Fuller  yanlısı  teorisyenlerden  Jeremy  Waldron,  Fuller ın  yukarıda aktarılan  iki  paragrafta  hukukun  özel  bir  yönüne  işaret  ettiğini  ileri sürmektedir. Bu özel yön de hukuk veya kurallarla yönetimin, kişinin kendi                                                  71 Fuller, 1969, s.162. 16AÜHFD, 64 (1) 2015: 1-35                                                                                                    Akı davranışına  kuralları  uygulayabilme  (self-application)  yetisine  dayanıyor olmasıdır. Yani, hukukla yönetim çerçevesinde, insanlar, devlet tarafından uygulanacak  zorlayıcı  bir  güç  neticesinde  kurallara  uymaktansa,  kendi davranışlarına  normları  uygulamakta  ve  buna  göre  davranmakta, davranışlarını düzenlemekte, kısaca normlara göre hareket etmektedir.72 Bu husus, Waldron a göre, işleyen bir hukuk sisteminin en önemli özelliğidir. Hukuk sistemleri, insanların normları anlama ve kavrama yetilerine, kendi kendilerini  kontrol  etmelerine,  denetlemelerine  ve  kendi  davranışlarını ayarlama yetilerine güvenmektedir.73 Bu iddiayla paralel olarak, Fuller ın teorisinde belirli bir insan görüşü söz konusudur. Buna göre, Fuller eyleyenden bahsettiği zaman, amaçsal eylemi gerçekleştirme yetisine sahip ve kendisinin amaç olduğu bilincine sahip kişiden bahsetmektedir. Buna göre sadece kanun koyucunun verdiği direktifleri takip eden biri değil, bir onur taşıyıcısı, kendi kendine karar verme yetisine sahip birinden söz etmektedir.74 Aynı zamanda, Fuller için hukuki özne ise,  onlara söyleneni yapmaya hazır, boyun eğen bir kitlenin  üyesi olmak değildir. Fuller için hukuki özne, bir eyleyen (agent) olarak saygı duyulan biri olmak ve ayırt edici özelliği olan bir düzenin üyesi olmak anlamına gelmektedir.75 Dahası Rundle a göre hukuki özne, sadece kendi çıkarları açısından seçimleri ve planları olan bir birey değil, Antik Yunan tarzı vatandaşa benzer olarak hukuk düzeninin aktif katılımcısıdır.76 Bu insan görüşünden hareket eden Rundle a göre hukuk doğası gereği ahlâkidir. Zira hukukun formu, yani  genel kurallar aracılığıyla yönetim, hukuki  öznenin  statüsünü  sorumlu  bir  varlık  olarak  kabul  etmekte  ve sorumlu bir eyleyen olarak insana saygı duymaktadır.77 Yani Fuller ın teorisi çerçevesinde  insan,  genel  kurallarla  etkileşime  girebilen  sorumlu  bir eyleyendir. Bu doğrultuda hukuki özneye talimat veren veya hukuki özneye dayatılan  bir  kurallar  sistemi,  hukuk  sistemi  olarak  adlandırılamaz.78                                                  72 Waldron, 2012, s.206. 73 Waldron, 2012, s.206; Luban, 2010, s.42, 43. 74 Rundle, 2012, s.99. 75  Rundle, 2012,s.2. Rundle aynen alıntıyı Fuller ın yayımlanmamış metinlerinden almıştır, Harvard Law School Library, Box 12. Ayrıca bkz. Rundle, 2013, s.771. 76 Rundle, 2012, s.99-100. 77  Rundle, 2012, s.3. İtalik bana ait. Rundle a göre, genellik ilkesi daha sonra, Fuller ın kendisini eleştirenlere yönelik fikirlerini geliştirirken hukukun neden içsel (internally) olarak ahlâki olduğunu göstermede büyük bir yer tutacaktır. Rundle, 2012, s.90. 78 Rundle, 2012, s.10.   17Hukukun İç Ahlâkı                                                      AÜHFD, 64 (1) 2015: 1-35 Özellikle bu noktada genel kurallar, yani hukuk aracılığıyla yönetim ve idari emir arasındaki fark önemlidir.79 Zira hukuk kurallarıyla, yani genel kurallar aracılığıyla  yönetim,  hukuki  öznenin  hukuk  çerçevesinde  eyleyebilme kapasitesine  dayanmaktadır.80  Daha  da  ötesi,  Fuller  hukukun  formunun öznenin statüsüne saygı göstermenin ötesinde, bunu önceden varsaydığını da iddia  etmektedir.  Zira  Fuller ın  The  Morality  of  Law da  belirttiği  gibi, hukuka bağlılık belirli bir insan anlayışını gerektirmektedir.81 Hukuk ve ahlâk arasındaki zorunlu bağlantıyı açıklamanın bir diğer yolu ise Fuller ın görüşleri çerçevesinde, sekiz ilkenin kanun koyucu ve vatandaş arasında bir karşılıklılık ilişkisi oluşturmasıdır. Yukarıda belirtildiği gibi, kanun koyucu ve vatandaş arasındaki karşılıklılık şuna dayanır: Bir yandan  kanun  koyucu  vatandaşların  bir  bütün  olarak  kendisinin  yaptığı kuralları hukuk olarak kabul ettiğini ve bunlara uyacağını umacak; diğer yandan da  vatandaşlar kanun  koyucunun  kendi yapmış  olduğu kurallara bağlı kalacağını (özellikle vatandaşların davranışları yargılanacağı zaman) umacaklardır.82 Fuller a göre, bunun anlamı, vatandaşların ellerinde kanun kitaplarıyla  dolaşıp,  kanun  koyucuların  bunlara  uygun  hareket  edip                                                  79  Hukuk  aracılığıyla  yönetim  ile  idari  emir  arasındaki  fark  Fuller ın  eunomics  projesi çerçevesinde açıklanabilir. Eunomics Fuller ın geliştirdiği bir terimdir. Fuller eunomics terimini şu şekilde tanımlamaktadır:  iyi düzenin veya işleyebilecek (workable) sosyal düzenlemelerin bilimi, teorisi veya çalışması.  Fuller, 2001(b), s.62. Fuller 1950 ve 1960 yılları arasında Principles of Social Order başlığı altında eunomicsle ilgili sistematik bir eser yazmayı planlamış, fakat sadece Means and Ends i bir giriş olarak yazmıştır. Kitap her ne kadar yazılmamış olsa da, Means and Ends in yayımının ardından geçen on yılda, Fuller sosyal düzenleme modelleri ve onların tezahürlerine büyük ilgi göstermiştir. Fuller, bütün sosyal düzenleme modellerini kapsayan bir eser yazmamıştır. Her bir sosyal düzenleme modeli için makaleleri bulunmaktadır. Bu makaleleri de Winston, Principles of Social Order  adlı  kitapta  bir  araya  getirmiştir.  Winston,  s.29.  Fuller ın  ilgilendiği  sosyal düzenleme modellerini bir liste olarak sunmak mümkün olmasa da, bunlar arasında hüküm verme (adjudication), arabuluculuk, kanun koyma, sözleşme ve idari emir (managerial direction) belirtilebilir. Fuller a göre her bir sosyal düzenleme modeli kendi iç ahlâkını içermektedir. Örneğin, kanun koyma genel kurallara uygun olarak yönetme girişimi olup, bu  girişim  sekiz  ilke  aracılığıyla  gerçekleştirilmektedir.  Diğer  sosyal  düzenleme modellerine göre, örneğin arabuluculuk ve sözleşmeye ilişkin ahlâki ilkeler  farklıdır. Winston, s.42. Dolayısıyla, kanun koyma yani genel kurallar aracılığıyla yönetim ve idari emir birbirinden farklı sosyal düzenleme formlarıdır. Bu ikisi arasındaki fark hukukun iç ahlâkını açıklamada önemli bir yerde durmaktadır. İkisi arasındaki fark aşağıda ayrıntılı olarak açıklanacaktır.  80 Rundle, 2012, s.10. 81 Rundle, 2012, s.10. İtalik bana ait. 82 Fuller, 2001(a), s.254-255; Fuller, 1969, s.39-40. 18AÜHFD, 64 (1) 2015: 1-35                                                                                                    Akı etmediğini  tespit  etmesi  demek  değildir.83  Burada  önemli  olan  nokta, vatandaşın  hükümetinin bu hukuk oyununu adil bir şekilde oynadığına dair bir inancının (faith)  olmasıdır.84 Fuller a göre işleyen bir hukuk sisteminde vatandaşların  bu inanca  sahip olması çok  büyük  bir  önem  taşıdığından, buradaki önemli bir düş kırıklığı hem vatandaş açısından hem de yöneticiler açısından bir hukuk düzeninin  ahlâki temellerini  zedeleyecektir.85 Dolayısıyla  kanun  koymanın  iç  ahlâkının  ahlâki  boyutu,  kuralların uygulanması bakımından kanun koyucu ve vatandaş arasındaki karşılıklı beklentiye dayanmaktadır. Kanun koyucunun kurallara uygun olarak hareket etmesi  için  de  öncelikle  genel  nitelikte  kuralların  olması,  bu  kuralların anlaşılabilir olması, yayımlanmış  olması yani sekiz ilkeye uygun olarak oluşturulması gerekmektedir. Bu doğrultuda hukukla yönetilen vatandaşların beklentisi  de  genel,  yayımlanmış  olan,  açık,  yerine  getirilebilir,  tutarlı, zaman  içinde  çok  sık  değişmeyen  ve  geçmişe  yürümeyen  kurallarla yönetilmektir. Daha açık bir ifadeyle vatandaşlar, kendi davranışlarına ve yetkililerin davranışlarına bu kuralların uygulanacağı beklentisi içindedirler. Bu beklenti ise bir sosyal düzenleme modeli olarak hukukun amacından kaynaklanmaktadır.  Fuller a  göre  hukukun  amacı,  insan davranışına  yön vermektir.86  Bu  doğrultuda  da  hukuka  tabi  olan  vatandaş,  bir  hukuk sistemindeki kuralların insan davranışına yön vereceği beklentisi içindedir. Dolayısıyla  hukukun  sekiz  ilkeye  uygun  olarak  oluşturulacağı  beklentisi içindedir. Kanun koyucunun beklentisi ise kurallara tabi olan vatandaşın bu kuralları anlama, takip edebilme yetisine sahip özerk bireyler olmasıdır. Sekiz ilkenin bir sosyal düzenleme modeli olarak hukukun amacından kaynaklandığı iddiası ise bu ilkelerin neden hukukun veya kanun koymanın  iç  (inner, internal) ahlâkı olarak kabul edilmesi gerektiğini açıklar. Bu ilkelerin hukukun  iç  ahlâkının ilkeleri olarak adlandırılmasının sebebi, hukukun  dışından  dayatılan  bir  takım  amaçlar  veya  gerekliliklerden kaynaklanmıyor  oluşu,  hukuk  düzeninin  bizatihi  kendi  amacından                                                  83 Fuller, 2001(a), s.255. 84 Fuller, 2001(a), s.255. 85 Fuller, 2001(a), s.255. 86 Fuller, 1969, s.106. 87 Bu noktada da Winston un yaptığı bir ayrım önemlidir; her bir sosyal düzenleme modelinin iç ve dış amacı. Sosyal düzenleme modelinin iç amacı, idari emir ve hukuk arasındaki farkla ilgilidir. Sosyal düzenleme modelinin iç amaçlarından bahsedildiği zaman sorulması   19Hukukun İç Ahlâkı                                                      AÜHFD, 64 (1) 2015: 1-35 kaynaklanıyor oluşudur. Daha açık bir ifadeyle, hukukla yönettiğini iddia eden her yönetim sekiz ilkeye riayet etmelidir. Zira hukukun amacını -insan davranışına  kurallar  aracılığıyla  yön  vermek-  gerçekleştirmeye  olanak sağlayan ve hukuku hukuk yapan sekiz ilkedir. Dolayısıyla Fuller ın görüşleri çerçevesinde hukukla yönetim, kanun koyucu ve vatandaş arasında bir karşılıklılık ilişkisine dayanır. Bu ilişki bir hukuk sisteminin ahlâki temelidir. Böyle bir ilişki Fuller ın hukukun kendine özgü bir ahlâkı olduğu iddiasının temelidir. Hukuk sisteminin vatandaş ve kanun koyucu arasındaki karşılıklı ilişkiye dayanmasının neden ahlâk olarak kabul edilmesi gerektiği, bir  verdiğin sözü tutma  veya  güven ilişkisi  olarak görülebilir. Hukukla yönettiğini iddia eden kanun koyucular, hukukla yönetimin  bir  gereği  olarak  sekiz  ilkeye  riayet  etme  sözü  vermiş olmaktadırlar. Vatandaş da böyle bir beklenti içindedir. Dolayısıyla sekiz ilkeye riayet etme zorunluluğu, hukuka tabi olan tarafı yani vatandaşı da hukukun bir parçası olarak görmekle ilgilidir. Kanun koyucular bir hukuk sistemi oluşturmayı amaçladıkları takdirde, vatandaşın kurallara uygun bir şekilde hareket edebileceği bir sistem yaratmak zorundadırlar. Zira Fuller ın görüşleri çerçevesinde kanun koyucu hukuk oluşturmak istiyorsa, dilediği her düzenlemeyi hukuk olarak kabul edemez; ancak vatandaşın kurallara uygun  olarak  davranışını  belirleyen,  yani  sekiz  ilkeye  uygun  olarak oluşturulmuş, düzenlemeler hukuk olarak kabul edilebilir. Dolayısıyla bir sosyal  düzenleme  modeli  olarak  hukuk,  karşılıklı  olarak  verilen  (kanun koyucu ve vatandaş tarafından) sözleri tutmak bakımından ahlâki bir düzen olarak görülebilir.  Ayrıca sekiz ilkeye uygun bir şekilde inşa edilen ve sürdürülen rejimler vatandaşları korku, tedirginlik ve belirsiz durumlardan uzak tuttuğu, belirli bir  kötülükten  kaçınmayı  sağladığı  için  de  ahlâki  bir  boyuta  sahiptir. Dolayısıyla sekiz ilkenin etik ilkeleri olarak kabul edilebilmesinin bir diğer nedeni,  keyfiliği  önlemeleri  ve  belirli  tür  kötülüklerin  önüne geçebilmeleridir.  İlkelerin  belirli  kötülüklerden  kaçınmayı  sağlaması, insanların belirsiz ve öngörülemeyen ve kaostan uzak bir hayat sürdürmesini                                                                                                                    gereken  soru,  bu  süreci  kullanmadaki  amaç  (point)  nedir  sorusudur.  Örneğin  hangi durumda neden o hukuki sürecin yani neden arabuluculuk veya idari emrin değil de kanun yapmanın kullanıldığı meselesidir. Fakat eğer hukuki sürecin dış amacını sorgularsak bu defa soru bu süreci kullanarak neyin elde edilebileceğidir. Mesela dar gelirli öğrencilere üniversite eğitimini gerçekleştirmek için burs sağlanması gibi. Winston, s.53. 20AÜHFD, 64 (1) 2015: 1-35                                                                                                    Akı olanaklı kılmalarıyla ilgilidir. Bu ilkeler aracılığıyla ne tür bir kötülükten kaçınılabileceği  ise  bu  ilkelerin  yerine  getirilmediği  bir  sistem  altında yaşamayı tahayyül etmekle ortaya konulabilir.88 Kuralların  yayımlanmadığı,  belirsiz  ve  yerine  getirilmesi  imkansız talepleri içerdiği rejimlerde, vatandaşlar devamlı bir tehlike korku ve kaos altında  yaşamaktadır.89Fuller  geçmişte  bazı  hükümetlerin  kaos  ve  korku yaratarak bazı gizli amaçlarını gerçekleştirmeye çalıştıklarının farkındadır.90 Çünkü yerine getirilmesi mümkün olmayan veya ne anlama geldiği açık olmayan kurallara uymak zorunda olmak, vatandaşı çok geniş ve hatta keyfi bir takdir yetkisine sahip bir yönetimle karşı karşıya getirmektedir. Belirsiz kurallar,  yönetenlerin  vatandaşlara  karşı  istediğini  yapabilmesini sağlamaktadır.  Bu  tür  kurallar,  yetkililere  istediği  kişiler  hakkında kovuşturma açma imkânı sunmaktadır. Böyle bir yönetimle karşı karşıya kalan vatandaşlar ise hayal kırıklığına uğramanın da ötesinde artık plan da yapamamakta  ve  korku  ve  tedirginliğin  yanı  sıra  hükümetleri kızdırmamaya  ve  muhalefet  etmemeye  çalışmak  durumunda kalmaktadırlar.92 Bu  tür  rejimlerde  söz  konusu  olan   kayıp  insanlar   da  muhalefeti korkutmanın veya insanları korku içinde bırakmanın örneklerinden biridir.93 Kayıp insanların söz konusu olduğu rejimlerde, sekizinci ilkenin ihlali çok açıktır. Burada amaç, insanlara korku aşılamak ve muhalefeti baskılamaktır. Aynı  şekilde,  kaybolanların  yakınları  açısından  da  durum  çok kötüdür.94Evan  Fox-Decent e  göre,  kaybolma  durumunda  devlet  yanlış yaptığı şeyleri reddetmekte ve kaybolan kişinin vücudu bulunamamakta ve yakınları da sonsuz bir keder ve ümitsiz bir beklenti içine düşmektedir. Bununla  birlikte,  hukuk  devleti  yani  sekiz  ilkeye  riayet  eden  bir  rejim tarafından güvence altına alınan saydamlık, kaybolmanın yol açtığı terörü engelleyebilir;  çünkü  kötülük  bunların  gizli  bir  şekilde  yapılmasından kaynaklanmaktadır.95                                                  88 Luban, 2010, s.39. 89 Luban, 2010, s.39; Waldron, 1994, s.263. 90  Waldron, 1994, s.263. Örneğin Hitler hükümeti, vatandaşları belirli bir acizlik ve korku içinde bırakmaktaydı. Waldron, 1994, s.263. 91 Waldron, 2008, s.7. 92 Luban, 2010, s.40. 93 Decent, s.573-574. 94 Decent, s.574. 95 Decent, s.574.   21Hukukun İç Ahlâkı                                                      AÜHFD, 64 (1) 2015: 1-35 Toparlayacak olursak Fuller ın dile getirdiği ilkeler kanun koyucuya yönelik bir takım davranış normları getirmektedir. Bu davranış normları kanun koyucu ve vatandaş arasında kuralların uygulanması bakımından bir karşılıklılık ilişkisi yaratması, kişinin özerkliğine saygı gösterilmesinin bir yolu olması bakımından ahlâk i bir niteliğe sahiptir. Daha da önemlisi sekiz ilkeye  uygun bir  şekilde  inşa edilen  ve  sürdürülen rejimler vatandaşları korku, tedirginlik ve belirsiz durumlardan uzak tuttuğu, belirli bir kötülükten kaçınmayı sağladığı için de ahlâki bir boyuta sahiptir.  IV.  Kişinin  Özerkliği  ve  Hukuk  Arasındaki  İlişkiye  Dair Sorgulamalar: Waldron Waldron a göre kurallarla yönetim, her ne kadar, insanın kendi kendine karar verme ve bunun neticesinde kurallara uyma veya uymama yetisine dayansa da, bir sosyal düzenleme modeli olarak hukuka ilişkin üç hususun daha tartışılması gerekmektedir. Birincisi hukuk sadece normlardan değil, aynı  zamanda  da  standartlardan  oluşmaktadır.  Dolayısıyla  vatandaşların karşısında her zaman onlara ne yapmalarını veya ne yapmamalarını söyleyen açık kurallar yoktur. Örneğin  gereken özen  kavramı gibi. Waldron a göre, bazı  düşünürler  sadece  yetkililer  tarafından  anlamı  belirlendiği  takdirde standartların insan davranışına rehber olabileceğini kabul etmektedir. Ancak Waldron a  göre,  bu  durumlarda  dahi  hukuk  insanlara,  standartların  ne anlama  geldiğini  belirlemek  konusunda  yetkililere  güvendiği  gibi güvenmektedir.  Dolayısıyla  hukuk,  normları  kendi  davranışlarına uygulayacağı  ve  normların  kendi  davranışları  üzerindeki  etkisini anlayabileceği noktasında insanlara güvenmektedir.96 İkinci  husus,  genel  kuralların  her  zaman  uygulanmasının  mümkün olmamasıdır.  Bunun  nedeni  uygulama  konusundaki  bir  uyuşmazlık olabileceği gibi, hukuk kurallarının uygulamasının bir yetkili aracılığıyla mümkün olması olabilir.97 Ama bu durumlarda da Waldron a göre, hukuk insanların  kuralları  kendi  davranışına  uygulayabilme  yetisine güvenmektedir. Örneğin, bir özel hukuk davasında belirli bir para ödemeye mahkum edilen kişinin evine doğrudan icra memurunun gitmesinden önce, kişinin parayı rızasıyla ödemesi beklenmektedir.98                                                  96 Waldron, 2012, s. 208. 97 Waldron, 2012, s.206. 98 Waldron, 2012, s.206. 22AÜHFD, 64 (1) 2015: 1-35                                                                                                    Akı Üçüncü husus ise hukukun zorlayıcı karakteriyle ilgilidir. Waldron ve diğer düşünürler insanın özerkliği ve kendi hayatı üzerinde karar verme yetisi üzerinde dursa da, Waldron hukukun zorlayıcı karakterinin, insanın özerkliği  ve  genel  kurallar  ilişkisine  nasıl  bir  etkide  bulunacağını sorgulamamıza  olanak  sağlar.  Waldron,  hukukun  zorlayıcılığının farkındadır. Amacı da hukukun zorlayıcı karakterini inkar etmek değildir;99 çünkü  hukuk insanları öldürür, iflas ettirir, güç kullanır, ceza verir. Bunlar hukukun  karakteristik  olarak  yaptığı  şeylerdir. 100  Ancak  hukuk  güç uygularken,  Waldron a  göre,  bunu  formlar  ve  kurumlar  aracılığıyla yapmaktadır  ve  hukukla  yönetimin  en  temel  özelliği  de  budur.101  Bu doğrultuda, hukukun normlar aracılığıyla ileri sürdüğü talepler, her ne kadar yerine  getirilmesi  gereken  talepler  olsa  da,  insanların  normu  kendi davranışlarına  uygulama  ve  izleme  (monitör)  yetisine  bir  alan bırakmaktadır.102 Dahası,  Waldron a  göre  hukukun  güç  uyguladığı  durumlarda  bile, hukukun her istediğini istediği şekilde yapması söz konusu değildir. Hukuk, insanlar hukuki yaptırımlardan korksa, çekinse veya hukuk insanların aksi takdirde gitmek istemeyeceği yerlerde veya durumlarda bulunmasına neden olsa bile, böyle bir durum sürü  gütmekten  farklı bir şeydir. Bunun yerine, hukuk  ve  insan  onuruna  saygı  arasındaki  ilişkiden  söz  edilmelidir.  Bu doğrultuda  hukukun  güç  kullandığı  ve  insanların  en  savunmasız  olduğu zamanlarda bile, insan onuruna saygı duyulması söz konusudur.103 Hukukun insanlar üzerinde zorlayıcılığını kullanmasının bir örneği kişinin ciddi bir suçla  yargılanmasıdır. Bu durumda  kişi istese  de  istemese  de  mahkeme salonuna zorla getirilmekte, ceza almakta, cezaevine götürülmekte ve bütün bunlar  zorla  yaptırılmaktadır.  Ancak  Waldron a  göre,  bu  zorlama  onu ‘barbarca  umutsuz  bir  dehşetten  titreyen 104  biri  haline indirgememektedir.105                                                  99 Waldron, 2012, s.206. 100 Waldron, 2012, s.217. 101 Waldron, 2012, s.217. 102 Waldron, 2012, s.217. 103 Waldron, 2012, s.218. 104  Hannah  Arendt,  The  Origins of  Totalitarianism,  New  York,  1973,  441 den  aktaran Waldron, 2012, s.218. 105 Waldron, 2012, s.218.   23Hukukun İç Ahlâkı                                                      AÜHFD, 64 (1) 2015: 1-35 Ayrıca Waldron a göre, hukuk tarafından davranışların sıkıca kontrol altına alındığı durumlarda bile, kişiler dik durabilmeli ve hareket etmekten acizlermiş  gibi  yerlerde  sürüklenmekte  ziyade  emirlere  cevap  verebilen durumunda olmalıdırlar. Waldron bunların belki önemsiz meseleler veya ayrıntılar  olarak  görülebileceğini  ve  bazılarının  şu  soruları   Eğer  birisi idama  mahkum  edilmişse  onun  hücreye  nasıl  götürüldüğünün  ne  önemi vardır?    Eğer  birisi  tutukluysa  onun  ayakta  mı  yoksa  sürüklenerek götürüldüğünün  ne  önemi  vardır 106  sorabileceğini  belirtir.  Ancak Waldron a göre, aşağılama veya itibarsızlaştırma durumunda bu detaylar öne çıkmakta veya gözaltı durumunda bu tür detaylar ile insan onuru ilişkisi doğrudan söz konusu  olmaktadır. Waldron a göre, onurun dik durmayla önemli bir ilişkisi vardır ve bu önemsiz meselelerdeki onur kırıcı durum (indignity) esasa ilişkin hakaretin bir habercisi olabilir. Zira,  Terörle olan savaşın başında, Guantanamo daki tutukluların yürüyerek götürülmesinden ziyade, el arabası üzerinde götürülmesi, sonradan yaşanacakların habercisi değil midir? 107 Sonuç  olarak  bütün  bunlar  Waldron a  göre,  hukukla  yönetimi,  bir çubukla veya köpekle bir hayvan sürüsünü gütmekten farklı bir şey yapar. İnsanların kuralları kendi davranışlarına uygulayabilmesi (self-application) hukuku  hukuk  yapan  özelliktir.  Bu  özellik  hukuku,  tehdit  ve  şiddet aracılığıyla gerçekleştiren yönetimden farklı kılar. Fuller ın da gösterdiği gibi,  insanların  kuralları  kendi  davranışlarına  uygulayabilmesi  (selfapplication) hukukun insan onuruna saygısının bir göstergesidir.108 V. Fuller ın Teorisine Yöneltilen Eleştiriler Fuller ın hukukun kendine özgü bir iç ahlâkı olduğu iddiası literatürde, o  dönemde,  ciddi  eleştirilere  maruz  kalmıştır.  Bu  eleştirilerden  ilki  bu ilkelerin  ahlâki  ilkeler  olmadıkları,  etkili  bir  kanun  koymanın  ilkeleri olduğudur.109 Fuller bu eleştiriye A Reply to Critics te idari emir ve genel kurallar  aracılığıyla  yönetim  ayrımı  çerçevesinde  cevap  vermiştir.110  Bu noktada da idari emir ve hukukun (genel kurallarla yönetim) farkı ortaya                                                  106 Waldron, 2012, s.219. 107 Waldron, 2012, s.219. 108 Waldron, 2012, s.206. 109 Hart, 1983, s.343-364. Raz, 2008, s.163. 110 Fuller, 1969, s.208. 24AÜHFD, 64 (1) 2015: 1-35                                                                                                    Akı konulmalıdır. Bununla birlikte Fuller bu iki sosyal düzenleme formunun gerçek hayatta birbirine girmiş olduğunu belirtir. Fuller açıklamada kolaylık sağlamak için bunların ideal tiplerinin özelliklerini ortaya koyar.111Ayrıca Rundle da idari emir ve hukuk arasındaki ayrımı abartmamak gerektiğini, zira  Fuller a  göre  hukukun  varlığının  bir  derece  meselesi  olduğunu belirtir.112 İkisi arasındaki farkı belirtmeden önce, bu iki sosyal düzenleme formu arasındaki benzer özellikler üzerinde durmak gerekmektedir. Buna göre hem hukuk hem idari emir, insan davranışını yönlendirmeyi ve kontrol etmeyi içine almaktadır. Her ikisi de otoriteye bağlılığa işaret etmektedir. İki sosyal düzenleme formunun da kullandığı terimler benzerdir; otorite, kontrol, yetki, itaat, rıza gösterme, meşruiyet gibi.113 Bununla birlikte Fuller a göre ikisi arasındaki  farklar  şu  şekildedir:   hukukun  en  temel  karakteristiği genelliğinde yatmaktadır. 114 Bunun anlamı hukukun genel kurallar koyması veya hukukun genel kurallar aracılığıyla yönetimle ilgili olmasıdır. Buna karşılık idari emir spesifik emirlerle  (directives) ilerlemektedir:  Burada bunu yap   A, B ile yer değiştirsin.   Yarın sekiz buçukta raporu hazır et gibi. 115  Ayrıca,  emirler  (directives)  üst  tarafından  belirlenen  bir  amaca hizmet etmek için  ast  tarafından uygulanmaktadır. Buna karşılık hukuka bağlı  vatandaş,  kanun  koyucu  tarafından  belirlenen  amaçlara  hizmet amacıyla  kuralları  uygulamamakta,  fakat  kendi  ilişkileri  (affair) çerçevesinde kuralları takip etmektedir. İdari emirler, ast/üst arasında ve tamamlayıcı bir şekilde  ast ın üçüncü kişilerle ilişkileri arasındadır. Bir hukuk  sisteminin  kuralları  ise  daha  çok  vatandaşların  birbirleriyle  ilişki kurmalarına, tamamlayıcı bir şekilde kurallardan kaynaklı olarak otoriteyle ilişki kurmalarına hizmet etmektedir. Fuller a göre ceza hukuku alanında bile  bu  böyledir.  Ceza  hukukunun  temel  fonksiyonu,  vatandaşların birbirleriyle  etkileşime  girebilmeleri için sağlam ve durağan  bir çerçeve yaratmaktır.116                                                  111 Fuller, 1969, s.208. 112 Rundle, 2012, s.137. 113 Fuller, 1969, s.207. 114 Fuller, 2001(a), s.254. 115 Fuller, 2001(a), s.254. 116 Fuller, 1969, s.207-208.   25Hukukun İç Ahlâkı                                                      AÜHFD, 64 (1) 2015: 1-35 Bununla  birlikte  Fuller  genellik  ilkesinin  idari  emirle  yönetim modelinde  de  kullanılabileceğinin  farkındadır.  Diğer  bir  ifadeyle   üst   ast ını genel kurallar aracılığıyla yönetebilir. Ancak bir sosyal düzenleme modeli  olarak  hukuktan  farklı  olarak  idari  emir  söz  konusu  olduğunda genellik ilkesi  üst  ün menfaati (expediency) gereği kabul edilmiştir.117 Diğer bir ifadeyle üst eğer genel kurallar aracılığıyla  ast la ilişki içinde ise bunun  nedeni,  her  seferinde  direktif  veya  emir  verme  zahmetinden kurtulmaktır.  Örneğin  ast/üst  ilişkisi  içinde  olan  iki  kitabevi  çalışanını düşünelim. Üst konumunda  olanın,  ast a her hafta raflardaki kitapların alfabetik sıraya uygun olup olmadığını kontrol etmesini söylemektense  her Pazartesi kitapların alfabetik sıraya uygunluğunu düzenle.  diye bir genel kural koyduğu varsayılsın. Fuller a göre buradaki genel kuralın hukukla yönetimden  farkı,  böyle  bir  genel  kuralın   üst ün  işini  kolaylaştırıyor oluşudur. Bunun anlamı,  üst ün genel kuraldan sapması halinde  ast ın şikayet etme hakkı olmamasıdır. Örneğin  üst  astına  bu hafta Çarşamba günü de kitapların alfabetik sıraya uygun olup olmadığını kontrol edeceksin  dediğinde,  ast ın  ama bu işi sadece Pazartesi yapıyordum  demeye hakkı yoktur.  Bu  durumda   üst ün  genel  kural  koymasının  tek  nedeni,  genel kuralla yönetimin kendisine sağladığı kolaylıktır. Bu nedenle  üst ün kendi koymuş olduğu genel kurala uyma yükümlülüğü de yoktur. Dolayısıyla idari emirde, genel kurallar koyulması,  üst ün menfaatleriyle ilgili olduğu için, sekizinci ilke, yani yayımlanan kural ile fiili uygulaması arasındaki uyum ilkesi de anlamını kaybetmektedir.  Fuller  bu  analizinin  neticesinde,  idari  emir  açısından  hukukun  iç ahlâkının sekiz ilkesinin, gerçekten etkililiğin ilkeleri olduğu ve buradaki ilişkinin tek  yönlü  olduğunu  dile  getirir.  Bu  ilkeler,  Fuller a  göre,   üst konumundaki  kişinin  amaçlarının  başarısını  sağlamaya  yönelik vasıtalar dır.118 Fuller a  göre  hukukun  en  karakteristik  özelliği  genel  kurallarla yönetime  dayanıyor oluşudur. İdari emir ise belirli emirlere, direktiflere dayanmaktadır. İdari emirde,  ast   üst ün belirli amaçlarını gerçekleştirmek için direktiflere uyuyordur. Bu doğrultuda emir veren  üst  verdiği emrin etkili bir şekilde gerçekleştirilmesini ve amaçladığı şeyin etkili bir şekilde                                                  117 Fuller, 1969, s.208. 118 Fuller, 1969, s.209.  26AÜHFD, 64 (1) 2015: 1-35                                                                                                    Akı gerçekleştirilmesini  istiyorsa  emirlerinin  açık,  tutarlı,  yerine  getirilebilir, yayımlanmış  olması  ve  birbiriyle  çelişmemesi  gerekmektedir.119  Ancak hukukla  ve  genel  kurallarla  yönetim  söz  konusu  olduğunda,  yöneten yönetilenin kuralları anlama kapasitesine ve özerkliğine saygı duymaktadır. Kişilerin  özerkliğine  saygı  duyularak,  kurallara  uygun  davranıp davranmamak kişilere bırakılmakta ve hukukla yönetim adına etkililikten taviz  verilmektedir.120  Dolayısıyla  hukukla  yönetimin  amacı  insan davranışına  yön  vermektir,  kanun  koyucunun  kişisel  çıkarlarını gerçekleştirmek değil. Bu nedenle hukukla yönetim söz konusu olduğunda bu ilkeler etkililiğin ilkeleri olarak görülmemelidir. Dahası Sururi Aktaş ın da  vurguladığı  gibi,  eğer  kanun  koyucular  amaçlarını  gerçekleştirmek istiyorlarsa, sekiz ilke bu amaçların etkili bir şekilde gerçekleştirilmesini engelliyor  olabilir.121  Ayrıca,  kanun  koyucu  kendi  amaçlarını gerçekleştirmeye çalıştığında, zaten artık hukukla yönetim değil, idari emirle yönetim  söz  konusudur.122  Örneğin,  kural  koyanların  amacı,  insan davranışını  kuralların  yönetimine  tabi  kılmaktansa,  muhaliflerden kurtulmaksa, bu amacı etkili bir şekilde gerçekleştirebilmek için geçmişe yürür kural çıkarabileceklerdir.  Fuller ı  eleştirenlerin  bir diğer  iddiası  ise  bu ilkelere  uygun  hukuk sistemlerinin, adil sistemler olmak zorunda olmadığı iddiasıdır.123 Fuller bu iddiaya  farklı  eserlerinde  cevap  vermeye  çalışmıştır.  Ancak  Fuller  bu sorunun onun teorisiyle ilgili olmadığı iddia etseydi, Hart ın ve diğerlerinin eleştirilerini bertaraf edebilirdi. Zira hukuki pozitivizmin iddia ettiği gibi hukukun iç ahlâkının sekiz ilkesine riayet eden ve aynı zamanda adaletsiz rejimler  olabilir.  Ancak  Fuller ın  temel  amacı  sekiz  ilkenin  nasıl adaletsizliklerin  önüne  geçebileceğini  açıklamak  değildir.124  Zira  Fuller açıkça  hukukun  iç  ahlâkı  ve  dış  ahlâkı  ayrımı  yapmaktadır.125   Hukuki                                                  119 Fuller, 1969, s.208. 120 Luban, 2008, s.112. 121 Aktaş, 2011, s.44-50 122 Nadler, s.32. 123 Hart, 1997, s.207; Dworkin, 1964-1965, s. 671,673. 124 Rundle, 2012, s.4. 125 Fuller, 1969, s.96. Hukukun dış ahlâkı da Fuller tarafından kullanılan bir terimdir. Fuller bu terimle hukuk kurallarının içeriğine yönelik bir ahlâk kavramı ileri sürmektedir. Diğer bir  ifadeyle   hukukun  dış  ahlâkı    maddi  anlamda  doğal  hukuk   kavramına  denk düşmektedir. Aktaş, 2011, s.10.    27Hukukun İç Ahlâkı                                                      AÜHFD, 64 (1) 2015: 1-35 ahlâkın  pek  çok  etik  meseleye  karşı  nötr  olduğunun  söylenebileceğini defalarca  gözlemledim.   126  cümlesindeki  ifadesi  de  çok  nettir.  Ayrıca Ronald Dworkin ve Marshall Cohen e yazdığı cevapta da düşünceleri çok açıktır:  Ben hiçbir zaman, hukukiliğin bütün taleplerine tamamıyla uyumlu vasıtalarla kötülüğü gerçekleştirmek, en azından bazı tür kötülükler, fikrinde mantıksal bir tutarsızlık olduğunu söylemedim… 127 Fuller, bu sözleriyle paralel bir şekilde hukukun iç ahlâkı, bir sosyal düzenleme modeli olarak hukukun kendine özgü bir ahlâkı olup olmadığı sorusuyla ilgilidir; hukuk kurallarının içeriğinin ahlâki niteliğiyle değil. Bu nedenle pozitivizmin bu eleştirisi ve Joseph Raz ın etkililik iddiaları Fuller ın teorisine zarar verir görünmemektedir.  Sonuç Yukarıda belirtildiği gibi Fuller ın teorisi o dönemde yoğun eleştirilere maruz kalmıştır. Bunun da ötesinde, Fuller ı asıl rahatsız eden hukukun iç ahlâk ının olup olmadığı sorusunun, sekiz ilkenin etkililiğin ilkeleri olup olmadığı  sorusuna  indirgenmesidir.  Fuller  hukukun  iç  ahlâk  ına  ilişkin görüşlerinin etkililik meselesine indirgenmesinin sorumlusu da olarak da Hart ı  görmektedir.129  Fuller ın  teorisi  her  ne  kadar  yaşandığı  dönemde anlaşılmamışsa da bugün bu durumun değiştiği ileri sürülebilir. Yukarıda                                                  126 Fuller, 1969, s.162. 127 Fuller, 1965, s.664. 128 Raz, s.163. 129 Rundle, 2012, s.107. 130  Girişte  de  belirtildiği  gibi  Fuller  hukuk  kurallarının  içeriğinin  ahlâk  i  niteliğiyle ilgilenmemektedir. Ancak Hart ın bu ilkelerin etkili bir kanun koymanın ilkeleri olduğu iddiası, tartışmayı hukuk kurallarının içeriğinin ahlâk i niteliğine çekmiştir. Dolayısıyla Fuller ın teorisi veya tartışmak istedikleri Hart ın eleştirilerinin gölgesinde kalmıştır. Rundle, 2012, s.3-4. Rundle a göre Fuller ın kendisi de Hart ın gündemine saplanmıştır. Fuller A Reply to Critics te, Hart ın gündeminden kaçmayı başarmışsa da, Rundle a göre bu cevap geç kalmış ve yetersiz bir cevaptır. Rundle, 2012, s.5. Hart ve Fuller arasındaki tartışma için bkz: H.L.A Hart  Positivism and the Separation of Law and Morals,  Harvard Law Review, C.71, S.4, 1958, s.593-629; Lon L. Fuller,  Positivism and Fidelity to Law: A Reply to Prof. Hart, Harvard Law Review, C.71, S.4, 1958, s.630-672. Fuller ın 1958 deki eleştirilerine karşılık, Hart 1961 de yazmış olduğu kitabında, Fuller a birkaç cümleyle cevap verir: H.L.A Hart, The Concept of Law, Clarendon Press, Oxford, 1961, s.202. Hart ın The Concept of Law daki iddiasına karşılık, FullerThe Morality of Law ın birinci baskısında The Concept of Law a bir bölüm ayırır: Fuller, The Morality of Law, s.133-145. The Morality of Law ın basılmasının ardından, Hart, The Morality of Law a bir kitap eleştirisi yazar. H.L.A Hart ‘Lon L. Fuller: The Morality of Law, 78 Harvard Law Review,  1965,  1281-1286.Tekrar  basım,  H.L.A.  Hart  Essays  in  Jurisprudence  and 28AÜHFD, 64 (1) 2015: 1-35                                                                                                    Akı görüşleri aktarılan Winston, Luban, Waldron, Rundle gibi isimler hukukun iç  ahlâk  ını  Hart ın  eleştirilerinden  sıyırarak  anlamlandırmışlardır.  Bu çalışmada da hukukun iç ahlâk ı veya Fuller ın ileri sürdüğü hukuk-ahlâk ilişkisi  Hart ın  iddiaları  çerçevesinde  yani  bu  ilkelerin  etkili  bir  kanun koymanın ilkeleri olup olmadığı sorusu çerçevesinde ele alınmamıştır.  Bu doğrultuda da Fuller ın ileri sürdüğü hukukun kendine özgü bir ahlâkı  olduğu  iddiası,  yukarıda  belirtildiği  gibi,  hukuk  kurallarının içeriğinden bağımsız olarak, vatandaşın veya hukuki öznenin özerk bir birey olmasıyla, kanun koyucu ve vatandaş arasındaki karşılıklı ilişkiyle ve sekiz ilkenin vatandaşı korku, tedirginlikten uzak tutmasıyla açıklanabilir. Ancak sekiz ilkenin vatandaşı korku, tedirginlikten uzak tutması iddiasına karşılık, bu tür rejimlerde muhaliflerin kaybolmalarının insan hakkı ihlali olduğu ve Fuller ın  teorisine  gerek  kalmadığı  iddia  edilebilir.131  Ancak,  Colleen Murphy nin de belirttiği gibi, Fuller ın teorisi aracılığıyla yetkililerin hukuk sisteminin  kurumsal  işleyişindeki  etkisine  ve  hukuk  kurumu  aracılığıyla oluşturulan yetkililer ve vatandaşlar arasındaki ilişkiye odaklanılabilir.132 Bu doğrultuda, Fuller ın teorisi, ahlâk dışı olan bazı davranışların, neden aynı zamanda hükümet ve vatandaş arasındaki sağlıklı bir ilişkinin temeli olan güven  ve  karşılıklılığa  zarar  verdiğini  göstermektedir.133  Bu  tür  ihlaller, ahlâki olarak problemlidir; çünkü vatandaşın ve yetkililerin birbirine karşı olan  ahlâki  sorumluluklarının  temelinde  yer  alan  karşılıklılığı  ortadan kaldırır. Murphy e  göre, bu ihlaller bireylerin hak ihlallerinin yanı sıra, kendine özgü ahlâki bir yanlışlıktır da.134 Bu çerçevede Fuller ın görüşleri, yetkililer ve vatandaş arasındaki karşılılıkta var olan yükümlülüklerin ahlâki temelinin görülmesini sağlar.135                                                                                                                    Philosophy, Clarendon Press, 1983, s.343-364. The Morality of Law ın aldığı eleştiriler karşısında, Fuller The Morality of Law ın ikinci baskısına A Reply to Criticis bölümünü ekler. Bu bölümde onu eleştirenlere olan eleştirilerini dile getirir: Fuller, The Morality of Law,  A Reply to Critics , s.187-242. 1958 yılında başlamış olan tartışma böylelikle 1969 yılında son bulur. 131  Dworkin in Fuller a karşı ileri sürdüğü eleştirilerden bir tanesi de budur. Dworkin, 19641965, s.674-675; Dworkin, 1965, s.636. 132 Murphy, s.245. 133 Murphy, s.245. 134 Murphy, s.246. 135 Murphy, s.249.    29Hukukun İç Ahlâkı                                                      AÜHFD, 64 (1) 2015: 1-35 Ancak bu iddialar sekiz ilkenin etik ilkeler olduğunu iddia etmek için yeterli  midir?  Yukarıda  belirtildiği  gibi,  etik  ilkeler  insanın  değerinin bilgisinden  türetilen  ilkelerdir.   İnsanın  değerinin  bilgisine  dayanarak çıkarılan ilkeler, reductio ad absurdum yoluyla temellendirilebilir. Böyle bir ilkenin bize bildirdiği ise şöyle bir şeydir: bir insan şöyle şöyle davranırsa (ya  da  davranmazsa),  insanın  yapısal  olanaklarının  gerçekleşmesini engellememesi olasılığı artar.  Tersini yapmak, gerçekten bu olanakların gerçekleşmesini  engelliyorsa  -bu  gösterilebiliyorsa-,  ilkenin  gerekliliği temellendirilmiş  olur. 136  O  halde  kanun  koyucular  sekiz  ilkeye  uygun davranıyorsa,  insanın  yapısal  olanaklarının  gerçekleşmesinin engellenmemesi olasılığı artmakta mıdır? Sekiz ilkeye riayet eden hukuk sistemlerinde  insanının  yapısal  olanaklarının  engellenmeme  olasılığının arttığı  ileri  sürülebilir.  Ancak  bunun  kavramsal  olarak  böyle  olması gerekmemektedir.  Daha  açık  bir  ifadeyle  kavramsal  olarak  sekiz  ilkeye riayet  eden  ve  insanın  yapısal  olanaklarını  engelleyen  hukuki  sistemler olabilir.  Dolayısıyla  yapısal  olanakları  engellememe  hususu,  hukuk kurallarının içeriğine yönelik ilkelerle ilgilidir, işkence yasağı yapmamak gerekir veya ırk ayrımı yapmamak gerekir gibi. Fuller ın ileri sürdüğü sekiz ilke ise kanun yapma sürecine ilişkin ilkelerdir. Ancak sekiz ilkenin insanın yapısal olanaklarının gelişimine hiçbir şekilde etki etmediğini iddia etmek doğru  değildir.  Zira  yukarıda  da  belirtildiği  gibi,  sekiz  ilke  aracılığıyla vatandaşlar hukuk sisteminin bir parçası haline gelmektedir. Daha da ötesi sekiz ilke aracılığıyla belirsizlikten ve kaostan uzak bir düzen kurulmaya çalışılmaktadır. Böyle bir hukuki düzen öngörülebilir bir düzendendir ve kanun  koyucuların  keyfi  davranışlarının  önüne  geçmektedir.  Dahası öngörülebilir bir ortam adaletsiz kanunların eleştirilmesi ve değiştirilmesi için  de  bir  zemin  hazırlamaktadır.137  Bütün  bu  iddiaların  yanında,  adil, haklara saygılı, geliri eşit bir biçimde dağıtmayı hedefleyen rejimlerin de, hedefledikleri bu  iyi  amaçları sekiz ilkeye uygun bir şekilde inşa edilmiş hukuk sistemleri aracılığıyla gerçekleştirebilecekleri unutulmamalıdır.138 Netice  olarak,  etik  ilkeler  insanın  yapısal  olanaklarını gerçekleştirmesiyle ilgili ilkeler ise, Fuller ın ileri sürdüğü ilkeler etik ilkeler olarak  kabul  edilebilecek  midir?  Sekiz  ilke  kişinin  özerkliğine  saygı                                                  136 Kuçuradi, 2009, s.179. 137 Bu konuda bkz. Decent, s.573. 138 Waldron, 1994, s.266. 30AÜHFD, 64 (1) 2015: 1-35                                                                                                    Akı göstererek, öngörülebilir bir çerçeve sağlayarak, vatandaşı korku ve kaostan uzak  tutarak,  aslında  insanın  yapısal  olanaklarını  geliştirmesine  dolaylı yoldan hizmet ettiği için etik ilkelerle ilişkili ilkeler olarak kabul edilebilir. Ayrıca sekiz ilkenin, insanın yapısal olanaklarının gelişimine hizmet eden bir hukuk sistemi oluşturmak için etik ilkeler yanında gerekli ilkeler olduğu da unutulmamalıdır.                        31Hukukun İç Ahlâkı                                                      AÜHFD, 64 (1) 2015: 1-35",
     "Kaynakça": "Aktaş, Sururi.(2004). Modern Doğal Hukuk Bağlamında John Finnish in Hukuk Teorisi. Atatürk Üniversitesi Erzincan Hukuk Fakültesi Dergisi, 8(1-2), 3-22. Aktaş, Sururi. (2011).  Prosedürel Doğal Hukuk Lon L. Fuller in Hukuk Kavramı. İstanbul: XII Levha Yayınları. Bix, Brian H. (2004a). Doğal Hukuk: Modern Gelenek. çev. Ertuğrul Uzun, Dokuz Eylül Üniversitesi Hukuk Fakültesi, 6(2), 291-343. Bix,  Brian.  (2004b).  Jurisprudence  Theory  and  Context.  Durham  Nort Carolina: Carolina Academic Press. Ceylan, Şule Şahin. (2014). H.L.A Hart ın Hukuk Kavramı. İstanbul: XII Levha Yayıncılık.  Decent, Evan Fox. (2008). Is The Rule of Law Really Indiffernt to Human Rights?. Law and Philosophy, 27(6), 533-581. Dworkin,  Ronald.  (1964-1965).  Philosophy,  Morality,  And  LawObservations Prompted by Professor Fuller s Novel Claim. University of Pennsylvania Law Review, 113, 668-690. Dworkin, Ronald. (1965). The Elusive  Morality of Law.  Villanova  Law Review, 10, 631-639. Fuller, Lon L. (1958). Positivism and Fidelity to Law - A Reply to Professor Hart. Harvard Law Review, 71(4), 630-672. Fuller, Lon L. (1965). A Reply to Professors Cohen and Dworkin. Villanova Law Review, 10(4), 655-666. Fuller, Lon L. (1969). The Morality of Law. New Haven: Yale University Press. Fuller, Lon L. (2001a). Human Interaction and the Law. Principles of Social Order  Selected  Essays  of  Lon.  L.  Fuller.  Ed.  Kenneth  I  Winston, Oxford-Portland Oregon: Hart Publishing, 231- 266. Fuller, Lon L. (2001b). Means and Ends. Principles of Social Order Selected Essays  of  Lon.  L.  Fuller.  Ed.  Kenneth  I Winston,  Oxford-Portland Oregon: Hart Publishing, 61-78. 32AÜHFD, 64 (1) 2015: 1-35                                                                                                    Akı Hart, H.L.A. (1958). Positivism and the Separation of Law and Morals. Harvard Law Review, 71(4), 593-629. Hart,  H.L.A.  (1983).  Lon  L.  Fuller:  The  Morality  of  Law.  Essays  in Jurisprudence and Philosophy. Clarendon Press, 343-364. Hart, H.L.A. (1997). The Concept of Law. Oxford University Press. Hart, H.L.A. (2011). Hukuk, Özgürlük ve Ahlâk. Ankara: Dost Kitabevi. Himma, Kennneth Einar. (2010). Hukukun Ahlâki Kriterleri Kapsayıcı ve Dışlayıcı  Pozitivistler Arasındaki Tartışma.  çev.  Saim  Üye, Ankara: Bilge Su Yayınları. Keyman,  Selahaddin.  (1978).  Hukuki  Pozitivizm.  Ankara  Üniversitesi Hukuk Fakültesi Dergisi, 35(1-5), 17-55. Keyman, Selahaddin. (1998). Tabii Hukuk Doktrinin Epistemolojik Tahlili. Ankara Üniversitesi Hukuk Fakültesi Dergisi, 47(1-4), 17-36. Kramer, Matthew. (1999). Scrupulousness without Scruples: a Critique of Lon Fuller and his Defenders. In Defense of Legal Positivism. Oxford University Press, 37-77. Kuçuradi,  Ioanna.  (1988).  Ahlâk  ve  Kavramları.  Uludağ  Konuşmaları. Ankara: Türkiye Felsefe Kurumu Yayını, 20-36. Kuçuradi,  Ioanna.  (1998).  İnsan  ve  Değerleri. Ankara:  Türkiye  Felsefe Kurumu Yayını. Kuçuradi, Ioanna. (2006). Etik. Ankara: Türkiye Felsefe Kurumu Yayınları. Kuçuradi, Ioanna. (2007). İnsan Onuru Kavramı ve İnsan Hakları, İnsan Hakları  Kavramları  ve  Sorunları. Ankara: Türkiye  Felsefe  Kurumu Yayını, 69-76. Kuçuradi, Ioanna. (2009). Normların Bilimsel Temellendirilebilirliği. Çağın Olayları Arasında. Ankara: Türkiye Felsefe Kurumu Yayınları, 175182. Luban,  David.(2008).  Legal  Ethics  and  Human  Dignity.  Cambridge University Press.   33Hukukun İç Ahlâkı                                                      AÜHFD, 64 (1) 2015: 1-35 Luban, David. (2010).The Rule of Law and Human Dignity: Re-examining Fuller s Canons. Hague Journal on the Rule of Law, (2), 29-47. Murphy, Colleen. (2005). Lon Fuller and The Moral Value of Rule of Law. Law and Philosophy, 24(3), 239-262. Murphy, Jeffrie G., Coleman, Jules. (1990). Philosophy of Law. Oxford: Westview Press. Nadler, Jeniffer. (2008). Hart, Fuller and the Connection Between Law and Justice. Law and Philosophy, 27(1), 1-34. Raz, Joseph. (2008). Hukuk Devleti ve Erdemi. çev. Bilal Canatan, Hukuk Devleti, Hukuki Bir İlke Siyasi Bir İdeal. Editörler: Ali Rıza Çoban, Bilal Canatan, Adnan Küçük, Ankara: Adres Yayınları, 149-166. Rundle, Kristen. (2012). Forms Liberate. Oxford: Hart Publishing.  Rundle, Kristen. (2013). Form and Agency in Raz s Legal Positivism. Law and Philosophy, 32(6), 767-791. Summers, Robert S. (1965). Professor Fuller on Morality and Law. Journal of Legal Education, 18(1), 1-27. Summers, Robert S. (1984). Lon L. Fuller. Edward Arnold. Surlu, Aydan Ömür.(2008). H.L.A Hart ta Tanıma Kuralı. Yayımlanmamış Doktora Tezi. Tepe, Harun. (1998). Bir Felsefe Dalı Olarak Etik: ‘Etik  Kavramı, Tarihçesi ve Günümüzde Etik. Doğu Batı, S.4, Ağustos, Eylül, Ekim, 11-28. Tepe, Harun. (2011). Etik ve Metaetik. Ankara: Türkiye Felsefe Kurumu. Uslu,  Cennet.  (2009).  Doğal  Hukuk  ve  Doğal  Haklar. Ankara:  Liberte Yayınları. Uygur, Gülriz. (2003). Hukuki Pozitivizmin Değişen Yüzü Mü?. Ankara Üniversitesi Hukuk Fakültesi Dergisi, 52(3), 145-176. Uygur, Gülriz. (2006). Hukuk, Etik ve İlkeler. Ankara: Siyasal Kitabevi. Uygur, Gülriz. (2014). Ioanna Kuçuradi nin Görüşlerinden Hareketle Hukuk Normlarının Türetilmesindeki Temel Problem: Etik Mi? Ahlâk Mı?. Ioanna  Kuçuradi  Çağın  Olayları  Arasında.  Ioanna  Kuçuradi ye 34AÜHFD, 64 (1) 2015: 1-35                                                                                                    Akı Armağan. Editörler: Betül Çotuksöken, Gülriz Uygur, Hülya Şimga, İstanbul: Tarihçi Kitabevi, 163-172. Uzun,  Ertuğrul.  (2005).  Ahlâksızlığın  Cezalandırılması:  Devlin-Hart Tartışması. Eskişehir Barosu Dergisi, S.6, 52-71. Van der Burg, Wibren. (2014a).  The Dynamics of Law and Morality A Pluralist Account of Legal Interactionism. Ashgate. Van der Burg, Wibren. (2014b) Lon L. Fuller dan Yasa Koyuculara Dersler. çev. E. İrem Akı, Hukuk Kuramı, 1(3), 58-64. Wacks, Raywond. (2013). Hukuk Felsefesine Kısa Bir Giriş. çev. Engin Arıkan, İstanbul: Tekin Yayınevi. Waldron, Jeremy. (1994). Why Law- Efficacy, Freedom, or Fidelity. Law and Philosophy, Special Issue on Lon L. Fuller,13(3), 259-284. Waldron, Jeremy. (2008). The Concept and The Rule of Law. Georgia Law Review, 1(43), 1-61. Waldron, Jeremy. (2012). How Law Protects Dignity. The Cambridge Law Journal, 71(1), 220-222. Winston,  Kenneth  I.  (2001).  Introduction.  Principles  of  Social  Order Selected Essays of Lon. L. Fuller. Editör: Kenneth I Winston, OxfordPortland Oregon: Hart Publishing, 25-58. Yücel,  Mustafa  Tören.  (2005).  Hukuk  Felsefesi. Ankara:  Başkent  Klişe Matbaası.           35Hukukun İç Ahlâkı                                                      AÜHFD, 64 (1) 2015: 1-35                  36"
}