{
     "Tip": "Makale",
     "Dergi İsmi": "",
     "Üniversite İsmi": "Ankara Üniversitesi",
     "Gün": "",
     "Ay": "",
     "Yıl": "2018",
     "Cilt": "67",
     "Sayı": "2",
     "Başlık": "HUKUK KAVRAMININ ANALİZİ",
     "Title": "Analysis of the Concept of Law",
     "Yazar İsmi": [
          "Sururi AKTAŞ"
     ],
     "Danışman İsmi": "",
     "Anahtar Kelimeler": [
          "Hukuk bilimi",
          "hukuk dogmatiği",
          "hukuk felsefesi",
          "hukuk sosyolojisi",
          "genel hukuk teorisi"
     ],
     "Keywords": [
          "Jurisprudence",
          "legal dogmatics",
          "legal philosophy",
          "sociology of law",
          "general theory of law"
     ],
     "Özet": "Bu  makale,  hukuk  kavramını  çeşitli  açılardan  analiz/tahlil  etmeyi amaçlamaktadır. Özellikle bu çalışmada hukuk olgusu ve kavramının bilişsel faaliyetlere nasıl konu olduğu, hukuk felsefesi, hukuk sosyolojisi ve genel hukuk teorisi gibi farklı disiplinlerin yöntemleri açısından nasıl kavrandığı incelenmektedir.  Sonuçta,  hukuk  olgusu  ve  kavramının  doğru kavranabilmesi  için  değişik  açılardan  incelenmesi  gerektiği vurgulanmaktadır.",
     "Abstract": "This article aims at analyzing the concept of law in terms of different perspectives. Especially it analyzes that how the concept and fenomenon of law has been the subject of cognitive activities and studied in terms of the methodologies of different disciplines such as legal philosophy, sociology of law and general theory of law. As a result, it emphasizes that law ought to be studied from different perspectives in order to comprehend the fenomenon of law truly. Key  words:  Jurisprudence,    legal  dogmatics,  legal  philosophy, sociology of law, general theory of law.                                                          Makale Geliş Tarihi 27.02.2018, Kabul Tarihi 06.07.2018  Prof. Dr., Erzincan Üniversitesi Hukuk Fakültesi Hukuk Felsefesi ve Sosyolojisi Anabilim DalıSururi Aktaş                                                            Ankara Üni. Hukuk Fak. Dergisi, 67 (2) 2018: 227-252 1- Giriş: Hukukun Kavranmasında Yöntem (Metod) Hukuk  kavramını  ele  alan  temel  disiplin  ve  teorilerin,  analiz  ve incelemelerinde  benimsedikleri  yol  (usul)  ve  bakış  açılarını,  hukukun kavranmasına ilişkin yöntem (metod) olarak nitelendirmekteyiz. Örneğin,  hukuk  felsefesi   genel  olarak  normatif  bir  yöntem  benimseyerek  ideal hukuka yönelirken;  genel hukuk teorisi , betimleyici bir yöntemle hukuk olgusunun ortak kavramlarının ne olduklarını sadece betimlemektedir; hukuk sosyolojisi  de  açıklayıcı  ve  betimleyici  bir  yöntemle  hukuksal  olay  ve olguları iyi-kötü (adil - gayri adil) değerlendirmesi yapmadan betimleyip açıklamaktadır.  Genel  hukuk  teorisi  ile  hukuk  sosyolojisinin  yöntemini, hukuka ilişkin daha genel bir yöntem olarak pozitivist yöntem içerisinde görebiliriz.  Hukuk  teorileri  ve  disiplinlerinin  hukuk  kavramının incelenmesinde benimsedikleri usul ve yöntem, nasıl bir hukuk anlayışının ortaya  çıkmasında  belirleyici  olmaktadır.  Dolaysıyla  hukuk  kavramının incelenmesi,  tek  bir  bakış  açısıyla  veya  tek  bir  yöntemle sınırlandırılmamalıdır.  Bu,  hukuk  kavramının  çok  yönlülüğünün  bir gereğidir. Hukukun  değişik  cephe  ve  boyutları  olması  dolayısıyla  çeşitli yöntemler açısından incelenmeye konu olmaktadır. Bu bağlamda hukukun temel disiplinlere nasıl konu olduğu ve bu disiplinlerin yöntemi açısından hukuk kavramı ve olgusuna nasıl yaklaşıldığı analiz edilmelidir. Böyle bir gereklilik,  hukukun,  hukuk  sosyolojisi  gibi  birçok  alt  disiplinin  konusu olması sonucunu doğurmaktadır. Her disiplinin yöntemi açısından hukuk, farklı açılardan kavranmaya çalışılmaktadır. Hukuk öğrencileri veya hukuk öğrenmeye meraklı olanlar, hukuka genellikle tek bakış açısıyla yaklaşmaya çalışmaktadırlar. Bu bakış açısı ise çoğunlukla dogmatik hukuk disiplinin yöntemi olarak belirleyici olmaktadır. Pozitif hukuk kuralları altında yatan etik  ilkeler,  kuralların  ortaya  çıkmasında  etkili  olan  toplumsal  gerçekler (olgular) genellikle bu bakış açısına girememektedir. Hukuk kavramının tam anlamıyla kavranabilmesi değişik bakış açılarına konu olabilmesine bağlıdır. Belki,  kısa  bir  hukuk  eğitimi  sürecinde  bu  tam  anlamıyla  mümkün olamayabilir.  Ancak  hiç  değilse  hukukun  değişik  yöntem  ve  disiplinler açısından tahlil edilmesi gereği konusunda farkındalık oluşturmak yararlı olabilir. 2- Hukuk Kavramı ve Olgusunun Çeşitli Açılardan Kavranması Gereği Hukuki düşüncemizi zenginleştirmek, hukuksal kurum ve kavramları doğru kavramak için hukuku değişik disiplinlerin konusu haline getirmemiz önem arz etmektedir. Özellikle biçimsel mantık açısından doğru hukuki akıl 228Ankara Üni. Hukuk Fak. Dergisi, 67 (2) 2018: 227-252                                        Hukuk Kavramının Analizi  yürütme (legal reasoning) kabiliyetine sahip olmak için, doğru ve geçerli düşünme  yöntemlerini  (formel/biçimsel  mantığı)  hukuk  eğitiminin  bir parçası  haline  dönüştürmemiz  gerekir.  Mantık,  İslam  bilimlerinde derinlemesine okutulagelmiş bir disiplindir. Mantık biliminin diğer sosyal bilimlerle  ilişkilendirilmesi  gerekir.  Mantık,  sadece  felsefe  öğrencilerine okutulacak,  diğer  bilimlerden  soyutlanmış  ve  kendi  amacını  kendinde taşıyan bir disiplin değildir. Mantık doğru düşünmenin ilkelerini araştırır ve diğer bilimler için bir araç niteliğini taşır. Dil, gramer ve mantık alet ilmi olarak  bilimlerin  vazgeçilmez  müfredatını  oluşturmaktadır.  Mantık  ve felsefenin başka bilimler ve disiplinler için kaynaklık etmesi gerekir. Ama ne yazık ki, Türkiye de sosyal bilimlerdeki felsefe, mantık ve sosyoloji gibi temel  disiplin  ve  bilimler  kendi  alanlarına  çekilmiş,    hukuk  gibi  diğer bilimler için araç (alet) olma niteliklerini kaybetmiştir. Halbuki, bu gibi temel bilimler, hukuk, iktisat gibi diğer bilimleri  desteklemeleri gerekir. Kısaca  disiplinlerarası  geçişkenliğin  sağlanması  gerekir.  Kantorowicz  ve Patterson ın belirttiği gibi  hukuk bilimi, hukuk ve bilim dışındaki unsurların yardımı olmaksızın işe yaramaz . Bu ünlü yazarların cümlesinden, hukuk biliminin,  pozitif  hukuk  bilgisiyle  sınırlı  olmadığını  ve  hukukun  sadece bilimsel  (betimleyici  veya  açıklayıcı)  bir  açıdan  ele  alınmasının  eksik olacağını anlayabiliriz.  Posner, hukukun özerk bir disiplin olduğu ve hukuk öğrencilerinin de sadece hukuk alanıyla ilgilenmeleri gerektiğine ilişkin düşüncenin ideolojik bir anlayışın ürünü olduğunu söyler. Yazara göre,  İngiltere de yargıçlar kendi kararlarına Kraliyetin müdahale etmesini engellemek için, hukukçular da  hukuki  meselelerde  kendi  tekelliklerini  korumak  için  bu  ideolojik düşünceye  başvurmuşlardır.  Yine  Posner in yaptığı  tespite  göre,  hukuki bilginin çıktığı kaynağın yargısal kararlar olduğu, hukuk eğitiminin de bu kararların öğrenilmesi ve karşılaştırılmasıyla ilgili olduğuna dair düşünceyi akademiye  getiren  kişi,  Harvard  Hukuk  Mektebinin/Fakültesinin  eski dekanlarından  Cristopher  Columbus  Langdell  (1826-1906)    olmuştur. Posner, hukuk teorisiyle kastettiği şeyin  geleneksel mesleki yeterlilik bilgisi olmadığını, mesleğin dışından, bilimsel ve beşeri araştırma yöntemlerini kullanarak hukuk sistemine ilişkin bilginin genişletilmesi olduğunu  belirtir.                                                             1   Kantorowicz,  Herman  U./Patterson,  W.,   Legal  Science--A  Summary  of  Its Methodology , Columbia Law Review,Vol. 28, No. 6 (Jun., 1928), s. 707, pp. 679-707. 2   Posner, Richard A.,  The Decline of Law as an Autonomous Discipline: 1962-1987 , Harvard Law Review  (1986-1987),  Vol. 100, s. 762,  pp. 761-780. 3   Posner, s. 761. 4   Posner, s. 761. 5   Posner, s. 779.   229Sururi Aktaş                                                            Ankara Üni. Hukuk Fak. Dergisi, 67 (2) 2018: 227-252 Hukukun  temeli,  genel  olarak  felsefi,  sosyolojik  ve  akli/mantıki boyutlara  sahip  olduğu  için,  bütün  bu  boyutların  gerektirdiği  bilişsel analizlere tabi tutulması gerekir. Aksi takdirde hukuk olgusu ve kavramı eksik anlaşılmış olur. Bu genel analizlerde iktisat, psikoloji ve tarih gibi diğer bilimlerden/disiplinlerden de yararlanmak gerekir. Örneğin doğru/adil bir hukuk kavramı için felsefi analiz yapılırken iktisat bilimi ve tarihinin verileri göz ardı edilemez. Mallara ve diğer maddi değerlere sahip olma ile ilgili adalet ilkeleri konusundaki tartışmalarda, iktisadi analizlerin dikkate alınması önem arz eder. Felsefi analiz olarak ahlak felsefesine girilirken, bir taraftan beşeri medeniyetin getirdiği ahlaki birikim, diğer taraftan iktisat felsefesi ihmal edilmemelidir. 3- Hukukun Kavranmasına Yönelik Bilişsel Çabaların Tasnifleri Hukuk bilimi/ilmi (jurisprudence) dendiğinde kastedilen şey, tamamen doğa bilimlerinde olduğu gibi dar anlamda   bilim  (science) değildir. Doğa bilimleri, deneysel olarak doğal fenomenler (olgular) arasındaki nedensel ilişkiyi  tespit  etmeye  veya  doğal  kanunlarla  doğal  olayları  açıklamaya çalışır. Naturalist (pozitivist) sosyoloji,  hukuk sosyolojisi  alt disiplini adı altında  hukuk  olgusu  ve  kavramına  doğal/pozitif  bilimlerin  yöntemiyle yaklaşsa da, hukuk bilimi, hukuk sosyolojisiyle tükenmediği için daha geniş bir inceleme araştırma alanına sahiptir. Hukuk sosyolojisi dışında, Hans Kelsen  ve  Hart  gibi  pozitivistler  hukuk  kavramına  pozitif  bir  yöntemle yaklaşmaya  çalışmışlardır.  Dolayısıyla  hukuk  sosyolojisi  dışında  hukuku pozitif yöntemle analiz etmeye çalışanlar,  genel hukuk teorisi  biçiminde eserler kaleme alan bazı hukuki pozitivistler olmuştur.                                                              6   Bu çalışmada  doğru/adil hukuk  tanımlamasındaki  doğru  sıfatı,  adil  sıfatı ile birlikte,  iyi hukuk  ya da  ideal hukuk u (de lege ferenda yı) anlatmak için kullanıldı.  Tartışılan konu hukuk bilimi olduğu için,  adil hukuk kavramı  yanında,  doğru  sıfatı da kullanıldı. Doğru hukuku kavramının,  iyi hukuk  ya da  ideal  hukuk  olarak adalete hizmet edebileceği telakki edildi. ( Doğru hukuk  kavramı için Bkz. Ökçesiz, Hayrettin,  Doğru Hukukun Bilgisi , Hukuk Felsefesi ve Sosyolojisi Arkivi (HFSA), 8. Kitap, Haz. Hayrettin Ökçesiz, İstanbul Barosu Yayını, İstanbul 2003, s. 120-135; Uygur, Gülriz, Hukuk, Etik ve İlkeler, Siyasal Kitabevi, Ankara 2006, s. 75 vd). 7   Troper, hukukun bilim olup olmayacağını, hukuk ve bilim sözcüklerine yükleyeceğimiz anlama bağlı olduğunu söyler. Yazara göre hukuku bir bilim olarak kabul etmesek de,  hukuk tan farklılaşmış ve hukuku konu olarak tanımlaya çalışan bir bilimin varlığı müzakere edilebilir. (Troper, Michel, Hukuk Felsefesi, Çev. Işık Ergüden, Dost Yayını, Ankara 2011, s. 31). Troper, bu bağlamda hukuku tanımlamayı nesnesi haline getiren hukuk biliminin, değerlendirici bir yönteme başvurmadan hukuku değerlerin toplamı olarak incelemesi halinde bilişsellikle uyuştuğu gibi, hukuku bir değerler toplamı olarak değil de insan iradesinin va z ettiği kurallar toplamı olarak ele alıp incelerse, bu sefer de yine etiğin bilinemeyeceğine ilişkin bilişsellik karşıtlığıyla uyuşabileceğini söyler.(Troper, s. 32). 8   Kelsen in yazdığı ve aşağıda atıf yaptığımız eserler genelde bu niteliktedir.  230Ankara Üni. Hukuk Fak. Dergisi, 67 (2) 2018: 227-252                                        Hukuk Kavramının Analizi  Kelsen  hukuk  biliminin  konusu  olarak  hukuk  normlarını göstermektedir. Kelsen, eğer beşeri ilişkiler hukuk normları tarafından inşa edilirse,  bunların  da  hukuk  biliminin  konusunu  oluşturacağını söylemektedir.  Bu bağlamda Kelsen hukuk bilimini, normatif hukuk bilimi (normative  jurisprudence)  ve  sosyolojik  hukuk  bilimi  (sociological jurisprudence) diye ikiye ayırmaktadır. Kelsen in normatif hukuk bilimi dediği,  hukuk  normlarını  konu  edinen  saf  hukuk  teorisidir.  Başka  bir anlatımla Kelsen de normların bilinmesi, saf hukuk teorisinin ve dolayısıyla normatif  hukuk  biliminin  konusu  oluşturur.  Aşağıda  göreceğimiz  gibi normatif hukuk bilimi tanımlaması daha çok, hukuku, etik değerler açısından kavramaya çalışan değerlendirici hukuk disiplinleri ve çoğunlukla hukuk felsefesi için kullanılır. Oysa Kelsen in normatif hukuk bilimi, iyi ve adil hukuku  araştırmaya  dönük  değerlendirici  bir  disiplin  olmayıp,  tamamen betimleyici ve açıklayıcı niteliktedir. Kelsen,  saf hukuk teorisinin, pozitif bir  hukuk  teorisi,  genel  hukuk  teorisi  olduğu,  herhangi  bir  özel  hukuk düzeninin  sunumu  ve  yorumu  olmadığını   belirtir.    Analitik  hukuk biliminin önde gelen temsilcisi John Austin de  hukuk bilimi ni ifade etmek için  jurisprudence  kavramını  kullanarak,  bu  bilimin  konusunun  pozitif hukuk olduğunu söyler. Ünlü hukuk sosyologu Timasheff, hukukla ilgili entelektüel faaliyetler olarak, hukuk felsefesi, hukuk bilimi (jurisprudence) ve hukuk sosyolojisi şeklinde bir tasnife giderek, bu üç disiplin arasındaki ayrımın tarihsel bir                                                             9   Kelsen, Hans, General Theory of Law and State (Translated by Anders Wedberg), Third Printing 1949, (Orginally Camridge-Harvard University Press 1945), s. 70. 10  Kelsen, General Theory of Law…, s. 70. 11  Kelsen, Hans,  The Pure Theory of Law and Analytical Jurisprudence , Harvard Law Review, Vol. 55, No. 1. (Nov., 1941), s. 50,  pp. 44-70. 12  Bkz. Kelsen, The Pure Theory of Law and Analytical…, s. 50. 13  Kelsen, The Pure Theory of Law and Analytical…, s. 44; Bkz. Aral, Vecdi, Kelsen in Saf Hukuk  Teorisinin  Metodu  ve  Değeri,  İstanbul  Üniversitesi  Hukuk  Fakültesi  Yayını, İstanbul 1978, s. 11; s. 279; Işıktaç, Yasemin, Hukuk Felsefesi, Filiz Kitabevi, İstanbul 2004, s. 279; Mecleod, Ian, Legal Theory,  Published by Palgrave Macmillan 2nd Edition, 2003, s. 86. 14  Austin, John, The Province of Jurisprudence Determined, (Edited By Wilfrid E. Rumble), Cambridge University Press, 2001,  Lecture I, s. 18;  Bu esrin Türkçe çevirisi için bkz.Austin, John, Hukukun Belirlenmiş Alanı (Çev. Üker Yükselbaba-Saim Üye-Umut Koloş), 1. Baskı, Tekin Yayını 2015, s. 27; Vaquero, hukuk biliminin bazı belirsizlikler taşıdığı söylemekle beraber, bu bilimi,  hukuk alimlerinin gerçekleştirdiği faaliyetler ve bu faaliyetleri  yönlendiren  yöntemsel  faraziyeler   olarak  algıladığını  söylemektedir. (Vaquero, Alvaro Nunez,  Five Model of Legal Science , Translator: Ester González Bertrán, Journal for Constitutional Theory and Philosophy of Law / Revija za ustavno teorijo in filozofijo prava (REVUS), Klub Revus, 19, 2013, s. 56, pp. 53-81.   231Sururi Aktaş                                                            Ankara Üni. Hukuk Fak. Dergisi, 67 (2) 2018: 227-252 gerçek olmaktan çok bir postulat olduğunu söyler. Yazara göre bu üç disiplin birbiriyle bağlantılı olarak gelişmiştir. Timasheff, jurisprudence ın (hukuk  biliminin)  kapsamına,  belirli  normları  inceleyen,  yorumlayan  ve sınıflandıran disiplin olarak pozitif (analitik) hukuk bilimini (genel olarak dogmatik  hukuk  bilimi  olarak  adlandırılır),  normları  tarihsel  açıdan inceleyen tarihsel hukuk bilimini (genel olarak hukuk tarihi olarak bilinir), çeşitli ülke hukuklarını karşılaştıran mukayeseli hukuk bilimini ve hukukun zaman ve mekana göre değişmeyen biçimsel yanını inceleyen teorik hukuk bilimini (yaygın olarak genel hukuk teorisi olarak adlandırılır) dahil eder. Yazara göre hukuk sosyolojisi, insan davranışlarını nedensel ilişki içerisinde incelediği için, jurisprudence (hukuk bilimi) içinde değil de, onun yanında bir disiplin olarak durması gerekir. Çağıl,  hukuk  bilimini,  dar  anlamda  hukuk  bilimi  (teorisi)  ve  geniş anlamda hukuk bilimi olarak ikiye ayırmaktadır. Dar anlamda hukuk bilimi olarak genel hukuk teorisini gösterirken, geniş anlamda hukuk bilimi olarak da hukuk felsefesi, hukuk sosyolojisi ve hukuk tarihini sayar. Kantorowicz ve Patterson, hukuk bilimini, hukukun anlamının inşasına ilişkin olarak genel hukuk bilimi (genel hukuk teorisi gibi) ve özgül hukuk bilimi (Roma hukuku gibi)22; deneysel alanda hukukun gerçekliğine ilişkin olarak  hukuk  sosyolojisi  ve  hukuk  tarihi;  deontolojik  alanda  hukukun değerine  ilişkin  olarak  hukuk  felsefesi  ve  yasamaya  ilişkin  hukuk  bilimi (legislative jurisprudence) olarak sınıflarlar. Anlaşıldığı gibi Kantorowicz ve Patterson, hukukun yöneldiği değeri/değerleri konu edinen deontolojik hukuk incelemelerini de legal science olarak ifade ettikleri hukuk biliminin kapsamında görmektedirler. Dolayısıyla iyi hukuk ideali (le lege ferenda), deontolojik  bir  saha  olarak  hukuk  biliminin  kapsamında değerlendirilmiştir.                                                             15  Timasheff, Nicholas S., An Introduction to the Sosyology of Law (with a new introduction by Javier Trevino), 3th Printing, Transcantion Publishers, s. 29. 16  Timasheff, s. 29. 17  Timasheff, s. 24. 18  Timasheff, s. 26. 19  Timasheff, s. 27. 20  Çağıl, Orhan Münir, Hukuk Metodolojisi Dersleri, İkinci Tab, İstanbul Üniversitesi Hukuk Fakültesi Yayınları, İstanbul 1952, s. 143-144. 21  Çağıl, s. 143-144. 22  Kantorowicz/Patterson, s. 691. 23  Kantorowicz/Patterson, s. 691. 24  Kantorowicz/Patterson, s. 691. 25  Bkz. Kantorowicz/Patterson, s. 682-684. 232Ankara Üni. Hukuk Fak. Dergisi, 67 (2) 2018: 227-252                                        Hukuk Kavramının Analizi  Twining,  hukuk  bilimini  (jurisprudence),  normatif  hukuk  bilimi (normative jurisprudence), analitik hukuk bilimi (analytic jurisprudence) ve empirik/sosyolojik  hukuk  bilimi  (empirical/sociological  jurisprudence) olarak üçe ayırmayı uygun bulmaktadır. Yazarın analizine göre,  analitik hukuk bilimi kavramlar ve akıl yürütmeyi konu edinirken, normatif hukuk bilimi,  değerleri  merkeze  alan  etik  ve  politika  bilimiyle  ilgili, empirik/sosyolojik hukuk bilimi ise hukuksal olgularla ilgidir. Görüldüğü gibi Twining, hukuk sosyolojisini de hukuk biliminin içine dahil etmiştir. Hart, The Concept of Law eserine eklenen postscript de betimleyici (descriptive)  hukuk  teorisi,  değerlendirici  (evaluative)    veya haklılaştırıcı/meşrulaştırıcı  (justificatory)  hukuk  teorisi  ayrımı  yaparak, kendi  teorisini  betimleyici,  Dworkin in  hukuk  teorisini  ise  kısmen değerlendirici ve haklılaştırıcı olarak tanımlamıştır. Ancak H.L.A Hart, The Concept  of  Law  adlı  eserinin  girişinde  kendi  yaklaşımını  aynı  zamanda betimleyici sosyoloji (descriptive sociology) olarak da tanımlamıştır Hart, kendi  teorisinin  ahlak  bakımından  nötr  olduğunu  ve  herhangi  bir haklılaştırıcı/meşrulaştırıcı  bir  amaç  gütmediğini  söylemektedir. Değerlendirici veya haklılaştırıcı hukuk teorileri, doğru/adil ve haklı hukuk ya  da  daha  genel  bir  ifadeyle  iyi  hukuk  ideallerini,  benimsedikleri değerler/ilkeler temeline dayanarak savunmaktadırlar. Başka bir ifade ile değerlendirici veya haklılaştırıcı hukuk teorileri, doğru/adil hukuk arayışına dönük düşünsel etkinlikleri hukuk biliminin konusu haline getirmektedirler.  Hukuki  pozitivizme  karşı  gelen  Dworkin in  hukuk  teorisinin değerlendirici  bir  teori  olması,  hukuku  bir  yorum  meselesi  olarak  ele almasından  kaynaklanır.  Dworkin de  hukuki  önermelerin  en  iyi  ve  en doğru  bir  biçimde  anlaşılması,  adalet  ilkeler  açısından  yorumlanmasına bağlıdır.                                                              26  Twining, William; General Jurisprdence: Understanding Law from Global Perspective,  Cambridge University Press, 2009, s. 13. 27  Twining, s. 13. 28  Hart, H.L.A., The Concept of Law, Second Edition, (with a postcript edited by Penelope A. Bulloch and Joseph Raz) Clarendon Press-Oxford, 1994, s. 240; bkz. Julie Dickson,  Methodology in Jurisprudence: A Critical Survey , Legal Theory, 10 (22049, s, 118-119, pp. 117-156. 29  Hart, s. 240. 30  Hart, s. v.   31  Hart, s. 240. 32  Bkz. Dworkin,   Law as Interpretation , Texas Law Review, Vol. 60, (1982), s. 527-550. 33  Uygur, s. 70-71.   233Sururi Aktaş                                                            Ankara Üni. Hukuk Fak. Dergisi, 67 (2) 2018: 227-252 Hukuka  yönelik  entelektüel  çabalardan  da  anlaşıldığı  gibi,  hukuk kavramı  ve  olgusu  değişik  disiplin  ve  teorilere  konu  olmaktadır.  Her disiplin kendi yöntemi ve amacı açısından hukuk kavramına yaklaşmaktadır.  Pozitivist hukuk teorileri hariç, hukuk teorileri de kendileri açısından doğru ya  da  iyi  hukuk  tasarımlarını  dile  getirmektedirler.  Pozitivist  hukuk teorilerinin iddiası, hukuku, pozitivist metodolojiye (pozitif bilime) göre en uygun  olarak  kendilerinin  anladıklarına  dönüktür.  Mesela  Kelsen,  kendi teorisinin,  hukuk  bilimini  yabancı  unsurlardan  temizlemeye  çalıştığını söyler. Pozitivist karakterli teorileri bir yana bırakırsak, hukuk teorileri amaçlarının gereği olarak, hukuk disiplinlerinin aksine, kendi hukuk tasarım ve  ideallerinin  en  iyi  hukuk  olduğunu  söyleyerek  indirgemeci  bir  tavır sergilemektedirler.  Oysa  hukuk  disiplinleri  birbirlerini  dışlamayıp, Özbilgen in belirttiği gibi yan yana durabilmektedir.  Hukukun değişik disiplinlere konu olması, beşeri davranışa yönelmiş normatif,  ahlaki, felsefi, toplumsal, tarihsel, dinsel ve iktisadi unsurlara sahip  olmasından  kaynaklanmaktadır.  Her  disiplin  kendi  verileri  ve yöntemiyle hukuk olgusuna yaklaşmaktadır. Bu durum, hukuk kavramına zenginlik katarak hukuki düşüncenin derinleşmesine katkı sağlamaktadır. Örneğin  felsefe,  ideal  hukuk  tasarımlarında  bulunan  teorilere  yönelerek  hukuk felsefesi  alt disiplininin ortaya çıkmasına neden olmuştur. Genel hukuk teorisi disiplini de geniş almamda hukuk felsefesinin konusuna girse de, hukuksal kavram ve kurumlara genel olarak betimleyici bir yöntemle nesnel olarak yaklaştığı için kendine özgü bir karakteri vardır. Timasheff,  genel hukuk teorisinin  işlevini yerine getiren hukuk disiplini için,  teorik hukuk  bilimi   (theoretical  jurisprudence)  tanımlamasını  kullanmaktadır. Sosyoloji, hukuku toplumsal bir olgu olarak ele alarak  hukuk sosyolojisi  alt  disiplini  kimliğine  bürünmüştür.  Tarih,  önceki  zamanlara  ait  hukuki malzemeyi  günümüze  taşımayı  amaçlayarak  hukuk  tarihi  alt  disiplini                                                             34  Bkz. Hİrş, Ernest, Hukuk Felsefesi ve Hukuk Sosyolojisi Dersleri, (Güncel dile uyarlayan Selçuk Baran (Vezirioğlu) 3. Tıpkı Basım, Ankara 2001, s. 8 vd; Gözler, Kemal, Hukukun Genel  Teorisine  Giriş   Hukuk  Normlarının  Geçerliliği  ve  Yorumu  Sorunu,  Us-A Yayıncılık, Ankara 1998, s. 1 vd 35  Bkz.  Uygun,  Oktay,  Hukuk  Teorileri,  1.  Baskı,  OnikiLevha  Yayını,  İstanbul  2017,  (tümüne atıf). 36  Bkz. Kelsen, Hans, Pure Theory of Law, (Translated from Second Revised and Enlarged German Edition) by Max Knight), Fift Printing 2005,  s. 1. 37  Özbilgen,  Tarık,  Eleştirel  Hukuk  Başlangıcı  Dersleri,  İstanbul  Üniversitesi  Hukuk Fakültesi Yayınları İstanbul 1976, s. 7.  38  Özbilgen, s. 8. 39  Bkz. Gözler, Kemal, Hukukun Genel Teorisine Giriş…, s. 9 vd; Troper, s. 15. 40  Timasheff, s. 24. 234Ankara Üni. Hukuk Fak. Dergisi, 67 (2) 2018: 227-252                                        Hukuk Kavramının Analizi  görünümünü almıştır. Bu bağlamda hukuk tarihini, hukuk sosyolojisine veri sağlayan bir disiplin olarak görmek mümkündür. Mantık ve metodolojinin (yöntembilimin)  hukuk  alanına  yansımış  görünümü  olarak   hukuk metodolojisi   karşımıza  çıkmaktadır.  Hukuk  metodolojisi  genel  olarak, gerek biçimsel (formel) mantık ve gerekse hukuka özgü gelişmiş bir takım akıl  yürütme  ilkelerini  incelemeyi  amaçlar.  Hukuk  metodolojisi,  İslam Hukuk Biliminde Usul-i Fıkh olarak büyük önem taşımaktadır. Hatta Usul-i Fıkh, hukuk felsefesini de içine alacak şekilde genişlemektedir.  Hukuk  dogmatiği  (legal  dogmatics)  veya  dogmatik  hukuk  disiplini, belirli bir hukuk düzeninin pozitif kurallarını yorumlama ve sistematize etme işlevini yerine getirmektedir. Minemura, hukuk dogmatiğinin, tıpkı hukuk sosyolojisi  gibi,  kültürel  değerlerin  belirlediği  hukuksal  olguları  konu edindiği için hukuk bilimi sınıflaması içerisine girdiğini söyler. Ancak yazara göre hukuk dogmatiğinin ele aldığı hukuksal olgu, belirli bir hukuk düzeni olduğu halde, hukuk sosyolojisinin ele aldığı hukuksal olgu, hukuk düzeni tarafından düzenlenen yaşamın kendisidir.   Hukuk  eğitimi  ağırlıklı  olarak  dogmatik  hukuk  bilimi  (disiplini) biçiminde  cereyan  etmektedir.  Hukuk eğitimine  daha  evrensel  bir  boyut kazandırabilmemiz  için,  ilgi  alanımızı  biraz  daha   genel  hukuk  teorisi , hukuk sosyolojisi ve hukuk felsefesine kaydırmamız gerekir. 4- Daha Derinlikli Bir Hukuk Kavrayışı İçin Üç Temel Analiz a) Normatif Analiz: Hukuk Felsefesi Hukuk  kavramına  daha  derinlikli  bakmaya  çalışan  disiplinlerden  en önemlisi  hukuk  felsefesidir.  Felsefeden  söz  edildiğinde  birçok  insanın zihninde anlaşılmaz soyut ve karmaşık düşünceler belirir. Oysa felsefe geniş anlamda  düşünmek  fiiliyle aynı anlamları çağrıştırır. Düşüncenin nesnesi (konusu) değişebilir. Ancak düşünmenin/felsefe yapmanın kendisi zihinsel bir  faaliyet  olarak,  insanın  (beşerin)  değişmez  bir  niteliğidir.  Varlık  ve meseleler üzerinde düşünmek, eşyanın tabiatı hakkında meraklı olmak ve toplumsal  sorunlara  çözüm  aramak,  felsefe  yapmak/düşünmek  demektir.                                                             41  Bkz. Güriz, Adnan, Hukuk Felsefesi, 7.  Baskı, Siyasal Kitabevi, Ankara 2007, s. 5. 42  Aulis, Aarnio, The Rational as Reasonable: A Treatise on Legal Justification, Reidel Publishing Company Dordrecht, 1987, s. 12; Hİrş, s. 8 ve s. 11 vd; Peczenik, Aleksander, On Law and Reason, Springer, 2008, s. 295. 43  Minemura Teruo,  Dogmatic Legal Science and Sociology of Law , Archiv für Rechts- und Sozialphilosophie / Archives for Philosophy of Law and Social Philosophy, (ARSP), Vol. 56, No. 3 (1970),  s. 351,  pp. 351-366 44  Minemura, s. 352.   235Sururi Aktaş                                                            Ankara Üni. Hukuk Fak. Dergisi, 67 (2) 2018: 227-252 Dolayısıyla felsefeyi, karmaşık ve anlaşılmaz spekülasyonlar yığını olma algısından kurtarıp, hakikatı arama ve kavrama (hikmet /Wisdom) olarak yeniden gündemimize sokmamız gerekir. Kur anı Kerimde Bakara Suresinin 269. ayetinde şöyle buyrulmaktadır:   Allah hikmeti dilediğine verir. Kime hikmet verilmişse, şüphesiz ona çokça hayır verilmiş demektir. Bunu ancak akıl  sahipleri  anlar 45.  Bu  ayette  kuşkusuz  insanın  aklını  işletmesinin önemine vurgu yapılmaktadır. Hikmete sahip olmanın değerinin anlaşılması, akıl sahipleriyle ilişkilendirilmektedir.  Hukuk kavramı da tartışmasız olarak felsefenin konusu olmaya devam etmiştir.  Zamanla  Hukuk  Felsefesi  (legal  philosophy/rechtsphilosophie) olarak tanımlanan bir disiplin (veya bilim dalı) ortaya çıkmıştır. Hukuk felsefesini dar anlamda, doğru/adil ya da ideal hukuku aramaya dönük bir disiplin olarak tanımlasak da, bugün daha fazla konu ve müfredat hukuk felsefesinin kapsamına sokulmaktadır.  Troper hukuk felsefesini  spekülatif ve normatif bir disiplin  olarak tanımlayıp,  kapsamına,   hukuksal  ontoloji  olarak  görülebilen  hukuksal kavramların özlerinin incelenmesi; hukuksal epistemoloji olarak bu özlerin tanınmasını sağlayacak olasılıkların kavranması; hukuksal erekbilim olarak değerlendirilebilen  hukukun amaçlarının belirlenmesini ve son olarak hukuk mantığı  olarak  da  hukuka  ilişkin  akıl  yürütmelerin  incelenmesini sokmaktadır  İyi  ya  da  doğru/adil  hukuku  araştırma  konusu  yapan   dar  anlamda hukuk  felsefesi ni  normatif  hukuk  felsefesi;   geniş  anlamda  hukuk felsefesi ni de, hem adil hukuk peşinde koşan normatif yaklaşımı ve hem de betimleyici yaklaşımı benimseyen analitik hukuk felsefesini içine alan hukuk felsefesi  olarak  tanımlayabiliriz.  İzveren,  hukuk  felsefesinin  konusunu,  hukuk nedir ve ne olmalıdır  biçiminde ortaya koyarak geniş anlamda bir hukuk  felsefesi  tanımı  yapmıştır.  Dolayısıyla  geniş  anlamda  hukuk felsefesi,  hukuk  kavramı  üzerine  yapılan  normatif  ve  analitik  düşünsel faaliyeti  kapsamaktadır.  Zannediyorum,  bugün  geniş  anlamda  hukuk                                                             45  Diyanet İşleri Başkanlığı Meali. 46  Bkz. Güriz, s. 11. 47  Troper, s. 15. 48  Troper, s. 15. 49  İzveren, Adil, Hukuk Felsefesi, Dokuz Eylül Üniversitesi Hukuk Fakültesi Yayını, Ankara 1988, s. 19. 50  İzveren, s. 19.; ayrıca değişik tanımlar için Bkz. Hİrş, s. 75 vd; Aral, Vecdi, Hukuk Felsefesinin Temel Sorunları, Filiz Kitabevi, İstanbul 1992, s. 31 vd; Güriz, s. 11; Işıktaç, Hukuk Felsefesi…, s. 27. 236Ankara Üni. Hukuk Fak. Dergisi, 67 (2) 2018: 227-252                                        Hukuk Kavramının Analizi  felsefesini, İngilizcede kullanılan jurisprudence sözcüğüyle ifade edebiliriz. İngilizceden  hukuk  bilimi  olarak  çevirebileceğimiz  Jurisprudence kavramının  tam  çevirisi,   hukukta  kabiliyet   veya   hukuk  bilgisi dir. Çünkü  prudence  sözcüğü,  Latince  bilgi  veya  kabiliyet  olarak tanımlayabiliceğimiz prudentia sözcüğünden türemiştir. Hukuk ve ahlak alanında hikmete dayalı doğru akıl yürütmeyi ifade etmek için, prudentia (wisdom)  hikmet  anlamında  da  kullanılmıştır.  Phillipps,  jurisprudence kavramını ideal hukuku araştıran dar anlamda hukuk felsefesi anlamında,  adaletin kurallarını analiz ve sınıflayan bilim  olarak tanımlamaktadır. Phillipps, hukuk bilimini, bir ahlak bilimi gibi algılamaktadır. Çünkü ona göre  adalet,  insanoğlunun  ahlaken  hak  ettiği  şeyin  (hakların) gözetilmesidir. Doğal hukuk teorisinin savunucularından Finnis de hukuk felsefesinin dar anlamdaki işlevine uygun olarak, bu disiplinin pratik akıl felsefesiyle  ilgili  olduğunu  söyler.  Pratik  akıl  felsefesi,  eylemlerimize ilişkin  seçimlerimizi  makul  hale  getiren  bir  disiplindir.  Dolayısıyla  bu açıdan  baktığımızda,  Finnis  açısından  hukuk  felsefesi,  hukuki tasavvurumuzu  akla  yatkın  hale  getiren  bir  işlev  görmektedir.  Finnis in deyimiyle hukuk felsefesi, milletler tarafından kabul görmüş hukukun genel ilkelerinin, adil ve yetke (otorite) ilkeler olduğunu kabul etmemizi sağlayan temelleri  belirlemeyi  hedefler.  Finnis in  bu  ifadesini  daha  açık  hale getirdiğimizde, hukuk felsefesi, kuralların ahlaki meşrulaştırmasını rasyonel (akla uygun)  hale getirmeyi amaçlayan pratik akıl alanındaki bilişsel bir faaliyeti ifade eder. Doğru/adil  hukuku  araştırmayı  konu  edinen  dar  anlamdaki  hukuk felsefesi,  ahlak  felsefesini  de  ilgilendiren  bir  alandır.  Davranışlarımızın genel  doğruluk  ölçütünü  sorgulayan  ahlak  felsefesi,  özel  olarak  hukuk felsefesine  yol  göstererek  hukuken  doğru  (adil)  davranışın  ne  olduğunu                                                             51  Merriam-Webster  Dictionary,   jurisprudence ,  https://www.merriamwebster.com/dictionary/jurisprudence (E.T. 04.01.2017) 52  Merriam-Webster  Dictionary,   jurisprudence ,  https://www.merriamwebster.com/dictionary/jurisprudence (E.T. 04.01.2017) 53  Bkz. Westerman, Pauline C., The Disintegration of Natural Law Theory: Aquinas to Finnis, Brill 1998,  s. 61-62. 54  Phillipps, Charler Spencer March, Jurisprudence, Adamant Media Corporation (Elibron Cllasics Series), 2006, s. 3. 55  Phillipps, s. 6. 56  Phillipps, s. 3. 57  Finnis, John,  What is the Philosophy of Law , Rivista di Filosofia del Diritto no. 1, (2012), s. 67, pp. 67-78. 58  Finnis, s. 67. 59  Finnis, s. 68.   237Sururi Aktaş                                                            Ankara Üni. Hukuk Fak. Dergisi, 67 (2) 2018: 227-252 analiz  eder.  Ancak  daha  önce  vurguladığımız  gibi,  böyle  bir  analizin rasyonel, tarihsel ve iktisadi olgularla çelişmemesi için, bu alanlara ilişkin, iktisat bilimi gibi temayüz etmiş bilim ve disiplinlerin ilkelerinin dikkate alınması gerekir. Hukuk, ahlak ve iktisat birbiriyle yakın ilişki içerisinde olan  alanlardır.  İktisat  biliminin  temellerini  atan  Adam  Smith in  aynı zamanda bir ahlak felsefecisi olduğu unutulmamalıdır. Yine F. A. Hayek in hukuk,  siyaset  ve  iktisat  felsefesi  alanlarında  dikkat  çekici  eserler vermesinde, hukuk ve iktisat felsefesine hakim olmasının rolü yadsınamaz. Hukuk  kavramıyla  ilgili  derinlikli  düşüncelere  ihtiyacımızın  olduğu tartışmasızdır. Hikmete dayalı derinlikli hukuk eğitimi, hukuk felsefesinin amacı olmalıdır. Hukuk felsefesi,  genel felsefeden beslenmekle birlikte kendisine  ait  muayyen  (spesifik)  bir  konusu  vardır.  Bu  da  kuşkusuz hukuktur. Dolayısıyla hukuk felsefesinin ilgi alanını hukuk kavramı üzerine yoğunlaştırmamız  gerekir.  Türkiye de  hukuk  felsefesiyle,  genel  felsefe yeterince  birbirinden  ayrılmış  değildir.  Genelde  hukuk  felsefesi,    genel felsefe  tarihi  şeklinde  ele  alınmaktadır.  Çoğunlukla  öğrenciler  hukuk felsefesinin konusunu yeterince kavrayamamaktadır. Bundan dolayı genel felsefe  konularıyla  hukuk  teorileri  arasındaki  bağ  yeterince anlaşılamamaktadır. Örneğin, faydacılık konusu işlenirken, hukuk ve adalet kavramı bakımından faydacılığın ne anlama geldiği ve faydacılığın ne tür bir hukuk ve adalet teorisini beslediğinin analiz edilmesi gerekir. Dolayısıyla öğrencilerin ilgisi, genel felsefeden hukuk kavramına çekilmelidir. Hukuk kavramı  ve  teorileriyle  ilgili  meseleler  hukuk  felsefesinin  odak  noktası haline getirilmesi gerekir. Dar anlamda hukuk felsefesi, ideal (doğru/adil ) hukuku araştırmayı konu edinirken, aynı zamanda hukuk teorilerine de yönelmelidir. Çünkü iyi hukuk  ideali,  her  hukuk  teorisinin  (pozitivist  teoriler  hariç)  ilgi  alanını oluşturur.  Hukuk  teorilerini  karşılaştırmak,  iyi  hukuk  analizlerini                                                             60  Örneğin  bkz.   Hukuk  Kavramı  ve  Olgusunun  Metodolojik  Olarak  Çeşitli  Açılardan Kavranması Gereği  adlı başlığa. 61  Bkz. Evensky, Jerry,  Adam Smith s Moral Philosophy: A Historical and Contemporary Perspective on Market, Law, Ethics, and Culture, Cambridge University Press 2005,  (tümüne atıf).  62  F. A Hayek in, eserlerinden Kanun, Yasama Faaliyeti ve Özgürlük adlı üç ciltlik çalışması disiplinlerarası bir yöntemle kaleme alınması bakımından anılmaya değer. (Bkz. Hayek, Friedrich August von, Kanun, Yasama Faaliyeti ve Özgürlük, C.I. (Kurallar ve Düzen), (çev. Atilla Yayla), 1. baskı, Türkiye İş Bankası Kültür Yayınları, Ankara 1994 tümüne atıf; Kanun, Yasama Faaliyeti ve Özgürlük, C. II (Sosyal Adalet Serabı), (çev. Mustafa Erdoğan) 1. Baskı, Türkiye İş Bankası Kültür Yayınları, 1995, tümüne atıf; Hukuk, Yasama ve Özgürlük, C. III. (Özgür Bir Toplumun Siyasal Düzeni), (çev. Mehmet Öz), Türkiye İş Bankası Kültür Yayını, 1997, tümüne atıf ).  238Ankara Üni. Hukuk Fak. Dergisi, 67 (2) 2018: 227-252                                        Hukuk Kavramının Analizi  karşılaştırmak demektir. Her hukuk teorisinin ideal hukuk tasarımı, felsefi açıdan  analize  tabi  tutulması  ve  diğer  iyi  hukuk  tasarımlarıyla karşılaştırılması  gerekir.  Bu  görev  de,  hukuk  felsefesine  düşmektedir. Dolayısıyla hukuk felsefesinin, hukukla ilgili teorileri karşılıklı analize tabi tutan bir işlev görmesi gerekir. Hukuk  felsefesi  yerine  bazen  hukuk  teorisi  de  kullanılmaktadır. Dolayısıyla hukuk teorisini de, normatif hukuk teorisi (dar anlamda hukuk felsefesi)  ve  analitik  hukuk  teorisi  olarak  ikiye  ayırabiliriz.  Böyle  bir ayırımda  normatif  hukuk  teorisi,  doğru/adil  hukuk  idealine  yönelen  dar anlamda hukuk felsefesinin işlevini görür. Analitik hukuk teorileri hukukun ne olduğunu açıklayan teoriler olarak betimleyici bir karakter arz eder.  Raz, hukukun doğasını (niteliğini) açıklamayı amaçlayan dar anlamda bir hukuk teorisinden yana tavır alarak, geniş anlamda hukuk teorilerinin varlığına da işaret etmektedir. Raz kendi açıklayıcı yöntemine uygun olarak bir hukuk teorisinin varlığının başarı şansını,  hukuka ilişkin önermelerinin zorunlu olarak doğru olması ve hukukun ne olduğunu açıklamasına  bağlı olduğunu söyler.  Raz,  zorunlu  doğruluk  tanımlamasına  yer  vererek  bir  taraftan analitik felsefenin/mantıksal pozitivizm yöntemine bağlı kalarak önermelerin doğruluklarını dilsel çözümlemeye tabi kılmakta, diğer taraftan da  olan  hukuku araştırmanın nesnesi haline getirerek değerlendirici yöntemi hukuk teorisinin  dışına  atmaktadır.  Dolayısıyla  Raz,  adil  hukuk  sorgulamasını kendi teorisi dışında tutmaktadır. Dagan ve Kreitner yazdıkları makalede, hukuk  teorisini,  toplumun   zorlayıcı  normatif  kurumlarına  açıklayıcı, haklılaştırıcı  (değerlendirici)  ve  reformist   açılardan  yaklaşan  bir  teori olarak  tanımladıklarını  belirterek,  geniş  almanda  bir  hukuk  teorisinden yana tavır alırlar. Adı geçen yazarlar hukuk teorisinin, hukukun kaynakları ve gelişimi için bir taraftan toplumsal-tarihsel (sociohistorical) tahlillerden, diğer  taraftan  değerlendirici  yan  disiplinler  olarak  etik  ve  siyaset felsefesinden (hukuk ve politika disiplininden)67  ve nihai olarak reformları amaçlayan   zanaat  olarak  hukuk   (law  as  craft)68  yaklaşımından  ibaret olması gerektiğini düşünürler.                                                             63  Raz, Joseph,  Can There Be a Theory of Law , The Blackwell Guide to the Philosophy of Law and Legal Theory (Edited by Martin P. Golding and William A. Edmundson), Blackwell Publishing, 2005,  s. 324. 64  Raz, s. 324. 65  Dagan, Hanoch, Kreitner, Roy,  The Character of Legal Theory , Cornell Law Review, (2011), Vol. 96, , s. 85. pp. 671-191. 66  Dagan/Kreitner, s. 685 ve bkz. 675 vd. 67  Dagan/Kreitner, s. 685 ve bkz 673 vd. 68 Dagan/Kreitner, s. 685 ve bkz. s. 677-678. 69 Ayrıca bkz. Dagan/Kreitner, s. 85 vd.   239Sururi Aktaş                                                            Ankara Üni. Hukuk Fak. Dergisi, 67 (2) 2018: 227-252 Hart  ve  Kelsen in  teorileri  gibi   genel  hukuk  teorisi   niteliğindeki teoriler  betimleyici  olduğu  için,  doğal  hukuk  gibi  dar  anlamdaki  hukuk felsefesinin konusunu oluşturan teorilerin aksine kendi doğru/adil hukuk ya da ideal hukuk tasarımlarına yer vermezler. Dolayısıyla genel hukuk teorisi ve pozitivist hukuk teorilerini bir yana bırakırsak, hukuk teorileri, hukukla ilgili  doğruluk/adillik  veya  iyilik  iddialarını  dile  getiren  sistematik düşüncelerle oluşmaktadır. Her hukuk teorisinin, pozitivist teoriler hariç, kendine  ait  doğru/adil  hukuk  veya  iyi  hukuk  tasarımı  vardır.  Pozitivist teorilerin adil hukuku araştırma gibi bir iddiaları bulunmaz. Ancak pozitivist teoriler de hukukun doğasını en gerçekçi ve bilimsel olarak kendilerinin kavradıklarını iddia etmektedirler. Zaman ve şartlar değiştikçe, yeni hukuk teorileri ortaya çıkmaktadır. Örneğin, doğal hukuk gibi geleneksel teoriler yanında   hukuk ve ekonomi  (law and economics) teorisi ve feminist hukuk teorisi gibi yaklaşımlar, kendi inanç ve ilkeleri açısından kendi ideal hukuk tasarımlarını  savunan  (göreli  olarak)  daha  yeni  düşüncelerdir.  Hukuk felsefesi  dersi,  öğrencilere  bu  teorilerin  kısa  bir  özetini  ve  amacını kavratmalı; öğrencilerin teorilerle ilgili eleştirel ve karşılaştırmalı bir analiz yeteneğine sahip olmalarının sağlanması amaçlanmalıdır. Dolayısıyla hukuk felsefesinin  dar  anlamda  konusu  olan   ideal  hukuk  tetkikleri , sanılanın aksine  çok  geniş  bir  konu  yelpazesine  sahiptir.  Pound,  eski  Yunan dan günümüze  kadar  olan  süreçte,    hukuk  felsefesinin,  beşeri  kurumların bütünlüklü  incelenmesi  gibi  öncü  bir  rol  üstlendiğini  söylemektedir. Friedmann da, hukuk teorisiyle ilgili sistematik düşüncelerin tümünün, bir taraftan felsefeyle ilgili, diğer taraftan da siyaset teorisiyle ilgili olduğunu söylemektir.  Friedmann ın  bu  analizinde,  hukuk  teorileri  bakımından felsefe  ve  siyaset  teorisinin  disiplinlerarası  (interdisipliner)  bir  alan oluşturduğunu söyleyebiliriz. İyi hukuk idealine dönük zihinsel faaliyetler, disiplinlerarası bir yöntem izlemesi gerekir. Yine Friedmann, bütün hukuk teorilerinin, bazı ögeleri felsefeden, bazılarını da siyaset teorisinden alması gerektiğini belirtmektedir.  Ancak kendisi açısından ideal bir hukuk kavramı peşinden koşan bir hukuk teorisi, sadece felsefe ve siyaset teorisi değil, diğer alanlardan da, özellikle genel tarih, dinler tarihi, devlet tarihi, iktisat, iktisat felsefesi, iktisat tarihi, psikoloji ve sosyoloji gibi alanlardan da yararlanması gerekir. Tek bir alanın  verileriyle  sınırlı  kalınarak  iyi  hukuk  idealine  yönelik  düşünsel                                                             70 Pound, Rorcoe, An Introduction to the Philosophy of Law, Yale University Press  1922, s. 15. 71 Fridmann, W., Legal Theory, 2nd Edition, London 1949, s. 3. 72 Fridmann, s. 3. 240Ankara Üni. Hukuk Fak. Dergisi, 67 (2) 2018: 227-252                                        Hukuk Kavramının Analizi  faaliyet yürütmek kısır kalmaya  mahkumdur. Kuralların arkasındaki aklı (ratio  legis)  keşfedebilmek  de  yine  disiplinlerarası  bir  zihniyete  ihtiyaç duyar. Mevcut kuralların arkasındaki aklı keşfedebilme kabiliyeti, topluma yeni iyi kurallar getirebilme olasılığını artırır. Geniş anlamda hukuk felsefesi, analitik hukuk bilimini de bünyesinde barındırır.  Yani  hukuku  olduğu  gibi  incelemeye  çalışan  betimleyici (descriptive) hukuk bilimi de hukuk felsefesinin ilgi alanındadır. Betimleyici anlayışın  dayandığı  metodolojide,  iyi  hukuk  arayışı,  hukuk  biliminin konusunu  oluşturmaz.  Özellikle  İngiliz  analitik  hukuk  biliminde  bunu görmekteyiz.  Kelsen,  iyi  hukuk  idealini  araştırma  işini,  hukuk biliminin dışında tuttuğu için, genel hukuk teorisi şeklindeki eserleri, pozitivist hukuk teorisi niteliğindedir. b) Betimleyici Kavramsal Analiz: Genel Hukuk Teorisi Hukuk  bilimini,  pozitif  bir  yöntemle  ele  alan  yaklaşımların  en önemlilerinden birisi de genel hukuk teorisi veya bazı yazarların ifadesiyle  hukukun genel teorisi dir. Troper in tespitine göre genel hukuk teorisi, pozitivist düşüncenin tesiriyle hukuk felsefesine karşı bir teori olarak kendini göstermiştir .  Hukuksal kavramlara ilişkin betimleyici bir yaklaşımı benimseyerek, ideal  hukuku  kapsamına  almayan  bu  yaklaşım  üzerinde  analitik (çözümleyici)  felsefenin  de  etkisi  büyüktür.  Bazı  zamanlar  mantıkçı pozitivizm  olarak  da  ifade  edilen  analitik  felsefenin  doğrulama yöntemlerinden  biri  de  önermelerin  dil  ve  mantık  açısıdan  tahlil edilmesidir. Özellikle Rudolf Carnap ve Alfred Jules Ayer in mantıkçı pozitivizminin  Hart  üzerinde  etkisi  olduğu  iddia  edilmektedir.  Hukuk biliminde metafiziği dışlayan bu yaklaşım açısından felsefenin konusunu mantıksal sınıflama oluşturur. Kelsen in saf hukuk teorisine baktığımızda bu yaklaşımın izlerini görebiliriz. Özellikle Kelsen hukuk bilimini, mantıksal çözümleme olarak algılamıştır. Başka bir anlatımla, Kelsen in teorisinde hukuk,  normların  oluşturduğu  mantıksal  bir  bütün  olarak  kavranmıştır.                                                             73  Bkz, Kelsen,  Pure Theory of Law…,  s.  1 vd; Kelsen, Hans, General Theory of Law…, (tümüne atıf).  74  Gözler, Hukukun Genel…, s. 6 ve 10. 75  Troper, s. 14. 76  Yazıcı, Sedat, Felsefeye Giriş, Genişletilmiş 3.baskı, Öncü Kitap, Ankara 2009, s. 24 77  Curzon, L. B., Jurisprudence, 2nd Edition,Cavendish Publishing, London-Sydney, 1995, s. 7 ve 81. 78  Curzon, s. 82. 79  Curzon, s. 124 vd. 80 Kelsen, The Pure Theory of Law…, s. 221 vd; bkz. Hukuk Felsefesi…, s. 80.   241Sururi Aktaş                                                            Ankara Üni. Hukuk Fak. Dergisi, 67 (2) 2018: 227-252 Normların içeriği, hukuk bilimi dışına taşınarak, biçimci  (formalist) bir hukuk kavramı geliştirilmiştir. Genel  hukuk  teorisi,  tanımlamanın  da  çağrıştırdığı  gibi,  dogmatik hukuk biliminden daha kapsayıcı bir hukuksal analiz yöntemine sahiptir. Bu yöntem,  hukuk  öğreticileri  ve  öğrencilerine,  pozitif  hukuk  analizleri  ve yorumları dışında, hukuksal kavramları evrensel olarak özümseme imkânı sağlayacaktır.  Böyle  bir  yaklaşım,  dogmatik  hukuk  bilimine  göre  daha derinlikli ve kapsayıcı görünmektedir.  Genel hukuk teorisi   geniş anlamda hukuk felsefesi nin alt bir disiplini olarak görülebileceği gibi, hukuk felsefesi sadece ideal hukuka yönelen bir disiplin olarak değerlendirenlerin yaklaşımı esas alındığında, kendine özgü ayrı bir disiplin olarak da görülebilir. Çağıl, dar anlamda hukuk bilimi olarak genel  hukuk  teorisiyle  hukuk  felsefesinin  özdeşliğini  kabul  etmemekle beraber,  bu  iki  disiplini, birbirinin  tamamlayıcısı  olarak  görür.  Her  ne şekilde sınıflarsak sınıflayalım, genel hukuk teorisi, hukuk bilimi ve hukuk eğitimi için önemli bir disiplindir. Bir kere genel hukuk teorisi, Kelsen in ifade ettiği gibi belirli bir hukuk sistemini inceleme konusu yapmayıp, bütün hukuk sistemlerinde görülen ortak kavram ve kurumları ele aldığı için hukuk biliminin evrensel müfredatını oluşturmaktadır. Bu açıdan,  hukuk genel teorisi nin bir ders olarak okutulması faydalı olabilir. Bir kere,  İdeal hukuk veya iyi ve doğru/adil hukuk nedir  sorularına yanıt aramadan önce, hukuk kavramının hukukun genel teorisinin betimleyici ve görece tarafsız yöntemiyle ele alınması gerekir. Hukuk felsefesi ahlaki ve hatta ideolojik bir tercihi gerektirdiğinden, dar anlamda hukuk felsefesi yöntemiyle doğru/adil hukuk  sorgulamasına  başlanmadan  önce  güçlü  bir  genel  hukuk  teorisi bilgisine sahip olunması gerekir. Ancak genel hukuk teorisi, hukuk biliminin tümünü içine almadığından yine de iyi ya da doğru/adil hukuk idealinin, hukukun tanımı (hukuk kavramı) dışına çıkarılmaması gerekir. Eğer böyle olursa, pozitivistlerin yaptığı gibi son derece haksız ve adaletsiz hukukları da hukuk sayma sonucuyla karşılaşılabilir. Başka bir anlatımla,  olan hukuk   ile  olması gereken  hukuk arasındaki bağlantının koparılmaması gerekir. Pozitif hukuk, hukuk kavramının tümünü tüketmemesi gerekir.  Bir yazarın                                                             81  Aral,  Kelsen in  Saf  Hukuk  Teorisinin…,  s.  24;  Özbilgen,  s.  106;  Işıktaç,  Hukuk Felsefesi…,  s. 80. 82  Çağıl, s. 142. 83  Kelsen, The Pure Theory of Law and Analytical…, s. 44. 84  Gözler, Kemal, Hukuka Giriş, Ekin Yayını, 14. Baskı Bursa 2017, s. 7-8. 85  Gözler, Hukuka Giriş, s. 6. 242Ankara Üni. Hukuk Fak. Dergisi, 67 (2) 2018: 227-252                                        Hukuk Kavramının Analizi  dediği  gibi  hukuk  bilimi,  salt  bir  pozitivizme  meylederek  körelmemesi gerekir. Dolayısıyla  hukuk  sistemlerinde  ve  genel  hukuk  tarihinde  görülen hukuksal  kavramların  tanımlanmasında  genel  hukuk  teorisinin betimleyici/tanımlayıcı  yöntemine  ihtiyacımız  olmakla  birlikte,  genel  bir hukuk kavramı/tanımı için sadece bu yöntemle yetinemeyiz. Doğru ve iyi hukuk  telakkimiz  için,  betimleyici  ve  değerlendirici  yöntemi  birlikte kullanmayı benimsememiz gerekir. Genel hukuk teorisi, kavramsal analiz yoluyla hukuk tefekkürümüzü zenginleştirebilir. Ancak iyi hukuk idesi (de lege ferenda/ideal law) için kavramsal analize, değerlendirici bir analizin eklenmesi gerekir. Hakların ve insan onurunun korunması, evrensel kabul görmüş  ilkelerle  uyum  içinde  olunması  gerektiğine  ilişkin  bir  hukuk tanımlaması, yargıca, pozitif hukuku (de lege lata), haklar, insan onuru ve evrensel kabul görmüş ilkeler doğrultusunda yorumlama fırsatı verecektir. c) Sosyolojik Analiz: Hukuk Sosyolojisi Hukuk  olgusunu,  doğa  bilimleri  yöntemiyle  ele  almaya  çalışan disiplinlerden birisi naturalist (pozitivist) sosyolojidir. Genel olarak Comte ve Durkheim in etkisinde gelişen bu anlayış toplumsal olguları, neden sonuç ilişkisi çerçevesinde açıklamaktadır. Hukuk da bir toplumsal olgu olarak ele alınıp incelenmekte, hukukla ilgili toplumsal olgular yine aynı şekilde nedensellik  ilişkisine  göre  açıklanmaya  çalışılmaktadır.  Dolayısıyla naturalist anlayışa dayanan hukuk sosyolojisi, açıklayıcı ve betimleyici bir karakter  arz  eder.  Timasheff  bu  anlayışa  dayanan  hukuk  sosyolojisini  toplumun  hukukla  ilgili  bilimsel  doğasına  ilişkin  yasaları  keşfetmeyi amaçlayan  nomografik  bir  bilim   olarak  tarif  eder.  Hukuk  sosyolojisi doğru/adil hukuk hangisidir biçiminde değerlendirici bir sorgulama içine girmez.  Örneğin  suç  olgusunun  arkasında  bulunan  toplumsal  olguların                                                             86  Schwarz, Andreas B.,  Roma Hukuku ve İngiliz Hukuku , İstanbul Üniversitesi Hukuk Fakültesi Mecmuası, Cilt 11, sayı 3-4, 1945,    s. 202. 87  Bkz. Uygur, s. 92 vd. 88  Bkz. İçli, Gönül, Sosyolojiye Giriş, 4. Baskı, Ankara 2009, s. 7 vd; Işıktaç, Yasemin, Hukuk Sosyolojisi, Filiz Kitabevi, İstanbul 2014, s. 32.  89  Timasheff, Gürkan ve Özbilgen,   hukuk sosyolojisi  deyiminin ilk kez İtalyan hukukçu D.  Anzilotti  tarafından   sosyologia  juridica nın  karşılığı  olarak  kullanıldığını  tespit etmişlerdir. (Timasheff, s. 52; Özbilgen, Hukuk Sosyolojisi, .s 62; Gürkan s.  33.) 90  Özcan, Mehmet Tevfik, Hukuk Sosyolojisine Giriş, 1. Baskı, Donkişot, İstanbul 2001, s. 11. 91  Timasheff, s. 19. 92  Bkz. Gürkan, Ülker, Hukuk Sosyolojisine Giriş, Gözden Geçirilmiş 4. Baskı, Siyasal Kitabevi, Ankara 2005, s. 24 vd.    243Sururi Aktaş                                                            Ankara Üni. Hukuk Fak. Dergisi, 67 (2) 2018: 227-252 neler olduğu, hangi tür cezaların hangi koşullar altında ortaya çıktığı, çok evliliğin hangi iklimsel ve ekonomik koşulların etkisiyle kendini gösterdiği biçimindeki  hukuksal  olgular,  pozitivist  bir  pencereden  kavranmaya çalışılmaktadır. Dolayısıyla sosyolojinin, hukuk olgusunu kendi metoduyla açıklamaya çalışması sürecinde bir alt disiplin olarak hukuk sosyoloji ortaya çıkmıştır.  Deflem e  göre  disiplin  olarak  hukuk  sosyolojisi,  klasik sosyolojiyle hemen aynı anda başlamamıştır. Adı geçen yazara göre klasik sosyologlar kendi çalışmalarında teorik pencerelerinden hukuka yer verseler de, bu çalışmalar bu günkü hukuk sosyolojisi niteliğinde değildi.   Kuşkusuz  hukuk  sosyolojisi  sadece  naturalist  sosyolojinin  etkisinde gelişmemiştir.  Max  Weber in  anti-pozitivist  sosyolojisinde  olduğu  gibi yorumlayıcı sosyoloji (anlayış sosyolojisi) de hukuk olgusuna el atmıştır. Weber in kapitalist hukuk sistemi üzerine yaptığı analizler bu bağlamda hatırlanmalıdır.  Deflem,  Weber in  modern  hukuk  sosyolojisinin  kurucu babası  olarak  düşünülmesinin  yaygın  kabul  gördüğünü  saptamaktadır.  Yorumlayıcı  sosyoloji  (anlayış  sosyolojisi)  bakımından  Deflem  haklıdır. Ancak  naturalist  veya  pozitivist  sosyoloji  açısından  Durkheim  modern hukuk  sosyolojisinin  kurucuları  arasında  sayılabilir.  Özbilgen,  metod açısından hukuk sosyolojisinin Durkheim le başladığını söyler. Hukuk  sosyolojisinin  uzak  habercileri  arasında  İslam  düşünürü  İbn Haldun önemli bir yere sahiptir. Özellikle hukuku her şeyden önce toplumsal bir olgu olarak ele alıp yerleşik toplum ve göçebe toplumlar bağlamında açıklaması  zamanına  göre  oldukça  ileri  bir  bilimsel  zihniyeti yansıtmaktadır.  İbn  Haldun un  toplumsal  çözümlemelerinde  dayanışma (asabiyyet) olgusuna yer vermesi toplumu gözleme dayalı olarak analiz etmesi,  toplumsal  kuralları,  doğal  yasalar  gibi  neden  sonuç  ilişkisi                                                             93  Bkz. Işıktaç, Hukuk Sosyolojisi…, s. 18; Özbilgen, Tarık, Eleştirisel Hukuk Sosyolojisi Dersleri, Cilt I, İstanbul Üniversitesi Hukuk Fakültesi Yayınları, İstanbul 1971, s. 6-63. 94  Deflem,  Mathieu,  Sosyology  of  Law,  (Vision  of  Scholarly  Tradition  ),  Cambridge University Press, 2008, s. 1. 95  Deflem, s. 1. 96  Öktem/Türkbağ, s. 322 vd; Deflem, s. 37 vd. 97  Deflem, s. 37. 98  Özbilgen, Hukuk Sosyolojisi, s.62-63. 99  İbn Haldun, Mukaddime, Cilt I (çev. Zakir Kadiri Ugan), MEB Yayını, İstanbul 1990, s. 302 vd, s. 350, s. 352 vd. vd; bkz. Gürkan, s. 72-76. 100  İbn Haldun, s. 331, s. 352 vd; bkz.Uygun, Oktay, İbn Haldun un Toplum ve Devlet Kuramı, XII Levha Yayını, 1. Baskı, İstanbul 2008, s. 34; Hassan s. 231. vd 101  Bkz. Hassan, Ümit, İbn Haldun un Metodu ve Siyaset Teorisi, 2. Baskı, Toplumsal Dönüşüm Yayınları, 1998 İstanbul, s. 82 vd. 244Ankara Üni. Hukuk Fak. Dergisi, 67 (2) 2018: 227-252                                        Hukuk Kavramının Analizi  çerçevesinde  açıklaması,  modern  sosyolojinin  kurucuları  sayılabilen Comte, Durkheim ve Tönnies gibi toplum bilimciler için öncü girişimler olmuştur. Hukuk  sosyolojisinin  temel  amacı,  hukukun  yürürlülük/biçimsel kaynaklarının  araştırılması  değil  de,  bu  yürürlük  kaynaklarını  besleyen toplumsal gerçekliklerin araştırılması ve tahlil edilmesidir. Timasheff e göre  hukuk  toplumsal  bir  güçtür .  Bu  güç,  belirli  davranış  kalıplarının bireylere  dayatılması  biçiminde  kendisini  göstermektedir.  Bu  anlamda hukuk  sosyolojisi,  hukuk  olgusunun  daha  derindeki  kaynaklarına  veya hukukun gerçek kaynaklarına yönelir. Hukukun gerçek kaynaklarına inmeyi amaçlayan hukuk sosyolojisinin bu bölümü Gurvitch tarafından sistematik hukuk  sosyolojisi   (Mikro  Hukuk  Sosyolojisi)  olarak  da  tanımlanır 106 . Gurvitch  toplumla,  ürettiği  hukuk  arasındaki  ilişkiyi  inceleyen  hukuk sosyolojisinin bölümünü,  diferansiyel hukuk sosyolojisi  (hukuki tipoloji) olarak  betimler.  Hukuksal  kavram  ve  kurumların  tarihsel  süreç içerisindeki değişimlerinin nasıl ve hangi yönde cereyan ettiği de hukuk sosyolojisinin ilgi alanlarındandır. Hukuk sosyolojisinin bu bölümü Gurvitch tarafından   jenetik  hukuk  sosyolojisi   olarak  adlandırılır.  Örneğin  bu bağlamda Durkheim hukukun, bastırıcı hukuktan (ceza hukukundan) iadevi hukuka (tazminat hukukuna)  doğru evrildiğini tespit eder. Kelsen e göre sosyolojik hukuk biliminin konusu, normlar açısından insan davranışlarının nasıl olması gerektiği değil de, hukuk olgusu olarak insanların normlara göre gerçekte nasıl hareket ettikleridir. Kelsen insan hareketini  inceleyen  disiplin  olarak  hukuk  sosyolojisinin  varlığına  karşı gelmektedir.  Kelsen  açısından   saf  hukuk  teorisi   bir  taraftan  adalet felsefesinden temizlenmesi gerekirken, diğer taraftan da sosyolojiden (sosyal                                                             102  Bkz. Hasan, s. 153 vd. 103  Bkz. Baali, Fuad, Society, State and Urbanism: Ibn Khaldun s Sosyological Thought, State University of New York Press, 1988, s. 109 vd; Hassan, s.48. 104  Timasheff, s. 23. 105  Timasheff, s. 23-24. 106  Georges,  Gurvitch,  Sociology  of  Law,  (With  a  New  Introduction  by  Alan  Hunt), Transanction Publishers, 2001, s. 198 vd; Ayrıca bkz. Gürkan, s. 40;Topçuoğlu, Hamide, Hukuk Sosyolojisi, Cilt I, Ankara Üniversitesi Hukuk Fakültesi yayınları, Ankara 1960, s.146 ve 156; Özbilgen, Hukuk Sosyolojisi  s. 108 vd. 107  Gurvitch, s. 231 vd; ayrıca bkz. Topçuoğlu, s. 146 ve 162;  Özbilgen, Hukuk Sosyolojisi  s. 101; Gürkan, s. 47. 108  Gurvitch, s. 287; Bkz. Topçuoğlu, s 146-147 ve s. 166; Gürkan, s. 50. 109  Bkz. Deflem, s. 61-62. 110  Kelsen, The Pure Theory of Law and Analytical…, s. 52.   245Sururi Aktaş                                                            Ankara Üni. Hukuk Fak. Dergisi, 67 (2) 2018: 227-252 gerçeklikten) temizlenmesi gerekir. Normativist teori (saf hukuk teorisi) açısından  nasıl  biyolojinin  matematik  açısından  incelenmesi  anlamsızsa, hukukun  da  insan  davranışlarını  nedenselliğe  göre  açıklamaya  çalışan sosyolojik  açıdan  incelenmesi  anlamsızdır.  Kelsen  açısından,  insan davranışlarının nedenselliğe göre nereye kadar incelenebileceğini bir tarafa bırakırsak, böyle bir incelemeyi amaçlayan sosyolojinin doğa bilimlerinden farkı olmaz. Oysa saf hukuk teorisi açısından hukuk, sosyal gerçeklikte ne olup bittiğini değil, insan davranışlarının nasıl olması gerektiğini buyurduğu için  normatif  alandadır.  Timasheff e  göre  Kelsen in  biyolojinin matematiksel  incelenmesinin  anlamsızlığı  ile  hukukun  sosyolojik incelenmesinin anlamsızlığı karşılaştırması hatalıdır; çünkü biyolojik olgular matematiğin  dışında  olduğu  halde,  hukuk,  toplumsal  (sosyal)  olguların dışında olmayıp sosyal bir olgudur. Timasheff açısından normların içeriği olan değerlerin insan davranışları üzerinde etkileri vardır; değerler insan davranışlarını  belirli  bir  yönde  olmasını  zorlayabilir.  Bundan  dolayı normlarla  insan  davranışları  arasında  bir  nedensel  ilişkinin  olması olanaklıdır. Kelsen,  bir hukuk sosyolojisinden bahsetsek bile, bunun konusunun, hukuk  normları  kapsamına  giren  insan  davranışları  olduğunu   söyler. Kelsen  haksız  fiil  sorumluluğu  kapsamında  normatif  hukuk  bilimiyle sosyolojik hukuk bilimini karşılaştırdığı zaman, bir kimsenin sorumluluğuna gidilmesini buyuran kural, normatif hukuk bilimi için bir hukuk kuralı iken, sosyolojik hukuk bilimi için, fiilen uygulandığı için gerçek bir kuraldır. Aynı  olayla  ilgili  olarak  bir  tahminde  bulunulması  durumunda  normatif hukuk  bilimi  için,   mahkeme  şöyle  karar  vermelidir   şeklinde  iken, sosyolojik hukuk bilimi için  mahkeme şu şekilde karar verecektir  biçimine dönüşmektedir.  Dolayısıyla Kelsen açısından, hukuk normları olmadan, hukuk sosyolojisi de olamayacağı için, sosyolojik hukuk biliminin varlığı,                                                             111  Kelsen, The Pure Theory of Law and Analytical…, s. 44. 112  Bkz. Özbilgen, Hukuk Sosyolojisi, s. 66. 113  Kelsen, Pure Theory of Law. S. 85. 114  Kelsen, Pure Theory of Law. S. 86 vd; eleştiriler için bkz. Özbilgen, Hukuk Sosyolojisi, s. 67 vd. 115  Timasheff, s. 22. 116  Timasheff, s. 22. 117  Timasheff, s. 22. 118  Bkz. Kelsen, General Theory of Law…, s. 176; Kelsen, The Pure Theory of Law and Analytical…, s. 52-53. 119  Kelsen, General Theory of Law…, s. 172. 120  Kelsen, General Theory of Law…, s. 172 vd. 246Ankara Üni. Hukuk Fak. Dergisi, 67 (2) 2018: 227-252                                        Hukuk Kavramının Analizi  normatif hukuk sisteminin varlığına bağlanmaktadır. Bu yüzden Kelsen açısından,  pozitif hukukun sosyolojisinin sonuçları, esasen normatif hukuk biliminden farkı yoktur . Böylece Kelsen, normatif hukuk biliminden ayrı, salt  insan  davranışlarını  inceleyen  bir  hukuk  sosyolojisini  anlamsız bulmaktadır. Hâlbuki sosyolojik olarak kendiliğinden gelişen normlar, tekrarlanan ve kalıplaşan insan hareketlerinin bir sonucudur. Karşılıklı beklenti güdüsüyle tekrarlanan  insan  davranışları,  normların  oluşmasına  neden  olmaktadır. Kendiliğinden  gelişen  normların,  hangi  kültürel  ve  ekonomik  ilişkilerin etkisiyle geliştiği, hukuk sosyolojisinin ilgi alanındadır. Toplumların yaşam biçimlerinin  hukuk  üzerindeki  etkisiyle,  hukukun  insan  davranışları üzerindeki etkisi hukuk sosyolojisinin konusu olarak nedensel (illiyet) ilişki bağlamında incelenebilir. Weber in yorumlayıcı sosyolojisinde bile nedensel açıklamanın  yeri  vardır.  Örneğin  Weber de  hukukun  rasyonelleşmesinin ekonomik gelişme (kapitalizm) üzerindeki etkisi bilinen bir tahlildir. Hukuk  sosyolojisi  alanında,  olgular  arasındaki  nedensel  ilişkinin belirlenmesi, yasa  koyucular  ile  uygulayıcılar  için yol  gösterici  nitelikte olabilir.  Örneğin  ekonomik  krizle,  boşanma  olayları  arasındaki  ilişkinin niceliksel  tespiti;  veya  kırsaldaki  suç  çeşitliliği  ile  kentlerdeki  suç çeşitliliğinin karşılaştırılması suç ve ceza politikası bakımından belirleyici olabilir. Bu bağlamda belirli suçların ekonomik refahı yüksek olan kesimler arasında  yaygınlık  kazanması  halinde,  bu  suçların  önlenebilmesi  için yaptırımı olarak adli para cezasına yer verilmemesi sosyolojik bir analizin gereğidir.  Sosyolojik  analizlerin  uygulayıcılar  üzerindeki  etkisi  de  söz konusu  olabilir.  Örneğin,  ekonomik  krizin  boşanma  davasının  açılması üzerindeki  etkisini  kavrayan  yargıç,  daha  etkili  bir  rol  oynayarak  aile birliğini koruma yönünde çaba sarf edebilir. Bir hukuk sisteminin tarihi mirasını açığa çıkararak veya farklı hukuk sistemlerinin  gelişimini  karşılaştırmalı  incelemesini  yaparak  hukuk sosyolojisine veri sağlaması gereken hukuk tarihi, hukuk eğitiminde hukuk sosyolojisi ile yan yana durarak birbirini eyit etmelidirler.                                                             121  Kelsen, General Theory of Law…, s. 175 vd. 122  Kelsen, General Theory of Law…, s. 174; Kelsen açısından, sosyolojik hukuk biliminin işlevi normlara göre mahkemelerin nasıl karar vereceği hususunda tahminde bulunmaktır. Bu da temelde bir hukuk düzeninin etkililiği veya etkisizliğini tahmin etmekten ibarettir. Etkililik ise normatif hukuk bilimi açısından bir normatif düzenin geçerliliği ile ilgili bir durumdur. Dolayısıyla, kelsen açısından sosyolojik hukuk bilimi ile normatif hukuk bilimi arasında bir ayrılık olamaz. (Kelsen, General Theory of Law…, s. 173). 123  Weber, Max, The Protestan Ethic and  The Spirit of Capitalism, (Translated by Talcott Parsons), Routlege, 2005 (orjinali 1930),  s. xxxviii; bkz. Deflem, s. 46-47.   247Sururi Aktaş                                                            Ankara Üni. Hukuk Fak. Dergisi, 67 (2) 2018: 227-252 4-Değerlendirme ve Sonuç Yukarıdaki  açıklama  ve  mülahazalardan  da  görüldüğü  gibi  hukuk kavramı değişik disiplinlerin ilgi alanında yer almaktadır. Hukuki bilgiyi sadece yürürlükte normların bilinmesi ve yorumlanması olarak dogmatik hukuk bilgisinden ibaret saymak, hukukla ilgili sığ ve yüzeysel bir bakış açısını yansıtmaktadır. Dogmatik hukuk bilimi, pozitif hukukun toplumsal gerçeklere  ve  ihtiyaçlara  uygun  olarak  yorumlanması  için  hukuk sosyolojisinden;  adalet  değeri,  insan  hakları  ve  onuruna  uygun  olarak yorumlanması  için  de  hukuk  felsefesinden  yararlanmalıdır.  Vaquero, dogmatik  hukuk  bilimine  alışılmışın  dışında  bir  rol  vererek,  bu  bilimin (disiplinin) sadece pozitif hukukun içeriğini tanımlamakla yetinmeyip, aynı zamanda zor davalarda (hard-cases) yargıçlara çözümler sunması gerektiğini belirtmektedir. Bu düşünceye koşut olarak adı geçen yazar, Aarnio ve Alexy  gibi  mantıksal/formel  gerekçelendirmeyle  yetinmeyen  hukuk felsefecilerinin  hukuksal  akıl  yürütmelerine  uygun  olarak,  hukuk dogmatiğini,  gerekçelendirici  hukuk  dogmatiği  (argumentativist  legal dogmatics)  olarak  yeniden  tanımlamaktadır.  Bu  bağlamda  Vaquero, hukuki  akıl  yürütmenin,  üç  boyutundan  söz  ederek  bunları,  mantıksal geçerlilik,  ikna  edici  kapasite  ve  maddi/özsel  ma kuliyet  (material plausibility) olarak sıralar. Yazar açısından maddi/özsel makuliyet/akla yatkınlık,  hukuki  ihtilaflarda  muhtemel  en  iyi  çözümün  bulunmasını sağlayan şartları belirlemeyi amaçlar. Dolayısıyla bu nitelikteki bir hukuk dogmatiği (dogmatik hukuk bilimi), sadece mevcut kurallardan hareket eden sıradan bir mantıki gerekçeyi yeterli görmeyip, buna akıl yürütmenin ikna ediciliğini ve ortaya çıkardığı sonucun mümkün olduğu kadar en iyi çözüm olmasını  da  eklemektedir.  İşte  dogmatik  hukuk  biliminin  bu  derinlikte kavranabilmesi  için,  hukuk  felsefesi  gibi  diğer  disiplinlerle  beslenmesi gerekir.  Peczenik,  hukuk  dogmatiğinin  betimleyici  ve  mantıksal gerekçelendirme  işlevlerini  içermesi  yanında  değerlendirici  işlevinin  de bulunduğunu  söyler.  Değerlendirici  akıl  yürütmenin,  ahlaki  değerler açısından  yapıldığını  söyleyen  Peczenik,  hukuk  dogmatiğinin,  hukuk siteminin  içsel  bir  tutarlığını  sağlamaya  dönük  bir  görevinin  bulunması                                                             124  Vaquero, s. 60, 67 ve dipnot 37. 125  Vaquero, s. 66. 126  Vaquero, s. 67. 127  Vaquero, s. 67. 128  Peczenik,  Alexander,   Scientia  Iuris:  An  Unsolved  Philosophical  Problem ,  Ethical Theory and Moral Practice, Vol. 3, No. 3, (Sep., 2000), Published by Springer,  s. 289. pp. 273-302.  129  Peczenik, Scientia Iuris, s. 289-290. 248Ankara Üni. Hukuk Fak. Dergisi, 67 (2) 2018: 227-252                                        Hukuk Kavramının Analizi  yanında,  söz  konusu  sistemin  ahlak  ve  siyaset  felsefesi  bakımından  da temellendirilmesini yapmaya dönük bir işlevinin olduğunu belirtir.    Hukuki  kurumların  işlevlerinin  doğru  olarak  kavranması,  hukuksal kavramların doğru olarak anlamlandırılması ve genel bir hukuk teorisine yol gösterici olması bakımından hukukun sosyolojik ve tarihsel analizlerinin yapılması  gerekir.  Bu  analizler,  örneğin  aile  ve  miras  kavramlarının toplumun işleyişi için ne anlam ifade ettiği ve buna benzer kurumların nasıl ortaya çıktığına ilişkin analizlerin yapılması ile dini metinlerdeki hukuksal kurumlar ve bu kurumların işlevleriyle ilgili sosyolojik tespitlerin yapılması bakımından  hukuk  yapımcıları  ve  reformcuları  için  yol  göstericidir. Billurlaşmış  evrensel  değerlerin tarihsel  ve  sosyolojik olarak işlevlerinin irdelenmesi ve doğru bir hukuki tasavvur için hukuk sosyolojisi ve hukuk tarihi disiplinlerinin, hukuk biliminin (jurisprudence) kaçınılmaz bir ögesi olduğunun bilincine varılması gerekir. Bu disiplinleri ihmal eden nice iyi niyetli  kişiler,  hukuksal  kurum  ve  kavramların  gerçek  anlamlarını kavrayamadıkları  için  beşeriyetin  hukuki  tasavvuruna  büyük  zarar vermişlerdir. Hukukun sadece kuvvete değil, aynı zamanda da hakka ve her toplumca kabul edilebilen bir takım evrensel değer ve ilkelere dayandığının anlaşılması için dar anlamda (normatif) hukuk felsefesi tahlillerine ihtiyaç vardır. Hukuk öğrencilerinin ve hukuka ilgi duyanların, hukuk bilgisinin, beşeri iradenin koyduğu normlarla tükenmediğinin farkına varmaları; hukuk öğreniminin ise dogmatik hukuk disipliniyle sınırlı olmadığının kavranması; hukukun  gerçek  kaynaklarına  inilmesi;  hukukun  dilsel  ve  mantıksal analizinin yapılması; ahlaki, ekonomik ve toplumsal ihtiyaçlar bağlamında tetkike tabi tutulması gereğinin bilincinde olunması, gerek evrensel düzeyde ve gerekse yerel düzeyde doğru/adil olmayan hukuk telakkilerinin önüne geçilmesi  bakımından  önem  arz  etmektedir.  İnsan  haklarının  ve  insan onurunun  korunması  bakımından  hukukun  derinlikli  olarak  kavranması kaçınılmazdır.  Hukuki  tefekkürümüzü  zenginleştirmek  için  genel  hukuk teorisi ve hukuk sosyolojisi gibi hukukun pozitif yöntemlerle tetkik edilmesi yanında, evrensel değerler ve adalet açısından eleştirel bir bakış açısına da ihtiyaç vardır. Bu görevi de hukuk felsefesiyle güçlendirilmiş bir hukuk eğitimi yerine getirmelidir.                                                               130 Peczenik, Scientia Iuris, s. 290.   249Sururi Aktaş                                                            Ankara Üni. Hukuk Fak. Dergisi, 67 (2) 2018: 227-252 Kaynakça Aral, Vecdi, Hukuk Felsefesinin Temel Sorunları, Filiz Kitabevi, İstanbul 1992. Aral,  Vecdi,  Kelsen in  Saf  Hukuk  Teorisinin  Metodu  ve  Değeri,  İstanbul Üniversitesi Hukuk Fakültesi Yayını, İstanbul 1978. Aulis, Aarnio, The Rational as Reasonable: A Treatise on Legal Justification, Reidel Publishing Company Dordrecht, 1987. Austin, John, Hukukun Belirlenmiş Alanı (Çev. Üker Yükselbaba-Saim Üye-Umut Koloş), 1. Baskı, Tekin Yayını 2015. Austin, John, The Province of Jurisprudence Determined, (Edited By Wilfrid E. Rumble), Cambridge University Press, 2001,  Lecture I. Baali, Fuad, Society, State and Urbanism: Ibn Khaldun s Sosyological Thought, State University of New York Press, 1988. Curzon, L. B., Jurisprudence, 2nd Edition,Cavendish Publishing, London-Sydney, 1995. Çağıl, Orhan Münir, Hukuk Metodolojisi Dersleri, İkinci Tab, İstanbul Üniversitesi Hukuk Fakültesi Yayınları, İstanbul 1952. Dagan, Hanoch, Kreitner, Roy,  The Character of Legal Theory , Cornell Law Review, (2011), Vol. 96,  pp. 671-191. Dworkin,   Law as Interpretation , Texas Law Review, Vol. 60, (1982). Evensky, Jerry,  Adam Smith s Moral Philosophy: A Historical and Contemporary Perspective on Market, Law, Ethics, and Culture, Cambridge University Press 2005. Finnis, John,  What is The Philosophy of Law , Rivista di Filosofia del Diritto no. 1, (2012), pp. 67-78. Fridmann, W., Legal Theory, 2nd Edition, London 1949. Georges, Gurvitch, Sociology of Law, (With a New Introduction by Alan Hunt), Transanction Publishers, 2001. Gözler, Kemal, Hukuka Giriş, Ekin Yayını, 13. Baskı Bursa 2016. Gözler, Kemal, Hukukun Genel Teorisine Giriş  Hukuk Normlarının Geçerliliği Ve Yorumu Sorunu,Us-A Yayıncılık, Ankara 1998. Güriz, Adnan, Hukuk Felsefesi, 7.  Baskı, Siyasal Kitabevi, Ankara 2007. Gürkan, Ülker, Hukuk Sosyolojisine Giriş, Gözden Geçirilmiş 4. Baskı, Siyasal Kitabevi, Ankara 2005. Hart, H.L.A., The Concept of Law, Second Edition, (with a postcript edited by Penelope A. Bulloch and Joseph Raz) Clarendon Press-Oxford, 1994. Hassan, Ümit, İbn Haldun un Metodu ve Siyaset Teorisi, 2. Baskı , Toplumsal Dönüşüm Yayınları, 1998 İstanbul. 250Ankara Üni. Hukuk Fak. Dergisi, 67 (2) 2018: 227-252                                        Hukuk Kavramının Analizi  Hayek,  Friedrich  August  von,  Kanun,  Yasama  Faaliyeti  ve  Özgürlük,  C.I. (Kurallar ve Düzen), (çev. Atilla Yayla), 1. baskı, Türkiye İş Bankası Kültür Yayınları, Ankara 1994; Kanun, Yasama Faaliyeti ve Özgürlük, C. II (Sosyal Adalet Serabı), (çev. Mustafa Erdoğan) 1. Baskı, Türkiye İş Bankası Kültür Yayınları, 1995; Hukuk, Yasama ve Özgürlük, C. III. (Özgür Bir Toplumun Siyasal Düzeni), (çev. Mehmet Öz), Türkiye İş Bankası Kültür Yayını, 1997).  Hirş, Ernest, Hukuk Felsefesi ve Hukuk Sosyolojisi Dersleri, (Güncel dile uyarlayan Selçuk Baran (Vezirioğlu) 3. Tıpkı Basım, Ankara 2001. Işıktaç, Yasemin, Hukuk Felsefesi, Filiz Kitabevi, İstanbul 2004. Işıktaç, Yasemin, Hukuk Sosyolojisi, Filiz Kitabevi, İstanbul 2014. İbn Haldun, Mukaddime, Cilt I (Çev. Zakir Kadiri Ugan), MEB Yayını, İstanbul 1990. İzveren, Adil, Hukuk Felsefesi, Dokuz Eylül Üniversitesi Hukuk Fakültesi Yayını, Ankara 1988. Julie Dickson,  Methodology in Jurisprudence: A Critical Survey , Legal Theory, 10 (22049, pp. 117-156. Kantorowicz,  Herman  U./Patterson,  W.,   Legal  Science--A  Summary  of  Its Methodology , Columbia Law Review,Vol. 28, No. 6 (Jun., 1928),  pp. 679707. Kelsen, Hans,  The Pure Theory of Law and Analytical Jurisprudence , Harvard Law Review, Vol. 55, No. 1. (Nov., 1941),  pp. 44-70. Kelsen, Hans, General Theory of Law and State (Translated by Anders Wedberg), Third Printing 1949, (Orginally Camridge-Harvard University Press 1945). Kelsen, Hans, Pure Theory of Law, (Translated From Second Revised and Enlarged German Edition) by Max Knight), Fift Printing 2005. Mecleod, Ian, Legal Theory,  Published by Palgrave Macmillan 2nd Edition, 2003. Merriam-Webster  Dictionary,   jurisprudence ,  https://www.merriamwebster.com/dictionary/jurisprudence (E.T. 04.01.2017) Minemura Teruo,  Dogmatic Legal Science and Sociology of Law , Archiv für Rechts- und Sozialphilosophie / Archives for Philosophy of Law and Social Philosophy, (ARSP), Vol. 56, No. 3 (1970), pp. 351-366 Ökçesiz,  Hayrettin,   Doğru  Hukukun  Bilgisi ,  Hukuk  Felsefesi  ve  Sosyolojisi Arkivi (HFSA), 8. Kitap, Haz. Hayrettin Ökçesiz, İstanbul Barosu Yayını, İstanbul 2003, ss. 120-135. Özbilgen, Tarık, Eleştirel Hukuk Başlangıcı Dersleri, İstanbul Üniversitesi Hukuk Fakültesi Yayınları İstanbul 1976. Özbilgen, Tarık, Eleştirisel Hukuk Sosyolojisi Dersleri, Cilt  I, İstanbul Üniversitesi Hukuk Fakültesi Yayınları, İstanbul 1971. Deflem, Mathieu, Sosyology of Law, (Vision of Scholarly Tradition ), Cambridge University Press, 2008.   251Sururi Aktaş                                                            Ankara Üni. Hukuk Fak. Dergisi, 67 (2) 2018: 227-252 Özcan, Mehmet Tevfik, Hukuk Sosyolojisine Giriş, 1. Baskı, Donkişot, İstanbul 2001. Peczenik, Aleksander, On Law and Reason, Springer, 2008. Peczenik, Alexander,  Scientia Iuris: An Unsolved Philosophical Problem , Ethical Theory and Moral Practice, Vol. 3, No. 3 (Sep., 2000), Published by: Springer, pp. 273-302.  Phillipps, Charler Spencer March, Jurisprudence, Adamant Media Corporation (Elibron Cllasics Series), 2006. Posner, Richard A.,  The Decline Of Law As An Autonomous Discipline: 19621987 , Harvard Law Review  (1986-1987),  Vol. 100,  pp. 761-780. Pound, Rorcoe, An Introduction to The Philosophy of Law, Yale University Press  1922. Raz, Joseph,  Can There Be a Theory of Law , The Blackwell Guide to The Philosophy of  Law  and  Legal  Theory  (Edited  by  Martin  P. Golding  and William A. Edmundson), Blackwell Publishing, 2005, pp. 324-342. Schwarz, Andreas B.,  Roma Hukuku ve İngiliz Hukuku , İstanbul Üniversitesi Hukuk Fakültesi Mecmuası, Cilt 11, sayı 3-4, 1945, pp. 180-202.  Timasheff, Nicholas S., An Introduction to The Sosyology of Law (with a new introduction by Javier Trevino), 3th Printing, Transcantion Publishers. Topçuoğlu,  Hamide,  Hukuk  Sosyolojisi,  Cilt  I,  Ankara  Üniversitesi  Hukuk Fakültesi yayınları, Ankara 1960.  Troper, Michel, Hukuk Felsefesi, Çev. Işık Ergüden, Dost Yayını, Ankara 2011. Twining,  William;  General  Jurisprdence:  Understanding  Law  From  Global Perspective,  Cambridge University Press, 2009. Uygun, Oktay, Hukuk Teorileri, 1. Baskı, OnikiLevha Yayını, İstanbul 2017. Uygun, Oktay, İbn Haldun un Toplum ve Devlet Kuramı, XII Levha Yayını, 1. Baskı, İstanbul 2008. Uygur, Gülriz, Hukuk, Etik ve İlkeler, Siyasal Kitabevi, Ankara 2006. Vaquero,  Alvaro  Nunez,   Five  Model  of  Legal  Science ,  Translator:  Ester González Bertrán, Journal for Constitutional Theory and Philosophy of Law / Revija za ustavno teorijo in filozofijo prava (REVUS), Klub Revus, 19, 2013, pp. 53-81. Weber, Max, The Protestan Ethic and  The Spirit of Capitalism, (Translated by Talcott Parsons), Routlege, 2005 (orjinali 1930),  s. xxxviii. Westerman, Pauline C., The Disintegration of Natural Law Theory: Aquinas to Finnis, Brill 1998. Yazıcı, Sedat, Felsefeye Giriş, Genişletilmiş 3.baskı, Öncü Kitap, Ankara 2009. 252",
     "Metin": "Hukuk  kavramını  ele  alan  temel  disiplin  ve  teorilerin,  analiz  ve incelemelerinde  benimsedikleri  yol  (usul)  ve  bakış  açılarını,  hukukun kavranmasına ilişkin yöntem (metod) olarak nitelendirmekteyiz. Örneğin,  hukuk  felsefesi   genel  olarak  normatif  bir  yöntem  benimseyerek  ideal hukuka yönelirken;  genel hukuk teorisi , betimleyici bir yöntemle hukuk olgusunun ortak kavramlarının ne olduklarını sadece betimlemektedir; hukuk sosyolojisi  de  açıklayıcı  ve  betimleyici  bir  yöntemle  hukuksal  olay  ve olguları iyi-kötü (adil - gayri adil) değerlendirmesi yapmadan betimleyip açıklamaktadır.  Genel  hukuk  teorisi  ile  hukuk  sosyolojisinin  yöntemini, hukuka ilişkin daha genel bir yöntem olarak pozitivist yöntem içerisinde görebiliriz.  Hukuk  teorileri  ve  disiplinlerinin  hukuk  kavramının incelenmesinde benimsedikleri usul ve yöntem, nasıl bir hukuk anlayışının ortaya  çıkmasında  belirleyici  olmaktadır.  Dolaysıyla  hukuk  kavramının incelenmesi,  tek  bir  bakış  açısıyla  veya  tek  bir  yöntemle sınırlandırılmamalıdır.  Bu,  hukuk  kavramının  çok  yönlülüğünün  bir gereğidir. Hukukun  değişik  cephe  ve  boyutları  olması  dolayısıyla  çeşitli yöntemler açısından incelenmeye konu olmaktadır. Bu bağlamda hukukun temel disiplinlere nasıl konu olduğu ve bu disiplinlerin yöntemi açısından hukuk kavramı ve olgusuna nasıl yaklaşıldığı analiz edilmelidir. Böyle bir gereklilik,  hukukun,  hukuk  sosyolojisi  gibi  birçok  alt  disiplinin  konusu olması sonucunu doğurmaktadır. Her disiplinin yöntemi açısından hukuk, farklı açılardan kavranmaya çalışılmaktadır. Hukuk öğrencileri veya hukuk öğrenmeye meraklı olanlar, hukuka genellikle tek bakış açısıyla yaklaşmaya çalışmaktadırlar. Bu bakış açısı ise çoğunlukla dogmatik hukuk disiplinin yöntemi olarak belirleyici olmaktadır. Pozitif hukuk kuralları altında yatan etik  ilkeler,  kuralların  ortaya  çıkmasında  etkili  olan  toplumsal  gerçekler (olgular) genellikle bu bakış açısına girememektedir. Hukuk kavramının tam anlamıyla kavranabilmesi değişik bakış açılarına konu olabilmesine bağlıdır. Belki,  kısa  bir  hukuk  eğitimi  sürecinde  bu  tam  anlamıyla  mümkün olamayabilir.  Ancak  hiç  değilse  hukukun  değişik  yöntem  ve  disiplinler açısından tahlil edilmesi gereği konusunda farkındalık oluşturmak yararlı olabilir. 2- Hukuk Kavramı ve Olgusunun Çeşitli Açılardan Kavranması Gereği Hukuki düşüncemizi zenginleştirmek, hukuksal kurum ve kavramları doğru kavramak için hukuku değişik disiplinlerin konusu haline getirmemiz önem arz etmektedir. Özellikle biçimsel mantık açısından doğru hukuki akıl 228Ankara Üni. Hukuk Fak. Dergisi, 67 (2) 2018: 227-252                                        Hukuk Kavramının Analizi  yürütme (legal reasoning) kabiliyetine sahip olmak için, doğru ve geçerli düşünme  yöntemlerini  (formel/biçimsel  mantığı)  hukuk  eğitiminin  bir parçası  haline  dönüştürmemiz  gerekir.  Mantık,  İslam  bilimlerinde derinlemesine okutulagelmiş bir disiplindir. Mantık biliminin diğer sosyal bilimlerle  ilişkilendirilmesi  gerekir.  Mantık,  sadece  felsefe  öğrencilerine okutulacak,  diğer  bilimlerden  soyutlanmış  ve  kendi  amacını  kendinde taşıyan bir disiplin değildir. Mantık doğru düşünmenin ilkelerini araştırır ve diğer bilimler için bir araç niteliğini taşır. Dil, gramer ve mantık alet ilmi olarak  bilimlerin  vazgeçilmez  müfredatını  oluşturmaktadır.  Mantık  ve felsefenin başka bilimler ve disiplinler için kaynaklık etmesi gerekir. Ama ne yazık ki, Türkiye de sosyal bilimlerdeki felsefe, mantık ve sosyoloji gibi temel  disiplin  ve  bilimler  kendi  alanlarına  çekilmiş,    hukuk  gibi  diğer bilimler için araç (alet) olma niteliklerini kaybetmiştir. Halbuki, bu gibi temel bilimler, hukuk, iktisat gibi diğer bilimleri  desteklemeleri gerekir. Kısaca  disiplinlerarası  geçişkenliğin  sağlanması  gerekir.  Kantorowicz  ve Patterson ın belirttiği gibi  hukuk bilimi, hukuk ve bilim dışındaki unsurların yardımı olmaksızın işe yaramaz . Bu ünlü yazarların cümlesinden, hukuk biliminin,  pozitif  hukuk  bilgisiyle  sınırlı  olmadığını  ve  hukukun  sadece bilimsel  (betimleyici  veya  açıklayıcı)  bir  açıdan  ele  alınmasının  eksik olacağını anlayabiliriz.  Posner, hukukun özerk bir disiplin olduğu ve hukuk öğrencilerinin de sadece hukuk alanıyla ilgilenmeleri gerektiğine ilişkin düşüncenin ideolojik bir anlayışın ürünü olduğunu söyler. Yazara göre,  İngiltere de yargıçlar kendi kararlarına Kraliyetin müdahale etmesini engellemek için, hukukçular da  hukuki  meselelerde  kendi  tekelliklerini  korumak  için  bu  ideolojik düşünceye  başvurmuşlardır.  Yine  Posner in yaptığı  tespite  göre,  hukuki bilginin çıktığı kaynağın yargısal kararlar olduğu, hukuk eğitiminin de bu kararların öğrenilmesi ve karşılaştırılmasıyla ilgili olduğuna dair düşünceyi akademiye  getiren  kişi,  Harvard  Hukuk  Mektebinin/Fakültesinin  eski dekanlarından  Cristopher  Columbus  Langdell  (1826-1906)    olmuştur. Posner, hukuk teorisiyle kastettiği şeyin  geleneksel mesleki yeterlilik bilgisi olmadığını, mesleğin dışından, bilimsel ve beşeri araştırma yöntemlerini kullanarak hukuk sistemine ilişkin bilginin genişletilmesi olduğunu  belirtir.                                                             1   Kantorowicz,  Herman  U./Patterson,  W.,   Legal  Science--A  Summary  of  Its Methodology , Columbia Law Review,Vol. 28, No. 6 (Jun., 1928), s. 707, pp. 679-707. 2   Posner, Richard A.,  The Decline of Law as an Autonomous Discipline: 1962-1987 , Harvard Law Review  (1986-1987),  Vol. 100, s. 762,  pp. 761-780. 3   Posner, s. 761. 4   Posner, s. 761. 5   Posner, s. 779.   229Sururi Aktaş                                                            Ankara Üni. Hukuk Fak. Dergisi, 67 (2) 2018: 227-252 Hukukun  temeli,  genel  olarak  felsefi,  sosyolojik  ve  akli/mantıki boyutlara  sahip  olduğu  için,  bütün  bu  boyutların  gerektirdiği  bilişsel analizlere tabi tutulması gerekir. Aksi takdirde hukuk olgusu ve kavramı eksik anlaşılmış olur. Bu genel analizlerde iktisat, psikoloji ve tarih gibi diğer bilimlerden/disiplinlerden de yararlanmak gerekir. Örneğin doğru/adil bir hukuk kavramı için felsefi analiz yapılırken iktisat bilimi ve tarihinin verileri göz ardı edilemez. Mallara ve diğer maddi değerlere sahip olma ile ilgili adalet ilkeleri konusundaki tartışmalarda, iktisadi analizlerin dikkate alınması önem arz eder. Felsefi analiz olarak ahlak felsefesine girilirken, bir taraftan beşeri medeniyetin getirdiği ahlaki birikim, diğer taraftan iktisat felsefesi ihmal edilmemelidir. 3- Hukukun Kavranmasına Yönelik Bilişsel Çabaların Tasnifleri Hukuk bilimi/ilmi (jurisprudence) dendiğinde kastedilen şey, tamamen doğa bilimlerinde olduğu gibi dar anlamda   bilim  (science) değildir. Doğa bilimleri, deneysel olarak doğal fenomenler (olgular) arasındaki nedensel ilişkiyi  tespit  etmeye  veya  doğal  kanunlarla  doğal  olayları  açıklamaya çalışır. Naturalist (pozitivist) sosyoloji,  hukuk sosyolojisi  alt disiplini adı altında  hukuk  olgusu  ve  kavramına  doğal/pozitif  bilimlerin  yöntemiyle yaklaşsa da, hukuk bilimi, hukuk sosyolojisiyle tükenmediği için daha geniş bir inceleme araştırma alanına sahiptir. Hukuk sosyolojisi dışında, Hans Kelsen  ve  Hart  gibi  pozitivistler  hukuk  kavramına  pozitif  bir  yöntemle yaklaşmaya  çalışmışlardır.  Dolayısıyla  hukuk  sosyolojisi  dışında  hukuku pozitif yöntemle analiz etmeye çalışanlar,  genel hukuk teorisi  biçiminde eserler kaleme alan bazı hukuki pozitivistler olmuştur.                                                              6   Bu çalışmada  doğru/adil hukuk  tanımlamasındaki  doğru  sıfatı,  adil  sıfatı ile birlikte,  iyi hukuk  ya da  ideal hukuk u (de lege ferenda yı) anlatmak için kullanıldı.  Tartışılan konu hukuk bilimi olduğu için,  adil hukuk kavramı  yanında,  doğru  sıfatı da kullanıldı. Doğru hukuku kavramının,  iyi hukuk  ya da  ideal  hukuk  olarak adalete hizmet edebileceği telakki edildi. ( Doğru hukuk  kavramı için Bkz. Ökçesiz, Hayrettin,  Doğru Hukukun Bilgisi , Hukuk Felsefesi ve Sosyolojisi Arkivi (HFSA), 8. Kitap, Haz. Hayrettin Ökçesiz, İstanbul Barosu Yayını, İstanbul 2003, s. 120-135; Uygur, Gülriz, Hukuk, Etik ve İlkeler, Siyasal Kitabevi, Ankara 2006, s. 75 vd). 7   Troper, hukukun bilim olup olmayacağını, hukuk ve bilim sözcüklerine yükleyeceğimiz anlama bağlı olduğunu söyler. Yazara göre hukuku bir bilim olarak kabul etmesek de,  hukuk tan farklılaşmış ve hukuku konu olarak tanımlaya çalışan bir bilimin varlığı müzakere edilebilir. (Troper, Michel, Hukuk Felsefesi, Çev. Işık Ergüden, Dost Yayını, Ankara 2011, s. 31). Troper, bu bağlamda hukuku tanımlamayı nesnesi haline getiren hukuk biliminin, değerlendirici bir yönteme başvurmadan hukuku değerlerin toplamı olarak incelemesi halinde bilişsellikle uyuştuğu gibi, hukuku bir değerler toplamı olarak değil de insan iradesinin va z ettiği kurallar toplamı olarak ele alıp incelerse, bu sefer de yine etiğin bilinemeyeceğine ilişkin bilişsellik karşıtlığıyla uyuşabileceğini söyler.(Troper, s. 32). 8   Kelsen in yazdığı ve aşağıda atıf yaptığımız eserler genelde bu niteliktedir.  230Ankara Üni. Hukuk Fak. Dergisi, 67 (2) 2018: 227-252                                        Hukuk Kavramının Analizi  Kelsen  hukuk  biliminin  konusu  olarak  hukuk  normlarını göstermektedir. Kelsen, eğer beşeri ilişkiler hukuk normları tarafından inşa edilirse,  bunların  da  hukuk  biliminin  konusunu  oluşturacağını söylemektedir.  Bu bağlamda Kelsen hukuk bilimini, normatif hukuk bilimi (normative  jurisprudence)  ve  sosyolojik  hukuk  bilimi  (sociological jurisprudence) diye ikiye ayırmaktadır. Kelsen in normatif hukuk bilimi dediği,  hukuk  normlarını  konu  edinen  saf  hukuk  teorisidir.  Başka  bir anlatımla Kelsen de normların bilinmesi, saf hukuk teorisinin ve dolayısıyla normatif  hukuk  biliminin  konusu  oluşturur.  Aşağıda  göreceğimiz  gibi normatif hukuk bilimi tanımlaması daha çok, hukuku, etik değerler açısından kavramaya çalışan değerlendirici hukuk disiplinleri ve çoğunlukla hukuk felsefesi için kullanılır. Oysa Kelsen in normatif hukuk bilimi, iyi ve adil hukuku  araştırmaya  dönük  değerlendirici  bir  disiplin  olmayıp,  tamamen betimleyici ve açıklayıcı niteliktedir. Kelsen,  saf hukuk teorisinin, pozitif bir  hukuk  teorisi,  genel  hukuk  teorisi  olduğu,  herhangi  bir  özel  hukuk düzeninin  sunumu  ve  yorumu  olmadığını   belirtir.    Analitik  hukuk biliminin önde gelen temsilcisi John Austin de  hukuk bilimi ni ifade etmek için  jurisprudence  kavramını  kullanarak,  bu  bilimin  konusunun  pozitif hukuk olduğunu söyler. Ünlü hukuk sosyologu Timasheff, hukukla ilgili entelektüel faaliyetler olarak, hukuk felsefesi, hukuk bilimi (jurisprudence) ve hukuk sosyolojisi şeklinde bir tasnife giderek, bu üç disiplin arasındaki ayrımın tarihsel bir                                                             9   Kelsen, Hans, General Theory of Law and State (Translated by Anders Wedberg), Third Printing 1949, (Orginally Camridge-Harvard University Press 1945), s. 70. 10  Kelsen, General Theory of Law…, s. 70. 11  Kelsen, Hans,  The Pure Theory of Law and Analytical Jurisprudence , Harvard Law Review, Vol. 55, No. 1. (Nov., 1941), s. 50,  pp. 44-70. 12  Bkz. Kelsen, The Pure Theory of Law and Analytical…, s. 50. 13  Kelsen, The Pure Theory of Law and Analytical…, s. 44; Bkz. Aral, Vecdi, Kelsen in Saf Hukuk  Teorisinin  Metodu  ve  Değeri,  İstanbul  Üniversitesi  Hukuk  Fakültesi  Yayını, İstanbul 1978, s. 11; s. 279; Işıktaç, Yasemin, Hukuk Felsefesi, Filiz Kitabevi, İstanbul 2004, s. 279; Mecleod, Ian, Legal Theory,  Published by Palgrave Macmillan 2nd Edition, 2003, s. 86. 14  Austin, John, The Province of Jurisprudence Determined, (Edited By Wilfrid E. Rumble), Cambridge University Press, 2001,  Lecture I, s. 18;  Bu esrin Türkçe çevirisi için bkz.Austin, John, Hukukun Belirlenmiş Alanı (Çev. Üker Yükselbaba-Saim Üye-Umut Koloş), 1. Baskı, Tekin Yayını 2015, s. 27; Vaquero, hukuk biliminin bazı belirsizlikler taşıdığı söylemekle beraber, bu bilimi,  hukuk alimlerinin gerçekleştirdiği faaliyetler ve bu faaliyetleri  yönlendiren  yöntemsel  faraziyeler   olarak  algıladığını  söylemektedir. (Vaquero, Alvaro Nunez,  Five Model of Legal Science , Translator: Ester González Bertrán, Journal for Constitutional Theory and Philosophy of Law / Revija za ustavno teorijo in filozofijo prava (REVUS), Klub Revus, 19, 2013, s. 56, pp. 53-81.   231Sururi Aktaş                                                            Ankara Üni. Hukuk Fak. Dergisi, 67 (2) 2018: 227-252 gerçek olmaktan çok bir postulat olduğunu söyler. Yazara göre bu üç disiplin birbiriyle bağlantılı olarak gelişmiştir. Timasheff, jurisprudence ın (hukuk  biliminin)  kapsamına,  belirli  normları  inceleyen,  yorumlayan  ve sınıflandıran disiplin olarak pozitif (analitik) hukuk bilimini (genel olarak dogmatik  hukuk  bilimi  olarak  adlandırılır),  normları  tarihsel  açıdan inceleyen tarihsel hukuk bilimini (genel olarak hukuk tarihi olarak bilinir), çeşitli ülke hukuklarını karşılaştıran mukayeseli hukuk bilimini ve hukukun zaman ve mekana göre değişmeyen biçimsel yanını inceleyen teorik hukuk bilimini (yaygın olarak genel hukuk teorisi olarak adlandırılır) dahil eder. Yazara göre hukuk sosyolojisi, insan davranışlarını nedensel ilişki içerisinde incelediği için, jurisprudence (hukuk bilimi) içinde değil de, onun yanında bir disiplin olarak durması gerekir. Çağıl,  hukuk  bilimini,  dar  anlamda  hukuk  bilimi  (teorisi)  ve  geniş anlamda hukuk bilimi olarak ikiye ayırmaktadır. Dar anlamda hukuk bilimi olarak genel hukuk teorisini gösterirken, geniş anlamda hukuk bilimi olarak da hukuk felsefesi, hukuk sosyolojisi ve hukuk tarihini sayar. Kantorowicz ve Patterson, hukuk bilimini, hukukun anlamının inşasına ilişkin olarak genel hukuk bilimi (genel hukuk teorisi gibi) ve özgül hukuk bilimi (Roma hukuku gibi)22; deneysel alanda hukukun gerçekliğine ilişkin olarak  hukuk  sosyolojisi  ve  hukuk  tarihi;  deontolojik  alanda  hukukun değerine  ilişkin  olarak  hukuk  felsefesi  ve  yasamaya  ilişkin  hukuk  bilimi (legislative jurisprudence) olarak sınıflarlar. Anlaşıldığı gibi Kantorowicz ve Patterson, hukukun yöneldiği değeri/değerleri konu edinen deontolojik hukuk incelemelerini de legal science olarak ifade ettikleri hukuk biliminin kapsamında görmektedirler. Dolayısıyla iyi hukuk ideali (le lege ferenda), deontolojik  bir  saha  olarak  hukuk  biliminin  kapsamında değerlendirilmiştir.                                                             15  Timasheff, Nicholas S., An Introduction to the Sosyology of Law (with a new introduction by Javier Trevino), 3th Printing, Transcantion Publishers, s. 29. 16  Timasheff, s. 29. 17  Timasheff, s. 24. 18  Timasheff, s. 26. 19  Timasheff, s. 27. 20  Çağıl, Orhan Münir, Hukuk Metodolojisi Dersleri, İkinci Tab, İstanbul Üniversitesi Hukuk Fakültesi Yayınları, İstanbul 1952, s. 143-144. 21  Çağıl, s. 143-144. 22  Kantorowicz/Patterson, s. 691. 23  Kantorowicz/Patterson, s. 691. 24  Kantorowicz/Patterson, s. 691. 25  Bkz. Kantorowicz/Patterson, s. 682-684. 232Ankara Üni. Hukuk Fak. Dergisi, 67 (2) 2018: 227-252                                        Hukuk Kavramının Analizi  Twining,  hukuk  bilimini  (jurisprudence),  normatif  hukuk  bilimi (normative jurisprudence), analitik hukuk bilimi (analytic jurisprudence) ve empirik/sosyolojik  hukuk  bilimi  (empirical/sociological  jurisprudence) olarak üçe ayırmayı uygun bulmaktadır. Yazarın analizine göre,  analitik hukuk bilimi kavramlar ve akıl yürütmeyi konu edinirken, normatif hukuk bilimi,  değerleri  merkeze  alan  etik  ve  politika  bilimiyle  ilgili, empirik/sosyolojik hukuk bilimi ise hukuksal olgularla ilgidir. Görüldüğü gibi Twining, hukuk sosyolojisini de hukuk biliminin içine dahil etmiştir. Hart, The Concept of Law eserine eklenen postscript de betimleyici (descriptive)  hukuk  teorisi,  değerlendirici  (evaluative)    veya haklılaştırıcı/meşrulaştırıcı  (justificatory)  hukuk  teorisi  ayrımı  yaparak, kendi  teorisini  betimleyici,  Dworkin in  hukuk  teorisini  ise  kısmen değerlendirici ve haklılaştırıcı olarak tanımlamıştır. Ancak H.L.A Hart, The Concept  of  Law  adlı  eserinin  girişinde  kendi  yaklaşımını  aynı  zamanda betimleyici sosyoloji (descriptive sociology) olarak da tanımlamıştır Hart, kendi  teorisinin  ahlak  bakımından  nötr  olduğunu  ve  herhangi  bir haklılaştırıcı/meşrulaştırıcı  bir  amaç  gütmediğini  söylemektedir. Değerlendirici veya haklılaştırıcı hukuk teorileri, doğru/adil ve haklı hukuk ya  da  daha  genel  bir  ifadeyle  iyi  hukuk  ideallerini,  benimsedikleri değerler/ilkeler temeline dayanarak savunmaktadırlar. Başka bir ifade ile değerlendirici veya haklılaştırıcı hukuk teorileri, doğru/adil hukuk arayışına dönük düşünsel etkinlikleri hukuk biliminin konusu haline getirmektedirler.  Hukuki  pozitivizme  karşı  gelen  Dworkin in  hukuk  teorisinin değerlendirici  bir  teori  olması,  hukuku  bir  yorum  meselesi  olarak  ele almasından  kaynaklanır.  Dworkin de  hukuki  önermelerin  en  iyi  ve  en doğru  bir  biçimde  anlaşılması,  adalet  ilkeler  açısından  yorumlanmasına bağlıdır.                                                              26  Twining, William; General Jurisprdence: Understanding Law from Global Perspective,  Cambridge University Press, 2009, s. 13. 27  Twining, s. 13. 28  Hart, H.L.A., The Concept of Law, Second Edition, (with a postcript edited by Penelope A. Bulloch and Joseph Raz) Clarendon Press-Oxford, 1994, s. 240; bkz. Julie Dickson,  Methodology in Jurisprudence: A Critical Survey , Legal Theory, 10 (22049, s, 118-119, pp. 117-156. 29  Hart, s. 240. 30  Hart, s. v.   31  Hart, s. 240. 32  Bkz. Dworkin,   Law as Interpretation , Texas Law Review, Vol. 60, (1982), s. 527-550. 33  Uygur, s. 70-71.   233Sururi Aktaş                                                            Ankara Üni. Hukuk Fak. Dergisi, 67 (2) 2018: 227-252 Hukuka  yönelik  entelektüel  çabalardan  da  anlaşıldığı  gibi,  hukuk kavramı  ve  olgusu  değişik  disiplin  ve  teorilere  konu  olmaktadır.  Her disiplin kendi yöntemi ve amacı açısından hukuk kavramına yaklaşmaktadır.  Pozitivist hukuk teorileri hariç, hukuk teorileri de kendileri açısından doğru ya  da  iyi  hukuk  tasarımlarını  dile  getirmektedirler.  Pozitivist  hukuk teorilerinin iddiası, hukuku, pozitivist metodolojiye (pozitif bilime) göre en uygun  olarak  kendilerinin  anladıklarına  dönüktür.  Mesela  Kelsen,  kendi teorisinin,  hukuk  bilimini  yabancı  unsurlardan  temizlemeye  çalıştığını söyler. Pozitivist karakterli teorileri bir yana bırakırsak, hukuk teorileri amaçlarının gereği olarak, hukuk disiplinlerinin aksine, kendi hukuk tasarım ve  ideallerinin  en  iyi  hukuk  olduğunu  söyleyerek  indirgemeci  bir  tavır sergilemektedirler.  Oysa  hukuk  disiplinleri  birbirlerini  dışlamayıp, Özbilgen in belirttiği gibi yan yana durabilmektedir.  Hukukun değişik disiplinlere konu olması, beşeri davranışa yönelmiş normatif,  ahlaki, felsefi, toplumsal, tarihsel, dinsel ve iktisadi unsurlara sahip  olmasından  kaynaklanmaktadır.  Her  disiplin  kendi  verileri  ve yöntemiyle hukuk olgusuna yaklaşmaktadır. Bu durum, hukuk kavramına zenginlik katarak hukuki düşüncenin derinleşmesine katkı sağlamaktadır. Örneğin  felsefe,  ideal  hukuk  tasarımlarında  bulunan  teorilere  yönelerek  hukuk felsefesi  alt disiplininin ortaya çıkmasına neden olmuştur. Genel hukuk teorisi disiplini de geniş almamda hukuk felsefesinin konusuna girse de, hukuksal kavram ve kurumlara genel olarak betimleyici bir yöntemle nesnel olarak yaklaştığı için kendine özgü bir karakteri vardır. Timasheff,  genel hukuk teorisinin  işlevini yerine getiren hukuk disiplini için,  teorik hukuk  bilimi   (theoretical  jurisprudence)  tanımlamasını  kullanmaktadır. Sosyoloji, hukuku toplumsal bir olgu olarak ele alarak  hukuk sosyolojisi  alt  disiplini  kimliğine  bürünmüştür.  Tarih,  önceki  zamanlara  ait  hukuki malzemeyi  günümüze  taşımayı  amaçlayarak  hukuk  tarihi  alt  disiplini                                                             34  Bkz. Hİrş, Ernest, Hukuk Felsefesi ve Hukuk Sosyolojisi Dersleri, (Güncel dile uyarlayan Selçuk Baran (Vezirioğlu) 3. Tıpkı Basım, Ankara 2001, s. 8 vd; Gözler, Kemal, Hukukun Genel  Teorisine  Giriş   Hukuk  Normlarının  Geçerliliği  ve  Yorumu  Sorunu,  Us-A Yayıncılık, Ankara 1998, s. 1 vd 35  Bkz.  Uygun,  Oktay,  Hukuk  Teorileri,  1.  Baskı,  OnikiLevha  Yayını,  İstanbul  2017,  (tümüne atıf). 36  Bkz. Kelsen, Hans, Pure Theory of Law, (Translated from Second Revised and Enlarged German Edition) by Max Knight), Fift Printing 2005,  s. 1. 37  Özbilgen,  Tarık,  Eleştirel  Hukuk  Başlangıcı  Dersleri,  İstanbul  Üniversitesi  Hukuk Fakültesi Yayınları İstanbul 1976, s. 7.  38  Özbilgen, s. 8. 39  Bkz. Gözler, Kemal, Hukukun Genel Teorisine Giriş…, s. 9 vd; Troper, s. 15. 40  Timasheff, s. 24. 234Ankara Üni. Hukuk Fak. Dergisi, 67 (2) 2018: 227-252                                        Hukuk Kavramının Analizi  görünümünü almıştır. Bu bağlamda hukuk tarihini, hukuk sosyolojisine veri sağlayan bir disiplin olarak görmek mümkündür. Mantık ve metodolojinin (yöntembilimin)  hukuk  alanına  yansımış  görünümü  olarak   hukuk metodolojisi   karşımıza  çıkmaktadır.  Hukuk  metodolojisi  genel  olarak, gerek biçimsel (formel) mantık ve gerekse hukuka özgü gelişmiş bir takım akıl  yürütme  ilkelerini  incelemeyi  amaçlar.  Hukuk  metodolojisi,  İslam Hukuk Biliminde Usul-i Fıkh olarak büyük önem taşımaktadır. Hatta Usul-i Fıkh, hukuk felsefesini de içine alacak şekilde genişlemektedir.  Hukuk  dogmatiği  (legal  dogmatics)  veya  dogmatik  hukuk  disiplini, belirli bir hukuk düzeninin pozitif kurallarını yorumlama ve sistematize etme işlevini yerine getirmektedir. Minemura, hukuk dogmatiğinin, tıpkı hukuk sosyolojisi  gibi,  kültürel  değerlerin  belirlediği  hukuksal  olguları  konu edindiği için hukuk bilimi sınıflaması içerisine girdiğini söyler. Ancak yazara göre hukuk dogmatiğinin ele aldığı hukuksal olgu, belirli bir hukuk düzeni olduğu halde, hukuk sosyolojisinin ele aldığı hukuksal olgu, hukuk düzeni tarafından düzenlenen yaşamın kendisidir.   Hukuk  eğitimi  ağırlıklı  olarak  dogmatik  hukuk  bilimi  (disiplini) biçiminde  cereyan  etmektedir.  Hukuk eğitimine  daha  evrensel  bir  boyut kazandırabilmemiz  için,  ilgi  alanımızı  biraz  daha   genel  hukuk  teorisi , hukuk sosyolojisi ve hukuk felsefesine kaydırmamız gerekir. 4- Daha Derinlikli Bir Hukuk Kavrayışı İçin Üç Temel Analiz a) Normatif Analiz: Hukuk Felsefesi Hukuk  kavramına  daha  derinlikli  bakmaya  çalışan  disiplinlerden  en önemlisi  hukuk  felsefesidir.  Felsefeden  söz  edildiğinde  birçok  insanın zihninde anlaşılmaz soyut ve karmaşık düşünceler belirir. Oysa felsefe geniş anlamda  düşünmek  fiiliyle aynı anlamları çağrıştırır. Düşüncenin nesnesi (konusu) değişebilir. Ancak düşünmenin/felsefe yapmanın kendisi zihinsel bir  faaliyet  olarak,  insanın  (beşerin)  değişmez  bir  niteliğidir.  Varlık  ve meseleler üzerinde düşünmek, eşyanın tabiatı hakkında meraklı olmak ve toplumsal  sorunlara  çözüm  aramak,  felsefe  yapmak/düşünmek  demektir.                                                             41  Bkz. Güriz, Adnan, Hukuk Felsefesi, 7.  Baskı, Siyasal Kitabevi, Ankara 2007, s. 5. 42  Aulis, Aarnio, The Rational as Reasonable: A Treatise on Legal Justification, Reidel Publishing Company Dordrecht, 1987, s. 12; Hİrş, s. 8 ve s. 11 vd; Peczenik, Aleksander, On Law and Reason, Springer, 2008, s. 295. 43  Minemura Teruo,  Dogmatic Legal Science and Sociology of Law , Archiv für Rechts- und Sozialphilosophie / Archives for Philosophy of Law and Social Philosophy, (ARSP), Vol. 56, No. 3 (1970),  s. 351,  pp. 351-366 44  Minemura, s. 352.   235Sururi Aktaş                                                            Ankara Üni. Hukuk Fak. Dergisi, 67 (2) 2018: 227-252 Dolayısıyla felsefeyi, karmaşık ve anlaşılmaz spekülasyonlar yığını olma algısından kurtarıp, hakikatı arama ve kavrama (hikmet /Wisdom) olarak yeniden gündemimize sokmamız gerekir. Kur anı Kerimde Bakara Suresinin 269. ayetinde şöyle buyrulmaktadır:   Allah hikmeti dilediğine verir. Kime hikmet verilmişse, şüphesiz ona çokça hayır verilmiş demektir. Bunu ancak akıl  sahipleri  anlar 45.  Bu  ayette  kuşkusuz  insanın  aklını  işletmesinin önemine vurgu yapılmaktadır. Hikmete sahip olmanın değerinin anlaşılması, akıl sahipleriyle ilişkilendirilmektedir.  Hukuk kavramı da tartışmasız olarak felsefenin konusu olmaya devam etmiştir.  Zamanla  Hukuk  Felsefesi  (legal  philosophy/rechtsphilosophie) olarak tanımlanan bir disiplin (veya bilim dalı) ortaya çıkmıştır. Hukuk felsefesini dar anlamda, doğru/adil ya da ideal hukuku aramaya dönük bir disiplin olarak tanımlasak da, bugün daha fazla konu ve müfredat hukuk felsefesinin kapsamına sokulmaktadır.  Troper hukuk felsefesini  spekülatif ve normatif bir disiplin  olarak tanımlayıp,  kapsamına,   hukuksal  ontoloji  olarak  görülebilen  hukuksal kavramların özlerinin incelenmesi; hukuksal epistemoloji olarak bu özlerin tanınmasını sağlayacak olasılıkların kavranması; hukuksal erekbilim olarak değerlendirilebilen  hukukun amaçlarının belirlenmesini ve son olarak hukuk mantığı  olarak  da  hukuka  ilişkin  akıl  yürütmelerin  incelenmesini sokmaktadır  İyi  ya  da  doğru/adil  hukuku  araştırma  konusu  yapan   dar  anlamda hukuk  felsefesi ni  normatif  hukuk  felsefesi;   geniş  anlamda  hukuk felsefesi ni de, hem adil hukuk peşinde koşan normatif yaklaşımı ve hem de betimleyici yaklaşımı benimseyen analitik hukuk felsefesini içine alan hukuk felsefesi  olarak  tanımlayabiliriz.  İzveren,  hukuk  felsefesinin  konusunu,  hukuk nedir ve ne olmalıdır  biçiminde ortaya koyarak geniş anlamda bir hukuk  felsefesi  tanımı  yapmıştır.  Dolayısıyla  geniş  anlamda  hukuk felsefesi,  hukuk  kavramı  üzerine  yapılan  normatif  ve  analitik  düşünsel faaliyeti  kapsamaktadır.  Zannediyorum,  bugün  geniş  anlamda  hukuk                                                             45  Diyanet İşleri Başkanlığı Meali. 46  Bkz. Güriz, s. 11. 47  Troper, s. 15. 48  Troper, s. 15. 49  İzveren, Adil, Hukuk Felsefesi, Dokuz Eylül Üniversitesi Hukuk Fakültesi Yayını, Ankara 1988, s. 19. 50  İzveren, s. 19.; ayrıca değişik tanımlar için Bkz. Hİrş, s. 75 vd; Aral, Vecdi, Hukuk Felsefesinin Temel Sorunları, Filiz Kitabevi, İstanbul 1992, s. 31 vd; Güriz, s. 11; Işıktaç, Hukuk Felsefesi…, s. 27. 236Ankara Üni. Hukuk Fak. Dergisi, 67 (2) 2018: 227-252                                        Hukuk Kavramının Analizi  felsefesini, İngilizcede kullanılan jurisprudence sözcüğüyle ifade edebiliriz. İngilizceden  hukuk  bilimi  olarak  çevirebileceğimiz  Jurisprudence kavramının  tam  çevirisi,   hukukta  kabiliyet   veya   hukuk  bilgisi dir. Çünkü  prudence  sözcüğü,  Latince  bilgi  veya  kabiliyet  olarak tanımlayabiliceğimiz prudentia sözcüğünden türemiştir. Hukuk ve ahlak alanında hikmete dayalı doğru akıl yürütmeyi ifade etmek için, prudentia (wisdom)  hikmet  anlamında  da  kullanılmıştır.  Phillipps,  jurisprudence kavramını ideal hukuku araştıran dar anlamda hukuk felsefesi anlamında,  adaletin kurallarını analiz ve sınıflayan bilim  olarak tanımlamaktadır. Phillipps, hukuk bilimini, bir ahlak bilimi gibi algılamaktadır. Çünkü ona göre  adalet,  insanoğlunun  ahlaken  hak  ettiği  şeyin  (hakların) gözetilmesidir. Doğal hukuk teorisinin savunucularından Finnis de hukuk felsefesinin dar anlamdaki işlevine uygun olarak, bu disiplinin pratik akıl felsefesiyle  ilgili  olduğunu  söyler.  Pratik  akıl  felsefesi,  eylemlerimize ilişkin  seçimlerimizi  makul  hale  getiren  bir  disiplindir.  Dolayısıyla  bu açıdan  baktığımızda,  Finnis  açısından  hukuk  felsefesi,  hukuki tasavvurumuzu  akla  yatkın  hale  getiren  bir  işlev  görmektedir.  Finnis in deyimiyle hukuk felsefesi, milletler tarafından kabul görmüş hukukun genel ilkelerinin, adil ve yetke (otorite) ilkeler olduğunu kabul etmemizi sağlayan temelleri  belirlemeyi  hedefler.  Finnis in  bu  ifadesini  daha  açık  hale getirdiğimizde, hukuk felsefesi, kuralların ahlaki meşrulaştırmasını rasyonel (akla uygun)  hale getirmeyi amaçlayan pratik akıl alanındaki bilişsel bir faaliyeti ifade eder. Doğru/adil  hukuku  araştırmayı  konu  edinen  dar  anlamdaki  hukuk felsefesi,  ahlak  felsefesini  de  ilgilendiren  bir  alandır.  Davranışlarımızın genel  doğruluk  ölçütünü  sorgulayan  ahlak  felsefesi,  özel  olarak  hukuk felsefesine  yol  göstererek  hukuken  doğru  (adil)  davranışın  ne  olduğunu                                                             51  Merriam-Webster  Dictionary,   jurisprudence ,  https://www.merriamwebster.com/dictionary/jurisprudence (E.T. 04.01.2017) 52  Merriam-Webster  Dictionary,   jurisprudence ,  https://www.merriamwebster.com/dictionary/jurisprudence (E.T. 04.01.2017) 53  Bkz. Westerman, Pauline C., The Disintegration of Natural Law Theory: Aquinas to Finnis, Brill 1998,  s. 61-62. 54  Phillipps, Charler Spencer March, Jurisprudence, Adamant Media Corporation (Elibron Cllasics Series), 2006, s. 3. 55  Phillipps, s. 6. 56  Phillipps, s. 3. 57  Finnis, John,  What is the Philosophy of Law , Rivista di Filosofia del Diritto no. 1, (2012), s. 67, pp. 67-78. 58  Finnis, s. 67. 59  Finnis, s. 68.   237Sururi Aktaş                                                            Ankara Üni. Hukuk Fak. Dergisi, 67 (2) 2018: 227-252 analiz  eder.  Ancak  daha  önce  vurguladığımız  gibi,  böyle  bir  analizin rasyonel, tarihsel ve iktisadi olgularla çelişmemesi için, bu alanlara ilişkin, iktisat bilimi gibi temayüz etmiş bilim ve disiplinlerin ilkelerinin dikkate alınması gerekir. Hukuk, ahlak ve iktisat birbiriyle yakın ilişki içerisinde olan  alanlardır.  İktisat  biliminin  temellerini  atan  Adam  Smith in  aynı zamanda bir ahlak felsefecisi olduğu unutulmamalıdır. Yine F. A. Hayek in hukuk,  siyaset  ve  iktisat  felsefesi  alanlarında  dikkat  çekici  eserler vermesinde, hukuk ve iktisat felsefesine hakim olmasının rolü yadsınamaz. Hukuk  kavramıyla  ilgili  derinlikli  düşüncelere  ihtiyacımızın  olduğu tartışmasızdır. Hikmete dayalı derinlikli hukuk eğitimi, hukuk felsefesinin amacı olmalıdır. Hukuk felsefesi,  genel felsefeden beslenmekle birlikte kendisine  ait  muayyen  (spesifik)  bir  konusu  vardır.  Bu  da  kuşkusuz hukuktur. Dolayısıyla hukuk felsefesinin ilgi alanını hukuk kavramı üzerine yoğunlaştırmamız  gerekir.  Türkiye de  hukuk  felsefesiyle,  genel  felsefe yeterince  birbirinden  ayrılmış  değildir.  Genelde  hukuk  felsefesi,    genel felsefe  tarihi  şeklinde  ele  alınmaktadır.  Çoğunlukla  öğrenciler  hukuk felsefesinin konusunu yeterince kavrayamamaktadır. Bundan dolayı genel felsefe  konularıyla  hukuk  teorileri  arasındaki  bağ  yeterince anlaşılamamaktadır. Örneğin, faydacılık konusu işlenirken, hukuk ve adalet kavramı bakımından faydacılığın ne anlama geldiği ve faydacılığın ne tür bir hukuk ve adalet teorisini beslediğinin analiz edilmesi gerekir. Dolayısıyla öğrencilerin ilgisi, genel felsefeden hukuk kavramına çekilmelidir. Hukuk kavramı  ve  teorileriyle  ilgili  meseleler  hukuk  felsefesinin  odak  noktası haline getirilmesi gerekir. Dar anlamda hukuk felsefesi, ideal (doğru/adil ) hukuku araştırmayı konu edinirken, aynı zamanda hukuk teorilerine de yönelmelidir. Çünkü iyi hukuk  ideali,  her  hukuk  teorisinin  (pozitivist  teoriler  hariç)  ilgi  alanını oluşturur.  Hukuk  teorilerini  karşılaştırmak,  iyi  hukuk  analizlerini                                                             60  Örneğin  bkz.   Hukuk  Kavramı  ve  Olgusunun  Metodolojik  Olarak  Çeşitli  Açılardan Kavranması Gereği  adlı başlığa. 61  Bkz. Evensky, Jerry,  Adam Smith s Moral Philosophy: A Historical and Contemporary Perspective on Market, Law, Ethics, and Culture, Cambridge University Press 2005,  (tümüne atıf).  62  F. A Hayek in, eserlerinden Kanun, Yasama Faaliyeti ve Özgürlük adlı üç ciltlik çalışması disiplinlerarası bir yöntemle kaleme alınması bakımından anılmaya değer. (Bkz. Hayek, Friedrich August von, Kanun, Yasama Faaliyeti ve Özgürlük, C.I. (Kurallar ve Düzen), (çev. Atilla Yayla), 1. baskı, Türkiye İş Bankası Kültür Yayınları, Ankara 1994 tümüne atıf; Kanun, Yasama Faaliyeti ve Özgürlük, C. II (Sosyal Adalet Serabı), (çev. Mustafa Erdoğan) 1. Baskı, Türkiye İş Bankası Kültür Yayınları, 1995, tümüne atıf; Hukuk, Yasama ve Özgürlük, C. III. (Özgür Bir Toplumun Siyasal Düzeni), (çev. Mehmet Öz), Türkiye İş Bankası Kültür Yayını, 1997, tümüne atıf ).  238Ankara Üni. Hukuk Fak. Dergisi, 67 (2) 2018: 227-252                                        Hukuk Kavramının Analizi  karşılaştırmak demektir. Her hukuk teorisinin ideal hukuk tasarımı, felsefi açıdan  analize  tabi  tutulması  ve  diğer  iyi  hukuk  tasarımlarıyla karşılaştırılması  gerekir.  Bu  görev  de,  hukuk  felsefesine  düşmektedir. Dolayısıyla hukuk felsefesinin, hukukla ilgili teorileri karşılıklı analize tabi tutan bir işlev görmesi gerekir. Hukuk  felsefesi  yerine  bazen  hukuk  teorisi  de  kullanılmaktadır. Dolayısıyla hukuk teorisini de, normatif hukuk teorisi (dar anlamda hukuk felsefesi)  ve  analitik  hukuk  teorisi  olarak  ikiye  ayırabiliriz.  Böyle  bir ayırımda  normatif  hukuk  teorisi,  doğru/adil  hukuk  idealine  yönelen  dar anlamda hukuk felsefesinin işlevini görür. Analitik hukuk teorileri hukukun ne olduğunu açıklayan teoriler olarak betimleyici bir karakter arz eder.  Raz, hukukun doğasını (niteliğini) açıklamayı amaçlayan dar anlamda bir hukuk teorisinden yana tavır alarak, geniş anlamda hukuk teorilerinin varlığına da işaret etmektedir. Raz kendi açıklayıcı yöntemine uygun olarak bir hukuk teorisinin varlığının başarı şansını,  hukuka ilişkin önermelerinin zorunlu olarak doğru olması ve hukukun ne olduğunu açıklamasına  bağlı olduğunu söyler.  Raz,  zorunlu  doğruluk  tanımlamasına  yer  vererek  bir  taraftan analitik felsefenin/mantıksal pozitivizm yöntemine bağlı kalarak önermelerin doğruluklarını dilsel çözümlemeye tabi kılmakta, diğer taraftan da  olan  hukuku araştırmanın nesnesi haline getirerek değerlendirici yöntemi hukuk teorisinin  dışına  atmaktadır.  Dolayısıyla  Raz,  adil  hukuk  sorgulamasını kendi teorisi dışında tutmaktadır. Dagan ve Kreitner yazdıkları makalede, hukuk  teorisini,  toplumun   zorlayıcı  normatif  kurumlarına  açıklayıcı, haklılaştırıcı  (değerlendirici)  ve  reformist   açılardan  yaklaşan  bir  teori olarak  tanımladıklarını  belirterek,  geniş  almanda  bir  hukuk  teorisinden yana tavır alırlar. Adı geçen yazarlar hukuk teorisinin, hukukun kaynakları ve gelişimi için bir taraftan toplumsal-tarihsel (sociohistorical) tahlillerden, diğer  taraftan  değerlendirici  yan  disiplinler  olarak  etik  ve  siyaset felsefesinden (hukuk ve politika disiplininden)67  ve nihai olarak reformları amaçlayan   zanaat  olarak  hukuk   (law  as  craft)68  yaklaşımından  ibaret olması gerektiğini düşünürler.                                                             63  Raz, Joseph,  Can There Be a Theory of Law , The Blackwell Guide to the Philosophy of Law and Legal Theory (Edited by Martin P. Golding and William A. Edmundson), Blackwell Publishing, 2005,  s. 324. 64  Raz, s. 324. 65  Dagan, Hanoch, Kreitner, Roy,  The Character of Legal Theory , Cornell Law Review, (2011), Vol. 96, , s. 85. pp. 671-191. 66  Dagan/Kreitner, s. 685 ve bkz. 675 vd. 67  Dagan/Kreitner, s. 685 ve bkz 673 vd. 68 Dagan/Kreitner, s. 685 ve bkz. s. 677-678. 69 Ayrıca bkz. Dagan/Kreitner, s. 85 vd.   239Sururi Aktaş                                                            Ankara Üni. Hukuk Fak. Dergisi, 67 (2) 2018: 227-252 Hart  ve  Kelsen in  teorileri  gibi   genel  hukuk  teorisi   niteliğindeki teoriler  betimleyici  olduğu  için,  doğal  hukuk  gibi  dar  anlamdaki  hukuk felsefesinin konusunu oluşturan teorilerin aksine kendi doğru/adil hukuk ya da ideal hukuk tasarımlarına yer vermezler. Dolayısıyla genel hukuk teorisi ve pozitivist hukuk teorilerini bir yana bırakırsak, hukuk teorileri, hukukla ilgili  doğruluk/adillik  veya  iyilik  iddialarını  dile  getiren  sistematik düşüncelerle oluşmaktadır. Her hukuk teorisinin, pozitivist teoriler hariç, kendine  ait  doğru/adil  hukuk  veya  iyi  hukuk  tasarımı  vardır.  Pozitivist teorilerin adil hukuku araştırma gibi bir iddiaları bulunmaz. Ancak pozitivist teoriler de hukukun doğasını en gerçekçi ve bilimsel olarak kendilerinin kavradıklarını iddia etmektedirler. Zaman ve şartlar değiştikçe, yeni hukuk teorileri ortaya çıkmaktadır. Örneğin, doğal hukuk gibi geleneksel teoriler yanında   hukuk ve ekonomi  (law and economics) teorisi ve feminist hukuk teorisi gibi yaklaşımlar, kendi inanç ve ilkeleri açısından kendi ideal hukuk tasarımlarını  savunan  (göreli  olarak)  daha  yeni  düşüncelerdir.  Hukuk felsefesi  dersi,  öğrencilere  bu  teorilerin  kısa  bir  özetini  ve  amacını kavratmalı; öğrencilerin teorilerle ilgili eleştirel ve karşılaştırmalı bir analiz yeteneğine sahip olmalarının sağlanması amaçlanmalıdır. Dolayısıyla hukuk felsefesinin  dar  anlamda  konusu  olan   ideal  hukuk  tetkikleri , sanılanın aksine  çok  geniş  bir  konu  yelpazesine  sahiptir.  Pound,  eski  Yunan dan günümüze  kadar  olan  süreçte,    hukuk  felsefesinin,  beşeri  kurumların bütünlüklü  incelenmesi  gibi  öncü  bir  rol  üstlendiğini  söylemektedir. Friedmann da, hukuk teorisiyle ilgili sistematik düşüncelerin tümünün, bir taraftan felsefeyle ilgili, diğer taraftan da siyaset teorisiyle ilgili olduğunu söylemektir.  Friedmann ın  bu  analizinde,  hukuk  teorileri  bakımından felsefe  ve  siyaset  teorisinin  disiplinlerarası  (interdisipliner)  bir  alan oluşturduğunu söyleyebiliriz. İyi hukuk idealine dönük zihinsel faaliyetler, disiplinlerarası bir yöntem izlemesi gerekir. Yine Friedmann, bütün hukuk teorilerinin, bazı ögeleri felsefeden, bazılarını da siyaset teorisinden alması gerektiğini belirtmektedir.  Ancak kendisi açısından ideal bir hukuk kavramı peşinden koşan bir hukuk teorisi, sadece felsefe ve siyaset teorisi değil, diğer alanlardan da, özellikle genel tarih, dinler tarihi, devlet tarihi, iktisat, iktisat felsefesi, iktisat tarihi, psikoloji ve sosyoloji gibi alanlardan da yararlanması gerekir. Tek bir alanın  verileriyle  sınırlı  kalınarak  iyi  hukuk  idealine  yönelik  düşünsel                                                             70 Pound, Rorcoe, An Introduction to the Philosophy of Law, Yale University Press  1922, s. 15. 71 Fridmann, W., Legal Theory, 2nd Edition, London 1949, s. 3. 72 Fridmann, s. 3. 240Ankara Üni. Hukuk Fak. Dergisi, 67 (2) 2018: 227-252                                        Hukuk Kavramının Analizi  faaliyet yürütmek kısır kalmaya  mahkumdur. Kuralların arkasındaki aklı (ratio  legis)  keşfedebilmek  de  yine  disiplinlerarası  bir  zihniyete  ihtiyaç duyar. Mevcut kuralların arkasındaki aklı keşfedebilme kabiliyeti, topluma yeni iyi kurallar getirebilme olasılığını artırır. Geniş anlamda hukuk felsefesi, analitik hukuk bilimini de bünyesinde barındırır.  Yani  hukuku  olduğu  gibi  incelemeye  çalışan  betimleyici (descriptive) hukuk bilimi de hukuk felsefesinin ilgi alanındadır. Betimleyici anlayışın  dayandığı  metodolojide,  iyi  hukuk  arayışı,  hukuk  biliminin konusunu  oluşturmaz.  Özellikle  İngiliz  analitik  hukuk  biliminde  bunu görmekteyiz.  Kelsen,  iyi  hukuk  idealini  araştırma  işini,  hukuk biliminin dışında tuttuğu için, genel hukuk teorisi şeklindeki eserleri, pozitivist hukuk teorisi niteliğindedir. b) Betimleyici Kavramsal Analiz: Genel Hukuk Teorisi Hukuk  bilimini,  pozitif  bir  yöntemle  ele  alan  yaklaşımların  en önemlilerinden birisi de genel hukuk teorisi veya bazı yazarların ifadesiyle  hukukun genel teorisi dir. Troper in tespitine göre genel hukuk teorisi, pozitivist düşüncenin tesiriyle hukuk felsefesine karşı bir teori olarak kendini göstermiştir .  Hukuksal kavramlara ilişkin betimleyici bir yaklaşımı benimseyerek, ideal  hukuku  kapsamına  almayan  bu  yaklaşım  üzerinde  analitik (çözümleyici)  felsefenin  de  etkisi  büyüktür.  Bazı  zamanlar  mantıkçı pozitivizm  olarak  da  ifade  edilen  analitik  felsefenin  doğrulama yöntemlerinden  biri  de  önermelerin  dil  ve  mantık  açısıdan  tahlil edilmesidir. Özellikle Rudolf Carnap ve Alfred Jules Ayer in mantıkçı pozitivizminin  Hart  üzerinde  etkisi  olduğu  iddia  edilmektedir.  Hukuk biliminde metafiziği dışlayan bu yaklaşım açısından felsefenin konusunu mantıksal sınıflama oluşturur. Kelsen in saf hukuk teorisine baktığımızda bu yaklaşımın izlerini görebiliriz. Özellikle Kelsen hukuk bilimini, mantıksal çözümleme olarak algılamıştır. Başka bir anlatımla, Kelsen in teorisinde hukuk,  normların  oluşturduğu  mantıksal  bir  bütün  olarak  kavranmıştır.                                                             73  Bkz, Kelsen,  Pure Theory of Law…,  s.  1 vd; Kelsen, Hans, General Theory of Law…, (tümüne atıf).  74  Gözler, Hukukun Genel…, s. 6 ve 10. 75  Troper, s. 14. 76  Yazıcı, Sedat, Felsefeye Giriş, Genişletilmiş 3.baskı, Öncü Kitap, Ankara 2009, s. 24 77  Curzon, L. B., Jurisprudence, 2nd Edition,Cavendish Publishing, London-Sydney, 1995, s. 7 ve 81. 78  Curzon, s. 82. 79  Curzon, s. 124 vd. 80 Kelsen, The Pure Theory of Law…, s. 221 vd; bkz. Hukuk Felsefesi…, s. 80.   241Sururi Aktaş                                                            Ankara Üni. Hukuk Fak. Dergisi, 67 (2) 2018: 227-252 Normların içeriği, hukuk bilimi dışına taşınarak, biçimci  (formalist) bir hukuk kavramı geliştirilmiştir. Genel  hukuk  teorisi,  tanımlamanın  da  çağrıştırdığı  gibi,  dogmatik hukuk biliminden daha kapsayıcı bir hukuksal analiz yöntemine sahiptir. Bu yöntem,  hukuk  öğreticileri  ve  öğrencilerine,  pozitif  hukuk  analizleri  ve yorumları dışında, hukuksal kavramları evrensel olarak özümseme imkânı sağlayacaktır.  Böyle  bir  yaklaşım,  dogmatik  hukuk  bilimine  göre  daha derinlikli ve kapsayıcı görünmektedir.  Genel hukuk teorisi   geniş anlamda hukuk felsefesi nin alt bir disiplini olarak görülebileceği gibi, hukuk felsefesi sadece ideal hukuka yönelen bir disiplin olarak değerlendirenlerin yaklaşımı esas alındığında, kendine özgü ayrı bir disiplin olarak da görülebilir. Çağıl, dar anlamda hukuk bilimi olarak genel  hukuk  teorisiyle  hukuk  felsefesinin  özdeşliğini  kabul  etmemekle beraber,  bu  iki  disiplini, birbirinin  tamamlayıcısı  olarak  görür.  Her  ne şekilde sınıflarsak sınıflayalım, genel hukuk teorisi, hukuk bilimi ve hukuk eğitimi için önemli bir disiplindir. Bir kere genel hukuk teorisi, Kelsen in ifade ettiği gibi belirli bir hukuk sistemini inceleme konusu yapmayıp, bütün hukuk sistemlerinde görülen ortak kavram ve kurumları ele aldığı için hukuk biliminin evrensel müfredatını oluşturmaktadır. Bu açıdan,  hukuk genel teorisi nin bir ders olarak okutulması faydalı olabilir. Bir kere,  İdeal hukuk veya iyi ve doğru/adil hukuk nedir  sorularına yanıt aramadan önce, hukuk kavramının hukukun genel teorisinin betimleyici ve görece tarafsız yöntemiyle ele alınması gerekir. Hukuk felsefesi ahlaki ve hatta ideolojik bir tercihi gerektirdiğinden, dar anlamda hukuk felsefesi yöntemiyle doğru/adil hukuk  sorgulamasına  başlanmadan  önce  güçlü  bir  genel  hukuk  teorisi bilgisine sahip olunması gerekir. Ancak genel hukuk teorisi, hukuk biliminin tümünü içine almadığından yine de iyi ya da doğru/adil hukuk idealinin, hukukun tanımı (hukuk kavramı) dışına çıkarılmaması gerekir. Eğer böyle olursa, pozitivistlerin yaptığı gibi son derece haksız ve adaletsiz hukukları da hukuk sayma sonucuyla karşılaşılabilir. Başka bir anlatımla,  olan hukuk   ile  olması gereken  hukuk arasındaki bağlantının koparılmaması gerekir. Pozitif hukuk, hukuk kavramının tümünü tüketmemesi gerekir.  Bir yazarın                                                             81  Aral,  Kelsen in  Saf  Hukuk  Teorisinin…,  s.  24;  Özbilgen,  s.  106;  Işıktaç,  Hukuk Felsefesi…,  s. 80. 82  Çağıl, s. 142. 83  Kelsen, The Pure Theory of Law and Analytical…, s. 44. 84  Gözler, Kemal, Hukuka Giriş, Ekin Yayını, 14. Baskı Bursa 2017, s. 7-8. 85  Gözler, Hukuka Giriş, s. 6. 242Ankara Üni. Hukuk Fak. Dergisi, 67 (2) 2018: 227-252                                        Hukuk Kavramının Analizi  dediği  gibi  hukuk  bilimi,  salt  bir  pozitivizme  meylederek  körelmemesi gerekir. Dolayısıyla  hukuk  sistemlerinde  ve  genel  hukuk  tarihinde  görülen hukuksal  kavramların  tanımlanmasında  genel  hukuk  teorisinin betimleyici/tanımlayıcı  yöntemine  ihtiyacımız  olmakla  birlikte,  genel  bir hukuk kavramı/tanımı için sadece bu yöntemle yetinemeyiz. Doğru ve iyi hukuk  telakkimiz  için,  betimleyici  ve  değerlendirici  yöntemi  birlikte kullanmayı benimsememiz gerekir. Genel hukuk teorisi, kavramsal analiz yoluyla hukuk tefekkürümüzü zenginleştirebilir. Ancak iyi hukuk idesi (de lege ferenda/ideal law) için kavramsal analize, değerlendirici bir analizin eklenmesi gerekir. Hakların ve insan onurunun korunması, evrensel kabul görmüş  ilkelerle  uyum  içinde  olunması  gerektiğine  ilişkin  bir  hukuk tanımlaması, yargıca, pozitif hukuku (de lege lata), haklar, insan onuru ve evrensel kabul görmüş ilkeler doğrultusunda yorumlama fırsatı verecektir. c) Sosyolojik Analiz: Hukuk Sosyolojisi Hukuk  olgusunu,  doğa  bilimleri  yöntemiyle  ele  almaya  çalışan disiplinlerden birisi naturalist (pozitivist) sosyolojidir. Genel olarak Comte ve Durkheim in etkisinde gelişen bu anlayış toplumsal olguları, neden sonuç ilişkisi çerçevesinde açıklamaktadır. Hukuk da bir toplumsal olgu olarak ele alınıp incelenmekte, hukukla ilgili toplumsal olgular yine aynı şekilde nedensellik  ilişkisine  göre  açıklanmaya  çalışılmaktadır.  Dolayısıyla naturalist anlayışa dayanan hukuk sosyolojisi, açıklayıcı ve betimleyici bir karakter  arz  eder.  Timasheff  bu  anlayışa  dayanan  hukuk  sosyolojisini  toplumun  hukukla  ilgili  bilimsel  doğasına  ilişkin  yasaları  keşfetmeyi amaçlayan  nomografik  bir  bilim   olarak  tarif  eder.  Hukuk  sosyolojisi doğru/adil hukuk hangisidir biçiminde değerlendirici bir sorgulama içine girmez.  Örneğin  suç  olgusunun  arkasında  bulunan  toplumsal  olguların                                                             86  Schwarz, Andreas B.,  Roma Hukuku ve İngiliz Hukuku , İstanbul Üniversitesi Hukuk Fakültesi Mecmuası, Cilt 11, sayı 3-4, 1945,    s. 202. 87  Bkz. Uygur, s. 92 vd. 88  Bkz. İçli, Gönül, Sosyolojiye Giriş, 4. Baskı, Ankara 2009, s. 7 vd; Işıktaç, Yasemin, Hukuk Sosyolojisi, Filiz Kitabevi, İstanbul 2014, s. 32.  89  Timasheff, Gürkan ve Özbilgen,   hukuk sosyolojisi  deyiminin ilk kez İtalyan hukukçu D.  Anzilotti  tarafından   sosyologia  juridica nın  karşılığı  olarak  kullanıldığını  tespit etmişlerdir. (Timasheff, s. 52; Özbilgen, Hukuk Sosyolojisi, .s 62; Gürkan s.  33.) 90  Özcan, Mehmet Tevfik, Hukuk Sosyolojisine Giriş, 1. Baskı, Donkişot, İstanbul 2001, s. 11. 91  Timasheff, s. 19. 92  Bkz. Gürkan, Ülker, Hukuk Sosyolojisine Giriş, Gözden Geçirilmiş 4. Baskı, Siyasal Kitabevi, Ankara 2005, s. 24 vd.    243Sururi Aktaş                                                            Ankara Üni. Hukuk Fak. Dergisi, 67 (2) 2018: 227-252 neler olduğu, hangi tür cezaların hangi koşullar altında ortaya çıktığı, çok evliliğin hangi iklimsel ve ekonomik koşulların etkisiyle kendini gösterdiği biçimindeki  hukuksal  olgular,  pozitivist  bir  pencereden  kavranmaya çalışılmaktadır. Dolayısıyla sosyolojinin, hukuk olgusunu kendi metoduyla açıklamaya çalışması sürecinde bir alt disiplin olarak hukuk sosyoloji ortaya çıkmıştır.  Deflem e  göre  disiplin  olarak  hukuk  sosyolojisi,  klasik sosyolojiyle hemen aynı anda başlamamıştır. Adı geçen yazara göre klasik sosyologlar kendi çalışmalarında teorik pencerelerinden hukuka yer verseler de, bu çalışmalar bu günkü hukuk sosyolojisi niteliğinde değildi.   Kuşkusuz  hukuk  sosyolojisi  sadece  naturalist  sosyolojinin  etkisinde gelişmemiştir.  Max  Weber in  anti-pozitivist  sosyolojisinde  olduğu  gibi yorumlayıcı sosyoloji (anlayış sosyolojisi) de hukuk olgusuna el atmıştır. Weber in kapitalist hukuk sistemi üzerine yaptığı analizler bu bağlamda hatırlanmalıdır.  Deflem,  Weber in  modern  hukuk  sosyolojisinin  kurucu babası  olarak  düşünülmesinin  yaygın  kabul  gördüğünü  saptamaktadır.  Yorumlayıcı  sosyoloji  (anlayış  sosyolojisi)  bakımından  Deflem  haklıdır. Ancak  naturalist  veya  pozitivist  sosyoloji  açısından  Durkheim  modern hukuk  sosyolojisinin  kurucuları  arasında  sayılabilir.  Özbilgen,  metod açısından hukuk sosyolojisinin Durkheim le başladığını söyler. Hukuk  sosyolojisinin  uzak  habercileri  arasında  İslam  düşünürü  İbn Haldun önemli bir yere sahiptir. Özellikle hukuku her şeyden önce toplumsal bir olgu olarak ele alıp yerleşik toplum ve göçebe toplumlar bağlamında açıklaması  zamanına  göre  oldukça  ileri  bir  bilimsel  zihniyeti yansıtmaktadır.  İbn  Haldun un  toplumsal  çözümlemelerinde  dayanışma (asabiyyet) olgusuna yer vermesi toplumu gözleme dayalı olarak analiz etmesi,  toplumsal  kuralları,  doğal  yasalar  gibi  neden  sonuç  ilişkisi                                                             93  Bkz. Işıktaç, Hukuk Sosyolojisi…, s. 18; Özbilgen, Tarık, Eleştirisel Hukuk Sosyolojisi Dersleri, Cilt I, İstanbul Üniversitesi Hukuk Fakültesi Yayınları, İstanbul 1971, s. 6-63. 94  Deflem,  Mathieu,  Sosyology  of  Law,  (Vision  of  Scholarly  Tradition  ),  Cambridge University Press, 2008, s. 1. 95  Deflem, s. 1. 96  Öktem/Türkbağ, s. 322 vd; Deflem, s. 37 vd. 97  Deflem, s. 37. 98  Özbilgen, Hukuk Sosyolojisi, s.62-63. 99  İbn Haldun, Mukaddime, Cilt I (çev. Zakir Kadiri Ugan), MEB Yayını, İstanbul 1990, s. 302 vd, s. 350, s. 352 vd. vd; bkz. Gürkan, s. 72-76. 100  İbn Haldun, s. 331, s. 352 vd; bkz.Uygun, Oktay, İbn Haldun un Toplum ve Devlet Kuramı, XII Levha Yayını, 1. Baskı, İstanbul 2008, s. 34; Hassan s. 231. vd 101  Bkz. Hassan, Ümit, İbn Haldun un Metodu ve Siyaset Teorisi, 2. Baskı, Toplumsal Dönüşüm Yayınları, 1998 İstanbul, s. 82 vd. 244Ankara Üni. Hukuk Fak. Dergisi, 67 (2) 2018: 227-252                                        Hukuk Kavramının Analizi  çerçevesinde  açıklaması,  modern  sosyolojinin  kurucuları  sayılabilen Comte, Durkheim ve Tönnies gibi toplum bilimciler için öncü girişimler olmuştur. Hukuk  sosyolojisinin  temel  amacı,  hukukun  yürürlülük/biçimsel kaynaklarının  araştırılması  değil  de,  bu  yürürlük  kaynaklarını  besleyen toplumsal gerçekliklerin araştırılması ve tahlil edilmesidir. Timasheff e göre  hukuk  toplumsal  bir  güçtür .  Bu  güç,  belirli  davranış  kalıplarının bireylere  dayatılması  biçiminde  kendisini  göstermektedir.  Bu  anlamda hukuk  sosyolojisi,  hukuk  olgusunun  daha  derindeki  kaynaklarına  veya hukukun gerçek kaynaklarına yönelir. Hukukun gerçek kaynaklarına inmeyi amaçlayan hukuk sosyolojisinin bu bölümü Gurvitch tarafından sistematik hukuk  sosyolojisi   (Mikro  Hukuk  Sosyolojisi)  olarak  da  tanımlanır 106 . Gurvitch  toplumla,  ürettiği  hukuk  arasındaki  ilişkiyi  inceleyen  hukuk sosyolojisinin bölümünü,  diferansiyel hukuk sosyolojisi  (hukuki tipoloji) olarak  betimler.  Hukuksal  kavram  ve  kurumların  tarihsel  süreç içerisindeki değişimlerinin nasıl ve hangi yönde cereyan ettiği de hukuk sosyolojisinin ilgi alanlarındandır. Hukuk sosyolojisinin bu bölümü Gurvitch tarafından   jenetik  hukuk  sosyolojisi   olarak  adlandırılır.  Örneğin  bu bağlamda Durkheim hukukun, bastırıcı hukuktan (ceza hukukundan) iadevi hukuka (tazminat hukukuna)  doğru evrildiğini tespit eder. Kelsen e göre sosyolojik hukuk biliminin konusu, normlar açısından insan davranışlarının nasıl olması gerektiği değil de, hukuk olgusu olarak insanların normlara göre gerçekte nasıl hareket ettikleridir. Kelsen insan hareketini  inceleyen  disiplin  olarak  hukuk  sosyolojisinin  varlığına  karşı gelmektedir.  Kelsen  açısından   saf  hukuk  teorisi   bir  taraftan  adalet felsefesinden temizlenmesi gerekirken, diğer taraftan da sosyolojiden (sosyal                                                             102  Bkz. Hasan, s. 153 vd. 103  Bkz. Baali, Fuad, Society, State and Urbanism: Ibn Khaldun s Sosyological Thought, State University of New York Press, 1988, s. 109 vd; Hassan, s.48. 104  Timasheff, s. 23. 105  Timasheff, s. 23-24. 106  Georges,  Gurvitch,  Sociology  of  Law,  (With  a  New  Introduction  by  Alan  Hunt), Transanction Publishers, 2001, s. 198 vd; Ayrıca bkz. Gürkan, s. 40;Topçuoğlu, Hamide, Hukuk Sosyolojisi, Cilt I, Ankara Üniversitesi Hukuk Fakültesi yayınları, Ankara 1960, s.146 ve 156; Özbilgen, Hukuk Sosyolojisi  s. 108 vd. 107  Gurvitch, s. 231 vd; ayrıca bkz. Topçuoğlu, s. 146 ve 162;  Özbilgen, Hukuk Sosyolojisi  s. 101; Gürkan, s. 47. 108  Gurvitch, s. 287; Bkz. Topçuoğlu, s 146-147 ve s. 166; Gürkan, s. 50. 109  Bkz. Deflem, s. 61-62. 110  Kelsen, The Pure Theory of Law and Analytical…, s. 52.   245Sururi Aktaş                                                            Ankara Üni. Hukuk Fak. Dergisi, 67 (2) 2018: 227-252 gerçeklikten) temizlenmesi gerekir. Normativist teori (saf hukuk teorisi) açısından  nasıl  biyolojinin  matematik  açısından  incelenmesi  anlamsızsa, hukukun  da  insan  davranışlarını  nedenselliğe  göre  açıklamaya  çalışan sosyolojik  açıdan  incelenmesi  anlamsızdır.  Kelsen  açısından,  insan davranışlarının nedenselliğe göre nereye kadar incelenebileceğini bir tarafa bırakırsak, böyle bir incelemeyi amaçlayan sosyolojinin doğa bilimlerinden farkı olmaz. Oysa saf hukuk teorisi açısından hukuk, sosyal gerçeklikte ne olup bittiğini değil, insan davranışlarının nasıl olması gerektiğini buyurduğu için  normatif  alandadır.  Timasheff e  göre  Kelsen in  biyolojinin matematiksel  incelenmesinin  anlamsızlığı  ile  hukukun  sosyolojik incelenmesinin anlamsızlığı karşılaştırması hatalıdır; çünkü biyolojik olgular matematiğin  dışında  olduğu  halde,  hukuk,  toplumsal  (sosyal)  olguların dışında olmayıp sosyal bir olgudur. Timasheff açısından normların içeriği olan değerlerin insan davranışları üzerinde etkileri vardır; değerler insan davranışlarını  belirli  bir  yönde  olmasını  zorlayabilir.  Bundan  dolayı normlarla  insan  davranışları  arasında  bir  nedensel  ilişkinin  olması olanaklıdır. Kelsen,  bir hukuk sosyolojisinden bahsetsek bile, bunun konusunun, hukuk  normları  kapsamına  giren  insan  davranışları  olduğunu   söyler. Kelsen  haksız  fiil  sorumluluğu  kapsamında  normatif  hukuk  bilimiyle sosyolojik hukuk bilimini karşılaştırdığı zaman, bir kimsenin sorumluluğuna gidilmesini buyuran kural, normatif hukuk bilimi için bir hukuk kuralı iken, sosyolojik hukuk bilimi için, fiilen uygulandığı için gerçek bir kuraldır. Aynı  olayla  ilgili  olarak  bir  tahminde  bulunulması  durumunda  normatif hukuk  bilimi  için,   mahkeme  şöyle  karar  vermelidir   şeklinde  iken, sosyolojik hukuk bilimi için  mahkeme şu şekilde karar verecektir  biçimine dönüşmektedir.  Dolayısıyla Kelsen açısından, hukuk normları olmadan, hukuk sosyolojisi de olamayacağı için, sosyolojik hukuk biliminin varlığı,                                                             111  Kelsen, The Pure Theory of Law and Analytical…, s. 44. 112  Bkz. Özbilgen, Hukuk Sosyolojisi, s. 66. 113  Kelsen, Pure Theory of Law. S. 85. 114  Kelsen, Pure Theory of Law. S. 86 vd; eleştiriler için bkz. Özbilgen, Hukuk Sosyolojisi, s. 67 vd. 115  Timasheff, s. 22. 116  Timasheff, s. 22. 117  Timasheff, s. 22. 118  Bkz. Kelsen, General Theory of Law…, s. 176; Kelsen, The Pure Theory of Law and Analytical…, s. 52-53. 119  Kelsen, General Theory of Law…, s. 172. 120  Kelsen, General Theory of Law…, s. 172 vd. 246Ankara Üni. Hukuk Fak. Dergisi, 67 (2) 2018: 227-252                                        Hukuk Kavramının Analizi  normatif hukuk sisteminin varlığına bağlanmaktadır. Bu yüzden Kelsen açısından,  pozitif hukukun sosyolojisinin sonuçları, esasen normatif hukuk biliminden farkı yoktur . Böylece Kelsen, normatif hukuk biliminden ayrı, salt  insan  davranışlarını  inceleyen  bir  hukuk  sosyolojisini  anlamsız bulmaktadır. Hâlbuki sosyolojik olarak kendiliğinden gelişen normlar, tekrarlanan ve kalıplaşan insan hareketlerinin bir sonucudur. Karşılıklı beklenti güdüsüyle tekrarlanan  insan  davranışları,  normların  oluşmasına  neden  olmaktadır. Kendiliğinden  gelişen  normların,  hangi  kültürel  ve  ekonomik  ilişkilerin etkisiyle geliştiği, hukuk sosyolojisinin ilgi alanındadır. Toplumların yaşam biçimlerinin  hukuk  üzerindeki  etkisiyle,  hukukun  insan  davranışları üzerindeki etkisi hukuk sosyolojisinin konusu olarak nedensel (illiyet) ilişki bağlamında incelenebilir. Weber in yorumlayıcı sosyolojisinde bile nedensel açıklamanın  yeri  vardır.  Örneğin  Weber de  hukukun  rasyonelleşmesinin ekonomik gelişme (kapitalizm) üzerindeki etkisi bilinen bir tahlildir. Hukuk  sosyolojisi  alanında,  olgular  arasındaki  nedensel  ilişkinin belirlenmesi, yasa  koyucular  ile  uygulayıcılar  için yol  gösterici  nitelikte olabilir.  Örneğin  ekonomik  krizle,  boşanma  olayları  arasındaki  ilişkinin niceliksel  tespiti;  veya  kırsaldaki  suç  çeşitliliği  ile  kentlerdeki  suç çeşitliliğinin karşılaştırılması suç ve ceza politikası bakımından belirleyici olabilir. Bu bağlamda belirli suçların ekonomik refahı yüksek olan kesimler arasında  yaygınlık  kazanması  halinde,  bu  suçların  önlenebilmesi  için yaptırımı olarak adli para cezasına yer verilmemesi sosyolojik bir analizin gereğidir.  Sosyolojik  analizlerin  uygulayıcılar  üzerindeki  etkisi  de  söz konusu  olabilir.  Örneğin,  ekonomik  krizin  boşanma  davasının  açılması üzerindeki  etkisini  kavrayan  yargıç,  daha  etkili  bir  rol  oynayarak  aile birliğini koruma yönünde çaba sarf edebilir. Bir hukuk sisteminin tarihi mirasını açığa çıkararak veya farklı hukuk sistemlerinin  gelişimini  karşılaştırmalı  incelemesini  yaparak  hukuk sosyolojisine veri sağlaması gereken hukuk tarihi, hukuk eğitiminde hukuk sosyolojisi ile yan yana durarak birbirini eyit etmelidirler.                                                             121  Kelsen, General Theory of Law…, s. 175 vd. 122  Kelsen, General Theory of Law…, s. 174; Kelsen açısından, sosyolojik hukuk biliminin işlevi normlara göre mahkemelerin nasıl karar vereceği hususunda tahminde bulunmaktır. Bu da temelde bir hukuk düzeninin etkililiği veya etkisizliğini tahmin etmekten ibarettir. Etkililik ise normatif hukuk bilimi açısından bir normatif düzenin geçerliliği ile ilgili bir durumdur. Dolayısıyla, kelsen açısından sosyolojik hukuk bilimi ile normatif hukuk bilimi arasında bir ayrılık olamaz. (Kelsen, General Theory of Law…, s. 173). 123  Weber, Max, The Protestan Ethic and  The Spirit of Capitalism, (Translated by Talcott Parsons), Routlege, 2005 (orjinali 1930),  s. xxxviii; bkz. Deflem, s. 46-47.   247Sururi Aktaş                                                            Ankara Üni. Hukuk Fak. Dergisi, 67 (2) 2018: 227-252 4-Değerlendirme ve Sonuç Yukarıdaki  açıklama  ve  mülahazalardan  da  görüldüğü  gibi  hukuk kavramı değişik disiplinlerin ilgi alanında yer almaktadır. Hukuki bilgiyi sadece yürürlükte normların bilinmesi ve yorumlanması olarak dogmatik hukuk bilgisinden ibaret saymak, hukukla ilgili sığ ve yüzeysel bir bakış açısını yansıtmaktadır. Dogmatik hukuk bilimi, pozitif hukukun toplumsal gerçeklere  ve  ihtiyaçlara  uygun  olarak  yorumlanması  için  hukuk sosyolojisinden;  adalet  değeri,  insan  hakları  ve  onuruna  uygun  olarak yorumlanması  için  de  hukuk  felsefesinden  yararlanmalıdır.  Vaquero, dogmatik  hukuk  bilimine  alışılmışın  dışında  bir  rol  vererek,  bu  bilimin (disiplinin) sadece pozitif hukukun içeriğini tanımlamakla yetinmeyip, aynı zamanda zor davalarda (hard-cases) yargıçlara çözümler sunması gerektiğini belirtmektedir. Bu düşünceye koşut olarak adı geçen yazar, Aarnio ve Alexy  gibi  mantıksal/formel  gerekçelendirmeyle  yetinmeyen  hukuk felsefecilerinin  hukuksal  akıl  yürütmelerine  uygun  olarak,  hukuk dogmatiğini,  gerekçelendirici  hukuk  dogmatiği  (argumentativist  legal dogmatics)  olarak  yeniden  tanımlamaktadır.  Bu  bağlamda  Vaquero, hukuki  akıl  yürütmenin,  üç  boyutundan  söz  ederek  bunları,  mantıksal geçerlilik,  ikna  edici  kapasite  ve  maddi/özsel  ma kuliyet  (material plausibility) olarak sıralar. Yazar açısından maddi/özsel makuliyet/akla yatkınlık,  hukuki  ihtilaflarda  muhtemel  en  iyi  çözümün  bulunmasını sağlayan şartları belirlemeyi amaçlar. Dolayısıyla bu nitelikteki bir hukuk dogmatiği (dogmatik hukuk bilimi), sadece mevcut kurallardan hareket eden sıradan bir mantıki gerekçeyi yeterli görmeyip, buna akıl yürütmenin ikna ediciliğini ve ortaya çıkardığı sonucun mümkün olduğu kadar en iyi çözüm olmasını  da  eklemektedir.  İşte  dogmatik  hukuk  biliminin  bu  derinlikte kavranabilmesi  için,  hukuk  felsefesi  gibi  diğer  disiplinlerle  beslenmesi gerekir.  Peczenik,  hukuk  dogmatiğinin  betimleyici  ve  mantıksal gerekçelendirme  işlevlerini  içermesi  yanında  değerlendirici  işlevinin  de bulunduğunu  söyler.  Değerlendirici  akıl  yürütmenin,  ahlaki  değerler açısından  yapıldığını  söyleyen  Peczenik,  hukuk  dogmatiğinin,  hukuk siteminin  içsel  bir  tutarlığını  sağlamaya  dönük  bir  görevinin  bulunması                                                             124  Vaquero, s. 60, 67 ve dipnot 37. 125  Vaquero, s. 66. 126  Vaquero, s. 67. 127  Vaquero, s. 67. 128  Peczenik,  Alexander,   Scientia  Iuris:  An  Unsolved  Philosophical  Problem ,  Ethical Theory and Moral Practice, Vol. 3, No. 3, (Sep., 2000), Published by Springer,  s. 289. pp. 273-302.  129  Peczenik, Scientia Iuris, s. 289-290. 248Ankara Üni. Hukuk Fak. Dergisi, 67 (2) 2018: 227-252                                        Hukuk Kavramının Analizi  yanında,  söz  konusu  sistemin  ahlak  ve  siyaset  felsefesi  bakımından  da temellendirilmesini yapmaya dönük bir işlevinin olduğunu belirtir.    Hukuki  kurumların  işlevlerinin  doğru  olarak  kavranması,  hukuksal kavramların doğru olarak anlamlandırılması ve genel bir hukuk teorisine yol gösterici olması bakımından hukukun sosyolojik ve tarihsel analizlerinin yapılması  gerekir.  Bu  analizler,  örneğin  aile  ve  miras  kavramlarının toplumun işleyişi için ne anlam ifade ettiği ve buna benzer kurumların nasıl ortaya çıktığına ilişkin analizlerin yapılması ile dini metinlerdeki hukuksal kurumlar ve bu kurumların işlevleriyle ilgili sosyolojik tespitlerin yapılması bakımından  hukuk  yapımcıları  ve  reformcuları  için  yol  göstericidir. Billurlaşmış  evrensel  değerlerin tarihsel  ve  sosyolojik olarak işlevlerinin irdelenmesi ve doğru bir hukuki tasavvur için hukuk sosyolojisi ve hukuk tarihi disiplinlerinin, hukuk biliminin (jurisprudence) kaçınılmaz bir ögesi olduğunun bilincine varılması gerekir. Bu disiplinleri ihmal eden nice iyi niyetli  kişiler,  hukuksal  kurum  ve  kavramların  gerçek  anlamlarını kavrayamadıkları  için  beşeriyetin  hukuki  tasavvuruna  büyük  zarar vermişlerdir. Hukukun sadece kuvvete değil, aynı zamanda da hakka ve her toplumca kabul edilebilen bir takım evrensel değer ve ilkelere dayandığının anlaşılması için dar anlamda (normatif) hukuk felsefesi tahlillerine ihtiyaç vardır. Hukuk öğrencilerinin ve hukuka ilgi duyanların, hukuk bilgisinin, beşeri iradenin koyduğu normlarla tükenmediğinin farkına varmaları; hukuk öğreniminin ise dogmatik hukuk disipliniyle sınırlı olmadığının kavranması; hukukun  gerçek  kaynaklarına  inilmesi;  hukukun  dilsel  ve  mantıksal analizinin yapılması; ahlaki, ekonomik ve toplumsal ihtiyaçlar bağlamında tetkike tabi tutulması gereğinin bilincinde olunması, gerek evrensel düzeyde ve gerekse yerel düzeyde doğru/adil olmayan hukuk telakkilerinin önüne geçilmesi  bakımından  önem  arz  etmektedir.  İnsan  haklarının  ve  insan onurunun  korunması  bakımından  hukukun  derinlikli  olarak  kavranması kaçınılmazdır.  Hukuki  tefekkürümüzü  zenginleştirmek  için  genel  hukuk teorisi ve hukuk sosyolojisi gibi hukukun pozitif yöntemlerle tetkik edilmesi yanında, evrensel değerler ve adalet açısından eleştirel bir bakış açısına da ihtiyaç vardır. Bu görevi de hukuk felsefesiyle güçlendirilmiş bir hukuk eğitimi yerine getirmelidir.                                                               130 Peczenik, Scientia Iuris, s. 290.   249Sururi Aktaş                                                            Ankara Üni. Hukuk Fak. Dergisi, 67 (2) 2018: 227-252 Kaynakça Aral, Vecdi, Hukuk Felsefesinin Temel Sorunları, Filiz Kitabevi, İstanbul 1992. Aral,  Vecdi,  Kelsen in  Saf  Hukuk  Teorisinin  Metodu  ve  Değeri,  İstanbul Üniversitesi Hukuk Fakültesi Yayını, İstanbul 1978. Aulis, Aarnio, The Rational as Reasonable: A Treatise on Legal Justification, Reidel Publishing Company Dordrecht, 1987. Austin, John, Hukukun Belirlenmiş Alanı (Çev. Üker Yükselbaba-Saim Üye-Umut Koloş), 1. Baskı, Tekin Yayını 2015. Austin, John, The Province of Jurisprudence Determined, (Edited By Wilfrid E. Rumble), Cambridge University Press, 2001,  Lecture I. Baali, Fuad, Society, State and Urbanism: Ibn Khaldun s Sosyological Thought, State University of New York Press, 1988. Curzon, L. B., Jurisprudence, 2nd Edition,Cavendish Publishing, London-Sydney, 1995. Çağıl, Orhan Münir, Hukuk Metodolojisi Dersleri, İkinci Tab, İstanbul Üniversitesi Hukuk Fakültesi Yayınları, İstanbul 1952. Dagan, Hanoch, Kreitner, Roy,  The Character of Legal Theory , Cornell Law Review, (2011), Vol. 96,  pp. 671-191. Dworkin,   Law as Interpretation , Texas Law Review, Vol. 60, (1982). Evensky, Jerry,  Adam Smith s Moral Philosophy: A Historical and Contemporary Perspective on Market, Law, Ethics, and Culture, Cambridge University Press 2005. Finnis, John,  What is The Philosophy of Law , Rivista di Filosofia del Diritto no. 1, (2012), pp. 67-78. Fridmann, W., Legal Theory, 2nd Edition, London 1949. Georges, Gurvitch, Sociology of Law, (With a New Introduction by Alan Hunt), Transanction Publishers, 2001. Gözler, Kemal, Hukuka Giriş, Ekin Yayını, 13. Baskı Bursa 2016. Gözler, Kemal, Hukukun Genel Teorisine Giriş  Hukuk Normlarının Geçerliliği Ve Yorumu Sorunu,Us-A Yayıncılık, Ankara 1998. Güriz, Adnan, Hukuk Felsefesi, 7.  Baskı, Siyasal Kitabevi, Ankara 2007. Gürkan, Ülker, Hukuk Sosyolojisine Giriş, Gözden Geçirilmiş 4. Baskı, Siyasal Kitabevi, Ankara 2005. Hart, H.L.A., The Concept of Law, Second Edition, (with a postcript edited by Penelope A. Bulloch and Joseph Raz) Clarendon Press-Oxford, 1994. Hassan, Ümit, İbn Haldun un Metodu ve Siyaset Teorisi, 2. Baskı , Toplumsal Dönüşüm Yayınları, 1998 İstanbul. 250Ankara Üni. Hukuk Fak. Dergisi, 67 (2) 2018: 227-252                                        Hukuk Kavramının Analizi  Hayek,  Friedrich  August  von,  Kanun,  Yasama  Faaliyeti  ve  Özgürlük,  C.I. (Kurallar ve Düzen), (çev. Atilla Yayla), 1. baskı, Türkiye İş Bankası Kültür Yayınları, Ankara 1994; Kanun, Yasama Faaliyeti ve Özgürlük, C. II (Sosyal Adalet Serabı), (çev. Mustafa Erdoğan) 1. Baskı, Türkiye İş Bankası Kültür Yayınları, 1995; Hukuk, Yasama ve Özgürlük, C. III. (Özgür Bir Toplumun Siyasal Düzeni), (çev. Mehmet Öz), Türkiye İş Bankası Kültür Yayını, 1997).  Hirş, Ernest, Hukuk Felsefesi ve Hukuk Sosyolojisi Dersleri, (Güncel dile uyarlayan Selçuk Baran (Vezirioğlu) 3. Tıpkı Basım, Ankara 2001. Işıktaç, Yasemin, Hukuk Felsefesi, Filiz Kitabevi, İstanbul 2004. Işıktaç, Yasemin, Hukuk Sosyolojisi, Filiz Kitabevi, İstanbul 2014. İbn Haldun, Mukaddime, Cilt I (Çev. Zakir Kadiri Ugan), MEB Yayını, İstanbul 1990. İzveren, Adil, Hukuk Felsefesi, Dokuz Eylül Üniversitesi Hukuk Fakültesi Yayını, Ankara 1988. Julie Dickson,  Methodology in Jurisprudence: A Critical Survey , Legal Theory, 10 (22049, pp. 117-156. Kantorowicz,  Herman  U./Patterson,  W.,   Legal  Science--A  Summary  of  Its Methodology , Columbia Law Review,Vol. 28, No. 6 (Jun., 1928),  pp. 679707. Kelsen, Hans,  The Pure Theory of Law and Analytical Jurisprudence , Harvard Law Review, Vol. 55, No. 1. (Nov., 1941),  pp. 44-70. Kelsen, Hans, General Theory of Law and State (Translated by Anders Wedberg), Third Printing 1949, (Orginally Camridge-Harvard University Press 1945). Kelsen, Hans, Pure Theory of Law, (Translated From Second Revised and Enlarged German Edition) by Max Knight), Fift Printing 2005. Mecleod, Ian, Legal Theory,  Published by Palgrave Macmillan 2nd Edition, 2003. Merriam-Webster  Dictionary,   jurisprudence ,  https://www.merriamwebster.com/dictionary/jurisprudence (E.T. 04.01.2017) Minemura Teruo,  Dogmatic Legal Science and Sociology of Law , Archiv für Rechts- und Sozialphilosophie / Archives for Philosophy of Law and Social Philosophy, (ARSP), Vol. 56, No. 3 (1970), pp. 351-366 Ökçesiz,  Hayrettin,   Doğru  Hukukun  Bilgisi ,  Hukuk  Felsefesi  ve  Sosyolojisi Arkivi (HFSA), 8. Kitap, Haz. Hayrettin Ökçesiz, İstanbul Barosu Yayını, İstanbul 2003, ss. 120-135. Özbilgen, Tarık, Eleştirel Hukuk Başlangıcı Dersleri, İstanbul Üniversitesi Hukuk Fakültesi Yayınları İstanbul 1976. Özbilgen, Tarık, Eleştirisel Hukuk Sosyolojisi Dersleri, Cilt  I, İstanbul Üniversitesi Hukuk Fakültesi Yayınları, İstanbul 1971. Deflem, Mathieu, Sosyology of Law, (Vision of Scholarly Tradition ), Cambridge University Press, 2008.   251Sururi Aktaş                                                            Ankara Üni. Hukuk Fak. Dergisi, 67 (2) 2018: 227-252 Özcan, Mehmet Tevfik, Hukuk Sosyolojisine Giriş, 1. Baskı, Donkişot, İstanbul 2001. Peczenik, Aleksander, On Law and Reason, Springer, 2008. Peczenik, Alexander,  Scientia Iuris: An Unsolved Philosophical Problem , Ethical Theory and Moral Practice, Vol. 3, No. 3 (Sep., 2000), Published by: Springer, pp. 273-302.  Phillipps, Charler Spencer March, Jurisprudence, Adamant Media Corporation (Elibron Cllasics Series), 2006. Posner, Richard A.,  The Decline Of Law As An Autonomous Discipline: 19621987 , Harvard Law Review  (1986-1987),  Vol. 100,  pp. 761-780. Pound, Rorcoe, An Introduction to The Philosophy of Law, Yale University Press  1922. Raz, Joseph,  Can There Be a Theory of Law , The Blackwell Guide to The Philosophy of  Law  and  Legal  Theory  (Edited  by  Martin  P. Golding  and William A. Edmundson), Blackwell Publishing, 2005, pp. 324-342. Schwarz, Andreas B.,  Roma Hukuku ve İngiliz Hukuku , İstanbul Üniversitesi Hukuk Fakültesi Mecmuası, Cilt 11, sayı 3-4, 1945, pp. 180-202.  Timasheff, Nicholas S., An Introduction to The Sosyology of Law (with a new introduction by Javier Trevino), 3th Printing, Transcantion Publishers. Topçuoğlu,  Hamide,  Hukuk  Sosyolojisi,  Cilt  I,  Ankara  Üniversitesi  Hukuk Fakültesi yayınları, Ankara 1960.  Troper, Michel, Hukuk Felsefesi, Çev. Işık Ergüden, Dost Yayını, Ankara 2011. Twining,  William;  General  Jurisprdence:  Understanding  Law  From  Global Perspective,  Cambridge University Press, 2009. Uygun, Oktay, Hukuk Teorileri, 1. Baskı, OnikiLevha Yayını, İstanbul 2017. Uygun, Oktay, İbn Haldun un Toplum ve Devlet Kuramı, XII Levha Yayını, 1. Baskı, İstanbul 2008. Uygur, Gülriz, Hukuk, Etik ve İlkeler, Siyasal Kitabevi, Ankara 2006. Vaquero,  Alvaro  Nunez,   Five  Model  of  Legal  Science ,  Translator:  Ester González Bertrán, Journal for Constitutional Theory and Philosophy of Law / Revija za ustavno teorijo in filozofijo prava (REVUS), Klub Revus, 19, 2013, pp. 53-81. Weber, Max, The Protestan Ethic and  The Spirit of Capitalism, (Translated by Talcott Parsons), Routlege, 2005 (orjinali 1930),  s. xxxviii. Westerman, Pauline C., The Disintegration of Natural Law Theory: Aquinas to Finnis, Brill 1998. Yazıcı, Sedat, Felsefeye Giriş, Genişletilmiş 3.baskı, Öncü Kitap, Ankara 2009. 252",
     "Kaynakça": "Aral, Vecdi, Hukuk Felsefesinin Temel Sorunları, Filiz Kitabevi, İstanbul 1992. Aral,  Vecdi,  Kelsen in  Saf  Hukuk  Teorisinin  Metodu  ve  Değeri,  İstanbul Üniversitesi Hukuk Fakültesi Yayını, İstanbul 1978. Aulis, Aarnio, The Rational as Reasonable: A Treatise on Legal Justification, Reidel Publishing Company Dordrecht, 1987. Austin, John, Hukukun Belirlenmiş Alanı (Çev. Üker Yükselbaba-Saim Üye-Umut Koloş), 1. Baskı, Tekin Yayını 2015. Austin, John, The Province of Jurisprudence Determined, (Edited By Wilfrid E. Rumble), Cambridge University Press, 2001,  Lecture I. Baali, Fuad, Society, State and Urbanism: Ibn Khaldun s Sosyological Thought, State University of New York Press, 1988. Curzon, L. B., Jurisprudence, 2nd Edition,Cavendish Publishing, London-Sydney, 1995. Çağıl, Orhan Münir, Hukuk Metodolojisi Dersleri, İkinci Tab, İstanbul Üniversitesi Hukuk Fakültesi Yayınları, İstanbul 1952. Dagan, Hanoch, Kreitner, Roy,  The Character of Legal Theory , Cornell Law Review, (2011), Vol. 96,  pp. 671-191. Dworkin,   Law as Interpretation , Texas Law Review, Vol. 60, (1982). Evensky, Jerry,  Adam Smith s Moral Philosophy: A Historical and Contemporary Perspective on Market, Law, Ethics, and Culture, Cambridge University Press 2005. Finnis, John,  What is The Philosophy of Law , Rivista di Filosofia del Diritto no. 1, (2012), pp. 67-78. Fridmann, W., Legal Theory, 2nd Edition, London 1949. Georges, Gurvitch, Sociology of Law, (With a New Introduction by Alan Hunt), Transanction Publishers, 2001. Gözler, Kemal, Hukuka Giriş, Ekin Yayını, 13. Baskı Bursa 2016. Gözler, Kemal, Hukukun Genel Teorisine Giriş  Hukuk Normlarının Geçerliliği Ve Yorumu Sorunu,Us-A Yayıncılık, Ankara 1998. Güriz, Adnan, Hukuk Felsefesi, 7.  Baskı, Siyasal Kitabevi, Ankara 2007. Gürkan, Ülker, Hukuk Sosyolojisine Giriş, Gözden Geçirilmiş 4. Baskı, Siyasal Kitabevi, Ankara 2005. Hart, H.L.A., The Concept of Law, Second Edition, (with a postcript edited by Penelope A. Bulloch and Joseph Raz) Clarendon Press-Oxford, 1994. Hassan, Ümit, İbn Haldun un Metodu ve Siyaset Teorisi, 2. Baskı , Toplumsal Dönüşüm Yayınları, 1998 İstanbul. 250Ankara Üni. Hukuk Fak. Dergisi, 67 (2) 2018: 227-252                                        Hukuk Kavramının Analizi  Hayek,  Friedrich  August  von,  Kanun,  Yasama  Faaliyeti  ve  Özgürlük,  C.I. (Kurallar ve Düzen), (çev. Atilla Yayla), 1. baskı, Türkiye İş Bankası Kültür Yayınları, Ankara 1994; Kanun, Yasama Faaliyeti ve Özgürlük, C. II (Sosyal Adalet Serabı), (çev. Mustafa Erdoğan) 1. Baskı, Türkiye İş Bankası Kültür Yayınları, 1995; Hukuk, Yasama ve Özgürlük, C. III. (Özgür Bir Toplumun Siyasal Düzeni), (çev. Mehmet Öz), Türkiye İş Bankası Kültür Yayını, 1997).  Hirş, Ernest, Hukuk Felsefesi ve Hukuk Sosyolojisi Dersleri, (Güncel dile uyarlayan Selçuk Baran (Vezirioğlu) 3. Tıpkı Basım, Ankara 2001. Işıktaç, Yasemin, Hukuk Felsefesi, Filiz Kitabevi, İstanbul 2004. Işıktaç, Yasemin, Hukuk Sosyolojisi, Filiz Kitabevi, İstanbul 2014. İbn Haldun, Mukaddime, Cilt I (Çev. Zakir Kadiri Ugan), MEB Yayını, İstanbul 1990. İzveren, Adil, Hukuk Felsefesi, Dokuz Eylül Üniversitesi Hukuk Fakültesi Yayını, Ankara 1988. Julie Dickson,  Methodology in Jurisprudence: A Critical Survey , Legal Theory, 10 (22049, pp. 117-156. Kantorowicz,  Herman  U./Patterson,  W.,   Legal  Science--A  Summary  of  Its Methodology , Columbia Law Review,Vol. 28, No. 6 (Jun., 1928),  pp. 679707. Kelsen, Hans,  The Pure Theory of Law and Analytical Jurisprudence , Harvard Law Review, Vol. 55, No. 1. (Nov., 1941),  pp. 44-70. Kelsen, Hans, General Theory of Law and State (Translated by Anders Wedberg), Third Printing 1949, (Orginally Camridge-Harvard University Press 1945). Kelsen, Hans, Pure Theory of Law, (Translated From Second Revised and Enlarged German Edition) by Max Knight), Fift Printing 2005. Mecleod, Ian, Legal Theory,  Published by Palgrave Macmillan 2nd Edition, 2003. Merriam-Webster  Dictionary,   jurisprudence ,  https://www.merriamwebster.com/dictionary/jurisprudence (E.T. 04.01.2017) Minemura Teruo,  Dogmatic Legal Science and Sociology of Law , Archiv für Rechts- und Sozialphilosophie / Archives for Philosophy of Law and Social Philosophy, (ARSP), Vol. 56, No. 3 (1970), pp. 351-366 Ökçesiz,  Hayrettin,   Doğru  Hukukun  Bilgisi ,  Hukuk  Felsefesi  ve  Sosyolojisi Arkivi (HFSA), 8. Kitap, Haz. Hayrettin Ökçesiz, İstanbul Barosu Yayını, İstanbul 2003,"
}