{
     "Tip": "Makale",
     "Dergi İsmi": "İstanbul Hukuk Mecmuası ",
     "Üniversite İsmi": "İstanbul Üniversitesi",
     "Gün": "12",
     "Ay": "04",
     "Yıl": "2021",
     "Cilt": "79",
     "Sayı": "2",
     "Başlık": "Karşılaştırmalı Bir Bakış Açısıyla Ileriye Dönük Hasta Direktifleri ve Türk Hukuku Için Öneriler",
     "Title": "Advanced Healthcare Directives From a Comparative Perspective and Proposals for Turkish Law",
     "Yazar İsmi": [

          "Gökçe Kurtulan Güner"
     ],
     "Danışman İsmi": "",
     "Anahtar Kelimeler": [
          "İleriye Dönük Hasta Direktifi", "Temsil", "Hasta Hakları", "Vesayet", "Ayırt Etme Gücünün Kaybı"
     ],
     "Keywords": [
          "Advance Healthcare Directive", "Durable Power of Attorney", "Patient Rights", "Guardianship", "Loss of Mental Capacity"
     ],
     "Özet": "Nüfusun yaşlanması ve ortalama yaşam süresinin uzaması ve bunlara paralel olarak toplumda ileride ayırt etme gücünden yoksunluğa sebep olabilecek psikiyatrik hastalıkların görünürlüğünün artması beraberinde toplumsal değişikliklerin yanı sıra birtakım hukuki gelişmeleri de getirmiştir. Bu doğrultuda kişilerin kademeli olarak karar verme yetilerini kaybetmeleri riskine karşı yasa koyucuların ve öğretinin daha geniş kapsamlı bir hukuki koruma arayışına girmesi söz konusu olmuştur. Bu çalışmanın konusunu, kişilerin karar verme yetilerini kaybettikleri zaman uygulanması için hazırladıkları ve ileriye dönük hasta direktifleri (advance healthcare directives) olarak anılan düzenlemeler oluşturmaktadır. Bu doğrultuda, öncelikle hem yönlendirici direktifleri hem de süregelen temsil yetkisini içine alan bir çatı kavram olarak kullanılan ileriye dönük hasta direktifi kavramının ortaya çıkışı ve karşılaştırmalı hukuk alanında bu yönde yaşanan gelişmeler incelenmiştir. Ardından bu tür düzenlemelerin bağlayıcılığına ilişkin herhangi bir kurala sahip olmayan Türk hukuk sistemindeki durum değerlendirilerek de lege feranda önerilerde bulunulmaya çalışılmıştır.",
     "Abstract": "As a result of the aging population and the improvement in average life expectancy, the visibility of psychiatric diseases causing loss of mental competence has considerably increased. The aging population presently enjoys expanded options in social life and improved support within the legal system. These positive changes resulted from the combined effort of the academic and legislative bodies toward finding ways to support patient autonomy and self-involvement in decisionmaking in case of loss of mental competence. This article focuses on the regulations, known as the advance healthcare directives, prepared for application when a drafter loses mental capacity. The genesis of this concept and efforts toward its adoption are discussed and analyzed from a comparative lens. This study examines advance healthcare directives in a wider sense, including instruction directives and durable powers of attorney. As Turkish law lacks a legal rule providing for bindingness for these kinds of dispositions, certain de lege ferenda proposals in line with the comparative findings have been proposed at the end of this paper.",
     "Metin": "I. Giriş ve Terminolojiye İlişkin AçıklamaNüfusun yaşlanması; nüfus artışı, göç ve şehirleşmeyle birlikte küresel bağlamda en etkili dört demografik  mega trendden  biri olarak kabul edilmektedir.1 Birleşmiş Milletler Ekonomik ve Sosyal İşler Departmanı (DESA) 2019 yılında yayınladığı bir rapora göre dünyadaki her 11 kişiden 1 inin 65 yaşının üzerinde olduğu düşünülmekte ve bu oranın 2050 yılı itibariyle 6 kişide 1 e düşecek olduğu öngörülmektedir.2 Yine DESA tarafından hazırlanan bir başka raporda, 2020 yılı itibariyle Türkiye de 65 yaş üstü nüfusun toplam nüfusa oranının %5 ila 10 arasında olduğu, bununla birlikte 2050 yılı itibariyle bu oranın %25 ila 30 arasında bir seviyeye kadar yükseleceği tahmin edilmektedir.3Aslında nüfusun yaşlanması başlı başına insanlık için bir başarı olmakla birlikte, bu  gerçeği  yakından  takip  eden  birtakım  önemli  sorunların  mevcut  olduğu  da unutulmamalıdır. Yaşlı nüfusun karşılaştıkları zorlukların başında gelen fiziksel ve akli bozukluklar ve bunların nasıl ele alınması gerektiği bunlardan sadece birini teşkil etmektedir.  Dünya Sağlık Örgütü ne göre 60 yaşın üstündeki bireylerin %20 sinin başta demans ve depresyon olmak üzere, akli veya nörolojik bir rahatsızlığı olduğu düşünülmektedir.4 Nüfusun yaşlanması ve ortalama yaşam süresinin uzaması, beraberinde toplumsal değişikliklerin yanı sıra birtakım hukuki gelişmeleri de getirmiştir. Bu çalışmanın konusunu, kişilerin karar verme yetilerini kaybettikleri zaman uygulanması için hazırladıkları ve ileriye dönük hasta direktifleri (advance healthcare directives) olarak anılan düzenlemeler oluşturmaktadır.5 Bununla birlikte şimdiden ileriye dönük hasta direktiflerinin sadece yaşlı nüfus için önem taşımadığının altı çizilmelidir. Zira genç ve sağlıklı bir kimsenin de ileride ayırt etme gücünü kaybetmesi ihtimalini dikkate alması, böyle bir durumda bedeni ve yaşamı hakkındaki kararlarda söz sahibi olmak istemesi ve bu yönde bir düzenleme yapma ihtiyacına sahip olması da pekâlâ mümkündür.61  Küresel ve demografik megatrendler konusunda ECOSOC tarafından hazırlanmış bir rapor için bkz <https://www.un.org/en/development/desa/population/events/pdf/expert/30/presentations/Monday/Session/Frank_Swiaczny_UNDESA_PowerPoint_EGM%20CPD.pdf> Erişim tarihi 15 Mart 20212  İlgili  raporun  tam  metni  için  bkz  <https://www.un.org/en/development/desa/population/publications/pdf/ageing/WorldPopulationAgeing9-Highlights.pdf> Erişim tarihi 15 Mart 20213  Bölgeler bazında hazırlanan bu rapor için bkz <https://population.un.org/wpp/Maps/> Erişim tarihi 15 Mart 20214  Bkz <https://www.who.int/news-room/fact-sheets/detail/mental-health-of-older-adults> Erişim tarihi 15 Mart 2021. 2019 yılında Alzheimer s Disease International tarafından düzenlenen raporda, dünya genelinde 50 milyondan fazla kişinin demans bastası olduğu ve bu sayının 2050 yılında 152 milyonu bulabileceği ifade edilmiştir. Bkz <https://www.alz.co.uk/research/WorldAlzheimerReport9.pdf> Erişim tarihi 15 Mart 20215  İngilizce de advance healthcare directive olarak ifade edilen bu kavramın Türkçe deki çeşitli olası karşılıkları için bkz Özge Yücel, Ayırt Etme Gücünden Yoksun Kişiler Adına Alınan Tıbbi Kararlarda Özerklik Hakkının Korunması ve Hasta Talimatları (1. bası, Seçkin 2018) 25.6  Saibe Oktay Özdemir, ‘Tıbbi Müdahaleler Alanında Önceden Verilmiş Talimatlara (Hasta Vasiyeti) İlişkin Gelişmeler ve Türk Hukukundaki Geçerliliği  iç Saibe Oktay Özdemir ve diğerleri (edr) Prof. Dr. Galip Sermet Akman a Armağan (1. bası, Filiz 2020) 615.412Kurtulan-Güner / Karşılaştırmalı Bir Bakış Açısıyla İleriye Dönük Hasta Direktifleri ve Türk Hukuku İçin ÖnerilerAslında ileriye dönük hasta direktifi kavramı hukukumuza tamamen yabancı bir kavram değildir. Zira bu kavram, Avrupa Konseyi çerçevesinde 1997 yılında imzaya açılan ve Türkiye tarafından 2003 yılında onaylanan Oviedo Sözleşmesi olarak da anılan İnsan Hakları ve Biyotıp Sözleşmesi yle birlikte sistemimize kısmen de olsa girmiştir.7 Anayasa nın 90. maddesi doğrultusunda iç hukukumuzun bir parçası olan ilgili Sözleşme nin  önceden açıklanmış istek  başlıklı 9. maddesinde  Müdahale sırasında  isteğini  açıklayabilecek  bir  durumda  bulunmayan  bir  hastanın,  tıbbî müdahale ile ilgili olarak önceden açıklamış olduğu istekler göz önüne alınacaktır.  buyrulmuştur. Ancak söz konusu Sözleşme nin hiçbir yerinde ileriye dönük hasta direktifi ifadesinin kullanılmadığı ve bunun, direktiflerin bağlayıcı niteliğini dışlamak için bilinçli bir tercih olduğu ifade edilmelidir.8 Bununla birlikte, birçok hukuk sisteminde son yıllarda bağlayıcı karaktere sahip ileriye dönük hasta direktiflerine ilişkin düzenlemeler getirildiği görülmektedir. Konuyu irdelemeye geçmeden önce, çalışmada kullanılan terminolojiye ilişkin birkaç çekincenin ortaya konması gerekmektedir. Çalışmada ileriye dönük hasta direktifi kavramı, kişilerin henüz ayırt etme gücüne sahipken ileride ortaya çıkabilecek ihtimalleri dikkate alarak yaptıkları ve karar verme yetilerini kaybettikleri durumda kendilerine uygulanacak veya uygulanmayacak tedaviyi belirledikleri yönlendirici direktiflerin yanı sıra,9 kişilerin ayırt etme gücünden yoksun kaldıkları ihtimalde kendi hayatları hakkındaki bu tür kararları vermek için birini temsilci olarak atadıkları süregelen temsil yetkisi (continuing/lasting/durable power of attorney) kurumunu da kapsayacak şekilde, yani geniş anlamda kullanılmıştır.10 Ancak, aşağıda inceleneceği üzere bazı uluslararası metinlerde ileriye dönük hasta direktifi ifadesinin sadece yönlendirici direktiflere karşılık gelecek şekilde, yani dar anlamda kullanıldığı belirtilmelidir.11 Bu nedenle, bu metinler incelenirken 7  Biyoloji ve Tıbbın Uygulanması Bakımından İnsan Hakları ve İnsan Haysiyetinin Korunması Sözleşmesi: İnsan Hakları ve Biyotıp Sözleşmesinin Onaylanmasının Uygun Bulunduğuna Dair Kanun, Kanun Numarası: 5013, Kabul Tarihi: 03.12.2003, RG 20.04.2004/25439.8  Roberto Andorno, ‘Regulating Advance Directives at the Council of Europe  iç Stefania Negri (ed), Self-Determination, Dignity and End-of-Life Care - Regulating Advance Directives in International and Comparative Perspective (1. bası, Brill 2012) 77. Nitekim önceden açıklanmış isteklerin bağlayıcı olmadığı, Sözleşme nin açıklayıcı raporunda da açıkça belirtilmiştir. Bkz. Oktay Özdemir (n 6) 605; Explanatory Report to the Convention for the Protection of Human Rights and Dignity of the Human Being with Regard to the Application of Biology and Medicine: Convention on Human Rights and Biomedicine, Oviedo, 4.5.1997, 10-11. Açıklayıcı raporun tam metni için bkz <https://rm.coe.int/16800ccde> Erişim tarihi 15 Mart 20219  Bu çalışmada, karşılaştırmalı hukukta özellikle Anglo-Sakson öğretisinde yönlendirici direktifin yerine kullanılan living will kavramının bir tercümesi olan yaşayan vasiyetname kavramı tercih edilmemiştir. Bunun temel sebebi ilgili düzenlemenin bir ölüme bağlı tasarruf olmaması, bu nedenle söz konusu tercümenin yanıltıcı olabileceğinin düşünülmesidir. Benzer yönde bkz Hamide Tacir, Hastanın Kendi Geleceğini Belirleme Hakkı (1. bası, On İki Levha 2011) 139; Yücel (n 5) 26 ff. Ayrıca bkz İpek Sevda Söğüt ve Ekin Tuna, ‘Hastanın Tıbbi Yaşam İradesine Dair Hukuki Vasıtalar  (2017) 12 Tıp Hukuku Dergisi 255, 258. Krş Oktay Özemir (n 6) 615.10  Öğretide bunların sırayla talimat direktifi (instruction directive) ve vekil direktifi (proxy directive) olarak da anıldığı görülmektedir. Bkz Yücel (n 5) 28; Tom Goffin, ‘Advance Directives as an Instrument in an Ageing Europe  (2012) 19 European Journal of Health Law 121, 124-125; Jochen Taupitz ve Amina Salkić, ‘Advance Directives and Legality of Euthanasia under German Law  iç Stefania Negri (ed), Self-Determination, Dignity and End-of-Life Care - Regulating Advance Directives in International and Comparative Perspective (1. bası, Brill 2012) 332.11  Yücel (n 5) 127.413İstanbul Hukuk Mecmuası 79/2geniş anlamda ileriye dönük hasta direktifi ifadesi hem yönlendirici direktifleri hem de süregelen temsil yetkisini kapsayacak şekilde, buna karşılık dar anlamda ileri dönük hasta direktifi ise sadece yönlendirici direktiflere karşılık gelecek şekilde kullanılacaktır.Öte yandan, uygulamada pek çok zaman tedaviye ilişkin yönlendirici direktifler ve süregelen temsil kurumları bir arada düzenlendiği ifade edilmelidir. Böylece kişilerin, öngörebildikleri ihtimallere karşı henüz ayırt etme gücüne sahip iken kendi kararlarını vermeleri, öngöremedikleri durumlarda ise bu karar verme yetkisini güvendikleri bir kişiye devretmeleri mümkün olmaktadır. Bu noktada, çalışmanın devamında sıkça yer verilecek olan süregelen temsil yetkisi kavramına ilişkin de bir çekincenin ortaya konması isabetli olacaktır. Zira bu kavram da hem temsil hem de vesayet kurumlarını içine alan bir çatı kavram olarak kullanılmaktadır.12 Süregelen temsil yetkisi verilmekle kişinin ayırt etme gücüne sahipken yaptığı ve ayırt etme gücünün kaybı geciktirici şartına bağlı (diğer bir ifadeyle ileriye dönük) ve temsil kabul eden işlemlerin bu kişilerce yapılması sağlanmakta, bunun yanı sıra prensip olarak kişiye sıkı sıkıya bağlı ve bu nedenle temsil düşmanı kabul edilen birtakım kararların da bu kişilerce alınması mümkün kılınarak vesayet kurumunun kapıları aralanmaktadır.13  İleriye dönük hasta direktifi kavramı yakın zamana kadar herhangi bir tedaviyi ya da bakımı kabul etme veya reddetmeye ilişkin kararlar için kullanılan daha dar kapsamlı bir hukuki araçken,14 bu bakış açısının zamanla değiştiğini söylemek mümkündür.  Nüfusun  yaşlanmasına  paralel  olarak  toplumda  ileride  ayırt  etme gücünden  yoksunluğa  sebep  olabilecek  hastalıkların  görünürlüğünün  artması, kişilerin kademeli olarak karar verme yetilerini kaybetmeleri riskine karşı daha geniş kapsamlı bir hukuki koruma arayışına girmesi sonucunu doğurmuştur. Bu doğrultuda aşağıda öncelikle bu çalışmanın başlığında geçen kavramların ortaya çıkışı ve bunlara yüklenen anlamlar incelenecek, ardından karşılaştırmalı hukuk alanında bu yönde yaşanan gelişmelere değinilecektir. Bu doğrultuda Türk hukuk sistemindeki durum incelenecek ve de lege feranda önerilerde bulunulmaya çalışılacaktır. II. İleriye Dönük Hasta Direktifi Kavramının Ortaya Çıkışı: Genel AçıklamalarBir kimsenin vücut bütünlüğünü etkileyecek tıbbi müdahalelere onay vermesi, temel insan hakları olan yaşam ve vücut bütünlüğünü haklarına yapılan ihlallere 12  Yücel (n 5) 283.13  Yücel (n 5) 283.14  Goffin (n 10) 122, 125.414Kurtulan-Güner / Karşılaştırmalı Bir Bakış Açısıyla İleriye Dönük Hasta Direktifleri ve Türk Hukuku İçin Önerilerrıza göstermesi demektir.15 Bu rıza, aksi takdirde hukuka aykırılık teşkil edecek bu tür müdahaleler açısından bir hukuka uygunluk sebebi teşkil etmektedir. Medeni hukukta karşımıza bir hukuka uygunluk sebebi olarak çıkan rızanın, yani kişilerin bu tür müdahalelere onay vermek ya da bunları reddetmek yönündeki iradelerinin, kişilik hakkının ve bunun bir görünümü olan özerklik ilkesinin hayata geçirilmesiyle doğrudan ilgili olduğunu söylemek mümkündür.16 Kişinin bu doğrultudaki iradesini müdahaleyle eş zamanlı olarak ileri sürmesi hâlinde varılan bu sonucun, iradenin öncelenmiş, diğer bir deyişle geleceğe dönük bir şekilde ortaya konulması hâlinde de kabul edilmesi gerektiği ileri sürülmektedir.17 Dolayısıyla kişilerin, daha sonra yaşayabilecekleri fiziksel ya da akli rahatsızlıklar için,  henüz  ayırt  etme  güçleri  mevcutken  hayatlarını  şekillendirecek  kararlar vermelerinin özerklik ilkesinin bir görünümü olduğunu söylemek mümkündür.18 Birey  özerkliğinin  bir  alt  görünümü  olan  hasta  özerkliği,  kişilerin  hastalıkları süresince kendi kaderlerini tayin edebilmesi anlamına gelmektedir. Kişilerin bu özerkliği hayata geçirmeye yarayan ileriye dönük hasta direktifleri temel olarak iki farklı şekilde düzenlenmektedir.19 Bunlardan ilki, bu çalışmada tedaviye ilişkin yönlendirici direktifler olarak anılan, genellikle yazılı şekilde düzenlenen ve kişilerin, ileride karar verme yetilerini kaybetmeleri durumunda devreye girecek talimatlar düzenlenmesidir. İkincisiyse kişilerin, bu tür kararları vermesi için güvendikleri birini sağlık durumlarıyla ilgili karar vermek üzere bir temsilci olarak atamalarıdır.21Hasta özerkliği prensibi ve bunun hukuk düzlemine yansımalarını, özellikle son yıllarda hasta hekim ilişkisinde yaşanan bakış açısındaki değişiklikten bağımsız bir şekilde değerlendirmek mümkün değildir. Zira bu ilişki zaman içinde hekim odaklı 15  Ayrıntılı bilgi için bkz Yücel (n 5) 37 ff; Saibe Oktay Özdemir, ‘Ayırt Etme Gücü Bulunmayan Yetişkinlere Yapılacak Tıbbi Müdahalelere Onay Konusunda İsviçre Hukukunda Yapılan Değişiklikler  (2016) 11(145-146) Bahçeşehir Üniversitesi Hukuk Fakültesi Dergisi (Prof. Dr. Özer Seliçi nin Anısına Armağan) 223, 229; Zafer Kahraman, ‘Medeni Hukuk Bakımından Tıbbi Müdahaleye Hastanın Rızası  (2016) 7(1) İnönü Üniversitesi Hukuk Fakültesi Dergisi 479 ff.16  Benzer yönde Oktay Özdemir (n 6) 603.17  Yücel (n 5) 124.18  Bkz ibid 121; Manuel Trachsel, Christine Mitchell ve Nikola Biller-Andorno, ‘Advance Directives Between Respect for Patient Autonomy and Paternalism  iç Peter Lack, Nikola Biller-Andorno ve Susan Brauer (edr) Advance Directives (1. bası, Springer 2014) 172 ff; Robert S. Olick, ‘On the Scope and limits of advanced directives and prospective autonomy  iç Peter Lack, Nikola Biller-Andorno ve Susan Brauer (edr) Advance Directives (1. bası, Springer 2014) 55-56; Alfred Simon, ‘Historical Review of Advance Directives  iç Peter Lack, Nikola Biller-Andorno ve Susan Brauer (edr) Advance Directives (1. bası, Springer 2014) 3. İleriye dönük hasta direktifi kavramının arkasındaki diğer felsefi temellere ilişkin bir değerlendirme için bkz Miguel A. Sanchez-Gonzalez, ‘Advance Directives Outside the USA: Are They the Best Solution Everywhere?  (1997) 18 Theoretical Medicine 283, 286 ff.19  Andorno (n 8) 73; Trachsel, Mitchell ve Biller-Andorno (n 18) 169.  Krş Olick (n 18) 54. Olick, bu iki kategorinin yanı sıra uzun süreli bir temsilcinin atandığı ve temsilciye verilen talimatları içeren bir ‘yaşayan vasiyet in hazırlandığı bir karma kategorinin daha bulunduğunu kabul etmektedir. 20  Bununla birlikte ileriye dönük hasta direktifinin bazen yaşayan vasiyet ile aynı anlama gelecek şekilde kullanıldığı da görülmelidir. Bu yönde örneğin Recommendation CM/Rec(2009)11. Avrupa Konseyi Bakanlar Komitesi tarafından kabul edilen bu tavsiye kararı için bkz  <https://rm.coe.int/168070965f> Erişim tarihi 15 Mart 2021. Bu çalışmada ileriye dönük hasta direktifleri hem yaşayan vasiyeti hem de uzun süreli temsilciyi kapsayacak şekilde kullanıldığının bir kere daha altı çizilmelidir. 21  Andorno (n 8) 73. Healthcare proxy kavramının Türkçe ye  sağlık hizmeti vekili  olarak da tercüme edildiği görülmektedir. Örneğin bkz Tacir (n 9) 144.415İstanbul Hukuk Mecmuası 79/2ve paternalist bir ilişki olmaktan git gide uzaklaşmış, hastanın iradesinin ve söz hakkının önem kazandığı karşılıklı bir tedavi ilişkisine dönüşmüştür.22 Bu doğrultuda kişilerin, ileride karar verme yetilerini kaybetme riskini dikkate alarak, rıza verme özgürlüğüne  sahip  oldukları  konularda  ileriye  dönük  bir  karar  mekanizmasına sahip olmaları gerektiği kabul edilmeye başlanmıştır. Bununla birlikte günümüzde ileriye dönük hasta direktiflerine yönelik genelgeçer bir yaklaşıma sahip olunduğu yanılgısına kapılmamak gerekmektedir. Zira bu direktiflere ilişkin hem etik hem de hukuki kaygıların hâlâ devam ettiği ve bu kaygılara ilişkin yaklaşımlar ile söz konusu düzenlemelere bağlanan sonuçların bir hukuk sisteminden diğerine değiştiği görülmektedir. III. Amerika Birleşik Devletleri nde İleriye Dönük Hasta Direktifleriİleriye dönük hasta direktifi kavramının ilk olarak Amerika Birleşik Devletleri nde (‘ABD ) henüz 1960 lı yılların sonunda ortaya çıktığını söylemek mümkündür.23 ABD de öncelikle ileriye dönük hasta direktifinin bir türü olan tedaviye ilişkin yönlendirici direktif kavramı tartışılmaya başlanmış, uzun süreli temsilci yapısı ise ancak sonraki yıllarda kabul edilmiştir.24 Bu doğrultuda yönlendirici direktiflere ilişkin ilk pozitif dayanağa 1976 yılında Kaliforniya eyaletinde kabul edilen Ölüm Yasası (Natural Death Act) ile kavuşulmuştur.25 Bu  gelişmelere  paralel  olarak,  ABD de  çeşitli  mahkemelerin  verdiği  yargı kararlarının da ileriye dönük hasta direktiflerine ilişkin hukuki düzenin oturmasında büyük rol oynadığı ifade edilmelidir.26 Bu davalardan ilki, kişilerin tedaviyi reddetme hakkının  bulunduğuna,  ayırt  etme  gücünden  yoksun  kişiler  içinse  bu  rızanın temsilcileri tarafından verilebileceğine hükmedilen 1976 tarihli Karen Ann Quinlan 22  Tuğrul Katoğlu, ‘Türk Hukukunun Bir Parçası Olarak Avrupa Konseyi İnsan Hakları ve Biyotıp Sözleşmesi  (2006) 55(1) AÜHFD 157, 164; Taupitz ve Salkić (n 9), 331; Simon (n 18) 4 ff; Barbara A. Brown, ‘The History of Advance Directives - A Literature Review  (2003) 29(9) Journal of Gerontological Nursing 4, 4; Marjoire Maguire Shultz, ‘From Informed Consent to Patient Choice: A New Protected Interest  (1985) 95(2) Yale Law Journal 219, 220 ff. Bu değişikliğin bir kanıtının, git gide ardan malpraktis davaları olduğu yönünde bkz Margaret Brazier, ‘Patient Autonomy and Consent to Treatment: Role of Law  (1987) 7 Legal Studies 169, 169.23  Simon (n 18) 3-4. Bu gelişmede Amerikalı hukukçu Luis Kutner in büyük katkısı olduğu düşünülmektedir. Bkz  Andorno (n 8) 75; Simon (n 18) 4; Yücel (n 5) 19. Yönlendirici direktife karşılık gelecek şekilde kullanılan living will ifadesine ilk defa 1969 yılında Luis Kutner in yazmış olduğu bir makalede yer verildiği düşünülmektedir. İlgili makale için bkz Luis Kutner, ‘Due Process of Euthanasia: The Living Will, A Proposal  (1969) 44 Indiana Law Journal 539, özellikle 550 ff. Ayrıca bkz Andorno (n 8) 75; Simon (n 18) 4; Ayşenur Battal, Hasta Tasarrufları ve Organ Vasiyeti (2012) Ankara Üniversitesi Sosyal Bilimler Enstitüsü Özel Hukuk Anabilim Dalı, yayınlanmamış yüksek lisans tezi, 74.  Yazar söz konusu çalışmasında, kişilerin ayırt etme gücüne sahip oldukları bir dönemde verdikleri ve ileride ortaya çıkabilecek belirli hâllerde tedavinin reddedilmesi/sonlandırılmasına ilişkin rızanın, noter ve iki şahit huzurunda verilmesi durumunda geçerli kabul edilmesi gerektiğini savunmuştur. Bunu takiben Amerika Ötanazi Derneği tarafından bir örnek rıza metni yayınlanmıştır. Bkz Simon (n 18) 4; Sanchez-Gonzalez (n 18) 284; Jennifer M. Scherer ve Rita James Simon, Euthanasia and the Right to Die: A Comparative View (1. bası, Rowman & Littlefield Publishing 1999) 28. 24  Simon (n 18) 5. Amerikan hukukundaki gelişmelere ilişkin ayrıntılı bilgi için Söğüt ve Tuna (n 9) 261 ff.25  Simon (n 18) 4; Sanchez-Gonzalez (n 18) 284-285; Scherer ve Simon (n 23) 28; Brown (n 22) 4; Yücel (n 5) 21.26  Olick (n 18) 54.416Kurtulan-Güner / Karşılaştırmalı Bir Bakış Açısıyla İleriye Dönük Hasta Direktifleri ve Türk Hukuku İçin Önerilerdavasıdır.27 Bir diğeriyse 1990 yılında ABD Yüksek Mahkemesi tarafından karara bağlanan Cruzan v. Director, Missouri Department of Health davasıdır.28 Bu davada ABD Yüksek Mahkemesi, kişilerin tedaviyi reddetme haklarına sahip olduğuna ancak federe devletlerin bu iradenin ortaya konulması bakımından açık ve ikna edici kanıtlar talep etmesinin önünde de anayasal bir engel olmadığına karar vermiştir.29 Bu noktada Yüksek Mahkeme nin Cruzan kararının ve daha önce benzer yönde verilen diğer kararların temelinde tedaviyi reddederek ölme hakkına ilişkin tartışmanın yer aldığına dikkat çekilmelidir. Bu nedenle ileriye dönük hasta talimatı kavramının da ilk olarak bu çerçevede doğduğunu, tedaviye ilişkin yönlendirici direktiflerinin temel olarak bir pasif ötanazi talebi olarak karşımıza çıktığını söylemek yanlış olmayacaktır.30 İlerleyen yıllarda ise kişinin tedavisiyle ilgili kararlar vermek üzere uzun süreli bir temsilci atayabilmesi de mümkün kılınmıştır. Bu yönde ilk düzenleme 1983 yılında Pensilvanya eyaletinde kabul edilmiştir.31ABD de Cruzan kararıyla aynı yıl Hastaların Kendi Kaderini Tayin Hakkına İlişkin Yasa (Patient Self-Determination Act) kabul edilerek ileriye dönük hasta direktiflerinin kullanımının yaygınlaşması için önemli bir adım daha atılmıştır. Bu doğrultuda ilgili Yasa nın kapsamına giren tüm sağlık hizmeti sunan kişilerin, hastaları ileriye dönük hasta direktifi hazırlama hakları konusunda bilgilendirmelerinin zorunlu olduğu        27  In re Quinlan 70 N.J. 10, 355 A.2d 647 (NJ 1976). Karara konu olan uyuşmazlıkta Quinlan bir kaza sonucunda bitkisel hayata girmiş, ailesi ise kızlarının yaşam destek ünitesinden çıkarılmasını, yani tedavinin sonlandırılmasını talep etmiştir. Ailenin bu yöndeki talebi ilk derece mahkemesi tarafından reddedilmiş, ancak temyiz mahkemesi tarafından kabul edilmiştir. Karara ilişkin olarak bkz Brown (n 22) 4 ff; Olick (n 18) 54-55. Karara ilişkin Türkçe bir değerlendirme için bkz Erika Bıton Serdaroğlu, ‘Ötanazi - Ölme Hakkı  (2016) 22(3) MÜHFHAD (Cevdet Yavuz a Armağan) 463, 475476. Bu karar, diğer federe devletlerin mahkemeleri açısından bağlayıcı olmasa da, sonraki yıllarda hemen hemen tüm devletlerde aynı yönde verilen mahkeme kararları açısından bir örnek teşkil etmiş, bu nedenle ileriye dönük hasta direktifi kavramının gelişmesinde bir dönüm noktası olmuştur. Bkz Olick (n 18) 55; Simon (n 18) 4. Ayrıca bu kararın 1976 yılında Kaliforniya da kabul edilen Doğal Ölüm Yasası na temel hazırladığı yönünde bkz Simon (n 18) 4.28  Cruzan v. Director, Missouri Department of Health, 497 U.S. 261 (1990). Bu davaya konu olan uyuşmazlık da Quinlan davasına benzer şekilde, bitkisel hayata giren Cruzan ın ailesinin, bundan birkaç yıl sonra kızlarının ölümüne yol açacak olmasına rağmen beslenme tüpünün çıkarılmasını talep etmeleri ve bu talebin hastane tarafından reddedilmesi üzerine çıkmıştır. Bu uyuşmazlığa ilişkin önemli bir ayrıntı, bir araba kazası sonucunda bitkisel hayata giren Nancy Cruzan ın, daha önce bir arkadaşına böyle bir durumda yaşamayı istemeyeceğine dair bir beyanda bulunmuş olmasıdır. Karara ilişkin Türkçe bir değerlendirme için bkz Yücel (n 5). 21 ff.29  Brown (n 22) 4-5; Bruce J. Winick, ‘Advance Directive Instruments for Those With Mental Illness  (1996) 51(1) University of Miami Law Review 57, 59.30  Marie-Jo Thiel, ‘Personal Capacity to Anticipate Future Illness and Treatment Preferences  iç Peter Lack, Nikola BillerAndorno ve Susan Brauer (edr) Advance Directives (1. bası, Springer 2014) 18.31  Simon (n 18) 5; Brown (n 22) 4.417İstanbul Hukuk Mecmuası 79/2hükme bağlanmıştır.32 Bu sayede kişilerin ileriye dönük hasta direktifi düzenlemeleri konusunda bilgilendirilmesi ve teşvik edilmesi amaçlanmıştır.33 Ancak buraya kadar yapılan açıklamalardan da anlaşılabileceği üzere, ABD de ileriye  dönük  hasta  direktifleri  bağlamında  yapılan  tartışmaların  ve  hukuki düzenlemelerin daha ziyade koma veya bitkisel hayat gibi durumlarda tedavinin sonlandırılması, diğer bir deyişle ölme hakkı çerçevesinde şekillendiğini söylemek yanlış olmayacaktır. Buna karşılık kişilerin, söz gelimi Alzheimer s gibi ilerleyici bir hastalıkları söz konusu olduğunda, ileride karşılaşabilecekleri muhtelif zorlukları öngörerek bir düzenleme yapabilmeleri, yani yaşam sonuna ilişkin değil bu sürece dair karar verme hakkına sahip olup olmamaları gerektiği çok daha yeni bir tartışmadır. Bu doğrultuda ABD de çeşitli sivil toplum örgütleri tarafından hazırlanan ve kamuoyuna sunulan birtakım ileriye dönük hasta direktifi formlarının bulunduğu gözlemlenmektedir.34 Öğretide bunlar ileriye dönük akıl sağlığı direktifi (mental health advance directive) olarak da anılmaktadır.35 Bunların standart direktiflerden temel  farkı,  sadece  yaşam  sonu  kararlarını  değil,  yaşamın  devamı  süresince, günlük  işleyişe  ilişkin  tercihleri  de  kapsamasıdır.  Örneğin  hastalığın  ilerlemesi durumunda, kişinin bakımın nerede ve kim tarafından yapılmasını arzu ettiğine veya masrafların nasıl karşılanmasını istediğine ilişkin kararına bu direktiflerde yer vermesi mümkündür. Bu bağlamda ilk yasal düzenlemeyi yapan eyalet 2003 yılında Washington olmuştur.36 Ancak psikiyatrik hastalıklar söz konusu olduğunda, ileriye dönük hasta direktiflerine kuşkuyla bakıldığını söylemek mümkündür.37 Nitekim bu yüzden söz konusu düzenlemelerde tedaviyi yapacak kişilere hastanın talimatlarını uygun olmadıkları gerekçesiyle uygulamama konusunda geniş bir takdir yetkisi 32  Ayrıntılı bilgi için bkz Brown (n 22) 5; Edward J. Larson ve Thomas A. Eaton, ‘The Limits of Advance Directives: A History and Assessment of the Patient Self-Determination Act  (1997) 32(2) Wake Forest Law Review 249, 250 ff.33  Bkz Söğüt ve Tuna (n 9) 262-263; Gail Gunter-Hunt, Jane E. Mahoney ve Carol E. Sieger, ‘A Comparison of State Advance Directive Documents  (2002) 42(1) The Gerantologist 51, 51 ff; Simon (n 18) 5. Söz konusu Yasa nın kabul edilmesinin arka planına ve etkilerine ilişkin bir değerlendirme için bkz Larson ve Eaton (n 32) 249-294. Bugün ABD nin tüm eyaletlerinde kişilerin bu talimatlardan yararlanması için gerekli hukuki alt yapının bulunduğunu söylemek mümkündür. Bkz Gunter-Hunt, Mahoney ve Sieger (n 34) 51-52; Simon (n 18) 4; Andorno (n 8) 76. Daha da önemlisi, bu hukuki alt yapının etkinliğine ve yerindeliğine ilişkin hukuki tartışmaların hala devam ediyor olmasına rağmen uygulamada kişilerin bu yapıya gittikçe artan bir şekilde başvuruyor olduğu ifade edilmektedir. Bu konuda 2010 yılında yapılmış ayrıntılı bir ampirik çalışma için bkz Maria J. Silveria, Scott Y. H. Kim ve Kenneth M. Langa, ‘Advance Directives and Outcomes of Surrogate Decision Making Before Death  (2010) 362 The New England Journal of Medicine 1211. Krş Simon (n 18) 6. 2017 yılı itibariyle her üç ABD li yetişkinden birinin ileriye dönük hasta direktifi hazırladığı yönünde bir araştırma için bkz Kuldeep Yadav ve diğerleri, ‘Approximately One in Three US Adults Completes Any Type of Advance Directive for End-of-Life Care  (2017) 36(1) Health Affairs 1244.34  Örneğin End of Life Washington Derneği tarafından hazırlanan direktif için bkz <https://www.deathwithdignity.org/wp-content/uploads/2019/08/End-of-Life-WA-Dementia-Advanced-Directive-2019.pdf>  Erişim  tarihi  15  Mart  2021. End of Life New York Derneği tarafından hazırlanan bir başka örnek için bkz. <https://endoflifechoicesny.org/wpcontent/uploads/2018/03/3_24_18-Dementia-adv-dir-w-logo-no-donation-language.pdf>  Erişim  tarihi  15  Mart  2021. 2017 yılında Dr. Barak Gaster tarafından hazırlanmış bir diğer seçenek için bkz <https://static.squarespace.com/static/5a8cffddcaad/t/5cdefdcbcbaf6/1557786582104/dementia-directive.pdf>  Erişim  tarihi 15 Mart 202.35  Lisa Brodoff, ‘Planning for Alzheimer s Disease with Mental Health Advance Directives  (2009) 17(2) Elder Law Journal 239, 239 ff.36  Revised Code of Washington, Bölüm 71.32. İlgili yasa metni için bkz <https://apps.leg.wa.gov/rcw/default.aspx?cite=71.32> Erişim tarihi 27 Nisan 2020.37  Brodoff (n 35) 251.418Kurtulan-Güner / Karşılaştırmalı Bir Bakış Açısıyla İleriye Dönük Hasta Direktifleri ve Türk Hukuku İçin Önerilertanındığı,38 bu nedenle bu direktiflerin bağlayıcılığı konusunda soru işaretlerinin bulunduğu belirtilmelidir.39IV. Genel Olarak Kara Avrupası Sistemlerinde İleriye Dönük Hasta Direktifleriİleriye dönük hasta direktifi kavramının Kara Avrupası sistemlerinde tartışılmaya ve hukuki bir temele oturtulmaya başlanmasının ABD ye kıyasla daha güncel bir gelişme olduğu ifade edilmelidir.40 Kara Avrupası sistemlerinde bu yönde hukuki gelişmelerin özellikle geçtiğimiz yirmi yılda hızlandığı gözlemlenmektedir.41 Bu gelişmelerden ilki 1997 yılında Avrupa Konseyi tarafından kabul edilen İnsan Hakları ve Biyotıp Sözleşmesi dir. Çalışmanın başında da belirtildiği üzere söz konusu Sözleşme nin 9. maddesiyle ileriye dönük hasta direktifi kavramı Kara Avrupası hukuk sistemlerine mütevazı bir giriş yapmıştır.42 Öte yandan Kara Avrupası sistemlerinde ileriye dönük hasta direktifi kavramının ve buna bağlanan hukuki sonuçların yeknesak bir şekilde geliştiğini söylemek mümkün değildir.43 Tam aksine, bu ülkelerin ileriye dönük hasta direktiflerine bakış açısı ve sunduğu bağlayıcılığın önemli derecede ayrıştığı gözlemlenmektedir.44 Bazı ülkeler İnsan Hakları ve Biyotıp Sözleşmesi ne taraf olmamakla birlikte, ileriye dönük hasta direktifleri için hukuki bir düzenlemeye sahiptir. Örneğin Avusturya 2006 da kabul edilen bir yasayla bağlayıcı niteliğe sahip ileriye dönük hasta direktifleri mümkün kılmıştır.45 Almanya da bu Sözleşme ye taraf olmamakla birlikte 2009 yılında Medeni Kanunu nda bu yönde önemli değişiklikler yapmıştır.46 Öte yandan Türkiye gibi bazı ülkeler Sözleşme ye taraf olmakla birlikte ileriye dönük hasta direktiflerinin bir hukuki temele oturtulması konusunda kayda değer bir adım atmamıştır.47 Bu yönde düzenleme yapan sistemler arasında da tercih farklılıkları olduğu belirtilmelidir.48 38  Örneğin bkz Revised Code of Washington, Bölüm 71.32.150.39  Brodoff (n 35) 251.40  Andorno (n 8) 75-76; Simon (n 18) 6.41  Ayrıntılı bilgi için Oktay Özdemir (n 6) 605 ff.42  Simon (n 18) 6. Bu Sözleşme nin Avrupa ülkeleri açısından asgari bir uzlaşı olduğu yönünde bkz Goffin (n 10) 122.43  Anne Röthel, ‘Patientenverfügung und Vorsorgevollmacht in europäischer Perspektive  (2007) FPR Heft 3 79, 79. 44  Simon (n 18) 6-7. Bu konuda ayrıntılı bir değerlendirme için bkz Denard Veshi ve Gerald Neitzke, ‘Advance Directives in Some Western European Countries: A Legal and Ethical Comparison Between Spain, France, England and Germany  (2015) 22 European Journal of Health Law 321. Ayrıca bkz Council of Europe Steering Committee on Bioethics Report to the Council of Europe based on the 18-22 June 2008  Exploratory Workshop on Advance Directives  organized by the Institute of Biomedical Ethics of the University of Zurich with the support of the European Science Foundation (ESF), Report prepared by Prof. Roberto Andorno, 6. İlgili raporun tam metni için bkz <https://rm.coe.int/CoERMPublicCommonSearchServices/DisplayDCTMContent?documentId=090000168039ee > Erişim tarihi 15 Mart 202145  Bundesgesetz über Patientenverfügungen (Patientenverfügungs-Gesetz – PatVG) StF: BGBI. I Nr. 55/2006.46  Bkz. Bürgerliches Gesetzbuch (‘BGB ), § 1901a vd.47  Bkz. Yücel (n 5) 281. Bu bağlamda Türk hukukundaki en önemli düzenlemenin Hasta Hakları Yönetmeliği nin 2014 yılında değiştirilen ve  Hastanın Rızası ve İzin  başlıklı 24. maddesi olduğunu söylemek mümkündür. Buna ilişkin olarak bkz aşağıda Bölüm V.48  Simon (n 18) 7.419İstanbul Hukuk Mecmuası 79/2 Aşağıda öncelikle Türkiye nin taraf olduğu İnsan Hakları ve Biyotıp Sözleşmesi nin 9. maddesi ve buna ilişkin Avrupa Konseyi Tavsiye Kararına değinilecektir. Bunun sebebi, Anayasa nın 90. maddesi uyarınca Türkiye iç hukukunun bir parçası olan bu düzenlemenin sunduğu hukuki çerçevenin daha iyi anlaşılmasıdır. Ardından seçilmiş Kara Avrupası sistemlerinde yönlendirici direktifler ve süregelen temsil yetkisi kurumları açısından ne tür yasal düzenlemelerle karşılaşıldığı kısaca incelenecektir. Bu karşılaştırmalı çalışmanın temel sebebi, ileriye dönük hasta direktiflerinin hukuki alt yapısına ilişkin, ileride Türk hukukunda olası bir yasal düzenleme açısından yol gösterici olabilecek tercih farklılıklarını ortaya koymaktır. A. İnsan Hakları ve Biyotıp Sözleşmesi ve Avrupa Konseyinin 2009(11) Tavsiye Kararıİnsan Hakları ve Biyotıp Sözleşmesi nin konumuz açısından önem taşıyan 9. maddesini kısaca incelemeye geçmeden önce, Sözleşme nin ileriye dönük hasta direktiflerinin en azından dikkate alınmasını zorunlu kılan Avrupa düzeyindeki ilk bağlayıcı hukuki enstrüman olduğu belirtilmelidir.49 Avrupa Konseyi nin 2009 tarihli Ehliyetsizlik Durumları İçin Süregelen Temsil Yetkisi ve İleriye Dönük Hasta Direktiflerine  ilişkin  tavsiye  kararı  (CM/Rec(2009)11)  ise  Sözleşme nin  aksine bağlayıcı niteliğe sahip olmayan, bir soft law aracıdır.50 Bununla birlikte söz konusu tavsiye kararın, ileriye dönük hasta direktifi kavramının Avrupa Konseyi ülkelerinde şekillenmesinde büyük rol oynadığını söylemek yanlış olmayacaktır.51 Aşağıda daha ayrıntılı bir şekilde değinileceği üzere, ileriye dönük hasta direktifi kavramının ilk olarak ortaya çıktığı ABD nin aksine, Kara Avrupası sistemlerinde tedaviye ilişkin yönlendirici direktiflerinden ziyade, süregelen temsil yetkisi verilmesi yolunun tercih edildiğini söylemek mümkündür. Bu bağlamda aynı yaklaşımı benimseyen tavsiye kararın, Avrupa Konseyi üyeleri açısından bir uzlaşıyı simgelediği veya ileride yapılacak düzenlemeler için bir kılavuz teşkil ettiği söylenebilir.52Sözleşme nin   önceden  açıklanmış  istek   başlıklı  9.  maddesi  şu  şekildedir:  Müdahale sırasında isteğini açıklayabilecek bir durumda bulunmayan bir hastanın, tıbbî  müdahale  ile  ilgili  olarak  önceden  açıklamış  olduğu  istekler  göz  önüne alınacaktır.  Söz konusu çerçeve hükmün sorunlu addedilebilecek ilk özelliği, önceden açıklanmış isteklerin nasıl, hangi şekilde, hangi şartlar altında açıklanabileceğini düzenlememesi  ve  bunların   göz  önüne  alınacağını   ifade  ederek  söz  konusu isteklerin bağlayıcı niteliğini emredici kılmaktan imtina etmesidir.53 Bununla birlikte, söz konusu hükmün en azından Sözleşme ye taraf ülkelerde bu isteklerin tavsiye 49  Andorno (n 8) 76.50  Principles concerning continuing powers of attorney and advance directives for incapacity, Recommendation CM/Rec(2009) 11. Tam metin için bkz <https://rm.coe.int/168070965f> Erişim tarihi 15 Mart 202151  Andorno (n 8) 85.52  Bkz Andorno (n 8) 85.53  Krş Goffin (n 10) 137 ff.420Kurtulan-Güner / Karşılaştırmalı Bir Bakış Açısıyla İleriye Dönük Hasta Direktifleri ve Türk Hukuku İçin Önerilerniteliğinin kabul edilmesi bakımından önemli bir adım olduğu itiraf edilmelidir.54 9. maddenin eksik kaldığı bir diğer yön ise ileriye dönük hasta direktiflerinden sadece önceden açıklanmış isteklerden, yani yönlendirici direktiflerden bahsetmesi, buna karşılık süregelen temsil yetkisi yapısını göz ardı etmesidir.55 Avrupa Konseyi nin 2009 yılında sunduğu tavsiye kararında bu olumsuzlukların törpülenmesine  ve  söz  konusu  hükmün  somutlaştırılmasına  ilişkin  birtakım adımlar  atıldığı  görülmektedir.  Söz  konusu  tavsiye  kararın  başlığından  da anlaşılabildiği üzere, öncelikle  önceden açıklanmış istekler  kavramı, tedaviye ilişkin yönlendirici direktifler, yani dar anlamda ileriye dönük hasta direktifleri ve süregelen temsil yetkisi olarak ikiye ayrılmıştır.57 Böylece Sözleşme nin 9. maddesinde göz ardı edilen süregelen temsil yetkisine dikkat çekilmiştir. İlgili Karar da, yönlendirici direktifler ve süregelen temsil yetkileri açısından toplam 17 ilke ortaya koyulmuştur. Bu doğrultuda Devletlerin kişilerin kendi kaderlerini tayin edebilmesi ve özerklik ilkelerine öncelik vermeleri gerektiği vurgulandıktan sonra (1. İlke), süregelen temsil yetkisi ve dar anlamda ileriye dönük hasta direktifi kavramları tanımlanmıştır (2. İlke). Bu noktada dikkat çekilmesi gereken önemli bir husus, İnsan Hakları ve Biyotıp Sözleşmesi nin 9. maddesinde, yönlendirici direktiflerin bağlayıcılığı konusunda benimsenen çekimser tutumun tavsiye kararda da devam etmiş olmasıdır.58 15. İlke uyarınca Devletlerin bu istekleri bağlayıcı kılıp kılmamak konusunda serbest oldukları açıkça hükme bağlanmıştır. Bununla birlikte, yönlendirici direktiflere, bunların bağlayıcı olmadığı durumlarda dahi olabildiğince saygı duyulması gerektiği (Sözleşme den biraz farklı bir dille) ifade edilmiştir.59Tavsiye kararın 3 ila 13. İlkeleri süregelen temsil yetkisine ilişkin olup, yönlendirici direktiflere ilişkin sadece dört İlkeye yer verilmiştir. Bunun temel sebebinin Kara Avrupası sistemlerinde temsil ve vekalet kurumlarının çok uzun zamandan beri kullanılan  hukuki  araçlar  olmasına  karşılık,  yönlendirici  direktif  yapısının  bu sistemlere yabancı olması olduğu düşünülmektedir.60 Bir diğer önemli sebep ise, kişilerin  fiil  ehliyetine  sahip  oldukları  dönemde  kaleme  aldıkları  yönlendirici direktiflerin içerebileceği muğlak ifadelerin veya bu iradenin tabiri caizse yaşlanması 54  Andorno (n 8) 76.55  Andorno (n 8) 77.56  Tavsiye kararda ileriye dönük hasta direktifi (advance directive) kavramı, sadece yönlendirici direktiflere (ya da living will) karşılık gelecek şekilde kullanılmıştır. Bkz Andorno (n 8) 79; Yücel (n 5) 127.57  Yücel (n 5) 283. Sözleşme nin 9. maddesinde ve bu maddenin şerhinde süregelen temsil yetkisi mekanizmasının tamamen göz ardı edildiği, bu boşluğun 2009 tarihli tavsiye kararla doldurulduğu belirtilmelidir. Bkz Andorno (n 8) 77.58  Andorno (n 8) 77.59  Sözleşme nin 9. maddesinde önceden açıklanmış isteklerin göz önüne alınacağı (shall be taken into account) hükme bağlanmıştır. Buna karşılık tavsiye kararın 15. İlkesinde ise bu ifadelere saygı duyulması gerektiği (should be given due respect) belirtilmiştir. İkinci ifadenin ilkine kıyasla daha güçlü bir anlama sahip olduğu yönünde bkz Andorno (n 8) 84-85.60  Andorno (n 8) 80.421İstanbul Hukuk Mecmuası 79/2ve çağın gerisinde kalması riskinin, bu konularda karar vermesi için atanan süregelen temsil yetkisi kurumunda mevcut olmamasıdır.61 Bu çalışmanın konusu bakımından tavsiye kararın süregelen temsil yetkisinin ve yönlendirici direktiflerin içeriğine ilişkin 3. ve 14. İlkeleri ayrı bir önem arz etmektedir. Bu doğrultuda bu düzenlemelerin sadece tıbbi müdahaleler, söz gelimi tedavinin reddi veya sona erdirilmesi gibi kararlarla sınırlı olarak değil, bunun dışında kalan ekonomik, finansal, sosyal veya şahsi konulara da ilişkin olabileceği ifade edilmiştir.62 Nitekim İlkelerde süregelen temsil yetkisine ve tedaviye ilişkin yönlendirici direktiflere verilen ilgi bakımından göze çarpan bir orantısızlık bulunmasının bir nedeninin de, süregelen temsil kurumunun sağlık bakımı kararları dışında kişinin yaşamının diğer alanlarına da sirayet eden, söz gelimi finansal veya kişinin yaşam biçimine ilişkin diğer kararlar açısından da etkin bir yöntem olmasına karşılık, yönlendirici direktiflerin genellikle sadece sağlık sorunları için belirleyici bir hukuki araç olarak görülmesi, diğer bir deyişle daha dar kapsamlı olması olduğunu söylemek mümkündür.63B. Yönlendirici Direktiflere İlişkin Düzenlemelere Genel BakışKara  Avrupası  sistemlerinde  ileriye  dönük  hasta  direktiflerine  ilişkin düzenlemeler değerlendirirken yukarıda açıklanan gelişmelere paralel olarak ikili bir ayrım yapılması mümkündür. Bu ayrımın ilk ayağını yönlendirici direktifler oluşturmaktadır.  Kara  Avrupası  sistemlerinde  yönlendirici  direktiflere  ilişkin yasama faaliyetlerinin, nüfusun yaşlanması olgusuna paralel olarak, özellikle son yirmi yılda ivme kazandığını söylemek mümkündür. Bu doğrultuda söz gelimi Fransız hukukunda 2005,64 Avusturya hukukunda 2006,65 İsviçre hukukunda 2008,66  61  Andorno (n 8) 80.62  Andorno (n 8) 79. 3. 63  Andorno (n 8) 80.64  Loi n° 2005-370 du 22 avril 2005 relative aux droits des malades et à la fin de vie. 2005 yılında yapılan bu düzenlemenin 2016 yılında yeniden gözden geçirildiği ve yönlendirici direktiflerin kapsamının genişletilerek bağlayıcılık gücünün arttırıldığını söylemek mümkündür. Öyle ki 2005 yılında yapılan düzenlemeyle yönlendirici direktiflerin dikkate alınacağı (consulter) hükme bağlanmışken, 2016 yılında yapılan değişiklikle bunların hekim açısından kural olarak bağlayıcı olduğunun (s imposer) açıkça düzenlendiği görülmektedir. Bkz Augustin Boulanger, ‘Les directives anticipées et le désir de maîtrise de sa fin de vie  (2017) 146-147 Médecine & Droit 136, 137.65  Bundesgesetz über Patientenverfügungen (PatVG), BGBI. I Nr. 55/2006.66  Loi fédérale du 19 déc. 2008 (Protection de l adulte, droit des personnes et droit de la filiation), RO 2011 725. İsviçre hukukunda yapılan değişikliklere ilişkin ayrıntılı bilgi için bkz Oktay Özdemir (n 15) 232 ff.422Kurtulan-Güner / Karşılaştırmalı Bir Bakış Açısıyla İleriye Dönük Hasta Direktifleri ve Türk Hukuku İçin ÖnerilerAlman hukukunda 2009,67 ve İtalyan hukukunda 201768 yılında önemli adımlar atıldığı görülmektedir.Kara Avrupası  sistemlerinde  yönlendirici  direktiflerin  düzenlenmesine  ilişkin farklı yolların izlendiğini ve içeriğine ilişkin değişik tercihlerin yapıldığını söylemek mümkündür. Kuşkusuz bu tercihlerin tüm boyutlarıyla incelendiği bir karşılaştırmalı hukuk  araştırması  bu  çalışmanın  sınırlarını  aşmaktadır.69 Ancak  ilk  bakışta  şu çıkarımların yapılması mümkündür:• Yönlendirici direktiflere ilişkin kuralların bazı sistemlerde özel düzenlemeler ile, bazılarında ise mevcut kanunlara yapılan eklemelerle getirildiği görülmektedir. Bu açıdan özellikle Alman ve İsviçre hukuk sistemlerinde olduğu gibi yönlendirici direktiflere ilişkin hükümlerin Medeni Kanun a alınması tercihinin, kişilerin ileriye dönük hasta direktifi düzenleme hakkının kişi varlığından kaynaklanan bir özel hukuk meselesi olduğu yönündeki politik kanıya işaret ettiğine değinmekte yarar vardır.70• Kara Avrupası sistemlerinde yönlendirici direktiflerin geçerliliği için aranan şekil şartlarına ilişkin de farklı tercihlere yer verildiğini söylemek mümkündür. Örneğin Alman hukukunda yönlendirici direktiflerin geçerliliği adi yazılı şekilde yapılmış olmalarına bağlı iken (BGB 1901a),71 İsviçre hukukunda nitelikli bir yazılı şekil şartı arandığı görülmektedir (İsviçre Medeni Kanunu (‘ZGB ) Art. 371).72 İtalyan ve Avusturya hukuk sistemlerinde ise bunlara ek olarak birtakım şartlar daha arandığı görülmektedir. İtalyan hukukuna göre kişinin geçerli bir yönlendirici direktif düzenleyebilmesi için öncesinde bir hekim tarafından bunun sonuçlarına ilişkin 67  Dritte Gesetz zur Änderung des Betreuungsrechts vom 29. Juli 2009. İlgili Kanun un siyasal arka planına ilişkin kısa bir değerlendirme için bkz Urban Wiesing ve diğerleri, ‘A New Law on Advance Directives in Germany  (2010) 36 Law, Ethics and Medicine 779, 779-780; Uwe H. Schneider, Münchener Kommentar zum Bürgerlichen Gesetzbuch (8. bası, C. H. Beck 2020) §1901a, Nr 1. Alman hukukunda yönlendirici direktiflere (Patientenverfügung) ilişkin ilk yasal düzenleme, 2009 yılında Alman Medeni Kanunu nun (‘BGB ) vesayete ilişkin hükümlerinde değişiklik yapılmasına ilişkin bu Kanun ile BGB ye eklenen § 1901a ve devamı maddeleriyle yapılmıştır. Bununla birlikte, ilgili yasal düzenlemeden önce de Almanya da bu kavramın tartışıldığını ve uygulamada kullanıldığını söylemek mümkündür. Bkz Thomas Diehn ve Ralf Rebhan, ‘Vorsorgevollmacht und Patientenverfügung  (2010) NJW Heft 6 326, 326. Benzer yönde ayrıca bkz Veshi ve Neitzke (n 44) 342. Nitekim Federal Mahkeme nin Almanya da düzenlenmiş bir direktife ilişkin olarak 2003 yılında vermiş olduğu tartışmalı bir kararın söz konusu yasanın hazırlanmasına zemin hazırladığı ifade edilmektedir. Bkz Schneider (n 67), §1901a Nr 1; Wiesing ve diğerleri (n 67) 779; Sascha Lanzrath, Patientenverfügung und Demenz (1. bası, Lit Verlag Berlin 2016) 10 ff.68  Legge Italiana n. 219/2017: conseguenze sul consenso informato del malato psichiatrico e sul privilegio terapeutico. Ayrıntılı bilgi için bkz Enkelejda Koka ve Denard Veshi, ‘A New Law of  Living Will  in Italy: A Critical Analysis  (2019) 40 Liverpool Law Review 113.69  Alman hukukundaki düzenlemelere ilişkin ayrıntılı bilgi için bkz Oktay Özdemir (n 6) 609 ff; Söğüt ve Tuna (n 9), 270 ff; Yener Ünver ve Suzan Kaya, Alman Tıp Hukukunda Hasta Talimatı (1. bası, Seçkin 2017) 19 ff. İsviçre hukukundaki düzenlemelere ilişkin ayrıntılı bilgi için bkz Oktay Özdemir (n 6) 607 ff; Oktay Özdemir (n 15) 232 ff; Söğüt ve Tuna (n 9) 284 ff. Fransız hukukuna ilişkin olarak bkz Oktay Özdemir (n 6) 611 ff.70  Veshi ve Neitzke (n 44) 330.71  Ünver ve Kaya (n 69) 48.72  Lukas Heckendorn Urscheler, ‘Allgemeine Einleitung  iç Andrea Büchler ve diğerleri (edr) FamKomm Erwachsenenschutz (1. bası, Stämpfli Verlag 2013) 75. Alman hukuku için bkz Volker Lipp ve Daniel Brauer, ‘Patientenvertreter, Betreuungsgericht und Patientenwille  iç Wolfram Höfling (ed) Das neue Patientenverfügungsgesetz in der Praxis - eine erste kritische Zwischenbilanz (1. bası, Nomos 2011) 39. İsviçre hukuku için bkz Dominique Manaï, ‘Les Directives Anticipées en Droit Suisse  iç Stefania Negri (ed), Self-Determination, Dignity and End-of-Life Care - Regulating Advance Directives in International and Comparative Perspective (1. bası, Brill 2012) 273. Ayrıca bkz Oktay Özdemir (n 15) 236; S. Hülya İmamoğlu, ‘Hasta Vasiyetine İlişkin Bazı Meseleler  (2016) 65(1) AÜHFD 199, 205.423İstanbul Hukuk Mecmuası 79/2aydınlatılmış olması gerekmektedir (Legge n. 219/2017, Art. 4(1)).73 Bunun yanı sıra bu direktiflerin kural olarak resmi şekilde yapılması gerektiği öngörülmüştür (Legge n. 219/2017, Art. 4(6)).74 Avusturya hukukunda ise yönlendirici direktifin düzenlenmesinden  önce  bir  hekime  danışılması  bu  direktifin  sonuçlarıyla  ilgili ayrıntılı bilginin alınması,75 yönlendirici direktifin belirli bir tedavinin reddine ilişkin olması ve direktifin bir avukat, noter veya Kanun da öngörülen diğer kişilerin huzurunda düzenlenmesi gerekmektedir (PatVG § 5).77• Sistemlerin ayrıştığı bir diğer nokta ise yönlendirici direktiflerin belirli bir süreye bağlı olup olmadığına ilişkindir.78 Alman ve İsviçre hukuklarında yönlendirici direktifler açısından bir geçerlilik süresi öngörülmüş değildir.79 Buna karşılık örneğin Avusturya hukukunda yönlendirici direktifler için en fazla 8 yıllık bir geçerlilik süresi öngörülmüştür (PatVG § 7).80 Fransız hukukunda ise yönlendirici direktiflerin ilk olarak pozitif düzenlemeye kavuşturulduğu 2005 yılında bu direktiflerin geçerliliği için 3 yıllık bir üst süre öngörülmüş olmasına rağmen 2016 yılında yapılan değişiklikle bu karardan vazgeçildiği görülmektedir.81 •  Yönlendirici  direktiflerin  geçerliliğine  ilişkin  olarak  aranan  ehliyet  şartı bakımından Alman (BGB § 1901a), Fransız (Code de la santé publique Art. L1-11) ve İtalyan (Legge n. 219/2017, Art. 4) hukuk sistemlerinde reşit olma şartı aranırken,82 Avusturya (PatVG § 3) ve İsviçre hukuklarında (ZGB Art. 370) düzenleyen kişinin ayırt etme gücüne sahip olması kıstas olarak belirlenmiştir.83 Dolayısıyla ayırt etme gücüne sahip bir küçüğün de yönlendirici direktif düzenleyebileceği kabul edilmiştir.84• Bahsi geçen hukuk sistemlerinde izin verilen yönlendirici direktiflerin kapsamına hangi kararların girebileceği konusunda da bir yeknesaklık bulunduğunu söylemek güçtür.  Örneğin  Fransız  hukukunda  bir  tedavinin  ya  da  tıbbi  bir  müdahalenin 73  Rosagemma Ciliberti ve diğerleri, ‘The Italian law on informed consent and advance directives: New rules of conduct for the autonomy of doctors and patients in end-of-life care  (2018) 48 Journal of Critical Care 178, 179.74  ibid 179.75  İsviçre hukukunda bu doğrultuda açık bir düzenleme bulunmasa da aynı şartın İsviçre hukuku bağlamında düzenlenen yönlendirici direktifler açısından da aranması gerektiği yönünde bkz Manaï (n 72) 274. Alman hukuku için benzer yönde bkz Ünver ve Kaya (n 69) 58-59.76  Maria Kletečka-Pulker, ‘Grundzüge und Zielsetzungen des Patientenverfügungs-Gesetzes  iç Ulrich Körtner, Christian Kopetzki ve Maria Kletečka-Pulker (edr) Das Österreichische Patientenverfügunsgesetz (1. bası, Springer 2007) 83.77  Ayrıntılı bilgi için bkz ibid, 85 ff. Yönlendirici direktiflerin geçerliliğine ilişkin bu katı şartlara yönelik bir eleştiri için bkz Gerhard Aigner, ‘Das Patientenverfügungs-Gesetz – Historie und Ausgangslage  iç Ulrich Körtner, Christian Kopetzki ve Maria Kletečka-Pulker (edr) Das Österreichische Patientenverfügunsgesetz (1. bası, Springer 2007) 78-79.78  Heckendorn Urscheler (n 72) 74.79  Schneider (n 67), BGB § 1901a Nr 15; Taupitz ve Salkić (n 9) 346; Manaï (n 72) 276.80  İlgili Yasa da 2019 yılında yapılan değişiklikten (BGBl. I Nr. 12/2019) önce bu sürenin 5 yıl olarak belirlendiğine işaret edilmelidir. 81  Boulanger (n 64)137; Patrick Mistretta, ‘De l art de légiférer avec tact et mesure : à propos de la loi n° 2016-87 du 2 février 2016  (2016) 8 La Semaine Juridique - Edition Générale 417, 421.82  Bu yaş sınırının öğretide eleştirildiği belirtilmelidir. Bkz Ünver ve Kaya (n 69) 46; Taupitz ve Salkić (n 9) 343.83  Kletečka-Pulker (n 76) 85; Manaï (n 72) 273-274.84  Kletečka-Pulker (n 76) 85; Manaï (n 72) 274.424Kurtulan-Güner / Karşılaştırmalı Bir Bakış Açısıyla İleriye Dönük Hasta Direktifleri ve Türk Hukuku İçin Önerilersürdürülmesine, sınırlandırılmasına, durdurulmasına ya da reddedilmesine ilişkin kararların yönlendirici direktiflerin konusunu oluşturabileceği açıkça düzenlenmişken (Code de la santé publique Art. L1-11),85 Avusturya hukukunda yönlendirici direktifin belirli bir tedavinin reddine ilişkin olması gerektiği hükme bağlanmıştır (PatVG § 5).86• Bu bağlamda kişilerin düzenledikleri yönlendirici direktiflerin kayıt altında tutulduğu bir sicilin öngörülüp öngörülmediği hususuna da değinmek gerekir.87 Alman hukukunda Federal Noterler Birliği nezdinde tutulan merkezi bir sicil bulunduğu görülmektedir.88  Avusturya  hukukunda  da  kişilerin  hazırladıkları  yönlendirici direktifleri dilerlerse yine noterler birliği nezdinde tutulan yönlendirici direktif siciline kaydettirmeleri mümkündür.89  Fransız hukukunda da benzer şekilde yönlendirici direktiflerin istenirse kişinin paylaşılan sağlık dosyasında saklanabileceği ve bunun da ulusal bir sicilde kayıt altında tutulabileceği kabul edilmiştir:90Yukarıda anılan tüm hukuk sistemlerinde geçerli bir şekilde düzenlenmiş olan yönlendirici direktiflerin prensip olarak bağlayıcı nitelikte olduğunun ve hekim tarafından gözetilmesinin gerekli olduğunun kabul edildiği görülmektedir. Bununla birlikte bu direktiflerin her şartta bağlayıcı olduğu yanılgısına da kapılmamak gerekir. Zira ilgili hukuk sistemlerinde, direktiflerin uygulanması veya uygulanmaması için öngörülen çeşitli kontrol mekanizmaların da düzenlendiği görülmektedir.91 • Örneğin Alman hukukunda geçerli bir şekilde düzenlenmiş olan yönlendirici direktiflerin  uygulanabilmeleri  için  adeta  ikinci  bir  denetime  tâbi  tutulduğu görülmektedir.92 İlgili hüküm uyarınca vasi (veya varsa bu direktifi hayata geçirmekle yetkilendirilmiş temsilci),93 bu düzenlemenin güncel yaşam ve tedavi durumuna uygun olup olmadığını denetlemek ve eğer uygun olduğuna kanaat getirirse kişinin düzenlediği  bu  talimatın  yerine  getirilmesini  sağlamakla  yükümlüdür.94  Prensip 85  İlgili hükümde 2016 yılında yapılan değişiklikten önce, yönlendirici direktiflerin sadece bir tedavinin sınırlandırılmasına ya da durdurulmasına ilişkin olabileceğinin hükme bağlandığı, 2016 yılında yürürlüğe giren değişiklik ile bu kapsamın genişletildiği ifade edilmelidir. Bkz Mistretta (n 81) 421.86  Kletečka-Pulker (n 76) 83.87  Bkz Heckendorn Urscheler (n 72) 75-76.88  Bkz <https://www.vorsorgeregister.de> Erişim tarihi 23 Ekim 2020. 89  Peter Kunz, ‘Patientenverfügung aus der Sicht der anwaltlichen Praxis  iç Ulrich Körtner, Christian Kopetzki ve Maria Kletečka-Pulker (edr) Das Österreichische Patientenverfügunsgesetz (1. bası, Springer 2007) 204.90  Jean-René Binet, ‘Présentation de la loi créant de nouveaux droits en faveur des malades et des personnes en fin de vie  (2016) 10 Revue Droit de la Famille 16, 16-17.91  Heckendorn Urscheler (n 72) 74.92  Andreas Spickhoff, Medizinrecht (3. bası, C. H. Beck 2018) BGB § 1901a, Rn. 10.93  Bkz BGB § 1901a/son. 94  Aksi takdirde kişinin önceden sözlü olarak ifade ettiği beyan ve istekleri ile dini ve etik görüşlerini dikkate alınarak varsayılan rızasının tespit edilmesi gerekmektedir. Kişinin varsayılan iradesi tespit edilirken buna ilişkin somut emarelerin araştırılması gerekmektedir. Örneğin kişinin daha önceden sözlü olarak açıkladığı ya da kişinin yakın akrabaları veya arkadaşlarıyla paylaştığı istekler bu bağlamda yol gösterici olabilir. Şüphe hâlinde ise in dubio pro vita ilkesinin devreye gireceği kabul edilmektedir. Ayrıntılı bilgi için bkz Taupitz ve Salkić (n 9) 346 ff.425İstanbul Hukuk Mecmuası 79/2bu  olmakla  birlikte,  hekimin  bu  bağlamda  hiçbir  rolünün  olmadığı  yanılgısına da  kapılmamak  gerekir.95  Zira  öncelikle  hekim,  mevcut  durumu  ve  şartları değerlendirerek nasıl bir tedavi uygulanabileceğini tespit etmeli, daha sonra hastanın bu tedaviye ilişkin bir yönlendirici direktifi bulunup bulunmadığı (aksi takdirde kişinin varsayılan iradesi) vasisi ya da temsilcisi tarafından araştırılmalıdır (BGB §1901b). Hekim ile vasinin ya da temsilcinin yönlendirici direktifin geçerliliği ve/veya muhtevası bakımından görüş ayrılığı söz konusuysa, vesayet mahkemesinin devreye gireceği ise ayrıca hükme bağlanmıştır (BGB § 1904).96 • Avusturya hukukunda da şekli ve maddi şartları sağlayan bir yönlendirici direktif bağlayıcı  niteliktedir  ve  hekim  tarafından  gözetilmesi  zorunludur.97  Dolayısıyla hastanın ilgili direktifte kendisine uygulanmasını reddettiği  tıbbi müdahalelerin yapılmaması gerekir, aksi takdirde hekimin cezai ve hukuki sorumluluğunun doğması mümkündür.98 Bununla birlikte Avusturya hukukunda da yönlendirici direktiflerin (Alman hukukundan daha farklı bir kanal üzerinden) güncellik denetimine tâbi tutulduğu söylenebilir. Öncelikle bu direktifler için ilgili Kanun da bir geçerlilik süresi (8 yıl) öngörüldüğü hatırlanacaktır. Bu sürenin geçmesinden sonra tekrar aynı şekli ve maddi şartlara uygun bir şekilde yenilenmeyen direktiflerin geçerliliğinden söz etmek mümkün değildir.99 Bunun yanı sıra ilgili Kanun un 10. paragrafında, yönlendirici  direktifin  hazırlandığı  tarihten  sonra  tıp  alanında  esaslı  gelişmeler yaşanması ihtimalinde de direktifin bağlayıcılığının sona ereceği hükme bağlanarak, yönlendirici  direktifler  açısından  kişinin  üstün  yararı  kavramına  bir  açık  kapı bırakıldığı ifade edilmelidir.100• İsviçre hukukunda da yönlendirici direktiflerin kanuna aykırılık teşkil ettikleri veya kişinin özgür iradesine veya varsayılan iradesine uymadığı konusunda haklı şüphelerin bulunması ihtimalinde yönlendirici direktiflerin bağlayıcı olmadığı açıkça düzenlenmiştir (ZGB Art. 372/2).101• Bu doğrultuda İtalyan hukukunda da benzer bir tutumla karşılaşıldığını söylemek mümkündür. Zira İtalyan hukukunda da yönlendirici direktiflerin bağlayıcılığı kabul edilmekle birlikte, bu düzenlemelerin hastanın tıbbi durumuyla uyumsuz olması veya düzenleme tarihinden sonra ilgili tıp alanında öngörülemeyen gelişmelerin yaşanması ihtimallerinde bu bağlayıcılığın ortadan kalktığının hükme bağlandığı görülmektedir.10295  Taupitz ve Salkić (n 9) 348.96  Taupitz ve Salkić (n 9) 347.97  Kletečka-Pulker (n 76) 93.98  Kletečka-Pulker (n 76) 93-94.99  Kletečka-Pulker (n 76) 89-90.100  Bkz Kletečka-Pulker (n 76) 91-92.101  İmamoğlu (n 72) 207.102  Ciliberti ve diğerleri (n 73) 179.426Kurtulan-Güner / Karşılaştırmalı Bir Bakış Açısıyla İleriye Dönük Hasta Direktifleri ve Türk Hukuku İçin Öneriler•  Fransız  hukukunda  yönlendirici  direktiflerin  düzenlendiği  Kamu  Sağlığı Kanunu nda (Code de la santé publique) 2016 yılında yapılan önemli değişikliklerin bir diğeri, geçerli bir şekilde hazırlanmış yönlendirici direktiflerin hekim açısından bağlayıcı  olduğunun  açıkça  hükme  bağlanmasıdır.103  Yine  aynı  hükümde,  bu bağlayıcılığa ilişkin iki istisna öngörülmüştür. Bunlardan ilki hekimin, yönlendirici direktifin tam bir değerlendirmesini yapmasına fırsat bırakmayacak derecede acil olan ve hayati tehlike yaratan durumların varlığıdır.104 Direktiflerin bağlayıcılığının askıya alındığı ikinci istisna ise bu düzenlemelerin mevcut tıbbi duruma açık bir şekilde uygun olmamasıdır.105C. Süregelen Temsil Yetkisine İlişkin Düzenlemelere Genel BakışSüregelen  temsil  yetkisi  ifadesinden  kasıt,  kişinin  ayırt  etme  gücünü kaybetmesinden sonra da geçerliliği devam eden, diğer bir deyişle ayırt etme gücünün kaybına rağmen süregelen temsil yetkisidir.106 Kara Avrupası sistemlerinde geniş anlamda ileriye dönük direktiflerin bir diğer görünümü olan süregelen temsil yetkisi veya ileriye dönük temsil yetkisinin nasıl düzenlendiğini irdelemeye geçmeden önce bu yetkinin kapsamına ilişkin bir ayrım yapılması yol gösterici olacaktır. Bu ayrımın ilk ayağını kişilerin, belirli bir tedaviye ilişkin olumlu veya olumsuz karar verme yetkisini, ileride ayırt etme güçlerini kaybetmeleri ihtimalinde devreye girecek şekilde, belirledikleri bir temsilciye verdikleri kurgu oluşturmaktadır. Aslında kişiye sıkı sıkıya bağlı nitelikteki bu tür kararların iradi temsilin konusunu oluşturabilmesi ihtimali dahi ilk bakışta şaşırtıcı gelebilir. Bununla birlikte yönlendirici direktiflere ilişkin  düzenlemeler  içeren  ve  yukarıda  incelenen  hemen  hemen  tüm  hukuk sistemlerinde bu tür bir temsil ilişkisine izin verildiği şimdiden ifade edilmelidir. Süregelen temsil yetkisinin diğer ayağını ise, kişilerin ayırt etme gücünden yoksun kalmaları ihtimalinde, bu kişilerin hayatlarındaki finansal, ekonomik nitelikteki veya kişinin refahına ilişkin kararların kim tarafından verileceğinin belirlendiği kurgu yer almaktadır. Hatırlanacak olursa Avrupa Konseyi nin 2009(11) Tavsiye Kararında da bu hususa dikkat çekilmiş ve Devletlerin ilgili düzenlemeleri yaparken, süregelen temsil yetkisinin kapsamının içine tıbbi kararların dışında kalan ekonomik, finansal veya başkaca nitelikteki kararların da girip girmediğini değerlendirmeleri gerektiği belirtilmiştir.107103  Bkz Code de la santé publique Art. L1-11(3). Bu değişiklikten önce ilgili hükümde kişinin istekleri (souhaits) ifadesine yer verilmiş, yönlendirici direktiflerin hekim açısından bağlayıcılığının düzenlenmesi konusunda bir adım atılmamıştır. Bkz Mistretta (n 81) 421; Binet (n 90) 16. 104  Mistretta (n 81) 421.105  Mistretta (n 81) 421; Binet (n 90) 16.106  Volker Lipp, ‘Going Private:  Vorsorgevollmacht  as an Alternative to Legal Guardianship for Adults , Leuven Üniversitesi nde verilen dersin gözden geçirilmiş notları, 2016. Metin için bkz <https://www.bgt-ev.de/fileadmin/Mediendatenbank/Themen/Einzelbeitraege/Lipp/Lipp_Vorsolgevollmacht_as_an_Alternative.pdf> Erişim tarihi 28 Ekim 2020.107  Bkz Recommendation CM/Rec(2009)11, İlke 3.427İstanbul Hukuk Mecmuası 79/2Aşağıda, Kara Avrupası sistemlerinde süregelen temsil yetkisine ilişkin genel bir değerlendirme yapılırken öncelikle kişiye sıkı sıkıya bağlı nitelikteki kararlar dışındaki kararları içeren temsil yetkisinden başlanacaktır. Ardından kişiye sıkı sıkıya bağlı tıbbi kararların bir iradi temsilci aracılığıyla alınıp alınamayacağı hususu üzerinde durulacaktır. i. Kişiye Sıkı Sıkıya Bağlı Nitelikte Olmayan Kararlar AçısındanKişilerin ayırt etme güçlerini kaybetmeleri ihtimalinde, bu kişilerin korunması için benimsenebilecek iki temel hukuk politikası tercihi mevcuttur. Bunlardan ilki, Türk hukukunda olduğu gibi, korumanın esas olarak yasal temsil yani vesayet kurumu  üzerinden  sağlanmasıdır.108  Erişkinlerin  vesayet  kuralları  üzerinden korunması, kökenini Roma hukukunun cura kurumunda bulan, geleneksel olarak nitelendirilebilecek yöntemdir.109 Bu doğrultuda hemen hemen tüm Kara Avrupası sistemlerinde erişkinlerin vesayet kurumu üzerinden önceleri sadece malvarlığını ilgilendiren  hususlarda  korunduğunu,  kişi  varlığına  ilişkin  meselelerin  de  bu kapsamda değerlendirilmesinin 1960lı yıllardan sonra gündeme geldiğini söylemek mümkündür.110 Son yıllarda ise, çalışmanın başında da ifade edildiği gibi gittikçe önem kazanan nüfusun yaşlanması olgusu neticesinde, vesayet kurumunun etkinliği birçok Kara Avrupası sisteminde yeniden gözden geçirilmiştir.111 Bu doğrultuda vesayetin karşısında kalan ve modern olarak nitelendirilebilecek hukuk politikası tercihinin, kişilerin özerkliği ilkesine vurgu yapan ve korumanın, irade özerkliğinin bir uzantısı olarak,112 iradi temsil yoluyla sunulması olduğunu söylemek mümkündür.113 Bu yönde aşağıda kısaca inceleneceği üzere, birçok sistemde kişilerin ayırt etme gücünü kaybetmeleri ihtimalinde kendi hukuk alanlarında sonuç doğuracak birtakım hukuki işlemleri yapma yetkisinin bir başkasına devretmelerine izin verilmektedir. Buna öncelenmiş iradi temsil de (Vorsorgevollmacht) denilmektedir. Öncelenmiş iradi temsil söz konusu olduğunda altı çizilmesi gereken bir husus, bu hâllerde yasal temsilin ikincil bir mekanizma olarak geriye çekildiğidir. Bu husus, Alman hukukunda vesayetin ikincilliği veya vesayetin gerekliliği ilkesi olarak anılmaktadır. Vesayetin ikincilliği meselesinin Alman hukukunda BGB § 1896/2 de açıkça düzenlendiği görülmektedir.116 İlgili hükme göre sadece gerekli olduğu zaman 108  Nina Dethloff, Familienrecht (32. bası, C. H. Beck 2018) Nr 45; Dilşad Keskin, ‘İsviçre Hukukunda Tedbir Vekaleti  (2015) 64(2) AÜHFD 365, 367.109  Dethloff (n 108) Nr 44. Ayrıca bkz Charles P. Sherman, ‘The Debt of the Modern Law of Guardianship to Roman Law  (1913) 12(2) Michigan Law Review 124.110  Dethloff (n 108) Nr 44.111  ibid, Nr 44; Heckendorn Urscheler (n 72) 71 ff.112  Bülent Karasu, Karşılaştırmalı Hukuk Işığında Türk Hukukunda Doğrudan ve Dolaylı Temsil (1. bası, On İki Levha 2018) 50.113  Dethloff (n 108) Nr 45; Heckendorn Urscheler (n 72) 71-72.114  Bkz Gabriele Müller-Engels, Beck scher Online-Kommentar BGB (56. bası, 01.11.2020) BGB § 1896 Nr 24.115  Bkz Schneider (n 67), BGB § 1896 Nr 39.116  Bkz Taupitz ve Salkić (n 9) 339; Renz Nico, Der Vorsorgeauftrag und seine Validierung (1. bası, Schulthess 2020) 25.428Kurtulan-Güner / Karşılaştırmalı Bir Bakış Açısıyla İleriye Dönük Hasta Direktifleri ve Türk Hukuku İçin Önerilerdevreye giren vesayet kurumu için gereklilik şartı, kişinin işlerinin bir iradi temsilci tarafından da yürütülebileceğinin anlaşıldığı durumlarda mevcut değildir.117 Diğer bir deyişle Alman hukukunda öncelenmiş iradi temsilin yasal temsil karşısında kayrıldığını söylemek mümkündür.118 Bu temsil yetkisinin mal varlığının yönetimi gibi sadece belirli konulara ilişkin olarak verilmesine bir engel bulunmamaktadır.119 Avusturya hukukunda da tıpkı Alman hukukunda olduğu gibi vesayetin ikincilliği ilkesi açıkça kabul edilmiştir (Avusturya Medeni Kanunu (‘ABGB ) § 240). Bu doğrultuda ayrı bir önem kazanan öncelenmiş iradi temsil kurumu ise AGBG § 260 ve devamı hükümlerinde hükme bağlanmıştır. Aslında öncelenmiş iradi temsil kavramının AGBG ye ilk defa 2007 yılında giriş yaptığını söylemek mümkündür.120 Ancak 2018 yılında Avusturya hukukunda yapılan erişkinlerin korunmasına ilişkin ikinci  bir  reforma  ihtiyaç  duyulmuştur.121  Bu  reformun  arkasında  yatan  temel sebebin, yasal temsilin uygulamada giderek artan etkisinin frenlenmesi olduğu ifade edilmektedir.122 Zira 2003 yılında 30.000 kişiye yasal temsilci atanmış olduğu, buna karşılık 2016 yılı itibariyle bu sayının neredeyse ikiye katlandığı bilinmektedir.123 Bu doğrultuda erişkinlerin korunması meselesinin ilk ayağı olan öncelenmiş iradi temsile ilişkin hükümler gözden geçirilerek bu kuruma duyulan ilginin artması amaçlanmıştır.125 AGBG § 260 ve devamı hükümlerine göre kişilerin, ileride ayırt etme güçlerini kaybetmeleri ihtimalinde geçerlilik kazanacak şekilde bir temsil yetkisi vermeleri veya hâli hazırda verilmiş bir temsil yetkisinin fiil ehliyetinin kaybı durumunda da geçerliliğini koruyacağına karar vermeleri mümkündür. Bu temsil yetkisinin geçerliliği belirli şekil şartlarına bağlanmış olup, bir sicile kaydı da zorunlu tutulmuştur.126 Öncelenmiş iradi temsil yapısı Fransız hukukuna, Medeni Kanun da yapılan ve 2009 yılında yürürlüğe giren bir değişiklikle giriş yapmıştır.127 Fransız Medeni 117  Ayrıntılı bilgi için bkz Schneider (n 67), BGB § 1896 Nr 50 ff.118  Benzer yönde bkz Schneider (n 67), BGB § 1896 Nr 50 ff.119  Taupitz ve Salkić (n 9) 340. Alman hukukunda öncelenmiş temsil yetkisine ilişkin ayrıntılı bilgi için bkz Nico (n 116) 24 ff.120  Röthel (n 43) 80; Nico (n 116) 31; Michael Ganner, ‘Das österreichische Erwachsenenschutzrecht 2018  (2019) 2 Die Praxis des Familienrechts 430.121  Bkz BGBI. I Nr. 59/2017. 122  Ganner (n 120) 430. 123  Bkz Federal Ministry of Constitutional Affairs, Reforms, Deregulation and Justice, The New Adult Protection Law, Ocak 2018, s. 3. İlgili rapor için bkz <https://www.justiz.gv.at/home/service/erwachsenenschutz/das-neue-erwachsenenschutzrecht-imueberblick~40.de.html> Erişim tarihi 13 Kasım 2020.124  Avusturya hukukunda erişkinlerin korunması bağlamında kabul edilen dört ayaklı sisteme ilişkin ayrıntılı bilgi için bkz Ganner (n 120) 431-432; Nico (n 116)31-32.125  2018 yılında ilga edilen hüküm uyarınca (AGBG mülga § 284f) aranan temsil yetkisinin içeriğinin kesin bir şekilde belirlenmiş olması ve bazı kişilerin temsilci olarak atanamaması gibi hususlar kaldırılmış, buna karşılık öncelenmiş iradi temsile ilişkin daha sıkı bir şekil şartı öngörülmüştür. Ayrıca mülga hükümde öngörülen adi işler için öncelenmiş temsil ve önemli işler için öncelenmiş temsil ayrımı da terk edilmiştir. Ayrıntılı bilgi için bkz Ganner (n 120) 432 ff; Nico (n 116) 31 ff.126  Ganner (n 120) 432-433.127  Nico (n 116) 16. Bu değişikliğin temelinde, 2007 yılında kabul edilen erişkinlerin korunmasına ilişkin reform kanunu yer almaktadır. Bkz Loi n° 2007-308 du 5 mars 2007 portant réforme de la protection juridique des majeurs.429İstanbul Hukuk Mecmuası 79/2Kanunu nun (‘CC ) 477. maddesi uyarınca tam ehliyetli bir kimsenin ya da hukuken ergin kılınan bir küçüğün, bir ya da birden fazla kişiyi, ileride yasal temsili gerektirecek bir durumun ortaya çıkmasına neden olan koşullardan birinin gerçekleşmesi hâlinde devreye girecek şekilde iradi temsilci olarak ataması (mandat de protection future) mümkün kılınmıştır.128 Bu doğrultuda Fransız hukukunda da hem şahıs varlığını, hem de mal varlığını ilgilendiren kararların bu sayede öncelenmiş iradi temsilci aracılığıyla alınması fikri kabul edilmiştir.129 İsviçre hukukunda benzer yönde bir adım, 2013 yılında İsviçre Medeni Kanunu nda yapılan değişiklikle atılmıştır.130 Bu doğrultuda erişkinlerin korunmasına ilişkin resmi tedbirlerin ikincilliği hususu yine açıkça hükme bağlanmıştır (ZGB m. 389).131 ZGB m. 360 ve devamı hükümleriyle getirilen yeni bir kavram olan tedbir/bakım vekaleti veya öncelenmiş vekalet kurumu (Vorsorgeauftrag) sayesinde, kişilerin henüz ayırt etme gücüne sahipken, ileride ayırt etme güçlerini kaybetmeleri ihtimalinde devreye girecek  şekilde  kişisel  bakım  ve  korunmalarının  sağlanması,  hukuki  işlemlerin kendisi adlarına yapılması ve mal varlıklarının yönetilmesi amacıyla bir kimseyi vekil olarak atayabilecekleri kabul edilmiştir.133 İlk bakışta Türk hukukunda temsil yetkisinin kişinin ayırt etme gücünü kaybetmesine rağmen devam edecek şekilde verilmesinin mümkün olduğu, bu nedenle İsviçre hukukundaki bu değişikliğin hukukumuz açısından ciddi bir katma değeri olmadığı düşüncesine kapılmak mümkündür. Zira TBK m. 43 ün lafzından açıkça anlaşıldığı üzere temsil yetkisinin, temsil olunanın ayırt etme gücünü kaybetmesine rağmen devam edeceği kararlaştırılabilir.134 Bunun yanı sıra temsil yetkisinin doğumunun da temsil olunanın ayırt etme gücünün kaybı geciktirici koşuluna bağlanmasına da bir engel yoktur.135 Dolayısıyla, en azından bu başlık altında incelenen ve ‘temsil düşmanı  olmayan kararlar açısından kişilerin, ileride ayırt etme güçlerini kaybetme ihtimallerini dikkate alarak bir temsil yetkisi vermeleri ya da bu yönde bir temsil yetkisini içeren vekalet sözleşmesi akdetmeleri mümkündür. 128  Nico (n 116) 17.129  Nico (n 116) 20.130  Bu reforma ilişkin ayrıntılı bilgi için bkz Oktay Özdemir (n 15), 232 ff; Walter Boente, Zürcher Kommentar: Der Erwachsenenschutz, Die eigene Vorsorge und Massnahmen von Gesetzes wegen Art. 360-387 ZGB (1. bası, Schulthess 2015), Vorbemerkungen zu Art. 360–37 Nr 108 ff.; Peter Breitschmid, ‘Die erwachsenenschutzrechtliche Behandlung künftiger Erblasserinnen und Erblasser  (2008) Successio 16, Nr 5 ff.131  Boente (n 130) Vorbemerkungen zu Art. 360–373 Nr 111; Widmer Blum ve Carmen Ladina, CHK - Handkommentar zum Schweizer Privatrecht: Personen- und Familienrecht - Partnerschaftsgesetz (3. bası, Schulthess 2016) ZGB Art. 360 Nr 1; Breitschmid (n 130) Nr 6.132  Bakım vekaleti ifadesi için bkz İbrahim Kaplan, ‘İsviçre Medeni Kanunu nun (ZGB nin) Yetişkinlerin Korunmasına İlişkin Yeni Hükümlerinin Değerlendirilmesi  (2018) 137 TBB Dergisi 375, 379. Tedvir vekaleti ifadesi için bkz Keskin (n 108) 365.133  Oktay Özdemir (n 15) 233; Yvo Biderbost, ‘Der neue Erwachsenenschutz im Überblick  (2010) 106 SJZ 309, 312 ff; Boente (n 130) Vorbemerkungen zu Art. 360–373 Nr 122 ff; Keskin (n 108) 368; Blum ve Ladina (n 131) ZGB Art. 360 Nr 15 ff. Bu kişinin belirlenebilir olmasının yeterli olduğu yönünde bkz Oliver Kälin, ‘Das Neue Erwachsenenschutzrecht - Pflegefall, Demenz und Vermögen  (2008) 12 Der Schweizer Treuhänder 1048, 1049.134  Benzer bir düzenlemeye vekalet sözleşmesine ilişkin TBK m. 513 te de rastlanmaktadır.135  Vekalet sözleşmesi açısından aynı yönde bkz Keskin (n 108) 393.430Kurtulan-Güner / Karşılaştırmalı Bir Bakış Açısıyla İleriye Dönük Hasta Direktifleri ve Türk Hukuku İçin ÖnerilerAncak öğretide Keskin in de ifade ettiği gibi, Türk hukukundaki bu imkân ile İsviçre hukukunda düzenlenen tedbir vekaleti kurumları arasında yine de birtakım önemli farklar mevcuttur.136 Bunlardan belki de en önemlisi, Türk hukukunda ileriye dönük bir temsil yetkisi vermiş olan kişinin ayırt etme gücünü kaybetmesi durumunda vesayet kurumunun yine de devreye girmesi ve yasal temsilci ile iradi temsilci arasında bir görüş ayrılığı olması durumunda ilkine öncelik tanınmasıdır.137 Bu açıdan bakıldığında erişkinlerin korunması anlamında Türk hukukunun hâlâ paternalist bir yaklaşım sürdürdüğünü söylemek mümkündür. Dolayısıyla hukukumuzda her ne kadar kişiye sıkı sıkıya bağlı olmayan, söz gelimi mal varlığının yönetilmesi gibi kararlar açısından ileriye dönük bir temsil ilişkisi kurmak mümkün gözükse de vesayetin ikincilliğinden bahsetmek mümkün olmadığı için, bu bağlamda kişinin irade özerkliğine tanınan ağırlığın yukarıda incelenen sistemlere kıyasla daha hafif olduğunu söylemek yanlış olmayacaktır. ii. Kişiye Sıkı Sıkıya Bağlı Nitelikteki Kararlar AçısındanBir kimsenin, ileride ayırt etme gücünü kaybetmesi ihtimalinde, kendi bedeniyle ilgili tıbbi kararları bir yönlendirici direktif vasıtasıyla önceden alması seçeneğinin yanı  sıra,  bu  kararların  alınması  konusunda  güvendiği  birini  yetkilendirmesi mümkündür. Karşılaştırmalı hukukta bu kişilere tıbbi vekil/sağlık bakım vekili (healthcare  proxy)  denmektedir.138  Kişiye  sıkı  sıkıya  bağlı  nitelikteki  kararlar söz konusu olduğunda, ayrı bir yasal düzenlemeye duyulan ihtiyaç daha da göze çarpmaktadır. Zira bu tür kararların temsilci aracılığıyla verilebilmesi fikri ilk bakışta Türk hukukunun da içinde bulunduğu pek çok sisteme yabancıdır.139 Dolayısıyla kişilerin, henüz ayırt etme gücüne sahipken, ileride bu nitelikteki kararların bir iradi  temsilci  vasıtasıyla  alınabileceğini  sağlayacak  şekilde  bir  temsil  yetkisi vermelerinin mümkün olup olmadığı konusunda farklı görüşler ileri sürülmüştür.140 Bununla birlikte bu tartışmanın, yukarıda incelenen sistemlerde son yıllarda yaşanan gelişmeler karşısında önemini yitirdiğini söylemek mümkündür. Alman hukukunda 2009 yılında BGB §1901a hükmünün ilk fıkrasında kişinin düzenlediği yönlendirici direktiflerin hayata geçirilmesi konusunda ilgilinin yasal temsilcisine bir yükümlülük yüklenmiş, bununla birlikte aynı hükmün 5. fıkrasında, kişinin bir iradi temsilci (Bevollmächtigte) atamış olması ihtimalinde bu fıkranın iradi 136  Keskin (n 108) 394 ff.137  Keskin (n 108) 394-395.138  Goffin (n 10) 128.139  Krş Yücel (n 5) 71.140  Bkz Yücel (n 5) 67 ff.431İstanbul Hukuk Mecmuası 79/2temsilciler açısından uygulanması gerektiği düzenlenmiştir.141 BGB nin 1999 yılında değişikliğe uğrayan §1904. paragrafında ise, kural olarak yasal temsilci tarafından alınacağı öngörülen söz gelimi tedavinin kabulü, reddi veya kabulün geri alınmasına ilişkin kararların, bunların açıkça öngörüldüğü ve yazılı şekilde düzenlenmiş bir temsil belgesi bulunması durumunda, iradi temsilci tarafından da alınabileceği hükme bağlanmıştır.142 Dolayısıyla yukarıda Alman hukukunda vesayetin ikincilliğine ilişkin yapılan açıklamaların, kişiye sıkı sıkıya bağlı haklar açısından da geçerli olduğunun belirtilmesinde yarar vardır. Daha açık bir ifadeyle, eğer kişi, sağlık durumuyla ilgili kararların verilmesi konusunda bir temsilci atamışsa, bu durumda bu yetki alanı için bir yasal temsilci atanması söz konusu olmayacaktır.143 İsviçre hukukunda tedbir vekaletinin şahıs varlığına ilişkin kararları da kapsayacağı ZGB m. 360 da açıkça hükme bağlanmıştır. Bunun yanı sıra yönlendirici direktiflere ilişkin ZGB m. 370/2 de de bu hükmün kapsamına giren tıbbi kararların belirli bir kişi tarafından alınabileceğinin kararlaştırılmasının mümkün olduğu ifade edilmiştir.144 Bununla birlikte İsviçre hukukunda bu düzenlemelerden önce de kişilerin bu tür kararların alınması konusundaki yetkiyi bir kişiye devredebileceklerinin öğretide bazı yazarlarca kabul edildiği ifade edilmelidir.145 Fransız hukukunda ise CC m. 425/2 ve 477 ışığında, ileriye dönük koruma sağlayan temsilin temsil olunanın hem malvarlığını hem de kişi varlığını ilgilendiren hususları kapsayabileceği kabul edildiği anımsanacaktır. Bunun yanı sıra Fransız hukukunda 2002  yılında  yapılan  bir  değişiklikle  güvenilen  kişi  (personne  de  confiance) kurumuna  yer  verilmiştir.146  Bu  doğrultuda  tıbbi  nitelikteki  kararların,  hastanın rızasının alınamadığı hâllerde, atanmış güvenilen kişi tarafından alınabileceği kabul edilmiştir.147141  İlgili hükme göre geçerli bir şekilde düzenlenmiş bir yönlendirici direktif söz konusu olduğunda, bu düzenlemenin hastanın mevcut durumuna ve öngörülen tedaviye uygun olup olmadığını denetleme yükümlülüğü hastanın yasal temsilcisi veya bu iş için atanmış iradi temsilcisindedir. Bkz Taupitz ve Salkić (n 10) 341. Nitekim bu nedenle bu denetimin hem bir hak hem de bir yükümlülük olduğu ifade edilmektedir. Bkz Spickhoff (n 92) BGB § 1901a Nr 13. 142  BGB § 1901a ve § 1904 hükümlerinin, esasen kişiye sıkı sıkıya bağlı bu kararların iradi temsilci tarafından alınıp alınamayacağına ilişkin tartışmaya son verdiği yönünde bkz Lanzrath (n 67) 57, dn. 349.143  Taupitz ve Salkić (n 10) 340; Ünver ve Kaya (n 69) 22.144  Bkz Boente (n 130) Vorbemerkungen zu Art. 360–373 Nr 123. İki hüküm arasındaki ilişkiye dair bir değerlendirme için bkz Max Baumann, ‘Vorsorgeauftrag für medizinische Massnahmen und Patientenverfügung  (2005) 2 Zeitschrift für Vormundschaftswesen 58, 59 ff.; Breitschmid (n 130) Nr 9 ff.; Blum ve Ladina (n 131) ZGB Art. 360 Nr 23-24.145  Boente (n 130) Vorbemerkungen zu Art. 360–373 Nr 87; Hans Michael Riemer, ‘Willensvertretung bei Betagten  (1998) 1 recht 21, 21. Bu doğrultuda Riemer, vasiyetname hazırlama, evlenme, miras sözleşmesi yapma gibi mutlak anlamda kişiye sıkı sıkıya bağlı işlemler ile belirli bir tedaviyi onaylama ya da reddetme gibi nispi anlamda kişiye sıkı sıkıya bağlı işlemler arasında bir ayrıma gitmiş, ikinci kategori açısından kişinin ayırt etme gücünü kaybetmesi ihtimalinde temsilin mümkün olduğu sonucuna varmıştır. Türk hukukunda benzer yönde bkz Yücel (n 5) 39, 76.146  Bkz Code de la santé publique, Art. L1-6. Ayrıca bkz Oktay Özdemir (n 6) 612.147  Ayrıntılı bilgi için bkz Maryline Bruggeman ve Hélène Capela, ‘L expression anticipée de la volonté individuelle en droit des personnes et de la famille: analyse critique  iç Marc Nicod (ed) De la volonté individuelle (1. bası, LGDJ 2009) 35 ff.432Kurtulan-Güner / Karşılaştırmalı Bir Bakış Açısıyla İleriye Dönük Hasta Direktifleri ve Türk Hukuku İçin ÖnerilerV. Sonuç Yerine: Türk Hukuku İçin Öneriler1960 lı yılların sonunda Amerika Birleşik Devletleri nde tartışılmaya başlayan ve  daha  sonra  birçok  ülkede  yasal  dayanağa  kavuşturulan  ileriye  dönük  hasta direktiflerine ilişkin Türk hukukunda hâli hazırda kanun düzeyinde bir düzenlemeden bahsetmek mümkün değildir.148 Bu bağlamda iç hukukumuzda atılan en somut adım, Hasta Hakları Yönetmeliği nin 2014 yılında değiştirilen ve  Hastanın Rızası ve İzin  başlıklı 24. maddesidir.149 İlgili hükmün beşinci fıkrası şu şekildedir:  Tıbbi müdahale sırasında isteğini açıklayabilecek durumda bulunmayan bir hastanın, tıbbî müdahale ile ilgili olarak önceden açıklamış olduğu istekleri göz önüne alınır.  Önceden açıklanmış isteklerin göz önüne alınacağını düzenleyen bu hüküm, İnsan Hakları ve Biyotıp Sözleşmesi nin 9. maddesinin bir tekrarı niteliğindedir ve ilgili maddeye getirilen tüm eleştirilerin bu bakımdan yinelenmesi mümkündür.150Bu  doğrultuda,  Türk  hukukunda  bağlayıcı  karakterdeki  ileriye  dönük  hasta direktiflerine ilişkin bir düzenleme ihtiyacı bulunduğu ortadadır.151 Bu yönde bir düzenleme, Avusturya hukukunda olduğu gibi ayrı bir kanunla veya İsviçre ve Alman hukuk sistemlerinde olduğu gibi Medeni Kanun da yapılacak bir değişiklikle benimsenmelidir.152 Bu doğrultuda öncelikle kişilerin, ileride ayırt etme güçlerini kaybetme ihtimallerini dikkate alarak, beden bütünlüklerini ilgilendiren ve hukuken izin verilen tıbbi kararları öncelenmiş bir şekilde almasının mümkün olduğu ve bu kararların başta hekim olmak üzere herkes açısından bağlayıcılığı pozitif bir düzenlemeye kavuşturulmalıdır. Zira hastanın kendi geleceğini belirleme hakkının somut olarak hayata geçirilmesi ancak bu şekilde mümkün olabilir.153 148  Oktay Özdemir (n 6) 624.149  Hükme ilişkin ayrıntılı değerlendirme ve eleştiri için ayrıca bkz Oktay Özdemir (n 15) 229, 241.150  Türkiye de 2018 yılında 372 doktor ve hemşirenin katılımıyla yapılan bir araştırmada, bilinci kapalı, yani ayırt etme gücünden yoksun olan hastalar için kimin karar verici olduğu sorusunun yanıtı, bu hükmün yetersizliğinin ve söz konusu yasal düzenlemelerin önemini gözler önüne sermektedir. Bu soruya katılımcıların %34,8 i yasal temsilci, %29,8 i hastanın kendi doktoru, %28,3 ü ise doktorlardan oluşacak bir komisyon yanıtını vermiştir. Dolayısıyla ayırt etme gücünden yoksun bir hastayı ilgilendiren tıbbi kararlar söz konusu olduğunda en yetkili görülen merciin doktorlar, bundan sonra ise yasal temsilciler olduğunu söylemek mümkündür. Buna karşılık hastanın ayırt etme gücüne sahipken, ileriye dönük bir şekilde hazırladığı bir direktifin belirleyici olması gerektiği yönünde görüş bildirenler katılımcıların sadece %5 ini oluşturmuştur. İlgili çalışma için bkz Lütfiye Tekpınar, Sağlık Hizmetlerinde Genişletilmiş Özerklik İlkesine Doktor ve Hemşirelerin Bakışı: Bir Alan Araştırması (2018) Necmettin Erbakan Üniversitesi Sağlık Bilimleri Enstitüsü, Sağlık Yönetimi Anabilim Dalı, yayınlanmamış yüksek lisans tezi, özellikle 119 ff. Hâli hazırda Hasta Hakları Yönetmeliği nin 24. maddesinde  Tıbbi müdahale sırasında isteğini açıklayabilecek durumda bulunmayan bir hastanın, tıbbî müdahale ile ilgili olarak önceden açıklamış olduğu istekleri göz önüne alınır.  hükmü bulunmasına rağmen, sağlık çalışanlarının sadece çok küçük bir kısmının bu isteklerin belirleyici olması gerektiği yönünde görüş bildirmesi, isteklere açıkça bağlayıcı nitelik tanınmamasının bir sonucu ve kanımca ilgili hükmün neredeyse bir ölü hüküm olarak değerlendirilebilmesinin bir sebebidir.151  Aynı yönde bkz Tolga Güven ve Gürkan Sert, ‘Advance Directives in Turkey s Cultural Context: Examining the Potential Benefits for the Implementation of Patient Rights  (2010) 24(3) Bioethics 127, 130-131; Yücel (n 5) 328. Ayrıca bkz Oktay Özdemir (n 15) 231. Oktay Özdemir, kişinin gelecekteki durumu bakımından isteklerini belirtme hakkına sahip olmasının ve bu isteklere bağlayıcı nitelik tanınmasının, hukukumuzda hâli hazırda mevcut olan sistemden daha iyi bir koruma sağlayacağını ifade etmektedir.152  Aynı yönde bkz Oktay Özdemir (n 6) 626; Oktay Özdemir (n 15) 242.153  Aynı yönde bkz Tacir (n 9) 137.433İstanbul Hukuk Mecmuası 79/2İleride kişinin bu direktifi düzenlerken ayırt etme gücünü haiz olup olmadığına ilişkin olarak ortaya çıkabilecek ispat sorunlarının bir ölçüde önüne geçilebilmesi için bu düzenlemelerin en azından yazılı şekilde yapılması aranmalıdır.154 Bunun yanı sıra, yönlendirici direktiflerin yapılabilmesi için bazı sistemlerde aranan reşit olma şartına ilişkin olarak öğretide dile getirilen eleştiriler dikkate alındığında, ayırt etme gücünün ehliyet şartı için yeterli olduğunun kabul edilmesi daha isabetli olacaktır. Bu yönde bir tutum, ayırt etme gücüne sahip kişilerin kişiye sıkı sıkıya bağlı haklarını kullanabileceğinin kabul edildiği hukuk düzenimizle de daha uyumludur. Öte yandan kanımca bir tedavinin reddine veya alternatif tedavi yöntemleri arasından birinin seçimine ilişkin öncelenmiş irade beyanlarının, İtalyan veA  vusturya hukuk sistemlerinde olduğu gibi, bir hekime danışıldıktan sonra, diğer bir deyişle aydınlatılmış bir şekilde verilmesi aranmalıdır.155 Yönlendirici direktiflerin bağlayıcılığının bir prensip olarak kabul edilmesi gerekli olsa da bu irade beyanlarının daha sonra gözden geçirilme imkânının da mevcut olması gereklidir. Yukarıda incelenen tüm Kara Avrupası sistemlerinde olduğu gibi, özellikle yönlendirici direktifin hastanın somut durumuna uygun olmadığı yönünde bir şüphe varsa veya direktifin düzenlenmesinden sonra tıp alanında bu konuda önemli gelişmeler gerçekleşmişse, direktifin uygulanmaması konusunda hâkime takdir yetkisi verilmesi mümkün olmalıdır. Son olarak özellikle acil durumlarda bu açıklamaların tespitinin kolay olabilmesi için elektronik ortamda ulusal bir sicil yaratılması yerinde olacaktır.156 Bunun yanı sıra yukarıda incelenen sistemlere paralel olarak, kişilerin hem kendi bedenlerini ilgilendiren tıbbi kararların, hem de bunun dışında kalan söz gelimi mal varlığının yönetilmesine ilişkin veya kişinin bir bakım evine yerleştirilmesi gibi kararların, bir temsilci tarafından alınmasına izin verilmeli ve bu husus da açıkça düzenlenmelidir. Aslında mevcut hukuk düzenimizde, kişiye sıkı sıkıya bağlı hakların mutlak ve nispi anlamda kişiye sıkı sıkıya bağlı haklar olarak bir ayrıma tâbi tutulması sayesinde tıbbi kararların bir temsilci vasıtasıyla alınabileceği, bunun yanı sıra kişiye sıkı sıkıya bağlı olmayan kararlar açısından da ayırt etme gücünün kaybı durumunda geçerlilik kazanacak şekilde temsil yetkisinin verilebileceği, bu nedenle bu tür bir düzenlemeye aslında gerek olmadığı ileri sürülebilir. Bununla birlikte, kanımca bu yapının da pozitif bir düzenlemeyle desteklenmesi zorunludur. Bunun ilk sebebi hukuk güvenliğinin sağlanmasıdır. Bir diğer önemli sebep ise, bu kurgunun vesayet kurumu karşısındaki kırılganlığıdır. Yukarıda da incelendiği üzere kişinin ayırt etme gücünü kaybetmesi durumunda bu kişiye vasi atanması ihtimalinde,  vasinin  kararlarının  söz  konusu  iradi  temsilciye  kıyasla  öncelikli olduğunun altı çizilmelidir. Oysaki modern sistemlerdeki eğilim, yasal temsile iradi 154  Bkz Oktay Özdemir (n 6) 619-620.155  Aydınlatılmış rıza kavramına ilişkin olarak Kahraman (n 15) 490 ff. 156  Benzer yönde Oktay Özdemir (n 6) 622.434Kurtulan-Güner / Karşılaştırmalı Bir Bakış Açısıyla İleriye Dönük Hasta Direktifleri ve Türk Hukuku İçin Önerilertemsil karşısında ikincil bir konum tahsis edilmesidir. Bu eğilim, çalışmanın en başında değinilen, hasta-hekim arasındaki paternalist ilişkiden uzaklaşan ve irade özerkliğini merkezi kavram olarak benimseyen tutumla da uyum içindedir.157 Daha da önemlisi, bu tutumun kamunun tercihlerine de paralel olduğuna ilişkin ampirik veriler mevcuttur.158 Bu doğrultuda kişilerin henüz ayırt etme gücüne sahipken, ileride tam ehliyetsiz hâle gelmeleri ihtimalini göz önünde tutarak, şahıs ve mal varlıklarıyla ilgili karar verme yetkilerini bir temsilciye devretmeleri imkânı Kanun da açıkça düzenlenmelidir. Ancak bu yönde bir düzenlemenin yapılabilmesi için öncelikle, yukarıda incelenen Kara Avrupası sistemlerine paralel olarak, resmi temsili esas alan vesayet kurumuna ilişkin kuralların yerindeliği ve güncelliği tartışmaya açılmalıdır. Bir kimsenin, ayırt etme gücünü kaybetmesi ihtimalinde kendisinin şahıs ve mal varlığı haklarının kim tarafından korunmasını istediğine ilişkin iradesine bağlayıcılık tanınması, bu yönde vesayet kurumunun geriye çekilerek iradi temsil kurumuna öncelik verilmesi, bu yönde bir temsil yetkisinin kişi henüz ayırt etme gücüne sahipken verildiği de göz önünde tutulduğunda, kişi özerkliği ilkesinin doğal bir görünümü olduğu kabul edilmelidir.Sonuç olarak, kanımca hukuk sistemimizde bir değişikliğe gidilerek kişilerin, ayırt etme güçlerini kaybetmeleri ihtimalinde devreye girecek geniş anlamda ileriye dönük hasta direktifleri hazırlamalarına imkân verilmesi, hatta bunun uygulamada yaygınlaştırılması için çaba harcanması gerekmektedir. Bu tür bir değişiklik insan onuruna, temel hasta haklarına ve irade özerkliği ilkesine uyumun bir gereğidir. Çalışmanın başında değinildiği üzere, Türkiye de 65 yaş üstü nüfusun oranının gösterdiği kayda değer ve ivmeli artış, bu yönde bir düzenleme ihtiyacının öneminin ve aciliyetinin sinyalini vermektedir.Hakem Değerlendirmesi: Dış bağımsız.Çıkar Çatışması: Yazar çıkar çatışması bildirmemiştir.Finansal Destek: Yazar bu çalışma için finansal destek almadığını beyan etmiştir.Teşekkür: Bu çalışmaya sunduğu destek ve katkıları için değerli Hocam Dr. Öğr. Üyesi İdil Işıl Gül e çok teşekkür ederim.Peer-review: Externally peer-reviewed. Conflict of Interest: The author has no conflict of interest to declare.Grant Support: The author declared that this study has received no financial support.Acknowledgements: I would like to thank Asst. Prof. Dr. İdil Işıl Gül for her support and contributions to this study.157  Hasta-hekim ilişkileri bağlamında paternalist yaklaşıma ilişkin ayrıntılı bir değerlendirme için bkz. Tacir (n 9) 113 ff. 158  Avrupa ülkeleri bağlamında bu yönde bir çalışma için bkz. Barbara A. Daveson ve diğerleri, ‘To Be Involved or Not To Be Involved: A Survey of Public Preferences for Self-Involvement in Decision-Making Involving Mental Capacity (Competence) Within Europe  (2013) 27(5) Palliative Medicine 418.435İstanbul Hukuk Mecmuası 79/2",
     "Kaynakça": "Aigner G, ‘Das Patientenverfügungs Gesetz – Historie und Ausgangslage  iç Ulrich Körtner, Christian Kopetzki ve Maria Kletečka Pulker (edr) Das Österreichische Patientenverfügunsgesetz (1. bası, Springer 2007)Andorno R, ‘Regulating Advance Directives at the Council of Europe  iç Stefania Negri (ed), SelfDetermination, Dignity and End of Life Care Regulating Advance Directives in International and Comparative Perspective (1. bası, Brill 2012) Battal A, Hasta Tasarrufları ve Organ Vasiyeti (2012) Ankara Üniversitesi Sosyal Bilimler Enstitüsü Özel Hukuk Anabilim Dalı, yayınlanmamış yüksek lisans teziBaumann M, ‘Vorsorgeauftrag für medizinische Massnahmen und Patientenverfügung  (2005) 2 Zeitschrift für Vormundschaftswesen 58 69Bıton Serdaroğlu E, ‘Ötanazi Ölme Hakkı  (2016) 22(3) MÜHFHAD (Cevdet Yavuz a Armağan) 463 491Biderbost Y, ‘Der neue Erwachsenenschutz im Überblick  (2010) 106 SJZ 309 320Binet JR, ‘Présentation de la loi créant de nouveaux droits en faveur des malades et des personnes en fin de vie  (2016) 10 Revue Droit de la Famille 16 19Blum  W  ve  Ladina  C,  CHK Handkommentar  zum  Schweizer  Privatrecht:  Personen   und Familienrecht Partnerschaftsgesetz (3. bası, Schulthess 2016)Boente W, Zürcher Kommentar: Der Erwachsenenschutz, Die eigene Vorsorge und Massnahmen von Gesetzes wegen Art. 360 387 ZGB (1. bası, Schulthess 2015)Boulanger A, ‘Les directives anticipées et le désir de maîtrise de sa fin de vie  (2017) 146 147 Médecine & Droit 136 140Brazier M, ‘Patient Autonomy and Consent to Treatment: Role of Law  (1987) 7 Legal Studies 169 193Breitschmid  P,  ‘Die  erwachsenenschutzrechtliche  Behandlung  künftiger  Erblasserinnen  und Erblasser  (2008) Successio 16 29Brodoff L, ‘Planning for Alzheimer s Disease with Mental Health Advance Directives  (2009) 17(2) Elder Law Journal 239 308Brown BA, ‘The History of Advance Directives  A Literature Review  (2003) 29(9) Journal of Gerontological Nursing 4 14Bruggeman M ve Capela H, ‘L expression anticipée de la volonté individuelle en droit des personnes et de la famille: analyse critique  iç Marc Nicod (ed) De la volonté individuelle (1. bası, LGDJ 2009)Ciliberti R ve diğerleri, ‘The Italian law on informed consent and advance directives: New rules of conduct for the autonomy of doctors and patients in end of life care  (2018) 48 Journal of Critical Care 178 182Daveson BA ve diğerleri, ‘To Be Involved or Not To Be Involved: A Survey of Public Preferences for Self Involvement in Decision Making Involving Mental Capacity (Competence) Within Europe  (2013) 27(5) Palliative Medicine 418 427Dethloff N, Familienrecht (32. bası, C. H. Beck 2018)Diehn T ve Rebhan R, ‘Vorsorgevollmacht und Patientenverfügung  (2010) NJW Heft 6 326 330Ganner  M,  ‘Das  österreichische  Erwachsenenschutzrecht  2018   (2019)  2  Die  Praxis  des Familienrechts 430 449Goffin T, ‘Advance Directives as an Instrument in an Ageing Europe  (2012) 19 European Journal of Health Law 121 140436Kurtulan Güner / Karşılaştırmalı Bir Bakış Açısıyla İleriye Dönük Hasta Direktifleri ve Türk Hukuku İçin ÖnerilerGunter Hunt G, Mahoney JE ve Sieger CE, ‘A Comparison of State Advance Directive Documents  (2002) 42(1) The Gerantologist 51 60Güven T ve Sert G, ‘Advance Directives in Turkey s Cultural Context: Examining the Potential Benefits for the Implementation of Patient Rights  (2010) 24(3) Bioethics 127 133Heckendorn Urscheler L, ‘Allgemeine Einleitung  iç Andrea Büchler ve diğerleri (edr) FamKomm Erwachsenenschutz (1. bası, Stämpfli Verlag 2013)İmamoğlu SH, ‘Hasta Vasiyetine İlişkin Bazı Meseleler  (2016) 65(1) AÜHFD 199 230Kahraman Z, ‘Medeni Hukuk Bakımından Tıbbi Müdahaleye Hastanın Rızası  (2016) 7(1) İnönü Üniversitesi Hukuk Fakültesi Dergisi 479 510Kälin O, ‘Das Neue Erwachsenenschutzrecht  Pflegefall, Demenz und Vermögen  (2008) 12 Der Schweizer Treuhänder 1048 1056Kaplan  İ,  ‘İsviçre  Medeni  Kanunu nun  (ZGB nin)  Yetişkinlerin  Korunmasına  İlişkin  Yeni Hükümlerinin Değerlendirilmesi  (2018) 137 TBB Dergisi 375 404Karasu B, Karşılaştırmalı Hukuk Işığında Türk Hukukunda Doğrudan ve Dolaylı Temsil (1. bası, On İki Levha 2018)Katoğlu T, ‘Türk Hukukunun Bir Parçası Olarak Avrupa Konseyi İnsan Hakları ve Biyotıp Sözleşmesi  (2006) 55(1) AÜHFD 157 193Keskin D, ‘İsviçre Hukukunda Tedbir Vekaleti  (2015) 64(2) AÜHFD 365 404Kletečka Pulker  M,  ‘Grundzüge  und  Zielsetzungen  des  Patientenverfügungs Gesetzes   iç Ulrich Körtner, Christian Kopetzki ve Maria Kletečka Pulker (edr) Das Österreichische Patientenverfügunsgesetz (1. bası, Springer 2007)Koka E ve Veshi D, ‘A New Law of  Living Will  in Italy: A Critical Analysis  (2019) 40 Liverpool Law Review 113 130Kunz P, ‘Patientenverfügung aus der Sicht der anwaltlichen Praxis  iç Ulrich Körtner, Christian Kopetzki ve Maria Kletečka Pulker (edr) Das Österreichische Patientenverfügunsgesetz (1. bası, Springer 2007)Kutner L, ‘Due Process of Euthanasia: The Living Will, A Proposal  (1969) 44 Indiana Law Journal 539 554Lanzrath S, Patientenverfügung und Demenz (1. bası, Lit Verlag Berlin 2016)Larson EJ ve Eaton TA, ‘The Limits of Advance Directives: A History and Assessment of the Patient Self Determination Act  (1997) 32(2) Wake Forest Law Review 249 293Lipp V ve Brauer D, ‘Patientenvertreter, Betreuungsgericht und Patientenwille  iç Wolfram Höfling (ed) Das neue Patientenverfügungsgesetz in der Praxis   eine erste kritische Zwischenbilanz (1. bası, Nomos 2011)Lipp V,  ‘Going  Private:   Vorsorgevollmacht  as  an Alternative to  Legal  Guardianship  for Adults , Leuven Üniversitesi nde verilen dersin gözden geçirilmiş notları, 2016. Metin için bkz  <https://www.bgtev.de/fileadmin/Mediendatenbank/Themen/Einzelbeitraege/Lipp/Lipp_Vorsolgevollmacht_as_an_Alternative.pdf> Erişim tarihi 28 Ekim 2020Manaï D, ‘Les Directives Anticipées en Droit Suisse  iç Stefania Negri (ed), Self Determination, Dignity and End of Life Care Regulating Advance Directives in International and Comparative Perspective (1. bası, Brill 2012)Mistretta P, ‘De l art de légiférer avec tact et mesure: à propos de la loi n° 2016 87 du 2 février 2016  (2016) 8 La Semaine Juridique   Edition Générale 417 423Müller Engels G, Beck scher Online Kommentar BGB (56. bası, 01.11.2020)437İstanbul Hukuk Mecmuası 79/2Nico R, Der Vorsorgeauftrag und seine Validierung (1. bası, Schulthess 2020)Oktay Özdemir S, ‘Ayırt Etme Gücü Bulunmayan Yetişkinlere Yapılacak Tıbbi Müdahalelere Onay Konusunda İsviçre Hukukunda Yapılan Değişiklikler  (2016) 11(145 146) Bahçeşehir Üniversitesi Hukuk Fakültesi Dergisi (Prof. Dr. Özer Seliçi nin Anısına Armağan) 223 243Oktay Özdemir S, ‘Tıbbi Müdahaleler Alanında Önceden Verilmiş Talimatlara (Hasta Vasiyeti) İlişkin Gelişmeler ve Türk Hukukundaki Geçerliliği  iç Saibe Oktay Özdemir ve diğerleri (edr) Prof. Dr. Galip Sermet Akman a Armağan (1. bası, Filiz 2020)Olick RS, ‘On the Scope and limits of advanced directives and prospective autonomy  iç Peter Lack, Nikola Biller Andorno ve Susan Brauer (edr) Advance Directives (1. bası, Springer 2014)Riemer HM, ‘Willensvertretung bei Betagten  (1998) 1 recht 21 24Röthel A, ‘Patientenverfügung und Vorsorgevollmacht in europäischer Perspektive  (2007) FPR Heft 3 79 82Sanchez Gonzalez MA, ‘Advance Directives Outside the USA: Are They the Best Solution Everywhere?  (1997) 18 Theoretical Medicine 283 301Scherer JM ve Simon RJ, Euthanasia and the Right to Die: A Comparative View (1. bası, Rowman & Littlefield Publishing 1999)Schneider UH, Münchener Kommentar zum Bürgerlichen Gesetzbuch (8. bası, C. H. Beck 2020)Sherman CP, ‘The Debt of the Modern Law of Guardianship to Roman Law  (1913) 12(2) Michigan Law Review 124 131Shultz MM, ‘From Informed Consent to Patient Choice: A New Protected Interest  (1985) 95(2) Yale Law Journal 219 299Silveria MJ, Kim SYH ve Langa KM, ‘Advance Directives and Outcomes of Surrogate Decision Making Before Death  (2010) 362 The New England Journal of Medicine 1211 1218Simon A, ‘Historical Review of Advance Directives  iç Peter Lack, Nikola Biller Andorno ve Susan Brauer (edr) Advance Directives (1. bası, Springer 2014)Söğüt İS ve Tuna E, ‘Hastanın Tıbbi Yaşam İradesine Dair Hukuki Vasıtalar  (2017) 12 Tıp Hukuku Dergisi 255 295Spickhoff A, Medizinrecht (3. bası, C. H. Beck 2018)Tacir H, Hastanın Kendi Geleceğini Belirleme Hakkı (1. bası, On İki Levha 2011)Taupitz J ve Salkić A,  Advance Directives and Legality of Euthanasia under German Law  iç Stefania Negri (ed), Self Determination, Dignity and End of Life Care Regulating Advance Directives in International and Comparative Perspective (1. bası, Brill 2012)Tekpınar L, Sağlık Hizmetlerinde Genişletilmiş Özerklik İlkesine Doktor ve Hemşirelerin Bakışı: Bir Alan Araştırması (2018) Necmettin Erbakan Üniversitesi Sağlık Bilimleri Enstitüsü, Sağlık Yönetimi Anabilim Dalı, yayınlanmamış yüksek lisans tezThiel MJ, ‘Personal Capacity to Anticipate Future Illness and Treatment Preferences  iç Peter Lack, Nikola Biller Andorno ve Susan Brauer (edr) Advance Directives (1. bası, Springer 2014)Trachsel M, Mitchell C ve Biller Andorno N, ‘Advance Directives Between Respect for Patient Autonomy and Paternalism  iç Peter Lack, Nikola Biller Andorno ve Susan Brauer (edr) Advance Directives (1. bası, Springer 2014)Ünver Y ve Kaya S, Alman Tıp Hukukunda Hasta Talimatı (1. bası, Seçkin 2017)Veshi D ve Neitzke G, ‘Advance Directives in Some Western European Countries: A Legal and Ethical Comparison Between Spain, France, England and Germany  (2015) 22 European Journal of Health Law 321 345438Kurtulan Güner / Karşılaştırmalı Bir Bakış Açısıyla İleriye Dönük Hasta Direktifleri ve Türk Hukuku İçin ÖnerilerWiesing U ve diğerleri, ‘A New Law on Advance Directives in Germany  (2010) 36 Law, Ethics and Medicine 779 783Winick BJ, ‘Advance Directive Instruments for Those With Mental Illness  (1996) 51(1) University of Miami Law Review 57 95Yadav K ve diğerleri, ‘Approximately One in Three US Adults Completes Any Type of Advance Directive for End of Life Care  (2017) 36(1) Health Affairs 1244 1251Yücel Ö, Ayırt Etme Gücünden Yoksun Kişiler Adına Alınan Tıbbi Kararlarda Özerklik Hakkının Korunması ve Hasta Talimatları (1. bası, Seçkin 2018)439"
}