{
     "Tip": "Makale",
     "Dergi İsmi": "Gazi Üniversitesi Hukuk Fakültesi Dergisi",
     "Üniversite İsmi": "",
     "Gün": "",
     "Ay": "",
     "Yıl": "2016",
     "Cilt": "20",
     "Sayı": "2",
     "Başlık": "MOBBİNG DAVALARINDA İSPAT SORUNU",
     "Title": "PROOF ISSUE IN THE MOBBING CASES",
     "Yazar İsmi": [
          "Ahmet TAŞKIN"
     ],
     "Danışman İsmi": "",
     "Anahtar Kelimeler": [
          "Mobbing",
          "yıldırma",
          "manevi tazminat",
          "ispat",
          "dava"
     ],
     "Keywords": [
          "Mobbing",
          "intimidation",
          "solatium",
          "prof",
          "case"
     ],
     "Özet": "Mobbing, kavram olarak nispeten yeni olsa da çok eski bir olgudur. İnsanların iş  veya  görev  gereği  aynı  ortamı  paylaştıkları  her  yerde  mobbinge  rastlamak mümkündür. Bugüne kadar mobbing konusunda yüzlerce tez ve makale yazılmış, anket ve araştırmalar yapılmıştır. Gerek özel ve gerekse kamu sektöründe çok sayıda mobbing meydana gelmekte ancak bunlardan çok azı hakkında dava açılmaktadır. Mobbing olgusuna göre dava sayısının çok az oluşu ve açılan davalardan çok azında manevi tazminata hükmedilmesi ispat konusunda sorunlar yaşandığını göstermektedir. Çünkü mobbing, çoğunlukla gizlice ve sinsice yürütüldüğü ve mağdur tarafından delil temin edilmesinde güçlük çekildiği için ispatlanması zor olan bir konudur. Bu nedenle mobbing iddialarında katı ispat kurallarının terk edilmesi zorunludur. Aksi takdirde işyerlerinde ve kamu kurumlarında mobbing sayısı her geçen gün artma eğilimi gösterecektir.",
     "Abstract": "Even though mobbing, as a relatively new concept, it is a very old phenomenon. Mobbing can be found everywhere that people share the same environment as job or task. Thesis and hundreds of articles on mobbing made so far, surveys and studies have been done. It should occur in either the private and the public sector, but regarding the few cases of mobbing are opened. According to the mobbing phenomenon consists of the very few number of cases filed and to award compensation in the very least indicates that there are problems with the proof. By reason of mobbing, and often secretly taken to a subject that is diﬀ icult to prove that the diﬀ iculties in providing evidence and stealthily carried by the victim. Therefore, it is necessary to abandon the strict rules of proof to the allegations of mobbing. Otherwise, the number of mobbing in the workplace and public institutions will tend to increase with each passing day.",
     "Metin": "1960 larda, hayvan davranışlarını inceleyen bilim adamı (ethologist) Konrad Lorenz, tarafından kuşlar gibi küçük hayvan grupları nın tilki gibi daha güçlü ve yalnız bir hayvana toplu şekilde hücum ederek uzaklaştırması ya da aynı kuluçkadan çı kan kuşlar arasında yaşanan ve diğer kuşların, aralarındaki en zayıf kuşu yiyecek ve sudan uzak tutarak dışlaması, iyice güçsüz bir hale getirmesi ve en sonunda da fiziksel saldırılarla öldürerek grubun dı şına atması durumunu ifade etmek amacıyla kullanılan ve Heinz Leynmann tarafından insan  davranışlarına  uyarlanan  mobbing  kavramı  bugüne  kadar  yüzlerce araştırmaya, tez ve makale çalışmasına konu olmuştur.1Tanım ve kavram yeni olsa da mobbingi oluşturan davranışlar kavramın ortaya çıkmasından çok daha öncesine dayanmaktadır. İnsanların iş veya görev gereği aynı ortamı paylaştıkları her yerde mobbinge rastlamak mümkündür. Çalışma ve Sosyal Güvenlik Bakanlığı tarafından kurulan mobbing hattına (ALO 170) binlerce şikâyet gelmesine karşın bunlardan çok azı dava konusu edilmekte ve açılan davalardan da çok azı ispatlanabilmektedir. Örneğin, 2010-2015 yılları arasında mobbing iddiası içeren 221 davadan sadece 54 ünde manevi tazminat talebinde bulunulmuş, bunlardan da yalnızca 11 i manevi tazminat talebinin kabulü ile sonuçlanmıştır.3 Binlerce mobbing mağduru olduğu halde bunlardan yüzlercesinin dava açması, dava açanlardan çok  azının  mobbing  nedeniyle  manevi  tazminat  talebinde  bulunması  ve talepte bulunanlardan çok azı lehine tazminata hükmedilmesi ciddi anlamda ispat sorunu olduğunu göstermektedir. Çünkü mobbing, çoğunlukla gizlice ve sinsice yürütüldüğü ve mağdur tarafından delil temin edilmesinde güçlük çekildiği için ispatlanması zor olan bir konudur. Birçok davada mobbing nedeniyle manevi tazminat talebinde bulunulduğu halde mobbinge ilişkin maddi  olgular  anlatılmamakta,  çoğu  zaman  da  mobbing  farklı  konu  ve kavramlarla karıştırılmaktadır. Örneğin, işyeri kabalığı veya işveren tarafından yapılan bir veya iki olaya ilişkin psikolojik baskı mobbing olarak algılanmakta ve manevi tazminat talebinde bulunulmaktadır. Doğal olarak bu tür davalarda mobbing iddiası unsurları oluşmadığı için reddedilmektedir. 1  Bkz. TAŞKIN, Ahmet, İş Hukuku Açısından İşyeri ve İşletmelerde Mobbing, Üç gün içinde kitap olarak yayınlanmış olacak, İstanbul Üniversitesi Adli Tıp Enstitüsü, İstanbul, 2016, s. 15 vd. 2  Bkz.www.ntv.com.tr/ekonomi/turkiyenin-mobbing-karnesi,8BnQH_8zkKZbbhJfUlAg (Erişim Tarihi: 07.03.2016) 3  Söz konusu bilgi UYAP (Ulusal Yargı Ağı Projesi) veri tabanından yapılan karar sorgulaması sonucu elde edilmiştir. 392 Gazi Üniversitesi Hukuk Fakültesi Dergisi C. XX, Y. 2016, Sa. 2Ahmet TAŞKIN Bu çalışmada mobbing tanımı yapıldıktan sonra mobbingin karıştırıldığı kavramlara yer verilmiş, ispatta yaşanan güçlükler ile buna ilişkin çözüm önerileri ve Yargıtay ın bu konuya ilişkin kararları değerlendirilmiştir. I. MOBBİNG KAVRAMI A. Kavramın Tarihsel Gelişimi Mobbing, birçok kavrama göre oldukça yeni bir kavramdır. Bu kavramın, yuvalarını korumak için saldırganın etrafında uçan kuşların davranışlarını betimlemek amacıyla 19. yüzyılda İngiliz biyologlar tarafından kullanıldığı bilinmektedir.4 Daha sonra 1960 larda, hayvan davranışlarını inceleyen bilim adamı (ethologist) Konrad Lorenz, mobbing kavramını, kuşlar gibi küçük hayvan grupları nın tilki gibi daha güçlü ve yalnız bir hayvana toplu şekilde hücum ederek uzaklaştırması ya da aynı kuluçkadan çı kan kuşlar arasında yaşanan ve diğer kuşların, aralarındaki en zayıf kuşu yiyecek ve sudan uzak tutarak dışlaması, iyice güçsüz bir hale getirmesi ve en sonunda da fiziksel saldırılarla öldürerek grubun dı şına atması durumunu ifade etmek amacıyla kullanmıştır.5 Konrad Lorenz in incelemelerine göre mobbing, küçük, güçsüz ve zayıf  hayvan  guruplarının  kendileri  için  tehdit  oluşturan  daha büyük  ve güçlü bir hayvana yönelik onu tehdit unsuru olmaktan uzaklaştırma amacını taşıyan taciz, yıldırma, bıktırma ve rahatsız etme şeklindeki davranışlarına deniyordu. Buna göre mağdurlar sayıca fazla ama güçsüz, saldırgan (mobbing eylemcisi) ise tek fakat güçlüydü. Mobbing kavramı insan davranışları ile ilişkilendirildiğinde kavramın da içeriği ve kapsamı değişmiş oldu. İnsanlar söz konusu olduğunda mobbing mağduru tek olsa da failinin sayıca çoğunlukta olması gereksiz hale geldi ve süreç içinde yatay, dikey ve düşey mobbing şeklinde üç büyük grup altında ele alındı. Buna göre mobbing faili bazen tek bazen de bir grup oldu; mağdur bazen güçlü konumdayken bazen de güçsüz konumda bulundu. Örneğin, memur veya işçi konumunda bulunan kimselerin 4    WESTHUES, Kenneth, The Mobbings at Medaille College, in 2002, Canada: University of Waterloo, October, 2002, s. 2. 5   TINAZ, Pınar, BAYRAM, Fuat ve ERGİN, Hediye, Çalışma Psikolojisi ve Hukuki Boyutlarıyla İşyerinde Psikolojik Taciz (Mobbing), Beta Yayınları, İstanbul, 2008, s. 3; GÜN, Hüseyin, Çalışma Ortamında Psikolojik Taciz: Mobbing/ Bullying, 2. Baskı, Lazer Yayınları, Ankara, 2010, s. 25; ACAR, Aslı Beyhan ve DÜNDAR, Gönen, İşyerinde Psikolojik Yıldırmaya (Mobbing) Maruz Kalma Sıklığı ile Demografik Özellikler Arasındaki İlişkinin İncelenmesi, İstanbul Üniversitesi İşletme Fakültesi Dergisi, Cilt: 37, Sayı: 2, 2008, s.112; LEYMANN, Heinz, The Content and Development of Mobbing at Work, European Journal of Work and Organizational Psychology, Volume: 5, Issue: 2, s.1996, s. 165-184; DAVENPORT, Noa, Ruth Distler, SCHWARTZ ve Gail Pursell, ELLIOTT, Mobbing İşyerinde Duygusal Taciz, Sistem Yayıncılık, İstanbul 2003, s. 3. Gazi Üniversitesi Hukuk Fakültesi Dergisi C. XX, Y. 2016, Sa. 2 393Mobbing Davalarında İspat Sorunu kendilerinden  daha  güçlü  konumda  bulunan  amirlerine  karşı  mobbing uygulaması klasik mobbing kavramına uygun olsa da bir amirin (yöneticinin, işverenin) kendinden daha güçsüz (ast veya alt kadrodakiler) çalışanlara karşı mobbing uygulaması klasik mobbing kavramına terstir. Heinz Leynmann, 1973 de ilk kez tanımlamış olduğu mobbing olgusunu. bir veya birkaç kişi tarafından diğer bir kişiye yönelik olarak, sistematik bir biçimde düşmanca ve ahlak dışı bir iletişim yönelmesi şeklinde, psikolojik bir terör olarak nitelendirmiştir.7 Mobbing kavramı, örgütte çalışanlar arasında birbirlerine karşı uygulanan benzer tipte, sistematik ve uzun dönemli düşmanca ve saldırganca davranışlar olarak tanımlanabilir. Bu açıdan mobbing, işyerinde diğer  çalışanlar  veya  işverenler  tarafından  tekrarlanan  saldırılar  şeklinde uygulanan  bir  çeşit  psikolojik  terördür.8  Söz  konusu  kavram,  çalışanlara üstleri, astları veya eşit düzeydeki çalışanlar tarafından sistematik biçimde uygulanan her tür kötü muamele, değersizleştirme (itibarsızlaştırma), tehdit, şiddet, aşağılama, küçümseme, uygunsuz şakalar ve baskı gibi davranışları ifade eden anlamlar içermektedir.9 Mobbing  kavramını,  ilk  kez  insanlar  arasındaki  bir  etkileşim tarzını betimlemek amacıyla kullanan kişi İsveçli bilim adamı Peter-Paul Heinemann dır.  Heinemann,  çocuklardan  oluşan  küçük  grup ların,  tek  ve güçsüz bir çocuğa karşı giriştiği kabadayılık ve zorbalık içeren zarar verici saldırgan davranışları mobbing kavramı ile tanımlamıştır.10 Doktor Caroll Brodsky, işyerinde mobbing davranışını tanımlayan ilk kitabını (The Harassed Worker) 1976 da yazmıştır. Brodsky kitabının başlığındaki taciz kelimesi; başkasını yıpratmak, ona eziyet etmek, onu engellemek veya ondan tepki almak amacıyla tekrar tekrar ve sürekli olarak yapılan girişimleri yapmak, sürekli diğer kişiyi kışkırtmak, ona baskı yapmak, onu korkutmak, yıldırmak, ya da rahatını kaçıran davranışlarda bulunmak anlamına kullanmıştır.11 6   SMITH, P.K. at al., Definitions of Bullying: A Comparison of Terms Used, and Age and Gender Diﬀ erences, in a Fourteen-Country International Comparison, Child Development, July-August, Volume: 73, Number: 4, 2002, s. 1119. 7  Bkz. WESTHUES, Kenneth at al, The Remedy and Prevention of Mobbing in Higher Education, Edwin Mellen Press, New York, 2006, s. 32. 8   TINAZ, Pınar İşyerinde Psikolojik Taciz (Mobbing), Beta Yayınları, İstanbul, 2006, s.11. 9    Bkz. NAMIE, Gary and NAMIE, Ruth, The bully at work. Naperville, IL: Sourcebooks Inc., 2000. 10  TINAZ/ BAYRAM/ ERGİN, s. 4; DAVENPORT/ SWARTZ/ ELLIOT, s. 3. 11  DAVENPORT/ SWARTZ/ ELLIOT, s. 4. 394 Gazi Üniversitesi Hukuk Fakültesi Dergisi C. XX, Y. 2016, Sa. 2Ahmet TAŞKIN 1988 de  İngiliz  gazeteci  Adams  BBC de  yaptığı  programlarda mobbing  olgusuna  kamuoyunun  dikkatini  çeken  ilk  isimdir.  Daha  sonra yaptığı çalışmalarını 1992 de İşyerinde Zorbalık: Nasıl Karşı Konulabilir ve Üstesinden Gelinir? kitabında yayınlamıştır. 1996 da bir başka İngiliz yazar Field, bullying kavramını insanların kendine güvenlerini ve kendine saygılarını hedef alan acımasız ve sürekli saldırı olarak tanımlamıştır. Bu davranışların altında yatan asıl sebeplerin ise insanlara hükmetme, boyun eğdirme ve örgütten uzaklaştırma isteği olduğunu vurgulamıştır.12 1998 de Duncan Chappell ve Vittorio Di Martino nun hazırlamış olduğu ve ILO tarafından yayınlanan İş Yerinde Şiddet (Violence at Work) adlı kitapta mobbing ve bullying eylemleri kapsamında şiddete yönelik davranışlar tartışılmıştır.  Bu  raporda  fiziksel  ve  duygusal  yönüyle  işyerinde  şiddet incelenerek, bu olgunun işyerlerinde görülen en ciddi sorunlardan biri olduğu vurgulanıp konuya uluslararası boyutta dikkat çekilmiştir. B. Tanım Yerli ve yabancı literatürde mobbing kavramı üzerinde fikir birliği yoktur.  Örneğin,  Björkqvist  ve  arkadaşları  tarafından  işyerinde  taciz, Baron  ve  Neuman  tarafından  işyeri  terörü  veya  şiddeti,  Ashforth tarafından zorbalık ve Anderson ve Pearson tarafından ise şiddet olarak tanımlanmaktadır.13 Kile, mobbing yerine sağlığı tehlikeye sokan liderlik, Thylefors ise başkasının suçunu yükleme terimini kullanmaktadır.14 Türk yazarlar arasında mobbing yerine İşyerinde Duygusal Taciz, İşyerinde Yıldırma, İşyerinde Ruhsal Taciz, İşyerinde Psikolojik Şiddet, İşyerinde Duygusal  Saldırı,  İşyerinde  Zorbalık,  İşyerinde  Psikolojik  Taciz, manevi taciz ve psikoşiddet gibi ifadeler kullanılmaktadır.15 Yargıtay kararlarında en sık kullanılan terim mobbing olmuştur. 12  YÜCETÜRK, Elif, Örgütlerde Durdurulamayan Yıldırma Uygulamaları: Düş mü? Gerçek mi? 11. Ulusal Yönetim ve Organizasyon Kongresi Bildiriler Kitabı, Afyon Kocatepe Üniversitesi Yayın No:57, 22-24 Mayıs, 2003, s. 3. 13  ACAR/ DÜNDAR, s.112. 14  AYDIN, Şule ve ÖZKUL, Emrah, İş Yerinde Yaşanan Psikolojik Şiddetin Yapısı ve Boyutları: 4-5 Yıldızlı Otel İşletmeleri Örneği, Anadolu Üniversitesi Sosyal Bilimler Dergisi, Cilt: 7, Sayı:2, 2007, s. 485. 15  KARAKUŞ, Hatice,Bir İçerik Analizi Örneği: Çalışma Hayatında Mobbing Olduğuna Kanaat Getiren Yargıtay Kararları, Uluslararası Sosyal Araştırmalar Dergisi, Cilt: 6 Sayı: 28, Güz 2013, s. 182; BİLGEL, Nazan, AYTAÇ, Serpil ve BAYRAM, Nuran, İşyerinde Yıldırma Davranışı, in: İşyerinde Şiddet, Ed: Serpil Aytaç ve Nuran Bayram, Beta Yayınları, İstanbul, 2011, s. 76. Gazi Üniversitesi Hukuk Fakültesi Dergisi C. XX, Y. 2016, Sa. 2 395Mobbing Davalarında İspat Sorunu Etimolojik olarak, İngilizce mob  ve Latince kararsız kalabalık anlamına gelen mobile vulgus sözcüğüne dayanan mobbingin.16 Türkçe anlamı, psikolojik taciz, psikolojik yıldırma, rahatsız etme, bezdiri, sıkıntı verme ve psikolojik baskıdır. Türk öğretisinde, kavramı ifade etmek için psikolojik  taciz,  psikolojik  sindirme  ve  psikolojik  yıldırma  deyimleri kullanılmaktadır.17  Literatüre  bakıldığında  mob  sözcüğünün,  birkaç zayıfın bir araya gelerek saldırgan davranışlar sergilemesi anlamına geldiği görülmektedir.18 Günümüzde güçlü olan kimseler tarafından zayıf kimselere yönelik  mobbing  uygulamasına  da  sık  rastlanmaktadır.  Genel  ve  yaygın anlamına bakıldığında mobbing, hem belli bir amaç için bir araya gelmiş zayıf bireylerin güçlü olanı psikolojik tacizi hem de güçlü olanın zayıf tarafı tacizi olduğu  anlaşılmaktadır.  Bir  işverenin  yasal  yükümlülüklerden  kurtulmak amacıyla  işçisini  mobbing  yoluyla  istifaya  zorlamasında  görülen  durum budur. Başka bir deyişle yukarıdan aşağıya uygulanan mobbingde fail bir grup değil, güçlü ve yetkili bir kişidir. Mobbingin  yerli  ve  yabancı  literatürde  yapılmış  onlarca  tanımı bulunmaktadır. Örneğin; Einarsen e göre bir ya da birden fazla çalışana karşı tekrarlanan, mağdurun karşı koymasına rağmen yapılan, aşağılayıcı, küçük düşürücü ve psikolojik olarak acı veren, işteki performansı engelleyen veyahut olumsuz bir çalışma ortamına neden olan bilerek veya bilmeden yapılan hareketlere mobbing denilir.19 Vandekerckhove ve Commers, mobbing kavramını; karmaşık davranışlarla karakterize edilen, işyerinde karşılaşılan ve  bir  bireye  karşı  uygulanan  zararlı  davranışlar  olarak  tanımlamıştır.20 Diğer tanımlara göre; mobbing, örgüt içinde gerilime ve çatışmalı bir iklime yol açan tüm psikolojik faktörlerin birleşimi sonucunda ortaya çıkan, örgüt sağlığını bozan, çalışanların iş doyumunu ve çalışma barışını olumsuz yönde etkileyen temel bir örgütsel sorundur ve bir işyerinde çalışanların, bir başka 16 ERDEM, Mustafa Ruhan ve PARLAK, Benay, Ceza Hukuku Boyutuyla Mobbing, TBB Dergisi, Sayı: 88, 2010, s. s.262; TINAZ/ BAYRAM/ ERGİN, s.3; YILDIZ, Selver ve KILKIŞ, İlknur, Psikolojik Taciz Olgusuna 4857 Sayılı İş Kanunu Açısından Bir Bakış, Çalışma İlişkileri Dergisi, Cilt:1, Sayı:1, 2010, s.72. 17 BOZBEL, Savaş ve PALAZ, Serap, İşyerinde Psikolojik Taciz (Mobbing) ve Hukuki Sonuçları, TİSK Akademi, Cilt: 2, Sayı; 3, 2007, s. 1. 18  CEMALOĞLU, Necati, Örgütlerin Kaçınılmaz Sorunu: Yıldırma, Bilig, Sayı: 42, 2007, s.112. 19  EINARSEN, Ståle, S. The Nature and Causes of Bullying at Work, International Journal of Manpower, Volume: 20, No:1/2, Einarsen, 1999, s. 17. 20   Bkz. VANDEKERCKHOVE, Wim  ve  COMMERS,  Ronald,  Downward Workplace Mobbing: A Sign of the Times, Journal of Business Ethics, Volume: 45, 2003, s. 41-50. 396 Gazi Üniversitesi Hukuk Fakültesi Dergisi C. XX, Y. 2016, Sa. 2Ahmet TAŞKIN kişiyi ya da kişileri rahatsız edici, ahlak dışı ve sistematik söz ve davranışlarla taciz ettikleri veya psikolojik şiddet uyguladıkları bir süreçtir.21 Uluslararası Psikolojik Stres ve Sistematik Mobbinge Karşı Çıkanlar Birliği ne göre, eşit veya eşit olmayan güce dayalı olarak bir kişinin sıkça, tekrarlı ve sistematik bir biçimde ayrımcılığa uğramasına mobbing denilmektedir.22 Mobbing, bir kişinin ya da bir grubun hedef seçilmiş kişiye karşı uyguladıkları ısrarlı, sistematik, aşağılayıcı, hakir görücü, yıldırıcı, haksız söz ve davranışlarıdır. Gücün bu şekilde kötüye kullanılması sonucunda, hedef seçilen kişi kendini altüst olmuş, tehdit altında, dışlanmış, aşağılanmış ve yaralanmış hisseder, öz güveni sarsılır, sahip olduğu yeteneklerinden şüphe etmeye başlar ve büyük bir stres altında kalır.23 Başka bir tanıma göre; mobbing; bir kişinin, diğer insanları kendi rızaları ile veya rızaları dışında başka bir kişiye karşı etrafında toplaması ve sürekli kötü niyetli hareketlerde bulunma, ima, alay ve karşısındakinin toplumsal itibarını düşürme gibi yollarla, saldırgan bir ortam yaratarak onu işten çıkmaya zorlamasıdır.24 ILO ya göre mobbing; bir veya bir grup işçiyi sabote etmek için yapılan, zalimce, kötü niyetli, intikamcı, aşağılayıcı ve eleştirici tavırlarla kendini gösteren davranış biçimi şeklinde tanımlanmaktadır. Çalışanlardan birine karşı bir araya gelinmekte ve kişiye karşı  psikolojik  yıldırma  uygulanarak,  kişi  tacize  maruz  bırakılmaktadır. Mobbing, bireyi sosyal açıdan izole eden sürekli negatif görüşler ya da eleştiriler, ofis dedikoduları ya da yanlış bilgilerin yayılımı, sorumluluğun ve görevlerin kaldırılması gibi eylemleri kapsamaktadır.25 Yargıtay HGK bir kararında öğretiye atıfta bulunarak bir mobbing tanımı yapmıştır. Söz konusu kararda  mobbing,  işyerinde  çalışanlara,  diğer  çalışanlar  veya  işverenler tarafından sistematik biçimde uygulanan, tekrarlanan her türlü kötü muamele, tehdit, şiddet, aşağılama gibi davranışlar olarak ifade edilmiştir.26  Anılan karara  göre;  mobbingin  bariz  örnekleri,  kendini  göstermeyi  engellemek, sözünü kesmek, yüksek sesle azarlamak, sürekli eleştiri, çalışan iş ortamında 21  TETİK, Semra, Mobbing Kavramı: Birey ve Örgütler Açısından Önemi, KMÜ Sosyal ve Ekonomik Araştırmalar Dergisi, Cilt: 12, Sayı: 18, 2010, s. 81. 22  GROEBLINGHOFF, Dieter ve BECKER, Michael, A Case Study of Mobbing and the Clinical Treatment of Mobbing Victims, European Journal of Work and Organizational Psychology, Vol: 5, No: 2, 1996, s. 277-278. 23  BÜTE, Mustafa, İşyerinde Psikolojik Yıldırma (Mobbing) Olgusu: Erzurum da İlaç Mümessilleri Üzerinde Bir Araştırma, 17. Ulusal Yönetim ve Organizasyon Kongresi, Eskişehir, 21-23 Mayıs 2009, s. 559. 24  DAVENPORT/ SWARTZ/ ELLIOT, s. 15. 25  When Working Becomes Hazardous, World of Work: The Magazine of The ILO, No: 26, Sept./Oct. 1998, s. 6. 26  Yargıtay Hukuk Genel Kurulu, E: 2012/9-1925. Gazi Üniversitesi Hukuk Fakültesi Dergisi C. XX, Y. 2016, Sa. 2 397Mobbing Davalarında İspat Sorunu yokmuş gibi davranmak, iletişimin kesilmesi, fikirlerine itibar edilmemesi, asılsız  söylenti,  hoş  olmayan  imalar,  nitelikli  iş  verilmemesi,  anlamsız işler verilip sürekli yer değiştirilmesi, ağır işler verilmesi ve fiziksel şiddet tehdidi gibi davranışlardır. Yargıtay ve mahkeme kararlarında bezdirme, yıldırma ve yıldırma politikası gibi terimlere çok az rastlanılmakta, bu terimlerin kullanıldığı davalarda da mobbinge bağlı manevi tazminat talebinde bulunulmamaktadır.27 C. Mobbingin Amacı Mobbingin yaygın amacı, kurban seçi len kişiyi, kendi rızasıyla veya başka bir şekilde o işyerinden uzaklaştırmaktır.28 Saldırganın temel amacı, hedef alınan kimsenin işten çıkartılması veya uzaklaştırılması ise de, tek amaç bu değildir. Amaç, mağdurun uzaklaştırılması olup, söz konusu uzaklaştırma; işten, işyerinden, işyerindeki pozisyondan veya bir kısım haklardan olabilir. İşyerinde  çalışan  kişiler  hedef  aldıklar  kişinin  terfi  etmesini  veya  prim almasını ya da başka bir birime gönderilmesini sağlamak amacıyla bu kişiye karşı mobbing uygulayabilirler. Bazen işyerindeki boşalan bir üst pozisyon için bu pozisyona aday kimseler arasında rekabet çıkabilmekte ve bu rekabet mobbinge dönüşebilmektedir. Kısaca mobbingde yegâne amaç hedef alınan işçinin işten çıkartılması değildir. D. Mobbingin Benzer Kavramlardan Farkı Mobbing, açık ve anlaşılır bir kavram olmakla birlikte kaynağı, sebepleri ve sonuçları yönünden bazı kavramlarla kolayca karıştırılabilmektedir. Bu durumu özellikle mobbinge bağlı tazminat istemiyle açılan iş davalarında görmek  mümkündür.  Mobbing,  psikolojik  baskı,  işyeri  zorbalığı (bullying), haksız takip (stalking), şiddet ve saldırganlık, örgütsel çatışma, sinizm,  yabancılaşma  ve  çalışma  koşullarının  kötüleşmesi  ile  kolaylıkla karıştırılabilmektedir. Çünkü mobbing sürecinde yaşananlar ile bu konulara ilişkin  süreçler  kısmen  de  olsa  benzerlik  göstermektedir.  Mobbingin  ne olduğunun daha iyi anlaşılabilmesi ve benzer kavramlardan kolaylıkla ayırt edilebilmesi için benzer kavramların açıklanmasında yarar bulunmaktadır. 1) Zorbalık (Bullying) Zorbalık terimi, birçok ülkede mobbing kavramıyla eş anlamda kullanılsa da, her iki kavram arasında farklılıklar söz konusudur. Zorbalığın 27  Bkz. Yargıtay 9. Hukuk Dairesi, E: 2014/36754; Yargıtay 9. Hukuk Dairesi, E: 2014/37868; Yargıtay 9. Hukuk Dairesi, E: 2014/ 20094. 28 TINAZ, Pınar, İşyerinde Psikolojik Taciz (Mobbing): Kavram, Süreç, Tanı ve Çözüm Önerileri, in: CHD, Yıl: 4, Sayı: 11, Aralık 2009, s. 11. (Tanı ve Çözüm Önerileri). 398 Gazi Üniversitesi Hukuk Fakültesi Dergisi C. XX, Y. 2016, Sa. 2Ahmet TAŞKIN fiziksel  olduğu  kadar  duygusal  ve  psikolojik  olanı  da  bulunmaktadır.29 Merkezi  Amerika da  bulunan  İşyeri  Zorbalığı  Enstitüsü ne  (Workplace Bullying Institute) göre zorbalık, bir veya birden fazla kimseye yönelik, sözlü taciz, tehdit, aşağılama, gözdağı verme, işe müdahale etme, işi önleme veya işin yapılmasını engelleme şeklindeki sağlığa zarar veren saldırgan davranışlardır.30 Kısaca zorbalık, mağduru hedef alan ve onu kontrol altında tutmayı amaçlayan tekrar edici zararlı ve kasıtlı kötü davranışlardır.31 Zorbalık (zorbalık) okulda, işyerinde, ailede, toplumda, komşulukta ve birçok yerde karşımıza çıkmaktadır. 2) Saldırganlık ve Şiddet Dünya Sağlık Örgütüne (WHO) göre şiddet; fiziksel bir gücün veya baskının kasıtlı olarak bireyin kendisine, başka birine veya bir gruba veya topluma yöneltilmesi ve bunun sonucunda yaralanma, ölüm, psikolojik zarar, gelişim bozukluğu veya yoksunluk durumun ortaya çıkması veya ortaya çıkma olasılığının yüksek olmasına neden olacak şekilde kullanılmasıdır.32 Saldırganlık, bir başka kişiye fiziksel veya psikolojik zarar verme niyetiyle sözlü veya fiziksel davranışta bulunma veya başkalarını inciten, zarar veren veya incitme ve zarar verme ihtimali olan davranışlar şeklinde tanımlanabilir.34 İşyerindeki  saldırganlık,  bireylerin  daha  önce  birlikte  çalıştıkları  ya  da halen çalışmakta oldukları bireylere ya da kurumlara zarar verme amacıyla gerçekleştirdikleri davranışları içerir.35 3) İşyeri Kabalığı İşyeri  kabalığı  (workplace  incivility),  mobbingden  ayrıldığı  gibi işyeri  zorbalığından  da  (bullying)  farklı  bir  kavramdır.  İşyerinde  taciz (mobbing), saldırı (aggression, assault) ve bullying (zorbalık) konularına 29  BRİDGE, Berna, Zorbalık-Mobbing: Bilinmeyen Çeşitleri ve Çözümleri, 2. Baskı, Beyaz Yayınları, İstanbul, 2010, s. 14. 30  CALVIN, Dan, Workplace Bullying Statutes And The Potential Eﬀ ect On Small Business, Ohio State Entrepreneurial Business Law Journal, Volume: 7, No:1,  2012, s.167. 31  CALVIN, s. 170. 32  DURSUN, Salih, İşyeri Şiddetinin Çalışanların Tükenmişlik Düzeyi Üzerine Etkisi: Sağlık Sektöründe Bir Uygulama, Çalışma İlişkileri Dergisi, Cilt: 3, Sayı: 1, Ocak, 2012, s. 106. 33 ÖZEN, Yener,  Saldırganlık,  Psikolojik  Şiddet  ve  Duygusal  Zekâ Arasındaki  İlişki, Akademik Bakış Dergisi, Sayı: 35, 2013, s.2. 34 TEVRÜZ,  Suna,  ERDEM,  İnci  ve  BOZKURT,  Tülay,  Davranışlarımızdan  Seçmeler: Örgütsel Yaklaşım, 3. Baskı, Nobel Yayınları, Ankara, 2012, s.151. 35 SOLMUŞ, Tarık, İşyeri Terapisi: İş Yaşamında Kişilik ve Davranış Sorunları, Papatya Yayıncılık, İstanbul, 2010, s. 79. Gazi Üniversitesi Hukuk Fakültesi Dergisi C. XX, Y. 2016, Sa. 2 399Mobbing Davalarında İspat Sorunu olabildiğince  ilgi  gösterilmesine  rağmen  basit  kabalığa,  nezaketsizliğe, davranışlarda  düşüncesizliğe,  saygısızlığa  ve  bunların  etkilerine  çok  az ilgi gösterilmiştir.36 Bununla birlikte söz konusu kavram son dönemlerde literatürde çok popüler olmaya başlamış ve araştırmalarda daha fazla dikkat çekmiştir.37 İşyeri kabalığı ile mobbing birbirine benzerlik gösterse de temel olarak birbirinden çok farklıdır. Mobbing; bir ya da birden fazla kişinin, bir kişiyi hedef alarak, kasıtlı olarak sistematik bir biçimde, ahlaki olmayan ve düşmanca davranışlarda bulunması ve bu davranışlar sonucunda kişinin savunmasız  ve  çaresiz  bir  duruma  itilmesiyken  işyeri  kabalığı,  pek  çok noktada bu kavramdan farklılaşmakta ve daha genel bir davranış biçimi olarak ortaya çıkmaktadır.38 Bu kavramın mobbingden ayrıldığı nokta, daha genel bir davranış biçimi olmasıdır. İşyerinde mobbing, bir veya birkaç kişiye yönelik olarak gerçekleştirilebilmekte iken, işyerinde kabalık herkese yönelik olabilmektedir.39 4) İş Sürtüşmesi, Örgütsel Çatışma, Sinizm ve Yabancılaşma Her işyerinde çalışanların sinirlendiği, stresin doruk noktaya çıktığı o an için meslektaşına kırıcı sözlerin söylendiği, sürtüşmelerin yaşandığı anlar olabilir. Bu kısa süreli tartışma, sürtüşme anı mobbing sayılmaz. Mobbing sayılması için kasıtlı ve sistematik olarak, olaya değil kişiye odaklanmış ve uzun bir zamandan beri devam ediyor olması gerekmektedir.40 İş sürtüşmesi işyeri kabalığından farklı bir kavramdır. İşyeri kabalığında işe ilişkin belli bir konu yoktur veya kabalıkta bulunan kişi belli bir konuda kaba davranmıyordur. Kabalık sürekli bir olgudur ve belli bir kişiye yönelik değildir. İş sürtüşmesi ise işyerinde bir işin yürütümü, paylaşımı veya yerine getirilmesinde yaşanan ihtilaﬂ a ilgilidir. Bazen çalışanlar yapılması istenen işin kendi işleri olmadığını veya tam tersine kendi işleri olduğunu ileri sürebilirler ya da bir işin nasıl yapılması gerektiği konusunda aralarında tartışabilirler. 36  MARTIN, Roberta, Workplace Incivility, Allworth Juniper, Issue:7, Autumn, 2003, s. 1. 37 TRUDEL, Jeannie, Workplace Incivility: Relationship With Conﬂ ict Management Styles and Impact on Perceived Job Performance, Organizational Commitment and Turnover, College of Education and Human Development Department of Leadership, Foundations and Human Resource Education University of Louisville, KY, August 2009, s. 2 38 DELEN, Meltem Güngör, Çalışma Hayatında İşyeri Kabalığı Olgusu, Maliye Araştırma Merkezi Konferansları, Sayı: 53, 2010, s. 46. 39  ÇUKUR, Cengiz, İşyerinde Psikolojik Taciz (Mobbing), ÇEİŞ, Mart, 2012, s. 37 40  KAYA, Çiğdem, Cerrahi Hemşirelerinin Mobbinge Maruz Kalma Durumlarının Belirlenmesi ve Mobbingin Hemşirelerin Motivasyonları Üzerine Olan Etkisinin İncelenmesi, Yüksek Lisans Tezi, Afyon Kocatepe Üniversitesi SBE, Afyonkarahisar, 2012, s. 12; ATASOY, Sağlık Sektöründe Mobbing: Sakarya İlinde Kamu ve Özel Hastanelerde Çalışan Ebe ve Hemşireler Üzerine Bir Araştırma, Yüksek Lisans Tezi, Sakarya, 2010, s. 16-17. 400 Gazi Üniversitesi Hukuk Fakültesi Dergisi C. XX, Y. 2016, Sa. 2Ahmet TAŞKIN Örgütsel çatışma kavramı, örgütte, iki veya daha fazla kişi veya grup arasındaki kıt kaynakların paylaşılması veya faaliyetlerin tahsisi ile yine bu kişi veya gruplar arasındaki statü, amaç, değer ve algı farklılıklarından kaynaklanan anlaşmazlık ya da uyuşmazlık şeklinde tanımlanabilir. Nasıl tanımlanmış olursa olsun, anlaşmazlık, zıtlaşma, uyumsuzluk ve birbirine ters düşme çatışmanın temel unsurlarını meydana getirir. Bu unsurların esas olduğu bir ortamda taraﬂ ar, kendi çıkarlarını gerçekleştirmek veya görüşlerini hâkim kılmak çabası içine girerler.41 İşyerinde veya işletmelerde çatışmalar; bir çalışanın kendi içinde, çalışanın diğer bir çalışanla, bir işçinin bir gurupla ya da gurubun diğer bir grupla çatışması şeklinde görülür.42 Çatışma, iki veya daha fazla kişi ya da grup arasındaki çeşitli sebeplerden doğan anlaşmazlıkları ifade etmekte, kişiliği hedef almamakta, esasen işin yapılış şekli üzerindeki fikir ayrılıklarına odaklanmaktadır. Mobbingde ise anlaşmazlığın görünümü ahlak dışı ya da kişiliğe yönelik haksız ve olumsuz davranışlar şeklinde ortaya çıkmakta, bu davranışlar süreklilik göstermekte ve sonuçları mağdur açısından ağır olmaktadır. Sinizm; özellikle insanların gizli, açığa vurulmamış amaçları hakkında kötümser ve hayal kırıklığına dayalı olarak olayları açıklama tutumu ile kendi çıkarlarını korumak veya artırmak için sırf araç olarak başkalarıyla ilgilenme ve işleri idare etme eğilimi olarak açıklanmaktadır.43 Bir tanıma göre örgütsel sinizm,  örgüt  içindeki  insanların  bir  bölümünde  bulunan,  örgütlerinin dürüstlükten yoksun olduğuna ve adalet, içtenlik, doğruluk gibi ilkelerin örgütün çıkarlarına feda edildiğine dair bir inançtır.44 Örgüt yönetimlerinin birçok hatalı ve başarısız uygulamaları neticesinde ortaya çıkan örgütsel problemler ve yaşanılan kriz ve skandallar, çalışanlarda örgütlerine yönelik ciddi şekilde güvensizlik, yılma, monotonluk, tedirginlik, kuşku, yabancılaşma ve benzeri bir takım olumsuz düşünce, tutum ve davranışların gelişmesine sebebiyet vermiş; sinizm de bu olumsuz düşünce ve tutumların en yaygın 41 ŞİMŞEK, M. Şerif, AKGEMCİ, Tahir ve ÇELİK, Adnan, Davranış Bilimlerine Giriş ve Örgütlerde Davranış, 7. Baskı, Gazi Kitabevi, Ankara, 2011, s. 353; KILIÇ, Mustafa, Örgütsel Çatışma ve Yönetimi, in: Yönetim ve Organizasyon, Ed: Salih Güney, 2. Baskı, Nobel Yayınları, Ankara, 2007, s. 104. 42 ŞİMŞEK/ AKGEMCİ/ ÇELİK, s. 359. 43 TOKGÖZ, Nuray ve YILMAZ, Hakan, Örgütsel Sinisizm: Eskişehir ve Alanya daki Otel İşletmelerinde Bir Uygulama, Anadolu Üniversitesi Sosyal Bilimler Dergisi, Cilt: 8, No: 2, 2008, s. 285. 44 TOKGÖZ, Nuray, Örgütsel Sinisizm, Örgütsel Destek ve Örgütsel Adalet İlişkisi: Elektrik Dağıtım İşletmesi Çalışanları Örneği, Eskişehir Osmangazi Üniversitesi İİBF Dergisi, Cilt: 6, Sayı: 2, Ekim, s. 365; BEDEIAN, A.G., Even if the Tower is Ivory, It isn t White: Understanding the Consequences of Faculty Cynicism, Academy of Management Learning & Education, Volume: 6, No: 1, 2007, s.11. Gazi Üniversitesi Hukuk Fakültesi Dergisi C. XX, Y. 2016, Sa. 2 401Mobbing Davalarında İspat Sorunu görülenlerinin  başında  yer  almıştır.45  Bireylerin  yalnız  kendi  çıkarlarını gözettiğine inanan ve buna göre herkesi çıkarcı kabul eden kimse sinik ve bunu açıklamaya çalışan düşünce sinizm olarak tanımlanmaktadır.46 İşe yabancılaşma, işçinin işini anlamsız bulması; örgütünde kurduğu ilişkilerden doyum sağlayamaması; kendisini yalnız, yetersiz, güçsüz görmesi; geleceğe ilişkin  umutlarını  yitirmesi  ve  kendisini  sistemin  basit  bir  çarkı  olarak algılaması  biçiminde  tanımlanmaktadır.47  İşe  yabancılaşma  kavramı,  bu doğrultuda örgütsel sinizm kavramının sonuçlarıyla ilişkili görünmektedir.48 Yabancılaşma,  bazen  topluma,  bazen  insanın  kendisine,  bazen  de  işe yabancılaşma şeklinde ortaya çıkmaktadır.49 5) Haksız Takip (Stalking) Stalking kelimesi İngilizceden gelmekte olup, bir kişinin kasıtlı ve ısrarlı bir şekilde belli bir süre takip ve taciz edilmesi, sinsice izlenmesi ve gözlenmesi anlamına gelmektedir (www.ldoceonline.com). İngilizce kökenli olan bu kavram avcıların kendi aralarında kullandıkları argo dilinden ortaya çıkmış ve kelime olarak ava sessizce ve dikkatlice yaklaşmak, avlamaya hazır halde beklemek veya hedefi belirlemek ve gerekli araçlarla gizli ve dikkatlice yaklaşmak anlamında kullanılmıştır.  Stalking kavramı, 1993 yılında bir adli tıpçı tarafından bir kimsenin izni olmadığı halde obsessiv ve normal olmayan bir biçimde tehdit veya taciz edilmesi olarak tanımlanmış ise  de  halen  genel  kabul  gören  bir  tanım  yapılmamıştır.50  Bazı  yazarlar 45 Bkz. GÜL, Hasan ve AĞIRÖZ, Aliye, Mobbing ve Örgütsel Sinizm Arasındaki İlişkiler: Hemşireler Üzerinde Bir Uygulama, Afyon Kocatepe Üniversitesi, İİBF Dergisi, Cilt: XIII, Sayı: II, 2011, s. 27-47. 46 TOPÇU,  İbrahim  vd.,  Sağlık  Çalışanlarında  Örgütsel  Sinizm  Ölçeğinin  Geçerlik  ve Güvenirliği, Dokuz Eylül Üniversitesi Hemşirelik Yüksekokulu Elektronik Dergisi, Cilt: 6, Sayı: 3, 2013, s. 125; SAĞIR, Tuba ve OĞUZ, Ebru, Öğretmenlere Yönelik Örgütsel Sinizm Ölçeğinin Geliştirilmesi, International Journal of Human Sciences, Volume: 9, Issue: 2, 2012, s. 1094; KÂHYA, Cem, Örgütsel Sinizm, İş Performansını Etkiler mi? İş Tatminin Aracılık Etkisi, Küresel İktisat ve İşletme Çalışmaları Dergisi, Yıl: 2, Sayı: 3, Bahar, 2013, s. 35. 47 FETTAHLIOĞLU, Tamara, Örgütlerde Yabancılaşmanın Yönetimi: Kahramanmaraş Özel İşletme ve Kamu Kuruluşlarında Karşılaştırmalı Bir Araştırma, Kahramanmaraş Sütçü İmam Üniversitesi SBE, Yüksek Lisan Tezi, Kahramanmaraş, 2012, s. 32 vd. 48 YILDIZ, Kaya, AKGÜN, Nuri ve YILDIZ, Sevilay, İşe Yabancılaşma ile Örgütsel Sinizm Arasındaki İlişki, The Journal of Academic Social Science Studies, Volume: 6, Issue: 6, Haziran, 2013, s. 1263-1264. 49 FETTAHLIOĞLU, s. 31. 50 ÜNVER, Yener, Ceza Hukuku Açısından Mobbing, Stalking ve Cinsel Taciz Eylemleri, CHD, Yıl: 4, Sayı: 11, Aralık 2009, s.10. 402 Gazi Üniversitesi Hukuk Fakültesi Dergisi C. XX, Y. 2016, Sa. 2Ahmet TAŞKIN stalking kelimesini saplantılı takip51 bazıları da ısrarlı takip52 olarak kullanmaktadır. Bu kavram, bir kimsenin sosyal yaşamında tek yönlü iletişim ve asimetrik bir ilişki kurmaya çalışması, bunu yaparken de ilişki ve iletişim kurmaya çalıştığı kişiye psikolojik olarak kasıtlı şekilde zarar vermesi ve ancak bunu saplantılı bir hale getirmesidir.53 Diğer bir ifadeyle stalking, bir kişinin, bir başka kişiyi, belli bir süre ve tekrarlanan davranışlarla hukuka aykırı olarak ısrarla takip ve taciz etmesi anlamına gelir.54 Kısaca stalking, bir insanın diğerine karşı ruhsal ve psikolojik açıdan kasıtlı şekilde zarar verici ve rahatsız edici bir dizi davranışta bulunmasıdır. Örneğin; sürekli telefon etme, mektup yazma, e-posta gönderme, not bırakma, izleme, takip etme, kontrol etme, eve veya ofiste çalışma odasına girme, çiçek veya benzeri hediyeler gönderme, iş girişinde ya da çıkışında bekleme, asılsız dedikodular yayma ve hatta şiddet uygulamaları birer stalking olarak ortaya çıkmaktadır.55 Mağdur, söz konusu davranışlarda adeta terörize edilmekte, hayatının birçok anı fail tarafından çekilmez hale getirilmektedir. Öyle ki mağdur ilerleyen süreç içinde evinde veya yalnız kaldığı yerlerde bile her an bir telefon alacak veya faili karşısında bulacak gibi tedirgin olmaktadır. 6) Psikolojik Baskı Mobbing ile en çok karıştırılan ve çoğu zaman da birlikte kullanılan kavram  psikolojik  baskıdır.  İnsanların  düşünce,  davranış  ve  iradeleri üzerindeki her zorlayıcı ve baskılayıcı söz, tutum, hukuki tasarruf ve davranış psikolojik baskı teşkil edebilir. Mobbingde de kişinin psikolojisi, duygu, düşünce ve ruhsal yapısı üzerinde manevi bir baskı söz konusudur. Ancak mobbingde bu durum uzun süreli, sık sık tekrarlanan, belli bir amaca yönelik olan sistemli bir harekettir. Psikolojik baskıda sistematik ve sürekli haksızlık veya olumsuzluk yoktur. Çalışana, Ya istifa edersin ya da senin hakkında hırsızlıktan soruşturma açar ve öyle işten çıkartırım ya da Ya diğer ildeki büroda  çalışmayı  kabul  edersin  ya  da  çıkarsın  demek  birer  psikolojik baskıdır. Çalışan sürekli soruşturmalara maruz bırakılıyor veya sürekli yeri 51 BAĞ, Beyhan, Bir Şiddet Türü Olarak Saplantılı Takip Etme Hali, ZfWT Vol. 4, No. 1, 2012, s. 165. 52 TÜRKMEN, Ahmet, Yeni Bir Hukuki Olgu Olarak Israrlı Takip ve Taciz (Stalking) ve Bunun Türk Medeni Hukuku Bakımından Değerlendirilmesi, DEÜHFD, Cilt: 11, Özel Sayı, 2009, s. 1387. 53 TAŞKIN, Ahmet, İşyerinde Mobbing ve Mobbing Benzeri Davranışlar, Yargıtay Dergisi, Cilt: 39, Sayı: 3, Temmuz 2013, s.156. 54 TÜRKMEN, s. 1387. 55 TÜRKMEN, s.1390. Gazi Üniversitesi Hukuk Fakültesi Dergisi C. XX, Y. 2016, Sa. 2 403Mobbing Davalarında İspat Sorunu değiştiriliyorsa ve bu durum bitecek gibi görülmüyorsa mobbingden söz edilir. Bazen işyerinde bir veya birkaç işçiye yönelik psikolojik baskı olabileceği gibi tüm işçilere yönelik baskı da olabilir. Örneğin, yetişmesi gereken siparişlerin zamanında teslimi için işçilere daha fazla ve daha özenle çalışmalarını aksi takdirde pirim ödemesinin yapılmayacağını söylemek ve adeta onlara nefes aldırmamak  hem  stres  nedeni  hem  de  bir  psikolojik  baskıdır.  Birçok  iş davasında işveren tarafından işçiler üzerinde psikolojik baskı yapıldığı iddia edilmekte, ancak çoğu iddialar soyut kalıp ispatlanamamaktadır.56 Mahkeme tarafından psikolojik baskının varlığı kabul edilse de bu husus mobbing olarak değerlendirilmemektedir. Çünkü her mobbing de psikolojik taciz bulunsa da her psikolojik baskı mobbing oluşturmamaktadır. 7) Çalışma Şartlarının Kötüleşmesi ve Yönetim Hakkının İstismarı Genellikle  işçiler  çalışma  şartlarının  işyeri  uygulaması  olarak ağırlaştırılmasını ya da kötüleşmesini psikolojik baskı ve mobbing olarak görebilmektedir. Örneğin, İzmir 6. İş Mahkemesi; kendi görev tanımı haricinde birçok işi yapmak zorunda bırakıldığını, normal şartlar altında çalışması gereken saatler dışında gece 00.00 ve 02.00 sularına kadar çalıştırıldığını, hafta sonları fazla mesai yaptırıldığını, tüm bunlara rağmen maaşına zam dahi yapılmadığını, işe başlama öncesinde lojman sözü verilmesine rağmen bu sözün tutulmadığını, kirli ve rahat olmayan alelade odalarda kalmaya zorlandığını beyanla mobbinge maruz kaldığını ileri süren bir işçinin mobbing iddiasını yerinde görmemiş ve bu yönde vermiş olduğu karar Yargıtayca da onanmıştır.58 Yine bir davada; bir başka işverene devredilen bir otelde yeni işveren yeni yönetim oluşturmaya çalışmış, verim alamadığı bazı işçilerle sorun yaşamış, bazılarının işten ayrılması için ikale yoluna gitmiş, yoğun ve stresli ortamın neden olduğu olumsuzluklar yüzünden işten çıkan bir işçi mobbing iddiasıyla manevi tazminat davası açmış, yerel mahkeme koşulları oluşmadığı gerekçesiyle mobbing iddiasını reddetmiş ve bu karar Yargıtay tarafından onanmıştır.60 Yönetim hakkının kötüye kullanımı veya çalışma şartlarının kötüleşmesi bir işçiye yönelik ise ve bu durum belirli aralıklarla sürekli tekrarlanıyorsa mobbingden söz edilebilir. Çalışma koşullarının kötüleşmesi iş sözleşmesinin işçi tarafından haklı nedenle feshedilme nedenidir.  56  Bkz. Yargıtay 22. Hukuk Dairesi, E: 2013/949. 57  Bkz. İzmir 6. İş Mahkemesi, E: 2011/828. 58  Bkz. Yargıtay 9. Hukuk Dairesi, E: 2012/33378 59  Bkz. İzmir 6. İş Mahkemesi, E: 2011/828. 60  Bkz. Yargıtay 9. Hukuk Dairesi, E: 2012/33373; Yargıtay 9. Hukuk Dairesi, 2012/33374; Yargıtay 9. Hukuk Dairesi, E: 2012/33375. 404 Gazi Üniversitesi Hukuk Fakültesi Dergisi C. XX, Y. 2016, Sa. 2Ahmet TAŞKIN E. Mobbingin Görülme Sıklığı İşyerlerinde  Mobbingin  Önlenmesi  kapsamında  2011/2  sayılı Başbakanlık Genelgesi 19.03.2011 tarih ve 27879 nolu sayı ile Resmi Gazetede yayınlanarak yürürlüğe girmiştir. Genelgenin 4. Maddesi gereği Psikolojik tacizle mücadeleyi güçlendirmek üzere Çalışma ve Sosyal Güvenlik İletişim Merkezi ALO 170 üzerinden psikologlar vasıtasıyla çalışanlara yardım ve destek sağlanmaktadır. Çalışma ve Sosyal Güvenlik İletişim Merkezine 15 Kasım 2010 – 31 Aralık 2012 tarihleri arasında 5.007.377 çağrı gelmiştir. 2012 yılında ise, 2011 yılına göre çağrı sayısında % 61 lik bir artış gerçekleşmiştir. 2012 yılında ALO 170 e gelen 3.015.944 çağrının %89,36 ına karşılık gelen 2.695.198 i karşılanmıştır. 19.03.2011 - 31.12.2012 tarihleri arasında toplam 4.851 adet mobbing ile ilgili çağrı alınmıştır. Çağrıların % 65 i özel sektör çalışanlarından (3.131); % 35 i ise kamu sektörü çalışanlarından (1.720) gelmiştir. 2.626 çağrı (% 54) erkeklerden, 2.225 çağrı (% 46) ise bayanlardan gelmiştir. Mobbing şikâyeti ile çağrı merkezini arayan özel sektörler ve arama sayısı şöyledir: Sanayi sektörü 495, mağaza, restoran ve market sektörü 320, özel sağlık kuruluşları 189, turizm işletmeleri 153, belediye taşeron firma çalışanları 126, hizmet sektörü 107, inşaat sektörü 103, bankacılık 102 ve iletişim hizmetleri 74 (www.csgb.gov.tr). Çalışma ve Sosyal Güvenlik Bakanlığı tarafından kurulan mobbing hattına binlerce şikâyet gelmesine karşın bunlardan çok azı dava konusu edilmekte, açılan davalardan da çok azı ispatlanmaktadır. Örneğin, 2010-2015 yılları arasında mobbing iddiası içeren 221 davadan sadece 54 ünde manevi tazminat talebinde bulunulmuş, bunlardan da yalnızca 11 i manevi tazminat talebinin kabulü ile sonuçlanmıştır.61 Binlerce mobbing  mağduru  olduğu  halde  bunlardan  yüzlercesi  dava  açıyor,  dava açanlardan çok azı mobbing nedeniyle manevi tazminat talebinde bulunuyor ve talepte bulunanlardan çok azı lehine manevi tazminata hükmediliyorsa bu durum ciddi anlamda ispat sorunu olduğunu göstermektedir. Çünkü mobbing çoğunlukla gizli ve sinsice yürütüldüğü ve mağdur tarafından delil temin edilmesinde güçlük bulunduğu için ispatlanması zor olan bir konudur. II. HUKUKTA İSPAT A. İspat Kavramı Sözlükte ispat kelimesi, bir şeyi açıklığa kavuşturma, güvenilir, sağlam şeyi ikame etme, gerekli delilleri sağlama, bir hak veya vakıanın gerçekliğini 61 Söz konusu bilgi UYAP (Ulusal Yargı Ağı Projesi) veri tabanından yapılan karar sorgulaması sonucu elde edilmiştir. Gazi Üniversitesi Hukuk Fakültesi Dergisi C. XX, Y. 2016, Sa. 2 405Mobbing Davalarında İspat Sorunu delillerle ortaya koyma anlamlarına gelir.62 Hukukta ispat, bir davada ileri sürülen iddia ve müdafaaların doğruluğuna, gerçeği yansıttıklarına hâkimi inandırma işidir.63 Türk hukukunda da ispat faaliyetinin hedefi olarak makul, ortalama  bir  kişinin  ikna  edilmesi  (objektiﬂ eştirme  teorisi)  veya  mutlak anlamda objektif gerçeğin bulunması (objektif teori) yerine; hâkimin ikna edilmesidir.64 Hâkimin inandırılması ise delillerle olur.65 Yani ispatın yegâne vasıtası delillerdir. Delile rağmen yorum ve kanuna rağmen hüküm olamaz. Hâkim; delilleri, maddi olguları ve kanunu yorumlayarak bir hüküm verir. Toplum hayatında insanlar arasında meydana gelen anlaşmazlıkların çoğunluğunun çözümü için yargıya başvurulmaktadır. Anlaşmazlıkların, ihtilaf konusu olan hak ve olayların adalet sınırları dâhilinde incelenerek saptanması ve çözüme kavuşturulmaları için, iddia konusu olan şeylerin ispat edilmesi gerekir. Bir hak hakikatte var olsa bile, hakkın varlığı ihtilaf halinde ispat olunmadığı takdirde, o hak elde edilemez. Dolayısıyla hakkın varlık ve sübutunun objektif hale gelebilmesi, herkes tarafından tanınıp, devletin ilgili kurumları vasıtasıyla sahibine verilebilmesi onun ispat edilmesine bağlıdır. Herhangi bir hukuk normunun uygulanması, o normla düzenlenen olumlu veya olumsuz olayın somut olarak gerçekleşmiş bulunmasına bağlıdır. Yani hukuk kuralının soyut olarak düzenlediği ve bir hukuki sonuç bağladığı olaylar, somut olarak gerçekleşmiş bulunmadıkça o kural uygulanamaz ve öngörülen hukuki sonuç doğmaz.66 Usul hukukunda kural olarak mahkemenin pasiﬂ iği ilkesi nedeniyle, hukuki sonucun doğumunu ileri süren tarafın iddiasını somut olayda ispatı gerekir, işte ispat, dava konusu hakkın veya buna karşı yapılan savunmanın dayandığı vakıaların var olup olmadığı hakkında mahkemeye kanaat verilmesi işlemi veya ikna faaliyetidir. Dava konusu hakkın ve buna karşı yapılan savunmanın dayandığı vakıaların var olup olmadıkları hakkında 62 TENGER, Feyza, İslâm Hukukunda Hâkimin Takdir Yetkisi Bağlamında Kendi Bilgisiyle Hüküm Vermesi, Yüksek Lisans Tezi, Ankara Üniversitesi Sosyal Bilimler Enstitüsü, Ankara, 2006, s. 13. 63 YILMAZ, Ejder, Hukuk Sözlüğü, Ankara, 2002, s. 575; ALBAYRAK, Hakan, Yaklaşık İspat, Yayımlanmış Doktora Tezi, Selçuk Üniversitesi SBE, Konya, 2012, s. 5; Bkz. KURU, Baki, Hukuk Muhakemeleri Usulü, 6. Baskı, Demir Demir Yayıncılık, İstanbul 2001, s. 1966. 64   Bkz. ATALAY, Oğuz, Medenî Usul Hukukunda Menfi Vakıaların İspatı, İzmir, 2001, s. 41. 65  KARAMAN, Hayreddin, Ana Hatlarıyla İslâm Hukuku-Giriş ve Amme Hukuku-, Acar Matbaacılık, İstanbul 1987, I/330; Fahrettin Atar, İslâm Adliye Teşkilatı, Gaye Matbaası, Ankara 1979, s.190. 66 TAŞPINAR, Sema, Fiili Karinelerin İspat Yükünün Dağılımındaki Rolü, AÜHFD, Cilt: 45, Sayı: 1-4, 1996, s. 543. 406 Gazi Üniversitesi Hukuk Fakültesi Dergisi C. XX, Y. 2016, Sa. 2Ahmet TAŞKIN mahkemeye kanaat verilmesi işlemine ispat denir. Kısaca ispat, bir vakıanın doğruluğuna hâkimi inandırmaktır.67 Yargılamada ispat hakkı, Anayasa nın 36. maddesi uyarınca temel haklardandır. Anayasa ya göre, Herkes, meşru vasıta ve yollardan faydalanmak suretiyle yargı mercileri önünde davacı veya davalı olarak iddia ve savunma ile adil yargılanma hakkına sahiptir. Benzer düzenleme 6100 sayılı HMK nın 189. maddesinde de yer almaktadır.  Dava konusu hakkın ve buna karşı yapılan savunmanın dayandığı vakıaların var olup olmadığı hakkında mahkemeye kanaat verilmesi işlemine ispat denir.68 İspat, dava konusu hakkın veya buna karşı yapılan savunmanın dayandığı vakıaların var olup olmadığı hakkında mahkemeye kanaat verilmesi işlemi veya ikna faaliyetidir. İspat hukukunda karinelerin yeri büyüktür. Sözlük anlamıyla karine; karışık bir iş veya meselenin anlaşılmasına ve çözümlenebilmesine yarayan iz, ipucu; bir durumun anlaşılmasına yardım eden hal ve belirtidir. Karineler, bir hukuki durumun aydınlanması, bir hukuki görüşe güvenin korunması veya muamele hayatının özel gereklerinin karşılanması şeklinde bir ispat zorunluluğunu kaldırması yahut kurumların varlığının korunması gibi çeşitli amaçlara hizmet eder.69 Kanuni karine, belli bir olaydan belli olmayan olay için kanun tarafından çıkarılan sonuçlardır.70 Doktrinde kanuni karineler, kendi  içlerinde  aksinin  ispat  edilip  edilememesine  göre  veya  bir  hakkı, olayı  göstermelerine  göre  çeşitli  ayrımlara  tabi  tutulmaktadır.  Bunlardan birisi karinelerin aksi ispat edilemeyenlerinin kesin, diğerlerinin adi karine sayılması şeklindedir. Diğer bir ayrım ise karineleri hak karineleri ve olay karineleri şeklinde ayırmaktadır.71 Delilsiz bir hüküm olmayacağı gibi delile rağmen adil bir hüküm de  kurulamaz.  Çünkü  medeni  usul  hukukunda  yargılamanın  amacı  ceza yargılamasında olduğu gibi maddi gerçeğe ulaşmaktır.72 Bununla birlikte medeni yargılamada maddi gerçeğe ulaşma mutlak anlam taşımaz. Taraﬂ ardan 67  TAŞPINAR, s. 543; Bkz. KURU, Baki, ARSLAN, Ramazan ve YILMAZ, Ejder, Medenî Usul Hukuku, 22. Bası, Ankara 2012, s. 357; Bkz. ATALAY, s. 5. 68 GÜMAN, Nihat, Medeni Yargılama Hukuku Açısından Taciz, CHD, Yıl: 4, Sayı: 11, Aralık 2009, s. 202. 69  KOÇHİSARLIOĞLU, Cengiz, Karine ve Borçlar Kanununun 96. Maddesindeki Kusur Karinesi, Yargıtay Dergisi, Cilt: 10, Temmuz, Sayı: 3, 1984, s. 272-273. 70  UMAR, Bilge ve YILMAZ, Ejder, İspat Yükü, İstanbul, 1980, s. 165. 71  TAŞPINAR, s. 544. 72  PEKCANITEZ, Hakan, ATALAY, Oğuz ve ÖZEKES, Muhammet, Medeni Usul Hukuku, 13. Bası, Yetkin Yayınları, Ankara, 2011, s. 47. Gazi Üniversitesi Hukuk Fakültesi Dergisi C. XX, Y. 2016, Sa. 2 407Mobbing Davalarında İspat Sorunu birisi ileri sürdüğü delili pek ala geri çekebilir. Vazgeçilen delili hâkim değerlendiremez. Oysa ceza yargılamasında hukuka uygun olan her delil değerlendirilir ve hükme esas alınabilir. Taraﬂ ardan biri, dayandığı vakıaların doğru olduğunu veya karşı tarafın dayandığı vakıaların doğru olmadığını ispat  ederek  davayı  kazanır  veya  reddini  sağlayabilir.73  Yargılamanın başında  iddia  edilen  ve  devamında  ispatına  çalışılan  gerçeğe  ulaşmak, mahkemenin değerlendirme, yorum ve takdiri ile mümkündür. Bu kapsamda mahkemeyi hükme götürücü bir kanaatin oluşabilmesi için taraﬂ arın, iddia ve savunmalarının temelini teşkil eden maddi olguların yanı sıra bu olguların dayandığı delilleri de mahkemeye sunmaları gerekmektedir.74 Bugün için medeni usul hukukunda taraﬂ arca getirilme ilkesi geçerli olduğundan dava malzemeleri, taraﬂ arca toplanır ve mahkemeye sunulur. Dolayısıyla taraﬂ arca ileri sürülmeyen olguların ve delillerin mahkemece kendiliğinden araştırılması mümkün değildir.75 B. İspatın ve Delilin Konusu İspatın konusunu taraﬂ arın üzerinde anlaşamadıkları ve uyuşmazlığın çözümünde etkili olabilecek çekişmeli vakıalar oluşturur ve bu vakıaların ispatı için delil gösterilir (HMK, m. 187/1). Bir taraf, ancak kendi dayandığı vakıaların doğru olduğunu veya karşı tarafın dayandığı vakıaların gerçek olmadığını ispat ederek davayı kazanır ve hakkında açılan davanın reddini sağlayabilir.76 Bu nedenle hukuksal açıdan haklı olmak değil, ispat etmek önemlidir.  Hâkim,  özellikle  bu  çerçevedeki  ilk  ve  en  önemli  tespiti  ön inceleme  aşamasında  yapmış  olmalıdır  (HMK,  m.  137,  140).  Herkesçe bilinen vakıalar (malum ve maruf vakıalar) ile ikrar edilmiş vakıalar çekişmeli sayılmaz (HMK, m. 187/2). Delilin konusu maddi vakıalardır.77 Bir maddi vakıanın ispatlanması da ancak delil ile olur. Dolayısıyla hukuk normları ispatın konusu dışında kalır. Çünkü hâkim, Türk hukukunu resen uygular (HMK, m. 33). İleri sürülen ve ispatına çalışılan maddi vakıaların hukuki nitelendirilmesi ve uygulanacak olan hukuk normunun belirlenmesi hâkimin görevine girmektedir. 73 KURU, Baki, Hukuk Muhakemeleri Usulü, 6. Baskı, Demir Demir Yayıncılık, İstanbul, 2001, s. 1966. 74 ÖCAL, Bahar, Roma Medeni Usul Hukukunda Yargıcın Delilleri Takdiri, AÜHFD, Cilt: 60, Sayı: 3, 2011, s.525. 75 KURT, Nesibe, Medeni Yargılama Hukukunda Doğrudan Doğruyalık İlkesi, Prof. Dr. Bilge Öztan a Armağan, Turhan Kitabevi Yayınları, Ankara, 2008, s. 603; ÖCAL, s. 525. 76  KURU/ ARSLAN/ YILMAZ, s. 357. 77  KURU, Baki, Hukuk Muhakemeleri Usulü, 6. Baskı, Demir Demir Yayıncılık, İstanbul, 2001, s. 1967. 408 Gazi Üniversitesi Hukuk Fakültesi Dergisi C. XX, Y. 2016, Sa. 2Ahmet TAŞKIN İspatı gereken olaylar müspet (olumlu) vakıalar olabileceği gibi, menfi (olumsuz)  vakıalar  da  olabilir.  Özellikle  yer  ve  zaman  yönünden  belirli olmayan olumsuz vakıaların ispatı neredeyse imkânsızdır. Bu imkânsızlığın aşılabilmesi için, ispat ölçüsünün yaklaşık ispat olarak kabulü, karşı tarafa açıklama  ödevi  kapsamında  savunmasını  somutlaştırma  yükü  yüklenerek menfi vakıanın belirli hale getirilmesi, karşı delil ikame yükü yüklenmesi ve isticvaba davet edilmesi imkânlarından yararlanılabilir.78 Eğer yasa bir tarafın iddia ettiği olaylara doğrudan veya dolaylı olarak hiçbir sonuç bağlamamış veya  ileri  sürülen  istemle  ilgili  olarak  hiçbir  sonuç  öngörmemiş  ise  bu olayların ispatına gerek yoktur. Ancak bir delilin güvenilirliği hususunda hâkimde kanaat uyandırmak için gerekirse yardımcı olayların ispatı olanağı saklıdır.79 Hâkim yargılamada taraﬂ arın ileri sürdükleri vakıaları ve delilleri bir süzgeçten geçirerek davanın çözümü için gerekli olmayanları inceleme konusu  yapmayacaktır.  Bu  ayıklama  gereksiz  yere  davanın  uzamasının önüne geçilmesi açısından da önem taşımaktadır.80 Taraﬂ ardan birinin ileri sürdüğü olaylara karşı diğer tarafın sessiz kalması davaya konu vakıayı çekişmesiz hale getirmez. Çünkü susmak, ikrar etmek anlamına gelmez. Türk hukukunda sükûtun zımni bir irade açıklaması veya örneğin bir ikrar olarak değerlendirilmesi mümkün değildir. Genel hükümler uyarınca, ileri sürülen olaya karşı diğer tarafın sessiz kalması halinde bile o olayın ispatı aranmaktadır.81 Nitekim HMK nın 128. maddesine göre Süresi içinde cevap dilekçesi vermemiş olan davalı, davacının dava dilekçesinde ileri sürdüğü vakıaların tamamını inkâr etmiş sayılır. İspatın konusu, bir davada ileri sürülen ve taraﬂ ar arasında çekişmeli olan olaylardır.82 Dolayısıyla, taraﬂ ar arasında çekişmeli olmayan hususlar için delil gösterilmesine gerek yoktur.83 Örneğin, taraﬂ arca anlaşmaya varılan veya taraﬂ arca ikrar edilen bir konu hakkında delil ibraz edilmez. İspatın konusunu taraﬂ arın üzerinde anlaşamadıkları ve uyuşmazlığın çözümünde etkili olabilecek çekişmeli vakıalar oluşturur ve bu vakıaların ispatı için delil 78  TIĞLI, Hüseyin, HMK Hükümleri Çerçevesinde İspat Yükü, Adalet Dergisi, Sayı: 43, 2012, s. 242. 79 UMAR, s. 19. 80 TIĞLI, s. 245. 81 UMAR, s. 26. 82 BAŞÖZEN,  Ahmet,  Tıbbi  Müdahaleden  Kaynaklanan  Tazminat  Davalarında  İspat Sorunları, Hukuk, Ekonomi ve Siyasal Bilimler Aylık İnternet Dergisi, Sayı: 119, Ocak 2012, s. 4. (İspat Sorunları) 83 KURU, s. 1968. Gazi Üniversitesi Hukuk Fakültesi Dergisi C. XX, Y. 2016, Sa. 2 409Mobbing Davalarında İspat Sorunu gösterilir. (HMK, m. 187) Varlığı aşikâr olan veya herkes ya da birçok insan tarafından bilinen maruf ve meşhur vakıaların ispatına gerek yoktur. Bundan başka mahkeme, bir delil ikamesi talebini yalnızca inceleme konusu vakıanın aşikâr olduğu gerekçesiyle değil, bunun yanında ispat gözleminin mefhumu muhalifinden aşikâr olduğu gerekçesiyle de reddedebilir.84 C. İspat Şekilleri Taraﬂ ar gerek kendi iddialarını ve gerekse karşı tarafın iddialarına karşı savunmalarını çeşitli şekillerde gerçekleştirir. 1) Tam İspat ve Yaklaşık İspat Tam  ispat,  klasik  anlamda  davalardaki  maddi  vakıaların  ispatında kullanılır. Davacı ve davalının iddia ve savunmalarını dayandırdığı vakıaların ispatı, deliller vasıtası ile gerçekleşir. Bir davada taraﬂ ar iddia etmiş oldukları hususları,  kanunun  izin  vermiş  olduğu  bütün  delillere  dayanarak  ispat etmeye çalışırlar. Bu ispat faaliyeti esnasında mümkün olan bütün delillerin incelenmesinden sonra oluşan kanaat ise tam kanaat olacaktır. Bir davada ise, kural olarak, kanuni sınırlar ve mantık kuralları içerisinde bütün deliller incelenir. Bütün delillerin incelenmesi nedeniyle yapılan ispat faaliyetinin adı tam ispattır ve bunun sonucunda oluşan kanaat ise tam kanaattir.85 Muhakeme ilkelerinin  egemen  olduğu  medeni  hukuk  usulünde  yalnızca  tartışmalı vakıaların ispata muhtaçlığı söz konusu olduğu halde, ceza muhakemesinde çarpıcı bir ilke olarak bir mahkemenin kararına ilişkin bütün önemli vakıaların herhangi bir biçimde ispat edilmek zorunda oldukları ilkesi geçerlidir.86 Tam kanaat, maddi vakıanın yüzde yüz kanıtlanması anlamına gelmez. Ceza yargılamasından farklı olarak hukuk yargılamasında şüphenin yüzde yüz giderilmesi diye bir ilke yoktur. Ceza yargılamasında, maddi vakıanın gerçekleşip gerçekleşmediği konusunda hâkimde yüzde birlik şüphe bile şüpheden sanık yararlanır ilkesi gereğince mahkûmiyete engel olur. Bununla birlikte hukuk yargılamasında bu derece kesin bir kanaat gerekli değildir. Bu kanaat bazen %51 lik bir oran bile olabilir. İş hukukunda bunun yasal ve içtihadi örnekleri çoktur. Yargıtay tarafından sıklıkla uygulanan İşçi lehine yorum, feshin son çare olması ve hayatın olağan akışı gibi ilkeler hüküm için tam ispatın aranmadığını göstermektedir. 84 ROXIN, s. 268. 85 ALBAYRAK, Hakan, Yaklaşık İspat, Yayımlanmış Doktora Tezi, Selçuk Üniversitesi SBE, Konya, 2012, s. 8. 86 ROXIN, s. 267. 410 Gazi Üniversitesi Hukuk Fakültesi Dergisi C. XX, Y. 2016, Sa. 2Ahmet TAŞKIN Davacı ve davalının iddia ve savunmalarını dayandırdığı vakıaların ispatı deliller vasıtası ile gerçekleşir. Bir davada taraﬂ ar iddia etmiş oldukları hususları,  kanunun  izin  vermiş  olduğu  bütün  delillere  dayanarak  ispat etmeye çalışırlar. Bir davada kural olarak, kanuni sınırlar ve mantık kuralları içerisinde bütün deliller incelenir. Bütün delillerin incelenmesi nedeniyle yapılan ispat faaliyetinin adı tam ispattır ve bunun neticesinde oluşan kanaat ise tam kanaattir.87 Hukuk muhakemesinde tam ispatın aranmadığı durumlar da  vardır.  Örneğin,  daha  önce  doktrin  tarafından  kabul  edilen  yaklaşık ispat kavramı, 6100 sayılı HMK nın 390. maddesi ile birlikte hukukumuza girmiştir.  Bu  maddenin  üçüncü  fıkrasına  göre  tedbir  talep  eden  taraf, dilekçesinde dayandığı tedbir sebebini ve türünü açıkça belirtmek ve davanın esası yönünden kendisinin haklılığını yaklaşık olarak ispat etmek zorundadır. Görüldüğü gibi kanun koyucu bilinçli bir tercih ile ihtiyati tedbirlerde ispat ölçüsü konusunda yaklaşık ispat kavramını tercih etmiştir. Yaklaşık ispat temel olarak tam ispata göre düşük dereceli bir ispat faaliyeti olarak kabul edilir.88 Yargıtay HGK nın bir kararına göre, …işçi bir taraftan diğer işçiye, diğer  taraftan  işverene  karşı  korunmaktadır.  İşçinin  anlattığı  mobbing teşkil eden olayların tutarlık teşkil etmesi, kuvvetli bir emarenin bulunması gerekmektedir….89 Dolayısıyla Yargıtay a göre davacı işçinin iddiaları tutarlı olmak, iş, işyeri, tanık beyanları veya diğer delillerle çelişmemek koşuluyla yaklaşık bir delille ispat edilmiş sayılacaktır. Mobbingle mücadelede davacı işçinin ortaya koyduğu emareler ve yaklaşık bir ispatı yeterli sayılmalıdır. Mobbingin varlığı için şüpheden uzak kesin delilleri aramak işçi lehine yorum ve işçinin korunması ilkeleri ile de bağdaşmayacaktır. Bir görüşe göre yaklaşık ispat, hâkimde bir olgunun ispatı konusunda, tam bir kanaat uyandırılmasına gerek duyulmayan, gerekçelendirilmiş bir iddiadan daha fazla, fakat tam ispattan daha az bir ispat noktasını ifade ederken diğer bir görüşe göre, vakıaların doğruluğunun ihtimal dâhilinde gösterilmesidir.91 Bir görüşe göre, 87 ALBAYRAK, Hakan ve YUVALI, Ertuğrul, İşverenin Eşit Davranma Borcuna Aykırı Davrandığı İddialarının İspat Hukuku Açısından Değerlendirilmesi, İSGHD, Cilt: 9, Sayı: 34, 2012s. 78. 88 ALBAYRAK/ YUVALI, s. 78. 89 Yargıtay Hukuk Genel Kurulu, E: 2012/9-1925. 90 PEKCANITEZ, Hakan, ATALAY, Oğuz ve ÖZEKES, Muhammet, Medeni Usul Hukuku, 13. Bası, Yetkin Yayınları, Ankara, 2012, s. 574. 91 KARSLI, Abdurrahman,  Medeni  Muhakeme  Hukuku,  3.  Baskı, Alternatif Yayıncılık, İstanbul, 2012, s. 562. Gazi Üniversitesi Hukuk Fakültesi Dergisi C. XX, Y. 2016, Sa. 2 411Mobbing Davalarında İspat Sorunu iddia edilen olayın doğruluğu muhtemel görülmekle birlikte, doğru olma ihtimalinin, doğru olmama ihtimaline göre daha ağır basması;92 bir başka görüşe göre de, hâkimin, resen yemin teklif ettiği durumun bir üst derecesi, tam ispatın bir alt derecesi şeklinde ortaya çıkan ispat biçimidir.93 Yaklaşık ispat, niteliği itibari ile dava olmayan, mahkemeden bir takım usuli taleplerin kabul edilmesinde incelenmesi gereken maddi şartların ispatında kullanılan bir yöntemdir geçici hukuki himaye tedbirleri, hâkimin reddi, belgelerin ibrazı talebi, delil tespiti talebi gibi dava olmayan yalnızca mahkemeden davanın ilerlemesini sağlayıcı usuli işlemler kategorisine giren maddi anlamda kesin hüküm teşkil etmeye elverişli olmayan usuli taleplerin kabulü için verilen ara  kararlarda  kullanılır.  Dikkat  edilirse  verilen  örneklerde  uyuşmazlığın esasını çözecek bir karar verilmez. Çünkü dava niteliğinde değillerdir. Dava niteliğinde olmadıklarından yaklaşık kanaat yeterlidir. Yaklaşık kanaat için ise bütün deliller incelenmeyebilir. Alman hukukunda yaklaşık ispat durumunda yalnızca  hemen  getirilmesi  mümkün  delillerin  incelenmesi  mümkündür. Amaçlanan şey yalnızca usuli talebin kabul veya reddi ile davaya devam edilerek,  o  usuli  talep  nedeniyle  davanın  geciktirilmesinin  önlenmesidir. Yaklaşık ispat durumunda, taraﬂ ar arasındaki sübjektif hak ihlaline ilişkin çekişmeyi  sonsuza  kadar  çözücü  mahiyette  bir  karar  verilemez.  Çünkü yaklaşık ispatın konusu sübjektif hak uyuşmazlığı değil usuli taleplerdeki maddi vakıaların ispatıdır.95 Yaklaşık  ispatta  hâkim,  ispat  edilmek  istenen  olayı  muhtemel görmelidir. Diğer bir ifadeyle, iddia edilen olayın doğru olma ihtimali, doğru olmama ihtimaline göre ağır basmalıdır. Ancak iddia edilen olayın yanlış olma ihtimali de, göz ardı edilmemelidir. Yaklaşık ispat, hâkimin çoğu kez acele karar vermesi gereken haller ile delil gösterilmesinin oldukça zor olduğu ve bu sebeple de kesin ispatın beklenemeyeceği hallerde dikkate alınan ispat ölçüsüdür.96 Mobbing olgusu da hakkaniyetli ve adil bir yargılama ve hüküm için yaklaşık ispatı gerekli kılmaktadır. Çünkü mobbingin birçok türünde, işveren karşısında çok daha zayıf konumda olan ve delil bulma ya da getirme konusunda  işverene  oranla  çok  daha  az  imkâna  sahip  bulunan  işçi  söz konusudur. 92 Bkz. PEKCANITEZ/ ATALAY/ ÖZEKES, s. 574-575. 93 RÜZGARESEN, Cumhur, İﬂ âs Hukukunda Borcun Ödenmeme Tehlikesi ve Başvuru Yolları, Hukuk, Ekonomi ve Siyasal Bilimler Aylık İnternet Dergisi, Sayı: 110, Nisan 2011, s. 1-24. 94  ALBAYRAK , s. 8. 95  ALBAYRAK , s. 8-9. 96  BAŞÖZEN, İspat Sorunları, s. 9. 412 Gazi Üniversitesi Hukuk Fakültesi Dergisi C. XX, Y. 2016, Sa. 2Ahmet TAŞKIN Mobbingde ispatın konusu, iddia edilen maddi vakıaların ve bunların sonunda  zararın  meydana  gelip  gelmediği,  zarar  oluşmuş  ise  bunun mobbing teşkil eden eylemlerle ilgisinin bulunup bulunmadığıdır. Uğradığı mobbing nedeniyle stres, anksiyete ve kaygı bozukluğu yaşayan bir kimse bu rahatsızlığını mobbinge bağlayabilir. Benzer şekilde karşı taraf da bu rahatsızlığın davacının aile içi sorunları nedeniyle meydana geldiğini ileri sürebilir. Mobbing iddiaları tanık ve belge gibi delillerle ispat edilmese bile kendi içinde tutarlı ve hayatın olağan akışına uygun ise hastalığın mobbing nedeniyle meydana geldiğinin kabulü hakkaniyete daha uygundur. 2) İspat Kolaylığı Bir konunun özelliği icabı ispatı ne kadar zor ise yargılamada ispat yükünün  o  ölçüde  hafiﬂ etilmesi  ya  da  kolaylaştırılması  gerekir.  Hiçbir ayrım yapmadan her konuda yargılamanın taraﬂ arından aynı derecede ispat derecesini beklemek hakkaniyete ve adalete aykırıdır. Bu durum silahların eşitliği  ilkesiyle  de  bağdaşmaz.  Kollhosser e  göre  Alman  Medeni  Usul Kanununda ispat ölçüsü, hâkime somut iddianın dayandırıldığı vakıaların gerçekleştiğinin ne kadar muhtemel olduğunu ve hâkimin kanaat tesisi için ihtimalin yeterli olup olmadığı, takdiren tespit hakkı verir. Bu çerçevede ispat ölçüsünün temeli, hâkimin delilleri değerlendirme ilkesine dayanır.97 Mobbing, çoğunlukla gizli ve sinsice yürütüldüğü ve genellikle de işveren veya vekili tarafından uygulandığı için mağdur tarafından delil bulunması zordur. Bir kere hali hazırda çalışan işçilerin işveren aleyhine tanıklık yapması hayatın olağan akışına da aykırıdır. İşveren, işyerinde kamera ile giriş ve çıkış  kayıtlarını  kendisi  tutmakta,  mahkemeden  istenilmesi  durumunda da ibrazdan kaçınabilmektedir. İşçi kendi lehine delil oluştururken geniş imkânlara sahip değildir. İşveren mobbing eylemini bizzat değil de işçileri vasıtasıyla uyguluyorsa ispat veya delil bulma çok daha zordur. Bu durumda ispat kolaylığı ve yaklaşık ispat gibi usul hukukuna ilişkin kavramlar fırsat eşitsizliğini gidermektedir. Mobbingle mücadele edilebilmesi, işveren karşısında oldukça zayıf konumda olan işçinin gerek işverene ve gerekse onun adına hareket eden vekilleri  ile  işyerindeki  sayı  ve  sıfat  yönüyle  güçlü  olan  kişilere  karşı korunabilmesi, işyerinde mobbinge ilişkin haksızlıkların önlenebilmesi ve yargılama sırasında doğrunun bulunarak adaletin sağlanması için mobbing davalarında ispatın kolaylaştırılması zorunludur. Diğer bir ifadeyle mobbing 97  BAŞÖZEN, İlk Görünüş İspatı, s. 116. Gazi Üniversitesi Hukuk Fakültesi Dergisi C. XX, Y. 2016, Sa. 2 413Mobbing Davalarında İspat Sorunu davalarında şüpheden uzak, kesin ve mutlak bir ispat aranması hakkaniyete ve adalete aykırı sonuçlar doğurur. İspat kolaylığı kavramı, tam ispatın tersidir ve bu tür ispatın eksikliğini ve adalete erişimdeki yetersizliğini tamamlamaktadır. İspat kolaylığı, bir davada tam olarak ispatlanması gereken vakıaların çeşitli ispat zorlukları sebebiyle ispat ölçüsünün düşürülerek ispatına imkân tanıyan, böylece bir görüşe göre delil ikame yükünün,98 bir görüşe göre ise ispat yükünün yer değiştirdiği durumları ifade etmek için kullanılan bir kavramdır.99 İspat kolaylığının iki etkisi bulunmaktadır. Birincisi ispat ölçüsünün düşürülmesi, ikincisi ise buna bağlı olarak delil ikame yükünün veya tartışmalı olmakla birlikte ispat yükünün yer değiştirmesi durumudur. İspat kolaylığı işverenin eşit davranma borcuna aykırı hareket etmesi halinde de söz konusudur. İş Kanununun 5. maddesinde, işçinin iddiasını dolaylı vakıalar yoluyla kanıtlamasından sonra ispat yükünün işverene geçtiği öngörülmüştür.  Doktrindeki  ispat  kolaylığının  olduğu  durumlarda  ispat yükünün mü değiştiği yoksa değişen şeyin yalnızca delil ikame yükünün mü  olduğu  tartışmalarına  girmeksizin  ispat  yükünün  yer  değiştirdiğini belirtmiştir.100 Böylece eşit davranma borcuna aykırılık iddiasındaki işçi, dolaylı yoldan hâkimde belirli ölçüde bir kanaatin oluşumunu sağlayacak biçimde vakıalar ortaya koyarsa işveren eşit davranma borcuna aykırı davranmadığını ispatlamak zorunda kalacaktır. İspat kolaylığı ile ispat zorluklarının aşılması amaçlanmaktadır. Çünkü davanın taraﬂ arından birinin davayı sırf iddia ettiği vakıaları ispat edememesi sebebiyle kaybetmesi usul hukukunun amaçlarından biri olan adil hüküm verme amacını sekteye uğratır. Bir yargılamada neyin adil olup olmadığını uygulanacak maddi hukuk hükümleri belirler. Maddi hukuk hükümlerinin somut olaya uygulanabilmesi için de o maddi hukuk hükmünün koşul vakıasının mevcut olduğuna dair hâkimde tam bir kanaatin oluşması gerekir. İşte ancak bu şekilde ilgili maddi hukuk kuralı somut olaya uygulanabilir ve en basit anlamıyla da adil bir kararın verilebilmesi sağlanmış olur.101 3) Doğrudan İspat ve Dolaylı İspat Taraﬂ arın  yargılama  neticesinde  lehlerine  hüküm  alabilmeleri  ileri sürdükleri iddia ve savunmaları ispat etmelerine bağlıdır. Bu yüzden taraﬂ ar 98  ALBAYRAK, s. 12. 99  ALBAYRAK/ YUVALI, s. 79. 100  Bkz. BAŞÖZEN, İl Görünüş İspatı, s. 92 vd. 101  ALBAYRAK/ YUVALI, s. 80. 414 Gazi Üniversitesi Hukuk Fakültesi Dergisi C. XX, Y. 2016, Sa. 2Ahmet TAŞKIN iddialarını ispat etmek için delil göstermek ve hâkimi ikna etmek zorundadır. Türk hukukunda kanuni delil sistemi kabul edildiği için davaya bakan hâkim kesin delillerle bağlı iken takdiri delilleri serbestçe değerlendirebilmektedir.102 İspat  kolaylığı  kavramı  aynı  zamanda  doğrudan  ispat  ve  dolaylı  ispat kavramları ile de yakından ilişkilidir. Buna göre ispat, doğrudan iddia edilen olaya delalet eden deliller aracılığı ile yapılırsa, buna doğrudan ispat denilir. Buna karşılık, iddia edilen olayı yansıtan ve kendisinden olayın oluşu hakkında doğrudan kanaat edinilebilecek delillerden ziyade, diğer komşu olayların varlığına dayalı olarak çekişmeli olay hakkında delillerin değerlendirilmesi suretiyle hâkim tarafından bir sonuca ulaşılması yoluyla gerçekleştirilen ispat faaliyetine de dolaylı ispat denilmektedir. Dolaylı ispat sayesinde ispat ile yükümlü olan tarafa iddiasını ispat ederken kolaylıklar sağlanmaktadır.103 İddia  edilen  vakıayı  doğrudan  yansıtan  ve  kendisinden  vakıanın oluşu hakkında doğrudan kanaat edinilebilecek delillerle değil, emare teşkil eden diğer komşu vakıaların varlığına dayanarak çekişmeli vakıa hakkında, hâkim tarafından delillerin değerlendirilmesiyle bir sonuca varılması yoluyla ispata çalışmak ise dolaylı ispat veya emare ispatı kavramlarıyla ifade edilmektedir. Emare ispatı da ilk görünüş ispatı gibi dolaylı bir ispattır. Bu nedenle komşu vakıaların ispat edilmesi suretiyle asıl vakıalar hakkında hâkimde bir kanaat oluşturulmaya çalışılır. Taraﬂ ar, komşu vakıaların kanuni unsurlarının gerçekleştiğini ispat ederlerse, hâkim bu vakıalara dayanarak, asıl ispatı gereken vakıanın da büyük ihtimalle gerçekleştiğine karar verebilir. Burada hayat tecrübeleri ve mantık kuralları önemli rol oynar. Bu noktada komşu vakıalar ile asıl ispat edilmesi gereken vakıalar arasında mantıksal bir bağ olması gerektiği belirtilmelidir.104 Doğrudan ispat, ispat edilen somut olayın gerçekleşme biçiminin normla ilişkilendirilmesi suretiyle olayların ispatına hizmet ederken; dolaylı ispat,  iddia edilen olaylara komşu olayların ispatlanması yoluyla somut olaya ilişkin çıkarılan sonucu haklı gösterir.105 4) Asıl İspat, Karşı İspat ve Aksine İspat İspat yükü, kendi üzerine düşen tarafın iddia ettiği vakıanın doğru olduğunu ve koşul vakıaları karşıladığını ispat etmesine asıl ispat adı verilir.106 102 ERDÖNMEZ, Güray, Hukuk Muhakemeleri Kanunu na Göre Delillerin Gösterilmesi ve İbrazı, İstanbul Barosu Dergisi, Cilt: 87, Sayı: 5, Eylül-Ekim 2013, s. 15. 103  ALBAYRAK/ YUVALI, s. 81. 104  ALBAYRAK/ YUVALI, s. 82. 105  BAŞÖZEN, İlk Görünüş İspatı, s. 59. 106 KARSLI, Abdurrahman,  Medeni  Muhakeme  Hukuku,  3.  Baskı, Alternatif Yayıncılık, Gazi Üniversitesi Hukuk Fakültesi Dergisi C. XX, Y. 2016, Sa. 2 415Mobbing Davalarında İspat Sorunu Asıl ispat ile karşı ispat fonksiyonel bakımdan birbirinden farklıdır. Asıl ispatın hedefi; hâkimde iddia olunan vakıaların gerçekleştiği ya da gerçekleşmediği yolunda bir kanaat uyandırmak olduğu halde, karşı ispatın hedefi ise; hâkimde ispat yükünü taşıyan tarafça oluşturulmaya çalışılan kanaatin sarsılması ve karşı  taraf  iddialarının  doğruluğu  hakkında  şüphe  uyandırmaktır.  Burada sadece şüphe uyandırmak yeter, aksi yönde tam bir kanaat tesisi zorunlu değildir.107 Aksini ispat ise bunlardan farklıdır. Çünkü asıl ispat ve karşı ispatta taraﬂ ar,  hâkimde  henüz  oluşmayan  kanaat  üzerinde  hâkimin  kanaatini kendi lehine oluşturma çabasında iken, aksini ispat ise hâkimde oluşmuş kanaatin ya da karine olarak kabul edilen vakıanın olmadığı ya da aksinin gerçekleşmiş  olduğu  yönündeki  ispat  çalışmasıdır.108  Aksini  ispat  kural olarak kanuni karinelerin çürütülmesine yönelik ispat faaliyetidir (HMK m. 190/II). Kendisine ispat yükü düşmeyen taraf, karşı tarafın iddiasını ispat etmesini beklemeden karşı delil ileri sürerek ispatta bulunabilir. Bir kimse kendi iddiasını ispat edemezse ispat yükü diğer tarafa geçmez. Bir kimsenin herhangi bir vakıayı ispatla yükümlü olmadığı halde bunun aksini gösterir deliller ileri sürmesine karşı delil denir. HMK nın 191. maddesine göre; Diğer taraf, ispat yükünü taşıyan tarafın iddiasının doğru olmadığı hakkında delil sunabilir. Karşı ispat faaliyeti için delil sunan taraf, ispat yükünü üzerine almış sayılmaz. Bir kimse karşı ispatta bulunarak karşı tarafı güç durumda bırakmak ve onu iddiasını ispat edemeyecek bir duruma sokmak isteyebilir. Örneğin, iş davalarına ilişkin uyuşmazlıklarda, ispat hukukunun genel esaslarına uygun şekilde iş sözleşmesinin haklı olarak bozulduğunun ve bir emek karşılığı olmayan hafta ve genel tatil ücretlerinin ödenmiş olduğunun ispatı işverene düşer.109  Diğer  bir  deyişle  işçi  çalıştığını,  işveren  ise  bunun  karşılığını ödediğini ispat etmek zorundadır. Karşı delil, ispat yükü kendisine düşmeyen tarafın gösterdiği delillere denir. İspat yükü kendisine düşen taraf iddiasını ispatlamış ise bunun aksini ispat karşı tarafa geçer. Kanuni  delil  sisteminin  özellikleri,  vakıaların  taraﬂ arca  getirilmesi ilkesi, teksif ilkesi, hâkimin emin olma çabasında hâkimi kısıtlayan ilkelerdir. Mesela vakıaların taraﬂ arca getirilmesi ve teksif ilkesi nedeniyle hâkim, olayı her yönüyle açıklamada gerekli gördüğü bütün verilere ulaşamamaktadır. İstanbul, 2012, s. 561. 107 ALBAYRAK, s. 6. 108 ALBAYRAK, s. 7. 109 KURU/ARSLAN/ YILMAZ, s. 366. 416 Gazi Üniversitesi Hukuk Fakültesi Dergisi C. XX, Y. 2016, Sa. 2Ahmet TAŞKIN Hâkim taraﬂ arın göstermiş olduğu delillerle bağlıdır. Ayrıca kanuni delil sitemi nedeniyle belli vakıaların ispatı ancak belli delillere hasredilmiştir. Hatta bu delillerle hâkim bağlıdır. Yani mesela, senede bağlanması zorunlu bir alacağın alacaklısı alacağının varlığını senet ile ispatladıktan sonra, hâkim için artık bu hakikattir. Bu şekilde kanun koyucu, hâkimin hakikate ulaşma çabasında hâkimi  sınırlamış,  bir  bakış  açısına  göre  de  hâkime  yardımcı  olmuştur. Böylece kanuni delil sistemi nedeniyle hâkim, belli delillerin gösterilmesi ile o vakıanın ispatlanmış olduğundan emin olmak zorunda kalacak, daha fazla araştırma yapmasına gerek kalmayacaktır.110 5) İlk Görünüş İspatı İspat  güçlüğünün  bulunduğu  durumlarda  hak  kaybının  önlenmesi ve adaletli bir sonuca ulaşılabilmesi için emare ispatı, fiili karineler, ispat kolaylığı ve ilk görünüş ispatı gibi hukuki kurumların kullanılması zorunludur. Bu zorunluluğun açıkça görüldüğü alanlardan birisi de iş hukuku ve özellikle de mobbing iddialarıdır. İnsanların bilimsel geçerlilik derecesinde mutlak gerçeğe ulaşması her durumda mümkün olmayacağı için, vicdani kanaatin oluşmasına yetecek kadar, muhtemel durumlarda da karar verilmesi özel hukuk açısından hakkaniyete ve adalete daha uygundur. Anayasanın 138. maddesinde de hâkimlerin anayasaya, kanunlara ve hukuka uygun olarak vicdani kanaatlerine göre karar verecekleri belirtilmiştir. Bu hükme göre esas olan hâkimin vicdani kanaatine göre karar vermesidir. Bir iddianın hiçbir şüpheye ve tereddüde yer vermeyecek biçimde mutlak olarak (%100) ispatlanması durumunda zaten vicdani kanaate gerek yoktur. O halde vicdani kanaat %51 den %99 a kadar olan bir inanma gücüdür. Buna göre, esas olarak özel hukukta her durum açısından mutlak bir ispattan söz edilmesi mümkün değildir. Aslında mutlak ispatın aranmasına da gerek yoktur. Hâkim, kuvvetli olmayan (%49 dan daha az) ihtimal hesaplarına, akıl, mantık ve muhakemeye dayanmayan varsayımlara göre karar veremez. Vicdani kanaat, bir şeyin varlığına veya yokluğuna ya da iddia edildiği şekilde meydana geldiğine dair ağırlıklı (%51) kanaattir. Bu kanaatin hayatın olağan akışı ilkesi ve yorumla desteklenmesi zorunludur. Güçlü delil ile ispatlanan bir iddianın kabulündeki vicdani kanaat ile güçsüz delillerle ispatlanmaya çalışılan bir iddianın kabulündeki vicdani kanaat bir değildir.111 Çünkü vicdani kanaat, bir tahmin veya his (duyu) değildir. Bu kanaat çerçevesinde; olayın 110  ALBAYRAK, s. 7-8. 111  AKCAN, Recep, Yargıtay Kararlarındaki Güçlü Delil Kavramının Hukuki Niteliği, Selçuk Üniversitesi HFD, Cilt: 12, Sayı: 1-2, 2004, s. 7-24. Gazi Üniversitesi Hukuk Fakültesi Dergisi C. XX, Y. 2016, Sa. 2 417Mobbing Davalarında İspat Sorunu özelliği ve oluş şekli, taraﬂ arın iddiaları, varsa tanıkların beyanları, bu beyan ve  iddialar  arasında  tutarlılık,  uyumluluk  ve  bütünlük,  maddi  vakıaların olabilirliği, dürüstlük ve iyiniyet göstergeleri ile hayatın olağan akışı gibi hususlar birlikte değerlendirilmelidir. Alman Krallık Mahkemesinin 1931 yılında verdiği bir karara göre; hâkimde bir olayın gerçekleştiğine yönelik ilk görünüş ispatı ile oluşan inanç (kanat), karşı tarafın delil göstermesiyle sona ermiş veya giderilmişse, bu durumda ilk görünüş ispatının aksini ispatla değil, karşı ispatla çürütüldüğü kabul  edilmelidir.112 Alman  Federal  Mahkemesi  de  ilk  görünüş  ispatının temellerini, hâkimin delilleri serbest değerlendirmesi yetkisi çerçevesinde ele almıştır. Buna ilave olarak, ilk görünüş ispatı ile gerçekleştirilen ispatın da, asıl ispat faaliyeti olduğu; ispat yükünün yer değiştirmesine etkili olmadığı; buna karşılık ilk görünüş ispatının gerçekleştirilmesiyle karşı ispat faaliyetine giri şilmesi  gerekliliği,  karşı  tarafın  ispat  faaliyetinin  karinelerle  ispattan farklı olarak aksini ispat olmadığı önemle vurgulanmıştır. Böylelikle ilk görünüş  ispatının,  esas  olarak,  ya şam  deneyimlerine  dayandığı,  hâkimin delilleri değerlendirme yetkisi alanında temel işlevlerini yerine getirdiği; ispat yükünün dağılımına etki etmediği kabul edilmiş oldu.113 İlk görünüş ispatının maddi hukuka ilişkin olduğu görüşüne göre, ilk  görünüş  ispatının  söz  konusu  olduğu  durumlarda  ispat  yükü  ya  yer değiştirmekte ya da kısmen ters çevrilmektedir.114 Alman hukukunda ileri sürülen ve halen hâkim olan görüşe göre ilk görünüş ispatı, ispat yükü kuralı olarak kabul edilemeyeceği için maddi hukuk kuralı olarak da kabul edilemez. Bu nedenle ilk görünüş ispatı, hâkimim delilleri değerlendirmesine yardımcı olan yargılama hukuku müessesesidir.115 Hâkim, ilk görünüş ispatı çerçevesinde ağırlıklı kanaatine göre bir yargıya varmaktadır. İlk görünüş ispatı, emare ispatı gibi hâkimin tecrübeleri aracılığıyla delilleri değerlendirmesine hizmet eder. Emare ispatında hâkim, tek başına somut olayı göstermeyen bireysel durumlardan yola çıkarak; bu bireysel durumların bir araya gelme siyle ana olaya ulaşırken; ilk görünüş ispatında ise, norma temel teşkil eden tipik olaylardan,  güvenilirliği  sınanmış  yüksek  tecrübe  kuralların dan  hareketle 112  BAŞÖZEN, İlk Görünüş İspatı, s.31. 113  BAŞÖZEN, İlk Görünüş İspatı, s.32. 114  Bkz. BAŞÖZEN, İlk Görünüş İspatı, s. 98 vd. 115  BAŞÖZEN, İlk Görünüş İspatı, s. 49-50. 418 Gazi Üniversitesi Hukuk Fakültesi Dergisi C. XX, Y. 2016, Sa. 2Ahmet TAŞKIN olaya ulaşır. İlk görünüş ispatı, kural olarak kendisine tecrübeleri temel alıp ancak bu halde uygulanabilirken; emare ispatı, tipik olmayan olaylarla da nedensellik bağının ispatında uygulama alanı bulur.116 İlk görünüş ispatının fiili karinelerle veya emare ispatı ile eş anlamda kullanıldığını ileri süren yazarlar da bulunmaktadır.117 Kanaatimizde üçünün temelinde yatan mantık ile varmak istedikleri hedef ortak olup o da adaletin ortaya çıkması ve ispatın dar yorumları içinde kaybolup gitmesinin önlenmesidir. 6) İspatta İhtimal Kavramı Alman  hukukuna  göre  ispat  ölçüsü  teorileri  ihtimal  kavramı  ile ilişkilidir. Her zaman mutlak gerçeğe ulaşmanın ve bazen de kesine yakın ispatın güçlüğü ispatta ihtimal kavramının varlığını gerektirmiştir. Objektif ve sübjektif ispat ölçüsüne benzeyen ihtimal kavramı Alman yargı kararlarında ve doktrinde sürekli kendisine başvurulan sihirli bir kavramdır. Objektif ihtimal kavramı olayların sıklığına yönelik olarak istatistikî ve matematiksel ihtimali öne çıkarır. Sıklık teorisine göre; ihtimal kavramının temelinde bir yandan olayların muhtemel olması yatarken, diğer yandan ise elverişli olması yatmaktadır. Sübjektif ihtimal kavramına göre, ancak ciddi bir biçimde akıl süzgecinden geçirilerek elde edilen kişisel tecrübeler, belirli türden olayların gerçekleşme ihtimaline değer katabilirler. İstatistikî ihtimaller, ancak ciddi ve mantıklı bir insan süzgecinden geçirilirse hükme esas alınabilir.118 Bilimsel  bilgi  ve  günlük  yaşamdan  kaynaklanan  tecrübe  kuralları arasında söylemlerinin kesinliğinde de farklılıklar bulunmaktadır. Tecrübe kuralı, genel olarak sadece sübjektif olarak şekillenen tahminlerin daha yüksek ihtimali değerlerini temel alır. Gerçekten de tecrübenin temeli, belirli türdeki olayların gerçekleşip gerçekleşmeyeceği ya da bu olayların gerçekleşmesine yönelik ihtimalin derecesi ile yakından ilgilidir.119 İhtimalin kabul edilebilir oranı hâkimdeki vicdani kanaati oluşturmaya yetecek olan orandır. Yani bir olayın gerçekleşebileceğine ve somut olay açısından gerçekleştiğine dair ihtimal en az %51 olmalıdır. Yaklaşık ispatta hâkim, ispat edilmek istenen olayı muhtemel görmelidir. Diğer bir ifadeyle, iddia edilen olayın doğru olma ihtimali, doğru olmama ihtimaline göre ağır basmalıdır. Ancak iddia edilen olayın yanlış olma ihtimali de, göz ardı edilmemelidir. Hâkim gerek bilgi ve 116  BAŞÖZEN, İlk Görünüş İspatı, s. 60. 117 YILDIRIM, M. Kamil, Medeni Usul Hukukunda Delillerin Değerlendirilmesi, İstanbul, 1990, s.128. 118 BAŞÖZEN, İlk Görünüş İspatı, s. 126-128. 119 BAŞÖZEN, İlk Görünüş İspatı, s. 128-129. Gazi Üniversitesi Hukuk Fakültesi Dergisi C. XX, Y. 2016, Sa. 2 419Mobbing Davalarında İspat Sorunu gerekse mesleki ve genel tecrübelerine dayanarak delilleri ve ihtimalleri bilim ve mantık çerçevesi içinde değerlendirir ve bir ihtimali sonuca ulaşır. Hâkim, kendisini karara götüren argümanları mutlak bir şekilde gerekçeye bağlamak ve gerekçeleri de hukuk bilimi, hayatın olağan akışı ölçütü, akıl ve mantık kuralları ile desteklemelidir. Cinsiyete Dayalı Ayrımcılık Hallerinde İspat Yüküne İlişkin 97/80 Sayılı Yönergenin 2. maddesine göre; eşit davranma ilkesinin uygulanmasında tarafsız olduğu izlenimini veren bir hüküm, bir ölçüt veya bir uygulamanın somut olarak belirli bir cinsten olanların önemli ölçüde büyük bir oranının aleyhine olması halinde doğrudan ayrımcılık olduğu kabul edilmektedir.120 Bir işyerinde kanundan, sözleşmeden veya işyeri uygulamasından kaynaklanan objektif bir durum varsa bunun herkese eşit uygulanması gerekir. Dolayısıyla nesnel bir durumun bazı çalışanlara uygulanması halinde ayrımcılığın varlığını kabul etmek gerekir. 7) Emarelere Dayanan İspat Medenî usul hukuku öğretisinde delil kavramının tanımı yapılmışsa da, emare konusunda görüş birliğine varılan bir tanıma gerek duyulmamıştır.121 Bu konuda medenî usul hukuku bakımından önemli olan, takdiri delille emareyi birbirinden ayırmak ve farklarını ortaya koymaktır. Kanunî deliller açısından bu konuda bir tereddüt duyulmamaktadır. Kanunî (kesin) delil ile takdiri delil arasındaki fark hâkimi bağlayıcılığı açısından açıklıkla ortaya konulmuştur.122 Bazı durumlarda ispatı gereken husus doğrudan doğruya kanıtlanamaz ya da bir maddi vakıanın ispatı çok güç olabilir.124 Örneğin, mobbing, işleniş şekliyle ve çoğu zaman gizli ve uzun bir süreç içinde yapılması nedeniyle ispatı zor bir olgudur. Çünkü bu kavram gerek özel hukukta ve gerekse ceza hukukunda bulunan birçok kavramla yakın benzerlik göstermektedir. Örneğin, işyeri kabalığı ve saplantılı takip (stalking) ile birer suç olan hakaret ve taciz gibi eylemler mobbing teşkil edebilmektedir. Mobbingde mağdurlar çoğunlukla  belge  veya  kayıt  oluşturmaz,  yaşadıklarını  günü  gününe  not 120 KÖKKILINÇ,  A.G.  İş  Hukukunun  Uluslararası  Kaynakları  Işığında  Kadın  İşçilerin Korunması, Legal Yayınları, İstanbul, 2013, s. 61. 121 KONURALP,  H.  Rekabet  Hukukunda  Deliller  ve  Değerlendirilmesi,  in:  Rekabet Hukukunda Güncel Gelişmeler Sempozyumu, V, 6-7 Nisan, Kayseri, 11-22, 2007, s. 17. 122 KONURALP, s. 17. 123  TAŞPINAR, s. 540. 124 MUŞUL, Timuçin, Medeni Usul Hukuku, 3. Baskı, Adalet Yayınevi, Ankara, 2012, s. 324. 420 Gazi Üniversitesi Hukuk Fakültesi Dergisi C. XX, Y. 2016, Sa. 2Ahmet TAŞKIN almaz, uzun bir süre sabır gösterdiği için ilgili makamlara durumu iletmez, suç oluşturan bir davranışa maruz kaldığında Cumhuriyet savcılığına şikâyette bulunur ya da manevi tazminat davası aşamasında istediği gibi tanık bulamaz. İşte, bu gibi durumlarda ispatı gereken vakıa yerine, o vakıanın gerçekleştiğini veya gerçekleşmediğini büyük bir ihtimal dâhilinde gösterebilecek başka bir vakıanın ispatı ile yetinilir. Böylece ispatı gereken vakıa doğrudan doğruya ispat edilebileceği yerde dolaylı bir şekilde ispatlanmış olur. Bu durumda ispat külfeti yer değiştirmemiş olmakta, sadece ispat edilecek vakıa değişmektedir.125 İlk görünüş ispatı da emare ispattır. Ancak konusu bir hukuki ilişkidir. Ayrıca yüksek mahkemeye göre emare ispatta boşluk olmaz, ancak ilk görünüş ispatı kural olarak belirsizlik içerir. Bir görüşe göre, emare (belirti), dış dünyada varlığı olan bir olaydır ve mahkemeler dava konusu olayı belirlemede bunlardan yararlanabilirler. Bu nedenledir ki belirtinin bir delil çeşidi olduğunda tereddüt edilmemelidir. Belirtiler  ispat  edilecek  olayı  dolaylı  olarak  gösterirler.  Örneğin,    fren izinden otomobilin hızını gerçeğe yakın olarak tahmin etmek mümkündür. Yine bu görüşe nazaran emareler tek başına ispat kuvvetini haiz olmadıkları gibi  birlikte,  birbirlerini  tamamladıkları  takdirde  delil  sayılabileceklerdir. Görüldüğü gibi, emare, delil olmakla birlikte olayın tamamını değil de bir kısmını gösteren dolaylı ispat aracıdır.126 Mobbing iddiasının ispatında emarelerin yeri büyüktür. Çünkü pek çok vakıada mobbingin ispatı güçtür. Bu durumda iddianın gerçek olup olmadığı hayatın olağan akışı ve işçi lehine yorum gibi iş hukukunda hâkim olan ilkelerin yanında emare ve ispat kolaylığı gibi medeni usul hukukuna ait kavramların birlikte uygulanması gerekir. Sonuç olarak; bir iddianın doğrulanması konusunda kanaat edinmeye elverişli olan ve fakat temsili niteliği itibariyle iddia edilen vakıayı ancak ihtimal derecesinde veya kısmen doğrulayabilen ispat araçlarına emare denir ve emare ile ispatın söz konusu olabilmesi için, uyuşmazlığın esasını çözücü bir vakıa olmaması ve bu vakıa hakkında niteliği gereği mahkemece tam bir kanaate ulaşılmasının çoğunlukla mümkün olamaması gerekir.127 D) İspat Hakkı ve İspat Yükü 1) İspat Hakkı Hak arama özgürlüğü bir yandan dava açma, diğer yandan açılan davada kendini savunma hakkını kapsayan bir kavramdır. Taraﬂ ar hem dava açarken 125  MUŞUL, s. 324. 126  MUŞUL, s. 324. 127  KONURALP, s. 19. Gazi Üniversitesi Hukuk Fakültesi Dergisi C. XX, Y. 2016, Sa. 2 421Mobbing Davalarında İspat Sorunu hem de haklarında açılmış bir davada savunma yaparken ispatta bulunma hakkına sahiptir. İspat taraﬂ ar için hem bir hak, hem de bir yükümlülüktür. Dava açmak veya açılmış bir davada iddia ya da savunma yapmak hukukun gösterdiği şekil kurallarına uymak suretiyle mümkündür. O halde ispat hakkı, kanunda  belirtilen  şekilde  yerine  getirilebilir.  HMK nın  189.  maddesine göre; Taraﬂ ar, kanunda belirtilen süre ve usule uygun olarak ispat hakkına sahiptir. Hukuka aykırı olarak elde edilmiş olan deliller, mahkeme tarafından bir vakıanın ispatında dikkate alınamaz. Kanunun belirli delillerle ispatını emrettiği hususlar, başka delillerle ispat olunamaz. Bir vakıanın ispatı için gösterilen delilin caiz olup olmadığına mahkemece karar verilir.  İspat  hakkı,  açıklama  yapma  hakkıyla  birlikte  hukuki  dinlenilme hakkının önemli unsurlarından birisidir. Hukukî dinlenilme hakkı, Anayasanın 36.  maddesinde  ve Avrupa  İnsan  Hakları  Sözleşmesinin  6.  maddesinde düzenlenen adil yargılanma hakkının en önemli unsurudur. Zira insan onurunun yargılamadaki zorunlu bir sonucu olarak, yargılama süjelerinin, yargılamada şeklen yer almaları dışında, tam olarak bilgi sahibi olmaları, kendilerini ilgilendiren yargılama konusunda açıklama ve ispat haklarını tam ve eşit olarak kullanmaları ve yargı organlarının da bu açıklamaları dikkate alarak gereği gibi değerlendirme yapıp karar vermesi gereklidir. Hukukî dinlenilme hakkı olarak maddede ifade edilen ve uluslararası metinlerde de yer bulan bu hak, çoğunlukla iddia ve savunma hakkı olarak bilinmektedir. Ancak, hukukî dinlenilme hakkı, iddia ve savunma hakkı kavramına göre daha geniş ve üst bir kavramdır. Taraﬂ ar, yargılamayla ilgili açıklamada bulunma, bu çerçevede iddia ve savunmalarını ileri sürme ve ispat etme hakkına sahiptirler. Her iki taraf da bu haktan eşit şekilde yararlanırlar. Bu durum silahların eşitliği ilkesi olarak da ifade edilmektedir (HMK 32. m. gerekçesi). Taraﬂ ar, kanunda belirtilen süre ve usule uygun olarak ispat hakkına sahiptir. Hukuka aykırı olarak elde edilmiş olan deliller, mahkeme tarafından bir vakıanın ispatında dikkate alınamaz. Kanunun belirli delillerle ispatını emrettiği hususlar, başka delillerle ispat olunamaz. Bir vakıanın ispatı için gösterilen delilin caiz olup olmadığına mahkemece karar verilir. (HMK, m.189). Herkesçe bilinen vakıaların ispatı gerekli değildir.128 Taraﬂ ar ispat hakkının bir gereği olarak başka yerde bulunun bir delilin getirtilmesini mahkemeden  isteyebilir.  Bu  çerçevede,  Taraﬂ arın  ellerinde  bulunmayan ve incelenmesine karar verilen delillerin getirtilmesi için, mahkemece ilgili resmî makam ve mercilerle üçüncü kişilere bu husus bildirilir. Mahkemeye getirtilmesi mümkün olmayan deliller, bulunduğu yerde incelenebilir veya 128 UMAR, Bilge, Hukuk Muhakemeleri Kanunu, Şerhi, Yetkin Yayınları, Ankara, 2011, s. 516. 422 Gazi Üniversitesi Hukuk Fakültesi Dergisi C. XX, Y. 2016, Sa. 2Ahmet TAŞKIN dinlenebilir.  (HMK,  m.  195). Taraﬂ ar,  ispat  hakkına  sahip  olduğu  gibi gösterdiği delillerden vazgeçme hakkına da sahiptir, ancak Delil gösteren taraf, karşı tarafın açık izni olmadıkça, o delile dayanmaktan vazgeçemez. (HMK, m.196). 2) İspat (Delil Gösterme) Yükü Delil gösterme veya delil ikame etme, bir kimsenin kendi iddialarının doğruluğunu  veya  karşı  tarafın  iddialarının  yanlışlığını  ispat  etmek  için ortaya koyduğu hâkimi inandırma faaliyetidir. İspat yükü (külfeti), bir davada taraﬂ ar arasında ihtilaﬂ ı olup da davanın hükme bağlanmasında etkili olan ve dosyaya da girmiş bulunan bir vakıayı taraﬂ ardan hangisinin ispatla yükümlü olduğunu ifade etmektedir.129 Hâkim, ispat faaliyetinin sonucu ne olursa olsun davayı bir hüküm le sonuçlandırmak mecburiyetindedir. Hâkim bu noktada ispat yükünü dikkate alarak sonuca ulaşacak ve ispat yükü kimin üzerindeyse, belirsizliğin riskine de bu taraf katlanmak zorunda kalacak; dolayısı ile karar bu tarafın aleyhine olacaktır.130 Medeni muhakeme hukukunda ‘taraﬂ arca getirilme ilkesi  geçerlidir. Bu ilke gereğince, dava malzemesinin toplanması, yani iddia ve savunmanın dayanağını oluşturan vakıalar ile onları ispatlamak için gerekli olan deliller taraﬂ arca getirilir. Bu nedenle, taraﬂ ar iddialarını ispatlayabilmek ve davanın kendi lehlerine karara bağlanması için delil temin etmeye çalışmaları gerekmektedir.131 İspat  yükü,  belli  bir  olayın  gerçekleşip  gerçekleşmediğinin anlaşılamaması, yani olayın ispatsız kalması yüzünden hâkimin aleyhte bir kararıyla karşılaşma tehlikesidir. Bu durunda hâkimin yapacağı iş söz konusu sorun  bakımından  ispat  yükünü  taşıyan  tarafın,  o  sorunda  ileri  sürdüğü istemi reddetmektir.132 Başka bir anlatım ile hâkim, davada hangi (çekişmeli) vakıaların ispat edilmesi gerektiğini tespit ettikten sonra, bu vakıaların kimin tarafından ispat edilmesi gerektiği sorusu ile karşılaşılır; buna ispat yükü denir.133 İspat yükü; soyut ve somut ispat yükü şeklinde ikiye ayrılmaktadır. 129  MUŞUL, s. 321; BUDAK, Ali Cem, AT Konsey ve Komisyonunun Yeni Rekabet Tüzükleri ve Rekabet Kanunu nda Yapılan Değişiklikler Işığında Delillerin Toplanması ve İspat, Perşembe Konferansları, Mayıs 2004, s. 15. 130 GÜMAN, Nihat, Medeni Yargılama Hukuku Açısından Taciz, CHD, Yıl: 4, Sayı: 11, Aralık 2009, s. 202. 131 AKİL, Cenk, Yargıtay Kararları Işığında Medeni Yargılama Hukukunda Hukuka Aykırı Biçimde  Elde  Edilmiş  Delillerin  Değerlendirilip  Değerlendirilemeyeceği  Meselesi, AÜHFD, Cilt: 61, Sayı: 4, 2012, s. 1224. 132  UMAR, s. 3. 133  KURU/ARSLAN/ YILMAZ, s. 360. Gazi Üniversitesi Hukuk Fakültesi Dergisi C. XX, Y. 2016, Sa. 2 423Mobbing Davalarında İspat Sorunu Soyut ispat yükü, derdest bir davanın gidişatına bağlı olmaksızın, taraﬂ ardan birinin aleyhte bir kararla karşılaşma tehlikesini engellemek üzere üstlendiği delil ikame yüküdür. Somut ispat yükü ise, hâkimin olaylar hakkında derdest bir davanın belli bir aşamasında belli bir derece bilgi sahibi olduğu yargılamada taraﬂ ardan hangisinin delil göstermeye davet edileceği sorunuyla ilgilidir.134 Somut ispat yükü, delillerin varlığı ile değil, değerlendirilmesiyle ilgili olduğu için yer değiştirmesi mümkündür. İspat yükü, kanunda özel bir düzenleme bulunmadıkça, iddia edilen vakıaya bağlanan hukuki sonuçtan kendi lehine hak çıkaran tarafa aittir. Kanuni bir karineye dayanan taraf, sadece karinenin temelini oluşturan vakıaya ilişkin ispat yükü altındadır. Kanunda öngörülen istisnalar dışında, karşı taraf, kanuni karinenin aksini ispat edebilir. (HMK, m.190). TMK nın 6. maddesine göre Kanunda aksine bir hüküm bulunmadıkça taraﬂ ardan her biri, hakkını dayandırdığı olguların varlığını ispatla yükümlüdür. Diğer taraf, ispat yükünü taşıyan tarafın iddiasının doğru olmadığı hakkında delil sunabilir. Karşı ispat faaliyeti için delil sunan taraf, ispat yükünü üzerine almış sayılmaz. (HMK, m.191). Kanunun belirli bir delille ispat zorunluluğunu öngörmediği hâllerde, Kanunda düzenlenmemiş olan diğer delillere de başvurulabilir. (HMK, m.192). Taraﬂ ar, dayandıkları vakıaları, ispata elverişli şekilde somutlaştırmalıdırlar. Taraﬂ arın, dayandıkları delilleri ve hangi delilin hangi vakıanın ispatı için gösterildiğini açıkça belirtmeleri zorunludur. (HMK, m. 194). İspat şartı kanundan doğabileceği gibi taraf iradelerinden de doğabilir. İspat şekline ilişkin kısıtlayıcı hükümler kamu düzenine ilişkin olmadığından sözleşme  ile  etkisiz  hale  getirilmeleri  mümkündür.135  Taraﬂ ar  aralarında düzenleyecekleri delil sözleşmesi ile kanunda belirli delillerle ispatı öngörülen vakıaların başka delil veya delillerle ispatını kararlaştırabilecekleri gibi, belirli delillerle ispatı öngörülmeyen vakıaların sadece belirli delil veya delillerle ispatını kabul edebilirler. (HMK, m. 193/1). Delil sözleşmesi yazılı yapılması veya  tutanağa  geçirilecek  beyanların  imzalanması  suretiyle  yapılması mümkündür.  Delil  sözleşmesi  açıkça  yapılabilir.  Dolayısıyla  zımni  delil sözleşmesi mümkün değildir.136 Davada her iki taraf da, ispat yükünün kime düştüğünü gözetmeden delil göstermişler ise, bu halde hâkimin (şimdilik) ispat yükünün hangi tarafa düştüğünü araştırmasına gerek yoktur. İki tarafın 134  BAŞÖZEN, İlk Görünüş İspatı, s. 91. 135 DELİDUMAN, Seyithan, Medeni Usul Hukukunda Senet ve Senetlerle Yazılı Şekil Arasındaki İlişki, AÜEHFD, Cilt: 4, Sayı: 1-2, 2000, s. 432; TIĞLI, s. 250. 136  TIĞLI, s. 250. 424 Gazi Üniversitesi Hukuk Fakültesi Dergisi C. XX, Y. 2016, Sa. 2Ahmet TAŞKIN (veya bir tarafın) gösterdiği deliller ile davaya ilişkin bütün çekişmeli vakıalar aydınlanmış ise, gene ispat yükünün hangi tarafa düştüğünü araştırmakta bir yarar yoktur. Buna karşılık, gösterilen delillerin hâkime dava hakkında kesin bir kanaat vermemesi halinde ispat yükünün hangi tarafa düştüğünün tespit edilmesinde yarar vardır. İşte ispat yükü bu hal için önemlidir. Çünkü hâkim gösterilen delillerin davayı karara bağlamak için yeterli olmadığı hallerde de esas hakkında bir karar vermekle yükümlüdür.137 İspat yükü kendisine düştüğü halde yeterli delil getiremeyen taraf davasını kaybeder. Ancak bu durumda, kendisine ispat yükü düşen ve fakat bunu yerine getirememiş olan tarafın karşı tarafa yemin teklif etme hakkı vardır (HMK, m. 225). Örneğin, ispat yükü kendisine düşen davacı iddiasını ispat edememiş ise hemen davanın reddine karar verilmez ve davacının davalı tarafa yemin teklif etmesine izin verilir. Hâkim  yemin  deliline  dayanması  için  taraﬂ ara  hatırlatmada  bulunamaz. Mobbing mağduru olduğunu söyleyen kimse dava açtığı kimsenin ne şekilde mobbing yaptığını ispat etmek zorundadır. Mağdur, sadece yer, zaman ve kişi isimleri vererek veya olguları ya da olayları tarif ederek talebini haklı çıkaramaz. Diğer bir deyişle mağdur iddiasını ispat etmiş olamaz. Bir konuyu iddia ettikten sonra aksini karşı taraf ispat etsin denilemez. İspat yükünün taraﬂ ardan hangisine düşeceği bir kısım ölçütlerle (kıstas) belli olur. İspat konusunda genel kural iddia edenin iddiasını ispatla yükümlü olmasıdır. Ancak bunun bir takım istisnaları bulunmaktadır: a) Normal Durumun Aksini İspat Bir  davada  ispat  yükünün  yargılamanın  taraﬂ arından  hangisine düşeceği TMK nın İspat yükü başlıklı 6. maddesinde belirtilmiştir. Buna göre; Kanunda aksine bir hüküm bulunmadıkça, taraﬂ ardan her biri, hakkını dayandırdığı olguların varlığını ispatla yükümlüdür. İspat yükünün yanlış tarafa  yüklenmesi  mahkeme  hükmünün  bozulmasını  gerektiren  bir  usuli hatadır.138  İspat  yükü,  kanunda  özel  bir  düzenleme  bulunmadıkça,  iddia edilen vakıaya bağlanan hukuki sonuçtan kendi lehine hak çıkaran tarafa aittir. Kanuni bir karineye dayanan taraf, sadece karinenin temelini oluşturan vakıaya ilişkin ispat yükü altındadır. Kanunda öngörülen istisnalar dışında, karşı taraf, kanuni karinenin aksini ispat edebilir. (HMK, m. 190). Normal veya hayatın olağan akışına uygun bir durumu ileri süren kimse bunu ispatla yükümlü değildir. Bu nedenle, normal durumun aksini ileri süren kimse bunun ispat etmek zorundadır. 137  KURU/ARSLAN/ YILMAZ, s. 360; TIĞLI, s. 253. 138  Yargıtay 11. Hukuk Dairesi, E: 1984/3276. Gazi Üniversitesi Hukuk Fakültesi Dergisi C. XX, Y. 2016, Sa. 2 425Mobbing Davalarında İspat Sorunu Mobbinge  maruz  kaldığını  iddia  eden  davacı  işçi  iddialarını somutlaştırıyor, yer zaman ve olguları açıkça gösteriyor ve tutarlı şekilde davranıyorsa işveren bunun aksini ispat etmelidir. Örneğin, hiçbir neden olmadan mobbing amacıyla yerinin birkaç kez değiştirildiğini iddia eden davacı bunu ispatlamışsa, söz konusu yer veya iş değişikliğinin mobbing değil de işin veya işletmenin gereği olarak yapıldığını işveren ispat etmelidir. b) İspat Yükünün Kanunla Belirlendiği Haller Bazen belli bir vakıayı kimin ispat edeceğini kanun hükmü belirler. Örneğin, haksız fiilde zararın varlığını ispat etmek davacıya (iddia edene) düşer. TBK nın 50. maddesine göre; Zarar gören, zararını ve zarar verenin kusurunu ispat yükü altındadır. Uğranılan zararın miktarı tam olarak ispat edilemiyorsa hâkim, olayların olağan akışını ve zarar görenin aldığı önlemleri göz önünde tutarak, zararın miktarını hakkaniyete uygun olarak belirler. TBK nın 66. maddesine göre; Adam çalıştıran, çalışanın, kendisine verilen işin yapılması sırasında başkalarına verdiği zararı gidermekle yükümlüdür. Adam çalıştıran, çalışanını seçerken, işiyle ilgili talimat verirken, gözetim ve denetimde bulunurken, zararın doğmasını engellemek için gerekli özeni gösterdiğini  ispat  ederse,  sorumlu  olmaz.  Bir  işletmede  adam  çalıştıran, işletmenin çalışma düzeninin zararın doğmasını önlemeye elverişli olduğunu ispat etmedikçe, o işletmenin faaliyetleri dolayısıyla sebep olunan zararı gidermekle yükümlüdür. c) Karineler Sözlük anlamıyla karine, karışık bir iş veya sorunun anlaşılmasına veya çözümlenmesine yarayan durum, ipucu ve belirti olarak açıklanmaktadır.139 Karine, zan yoluyla bilinmeyen bir şeye delalet eden bilinen bir emaredir.140 Fiili karineler, ileri sürülen maddi vakıaların iddia edildiği gibi meydana geldiği konusunda hâkimde belli bir kanaatin oluşmasına katkıda bulunan, yaşam tecrübelerinin ortaya koyduğu, akıl ve mantığa uygun, hukukla ilgili bulunmayan  değer  hükümleridir.  Başka  bir  deyişle  fiili  karineler,  belirli bir olaya işaret eden, fakat kendi başına karar vermeye elverişli bir ispatı sağlayamayan basit tecrübe kuralı olarak açıklanabilir. Doktrinde fiili karine ile olay karinesi birbirinden ayrı değerlendirilmektedir. Olay karinesi ile yasal 139  DEVELLİOĞLU, Ferit, Osmanlıca-Türkçe Ansiklopedik Lügat, 22. Baskı, Aydın Kitabevi, Ankara, 2005, s. 491. 140  ŞEN, Yusuf, İslam Muhakeme Hukukunda Bir İspat Vasıtası Olarak Karine, Yüksek Lisans Tezi, Selçuk Üniversitesi SBE, Konya, 1997, s. 37. 426 Gazi Üniversitesi Hukuk Fakültesi Dergisi C. XX, Y. 2016, Sa. 2Ahmet TAŞKIN olarak formüle edilmiş, somut olaylara dayalı, aksi ispat edilebilir karineler anlaşılmaktadır.141 Karine, adaletin işlemesine yarayan teknik bir yöntemdir. İspat sorununu daha kolay çözmeye yardımcı olur. Karine, bir kesinlik aracı, hukuk  kuralının  oluşması  için  gerekli  unsurların  sayısını  azaltabilmeyi olanaklı kılan bir yol; sadeleştirici ve kolaylaştırıcı bir indirgeme aracıdır ve varsayımdan daha güçlüdür. Çünkü karinenin temelinde bir olasılık veya bilgi ve görgü düşüncesi yatar.142 Hayatın  olağan  akışı  ölçütü  uygulanırken  karineleri  göz  önünde bulundurmak ve buna göre değerlendirme yapmak gerekir.143 Aksi halde neyin  hayatın  normal  akışına  uygun  olduğu  hakkaniyetli  şekilde  ortaya konulamaz.  Hukukta  karine,  bilinenden  bilinmeyeni  çıkarmaya  yarayan hukuki istidlallerdir. Daha geniş olarak ise karineyi, varlığı bilinen olumlu veya olumsuz bir olaydan, diğer olumlu veya olumsuz bir olayın, bir hukuksal durumun  varlığı  veya  yokluğu  sonucunun  çıkarılmasına  olanak  veren kural  olarak  tanımlamak  mümkündür.144  Fiili  karine,  bilinen  vakıalardan bilinmeyenler  hakkında  kanunen  değil  aksine  hâkim  tarafından  çıkarılan sonuçlardır.145 Bir hukuk kuralı ile bağlı olmaksızın, hâkimin insanlar ve yaşam  konusundaki  tecrübelerinden  yararlanarak  belli  olmayan  vakıalar hakkında sonuç çıkarmasıdır.146 Fiili karineler iddia edilen bir olayın gerçekten de iddia edildiği şekilde gerçekleşip gerçekleşmediğini anlamak için somut olaylarda ispat zorluklarında hâkime yardım eder.147 Fiili karine lehine olan taraf, o hususu ispat etmiş sayılır. Diğer bir deyişle kural olarak fiili karinenin aksini ispat yükü karşı tarafa düşer. Fiili karineler bu yönüyle normal olan hususlar gibidir. Kanuni karineler, belli olaydan belli olmayan bir olay için kanun tarafından çıkarılan sonuçlardır. Kanuni karineler ispat yüküne gerçek bir istisna teşkil etmektedir. Bazı kanuni karineler kesindir ve karşı taraf bunun aksini ispat edemez. HMK nın 190. maddesine göre; Kanunda öngörülen istisnalar dışında, karşı taraf, kanuni karinenin aksini ispat edebilir. Örneğin, Yanılma veya aldatma sebebiyle ya da korkutulma sonucunda sözleşme 141  BAŞÖZEN, İlk Görünüş İspatı, s. 75. 142  TAŞPINAR,  s. 533-536. 143 GÖKSU, Mustafa, 6100 Sayılı Hukuk Muhakemeleri Kanunu Çerçevesinde Senetle İspat Kuralları ve Bunların İstisnaları, Hacettepe Hukuk Fakültesi Dergisi, Cilt: 1, Sayı: 1, 2011, s. 63. 144  UMAR, Bilge ve YILMAZ, Ejder, İspat Yükü, İstanbul, 1980, s. 165. 145  TAŞPINAR, s. 536. 146 POSTACIOĞLU, İlhan E. Medeni Usul Hukuku, 1711 Sayılı Kanuna Göre Yazılmış, 6. Bası, İstanbul, 1978, s. 528. 147 TAŞPINAR, s. 537. Gazi Üniversitesi Hukuk Fakültesi Dergisi C. XX, Y. 2016, Sa. 2 427Mobbing Davalarında İspat Sorunu yapan taraf, yanılma veya aldatmayı öğrendiği ya da korkutmanın etkisinin ortadan kalktığı andan başlayarak bir yıl içinde sözleşme ile bağlı olmadığını bildirmez  veya  verdiği  şeyi  geri  istemezse,  sözleşmeyi  onamış  sayılır. (TBK, m. 39). Adi kanuni karineler ise aksi ispat edilebilen karinelerdir. Adi karinenin kendi aleyhine olduğunu ileri süren kimse bunun aksini ispat etmek zorundadır. Örneğin, TMK nın 3. maddesindeki iyiniyet karinesi böyledir. Ancak, durumun gereklerine göre kendisinden beklenen özeni göstermeyen kimse iyiniyet iddiasında bulunamaz. E) İspat Ölçüsü Alman hukukunda ispat ölçüsü teorileri genel olarak sübjektif ispat ölçüsü ve objektif ispat ölçüsü şeklinde ikiye ayrılmaktadır. 1) Sübjektif İspat Ölçüsü Sübjektif ispat ölçüsü teorisine göre; hâkim, olayın gerçekleştiğine ilişkin  yeterli  kanaati  edinmişse,  kararını  vermelidir.  Hâkimin  kanaate ulaşabilmesi için, somut olayların bilinmesi zorunlu olduğundan, tecrübe kuralları  ile  mantık  kuralları  serbest  iradenin  objektif  sınırını  çizer.  Bir olayın ispatlanmış sayılması için, hâkimde o olayın iddia edildiği şekilde gerçekleştiğine yönelik kanaat olaşması gerekir. Bu nedenle sübjektif ispat teorisi gerçek kanaat teorisi olarak da isimlendirilmiştir.148 Özel hukuk alanında Türk hukuku açısında kabul edilmesi gereken ispat vicdani kanaat ölçüsüdür. Hâkimler anayasaya, kanuna ve hukuka uygun olarak vicdani kanaatlerine göre hüküm (karar) verirler. Bu kanaatin oluşması  bazen  ağırlıklı  ihtimal  (%51-%89),  bazen  kesine  yakın  (%90%99) ihtimal ve bazen de kesinlik (%100) sınırıdır. Hâkim, yargılamanın taraﬂ arından  biri  lehine  karar  vermek  zorunda  olduğundan  çoğu  zaman ağırlıklı kanaat karar için yeterli olacaktır. Hâkimin somut olay hakkındaki kanaati ne ölçüde olursa olsun kararı yeterli açıklıkta bir gerekçeye dayanmak zorundadır.  Çünkü  gerekçesiz  hüküm  olamaz.  Kararlar  hukukiliğini  ve vicdaniliğini gerekçelerinden alırlar. Mahkeme kararlarında yer alan tatmin edici bir gerekçe, hâkimin sübjektif veya keyfi davranmadığını gösteren ve taraﬂ ara adil bir yargılama yapıldığı hissini veren en temel ölçüttür. İki tarafı dinlemeden verilen karar hukuken doğru olsa da adil olamayacağı gibi hiç veya yeterli bir gerekçe içermeyen hüküm de doğru olsa bile adil sayılamaz. Hâkim, ibraz edilen delilleri değerlendirerek objektif bir kanaate varır. İddialar olayın gerçek oluşuna ve hayatın olağan akışına uygun, tutarlı, ölçülü ve mantıklıysa, 148  BAŞÖZEN, İlk Görünüş İspatı, s.117-118. 428 Gazi Üniversitesi Hukuk Fakültesi Dergisi C. XX, Y. 2016, Sa. 2Ahmet TAŞKIN ileri sürülen deliller kısmen de olsa iddiayı ve olanları doğruluyor ve bunlarla bütünlük gösteriyorsa hâkimin kanaati güçlenir. Hukuki değerlendirmelere ve hukuk biliminde var olan yorum metotlarına dayanmayan çıkarımlar ve yargılar hâkimin kararını keyfiliğe götürür. 2) Objektif İspat Ölçüsü Bu teoriye göre hâkimin kanaatinin oluştuğunun kabul edilebilmesi için objektif bir dayanak noktası bulunmalı ve hâkimin şahsi kanaati yeterli olmamalıdır. Hâkimin kanaati yargılamaya konu dava dosyasında bulunan objektif bir bilgiye dayanır. Bu teoriye göre de hâkimin mutlak bir kanaate ulaşması gerekli değildir. Çünkü özel hukukta ve özellikle de iş hukukunda aranan gerçeklik, bilimsel bir gerçeklik olmadığı gibi ceza yargılamasında aranan mutlak bir kesin inanış da değildir. Hâkimin olayın gerçekleştiği yönündeki  kanaati  mutlak  gerçeğin  o  olduğu  anlamına  gelmez.149  Bazı durumlarda, hâkimde tam kanaati oluşturan delillerin ispat yükünü taşıyan taraftan beklemek dürüstlük kuralına aykırılık teşkil eder. İspat güçlüğü veya ispat imkânsızlığı hallerinde ispat ölçüsü de düşürülmelidir.150 Bu husus, yargılamada silahların eşitliği ilkesinin de bir sonucu olarak görülmelidir. İspat ölçüsünün düşürülmesi ve yaklaşık ispatla yetinilmesi, ancak, takdiri delillerle ispatın geçerli olduğu durumlar içindir. Kesin delillerle ispatlanılması gereken olaylar bakımından kural olarak ispat ölçüsünün düşürülmesinden söz edilemez.151 Mobbing konusu da delille ispatı zor konulardan birisini teşkil etmektedir. Çünkü çoğu zaman mobbing gizli ve sinsice yürütülmekte, genellikle davranışlar tek tek ele alındığında mobbing fark edilmemektedir. Özellikle mobbingin işveren veya onun vekilinden geldiği durumlarda (düşey mobbing) mağdurun tanık bulması oldukça güçtür. Bu nedenle mobbingde somut olaya göre ispat ölçüsü düşürülmelidir. SONUÇ Mobbing, insanların iş veya görev icabı bir arada bulundukları her ortamda öteden beri var olan, benzer kavramlarla karıştırılsa da her geçen gün  daha  fazla  davaya  konu  edilen,  unsurlarında  ve  ispatlanmasında ciddi  sorunlar  bulunan  bir  kavramdır.  Mobbingin  niteliğinde  ve  özünde hedef alınan kişiyi rahatsız edecek ve onu bıktıracak davranışların gizli ve sinsi şekilde tekrarlanması söz konusudur. Mağdurlar çoğu zaman hedef alındıklarını ve mobbinge maruz kaldıklarını belli bir süre geçtikten sonra 149  BAŞÖZEN, İlk Görünüş İspatı, s.120. 150  Bkz. ATALAY, s. 44. 151  ATALAY, s. 44-45. Gazi Üniversitesi Hukuk Fakültesi Dergisi C. XX, Y. 2016, Sa. 2 429Mobbing Davalarında İspat Sorunu fark etmekte, çoğunlukla yalnız bırakılmakta ve en yaygın ispat yöntemi olan  tanık  beyanlarından  mahrum  kalmaktadırlar.  Mobbing  mağdurları saldırının  hedefi  olurken  yalnız  oldukları  gibi  yargılama  sırasında  delil bulup mahkemeye sunarken de yalnızdır. Mobbingin ispatlanmasında doktor raporları gerekli olmadığı halde doktor raporunun olmaması mağdur aleyhine değerlendirilebilmektedir. Mobbingin özellikle işveren veya vekili tarafından yapılması halinde buna maruz kalan kimsenin tanık başta olmak üzere delil bulmakta zorlanacağı aşikârdır. Mobbing konusunda yapılan araştırma ve anketlere göre her yıl binlerce insanın mobbing mağduru olduğu ortaya konulmaktadır. Buna rağmen bunlardan onlarla ifade edilen kısmının dava açması, bunların da bir kısmının manevi tazminat talebinde bulunmaması ispatta çekilen güçlüğün bir sonucudur. Mobbing iddiası ve buna bağlı olarak manevi tazminat istemiyle açılan davaların  büyük  çoğunluğu  mahkemelerce  reddedilmektedir. Aynı  durum Yargıtay için de söz konusudur. Örneğin, 2010-2015 yılları arasında mobbing iddiası  içeren  221  davadan  sadece  54 ünde  manevi  tazminat  talebinde bulunulmuş, bunlardan da yalnızca 11 i manevi tazminat talebinin kabulü ile sonuçlanmıştır. Özel hukukta vicdani kanaatin oluşmasını gerektirecek bir ispatın yeterli olması gerekirken kesin ispatın arandığı davalara rastlanmaktadır. Taraﬂ ar, kanunda belirtilen süre ve usule uygun olarak ispat hakkına sahiptir. Hukuka aykırı olarak elde edilmiş olan deliller, mahkeme tarafından bir vakıanın ispatında dikkate alınamaz. Kanunun belirli delillerle ispatını emrettiği hususlar, başka delillerle ispat olunamaz. Bir vakıanın ispatı için gösterilen delilin caiz olup olmadığına mahkemece karar verilir. Herkesçe bilinen vakıaların ispatı gerekli değildir. Taraﬂ ar ispat hakkının bir gereği olarak başka yerde bulunun bir delilin getirtilmesini mahkemeden isteyebilir. Bu çerçevede, taraﬂ arın ellerinde bulunmayan ve incelenmesine karar verilen delillerin  getirtilmesi  için,  mahkemece  ilgili  resmî  makam  ve  mercilerle üçüncü kişilere bu husus bildirilir. Mahkemeye getirtilmesi mümkün olmayan deliller, bulunduğu yerde incelenebilir veya dinlenebilir. Mobbinge maruz kalan kimsenin kendi lehine delil toplamak amacıyla kendisiyle ilgili ses ve görüntü kayıtlarını mahkemeye sunması hukuka aykırı delil olarak görülemez. Bu  nedenle;  mobbing  gibi  ispat  güçlüğünün  bulunduğu  durumlarda  hak kaybının önlenmesi ve adaletli bir sonuca ulaşılabilmesi için emare ispatı, fiili karineler, ispat kolaylığı ve ilk görünüş ispatı gibi hukuki kurumların kullanılması zorunludur. 430 Gazi Üniversitesi Hukuk Fakültesi Dergisi C. XX, Y. 2016, Sa. 2Ahmet TAŞKIN KAYNAKLAR ACAR,  Aslı  Beyhan  ve  DÜNDAR,  Gönen,  İşyerinde  Psikolojik Yıldırmaya  (Mobbing)  Maruz  Kalma  Sıklığı  ile  Demografik  Özellikler Arasındaki  İlişkinin  İncelenmesi,  İstanbul  Üniversitesi  İşletme  Fakültesi Dergisi, Cilt: 37, Sayı: 2, 2008. AKCAN, Recep, Yargıtay Kararlarındaki Güçlü Delil Kavramının Hukuki Niteliği, Selçuk Üniversitesi HFD, Cilt: 12, Sayı: 1-2, 2004. AKİL, Cenk, Yargıtay Kararları Işığında Medeni Yargılama Hukukunda Hukuka Aykırı Biçimde Elde Edilmiş Delillerin Değerlendirilip Değerlendirilemeyeceği Meselesi, AÜHFD, Cilt: 61, Sayı: 4, 2012ç ALANGOYA, Yavuz, Medeni Usul Hukuku Esasları, İstanbul, 2003. ALBAYRAK, Hakan ve YUVALI, Ertuğrul, İşverenin Eşit Davranma Borcuna Aykırı Davrandığı İddialarının İspat Hukuku Açısından Değerlendirilmesi, İSGHD, Cilt: 9, Sayı: 34, 2012. ALBAYRAK,  Hakan,  Yaklaşık  İspat,  Yayımlanmış  Doktora  Tezi, Selçuk Üniversitesi SBE, Konya, 2012. ATALAY, Oğuz, Medenî Usul Hukukunda Menfi Vakıaların İspatı, İzmir, 2001. ATASOY, Işık, Sağlık Sektöründe Mobbing: Sakarya İlinde Kamu ve Özel Hastanelerde Çalışan Ebe ve Hemşireler Üzerine Bir Araştırma, Yüksek Lisans Tezi, Sakarya, 2010. AYDIN, Şule ve ÖZKUL, Emrah, İş Yerinde Yaşanan Psikolojik Şiddetin Yapısı ve Boyutları: 4-5 Yıldızlı Otel İşletmeleri Örneği, Anadolu Üniversitesi Sosyal Bilimler Dergisi, Cilt: 7, Sayı:2, 2007. BAĞ, Beyhan, Bir Şiddet Türü Olarak Saplantılı Takip Etme Hali, ZfWT Vol. 4, No. 1, 2012. BAŞÖZEN, Ahmet, Tıbbi Müdahaleden Kaynaklanan Tazminat Davalarında İspat Sorunları, Hukuk, Ekonomi ve Siyasal Bilimler Aylık İnternet Dergisi, Sayı: 119, Ocak 2012. (İspat Sorunları) BAŞÖZEN, Ahmet, Medeni Usul Hukukunda İlk Görünüş İspatı, Adalet Yayınevi, Ankara, 2010. (İlk Görünüş İspatı). BEDEIAN, A.G., Even if the Tower is Ivory, It isn t White: Understanding the Consequences of Faculty Cynicism, Academy of Management Learning & Education, Volume: 6, No: 1, 2007. Gazi Üniversitesi Hukuk Fakültesi Dergisi C. XX, Y. 2016, Sa. 2 431Mobbing Davalarında İspat Sorunu BİLGEL, Nazan, AYTAÇ, Serpil ve BAYRAM, Nuran, İşyerinde Yıldırma Davranışı, in: İşyerinde Şiddet, Ed: Serpil Aytaç ve Nuran Bayram, Beta Yayınları, İstanbul, 2011. BOZBEL,  Savaş  ve  PALAZ,  Serap,  İşyerinde  Psikolojik  Taciz (Mobbing) ve Hukuki Sonuçları, TİSK Akademi, Cilt: 2, Sayı; 3, 2007. BRIDGE,  Berna,  Zorbalık-Mobbing:  Bilinmeyen  Çeşitleri  ve Çözümleri, 2. Baskı, Beyaz Yayınları, İstanbul, 2010. BÜTE, Mustafa, İşyerinde Psikolojik Yıldırma (Mobbing) Olgusu: Erzurum da İlaç Mümessilleri Üzerinde Bir Araştırma, 17. Ulusal Yönetim ve Organizasyon Kongresi, Eskişehir, 21-23 Mayıs 2009. CALVIN, Dan, Workplace Bullying Statutes And The Potential Eﬀ ect On  Small  Business,  Ohio  State  Entrepreneurial  Business  Law  Journal, Volume: 7, No:1,  2012. CEMALOĞLU, Necati, Örgütlerin Kaçınılmaz Sorunu: Yıldırma, Bilig, Sayı: 42, 2007. ÇUKUR, Cengiz, İşyerinde Psikolojik Taciz (Mobbing), ÇEİŞ, Mart, 2012. DAVENPORT, Noa, SCHWARTZ, Ruth Distler ve ELLIOTT, Gail Pursell,  Mobbing  İşyerinde  Duygusal  Taciz,  Sistem  Yayıncılık,  İstanbul Davenport, Swartz ve Elliot, 2003. DELEN, Meltem Güngör, Çalışma Hayatında İşyeri Kabalığı Olgusu, Maliye Araştırma Merkezi Konferansları, Sayı: 53, 2010. DELİDUMAN, Seyithan, Medeni Usul Hukukunda Senet ve Senetlerle Yazılı Şekil Arasındaki İlişki, AÜEHFD, Cilt: 4, Sayı: 1-2, 2000 DEVELLİOĞLU, Ferit, Osmanlıca-Türkçe Ansiklopedik Lügat, 22. Baskı, Aydın Kitabevi, Ankara, 2005. DURSUN, Salih, İşyeri Şiddetinin Çalışanların Tükenmişlik Düzeyi Üzerine Etkisi: Sağlık Sektöründe Bir Uygulama, Çalışma İlişkileri Dergisi, Cilt: 3, Sayı: 1, Ocak, 2012. EINARSEN, Ståle, S. The Nature and Causes of Bullying at Work, International Journal of Manpower, Volume: 20, No:1/2, Einarsen, 1999. ERDEM,  Mustafa  Ruhan  ve  PARLAK,  Benay,  Ceza  Hukuku Boyutuyla Mobbing, TBB Dergisi, Sayı: 88, 2010. 432 Gazi Üniversitesi Hukuk Fakültesi Dergisi C. XX, Y. 2016, Sa. 2Ahmet TAŞKIN ERDÖNMEZ,  Güray,  Hukuk  Muhakemeleri  Kanunu na  Göre Delillerin Gösterilmesi ve İbrazı, İstanbul Barosu Dergisi, Cilt: 87, Sayı: 5, Eylül-Ekim 2013. FETTAHLIOĞLU,  Tamara,  Örgütlerde  Yabancılaşmanın  Yönetimi: Kahramanmaraş Özel İşletme ve Kamu Kuruluşlarında Karşılaştırmalı Bir Araştırma, Kahramanmaraş Sütçü İmam Üniversitesi SBE, Yüksek Lisan Tezi, Kahramanmaraş, 2012. GÖKSU,  Mustafa,  6100  Sayılı  Hukuk  Muhakemeleri  Kanunu Çerçevesinde  Senetle  İspat  Kuralları  ve  Bunların  İstisnaları,  Hacettepe Hukuk Fakültesi Dergisi, Cilt: 1, Sayı: 1, 2011. GROEBLINGHOFF, Dieter ve BECKER, Michael, A Case Study of Mobbing and the Clinical Treatment of Mobbing Victims, European Journal of Work and Organizational Psychology, Vol: 5, No: 2, 1996. GÜL,  Hasan  ve  AĞIRÖZ,  Aliye,  Mobbing  ve  Örgütsel  Sinizm Arasındaki İlişkiler: Hemşireler Üzerinde Bir Uygulama, Afyon Kocatepe Üniversitesi, İİBF Dergisi, Cilt: XIII, Sayı: II, 2011. GÜMAN, Nihat, Medeni Yargılama Hukuku Açısından Taciz, CHD, Yıl: 4, Sayı: 11, Aralık 2009. GÜN,  Hüseyin,  Çalışma  Ortamında  Psikolojik  Taciz:  Mobbing/ Bullying, 2. Baskı, Lazer Yayınları, Ankara, 2010. KÂHYA, Cem, Örgütsel Sinizm, İş Performansını Etkiler mi? İş Tatminin Aracılık Etkisi, Küresel İktisat ve İşletme Çalışmaları Dergisi, Yıl: 2, Sayı: 3, Bahar, 2013. KARAKUŞ, Hatice, Bir İçerik Analizi Örneği: Çalışma Hayatında Mobbing Olduğuna Kanaat Getiren Yargıtay Kararları, Uluslararası Sosyal Araştırmalar Dergisi, Cilt: 6 Sayı: 28, Güz 2013. KARAMAN, Hayreddin, Ana Hatlarıyla İslâm Hukuku-Giriş ve Amme Hukuku-, Acar Matbaacılık, İstanbul 1987, I/330; Fahrettin Atar, İslâm Adliye Teşkilatı, Gaye Matbaası, Ankara 1979. KARSLI,  Abdurrahman,  Medeni  Muhakeme  Hukuku,  3.  Baskı, Alternatif Yayıncılık, İstanbul, 2012. KAYA,  Çiğdem,  Cerrahi  Hemşirelerinin  Mobbinge  Maruz  Kalma Durumlarının  Belirlenmesi  ve  Mobbingin  Hemşirelerin  Motivasyonları Üzerine Olan Etkisinin İncelenmesi, Yüksek Lisans Tezi, Afyon Kocatepe Gazi Üniversitesi Hukuk Fakültesi Dergisi C. XX, Y. 2016, Sa. 2 433Mobbing Davalarında İspat Sorunu Üniversitesi SBE, Afyonkarahisar, 2012. KILIÇ, Mustafa, Örgütsel Çatışma ve Yönetimi, in: Yönetim ve Organizasyon, Ed: Salih Güney, 2. Baskı, Nobel Yayınları, Ankara, 2007. KOÇHİSARLIOĞLU,  Cengiz,  Karine  ve  Borçlar  Kanununun  96. Maddesindeki Kusur Karinesi, Yargıtay Dergisi, Cilt: 10, Temmuz, Sayı: 3, 1984. KONURALP,  Haluk,  Rekabet  Hukukunda  Deliller  ve Değerlendirilmesi, in: Rekabet Hukukunda Güncel Gelişmeler Sempozyumu, V, 6-7 Nisan, Kayseri, 11-22, 2007. KÖKKILINÇ,  Ayşe  Gül,  İş  Hukukunun  Uluslararası  Kaynakları Işığında Kadın İşçilerin Korunması, Legal Yayınları, İstanbul, 2013. KURU, Baki, ARSLAN, Ramazan ve YILMAZ, Ejder, Medenî Usul Hukuku, 22. Bası, Ankara 2012. KURU, Baki, Hukuk Muhakemeleri Usulü, 6. Baskı, Demir Demir Yayıncılık, İstanbul 2001. LEYMANN, Heinz, The Content and Development of Mobbing at Work, European Journal of Work and Organizational Psychology, Volume: 5, Issue: 2, s.1996. MARTIN, Roberta, Workplace Incivility, Allworth Juniper, Issue:7, Autumn, 2003. MUŞUL, Timuçin, Medeni Usul Hukuku, 3. Baskı, Adalet Yayınevi, Ankara, 2012. NAMIE, Gary and NAMIE, Ruth, The bully at work. Naperville, IL: Sourcebooks Inc., 2000. ÖCAL, Bahar, Roma Medeni Usul Hukukunda Yargıcın Delilleri Takdiri, AÜHFD, Cilt: 60, Sayı: 3, 2011. ÖZEN,  Yener,  Saldırganlık,  Psikolojik  Şiddet  ve  Duygusal  Zekâ Arasındaki İlişki, Akademik Bakış Dergisi, Sayı: 35, 2013. PEKCANITEZ, Hakan, ATALAY, Oğuz ve ÖZEKES, Muhammet, Medeni Usul Hukuku, 13. Bası, Yetkin Yayınları, Ankara, 2011. POSTACIOĞLU, İlhan E. Medeni Usul Hukuku, 1711 Sayılı Kanuna Göre Yazılmış, 6. Bası, İstanbul, 1978. ROXIN,  Claus  İspat  Hukukunun  Esasları,  Çev: Yener  ÜNVER, 434 Gazi Üniversitesi Hukuk Fakültesi Dergisi C. XX, Y. 2016, Sa. 2Ahmet TAŞKIN İstanbul Ticaret Üniversitesi Sosyal Bilimler Dergisi, Cilt:2, Sayı:8, Yıl:4,  Güz 2005. RÜZGARESEN,  Cumhur,  İﬂ âs  Hukukunda  Borcun  Ödenmeme Tehlikesi ve Başvuru Yolları, Hukuk, Ekonomi ve Siyasal Bilimler Aylık İnternet Dergisi, Sayı: 110, Nisan 2011. SAĞIR, Tuba ve OĞUZ, Ebru, Öğretmenlere Yönelik Örgütsel Sinizm Ölçeğinin Geliştirilmesi, International Journal of Human Sciences, Volume: 9, Issue: 2, 2012. SMITH, P.K. at al., Definitions of Bullying: A Comparison of Terms Used, and Age and Gender Diﬀ erences, in a Fourteen-Country International Comparison, Child Development, July-August, Volume: 73, Number: 4, 2002. SOLMUŞ, Tarık, İşyeri Terapisi: İş Yaşamında Kişilik ve Davranış Sorunları, Papatya Yayıncılık, İstanbul, 2010. ŞEN, Yusuf, İslam Muhakeme Hukukunda Bir İspat Vasıtası Olarak Karine, Yüksek Lisans Tezi, Selçuk Üniversitesi SBE, Konya, 1997. ŞİMŞEK, M. Şerif, AKGEMCİ, Tahir ve ÇELİK, Adnan, Davranış Bilimlerine Giriş ve Örgütlerde Davranış, 7. Baskı, Gazi Kitabevi, Ankara, 2011. TAŞKIN,  Ahmet,  İşyerinde  Mobbing  ve  Mobbing  Benzeri Davranışlar, Yargıtay Dergisi, Cilt: 39, Sayı: 3, Temmuz 2013. TAŞKIN,  Ahmet,  İş  Hukuku  Kapsamında  İşyeri  ve  İşletmelerde Mobbing,  Yayımlanmamış  Doktora  Tezi,  İstanbul  Üniversitesi  Adli  Tıp Enstitüsü, İstanbul, 2016. TAŞPINAR, Sema, Fiili Karinelerin İspat Yükünün Dağılımındaki Rolü, AÜHFD, Cilt: 45, Sayı: 1-4, 1996. TENGER, Feyza, İslâm Hukukunda Hâkimin Takdir Yetkisi Bağlamında Kendi Bilgisiyle Hüküm Vermesi, Yüksek Lisans Tezi, Ankara Üniversitesi Sosyal Bilimler Enstitüsü, Ankara, 2006. TETİK,  Semra,  Mobbing  Kavramı:  Birey  ve  Örgütler Açısından Önemi, KMÜ Sosyal ve Ekonomik Araştırmalar Dergisi, Cilt: 12, Sayı: 18, 2010. TEVRÜZ, Suna, ERDEM, İnci ve BOZKURT, Tülay, Davranışlarımızdan Seçmeler: Örgütsel Yaklaşım, 3. Baskı, Nobel Yayınları, Ankara, 2012. Gazi Üniversitesi Hukuk Fakültesi Dergisi C. XX, Y. 2016, Sa. 2 435Mobbing Davalarında İspat Sorunu TIĞLI, Hüseyin, HMK Hükümleri Çerçevesinde İspat Yükü, Adalet Dergisi, Sayı: 43, 2012. TINAZ, Pınar, İşyerinde Psikolojik Taciz (Mobbing): Kavram, Süreç, Tanı ve Çözüm Önerileri, in: CHD, Yıl: 4, Sayı: 11, Aralık 2009, s. 11. (Tanı ve Çözüm Önerileri). TINAZ, Pınar, BAYRAM, Fuat ve ERGİN, Hediye, Çalışma Psikolojisi ve Hukuki Boyutlarıyla İşyerinde Psikolojik Taciz (Mobbing), Beta Yayınları, İstanbul, 2008. TINAZ, Pınar, İşyerinde Psikolojik Taciz (Mobbing), Beta Yayınları, İstanbul, 2006. TOKGÖZ, Nuray, Örgütsel Sinisizm, Örgütsel Destek ve Örgütsel Adalet İlişkisi: Elektrik Dağıtım İşletmesi Çalışanları Örneği, Eskişehir Osmangazi Üniversitesi İİBF Dergisi, Cilt: 6, Sayı: 2, Ekim 2011. TOKGÖZ, Nuray ve YILMAZ, Hakan, Örgütsel Sinisizm: Eskişehir ve Alanya daki Otel İşletmelerinde Bir Uygulama, Anadolu Üniversitesi Sosyal Bilimler Dergisi, Cilt: 8, No: 2, 2008. TOPÇU, İbrahim vd., Sağlık Çalışanlarında Örgütsel Sinizm Ölçeğinin Geçerlik ve Güvenirliği, Dokuz Eylül Üniversitesi Hemşirelik Yüksekokulu Elektronik Dergisi, Cilt: 6, Sayı: 3, 2013. TRUDEL, Jeannie, Workplace Incivility: Relationship With Conﬂ ict Management Styles and Impact on Perceived Job Performance, Organizational Commitment and Turnover, College of Education and Human Development Department of Leadership, Foundations and Human Resource Education University of Louisville, KY, August 2009 TÜRKMEN, Ahmet, Yeni Bir Hukuki Olgu Olarak Israrlı Takip ve Taciz (Stalking) ve Bunun Türk Medeni Hukuku Bakımından Değerlendirilmesi, DEÜHFD, Cilt: 11, Özel Sayı, 2009. UMAR, Bilge ve YILMAZ, Ejder, İspat Yükü, İstanbul, 1980. UMAR, Bilge, Hukuk Muhakemeleri Kanunu, Şerhi, Yetkin Yayınları, Ankara, 2011. ÜNVER, Yener, Ceza Hukuku Açısından Mobbing, Stalking ve Cinsel Taciz Eylemleri, CHD, Yıl: 4, Sayı: 11, Aralık 2009. VANDEKERCKHOVE, Wim ve COMMERS, Ronald, Downward Workplace Mobbing: A Sign of the Times, Journal of Business Ethics, 436 Gazi Üniversitesi Hukuk Fakültesi Dergisi C. XX, Y. 2016, Sa. 2Ahmet TAŞKIN Volume: 45, 2003.. WESTHUES, Kenneth at al, The Remedy and Prevention of Mobbing in Higher Education, Edwin Mellen Press, New York, 2006. WESTHUES, Kenneth, The Mobbings at Medaille College, in 2002, Canada: University of Waterloo, October, 2002. When Working Becomes Hazardous, World of Work: The Magazine of The ILO, No: 26, Sept./Oct. 1998. www.ntv.com.tr/ekonomi/turkiyenin-mobbingkarnesi,8BnQH_8zkKZbbhJfUlAg (Erişim Tarihi: 17.3.2016) YILDIRIM,  M.  Kamil,  Medeni  Usul  Hukukunda  Delillerin Değerlendirilmesi, İstanbul, 1990. YILDIZ, Kaya, AKGÜN, Nuri ve YILDIZ, Sevilay, İşe Yabancılaşma ile  Örgütsel  Sinizm Arasındaki  İlişki, The  Journal  of Academic  Social Science Studies, Volume: 6, Issue: 6, Haziran, 2013. YILDIZ, Selver ve KILKIŞ, İlknur, Psikolojik Taciz Olgusuna 4857 Sayılı İş Kanunu Açısından Bir Bakış, Çalışma İlişkileri Dergisi, Cilt:1, Sayı:1, 2010. YILMAZ, Ejder, Hukuk Sözlüğü, Ankara, 2002. YÜCETÜRK,  Elif,  Örgütlerde  Durdurulamayan  Yıldırma Uygulamaları: Düş mü? Gerçek mi? 11. Ulusal Yönetim ve Organizasyon Kongresi Bildiriler Kitabı, Afyon Kocatepe Üniversitesi Yayın No:57, 22-24 Mayıs, 2003. Gazi Üniversitesi Hukuk Fakültesi Dergisi C. XX, Y. 2016, Sa. 2 437",
     "Kaynakça": "ACAR,  Aslı  Beyhan  ve  DÜNDAR,  Gönen,  İşyerinde  Psikolojik Yıldırmaya  (Mobbing)  Maruz  Kalma  Sıklığı  ile  Demografik  Özellikler Arasındaki  İlişkinin  İncelenmesi,  İstanbul  Üniversitesi  İşletme  Fakültesi Dergisi, Cilt: 37, Sayı: 2, 2008. AKCAN, Recep, “Yargıtay Kararlarındaki Güçlü Delil Kavramının Hukuki Niteliği”, Selçuk Üniversitesi HFD, Cilt: 12, Sayı: 1-2, 2004. AKİL, Cenk, “Yargıtay Kararları Işığında Medeni Yargılama Hukukunda Hukuka Aykırı Biçimde Elde Edilmiş Delillerin Değerlendirilip Değerlendirilemeyeceği Meselesi”, AÜHFD, Cilt: 61, Sayı: 4, 2012ç ALANGOYA, Yavuz, Medeni Usul Hukuku Esasları, İstanbul, 2003. ALBAYRAK, Hakan ve YUVALI, Ertuğrul, “İşverenin Eşit Davranma Borcuna Aykırı Davrandığı İddialarının İspat Hukuku Açısından Değerlendirilmesi”, İSGHD, Cilt: 9, Sayı: 34, 2012. ALBAYRAK,  Hakan,  Yaklaşık  İspat,  Yayımlanmış  Doktora  Tezi, Selçuk Üniversitesi SBE, Konya, 2012. ATALAY, Oğuz, Medenî Usul Hukukunda Menfi Vakıaların İspatı, İzmir, 2001. ATASOY, Işık, Sağlık Sektöründe Mobbing: Sakarya İlinde Kamu ve Özel Hastanelerde Çalışan Ebe ve Hemşireler Üzerine Bir Araştırma, Yüksek Lisans Tezi, Sakarya, 2010. AYDIN, Şule ve ÖZKUL, Emrah, “İş Yerinde Yaşanan Psikolojik Şiddetin Yapısı ve Boyutları: 4-5 Yıldızlı Otel İşletmeleri Örneği”, Anadolu Üniversitesi Sosyal Bilimler Dergisi, Cilt: 7, Sayı:2, 2007. BAĞ, Beyhan, “Bir Şiddet Türü Olarak Saplantılı Takip Etme Hali”, ZfWT Vol. 4, No. 1, 2012. BAŞÖZEN, Ahmet, “Tıbbi Müdahaleden Kaynaklanan Tazminat Davalarında İspat Sorunları”, Hukuk, Ekonomi ve Siyasal Bilimler Aylık İnternet Dergisi, Sayı: 119, Ocak 2012. (İspat Sorunları) BAŞÖZEN, Ahmet, Medeni Usul Hukukunda İlk Görünüş İspatı, Adalet Yayınevi, Ankara, 2010. (İlk Görünüş İspatı). BEDEIAN, A.G., “Even if the Tower is Ivory, It isn t White: Understanding the Consequences of Faculty Cynicism”, Academy of Management Learning & Education, Volume: 6, No: 1, 2007. Gazi Üniversitesi Hukuk Fakültesi Dergisi C. XX, Y. 2016, Sa. 2 431Mobbing Davalarında İspat Sorunu BİLGEL, Nazan, AYTAÇ, Serpil ve BAYRAM, Nuran, “İşyerinde Yıldırma Davranışı”, in: İşyerinde Şiddet, Ed: Serpil Aytaç ve Nuran Bayram, Beta Yayınları, İstanbul, 2011. BOZBEL,  Savaş  ve  PALAZ,  Serap,  “İşyerinde  Psikolojik  Taciz (Mobbing) ve Hukuki Sonuçları”, TİSK Akademi, Cilt: 2, Sayı; 3, 2007. BRIDGE,  Berna,  Zorbalık-Mobbing:  Bilinmeyen  Çeşitleri  ve Çözümleri, 2. Baskı, Beyaz Yayınları, İstanbul, 2010. BÜTE, Mustafa, “İşyerinde Psikolojik Yıldırma (Mobbing) Olgusu: Erzurum da İlaç Mümessilleri Üzerinde Bir Araştırma”, 17. Ulusal Yönetim ve Organizasyon Kongresi, Eskişehir, 21-23 Mayıs 2009. CALVIN, Dan, “Workplace Bullying Statutes And The Potential Eﬀ ect On  Small  Business,  Ohio  State  Entrepreneurial  Business  Law  Journal”, Volume: 7, No:1,  2012. CEMALOĞLU, Necati, “Örgütlerin Kaçınılmaz Sorunu: Yıldırma”, Bilig, Sayı: 42, 2007. ÇUKUR, Cengiz, “İşyerinde Psikolojik Taciz (Mobbing)”, ÇEİŞ, Mart, 2012. DAVENPORT, Noa, SCHWARTZ, Ruth Distler ve ELLIOTT, Gail Pursell,  Mobbing  İşyerinde  Duygusal  Taciz,  Sistem  Yayıncılık,  İstanbul Davenport, Swartz ve Elliot, 2003. DELEN, Meltem Güngör, “Çalışma Hayatında İşyeri Kabalığı Olgusu”, Maliye Araştırma Merkezi Konferansları, Sayı: 53, 2010. DELİDUMAN, Seyithan, “Medeni Usul Hukukunda Senet ve Senetlerle Yazılı Şekil Arasındaki İlişki”, AÜEHFD, Cilt: 4, Sayı: 1-2, 2000 DEVELLİOĞLU, Ferit, Osmanlıca-Türkçe Ansiklopedik Lügat, 22. Baskı, Aydın Kitabevi, Ankara, 2005. DURSUN, Salih, “İşyeri Şiddetinin Çalışanların Tükenmişlik Düzeyi Üzerine Etkisi: Sağlık Sektöründe Bir Uygulama”, Çalışma İlişkileri Dergisi, Cilt: 3, Sayı: 1, Ocak, 2012. EINARSEN, Ståle, S. “The Nature and Causes of Bullying at Work”, International Journal of Manpower, Volume: 20, No:1/2, Einarsen, 1999. ERDEM,  Mustafa  Ruhan  ve  PARLAK,  Benay,  “Ceza  Hukuku Boyutuyla Mobbing”, TBB Dergisi, Sayı: 88, 2010. 432 Gazi Üniversitesi Hukuk Fakültesi Dergisi C. XX, Y. 2016, Sa. 2Ahmet TAŞKIN ERDÖNMEZ,  Güray,  “Hukuk  Muhakemeleri  Kanunu na  Göre Delillerin Gösterilmesi ve İbrazı, İstanbul Barosu Dergisi, Cilt: 87, Sayı: 5, Eylül-Ekim 2013. FETTAHLIOĞLU,  Tamara,  Örgütlerde  Yabancılaşmanın  Yönetimi: Kahramanmaraş Özel İşletme ve Kamu Kuruluşlarında Karşılaştırmalı Bir Araştırma, Kahramanmaraş Sütçü İmam Üniversitesi SBE, Yüksek Lisan Tezi, Kahramanmaraş, 2012. GÖKSU,  Mustafa,  “6100  Sayılı  Hukuk  Muhakemeleri  Kanunu Çerçevesinde  Senetle  İspat  Kuralları  ve  Bunların  İstisnaları”,  Hacettepe Hukuk Fakültesi Dergisi, Cilt: 1, Sayı: 1, 2011. GROEBLINGHOFF, Dieter ve BECKER, Michael, “A Case Study of Mobbing and the Clinical Treatment of Mobbing Victims”, European Journal of Work and Organizational Psychology, Vol: 5, No: 2, 1996. GÜL,  Hasan  ve  AĞIRÖZ,  Aliye,  “Mobbing  ve  Örgütsel  Sinizm Arasındaki İlişkiler: Hemşireler Üzerinde Bir Uygulama”, Afyon Kocatepe Üniversitesi, İİBF Dergisi, Cilt: XIII, Sayı: II, 2011. GÜMAN, Nihat, “Medeni Yargılama Hukuku Açısından Taciz”, CHD, Yıl: 4, Sayı: 11, Aralık 2009. GÜN,  Hüseyin,  Çalışma  Ortamında  Psikolojik  Taciz:  Mobbing/ Bullying, 2. Baskı, Lazer Yayınları, Ankara, 2010. KÂHYA, Cem, “Örgütsel Sinizm, İş Performansını Etkiler mi? İş Tatminin Aracılık Etkisi”, Küresel İktisat ve İşletme Çalışmaları Dergisi, Yıl: 2, Sayı: 3, Bahar, 2013. KARAKUŞ, Hatice, “Bir İçerik Analizi Örneği: Çalışma Hayatında Mobbing Olduğuna Kanaat Getiren Yargıtay Kararları”, Uluslararası Sosyal Araştırmalar Dergisi, Cilt: 6 Sayı: 28, Güz 2013. KARAMAN, Hayreddin, Ana Hatlarıyla İslâm Hukuku-Giriş ve Amme Hukuku-, Acar Matbaacılık, İstanbul 1987, I/330; Fahrettin Atar, İslâm Adliye Teşkilatı, Gaye Matbaası, Ankara 1979. KARSLI,  Abdurrahman,  Medeni  Muhakeme  Hukuku,  3.  Baskı, Alternatif Yayıncılık, İstanbul, 2012. KAYA,  Çiğdem,  Cerrahi  Hemşirelerinin  Mobbinge  Maruz  Kalma Durumlarının  Belirlenmesi  ve  Mobbingin  Hemşirelerin  Motivasyonları Üzerine Olan Etkisinin İncelenmesi, Yüksek Lisans Tezi, Afyon Kocatepe Gazi Üniversitesi Hukuk Fakültesi Dergisi C. XX, Y. 2016, Sa. 2 433Mobbing Davalarında İspat Sorunu Üniversitesi SBE, Afyonkarahisar, 2012. KILIÇ, Mustafa, “Örgütsel Çatışma ve Yönetimi”, in: Yönetim ve Organizasyon, Ed: Salih Güney, 2. Baskı, Nobel Yayınları, Ankara, 2007. KOÇHİSARLIOĞLU,  Cengiz,  “Karine  ve  Borçlar  Kanununun  96. Maddesindeki Kusur Karinesi”, Yargıtay Dergisi, Cilt: 10, Temmuz, Sayı: 3, 1984. KONURALP,  Haluk,  “Rekabet  Hukukunda  Deliller  ve Değerlendirilmesi”, in: Rekabet Hukukunda Güncel Gelişmeler Sempozyumu, V, 6-7 Nisan, Kayseri, 11-22, 2007. KÖKKILINÇ,  Ayşe  Gül,  İş  Hukukunun  Uluslararası  Kaynakları Işığında Kadın İşçilerin Korunması, Legal Yayınları, İstanbul, 2013. KURU, Baki, ARSLAN, Ramazan ve YILMAZ, Ejder, Medenî Usul Hukuku, 22. Bası, Ankara 2012. KURU, Baki, Hukuk Muhakemeleri Usulü, 6. Baskı, Demir Demir Yayıncılık, İstanbul 2001. LEYMANN, Heinz, “The Content and Development of Mobbing at Work”, European Journal of Work and Organizational Psychology, Volume: 5, Issue: 2, s.1996. MARTIN, Roberta, “Workplace Incivility”, Allworth Juniper, Issue:7, Autumn, 2003. MUŞUL, Timuçin, Medeni Usul Hukuku, 3. Baskı, Adalet Yayınevi, Ankara, 2012. NAMIE, Gary and NAMIE, Ruth, The bully at work. Naperville, IL: Sourcebooks Inc., 2000. ÖCAL, Bahar, “Roma Medeni Usul Hukukunda Yargıcın Delilleri Takdiri”, AÜHFD, Cilt: 60, Sayı: 3, 2011. ÖZEN,  Yener,  “Saldırganlık,  Psikolojik  Şiddet  ve  Duygusal  Zekâ Arasındaki İlişki”, Akademik Bakış Dergisi, Sayı: 35, 2013. PEKCANITEZ, Hakan, ATALAY, Oğuz ve ÖZEKES, Muhammet, Medeni Usul Hukuku, 13. Bası, Yetkin Yayınları, Ankara, 2011. POSTACIOĞLU, İlhan E. Medeni Usul Hukuku, 1711 Sayılı Kanuna Göre Yazılmış, 6. Bası, İstanbul, 1978. ROXIN,  Claus  “İspat  Hukukunun  Esasları”,  Çev: Yener  ÜNVER, 434 Gazi Üniversitesi Hukuk Fakültesi Dergisi C. XX, Y. 2016, Sa. 2Ahmet TAŞKIN İstanbul Ticaret Üniversitesi Sosyal Bilimler Dergisi, Cilt:2, Sayı:8, Yıl:4,  Güz 2005. RÜZGARESEN,  Cumhur,  “İﬂ âs  Hukukunda  Borcun  Ödenmeme Tehlikesi ve Başvuru Yolları”, Hukuk, Ekonomi ve Siyasal Bilimler Aylık İnternet Dergisi, Sayı: 110, Nisan 2011. SAĞIR, Tuba ve OĞUZ, Ebru, “Öğretmenlere Yönelik Örgütsel Sinizm Ölçeğinin Geliştirilmesi”, International Journal of Human Sciences, Volume: 9, Issue: 2, 2012. SMITH, P.K. at al., “Definitions of Bullying: A Comparison of Terms Used, and Age and Gender Diﬀ erences, in a Fourteen-Country International Comparison”, Child Development, July-August, Volume: 73, Number: 4, 2002. SOLMUŞ, Tarık, İşyeri Terapisi: İş Yaşamında Kişilik ve Davranış Sorunları, Papatya Yayıncılık, İstanbul, 2010. ŞEN, Yusuf, İslam Muhakeme Hukukunda Bir İspat Vasıtası Olarak Karine, Yüksek Lisans Tezi, Selçuk Üniversitesi SBE, Konya, 1997. ŞİMŞEK, M. Şerif, AKGEMCİ, Tahir ve ÇELİK, Adnan, Davranış Bilimlerine Giriş ve Örgütlerde Davranış, 7. Baskı, Gazi Kitabevi, Ankara, 2011. TAŞKIN,  Ahmet,  “İşyerinde  Mobbing  ve  Mobbing  Benzeri Davranışlar”, Yargıtay Dergisi, Cilt: 39, Sayı: 3, Temmuz 2013. TAŞKIN,  Ahmet,  İş  Hukuku  Kapsamında  İşyeri  ve  İşletmelerde Mobbing,  Yayımlanmamış  Doktora  Tezi,  İstanbul  Üniversitesi  Adli  Tıp Enstitüsü, İstanbul, 2016. TAŞPINAR, Sema, “Fiili Karinelerin İspat Yükünün Dağılımındaki Rolü”, AÜHFD, Cilt: 45, Sayı: 1-4, 1996. TENGER, Feyza, İslâm Hukukunda Hâkimin Takdir Yetkisi Bağlamında Kendi Bilgisiyle Hüküm Vermesi, Yüksek Lisans Tezi, Ankara Üniversitesi Sosyal Bilimler Enstitüsü, Ankara, 2006. TETİK,  Semra,  “Mobbing  Kavramı:  Birey  ve  Örgütler Açısından Önemi”, KMÜ Sosyal ve Ekonomik Araştırmalar Dergisi, Cilt: 12, Sayı: 18, 2010. TEVRÜZ, Suna, ERDEM, İnci ve BOZKURT, Tülay, Davranışlarımızdan Seçmeler: Örgütsel Yaklaşım, 3. Baskı, Nobel Yayınları, Ankara, 2012. Gazi Üniversitesi Hukuk Fakültesi Dergisi C. XX, Y. 2016, Sa. 2 435Mobbing Davalarında İspat Sorunu TIĞLI, Hüseyin, “HMK Hükümleri Çerçevesinde İspat Yükü”, Adalet Dergisi, Sayı: 43, 2012. TINAZ, Pınar, “İşyerinde Psikolojik Taciz (Mobbing): Kavram, Süreç, Tanı ve Çözüm Önerileri”, in: CHD, Yıl: 4, Sayı: 11, Aralık 2009, s. 11. (Tanı ve Çözüm Önerileri). TINAZ, Pınar, BAYRAM, Fuat ve ERGİN, Hediye, Çalışma Psikolojisi ve Hukuki Boyutlarıyla İşyerinde Psikolojik Taciz (Mobbing), Beta Yayınları, İstanbul, 2008. TINAZ, Pınar, İşyerinde Psikolojik Taciz (Mobbing), Beta Yayınları, İstanbul, 2006. TOKGÖZ, Nuray, “Örgütsel Sinisizm, Örgütsel Destek ve Örgütsel Adalet İlişkisi: Elektrik Dağıtım İşletmesi Çalışanları Örneği”, Eskişehir Osmangazi Üniversitesi İİBF Dergisi, Cilt: 6, Sayı: 2, Ekim 2011. TOKGÖZ, Nuray ve YILMAZ, Hakan, “Örgütsel Sinisizm: Eskişehir ve Alanya daki Otel İşletmelerinde Bir Uygulama”, Anadolu Üniversitesi Sosyal Bilimler Dergisi, Cilt: 8, No: 2, 2008. TOPÇU, İbrahim vd., “Sağlık Çalışanlarında Örgütsel Sinizm Ölçeğinin Geçerlik ve Güvenirliği”, Dokuz Eylül Üniversitesi Hemşirelik Yüksekokulu Elektronik Dergisi, Cilt: 6, Sayı: 3, 2013. TRUDEL, Jeannie, “Workplace Incivility: Relationship With Conﬂ ict Management Styles and Impact on Perceived Job Performance, Organizational Commitment and Turnover”, College of Education and Human Development Department of Leadership, Foundations and Human Resource Education University of Louisville, KY, August 2009 TÜRKMEN, Ahmet, “Yeni Bir Hukuki Olgu Olarak Israrlı Takip ve Taciz (Stalking) ve Bunun Türk Medeni Hukuku Bakımından Değerlendirilmesi”, DEÜHFD, Cilt: 11, Özel Sayı, 2009. UMAR, Bilge ve YILMAZ, Ejder, İspat Yükü, İstanbul, 1980. UMAR, Bilge, Hukuk Muhakemeleri Kanunu, Şerhi, Yetkin Yayınları, Ankara, 2011. ÜNVER, Yener, “Ceza Hukuku Açısından Mobbing, Stalking ve Cinsel Taciz Eylemleri”, CHD, Yıl: 4, Sayı: 11, Aralık 2009. VANDEKERCKHOVE, Wim ve COMMERS, Ronald, “Downward Workplace Mobbing: A Sign of the Times”, Journal of Business Ethics, 436 Gazi Üniversitesi Hukuk Fakültesi Dergisi C. XX, Y. 2016, Sa. 2Ahmet TAŞKIN Volume: 45, 2003.. WESTHUES, Kenneth at al, The Remedy and Prevention of Mobbing in Higher Education, Edwin Mellen Press, New York, 2006. WESTHUES, Kenneth, The Mobbings at Medaille College, in 2002, Canada: University of Waterloo, October, 2002. When Working Becomes Hazardous, World of Work: The Magazine of The ILO, No: 26, Sept./Oct. 1998. www.ntv.com.tr/ekonomi/turkiyenin-mobbingkarnesi,8B9nQH_8zkKZbbhJfUl0Ag (Erişim Tarihi: 17.3.2016) YILDIRIM,  M.  Kamil,  Medeni  Usul  Hukukunda  Delillerin Değerlendirilmesi, İstanbul, 1990. YILDIZ, Kaya, AKGÜN, Nuri ve YILDIZ, Sevilay, “İşe Yabancılaşma ile  Örgütsel  Sinizm Arasındaki  İlişki”, The  Journal  of Academic  Social Science Studies, Volume: 6, Issue: 6, Haziran, 2013. YILDIZ, Selver ve KILKIŞ, İlknur, “Psikolojik Taciz Olgusuna 4857 Sayılı İş Kanunu Açısından Bir Bakış”, Çalışma İlişkileri Dergisi, Cilt:1, Sayı:1, 2010. YILMAZ, Ejder, Hukuk Sözlüğü, Ankara, 2002. YÜCETÜRK,  Elif,  “Örgütlerde  Durdurulamayan  Yıldırma Uygulamaları: Düş mü? Gerçek mi?11. Ulusal Yönetim ve Organizasyon Kongresi Bildiriler Kitabı, Afyon Kocatepe Üniversitesi Yayın No:57, 22-24 Mayıs, 2003. Gazi Üniversitesi Hukuk Fakültesi Dergisi C. XX, Y. 2016, Sa. 2 437"
}