{
     "Tip": "Makale",
     "Dergi İsmi": "Gazi Üniversitesi Hukuk Fakültesi Dergisi",
     "Üniversite İsmi": "",
     "Gün": "",
     "Ay": "",
     "Yıl": "2015",
     "Cilt": "19",
     "Sayı": "3",
     "Başlık": "ALEXIS DE TOCQUEVILLE’E GÖRE SİVİL TOPLUMMurat TUMAY",
     "Title": "CIVIL SOCIETY ACCORDING TO ALEXIS DE TOCQUEVILLE",
     "Yazar İsmi": [
          "Firdevs OKATAN"
     ],
     "Danışman İsmi": "",
     "Anahtar Kelimeler": [
          "Alexis De Tocqueville",
          "Sivil toplum",
          "Demokrasi",
          "Örgütlenme özgürlüğü",
          "İnsan hakları"
     ],
     "Keywords": [
          "Alexis De Tocqueville",
          "Civil society",
          "democracy",
          "Freedom of Association",
          "Human Rights"
     ],
     "Özet": "Sivil toplum, antik çağdan günümüze dek var olmuş bir kavramdır. Fakat anlam bakımından oldukça fazla değişikliğe uğramıştır. Sivil toplumu günümüzdeki anlamına yakınlaştıran Alexis De Tocqueville, 19. yüzyılda yaşamış Fransız bir düşünürdür. Aristokrasiden demokrasiye geçiş sürecinin yaşandığı bir devirde Tocqueville e göre demokrasinin doğru şekilde işleyebilmesi için örgüt kurma hakkının vazgeçilmez olması gerekmektedir ve demokrasinin aksayan yanlarını düzeltecek olan mekanizma sivil toplumdur. Anahtar Kelime: Alexis De Tocqueville, Sivil toplum, Demokrasi, Örgütlenme özgürlüğü, İnsan hakları CIVIL SOCIETY ACCORDING TO ALEXIS DE TOCQUEVILLE ABSTRACT Sivil society is a concept that has existed from Ancient Times to the present day. However in terms of meaning, the concept has changed quite a lot. Alexis De Tocqueville, who make the civil society closer to the meaning of today, is a French philosopher of the nineteenth century. At a time of transition from aristocracy to democracy, according to Tocqueville to process democracy properly constitutional right  to  association  is  unalienable.  Furthermore,  mechanism  to  correct  the shortcomings of democracy is sivil society. Keywords:  Alexis  De  Tocqueville,  Civil  society,  democracy,  Freedom  of Association, Human Rights     Yrd. Doç. Dr., Selçuk Üniversitesi Hukuk Fakültesi Öğretim Üyesi, İnsan Hakları Araştırma ve Uygulama Merkezi     Selçuk Üniversitesi Hukuk Fakültesi Araştırma Görevlisi Gazi Üniversitesi Hukuk Fakültesi Dergisi C. XIX, Y. 2015, Sa. 3 321Alexis De Tocqueville e Göre Sivil Toplum GİRİŞ Sivil toplum kavramı, siyaset bilimi veya insan hakları gibi alanların yanı sıra demokrasi, anayasa, adalet, eşitlik gibi konularla da yakından ilgilidir. Böylesine geniş alanı ilgilendiren bir kavramla ve onun içeriğiyle ilgili de pek çok eserin ortaya konması kaçınılmazdır. Antik çağdan günümüze kavram, içeriği bakımından oldukça değişikliğe uğramış olsa da kendisine gösterilen ilgi tükenmemiş aksine artarak devam etmiştir. Nitekim sivil toplumu anlatan, sivil toplumu tartışan, Türkiye de ve Dünya da sivil toplumun gelişimine değinen pek çok kitap, dergi, makale vs. karşımıza çıkmaktadır. Asıl  konumuz  olan  Alexis  De  Tocqueville e  göre  sivil  toplum; Tocqueville in Amerika da gördüğü dernek ve örgütlenme yoğunluğunun demokrasiyi  güçlendirme  ve  devleti  kontrol  altında  tutma  gibi  yararlar sağladığı kanaatine varmasıyla şekillenmiştir. Demokrasinin öneminin yavaş yavaş  anlaşılmaya  başlandığı  1800 lü  yıllarda  yaşamış  olan  Tocqueville bir taraftan demokrasi, özgürlük, eşitlik kavramları ışığında sivil toplumun gerekliliğini, faydalarını anlatırken, diğer taraftan sivil toplum kavramını kendi düşüncesi çerçevesinde şekillendirmeye çalışmıştır. Çalışmamızın birinci kısmında, sivil toplum kavramı üzerine bilgiler sunduktan sonra, ikinci kısımla birlikte ünlü Fransız düşünür Alexis De Tocqueville in bakışıyla sivil toplum konusunu ele almaya çalışacağız. § I. GENEL OLARAK SİVİL TOPLUM KAVRAMI Sivil Toplum” kelimesi dilimize sonradan eklenmiş Batı kökenli bir kavramdır.1Kavrama yüklenen anlam zaman içinde değişikliğe uğramış olsa da2 düşüncel boyutunun gelişmesi 17.  ve 18. yüzyıla dayanmaktadır.3 Sivil toplumun temellerinin atıldığı Antik Yunan da sivil toplum ile devlet aynı anlamda kullanılırken, bir sivil toplum üyesi olmak ile yurttaş veya devletin bir üyesi olmak aynı anlamaları karşılamaktaydı.4 Sivil topluma geçiş 1   BOLAY, Hayri, Sivil Toplum ve Manası”, Yeni Türkiye, S. 18, 1997, s.7 2   İNAÇ, Hüsamettin- ERDOĞAN, Selami, Farklı Kuramsal Perspektiﬂ er Çerçevesinde Sivil Toplum Tartışmalarının Karşılıklı Analizi”, Akademik Bakış Uluslararası Hakemli Sosyal Bilimler E- Dergisi, S. 11, Ocak-2007, s. 2 3   YILMAZ, Aytekin,  Sivil Toplum Demokrasi ve Türkiye”, ”, Yeni Türkiye, S. 18, 1997, s. 87; ONBAŞI, Funda, Sivil Toplum, L&M Yayınları, İstanbul, Ekim 2015, s. 13 4   KEANE, John, Despotizm ve Demokrasi”, Sivil Toplum ve Devlet, Avrupa da Yeni Yaklaşımlar, Der: John Keane, Çev: Levent Köker, Ayrıntı Yayınevi, Aralık 1993, s. 48, SAVRAN, Gülnur, Sivil Toplumun Eleştirisi”, Yapıt Toplumsal Araştırmalar Dergisi, S: 5 Haziran- Temmuz 1984, s: 33 322 Gazi Üniversitesi Hukuk Fakültesi Dergisi C. XIX, Y. 2015, Sa. 3Murat TUMAY / Firdevs OKATAN doğa durumunda özgür olan insanların sahip olduğu uyumun desteklenmesi ve pekiştirilmesidir.5 Sivil  toplum  ve  devlet  ayrımının,  devlet  yapısının  sivil  toplumun gelişimine  daha  uygun  olması  dolayısıyla  Amerika da  ortaya  çıktığını söylemek mümkündür.6 Sivil toplum ve devletin birbirinden ayrı olması toplumun  siyasi  yönlendirmelerden  ziyade  eşitlik,  özgürlük  gibi  önemli ilkelerden hareket etmesinin önünü açmaktadır. 7 Sivil  toplum  kavramının  kelime  anlamı  ve  kapsamı  konusuna geçmeden önce sivil toplumun iç içe olduğu kavram olan demokrasiden kısaca bahsetmekte yarar vardır. Demokrasinin Abraham Lincoln tarafından yapılmış ünlü tanımı şöyledir: Demokrasi, halkın halk tarafından, halk için yönetilmesidir.8İlkçağda  ortaya  çıktıktan  sonra  tekrar  yükselişi  Yeniçağ aydınlanma çağına tekabül eden demokrasi, günümüzde kırılgan, kurulması ve kaldırılması bir çok etkene bağlı bir rejim olarak varlığını sürdürmektedir.9 Sivil toplum kavramının gelişimi konusunda Antik çağdan günümüze Aristoteles, Çiçero, Thomas Hobbes, Montesquieu, Gramsci gibi pek çok Batılı  düşünür  çalışmalar  ve  tartışmalar  yapmıştır.10  Savran a  göre  sivil toplum kavramı üzerindeki tartışmalar yalnızca sivil toplum”un terminolojik anlamını ortaya koyma kaygısından öte kavramın siyasal ve ideolojik fikirlerin etkisinde kalmasından ileri gelmiştir.11 A.  SİVİL TOPLUM HAKKINDA Sivil toplumu, özel bireyler tarafından oluşturulan, serbest bir şekilde örgütlenip faaliyet gösterebilen, toplumun kolektif hayatını oluşturan, bireyle devlet arasında yer alan ara yapılar olarak ifade edebiliriz. Çeşitli etnik, dini, fikri veya hayri nitelikteki bu topluluklarda esas olan gönüllülük ve rızadır.12 Sivil toplum kuruluşları yardımlaşma, insan hakları, kadın ve çocuk hakları, 5   SAVRAN, Gülnur Acar, Sivil Toplum ve Ötesi, Rousseau, Hegel, Marx, Dipnot Yayınları, Ankara 2013, s. 36 6   KEANE, s. 49 7   SAVRAN, , Sivil Toplumun Eleştirisi”, s. 40 8   ERDOĞAN, Mustafa, Anayasal Demokrasi, Siyasal Kitabevi, 9. baskı, Eylül, 2012, s. 232 9   ERDOĞAN, s. 229-230 10  ERASLAN, Levent, Sivil Toplum ve Eğitim (ESTK), Maya Akademi Yayınevi, Ekim 2011, Ankara, s. 13 11  SAVRAN, s. 47 12  YAYLA, Atilla, Siyasi Düşünceler Sözlüğü”, Adres Yayınları, 2. Baskı, Ekim 2004,s. 206 Gazi Üniversitesi Hukuk Fakültesi Dergisi C. XIX, Y. 2015, Sa. 3 323Alexis De Tocqueville e Göre Sivil Toplum çevre ve bilim teknoloji gibi pek çok alanda çalışmalar yürütüp ulusal veya uluslar arası alanda da faaliyet gösterebilirler.13 Sivil toplumun karşıtını oluşturan kelime bilindiği üzere askeri toplum değil siyasal toplum veya politik toplumdur. Politik toplum kavramından da basitçe devleti anlayabiliriz.14 Sivil toplum siyasal toplum şeklindeki ayrım kapitalizmin doğuşuyla birlikte ortaya çıkmıştır.15 Keane devlet ve sivil toplum arasındaki ayrıma işaret eden üç farklı ana yaklaşım olduğundan bahseder. Analitik yaklaşımlar, söz konusu ayrımdan özel kurumlar veya toplumsal sistemler için bir nevi çözümleme aracı olarak faydalanmaya vurgu yapar.16 Devlet ve sivil toplum ikilisinin siyasal bir takım hedeﬂ er için destek olarak kullanıldığını savunan ikinci yaklaşımı oluşturuken17 üçüncü yaklaşımda ise devlet ve sivil toplum arasındaki ayrılığın korunmasının önemi vurgulanırken söz konusu ayrımın normatif boyutu öne çıkarılmaktadır.18 Çaha ya göre sivil toplum ideolojik topluma karşı tutum sergileyen, ideolojik toplumun toplumsal farklılık ve zenginliklere müsaade etmeyen yanını reddeden bir toplum modelini ifade etmektedir.19 Sivil toplum kavramının doğuşu devletin ortaya çıkmasıyla başlar. Modern öncesi dönemde, sivil toplum ve devlet aynı anlama geliyorken, Orta Çağ dan itibaren kapitalizmin yükselişiyle birlikte sivil toplum devletten ayrılmaya hatta devletle çatışmaya başlamıştır. Bu ayrışma ve çatışmanın sebebiyse  doğa  halinden  sonra  ortaya  çıkan  devletin  zamanla  otoritesini artırıp,  toplum  için  devlet  yerine  devlet  için  toplum  anlayışına  doğru yönelmesidir. Modern öncesi dönemde sağlanan yurttaş- devlet birlikteliği ve barışı, Orta Çağ da ticaretin gelişmesiyle birlikte diğer bir deyişle paranın 13  ATAR, Yavuz, Demokratik Sistemde Sivil Toplumun Fonksiyonu ve Sivil Toplum- Devlet Düalizmi”, Yeni  Türkiye, S. 18, 1997, s. 98 14 BELGE, Murat,  Sivil Toplum Nedir?”, http://stk.bilgi.edu.tr/docs/belge_std_1.pdf , İstanbul Bilgi Üniversitesi Sivil Toplum Kuruluşları Eğitim ve Araştırma  Birimi, s. 1, 10.04.13 15  BUMİN, Kürşat, Sivil Toplum ve Devlet, Yazarlar ve Çevirmenler Yayın Üretim Kooperatifi, İstanbul, 1981, s.11; YILMAZ, Murat, Sivil Toplumun Kısa Tarihi ve Aktüel Bazı Meseleleri” Yeni Türkiye, S. 18, 1997, s. 369; 16  KEANE, John, Giriş”, Sivil Toplum ve Devlet, Avrupa da Yeni Yaklaşımlar, Ayrıntı Yayınları, Der: John Keane, Çev: Levent Köker, Aralık 1993, s. 25 17  KEANE, Giriş”,  s. 34 18  KEANE, Giriş”,  s. 39 19  ÇAHA, Ömer, Sivil Toplum Üstüne”, Sivil Toplum ve Demokrasi, Kaknüs Yayınları, İstanbul, 2005, s. 15 324 Gazi Üniversitesi Hukuk Fakültesi Dergisi C. XIX, Y. 2015, Sa. 3Murat TUMAY / Firdevs OKATAN öneminin artmasıyla birlikte kırılmaya başlamış ve devlet- tebaa” haline dönüşmüştür.20 18. yüzyıldan itibaren iktidar artık ilahi değil dünyevi kaynaklı hale gelmeye başlamıştır, bu süreçte de sivil toplumun bağımsız hale gelmesinin önemli payı bulunmaktadır.21 Sivil  toplumun  oluşum  ve  gelişimi  birçok  faktörün  durumuna bağlıdır. Bunlar anayasa da devletin yapısı, işleyiş tarzı, toplumun yapısı, ülkenin ekonomik durumu gibi çeşitlilik gösterebilir.22 Sivil toplum her ne kadar anayasalcılık ile de hedeﬂ enen devleti sınırlandırma gayesi içinde olsa da iktidarı ele geçirmek veya siyaseti bizzat yürütmek gibi bir amacı hedeﬂ ememektedir.23 Batı toplumlarında ortaya çıkan ve güçlenen burjuvazi ile birlikte belirginleşen toplumsal sınıf sivil toplum düşüncesinin gelişimi anlamında  katkı  sağlarken,  1789  Fransız  İnsan  ve  Vatandaşlık  Hakları Beyannamesi ile bu gelişim hız kazanmıştır.24 Sivil toplumun gelişmesine dolaylı olarak katkı sağlamış gelişmelere değinecek olursak; ekonomik liberalizmle birlikte siyasi liberalizmin gelişmesi ve bu gelişim ile birlikte genel oy hakkının yaygınlaşması, yurttaşlık bilincinin gelişmesi, örgütlenme hakkının tanınması gibi imkanları belirtmekte fayda olacaktır.25 B.  SİVİL TOPLUMUN YERİNE GETİRDİĞİ İŞLEVLER Sivil toplum demokrasinin gerçek anlamda işlemesini sağlayan bir mekanizmadır.  Sivil  toplumun  görevi;  devlete,  devletin  toplum  için  var olduğunu  ve  vekâletin  yurttaştan  alındığını  hatırlatmaktır.26  Sivil  toplum varlığını  sürdürebilmek  için  demokratik  topluma  ihtiyaç  duyarken  İdeal devlet diyebileceğimiz sivil toplumun gelişmesinin önünü açan devlet, her şeyden önce kutsal olanın kendisi değil, birey hak ve özgürlükleri olduğunun farkına varmış olan devlettir.27 Bir ülkede demokrasinin kurulması, yerleşmesi 20  YILMAZ, Murat, s. 368-372 21  BUMİN, Kürşat, s. 21 22  YILMAZ, Aytekin, s. 87 23  YILDIRIM,  İbrahim,  Demokrasi,  Sivil Toplum  Kuruluşları  ve Yönetişim,  Seçkin Yayıncılık, Ankara, Ocak-2004, s. 48 24  ONBAŞI, Funda, s. 14 25  ONBAŞI, Funda, s. 14-15 26  HOCAOĞLU, Durmuş, Sivillik ve Demokrasi”, Yeni Türkiye, S. 18, 1997, s. 106-108 27  AKTAN, Coşkun Can, Sivil Toplum İçin İdeal Devlet”, Yeni Türkiye, S. 18, 1997, s. 190 Gazi Üniversitesi Hukuk Fakültesi Dergisi C. XIX, Y. 2015, Sa. 3 325Alexis De Tocqueville e Göre Sivil Toplum ve gelişmesi sivil toplumun gelişip gelişmediğiyle yakından ilgilidir. Ayrıca özgürlükler de sivil toplumun gücüne bağlı olarak var olabilmektedir.28 Toplumun  parçası  olan  bireyler,  kendilerini  çeşitli  ilgi  ve  çıkar alanlarının merkezi olarak gördükleri konularda, daha etkin olmayı sağlayacak dayanışmaya  ulaşmak  için  aralarında  birleşip  sivil  toplum  kuruluşlarını oluştururlar. Bireyin esas olduğu bir toplumda, kişiler arasındaki eşitlik ön planda olduğundan ortak amacın çıkarı doğrultusunda çalışmak zorunluluğu ortaya çıkar. Oluşan bu kuruluşlar, seçim ve grev gibi yöntemlerin dışında, devletin ve yerel yönetimlerin temsilcileri ile iletişime geçerek ya da onlara baskı yaparak amaçlarına varmaya çalışırlar. Bireyin tek başına politikacıyla ya da iktidar temsilcisi ile pazarlığa girerek sorunları halletmeye çalışması yerine,  bireylerin  eşit  katkı  ve  sorumlulukları  ile  kurulmuş  sivil  toplum kuruluşlarının bu görevi üstlenmesi daha doğru olacaktır.29 Sivil toplum menfaatlerin savunulması adına bir ortam oluşmasını sağlarken, rayında işleyen bir sivil toplum daha çoğulcu ve katılmacı bir toplum olacaktır. Sivil toplum kuruluşları siyasal kurumlarla bağlantı halinde olduğundan halktan kopuk bir siyasetin önüne geçilmiş olacaktır. Ayrıca sivil toplum kuruluşları yeniliklere uyum sürecinde de destek sağlamaktadır.30 Sivil  toplum  devletin  karşısında  toplum  lehine  bir  muhalefet oluştururken, toplumun taleplerinin üst mercilere iletilmesini sağlar. Kamusal ahlak ilkeleri oluşturulması ve uygulanması konusunda da sivil topluma önemli görevler düşmektedir. Bunların dışında sivil toplum kuruluşlarının birbirleriyle etkileşime geçmeleriyle de demokratik bir tartışma ve dayanışma ortamı oluşmuş olacaktır.31 Sivil  toplum  kuruluşlarını  sivil  toplum  içindeki  konumunu  sivil toplumun  meyveleri”  olarak  nitelendirmek  mümkündür.  Bu  kuruluşlar içerisinde yer aldıkları toplumdan beslenerek, yine içerisinde yer aldıkları topluma yararlıklar sağlayan bir döngüyü oluşturmaktadırlar.32 28  YILMAZ, Aytekin, s. 89 29  YERASİMOS, Stefanos,  Sivil Toplum, Avrupa ve Türkiye”, Türkiye de Sivil Toplum ve Milliyetçilik, İletişim Yayınları, 1. Baskı, İstanbul 2011, s. 13 30  ATAR, s.  99-100 31  GENÇKAYA, Ömer Faruk, Demokratikleşme ve Sivil Toplum İlişkisi Üzerine Bir Not”, Yeni Türkiye, S. 18, 1997, s. 104 32  YILDIRIM, Murat, Sivil Toplum ve Devlet”, Cumhuriyet Üniversitesi Sosyal Bilimler Dergisi, C: 27, No: 2, Aralık 2003, s. 226 326 Gazi Üniversitesi Hukuk Fakültesi Dergisi C. XIX, Y. 2015, Sa. 3Murat TUMAY / Firdevs OKATAN §  II.  ALEXIS  DE  TOCQUEVILLE NİN  SİVİL  TOPLUMA YAKLAŞIMI VE GETİRDİĞİ YENİLİKLER Tam  adı Alexis  Charles  Henri  Maurice  Clerel  De Tocqueville dir. 1805 yılında Verneuil de dünyaya gelen Fransız düşünür meslek hayatına Versailles da  stajyer  hakim  olarak  başlar.  Görevi  sırasında Amerika daki hapishaneleri incelemek amacıyla bu ülkeye gider. Bu ziyaret onu günümüze kadar taşıyan kitabı Amerika da Demokrasi”nin kaleme alınmasına vesile olacaktır.33 Tocqueville,  aristokrat  bir  Norman  ailesinin  içinde  büyümüştür. Aristokrasiden demokrasiye geçiş evresinin yaşandığı 1800 lü yılların başına tanıklık etmiş olan düşünür her iki rejimi de karşılaştırma fırsatını yakalamıştır. Her  ne  kadar  aristokrat  bir  aileden  gelse  de,  ülkesi  Fransa da  yaşanan demokrasi ve eşitlik mücadelesine de kayıtsız kalamamıştır. Fransa da sürekli tehditlerle karşılaşan ve kesintiye uğrayan demokrasinin aksine, Amerika da barışçıl ve eksiksiz işleyen bir demokrasinin hüküm sürdüğünü gören düşünür bu farkın nelerden kaynaklandığını araştırmak ve bir karşılaştırma yapmak üzere Amerika ya gider.34 A. ALEXIS DE TOCQUEVILLE IN GENEL OLARAK SİVİL TOPLUMA YAKLAŞIMI Tocqueville  Amerika nın,  doğup  büyüdüğü  Fransa dan  farklı  ve olumlu yönlerinden bahsederken iki önemli duruma işaret etmiştir. Birincisi Fransa daki monarşik egemenliğin aksine A.B.D. de anaaysal demokrasinin hakim olması, ikincisi ise A.B.D. de güçlü merkezi yönetim oluşturmak yerine yerinden yönetimlere önem verilip, gücün tek merkezde toplanmasının engellenmiş olmasıdır.35 Her iki faktör de Amerika adına sivil toplum için gereken zemini hazırlamıştır. Tocqueville;  Amerikalıların  karşılaştığı  hemen  her  problemi  bir vakıf veya dernek kurarak aşmaya çalıştığını gözlemlemiştir. Sivil toplum bilincinin bu denli gelişmiş olmasını da insanların aristokratik rejimlerdeki durumun aksine eşit olmaları sayesinde bir araya gelerek güçlenebileceklerini fark  etmelerine  ve  devlete  olan  bağımlılığı  böylece  azaltmış  olmalarına bağlamaktadır.36 33  TOCQUEVİLLE, Alexis De, Amerika da Demokrasi, Çev. İhsan Sezal- Fatoş Dilber, Yetkin Yayınları, 1994, s. 13 34  TOCQUEVILLE,  s. 28-35 35  SCHMİDT, Manfred G., Demokrasi Kuramlarına Giriş, Çev. M. Emin Köktaş, Vadi Yayınları, 1. Basım, Ekim-2001, s. 79 36  TAMER, s. 98-99 Gazi Üniversitesi Hukuk Fakültesi Dergisi C. XIX, Y. 2015, Sa. 3 327Alexis De Tocqueville e Göre Sivil Toplum Tocqueville e  göre  sivil  toplum  çoğulcu  örgütlenmeler  sistemi” diyebileceğimiz ve ihtiyaçlara çözüm bulabilmek, devletin baskıcı davrandığı durumlarda müdahale edebilmek, demokrasinin korunmasını sağlamak gibi faaliyetleri  içeren  esasen  toplumun  kendini  korumak  adına  oluşturduğu bir güvencedir.37 Ona göre sivil toplumun amacı bir düşünceyi yaymak ve güçlendirmektir.38 B.  ALEXIS  DE  TOCQUEVILLE NİN  SİVİL  TOPLUM KAVRAMINA GETİRDİĞİ YENİLİKLER Tocqueville, devletin  yalnızca  özgürlük ve  eşitliğe önem vermesini  yeterli görmez aynı zamanda sivil toplumun oluşmasına da ortam sağlaması gerektiğini  ifade  eder.39  Çünkü  ona  göre  örgütlenme  özgürlüğü  bireysel özgürlükler kadar önemlidir. Hatta öyle ki örgütlenme özgürlüğüne yapılacak bir müdahalenin toplumu da derinden sarsacağını ifade etmiştir.40 Tocqueville in Amerika da gördüğü örgütlenme biçimini o zamanın41 Avrupa sından ayıran önemli farklar vardır. Örneğin; Amerika da azınlıkta kalan kesim diğerlerine kendilerinin de var olduğunu göstermek ve güçlerini ortaya koymak için bir araya gelirken Avrupa ya baktığımızda çoğunluğun karşısında kendini ezilmiş hisseden ve buna karşı mücadele etme yolunu seçen bir örgütlenme dikkati çekiyor. Avrupa da bir araya gelen insanların yaptıkları tartışmaların sonuçları hayata geçirilemezken Amerika da olumlu, umutlu ve barışçı bir örgütlenme alanı kendini gösterir.42  Tocqueville sivil toplumun demokrasi için vazgeçilmez olduğunun altını çizmiş ve demokrasinin ihtiyacı olan toplumun güveni, eşitliği ve toplumla uzlaşmanın sivil toplum sayesinde gerçekleşebileceğini savunmuştur. Ayrıca sivil toplum kavramını; devletten, siyasi partiler ve yerel yönetimler gibi siyasetle iç içe kurumlardan ayırmak suretiyle ayrı bir örgütlenme alanı olarak ifade etmiştir.43 37  YETİŞ, Mehmet, Tocqueville, Demokratik Devrim ve Sivil Toplum”, Ankara Üniversitesi Siyasal Bilgiler Fakültesi Gelişme ve Toplum Araştırmaları Merkezi Tartışma Metinleri, No.87, Ekim-2005, s. 14 38  TOCQUEVILLE,  s. 84 39  DOĞAN, İlyas, Sivil Toplum Anlayışı ve Siyasal Sistemler, Barış Platin Kitabevi, 2. Baskı, 2009, s. 141 40  TOCQUEVILLE, s. 86 41  Tocqueville in Amerika da Demokrasi” kitabını yazdığı tarihten yola çıkacak olursak 1800 lü yılların başı diyebiliriz. 42  TOCQUEVILLE, s, 86 43  TAMER, s. 100 328 Gazi Üniversitesi Hukuk Fakültesi Dergisi C. XIX, Y. 2015, Sa. 3Murat TUMAY / Firdevs OKATAN Tocqueville devletin merkezileşmesinin özgürlükleri sınırlandıracağını savunmaktadır. Ona göre otoriter bir devletin müdahale edebileceği alanlar ne kadar geniş olursa, birey özgürlükleri de o kadar daralmaktadır. Birey özgürlükleriyle  birlikte  örgütlenme  özgürlüğü  de  devletin  baskısı  altında ezilmeye mahkum olacaktır.44 Sivil toplumda gönüllülüğün esas olduğunu vurgulayan Tocqueville e göre  hemen  her  konuda  örgütlenmek  mümkün  olduğundan  dolayı  ülke ekonomisinin gelişmesinde dahi sivil toplumun payı büyüktür.45 1.  DEMOKRASİ İÇİN SİVİL TOPLUMUN ÖNEMİ Tocqueville;  kitabı  Amerika da  Demokrasi”de  Amerika  Birleşik Devletleri nin aristokrasi gibi totaliter veya otoriter bir rejim yerine demokrasiyi benimsediğini ve bunu da sivil toplumun desteğiyle sürdürmeye çalıştığını belirtir. Bu gelişimi de oraya yerleşen göçmenlerin durumundan yola çıkarak açıklamaya çalışır. Amerika bilindiği üzere keşfedilmesinin ardından güçlü Avrupa ülkelerinin sömürgesi olarak tarih sahnesinde görülmeye başlamıştır. Yeni Dünya diye de adlandırılan bu kıtaya gelen göçmenler çeşitli sebeplerden ötürü ülkelerinden ayrılmak zorunda kalmışlardır. Fakirliğin yanı sıra başka bir takım sıkıntılar içinde olan insanlar yerleşmeye başladıkları bu toprakları benzer sebeplerle vatanlarından sürülmüş diğer insanlarla paylaşmışlardır. Bu şekilde başlayan yerleşim süreci sırasında kimsenin  birbirlerine karşı herhangi bir üstünlük kurma çabası olmamıştır. O dönemde Avrupa da uygulanan mülkiyete dayalı aristokrasi kabul edilemez olarak görülmüş ve bu nedenle de reddedilmiştir. Bu düşüncenin gelişmesinde  rol  oynayan  etkenlerden  biri  insanların  eşit  olduğunun benimsenmesi iken, diğer etken aristokrasinin gücünü topraktan alan bir rejim olmasıyla ilişkilidir. Şöyle ki; göçlerle gelen insanların başlattığı tarım faaliyetlerine kadar işlenmemiş olan Amerika topraklarından alınabilecek verimin düşük olması diğer bir deyişle, toprağın sadece bakıcısına yetecek kadar gelir getirmesi toprak üzerinden hem mülk sahibinin hem çalışanın geçimini sağlamasını imkansız hale getirmektedir.46 Aristokrasinin yönetim biçimi olarak benimsendiği bir ülkede, ülkenin her türlü işiyle ilgilenenler tahmin edilebileceği gibi aristokrat yani zengin, imtiyazlı olan kesimdir. Bu durumda sıradan vatandaş için ülke yönetimine 44  TAMER, s. 101 45  TOCQUEVILLE, s. 172-174 46  TOCQUEVILLE,  s, 33 Gazi Üniversitesi Hukuk Fakültesi Dergisi C. XIX, Y. 2015, Sa. 3 329Alexis De Tocqueville e Göre Sivil Toplum ilgi gösterme gereği ortadan kalkmış olur. Ancak demokraside durum farklıdır. Demokratik bir ülkede imtiyazlı kesim diye bir şey olmadığından herkes eşit derecede güçsüzdür. İşte bu noktada insanlar ancak bir araya gelerek güçlü olmayı başarabilmektedirler.47 Demokrasinin  bir  gereği  olan  çoğunluğun  egemenliği,  önemli  bir tehlikeyi doğurabilir. Tocqueville e göre çoğunluğun egemenliği en mantıklı yol gibi görünse de bazen çoğunluğun istek ve eylemleri azınlıkta kalan kesime zarar verir hale gelebilir. Tocqueville bu durumu demokrasinin despotizme dönüşmesi başka bir deyişle çoğunluğun despotizmi olarak ifade etmiştir. Yasaların çoğunluğun seçtiği kimselerce çıkarılıp yine çoğunluğun seçtiği kimselerce uygulandığı bir ülkede azınlığın bütün bunlara boyun eğmekten başka çaresi kalmayacaktır.48 Demokrasinin despotizme dönüşmesine yol açabilecek diğer faktör ise modernleşen toplumla ilgilidir. Modern toplum giderek bireylerin yalnızlaşıp içine kapandığı bir yöne doğru ilerlemektedir. Bu durumun toplum geleceği açısından  tehlikelerine  işaret  eden  Tocqueville  bireyin  yalnızlaşmasını bireyselleşme” olarak ifade etmektedir. Bireyselleşme genel itibariyle özgür irade ve de kişinin kendi kararlarını kendi başına almasını ifade ederken, Tocqueville bu kavramı bireyin sosyal, siyasal konulara karşı ilgisizleşmesi ve de çoğunluğun aldığı kararlara uyum sağlamakla yetinmesi şeklinde olumsuz bir kavram olarak ifade etmektedir. Çoğunluğun aldığı kararlar her zaman doğru olmayabileceği gibi, hiçbir tepki bulunmadığı için keyfi uygulamalara da yol açabilecektir.49 Tocqueville e göre bu yeni despotizm daha önce benzeri görülmediği için  sonuçlarının  anlaşılması  veya  ortaya  çıkarılması  oldukça  güçtür.50 Tocqueville nin bahsettiği türden bir despotizm, günümüz demokrasisinde çoğunluk  iktidarının  da  sınırlarının  olması  ve  azınlık  kesimin  katkıda bulunacağı hususların bulunduğu gerekçesiyle eleştirilmektedir.51 Demokrasinin  karşılaşabileceği  bir  diğer  tehlike  de  anarşizmdir. Tocqueville demokrasinin tanıdığı özgürlük alanının daha da genişletilmeye 47 TOCQUEVILLE,  s, 173 48  GÖZE, Ayferi, Siyasal Düşünceler ve Yönetimler, Beta Basım A.Ş., 9. Bası,  İstanbul-2000, s. 252,253 49  YETİŞ, s. 14 50  KEANE, ”Despotizm ve Demokrasi”, s. 75 51  SCHMİDT, s.  89 330 Gazi Üniversitesi Hukuk Fakültesi Dergisi C. XIX, Y. 2015, Sa. 3Murat TUMAY / Firdevs OKATAN çalışılması sonucu karşılaşılabilecek bu durumun, insanlardaki denge ve düzen duygusu” sayesinde sorun olmaktan çıkacağını belirtmiştir.52 Tocqueville demokrasinin zayıf taraﬂ arına karşı korunmak adına sosyal yapı için olmazsa olmaz diyebileceğimiz ara yapılardan” bahsetmektedir.53 Bu da bizi sivil toplum olgusuna götürmektedir. 2.  BİREYİ DEVLETE KARŞI KORUYAN SİVİL TOPLUM Devletin sahip olduğu gücün kontrolünün sağlanması adına geliştirilmiş yöntemler  vardır.  Bunları  kısaca  anayasal  devlet,  düzenli  seçimler  ve kuvvetlerin ayrılığı olarak ifade edebiliriz. Tocqueville e göre sivil toplum diğer bir önemli faktörü oluşturur. Ona göre sivil toplum devleti  toplumsal ve siyasal açıdan sınırlandıran ve denetim altında tutan en etkili yöntemdir.54 Keane e göre sivil toplumu yok olmanın eşiğine getirecek olan tek partinin egemenliğinin benimsendiği yönetim şeklidir. Ona göre 1980 lerin Batı Avrupa sında devlet ve özel şirketler tarafından tehdit edilen ve hareketleri kısıtlanan sivil toplum her şeye rağmen güçlenmeye devam etmektedir.55 Tocqueville A.B.D. de gördüğü sivil toplum kuruluşu yoğunluğundan övgüyle söz eder. Ona göre bu durum halkın kültürünün bir yansımasıdır.56 Amerikalı  aileler  çocuklarını  yetiştirirken  onlara  zorluklar  karşısında mücadeleci olmayı ve karşılarına çıkan bir sorunla baş edemedikleri takdirde yardım istemeleri gerektiğini öğretirler.57 Bu örnekten örgütlenmenin önemini kavramış bir toplumun, bunu yeni nesillere de aktarma gayreti içerisinde olduğunu anlayabiliriz. Dernek kurma özgürlüğü ile basın özgürlüğü arasında yakın bir ilişki vardır.  Toplumun  sorunlar  karşısında  çözüm  üretebilmesi,  devlete  karşı düşündüklerini özgürce ifade edebilmesi ve tartışabilmesi basın organları yoluyla gerçekleşebilecektir.58 Tocqueville e göre bir düşünceyi ifade etmek ve yaymak üzere bir araya gelen insanların oluşturduğu örgüt basından bile güçlü bir etki yaratacaktır.59 52  GÖZE, s. 252 53  GÖZE, s. 255 54  YETİŞ, s. 18 55  KEANE, Giriş”,  s. 14 56  DİNÇKOL,  Çoğunluk Tiranisine Karşı Bir Çözüm Yolu: Tocqueville nin Syasal Kuramı”, İstanbul Ticaret Üniversitesi Dergisi, C. 3, S. 5,2004,s. 150 57  TOCQUEVILLE, s. 83 58  GÖZE,  s. 256 59  TOCQUEVILLE, s. 84 Gazi Üniversitesi Hukuk Fakültesi Dergisi C. XIX, Y. 2015, Sa. 3 331Alexis De Tocqueville e Göre Sivil Toplum 3.  DEVLET, SİYASİ TOPLUM VE SİVİL TOPLUM Tocqueville, sivil toplumu ilk kez ayrı bir örgütlenme alanı olarak ifade etmiştir.60 Bireylerin tek başlarına büyük işleri başarabilmesinin demokratik rejimlerde pek mümkün olmadığından bahseden düşünür, böyle bir ülkede örgütlenmenin  öneminin  de  yeterince  kavranamamış  olmasıyla  birlikte ilkelliğe dönüşün yaşanabileceğine işaret etmektedir.61 Tocqueville in Amerika da Demokrasi kitabında sivil toplum, siyasi toplum ve devlet şeklinde üçlü bir ayrım ortaya koyduğunu görürüz. Yani devletin dışında siyaset ile uğraşan bir toplumdan söz eder. Ona göre siyaset ile ilgilenmek sadece devletin tekelinde olmamalıdır. Sivil toplumu da siyasi toplumu şekillendiren bir unsur olarak kabul etmektedir.62 Tocqueville,  siyasi  örgütlerin  devlete  ve  ülkeye  faydalarından bahsederken örgütlenme hakkının konu yönünden sınırlandırılmasının fayda yerine zarar getireceğini savunmuştur. Kitabında sivil toplum kelimesine yer vermese de bu kavram için halkın kurduğu örgütler” veya dernekler” ifadelerini kullanmıştır. Ona göre, sivil toplum siyasi toplumun oluşmasının yolunu açarken siyasi toplum da sivil toplumun güçlenmesini sağlayacaktır.63 4.  SİVİL TOPLUMDAKİ GÖNÜLLÜLÜK ESASI Tocqueville, Amerika da insanların inandıkları bir fikir için destek aradıklarından ve bu amaçla bir araya geldiklerinden bahseder. Bir araya gelmekle  birlikte  bireylerin  güçlendiğini  ve  fikirlerin  dinlenebilir  hale geldiğini  ifade  eden Tocqueville;  gönüllülük  esasının  bu  hususta  önemli olduğunu vurgulamaktadır.64 Amerikalıların toplumun refahı için büyük özveride bulunduklarını ifade eden Tocqueville insanların sahip oldukları özgür kurumlar ve sık sık kullandıkları politik haklar sayesinde yurttaş ve toplumun bir parçası olduklarını hatırladıklarını belirtir. Sahip olunan bu güçlü haklar da insanları birbirlerine yakınlaştırmaktadır. Çünkü birbirlerine karşı herhangi bir üstünlük veya  ayrıcalığı  olmayan  insanlar  daha  kolay  iletişim  kurup  daha  kolay 60  TAMER,  s. 100 61  TOCQUEVILLE,  s. 173 62  GÖNENÇ, Ayşenur Akpınar, Sivil Toplum Düşünsel Temelleri ve Türkiye  Perspektifi”,  http://www.altkitap.net/sivil-toplum/, s. 34, 10.04.2013, 13:00 63  TOCQUEVILLE,  s. 177-178 64  TOCQUEVILLE,  s. 174 332 Gazi Üniversitesi Hukuk Fakültesi Dergisi C. XIX, Y. 2015, Sa. 3Murat TUMAY / Firdevs OKATAN uzlaşabileceklerdir.65 Bu durumun da; gönüllülük esasının önemli olduğu sivil toplumda, örgütlenmenin önündeki engellerin kaldırılmasının ve hatta teşvik edilmesinin bir görünümü olduğunu kabul edebiliriz. 5.  SİVİL  TOPLUMUN  EKONOMİK  ETKİNLİKLERDEKİ FONKSİYONU Tocqueville Amerika daki derneklerdeki konu çeşitliliğine dikkat çeker ve hemen her konuda halkın örgütlenebildiğinden bahseder. Güvenlik, ahlaki, dini vb. meselelerin yanında ticaret ve endüstriyi geliştirmek gibi konular da dernek kurmaya vesile olabilir.66 Devletin toplumun her türlü ihtiyacını karşılamak amacıyla artırdığı görev ve hizmetleri; kendi güç ve otoritesini de artırırken, tüm ihtiyaçları önüne hazır olarak sunulan birey ise örgütlenmeye daha az gereksinim duyacaktır. Merkezileşen devletin özel sektörün alanına müdahale etmek suretiyle kendi otoritesini  güçlendirmesinin  sakıncalarına  değinen Tocqueville,  böyle  bir durumda güçsüzleşen toplumun yaratıcılığının da zamanla yok olacağını savunmaktadır. Ticaret, üretim gibi alanların özel girişime bırakılmasının halkın  zekasının  güçlenmesine  katkıda  bulunacağına  değinen  düşünür, böylelikle devlete olan bağımlılığın da azalacağına işaret etmektedir.67 5.  BASININ SİVİL TOPLUM ÜZERİNDEKİ  ETKİSİ Tocqueville,  sivil  toplum  kuruluşlarının  gazeteler  tarafından desteklenmesinin,  toplumdaki  işbirliğinin  sağlanabilmesi  adına  en  kolay ve alışılagelmiş yöntem olduğunu savunur. 1800 lü yıllarda internetten söz edilemeyeceği için özellikle gazetelerin önemine değinen düşünür, gazetelerin farklı fikirleri içeren çeşitlerinin olmasının ve uzak bölgelere iletilebilmeleriyle birlikte; iletişimin geniş alanlar arasında sağlanması gibi özelliklerinin önemine vurgu yapar. Aynı sivil toplum kuruluşuna üye olan insanların, iletişim halinde olabilmek için aynı çevrede yaşamaları zorunluluğunu ortadan kaldıran da işte bu gazetelerin varlığıdır.  Ona göre gazete tüm bu özellikleri sayesinde uygarlığın sürekliliğini sağlayacak yegane araçtır.68 Tocqueville  demokratik  rejimlerde  bireylerin  güçsüzlüğüne  vurgu yaparken bireylerin bir araya gelmesinin oldukça zor olduğunu ifade eder. 65  TOCQUEVILLE,  s. 171-172 66   TOCQUEVILLE, s. 84 67  TOCQUEVİLLE, s. 174 68  TOCQUEVİLLE, s. 175 Gazi Üniversitesi Hukuk Fakültesi Dergisi C. XIX, Y. 2015, Sa. 3 333Alexis De Tocqueville e Göre Sivil Toplum Güçsüz  bireylerin  durumunu  karanlık  içinde  birbirini  arayan  insanlara benzeten Tocqueville gazeteleri ise onları bir araya getiren ve bir arada kalmalarını destekleyen unsur olarak görür. Ne var ki, basının insanları yanlış hedeﬂ ere yönlendirebilmesinin de mümkün olduğunu savunan  Tocqueville, yine de sivil topluma sağlayacağı faydalarının zararlardan üstün geleceğine inanmaktadır. Nasıl ki sivil toplum demokrasiyi güçlendiren ve destekleyen bir faktör ise, gazeteler de sivil toplumun en büyük destekçisidir.69 Günümüzde basın, çok daha çeşitli platformlarda karşımıza çıkmaktadır. Fakat bu çeşitlilik içinde sivil toplumu güçlendirici ve destekleyici basının yanı  sıra,  amacından  ayrılarak  insanları  belirli  alanlara  yönlendirmeye çalışan basın kuruluşları ile karşılaşmak da mümkündür. Özellikle ideolojik düşünceler taşıyan kesimler veya devlet tarafından maddi ve manevi bakımdan desteklenen bir basın- yayın kuruluşunun; tarafsızlığını koruyabilmesi pek mümkün gözükmemektedir.70 6.  ANAYASAL DEMOKRASİ VE SİVİL TOPLUM Anayasal demokrasi kavramı çok basit bir biçimde Anayasal şekilde örgütlenmiş  demokratik  devlet”  şeklinde  formüle  edilebilir.  Bu  tanım çerçevesinde anayasal demokrasi” kavramını açıklayabilmek için öncelikle anayasal devlet” ve demokratik devlet” kavramları üzerinde durmak gerekir. Her anayasası olan devle anayasal devlet” demek değildir. Siyasi iktidar büyük bir güç potansiyelini ifade eder. Dolayısıyla, siyasi iktidara sahip  olanların  her  zaman  siyasi  iktidarı  bu  iktidara  sahip  olmayanlar aleyhine kullanma ihtimali vardır. İşte anayasal bir devlette anayasa, bireyleri siyasi iktidara karşı koruyan kurumsal bir kalkan işlevi görür. Bu tespitten yola  çıkarak  anayasal  devlet;  siyasi  iktidarın,  bireyi  korumak  amacıyla, anayasacılık”  prensiplerine  uygun  olarak  kullanılması  esasına  dayanan devlet olarak tanımlanabilir. Demokratik devlet kavramı anayasal devlet te siyasi iktidarın nasıl kullanılacağı sorusuna cevap arar. Bir anayasal devlette siyasi iktidar anayasacılık prensiplerine uygun olarak kullanılır. Demokratik devlet ise, daha çok; Siyasi iktidar kimin tarafından kullanılır?” Siyasi iktidar hangi kurallara göre el değiştirir?” sorularıyla ilgilidir. Tarih boyunca bu sorulara farklı cevaplar verilmiş ve bu cevaplar çerçevesinde farklı rejim biçimleri  ortaya  çıkmıştır.  Demokrasi  adını  verdiğimiz  rejimlerde  siyasi iktidar halk adına, halk tarafından seçilen ve halka hesap veren yöneticiler 69  TOCQUEVILLE, s. 176 70  DİLİPAK, Abdurrahman, Sivil Toplum”, Yeni  Türkiye, S. 18, 1997, s. 66 334 Gazi Üniversitesi Hukuk Fakültesi Dergisi C. XIX, Y. 2015, Sa. 3Murat TUMAY / Firdevs OKATAN tarafından kullanılır. Bir başka ifadeyle, demokratik bir devlette, siyasi iktidarı kullanacak olanlar seçimler yoluyla belirlenir ve siyasi iktidar gerektiğinde yine  seçimler  yoluyla  barışçı  bir  biçimde  el  değiştirir.  Bu  tespitten  de anlaşılacağı gibi, demokratik devlet açısından seçim ve ona bağlı kavramlar, örneğin siyasi partiler önem kazanır. Bu bağlamda iktidarın demokratik olarak elde edilmesi ve el değiştirmesi sivil toplumun anayasal garanti ile örgütlenme ve ifade hürriyetine sahip olmasına ve güçlü olmasına bağlıdır. Kısaca modern bir sivil toplumun kurumsallaşması temel sivil ve siyasal hakların garanti edilmesi şartına bağlı olacaktır. Bu haklar ise öte yandan ancak özgürlükçü bir anayasacılık ile mümkündür.71 SONUÇ Sivil toplum kavramı günümüzdeki anlamı ve içeriğini alana dek çeşitli aşamalardan geçmiştir. İlk zamanlarda devlet sivil toplumla iç içe ve bir bütün olarak anılırken Ortaçağ dan itibaren kapitalizmin yükselişiyle birlikte artık çatışma hali ortaya çıkmıştır. Sivil toplum özel bireyler tarafından oluşturulan, devletten bağımsız, gönüllülük esasının benimsendiği ve belirli fikirlerin savunulmasına fırsat tanıyan platformlardır. Sivil toplumun en önemli fonksiyonu demokrasinin işleyişini desteklemektir. Günümüzdeki anlamıyla sivil toplum demokrasinin vazgeçilmez bir parçasıdır diyebiliriz. Halkın kendi kendisini yönettiği rejim olan demokrasinin halktan kopmadan sürdürülebilmesi yine halkın desteğiyle mümkün olabilecektir. Sivil  toplum  ortak  sivil  menfaatlerin  savunulmasını  ve  devletin baskısının azaltılmasını sağlayan bir mekanizmadır. Devletle toplum arasında bir köprü vazifesi görerek isteklerin veya fikirlerin meşru yollardan devlete iletilmesini sağlamakla görevlidir. Alexis De Tocqueville; sivil toplumun önemini günümüzden yaklaşık iki yüz yıl önce vurgularken anayasal demokrasi rejimi var olduğu müddetçe sivil toplumun da var olacağını savunmuştur. Amerika ya  giderek  ülkesi  Fransa da  yeni  yeni  kendini  gösteren demokrasinin  ihtiyaçlarını,  zaaﬂ arını  ve  güçlü  yanlarını  araştıran Alexis De  Tocqueville,  Fransa da  demokrasinin  Amerika daki  kadar  doğru uygulanamamasını  Fransa da  eksik  olan  kontrol  mekanizmasına  bağlar. 71 Arato, Andrew, Civil  Society, Constitution and Legitimacy, (Rowmand & Littlefield Publisher, 2000, New York, London), s.10 Gazi Üniversitesi Hukuk Fakültesi Dergisi C. XIX, Y. 2015, Sa. 3 335Alexis De Tocqueville e Göre Sivil Toplum Bu mekanizma ise bireylerin bir araya gelerek oluşturdukları sivil toplum kuruluşlarıdır. Tocqueville Amerika da gördüğü olumlu hallerin bir çoğunu orada gelişmiş olan sivil toplum yapısına bağlamaktadır. Amerika da benimsenen demokratik  rejimin  ortaya  çıkış  nedenlerini  araştıran  Tocqueville;  oraya yerleşen  insanların  eşitliği  esas  alarak,  mülkiyete  dayalı  aristokrasiyi reddettiklerini ortaya koymuştur. Eşit ve güçsüz olan bu bireyler, hemen her konuda bir sivil toplum kuruluşunun oluşturulmasına gayret göstermişlerdir. Bu durumu da her bir bireyin, ülkenin devamlılığı ve istikrarı için kendisini sorumlu olarak hissetmesine bağlayan Tocqueville; ülke sorunlarına duyarlı olan yurttaşların çok büyük yararlıklar sağlayabileceğini ifade etmiştir. Tocqueville demokrasi, eşitlik, özgürlük gibi kavramlarla yakından ilgilenmesinin yanı sıra sivil toplum kavramının da günümüzdeki anlamına ulaşmasının önünü açan pek çok yenilikler ortaya atmıştır. Bunlardan en önemlisi; sivil toplumun demokrasinin güçlenmesi adına sağladığı destektir. Devletin  sınırlarını  aşmak  suretiyle  topluma  olan  baskısının  artmasını engellemek de yine sivil toplumun görevleri arasındadır. Sivil toplumun devletten veya siyasi toplumdan ayrı bir yerde olduğunu savunan Tocqueville, sivil toplumda gönüllülüğün esas olduğunun altını çizmiştir. Günümüzde de öneminin iyi bilindiği basının, sivil toplum üzerindeki etkisinden bahseden düşünür  gazeteleri  uygarlığın  sürekliliğini  sağlayacak”  en  önemli  araç olarak görmüştür. Aradan  geçen  yıllara  rağmen  sivil  toplumun  hak  ettiği  noktada bulunmadığını söylemek mümkündür. Belki de devletin toplum için var olması gerektiği tam olarak idrak edilemediğinden, sivil toplum devlet tarafından bir tehlike olarak algılanmaktadır. Oysa sivil toplum tarafından desteklenen bir demokrasi, devleti ve ülkeyi ileriye taşıyacak en önemli etkendir. 336 Gazi Üniversitesi Hukuk Fakültesi Dergisi C. XIX, Y. 2015, Sa. 3Murat TUMAY / Firdevs OKATAN BİBLİYOGRAFYA AKTAN, Coşkun Can, Sivil Toplum İçin İdeal Devlet”, Yeni Türkiye, S. 18, 1997, s. 188-191. ARATO,  Andrew,  Civil  Society,  Constitution  and  Legitimacy, (Rowmand & Littlefield Publisher, 2000, New York, London), ATAR, Yavuz, Demokratik Sistemde Sivil Toplumun Fonksiyonu ve Sivil Toplum- Devlet Düalizmi”, Yeni  Türkiye, S. 18, 1997, s. 98- 101. BELGE, Murat,  Sivil Toplum Nedir?”, http://stk.bilgi.edu.tr/docs/belge_std_1.pdf , İstanbul Bilgi Üniversitesi Sivil Toplum Kuruluşları Eğitim ve  Araştırma  Birimi, 10.04.2013, 13:00 BOLAY, S. Hayri, Sivil Toplum ve Manası”, Yeni  Türkiye, S. 18, 1997, s. 7-8 BUMİN, Kürşat, Sivil Toplum ve Devlet, Yazarlar ve Çevirmenler Yayın Üretim Kooperatifi, İstanbul, 1981  ÇAHA, Ömer, Sivil Toplum Üstüne”, Sivil Toplum ve Demokrasi, Kaknüs Yayınları, İstanbul, 2005, s. 9-22 DİLİPAK, Abdurrahman, Sivil Toplum”, Yeni  Türkiye, S. 18, 1997, s. 65-67. DİNÇKOL, Bihterin, Çoğunluk Tiranisine Karşı Bir Çözüm Yolu: Tocqueville nin  Siyasal Kuramı”, İstanbul Ticaret Üniversitesi Dergisi, C. 3, S. 5,2004 DOĞAN, İlyas, Sivil Toplum Anlayışı ve Siyasal Sistemler, Barış Platin Kitabevi, 2. Baskı, 2009 ERASLAN, Levent, Sivil Toplum ve Eğitim (ESTK), Maya Akademi Yayınevi, Ekim 2011, Ankara ERDİNÇ, Tahsin,  Alexis De Tocqueville ve ABD de Sivil Toplumun Temelleri”, Yeni Türkiye, S.18, 1997 ERDOĞAN,  Mustafa,  Anayasal  Demokrasi,  Siyasal  Kitabevi,  9. baskı, Eylül, 2012 GENÇKAYA, Ömer Faruk, Demokratikleşme ve Sivil Toplum İlişkisi Üzerine Bir Not”, Yeni  Türkiye, S. 18, 1997, s. 102-105 Gazi Üniversitesi Hukuk Fakültesi Dergisi C. XIX, Y. 2015, Sa. 3 337Alexis De Tocqueville e Göre Sivil Toplum GÖNENÇ, Ayşenur Akpınar, Sivil Toplum Düşünsel Temelleri ve Türkiye  Perspektifi”,  http://www.altkitap.net/sivil-toplum/ , 10.04.2013, 13:00 GÖZE, Ayferi, Siyasal Düşünceler ve Yönetimler, Beta Basım A.Ş., 9. Bası,  İstanbul-2000 HOCAOĞLU, Durmuş, Sivillik ve Demokrasi”, Yeni Türkiye, S. 18, 1997, s. 106-112 İNAÇ, Hüsamettin- ERDOĞAN, Selami, Farklı Kuramsal Perspektiﬂ er Çerçevesinde Sivil Toplum Tartışmalarının Karşılıklı Analizi”, Akademik Bakış Uluslararası Hakemli Sosyal Bilimler E- Dergisi, S. 11, Ocak-2007 KEANE, John, Despotizm ve Demokrasi”, Sivil Toplum ve Devlet, Avrupa da Yeni Yaklaşımlar, Der: John Keane, Çev: Levent Köker, Ayrıntı Yayınevi, Aralık 1993 KEANE, John, Giriş”, Sivil Toplum ve Devlet, Avrupa da Yeni Yaklaşımlar, Ayrıntı Yayınları, Der: John Keane, Çev: Levent Köker, Aralık 1993 ONBAŞI, Funda, Sivil Toplum, L&M Yayınları, İstanbul, Ekim 2015 SAVRAN,  Gülnur,  Sivil  Toplumun  Eleştirisi”,  Yapıt  Toplumsal Araştırmalar Dergisi, S: 5 Haziran- Temmuz 1984, s: 31-49 SAVRAN, Gülnur Acar, Sivil Toplum ve Ötesi, Rousseau, Hegel, Marx, Dipnot Yayınları, Ankara 2013 SCHMİDT, Manfred G., Demokrasi Kuramlarına Giriş, Çev. M. Emin Köktaş, Vadi Yayınları, 1. Basım, Ekim-2001 SELÇUK,  Sami,  Zorba  Devletten  Hukukun  Üstünlüğüne,  Yeni Türkiye Yayınları, 1998 TAMER, Mine Gözübüyük, Tarihsel Süreçte Sivil Toplum”, Edebiyat Fakültesi Dergisi, C. 27, S. 1, Haziran-2010, s. 89-105 TOCQUEVILLE, Alexis  De,  Amerika da  Demokrasi,  Çev.  İhsan Sezal- Fatoş Dilber, Yetkin Yayınları, 1994 YAYLA, Atilla, Siyasi Düşünceler Sözlüğü, Adres Yayınları, 2. Baskı, Ekim-2004 YERASİMOS,  Stefanos,  Sivil  Toplum,  Avrupa  ve  Türkiye”, 338 Gazi Üniversitesi Hukuk Fakültesi Dergisi C. XIX, Y. 2015, Sa. 3Murat TUMAY / Firdevs OKATAN Türkiye de Sivil  Toplum ve Milliyetçilik, İletişim Yayınları, 1. Baskı, İstanbul-2001 YETİŞ, Mehmet, Tocqueville, Demokratik Devrim ve Sivil Toplum”, Ankara  Üniversitesi  Siyasal  Bilgiler  Fakültesi  Gelişme  ve  Toplum Araştırmaları  Merkezi Tartışma Metinleri, No.87, Ekim-2005 YILDIRIM,  İbrahim,  Demokrasi,  Sivil  Toplum  Kuruluşları  ve Yönetişim, Seçkin Yayıncılık, Ankara, Ocak-2004 YILDIRIM,  Murat,  Sivil  Toplum  ve  Devlet”,  Cumhuriyet Üniversitesi Sosyal Bilimler Dergisi, C: 27, No: 2, Aralık 2003, s. 226-242 YILMAZ,  Aytekin,  Sivil  Toplum  Demokrasi  ve  Türkiye”,  Yeni  Türkiye, S. 18, 1997, s. 86-97 YILMAZ,  Murat,  Sivil  Toplumun  Kısa  Tarihi  ve  Aktüel  Bazı Meseleleri” Yeni Türkiye, S. 18, 1997 Gazi Üniversitesi Hukuk Fakültesi Dergisi C. XIX, Y. 2015, Sa. 3 339",
     "Abstract": "Sivil society is a concept that has existed from Ancient Times to the present day. However in terms of meaning, the concept has changed quite a lot. Alexis De Tocqueville, who make the civil society closer to the meaning of today, is a French philosopher of the nineteenth century. At a time of transition from aristocracy to democracy, according to Tocqueville to process democracy properly constitutional right  to  association  is  unalienable.  Furthermore,  mechanism  to  correct  the shortcomings of democracy is sivil society.",
     "Metin": "Sivil toplum kavramı, siyaset bilimi veya insan hakları gibi alanların yanı sıra demokrasi, anayasa, adalet, eşitlik gibi konularla da yakından ilgilidir. Böylesine geniş alanı ilgilendiren bir kavramla ve onun içeriğiyle ilgili de pek çok eserin ortaya konması kaçınılmazdır. Antik çağdan günümüze kavram, içeriği bakımından oldukça değişikliğe uğramış olsa da kendisine gösterilen ilgi tükenmemiş aksine artarak devam etmiştir. Nitekim sivil toplumu anlatan, sivil toplumu tartışan, Türkiye de ve Dünya da sivil toplumun gelişimine değinen pek çok kitap, dergi, makale vs. karşımıza çıkmaktadır. Asıl  konumuz  olan  Alexis  De  Tocqueville e  göre  sivil  toplum; Tocqueville in Amerika da gördüğü dernek ve örgütlenme yoğunluğunun demokrasiyi  güçlendirme  ve  devleti  kontrol  altında  tutma  gibi  yararlar sağladığı kanaatine varmasıyla şekillenmiştir. Demokrasinin öneminin yavaş yavaş  anlaşılmaya  başlandığı  1800 lü  yıllarda  yaşamış  olan  Tocqueville bir taraftan demokrasi, özgürlük, eşitlik kavramları ışığında sivil toplumun gerekliliğini, faydalarını anlatırken, diğer taraftan sivil toplum kavramını kendi düşüncesi çerçevesinde şekillendirmeye çalışmıştır. Çalışmamızın birinci kısmında, sivil toplum kavramı üzerine bilgiler sunduktan sonra, ikinci kısımla birlikte ünlü Fransız düşünür Alexis De Tocqueville in bakışıyla sivil toplum konusunu ele almaya çalışacağız. § I. GENEL OLARAK SİVİL TOPLUM KAVRAMI Sivil Toplum kelimesi dilimize sonradan eklenmiş Batı kökenli bir kavramdır.1Kavrama yüklenen anlam zaman içinde değişikliğe uğramış olsa da düşüncel boyutunun gelişmesi 17.  ve 18. yüzyıla dayanmaktadır.3 Sivil toplumun temellerinin atıldığı Antik Yunan da sivil toplum ile devlet aynı anlamda kullanılırken, bir sivil toplum üyesi olmak ile yurttaş veya devletin bir üyesi olmak aynı anlamaları karşılamaktaydı.4 Sivil topluma geçiş 1   BOLAY, Hayri, Sivil Toplum ve Manası, Yeni Türkiye, S. 18, 1997, s.7 2   İNAÇ, Hüsamettin- ERDOĞAN, Selami, Farklı Kuramsal Perspektiﬂ er Çerçevesinde Sivil Toplum Tartışmalarının Karşılıklı Analizi, Akademik Bakış Uluslararası Hakemli Sosyal Bilimler E- Dergisi, S. 11, Ocak-2007, s. 2 3   YILMAZ, Aytekin,  Sivil Toplum Demokrasi ve Türkiye, , Yeni Türkiye, S. 18, 1997, s. 87; ONBAŞI, Funda, Sivil Toplum, L&M Yayınları, İstanbul, Ekim 2015, s. 13 4   KEANE, John, Despotizm ve Demokrasi, Sivil Toplum ve Devlet, Avrupa da Yeni Yaklaşımlar, Der: John Keane, Çev: Levent Köker, Ayrıntı Yayınevi, Aralık 1993, s. 48, SAVRAN, Gülnur, Sivil Toplumun Eleştirisi, Yapıt Toplumsal Araştırmalar Dergisi, S: 5 Haziran- Temmuz 1984, s: 33 322 Gazi Üniversitesi Hukuk Fakültesi Dergisi C. XIX, Y. 2015, Sa. 3Murat TUMAY / Firdevs OKATAN doğa durumunda özgür olan insanların sahip olduğu uyumun desteklenmesi ve pekiştirilmesidir.5 Sivil  toplum  ve  devlet  ayrımının,  devlet  yapısının  sivil  toplumun gelişimine  daha  uygun  olması  dolayısıyla  Amerika da  ortaya  çıktığını söylemek mümkündür.6 Sivil toplum ve devletin birbirinden ayrı olması toplumun  siyasi  yönlendirmelerden  ziyade  eşitlik,  özgürlük  gibi  önemli ilkelerden hareket etmesinin önünü açmaktadır. 7 Sivil  toplum  kavramının  kelime  anlamı  ve  kapsamı  konusuna geçmeden önce sivil toplumun iç içe olduğu kavram olan demokrasiden kısaca bahsetmekte yarar vardır. Demokrasinin Abraham Lincoln tarafından yapılmış ünlü tanımı şöyledir: Demokrasi, halkın halk tarafından, halk için yönetilmesidir.8İlkçağda  ortaya  çıktıktan  sonra  tekrar  yükselişi  Yeniçağ aydınlanma çağına tekabül eden demokrasi, günümüzde kırılgan, kurulması ve kaldırılması bir çok etkene bağlı bir rejim olarak varlığını sürdürmektedir.9 Sivil toplum kavramının gelişimi konusunda Antik çağdan günümüze Aristoteles, Çiçero, Thomas Hobbes, Montesquieu, Gramsci gibi pek çok Batılı  düşünür  çalışmalar  ve  tartışmalar  yapmıştır.10  Savran a  göre  sivil toplum kavramı üzerindeki tartışmalar yalnızca sivil toplumun terminolojik anlamını ortaya koyma kaygısından öte kavramın siyasal ve ideolojik fikirlerin etkisinde kalmasından ileri gelmiştir.11 A.  SİVİL TOPLUM HAKKINDA Sivil toplumu, özel bireyler tarafından oluşturulan, serbest bir şekilde örgütlenip faaliyet gösterebilen, toplumun kolektif hayatını oluşturan, bireyle devlet arasında yer alan ara yapılar olarak ifade edebiliriz. Çeşitli etnik, dini, fikri veya hayri nitelikteki bu topluluklarda esas olan gönüllülük ve rızadır.12 Sivil toplum kuruluşları yardımlaşma, insan hakları, kadın ve çocuk hakları, 5   SAVRAN, Gülnur Acar, Sivil Toplum ve Ötesi, Rousseau, Hegel, Marx, Dipnot Yayınları, Ankara 2013, s. 36 6   KEANE, s. 49 7   SAVRAN, , Sivil Toplumun Eleştirisi, s. 40 8   ERDOĞAN, Mustafa, Anayasal Demokrasi, Siyasal Kitabevi, 9. baskı, Eylül, 2012, s. 232 9   ERDOĞAN, s. 229-230 10  ERASLAN, Levent, Sivil Toplum ve Eğitim (ESTK), Maya Akademi Yayınevi, Ekim 2011, Ankara, s. 13 11  SAVRAN, s. 47 12  YAYLA, Atilla, Siyasi Düşünceler Sözlüğü, Adres Yayınları, 2. Baskı, Ekim 2004,s. 206 Gazi Üniversitesi Hukuk Fakültesi Dergisi C. XIX, Y. 2015, Sa. 3 323Alexis De Tocqueville e Göre Sivil Toplum çevre ve bilim teknoloji gibi pek çok alanda çalışmalar yürütüp ulusal veya uluslar arası alanda da faaliyet gösterebilirler.13 Sivil toplumun karşıtını oluşturan kelime bilindiği üzere askeri toplum değil siyasal toplum veya politik toplumdur. Politik toplum kavramından da basitçe devleti anlayabiliriz.14 Sivil toplum siyasal toplum şeklindeki ayrım kapitalizmin doğuşuyla birlikte ortaya çıkmıştır.15 Keane devlet ve sivil toplum arasındaki ayrıma işaret eden üç farklı ana yaklaşım olduğundan bahseder. Analitik yaklaşımlar, söz konusu ayrımdan özel kurumlar veya toplumsal sistemler için bir nevi çözümleme aracı olarak faydalanmaya vurgu yapar.16 Devlet ve sivil toplum ikilisinin siyasal bir takım hedeﬂ er için destek olarak kullanıldığını savunan ikinci yaklaşımı oluşturuken üçüncü yaklaşımda ise devlet ve sivil toplum arasındaki ayrılığın korunmasının önemi vurgulanırken söz konusu ayrımın normatif boyutu öne çıkarılmaktadır.18 Çaha ya göre sivil toplum ideolojik topluma karşı tutum sergileyen, ideolojik toplumun toplumsal farklılık ve zenginliklere müsaade etmeyen yanını reddeden bir toplum modelini ifade etmektedir.19 Sivil toplum kavramının doğuşu devletin ortaya çıkmasıyla başlar. Modern öncesi dönemde, sivil toplum ve devlet aynı anlama geliyorken, Orta Çağ dan itibaren kapitalizmin yükselişiyle birlikte sivil toplum devletten ayrılmaya hatta devletle çatışmaya başlamıştır. Bu ayrışma ve çatışmanın sebebiyse  doğa  halinden  sonra  ortaya  çıkan  devletin  zamanla  otoritesini artırıp,  toplum  için  devlet  yerine  devlet  için  toplum  anlayışına  doğru yönelmesidir. Modern öncesi dönemde sağlanan yurttaş- devlet birlikteliği ve barışı, Orta Çağ da ticaretin gelişmesiyle birlikte diğer bir deyişle paranın 13  ATAR, Yavuz, Demokratik Sistemde Sivil Toplumun Fonksiyonu ve Sivil Toplum- Devlet Düalizmi, Yeni  Türkiye, S. 18, 1997, s. 98 14 BELGE, Murat,  Sivil Toplum Nedir?, http://stk.bilgi.edu.tr/docs/belge_std_1.pdf , İstanbul Bilgi Üniversitesi Sivil Toplum Kuruluşları Eğitim ve Araştırma  Birimi, s. 1, 10.04.13 15  BUMİN, Kürşat, Sivil Toplum ve Devlet, Yazarlar ve Çevirmenler Yayın Üretim Kooperatifi, İstanbul, 1981, s.11; YILMAZ, Murat, Sivil Toplumun Kısa Tarihi ve Aktüel Bazı Meseleleri Yeni Türkiye, S. 18, 1997, s. 369; 16  KEANE, John, Giriş, Sivil Toplum ve Devlet, Avrupa da Yeni Yaklaşımlar, Ayrıntı Yayınları, Der: John Keane, Çev: Levent Köker, Aralık 1993, s. 25 17  KEANE, Giriş,  s. 34 18  KEANE, Giriş,  s. 39 19  ÇAHA, Ömer, Sivil Toplum Üstüne, Sivil Toplum ve Demokrasi, Kaknüs Yayınları, İstanbul, 2005, s. 15 324 Gazi Üniversitesi Hukuk Fakültesi Dergisi C. XIX, Y. 2015, Sa. 3Murat TUMAY / Firdevs OKATAN öneminin artmasıyla birlikte kırılmaya başlamış ve devlet- tebaa haline dönüşmüştür.20 18. yüzyıldan itibaren iktidar artık ilahi değil dünyevi kaynaklı hale gelmeye başlamıştır, bu süreçte de sivil toplumun bağımsız hale gelmesinin önemli payı bulunmaktadır.21 Sivil  toplumun  oluşum  ve  gelişimi  birçok  faktörün  durumuna bağlıdır. Bunlar anayasa da devletin yapısı, işleyiş tarzı, toplumun yapısı, ülkenin ekonomik durumu gibi çeşitlilik gösterebilir.22 Sivil toplum her ne kadar anayasalcılık ile de hedeﬂ enen devleti sınırlandırma gayesi içinde olsa da iktidarı ele geçirmek veya siyaseti bizzat yürütmek gibi bir amacı hedeﬂ ememektedir.23 Batı toplumlarında ortaya çıkan ve güçlenen burjuvazi ile birlikte belirginleşen toplumsal sınıf sivil toplum düşüncesinin gelişimi anlamında  katkı  sağlarken,  1789  Fransız  İnsan  ve  Vatandaşlık  Hakları Beyannamesi ile bu gelişim hız kazanmıştır.24 Sivil toplumun gelişmesine dolaylı olarak katkı sağlamış gelişmelere değinecek olursak; ekonomik liberalizmle birlikte siyasi liberalizmin gelişmesi ve bu gelişim ile birlikte genel oy hakkının yaygınlaşması, yurttaşlık bilincinin gelişmesi, örgütlenme hakkının tanınması gibi imkanları belirtmekte fayda olacaktır.25 B.  SİVİL TOPLUMUN YERİNE GETİRDİĞİ İŞLEVLER Sivil toplum demokrasinin gerçek anlamda işlemesini sağlayan bir mekanizmadır.  Sivil  toplumun  görevi;  devlete,  devletin  toplum  için  var olduğunu  ve  vekâletin  yurttaştan  alındığını  hatırlatmaktır.26  Sivil  toplum varlığını  sürdürebilmek  için  demokratik  topluma  ihtiyaç  duyarken  İdeal devlet diyebileceğimiz sivil toplumun gelişmesinin önünü açan devlet, her şeyden önce kutsal olanın kendisi değil, birey hak ve özgürlükleri olduğunun farkına varmış olan devlettir.27 Bir ülkede demokrasinin kurulması, yerleşmesi 20  YILMAZ, Murat, s. 368-372 21  BUMİN, Kürşat, s. 21 22  YILMAZ, Aytekin, s. 87 23  YILDIRIM,  İbrahim,  Demokrasi,  Sivil Toplum  Kuruluşları  ve Yönetişim,  Seçkin Yayıncılık, Ankara, Ocak-2004, s. 48 24  ONBAŞI, Funda, s. 14 25  ONBAŞI, Funda, s. 14-15 26  HOCAOĞLU, Durmuş, Sivillik ve Demokrasi, Yeni Türkiye, S. 18, 1997, s. 106-108 27  AKTAN, Coşkun Can, Sivil Toplum İçin İdeal Devlet, Yeni Türkiye, S. 18, 1997, s. 190 Gazi Üniversitesi Hukuk Fakültesi Dergisi C. XIX, Y. 2015, Sa. 3 325Alexis De Tocqueville e Göre Sivil Toplum ve gelişmesi sivil toplumun gelişip gelişmediğiyle yakından ilgilidir. Ayrıca özgürlükler de sivil toplumun gücüne bağlı olarak var olabilmektedir.28 Toplumun  parçası  olan  bireyler,  kendilerini  çeşitli  ilgi  ve  çıkar alanlarının merkezi olarak gördükleri konularda, daha etkin olmayı sağlayacak dayanışmaya  ulaşmak  için  aralarında  birleşip  sivil  toplum  kuruluşlarını oluştururlar. Bireyin esas olduğu bir toplumda, kişiler arasındaki eşitlik ön planda olduğundan ortak amacın çıkarı doğrultusunda çalışmak zorunluluğu ortaya çıkar. Oluşan bu kuruluşlar, seçim ve grev gibi yöntemlerin dışında, devletin ve yerel yönetimlerin temsilcileri ile iletişime geçerek ya da onlara baskı yaparak amaçlarına varmaya çalışırlar. Bireyin tek başına politikacıyla ya da iktidar temsilcisi ile pazarlığa girerek sorunları halletmeye çalışması yerine,  bireylerin  eşit  katkı  ve  sorumlulukları  ile  kurulmuş  sivil  toplum kuruluşlarının bu görevi üstlenmesi daha doğru olacaktır.29 Sivil toplum menfaatlerin savunulması adına bir ortam oluşmasını sağlarken, rayında işleyen bir sivil toplum daha çoğulcu ve katılmacı bir toplum olacaktır. Sivil toplum kuruluşları siyasal kurumlarla bağlantı halinde olduğundan halktan kopuk bir siyasetin önüne geçilmiş olacaktır. Ayrıca sivil toplum kuruluşları yeniliklere uyum sürecinde de destek sağlamaktadır.30 Sivil  toplum  devletin  karşısında  toplum  lehine  bir  muhalefet oluştururken, toplumun taleplerinin üst mercilere iletilmesini sağlar. Kamusal ahlak ilkeleri oluşturulması ve uygulanması konusunda da sivil topluma önemli görevler düşmektedir. Bunların dışında sivil toplum kuruluşlarının birbirleriyle etkileşime geçmeleriyle de demokratik bir tartışma ve dayanışma ortamı oluşmuş olacaktır.31 Sivil  toplum  kuruluşlarını  sivil  toplum  içindeki  konumunu  sivil toplumun  meyveleri  olarak  nitelendirmek  mümkündür.  Bu  kuruluşlar içerisinde yer aldıkları toplumdan beslenerek, yine içerisinde yer aldıkları topluma yararlıklar sağlayan bir döngüyü oluşturmaktadırlar.32 28  YILMAZ, Aytekin, s. 89 29  YERASİMOS, Stefanos,  Sivil Toplum, Avrupa ve Türkiye, Türkiye de Sivil Toplum ve Milliyetçilik, İletişim Yayınları, 1. Baskı, İstanbul 2011, s. 13 30  ATAR, s.  99-100 31  GENÇKAYA, Ömer Faruk, Demokratikleşme ve Sivil Toplum İlişkisi Üzerine Bir Not, Yeni Türkiye, S. 18, 1997, s. 104 32  YILDIRIM, Murat, Sivil Toplum ve Devlet, Cumhuriyet Üniversitesi Sosyal Bilimler Dergisi, C: 27, No: 2, Aralık 2003, s. 226 326 Gazi Üniversitesi Hukuk Fakültesi Dergisi C. XIX, Y. 2015, Sa. 3Murat TUMAY / Firdevs OKATAN §  II.  ALEXIS  DE  TOCQUEVILLE NİN  SİVİL  TOPLUMA YAKLAŞIMI VE GETİRDİĞİ YENİLİKLER Tam  adı Alexis  Charles  Henri  Maurice  Clerel  De Tocqueville dir. 1805 yılında Verneuil de dünyaya gelen Fransız düşünür meslek hayatına Versailles da  stajyer  hakim  olarak  başlar.  Görevi  sırasında Amerika daki hapishaneleri incelemek amacıyla bu ülkeye gider. Bu ziyaret onu günümüze kadar taşıyan kitabı Amerika da Demokrasinin kaleme alınmasına vesile olacaktır.33 Tocqueville,  aristokrat  bir  Norman  ailesinin  içinde  büyümüştür. Aristokrasiden demokrasiye geçiş evresinin yaşandığı 1800 lü yılların başına tanıklık etmiş olan düşünür her iki rejimi de karşılaştırma fırsatını yakalamıştır. Her  ne  kadar  aristokrat  bir  aileden  gelse  de,  ülkesi  Fransa da  yaşanan demokrasi ve eşitlik mücadelesine de kayıtsız kalamamıştır. Fransa da sürekli tehditlerle karşılaşan ve kesintiye uğrayan demokrasinin aksine, Amerika da barışçıl ve eksiksiz işleyen bir demokrasinin hüküm sürdüğünü gören düşünür bu farkın nelerden kaynaklandığını araştırmak ve bir karşılaştırma yapmak üzere Amerika ya gider.34 A. ALEXIS DE TOCQUEVILLE IN GENEL OLARAK SİVİL TOPLUMA YAKLAŞIMI Tocqueville  Amerika nın,  doğup  büyüdüğü  Fransa dan  farklı  ve olumlu yönlerinden bahsederken iki önemli duruma işaret etmiştir. Birincisi Fransa daki monarşik egemenliğin aksine A.B.D. de anaaysal demokrasinin hakim olması, ikincisi ise A.B.D. de güçlü merkezi yönetim oluşturmak yerine yerinden yönetimlere önem verilip, gücün tek merkezde toplanmasının engellenmiş olmasıdır.35 Her iki faktör de Amerika adına sivil toplum için gereken zemini hazırlamıştır. Tocqueville;  Amerikalıların  karşılaştığı  hemen  her  problemi  bir vakıf veya dernek kurarak aşmaya çalıştığını gözlemlemiştir. Sivil toplum bilincinin bu denli gelişmiş olmasını da insanların aristokratik rejimlerdeki durumun aksine eşit olmaları sayesinde bir araya gelerek güçlenebileceklerini fark  etmelerine  ve  devlete  olan  bağımlılığı  böylece  azaltmış  olmalarına bağlamaktadır.36 33  TOCQUEVİLLE, Alexis De, Amerika da Demokrasi, Çev. İhsan Sezal- Fatoş Dilber, Yetkin Yayınları, 1994, s. 13 34  TOCQUEVILLE,  s. 28-35 35  SCHMİDT, Manfred G., Demokrasi Kuramlarına Giriş, Çev. M. Emin Köktaş, Vadi Yayınları, 1. Basım, Ekim-2001, s. 79 36  TAMER, s. 98-99 Gazi Üniversitesi Hukuk Fakültesi Dergisi C. XIX, Y. 2015, Sa. 3 327Alexis De Tocqueville e Göre Sivil Toplum Tocqueville e  göre  sivil  toplum  çoğulcu  örgütlenmeler  sistemi diyebileceğimiz ve ihtiyaçlara çözüm bulabilmek, devletin baskıcı davrandığı durumlarda müdahale edebilmek, demokrasinin korunmasını sağlamak gibi faaliyetleri  içeren  esasen  toplumun  kendini  korumak  adına  oluşturduğu bir güvencedir.37 Ona göre sivil toplumun amacı bir düşünceyi yaymak ve güçlendirmektir.38 B.  ALEXIS  DE  TOCQUEVILLE NİN  SİVİL  TOPLUM KAVRAMINA GETİRDİĞİ YENİLİKLER Tocqueville, devletin  yalnızca  özgürlük ve  eşitliğe önem vermesini  yeterli görmez aynı zamanda sivil toplumun oluşmasına da ortam sağlaması gerektiğini  ifade  eder.39  Çünkü  ona  göre  örgütlenme  özgürlüğü  bireysel özgürlükler kadar önemlidir. Hatta öyle ki örgütlenme özgürlüğüne yapılacak bir müdahalenin toplumu da derinden sarsacağını ifade etmiştir.40 Tocqueville in Amerika da gördüğü örgütlenme biçimini o zamanın Avrupa sından ayıran önemli farklar vardır. Örneğin; Amerika da azınlıkta kalan kesim diğerlerine kendilerinin de var olduğunu göstermek ve güçlerini ortaya koymak için bir araya gelirken Avrupa ya baktığımızda çoğunluğun karşısında kendini ezilmiş hisseden ve buna karşı mücadele etme yolunu seçen bir örgütlenme dikkati çekiyor. Avrupa da bir araya gelen insanların yaptıkları tartışmaların sonuçları hayata geçirilemezken Amerika da olumlu, umutlu ve barışçı bir örgütlenme alanı kendini gösterir.42  Tocqueville sivil toplumun demokrasi için vazgeçilmez olduğunun altını çizmiş ve demokrasinin ihtiyacı olan toplumun güveni, eşitliği ve toplumla uzlaşmanın sivil toplum sayesinde gerçekleşebileceğini savunmuştur. Ayrıca sivil toplum kavramını; devletten, siyasi partiler ve yerel yönetimler gibi siyasetle iç içe kurumlardan ayırmak suretiyle ayrı bir örgütlenme alanı olarak ifade etmiştir.43 37  YETİŞ, Mehmet, Tocqueville, Demokratik Devrim ve Sivil Toplum, Ankara Üniversitesi Siyasal Bilgiler Fakültesi Gelişme ve Toplum Araştırmaları Merkezi Tartışma Metinleri, No.87, Ekim-2005, s. 14 38  TOCQUEVILLE,  s. 84 39  DOĞAN, İlyas, Sivil Toplum Anlayışı ve Siyasal Sistemler, Barış Platin Kitabevi, 2. Baskı, 2009, s. 141 40  TOCQUEVILLE, s. 86 41  Tocqueville in Amerika da Demokrasi kitabını yazdığı tarihten yola çıkacak olursak 1800 lü yılların başı diyebiliriz. 42  TOCQUEVILLE, s, 86 43  TAMER, s. 100 328 Gazi Üniversitesi Hukuk Fakültesi Dergisi C. XIX, Y. 2015, Sa. 3Murat TUMAY / Firdevs OKATAN Tocqueville devletin merkezileşmesinin özgürlükleri sınırlandıracağını savunmaktadır. Ona göre otoriter bir devletin müdahale edebileceği alanlar ne kadar geniş olursa, birey özgürlükleri de o kadar daralmaktadır. Birey özgürlükleriyle  birlikte  örgütlenme  özgürlüğü  de  devletin  baskısı  altında ezilmeye mahkum olacaktır.44 Sivil toplumda gönüllülüğün esas olduğunu vurgulayan Tocqueville e göre  hemen  her  konuda  örgütlenmek  mümkün  olduğundan  dolayı  ülke ekonomisinin gelişmesinde dahi sivil toplumun payı büyüktür.45 1.  DEMOKRASİ İÇİN SİVİL TOPLUMUN ÖNEMİ Tocqueville;  kitabı  Amerika da  Demokraside  Amerika  Birleşik Devletleri nin aristokrasi gibi totaliter veya otoriter bir rejim yerine demokrasiyi benimsediğini ve bunu da sivil toplumun desteğiyle sürdürmeye çalıştığını belirtir. Bu gelişimi de oraya yerleşen göçmenlerin durumundan yola çıkarak açıklamaya çalışır. Amerika bilindiği üzere keşfedilmesinin ardından güçlü Avrupa ülkelerinin sömürgesi olarak tarih sahnesinde görülmeye başlamıştır. Yeni Dünya diye de adlandırılan bu kıtaya gelen göçmenler çeşitli sebeplerden ötürü ülkelerinden ayrılmak zorunda kalmışlardır. Fakirliğin yanı sıra başka bir takım sıkıntılar içinde olan insanlar yerleşmeye başladıkları bu toprakları benzer sebeplerle vatanlarından sürülmüş diğer insanlarla paylaşmışlardır. Bu şekilde başlayan yerleşim süreci sırasında kimsenin  birbirlerine karşı herhangi bir üstünlük kurma çabası olmamıştır. O dönemde Avrupa da uygulanan mülkiyete dayalı aristokrasi kabul edilemez olarak görülmüş ve bu nedenle de reddedilmiştir. Bu düşüncenin gelişmesinde  rol  oynayan  etkenlerden  biri  insanların  eşit  olduğunun benimsenmesi iken, diğer etken aristokrasinin gücünü topraktan alan bir rejim olmasıyla ilişkilidir. Şöyle ki; göçlerle gelen insanların başlattığı tarım faaliyetlerine kadar işlenmemiş olan Amerika topraklarından alınabilecek verimin düşük olması diğer bir deyişle, toprağın sadece bakıcısına yetecek kadar gelir getirmesi toprak üzerinden hem mülk sahibinin hem çalışanın geçimini sağlamasını imkansız hale getirmektedir.46 Aristokrasinin yönetim biçimi olarak benimsendiği bir ülkede, ülkenin her türlü işiyle ilgilenenler tahmin edilebileceği gibi aristokrat yani zengin, imtiyazlı olan kesimdir. Bu durumda sıradan vatandaş için ülke yönetimine 44  TAMER, s. 101 45  TOCQUEVILLE, s. 172-174 46  TOCQUEVILLE,  s, 33 Gazi Üniversitesi Hukuk Fakültesi Dergisi C. XIX, Y. 2015, Sa. 3 329Alexis De Tocqueville e Göre Sivil Toplum ilgi gösterme gereği ortadan kalkmış olur. Ancak demokraside durum farklıdır. Demokratik bir ülkede imtiyazlı kesim diye bir şey olmadığından herkes eşit derecede güçsüzdür. İşte bu noktada insanlar ancak bir araya gelerek güçlü olmayı başarabilmektedirler.47 Demokrasinin  bir  gereği  olan  çoğunluğun  egemenliği,  önemli  bir tehlikeyi doğurabilir. Tocqueville e göre çoğunluğun egemenliği en mantıklı yol gibi görünse de bazen çoğunluğun istek ve eylemleri azınlıkta kalan kesime zarar verir hale gelebilir. Tocqueville bu durumu demokrasinin despotizme dönüşmesi başka bir deyişle çoğunluğun despotizmi olarak ifade etmiştir. Yasaların çoğunluğun seçtiği kimselerce çıkarılıp yine çoğunluğun seçtiği kimselerce uygulandığı bir ülkede azınlığın bütün bunlara boyun eğmekten başka çaresi kalmayacaktır.48 Demokrasinin despotizme dönüşmesine yol açabilecek diğer faktör ise modernleşen toplumla ilgilidir. Modern toplum giderek bireylerin yalnızlaşıp içine kapandığı bir yöne doğru ilerlemektedir. Bu durumun toplum geleceği açısından  tehlikelerine  işaret  eden  Tocqueville  bireyin  yalnızlaşmasını bireyselleşme olarak ifade etmektedir. Bireyselleşme genel itibariyle özgür irade ve de kişinin kendi kararlarını kendi başına almasını ifade ederken, Tocqueville bu kavramı bireyin sosyal, siyasal konulara karşı ilgisizleşmesi ve de çoğunluğun aldığı kararlara uyum sağlamakla yetinmesi şeklinde olumsuz bir kavram olarak ifade etmektedir. Çoğunluğun aldığı kararlar her zaman doğru olmayabileceği gibi, hiçbir tepki bulunmadığı için keyfi uygulamalara da yol açabilecektir.49 Tocqueville e göre bu yeni despotizm daha önce benzeri görülmediği için  sonuçlarının  anlaşılması  veya  ortaya  çıkarılması  oldukça  güçtür.50 Tocqueville nin bahsettiği türden bir despotizm, günümüz demokrasisinde çoğunluk  iktidarının  da  sınırlarının  olması  ve  azınlık  kesimin  katkıda bulunacağı hususların bulunduğu gerekçesiyle eleştirilmektedir.51 Demokrasinin  karşılaşabileceği  bir  diğer  tehlike  de  anarşizmdir. Tocqueville demokrasinin tanıdığı özgürlük alanının daha da genişletilmeye 47 TOCQUEVILLE,  s, 173 48  GÖZE, Ayferi, Siyasal Düşünceler ve Yönetimler, Beta Basım A.Ş., 9. Bası,  İstanbul-2000, s. 252,253 49  YETİŞ, s. 14 50  KEANE, Despotizm ve Demokrasi, s. 75 51  SCHMİDT, s.  89 330 Gazi Üniversitesi Hukuk Fakültesi Dergisi C. XIX, Y. 2015, Sa. 3Murat TUMAY / Firdevs OKATAN çalışılması sonucu karşılaşılabilecek bu durumun, insanlardaki denge ve düzen duygusu sayesinde sorun olmaktan çıkacağını belirtmiştir.52 Tocqueville demokrasinin zayıf taraﬂ arına karşı korunmak adına sosyal yapı için olmazsa olmaz diyebileceğimiz ara yapılardan bahsetmektedir.53 Bu da bizi sivil toplum olgusuna götürmektedir. 2.  BİREYİ DEVLETE KARŞI KORUYAN SİVİL TOPLUM Devletin sahip olduğu gücün kontrolünün sağlanması adına geliştirilmiş yöntemler  vardır.  Bunları  kısaca  anayasal  devlet,  düzenli  seçimler  ve kuvvetlerin ayrılığı olarak ifade edebiliriz. Tocqueville e göre sivil toplum diğer bir önemli faktörü oluşturur. Ona göre sivil toplum devleti  toplumsal ve siyasal açıdan sınırlandıran ve denetim altında tutan en etkili yöntemdir.54 Keane e göre sivil toplumu yok olmanın eşiğine getirecek olan tek partinin egemenliğinin benimsendiği yönetim şeklidir. Ona göre 1980 lerin Batı Avrupa sında devlet ve özel şirketler tarafından tehdit edilen ve hareketleri kısıtlanan sivil toplum her şeye rağmen güçlenmeye devam etmektedir.55 Tocqueville A.B.D. de gördüğü sivil toplum kuruluşu yoğunluğundan övgüyle söz eder. Ona göre bu durum halkın kültürünün bir yansımasıdır.56 Amerikalı  aileler  çocuklarını  yetiştirirken  onlara  zorluklar  karşısında mücadeleci olmayı ve karşılarına çıkan bir sorunla baş edemedikleri takdirde yardım istemeleri gerektiğini öğretirler.57 Bu örnekten örgütlenmenin önemini kavramış bir toplumun, bunu yeni nesillere de aktarma gayreti içerisinde olduğunu anlayabiliriz. Dernek kurma özgürlüğü ile basın özgürlüğü arasında yakın bir ilişki vardır.  Toplumun  sorunlar  karşısında  çözüm  üretebilmesi,  devlete  karşı düşündüklerini özgürce ifade edebilmesi ve tartışabilmesi basın organları yoluyla gerçekleşebilecektir.58 Tocqueville e göre bir düşünceyi ifade etmek ve yaymak üzere bir araya gelen insanların oluşturduğu örgüt basından bile güçlü bir etki yaratacaktır.59 52  GÖZE, s. 252 53  GÖZE, s. 255 54  YETİŞ, s. 18 55  KEANE, Giriş,  s. 14 56  DİNÇKOL,  Çoğunluk Tiranisine Karşı Bir Çözüm Yolu: Tocqueville nin Syasal Kuramı, İstanbul Ticaret Üniversitesi Dergisi, C. 3, S. 5,2004,s. 150 57  TOCQUEVILLE, s. 83 58  GÖZE,  s. 256 59  TOCQUEVILLE, s. 84 Gazi Üniversitesi Hukuk Fakültesi Dergisi C. XIX, Y. 2015, Sa. 3 331Alexis De Tocqueville e Göre Sivil Toplum 3.  DEVLET, SİYASİ TOPLUM VE SİVİL TOPLUM Tocqueville, sivil toplumu ilk kez ayrı bir örgütlenme alanı olarak ifade etmiştir.60 Bireylerin tek başlarına büyük işleri başarabilmesinin demokratik rejimlerde pek mümkün olmadığından bahseden düşünür, böyle bir ülkede örgütlenmenin  öneminin  de  yeterince  kavranamamış  olmasıyla  birlikte ilkelliğe dönüşün yaşanabileceğine işaret etmektedir.61 Tocqueville in Amerika da Demokrasi kitabında sivil toplum, siyasi toplum ve devlet şeklinde üçlü bir ayrım ortaya koyduğunu görürüz. Yani devletin dışında siyaset ile uğraşan bir toplumdan söz eder. Ona göre siyaset ile ilgilenmek sadece devletin tekelinde olmamalıdır. Sivil toplumu da siyasi toplumu şekillendiren bir unsur olarak kabul etmektedir.62 Tocqueville,  siyasi  örgütlerin  devlete  ve  ülkeye  faydalarından bahsederken örgütlenme hakkının konu yönünden sınırlandırılmasının fayda yerine zarar getireceğini savunmuştur. Kitabında sivil toplum kelimesine yer vermese de bu kavram için halkın kurduğu örgütler veya dernekler ifadelerini kullanmıştır. Ona göre, sivil toplum siyasi toplumun oluşmasının yolunu açarken siyasi toplum da sivil toplumun güçlenmesini sağlayacaktır.63 4.  SİVİL TOPLUMDAKİ GÖNÜLLÜLÜK ESASI Tocqueville, Amerika da insanların inandıkları bir fikir için destek aradıklarından ve bu amaçla bir araya geldiklerinden bahseder. Bir araya gelmekle  birlikte  bireylerin  güçlendiğini  ve  fikirlerin  dinlenebilir  hale geldiğini  ifade  eden Tocqueville;  gönüllülük  esasının  bu  hususta  önemli olduğunu vurgulamaktadır.64 Amerikalıların toplumun refahı için büyük özveride bulunduklarını ifade eden Tocqueville insanların sahip oldukları özgür kurumlar ve sık sık kullandıkları politik haklar sayesinde yurttaş ve toplumun bir parçası olduklarını hatırladıklarını belirtir. Sahip olunan bu güçlü haklar da insanları birbirlerine yakınlaştırmaktadır. Çünkü birbirlerine karşı herhangi bir üstünlük veya  ayrıcalığı  olmayan  insanlar  daha  kolay  iletişim  kurup  daha  kolay 60  TAMER,  s. 100 61  TOCQUEVILLE,  s. 173 62  GÖNENÇ, Ayşenur Akpınar, Sivil Toplum Düşünsel Temelleri ve Türkiye  Perspektifi,  http://www.altkitap.net/sivil-toplum/, s. 34, 10.04.2013, 13:00 63  TOCQUEVILLE,  s. 177-178 64  TOCQUEVILLE,  s. 174 332 Gazi Üniversitesi Hukuk Fakültesi Dergisi C. XIX, Y. 2015, Sa. 3Murat TUMAY / Firdevs OKATAN uzlaşabileceklerdir.65 Bu durumun da; gönüllülük esasının önemli olduğu sivil toplumda, örgütlenmenin önündeki engellerin kaldırılmasının ve hatta teşvik edilmesinin bir görünümü olduğunu kabul edebiliriz. 5.  SİVİL  TOPLUMUN  EKONOMİK  ETKİNLİKLERDEKİ FONKSİYONU Tocqueville Amerika daki derneklerdeki konu çeşitliliğine dikkat çeker ve hemen her konuda halkın örgütlenebildiğinden bahseder. Güvenlik, ahlaki, dini vb. meselelerin yanında ticaret ve endüstriyi geliştirmek gibi konular da dernek kurmaya vesile olabilir.66 Devletin toplumun her türlü ihtiyacını karşılamak amacıyla artırdığı görev ve hizmetleri; kendi güç ve otoritesini de artırırken, tüm ihtiyaçları önüne hazır olarak sunulan birey ise örgütlenmeye daha az gereksinim duyacaktır. Merkezileşen devletin özel sektörün alanına müdahale etmek suretiyle kendi otoritesini  güçlendirmesinin  sakıncalarına  değinen Tocqueville,  böyle  bir durumda güçsüzleşen toplumun yaratıcılığının da zamanla yok olacağını savunmaktadır. Ticaret, üretim gibi alanların özel girişime bırakılmasının halkın  zekasının  güçlenmesine  katkıda  bulunacağına  değinen  düşünür, böylelikle devlete olan bağımlılığın da azalacağına işaret etmektedir.67 5.  BASININ SİVİL TOPLUM ÜZERİNDEKİ  ETKİSİ Tocqueville,  sivil  toplum  kuruluşlarının  gazeteler  tarafından desteklenmesinin,  toplumdaki  işbirliğinin  sağlanabilmesi  adına  en  kolay ve alışılagelmiş yöntem olduğunu savunur. 1800 lü yıllarda internetten söz edilemeyeceği için özellikle gazetelerin önemine değinen düşünür, gazetelerin farklı fikirleri içeren çeşitlerinin olmasının ve uzak bölgelere iletilebilmeleriyle birlikte; iletişimin geniş alanlar arasında sağlanması gibi özelliklerinin önemine vurgu yapar. Aynı sivil toplum kuruluşuna üye olan insanların, iletişim halinde olabilmek için aynı çevrede yaşamaları zorunluluğunu ortadan kaldıran da işte bu gazetelerin varlığıdır.  Ona göre gazete tüm bu özellikleri sayesinde uygarlığın sürekliliğini sağlayacak yegane araçtır.68 Tocqueville  demokratik  rejimlerde  bireylerin  güçsüzlüğüne  vurgu yaparken bireylerin bir araya gelmesinin oldukça zor olduğunu ifade eder. 65  TOCQUEVILLE,  s. 171-172 66   TOCQUEVILLE, s. 84 67  TOCQUEVİLLE, s. 174 68  TOCQUEVİLLE, s. 175 Gazi Üniversitesi Hukuk Fakültesi Dergisi C. XIX, Y. 2015, Sa. 3 333Alexis De Tocqueville e Göre Sivil Toplum Güçsüz  bireylerin  durumunu  karanlık  içinde  birbirini  arayan  insanlara benzeten Tocqueville gazeteleri ise onları bir araya getiren ve bir arada kalmalarını destekleyen unsur olarak görür. Ne var ki, basının insanları yanlış hedeﬂ ere yönlendirebilmesinin de mümkün olduğunu savunan  Tocqueville, yine de sivil topluma sağlayacağı faydalarının zararlardan üstün geleceğine inanmaktadır. Nasıl ki sivil toplum demokrasiyi güçlendiren ve destekleyen bir faktör ise, gazeteler de sivil toplumun en büyük destekçisidir.69 Günümüzde basın, çok daha çeşitli platformlarda karşımıza çıkmaktadır. Fakat bu çeşitlilik içinde sivil toplumu güçlendirici ve destekleyici basının yanı  sıra,  amacından  ayrılarak  insanları  belirli  alanlara  yönlendirmeye çalışan basın kuruluşları ile karşılaşmak da mümkündür. Özellikle ideolojik düşünceler taşıyan kesimler veya devlet tarafından maddi ve manevi bakımdan desteklenen bir basın- yayın kuruluşunun; tarafsızlığını koruyabilmesi pek mümkün gözükmemektedir.70 6.  ANAYASAL DEMOKRASİ VE SİVİL TOPLUM Anayasal demokrasi kavramı çok basit bir biçimde Anayasal şekilde örgütlenmiş  demokratik  devlet  şeklinde  formüle  edilebilir.  Bu  tanım çerçevesinde anayasal demokrasi kavramını açıklayabilmek için öncelikle anayasal devlet ve demokratik devlet kavramları üzerinde durmak gerekir. Her anayasası olan devle anayasal devlet demek değildir. Siyasi iktidar büyük bir güç potansiyelini ifade eder. Dolayısıyla, siyasi iktidara sahip  olanların  her  zaman  siyasi  iktidarı  bu  iktidara  sahip  olmayanlar aleyhine kullanma ihtimali vardır. İşte anayasal bir devlette anayasa, bireyleri siyasi iktidara karşı koruyan kurumsal bir kalkan işlevi görür. Bu tespitten yola  çıkarak  anayasal  devlet;  siyasi  iktidarın,  bireyi  korumak  amacıyla, anayasacılık  prensiplerine  uygun  olarak  kullanılması  esasına  dayanan devlet olarak tanımlanabilir. Demokratik devlet kavramı anayasal devlet te siyasi iktidarın nasıl kullanılacağı sorusuna cevap arar. Bir anayasal devlette siyasi iktidar anayasacılık prensiplerine uygun olarak kullanılır. Demokratik devlet ise, daha çok; Siyasi iktidar kimin tarafından kullanılır? Siyasi iktidar hangi kurallara göre el değiştirir? sorularıyla ilgilidir. Tarih boyunca bu sorulara farklı cevaplar verilmiş ve bu cevaplar çerçevesinde farklı rejim biçimleri  ortaya  çıkmıştır.  Demokrasi  adını  verdiğimiz  rejimlerde  siyasi iktidar halk adına, halk tarafından seçilen ve halka hesap veren yöneticiler 69  TOCQUEVILLE, s. 176 70  DİLİPAK, Abdurrahman, Sivil Toplum, Yeni  Türkiye, S. 18, 1997, s. 66 334 Gazi Üniversitesi Hukuk Fakültesi Dergisi C. XIX, Y. 2015, Sa. 3Murat TUMAY / Firdevs OKATAN tarafından kullanılır. Bir başka ifadeyle, demokratik bir devlette, siyasi iktidarı kullanacak olanlar seçimler yoluyla belirlenir ve siyasi iktidar gerektiğinde yine  seçimler  yoluyla  barışçı  bir  biçimde  el  değiştirir.  Bu  tespitten  de anlaşılacağı gibi, demokratik devlet açısından seçim ve ona bağlı kavramlar, örneğin siyasi partiler önem kazanır. Bu bağlamda iktidarın demokratik olarak elde edilmesi ve el değiştirmesi sivil toplumun anayasal garanti ile örgütlenme ve ifade hürriyetine sahip olmasına ve güçlü olmasına bağlıdır. Kısaca modern bir sivil toplumun kurumsallaşması temel sivil ve siyasal hakların garanti edilmesi şartına bağlı olacaktır. Bu haklar ise öte yandan ancak özgürlükçü bir anayasacılık ile mümkündür.71 SONUÇ Sivil toplum kavramı günümüzdeki anlamı ve içeriğini alana dek çeşitli aşamalardan geçmiştir. İlk zamanlarda devlet sivil toplumla iç içe ve bir bütün olarak anılırken Ortaçağ dan itibaren kapitalizmin yükselişiyle birlikte artık çatışma hali ortaya çıkmıştır. Sivil toplum özel bireyler tarafından oluşturulan, devletten bağımsız, gönüllülük esasının benimsendiği ve belirli fikirlerin savunulmasına fırsat tanıyan platformlardır. Sivil toplumun en önemli fonksiyonu demokrasinin işleyişini desteklemektir. Günümüzdeki anlamıyla sivil toplum demokrasinin vazgeçilmez bir parçasıdır diyebiliriz. Halkın kendi kendisini yönettiği rejim olan demokrasinin halktan kopmadan sürdürülebilmesi yine halkın desteğiyle mümkün olabilecektir. Sivil  toplum  ortak  sivil  menfaatlerin  savunulmasını  ve  devletin baskısının azaltılmasını sağlayan bir mekanizmadır. Devletle toplum arasında bir köprü vazifesi görerek isteklerin veya fikirlerin meşru yollardan devlete iletilmesini sağlamakla görevlidir. Alexis De Tocqueville; sivil toplumun önemini günümüzden yaklaşık iki yüz yıl önce vurgularken anayasal demokrasi rejimi var olduğu müddetçe sivil toplumun da var olacağını savunmuştur. Amerika ya  giderek  ülkesi  Fransa da  yeni  yeni  kendini  gösteren demokrasinin  ihtiyaçlarını,  zaaﬂ arını  ve  güçlü  yanlarını  araştıran Alexis De  Tocqueville,  Fransa da  demokrasinin  Amerika daki  kadar  doğru uygulanamamasını  Fransa da  eksik  olan  kontrol  mekanizmasına  bağlar. 71 Arato, Andrew, Civil  Society, Constitution and Legitimacy, (Rowmand & Littlefield Publisher, 2000, New York, London), s.10 Gazi Üniversitesi Hukuk Fakültesi Dergisi C. XIX, Y. 2015, Sa. 3 335Alexis De Tocqueville e Göre Sivil Toplum Bu mekanizma ise bireylerin bir araya gelerek oluşturdukları sivil toplum kuruluşlarıdır. Tocqueville Amerika da gördüğü olumlu hallerin bir çoğunu orada gelişmiş olan sivil toplum yapısına bağlamaktadır. Amerika da benimsenen demokratik  rejimin  ortaya  çıkış  nedenlerini  araştıran  Tocqueville;  oraya yerleşen  insanların  eşitliği  esas  alarak,  mülkiyete  dayalı  aristokrasiyi reddettiklerini ortaya koymuştur. Eşit ve güçsüz olan bu bireyler, hemen her konuda bir sivil toplum kuruluşunun oluşturulmasına gayret göstermişlerdir. Bu durumu da her bir bireyin, ülkenin devamlılığı ve istikrarı için kendisini sorumlu olarak hissetmesine bağlayan Tocqueville; ülke sorunlarına duyarlı olan yurttaşların çok büyük yararlıklar sağlayabileceğini ifade etmiştir. Tocqueville demokrasi, eşitlik, özgürlük gibi kavramlarla yakından ilgilenmesinin yanı sıra sivil toplum kavramının da günümüzdeki anlamına ulaşmasının önünü açan pek çok yenilikler ortaya atmıştır. Bunlardan en önemlisi; sivil toplumun demokrasinin güçlenmesi adına sağladığı destektir. Devletin  sınırlarını  aşmak  suretiyle  topluma  olan  baskısının  artmasını engellemek de yine sivil toplumun görevleri arasındadır. Sivil toplumun devletten veya siyasi toplumdan ayrı bir yerde olduğunu savunan Tocqueville, sivil toplumda gönüllülüğün esas olduğunun altını çizmiştir. Günümüzde de öneminin iyi bilindiği basının, sivil toplum üzerindeki etkisinden bahseden düşünür  gazeteleri  uygarlığın  sürekliliğini  sağlayacak  en  önemli  araç olarak görmüştür. Aradan  geçen  yıllara  rağmen  sivil  toplumun  hak  ettiği  noktada bulunmadığını söylemek mümkündür. Belki de devletin toplum için var olması gerektiği tam olarak idrak edilemediğinden, sivil toplum devlet tarafından bir tehlike olarak algılanmaktadır. Oysa sivil toplum tarafından desteklenen bir demokrasi, devleti ve ülkeyi ileriye taşıyacak en önemli etkendir. 336 Gazi Üniversitesi Hukuk Fakültesi Dergisi C. XIX, Y. 2015, Sa. 3Murat TUMAY / Firdevs OKATAN BİBLİYOGRAFYA AKTAN, Coşkun Can, Sivil Toplum İçin İdeal Devlet, Yeni Türkiye, S. 18, 1997, s. 188-191. ARATO,  Andrew,  Civil  Society,  Constitution  and  Legitimacy, (Rowmand & Littlefield Publisher, 2000, New York, London), ATAR, Yavuz, Demokratik Sistemde Sivil Toplumun Fonksiyonu ve Sivil Toplum- Devlet Düalizmi, Yeni  Türkiye, S. 18, 1997, s. 98- 101. BELGE, Murat,  Sivil Toplum Nedir?, http://stk.bilgi.edu.tr/docs/belge_std_1.pdf , İstanbul Bilgi Üniversitesi Sivil Toplum Kuruluşları Eğitim ve  Araştırma  Birimi, 10.04.2013, 13:00 BOLAY, S. Hayri, Sivil Toplum ve Manası, Yeni  Türkiye, S. 18, 1997, s. 7-8 BUMİN, Kürşat, Sivil Toplum ve Devlet, Yazarlar ve Çevirmenler Yayın Üretim Kooperatifi, İstanbul, 1981  ÇAHA, Ömer, Sivil Toplum Üstüne, Sivil Toplum ve Demokrasi, Kaknüs Yayınları, İstanbul, 2005, s. 9-22 DİLİPAK, Abdurrahman, Sivil Toplum, Yeni  Türkiye, S. 18, 1997, s. 65-67. DİNÇKOL, Bihterin, Çoğunluk Tiranisine Karşı Bir Çözüm Yolu: Tocqueville nin  Siyasal Kuramı, İstanbul Ticaret Üniversitesi Dergisi, C. 3, S. 5,2004 DOĞAN, İlyas, Sivil Toplum Anlayışı ve Siyasal Sistemler, Barış Platin Kitabevi, 2. Baskı, 2009 ERASLAN, Levent, Sivil Toplum ve Eğitim (ESTK), Maya Akademi Yayınevi, Ekim 2011, Ankara ERDİNÇ, Tahsin,  Alexis De Tocqueville ve ABD de Sivil Toplumun Temelleri, Yeni Türkiye, S.18, 1997 ERDOĞAN,  Mustafa,  Anayasal  Demokrasi,  Siyasal  Kitabevi,  9. baskı, Eylül, 2012 GENÇKAYA, Ömer Faruk, Demokratikleşme ve Sivil Toplum İlişkisi Üzerine Bir Not, Yeni  Türkiye, S. 18, 1997, s. 102-105 Gazi Üniversitesi Hukuk Fakültesi Dergisi C. XIX, Y. 2015, Sa. 3 337Alexis De Tocqueville e Göre Sivil Toplum GÖNENÇ, Ayşenur Akpınar, Sivil Toplum Düşünsel Temelleri ve Türkiye  Perspektifi,  http://www.altkitap.net/sivil-toplum/ , 10.04.2013, 13:00 GÖZE, Ayferi, Siyasal Düşünceler ve Yönetimler, Beta Basım A.Ş., 9. Bası,  İstanbul-2000 HOCAOĞLU, Durmuş, Sivillik ve Demokrasi, Yeni Türkiye, S. 18, 1997, s. 106-112 İNAÇ, Hüsamettin- ERDOĞAN, Selami, Farklı Kuramsal Perspektiﬂ er Çerçevesinde Sivil Toplum Tartışmalarının Karşılıklı Analizi, Akademik Bakış Uluslararası Hakemli Sosyal Bilimler E- Dergisi, S. 11, Ocak-2007 KEANE, John, Despotizm ve Demokrasi, Sivil Toplum ve Devlet, Avrupa da Yeni Yaklaşımlar, Der: John Keane, Çev: Levent Köker, Ayrıntı Yayınevi, Aralık 1993 KEANE, John, Giriş, Sivil Toplum ve Devlet, Avrupa da Yeni Yaklaşımlar, Ayrıntı Yayınları, Der: John Keane, Çev: Levent Köker, Aralık 1993 ONBAŞI, Funda, Sivil Toplum, L&M Yayınları, İstanbul, Ekim 2015 SAVRAN,  Gülnur,  Sivil  Toplumun  Eleştirisi,  Yapıt  Toplumsal Araştırmalar Dergisi, S: 5 Haziran- Temmuz 1984, s: 31-49 SAVRAN, Gülnur Acar, Sivil Toplum ve Ötesi, Rousseau, Hegel, Marx, Dipnot Yayınları, Ankara 2013 SCHMİDT, Manfred G., Demokrasi Kuramlarına Giriş, Çev. M. Emin Köktaş, Vadi Yayınları, 1. Basım, Ekim-2001 SELÇUK,  Sami,  Zorba  Devletten  Hukukun  Üstünlüğüne,  Yeni Türkiye Yayınları, 1998 TAMER, Mine Gözübüyük, Tarihsel Süreçte Sivil Toplum, Edebiyat Fakültesi Dergisi, C. 27, S. 1, Haziran-2010, s. 89-105 TOCQUEVILLE, Alexis  De,  Amerika da  Demokrasi,  Çev.  İhsan Sezal- Fatoş Dilber, Yetkin Yayınları, 1994 YAYLA, Atilla, Siyasi Düşünceler Sözlüğü, Adres Yayınları, 2. Baskı, Ekim-2004 YERASİMOS,  Stefanos,  Sivil  Toplum,  Avrupa  ve  Türkiye, 338 Gazi Üniversitesi Hukuk Fakültesi Dergisi C. XIX, Y. 2015, Sa. 3Murat TUMAY / Firdevs OKATAN Türkiye de Sivil  Toplum ve Milliyetçilik, İletişim Yayınları, 1. Baskı, İstanbul-2001 YETİŞ, Mehmet, Tocqueville, Demokratik Devrim ve Sivil Toplum, Ankara  Üniversitesi  Siyasal  Bilgiler  Fakültesi  Gelişme  ve  Toplum Araştırmaları  Merkezi Tartışma Metinleri, No.87, Ekim-2005 YILDIRIM,  İbrahim,  Demokrasi,  Sivil  Toplum  Kuruluşları  ve Yönetişim, Seçkin Yayıncılık, Ankara, Ocak-2004 YILDIRIM,  Murat,  Sivil  Toplum  ve  Devlet,  Cumhuriyet Üniversitesi Sosyal Bilimler Dergisi, C: 27, No: 2, Aralık 2003, s. 226-242 YILMAZ,  Aytekin,  Sivil  Toplum  Demokrasi  ve  Türkiye,  Yeni  Türkiye, S. 18, 1997, s. 86-97 YILMAZ,  Murat,  Sivil  Toplumun  Kısa  Tarihi  ve  Aktüel  Bazı Meseleleri Yeni Türkiye, S. 18, 1997 Gazi Üniversitesi Hukuk Fakültesi Dergisi C. XIX, Y. 2015, Sa. 3 339",
     "Kaynakça": "AKTAN, Coşkun Can, “Sivil Toplum İçin İdeal Devlet”, Yeni Türkiye, S. 18, 1997, s. 188-191. ARATO,  Andrew,  Civil  Society,  Constitution  and  Legitimacy, (Rowmand & Littlefield Publisher, 2000, New York, London), ATAR, Yavuz, “Demokratik Sistemde Sivil Toplumun Fonksiyonu ve Sivil Toplum- Devlet Düalizmi”, Yeni  Türkiye, S. 18, 1997, s. 98- 101. BELGE, Murat, Sivil Toplum Nedir?”, http://stk.bilgi.edu.tr/docs/belge_std_1.pdf , İstanbul Bilgi Üniversitesi Sivil Toplum Kuruluşları Eğitim ve  Araştırma  Birimi, 10.04.2013, 13:00 BOLAY, S. Hayri, “Sivil Toplum ve Manası”, Yeni  Türkiye, S. 18, 1997, s. 7-8 BUMİN, Kürşat, Sivil Toplum ve Devlet, Yazarlar ve Çevirmenler Yayın Üretim Kooperatifi, İstanbul, 1981  ÇAHA, Ömer, “Sivil Toplum Üstüne”, Sivil Toplum ve Demokrasi, Kaknüs Yayınları, İstanbul, 2005, s. 9-22 DİLİPAK, Abdurrahman, “Sivil Toplum”, Yeni  Türkiye, S. 18, 1997, s. 65-67. DİNÇKOL, Bihterin, “Çoğunluk Tiranisine Karşı Bir Çözüm Yolu: Tocqueville nin  Siyasal Kuramı”, İstanbul Ticaret Üniversitesi Dergisi, C. 3, S. 5,2004 DOĞAN, İlyas, Sivil Toplum Anlayışı ve Siyasal Sistemler, Barış Platin Kitabevi, 2. Baskı, 2009 ERASLAN, Levent, Sivil Toplum ve Eğitim (ESTK), Maya Akademi Yayınevi, Ekim 2011, Ankara ERDİNÇ, Tahsin, Alexis De Tocqueville ve ABD de Sivil Toplumun Temelleri”, Yeni Türkiye, S.18, 1997 ERDOĞAN,  Mustafa,  Anayasal  Demokrasi,  Siyasal  Kitabevi,  9. baskı, Eylül, 2012 GENÇKAYA, Ömer Faruk, “Demokratikleşme ve Sivil Toplum İlişkisi Üzerine Bir Not”, Yeni  Türkiye, S. 18, 1997, s. 102-105 Gazi Üniversitesi Hukuk Fakültesi Dergisi C. XIX, Y. 2015, Sa. 3 337Alexis De Tocqueville e Göre Sivil Toplum GÖNENÇ, Ayşenur Akpınar, “Sivil Toplum Düşünsel Temelleri ve Türkiye  Perspektifi”,  http://www.altkitap.net/sivil-toplum/ , 10.04.2013, 13:00 GÖZE, Ayferi, Siyasal Düşünceler ve Yönetimler, Beta Basım A.Ş., 9. Bası,  İstanbul-2000 HOCAOĞLU, Durmuş, “Sivillik ve Demokrasi”, Yeni Türkiye, S. 18, 1997, s. 106-112 İNAÇ, Hüsamettin- ERDOĞAN, Selami, “Farklı Kuramsal Perspektiﬂ er Çerçevesinde Sivil Toplum Tartışmalarının Karşılıklı Analizi”, Akademik Bakış Uluslararası Hakemli Sosyal Bilimler E- Dergisi, S. 11, Ocak-2007 KEANE, John, “Despotizm ve Demokrasi”, Sivil Toplum ve Devlet, Avrupa da Yeni Yaklaşımlar, Der: John Keane, Çev: Levent Köker, Ayrıntı Yayınevi, Aralık 1993 KEANE, John, “Giriş”, Sivil Toplum ve Devlet, Avrupa da Yeni Yaklaşımlar, Ayrıntı Yayınları, Der: John Keane, Çev: Levent Köker, Aralık 1993 ONBAŞI, Funda, Sivil Toplum, L&M Yayınları, İstanbul, Ekim 2015 SAVRAN,  Gülnur,  “Sivil  Toplumun  Eleştirisi”,  Yapıt  Toplumsal Araştırmalar Dergisi, S: 5 Haziran- Temmuz 1984, s: 31-49 SAVRAN, Gülnur Acar, Sivil Toplum ve Ötesi, Rousseau, Hegel, Marx, Dipnot Yayınları, Ankara 2013 SCHMİDT, Manfred G., Demokrasi Kuramlarına Giriş, Çev. M. Emin Köktaş, Vadi Yayınları, 1. Basım, Ekim-2001 SELÇUK,  Sami,  Zorba  Devletten  Hukukun  Üstünlüğüne,  Yeni Türkiye Yayınları, 1998 TAMER, Mine Gözübüyük, “Tarihsel Süreçte Sivil Toplum”, Edebiyat Fakültesi Dergisi, C. 27, S. 1, Haziran-2010, s. 89-105 TOCQUEVILLE, Alexis  De,  Amerika da  Demokrasi,  Çev.  İhsan Sezal- Fatoş Dilber, Yetkin Yayınları, 1994 YAYLA, Atilla, Siyasi Düşünceler Sözlüğü, Adres Yayınları, 2. Baskı, Ekim-2004 YERASİMOS,  Stefanos,  “Sivil  Toplum,  Avrupa  ve  Türkiye”, 338 Gazi Üniversitesi Hukuk Fakültesi Dergisi C. XIX, Y. 2015, Sa. 3Murat TUMAY / Firdevs OKATAN Türkiye de Sivil  Toplum ve Milliyetçilik, İletişim Yayınları, 1. Baskı, İstanbul-2001 YETİŞ, Mehmet, “Tocqueville, Demokratik Devrim ve Sivil Toplum”, Ankara  Üniversitesi  Siyasal  Bilgiler  Fakültesi  Gelişme  ve  Toplum Araştırmaları  Merkezi Tartışma Metinleri, No.87, Ekim-2005 YILDIRIM,  İbrahim,  Demokrasi,  Sivil  Toplum  Kuruluşları  ve Yönetişim, Seçkin Yayıncılık, Ankara, Ocak-2004 YILDIRIM,  Murat,  “Sivil  Toplum  ve  Devlet”,  Cumhuriyet Üniversitesi Sosyal Bilimler Dergisi, C: 27, No: 2, Aralık 2003, s. 226-242 YILMAZ,  Aytekin,  “Sivil  Toplum  Demokrasi  ve  Türkiye”,  Yeni  Türkiye, S. 18, 1997, s. 86-97 YILMAZ,  Murat,  “Sivil  Toplumun  Kısa  Tarihi  ve  Aktüel  Bazı MeseleleriYeni Türkiye, S. 18, 1997 Gazi Üniversitesi Hukuk Fakültesi Dergisi C. XIX, Y. 2015, Sa. 3 339"
}