{
     "Tip": "Makale",
     "Dergi İsmi": "Gazi Üniversitesi Hukuk Fakültesi Dergisi",
     "Üniversite İsmi": "",
     "Gün": "",
     "Ay": "",
     "Yıl": "2015",
     "Cilt": "19",
     "Sayı": "3",
     "Başlık": "YABANCI UNSURLU BOŞANMA DAVALARINDA HUKUKSEÇİMİ",
     "Title": "CHOICE OF LAW IN INTERNATIONAL DIVORCE CASES",
     "Yazar İsmi": [
          "Aslı Bayata CANYAŞ"
     ],
     "Danışman İsmi": "",
     "Anahtar Kelimeler": [
          "Boşanma",
          "hukuk seçimi",
          "irade muhtariyeti",
          "uluslararası aile hukuku",
          "kamu düzeni."
     ],
     "Keywords": [
          "Divorce",
          "choice of law",
          "party autonomy",
          "international family law",
          "public policy."
     ],
     "Özet": "Yabancı unsurlu boşanma davalarında uygulanacak hukukun tespiti konusunda geleneksel  olarak,  Common  law  ülkelerinde  lex  fori nin  uygulanması  anlayışı hâkimken; Kıta Avrupası hukuk sisteminde genellikle tâbiiyet bağlama noktasından hareket edildiği görülmektedir. Günümüz itibariyle ise boşanma hukuku alanında hem maddî hukuk alanında hem kanunlar ihtilâfı hukuku alanında daha liberal bir  yaklaşımın  yeşermeye  başladığı  gözlemlenmektedir.  Maddî  hukuk  alanında, yasak  olan  boşanmanın  mümkün  hale  getirilmesi,  boşanmanın  koşullarının esnekleştirilmesi,  anlaşmalı  boşanma”  gibi  boşanma  yanlısı  (favor  divortii) anlayışlara yer verilmektedir. Kanunlar ihtilâfı hukukunda ise, eşlere, boşanma davasına uygulanacak hukuku seçme imkânının tanınabildiği görülmektedir.  Bu şekilde, taraﬂ arın kendilerini daha yakın hissettikleri hukukun uygulanabilmesi ve hukukî kesinlik ile öngörülebilirlik amaçlanmaktadır. Bu çalışmada, çeşitli hukuk düzenleri çerçevesinde konu incelendikten sonra, Türk mahkemeleri önünde, yabancı unsurlu boşanma davalarında taraﬂ arın hukuk seçme imkânlarının ihtimal dahilinde olup olmadığı tartışılmaktadır.",
     "Abstract": "While  determining  the  applicable  law  in  international  divorce  cases, traditionally, application of lex fori is the main principle in Common law countries whereas nationality comes into prominence in Continental law system as a connecting factor. As of today, it might be possible to observe that a more liberal approach is emerging in the area of divorce law both in terms of substantive law and in the conﬂ ict of laws. In substantive law, favor divortii approaches such as enabling divorce which has been previously forbidden, facilitating the conditions of divorce, making divorce possible by mutual agreement are encountered gradually more. From the conﬂ ict of laws perspective, the spouses are granted the right to choose the applicable law to divorce. By this way, application of the law that the parties are most familiar with and legal certainty and predictability are aimed. In this study, after analyzing the subject from the perspectives of different laws, the possibility of choice of law in divorce cases heard before the Turkish courts is to be questioned. Keywords : Divorce, choice of law, party autonomy, international family law, public policy.     Yrd. Doç. Dr., Bilkent Üniversitesi Hukuk Fakültesi Uluslararası Özel Hukuk ABD. Öğreti Üyesi bayata@bilkent.edu.tr Gazi Üniversitesi Hukuk Fakültesi Dergisi C. XIX, Y. 2015, Sa. 3 3Yabancı Unsurlu Boşanma Davalarında Hukuk Seçimi Giriş Ülke  sınırları  arasındaki  hareketlilik  arttıkça,  bu  hareket  hukukun her alanında olduğu gibi aile hukuku alanında da etkisini göstermekte ve uluslararası aile hukuku giderek daha büyük önem kazanmaktadır. Örneğin, Avrupa daki evliliklerin yaklaşık yüzde on beşinin farklı vatandaşlığa sahip kişiler  arasında  gerçekleştiği  görülmektedir1.  Bu  evliliklerin  yürümediği durumlarda ise yabancı unsurlu boşanma davaları gündeme gelmekte ve boşanmayla birlikte çocukların velayeti, evlilik mallarının bölüşümü, nafaka gibi pek çok sorun ortaya çıkmaktadır2. Bu sorunlardan biri de, boşanma davasının maddî anlamda çözüme ulaştırılabilmesi  için  öncelikle  hangi  devlet  hukukunun  uygulanacağının belirlenmesidir. Bu bağlamda, geleneksel anlamda, Common law ülkeleri ile  Kıta Avrupası  hukuk  sistemine  dahil  ülkelerde  birbirinden  farklı  iki yaklaşımın söz konusu olduğunu söylemek mümkündür3. Yabancı unsurlu boşanma davalarında, Common law ülkelerinde, lex fori nin uygulanması anlayışının hâkim olduğu görülmektedir4. Kıta Avrupası hukukunda ise daha ziyade Mancini5 etkisiyle tâbiiyet bağlama noktasından hareket edilerek uygulanacak hukuk tespit edilmektedir.  Lex fori nin uygulanması yoluyla, zaman ve emek anlamında pratiklik sağlanmak istenirken; tâbiiyet ise kişisel statüyü ilgilendiren boşanma gibi durumlarda en sıkı ilişkili bağlama noktası olarak görüldüğü için tercih edilebilmektedir6. Bu çerçevede, Kıta Avrupası hukuk sistemi anlayışı içinde yetişmiş bir hukukçu için, yabancı unsurlu boşanma davasında lex fori nin uygulanacak 1  Ayrıntılı bilgi için bkz. DETHLOFF, Nina, Arguments for the Uniﬁ cation and Harmonisation of Family Law in Europe, Perspectives for the Uniﬁ cation and Harmonisation in Europe (Ed. Katharina Boele- Woelki), Intersentia, Antwerp-Oxford-New York, 2003, s. 37. 2  Örneğin, Avrupa Birliğinde her yıl ortalama 170.000 yabancı unsurlu boşanma davasının açıldığı belirtilmektedir: Konu hakkında bkz. FIORINI, Aude, Rome III-Choice of Law in Divorce: Is the Europeanization of Family Law Going Too Far?, International Journal of Law, Policy and the Family, 22, 2008, s. 178. 3  Konu hakkında ayrıntılı bilgi için bkz. GAERTNER,Veronika, European Choice of Law Rules in Divorce (Rome III): An Examination of the Possible Connecting Factors in Divorce Matters Against the Background of Private International Law Developments, Journal of Private International Law, 2006, C. 2, N. 1, s. 104 vd. 4  GAERTNER, s. 104. 5  Mancini doktrini hak. bkz. ÇELİKEL, Aysel/ ERDEM, Bahadır, Milletlerarası Özel Hukuk, 13.B., Beta, İstanbul, 2014, s. 54; NOMER, Ergin, Devletler Hususî Hukuku, 21.B., Beta, İstanbul, 2015, s. 55-56. 6  Konu hakkında bkz. GAERTNER, s. 104. 4 Gazi Üniversitesi Hukuk Fakültesi Dergisi C. XIX, Y. 2015, Sa. 3Aslı Bayata CANYAŞ olması  şaşırtıcı  bulunabilir7.  Hatta,  lex  fori nin  uygulanması,  kanunlar ihtilâfı  hukukunu  tehdit  eden  bir  anlayış  olarak  dahi  görülebilir8.  Zira, kişisel statüyü ilgilendiren böyle bir durumda, taraﬂ ar, kendilerini en yakın hissettikleri hukukun uygulanması beklentisi içinde olabilirler9. Bu noktada, hâkimin  hukukunun  uygulanması,  taraf  beklentisini  karşılamayabileceği için taraf menfaatlerine aykırı olabilecektir. Diğer yandan, Common law anlayışı içinde ise, tâbiiyet bağlama noktasından hareket edilmesi sonucunda hâkimin hukukundan çok farklı nitelikteki bir hukukun uygulanması olasılığı kabul edilemez bulunabilir10. Ayrıca, bu yaklaşım çerçevesinde lex fori nin uygulanması, yabancı hukukun araştırılmasını gerektirmediğinden hem zaman hem masraf kaybını önleyici bir formül olarak görülebilmektedir11. Yabancı unsurlu boşanma davalarında uygulanacak hukukun bu şekilde objektif tespitinin yanı sıra, irade muhtariyetine etki tanıyan düzenlemelerin varlığı  da  gündeme  gelebilmektedir.  Çalışmada,  boşanma  hukukundaki liberalleşme  akımına  değinildikten  sonra,  aile  hukukuna  ilişkin  olarak hukuk seçimi konusundaki esnek ve katı yaklaşımlar üzerinde durulacaktır. Ardından, yabancı unsurlu boşanma davalarında hukuk seçimi imkânı, bazı hukuk düzenleri ile sınırlı olarak ele alınacaktır. Son olarak, Türk hukukunda boşanmaya uygulanacak hukuk değerlendirildikten sonra, yabancı unsurlu boşanma davalarında taraﬂ arca yapılan hukuk seçiminin etkisi tartışılmakta ve  bu  çerçevede,  kamu  düzenine  aykırılığın  ortaya  çıkıp  çıkmayacağı  değerlendirilmektedir. I. Boşanma Hukukunda Liberalleşme Boşanma hukuku alanında giderek daha esnek ve liberal bir anlayışın yerleşmekte olduğu ileri sürülmektedir12. Örneğin, boşanmanın mahkeme 7  GAERTNER, s. 106. 8  D. Evrigenis, Tendances doctrineales actuelles en droit international privé (1966-II) 118 Recueil des Cours, 313 den aktaran GAERTNER, s. 106. 9  A. Vonken, Balancing Processes in International Family Law-On the Determination and Weighing of Interests in the Conﬂ ict of Laws and the ‘Openness  of the Choice of Law System, Forty Years On: The Evolution of Postwar Private International Law in Europe (Ed. T de Boer), Deventer, Kluwer, 1990, s. 178 den aktaran GAERTNER, s. 114. 10 Değerlendirmeler için bkz. MORRIS, J., Conﬂ ict of Laws, London, Sweet&Maxwell, 5. B., London, 2000, s. 23 vd. 11 Konu hak. bilgi için bkz. GAERTNER, s. 112; PFEIFFER, Magdalena, Choice of Law in International Family and Succession Law, The Lawyer Quarterly, 4/2012, s. 301. 12 Konu hak. bkz. GAERTNER, s. 112.  Boşanmanın yasak olduğu hukukların sayısının giderek azalmakta olduğuna ve boşanma konusunda maddî hukuk düzenlemelerine ilişkin karşılaştırmalı hukuk değerlendirmesine yönelik olarak bkz. UYANIK ÇAVUŞOĞLU, Ayfer, Türk Gazi Üniversitesi Hukuk Fakültesi Dergisi C. XIX, Y. 2015, Sa. 3 5Yabancı Unsurlu Boşanma Davalarında Hukuk Seçimi huzurunda gerçekleşen bir işlem olmasının yanı sıra, arabulucular13 nezdinde de  çözüme  kavuşturulmaya  başlanan  bir  konu  olarak  görülebilmesi  bu liberalleşmeye bir işaret olarak algılanmaktadır. Ayrıca, idarî makamlarca verilen kararlar yoluyla evliliğin sonlandırılabilmesi14 ya da çiftlerin anlaşma yoluyla boşanabilmeleri de bu esnek anlayışı yansıtır şekilde yorumlanmaktadır. Diğer  yandan,  boşanma  konusundaki  yasağın  kaldırılarak  mümkün  hale geldiği Malta15 gibi örnekler de boşanma konusundaki liberalleşme eğilimini destekler şekilde yorumlanmaktadır. Boşanma konusunda, maddî hukuktaki anlayış ile kanunlar ihtilâfı hukuku arasındaki etkileşimin yoğun olduğu ve iç hukukta, boşanmaya ilişkin esnek  bir  yaklaşımın  benimsendiği  (favor  divortii)  hukuk  düzenlerinde, kanunlar ihtilâfı hukuku alanında da bu esnekliğin yansımasının hissedildiği belirtilmektedir16. Buna karşın, maddî hukukta evliliği olabildiğince ayakta tutmak yanlısı bir anlayış hâkimse (favor matrimonii), bu anlayışın yabancı unsurlu boşanma davalarında da etkisini hissettirdiği belirtilerek boşanmaya hükmedilmesinin zorlaşabildiği ifade olunmaktadır17.  Boşanma  hukukundaki  liberalleşmenin  kanunlar  ihtilâfı  hukuku alanındaki en somut görünümü, taraﬂ arın, boşanmaya uygulanacak hukuku seçme  imkânına  kavuşturulması  şeklinde  ortaya  çıkmaktadır.  Örneğin, Avrupa Birliğinde, aile hukukuna ilişkin kanunlar ihtilâfı hukuku alanında irade  muhtariyetinin,  giderek  temel  ilke  haline  gelmekte  olduğu  ileri sürülmektedir18. Hatta, Avrupa Birliğinde aile hukukuna ilişkin konularda Milletlerarası Özel Hukukunda Boşanma, Beta, İstanbul, 2006, s. 21-25. 13 WESTCOTT, John (Ed.), Family Mediation: Past, Present and Future, Jordan Publishing, Bristol, 2004, s. 5 vd.  14 Konu hakkında ayrıca  bkz. EKŞİ, Nuray, Milletlerarası Özel Hukukta Medeni Olmayan Evliliklerin ve Adli Olmayan Boşanmaların Tanınması, Seçkin, İstanbul, 2012, s. 39 vd. 15 1 Ekim 2011 tarihinde yürürlüğe giren Medenî Kanun değişikliği için bkz.  Civil Code (Amendment) Act, 2011, Government Gazette of Malta No. 18. 784, 29.07.201: www.doi. gov.mt (Erişim tarihi 29.06.2015) Malta hukuku uyarınca her ne kadar boşanma mümkün hale gelmişse de boşanmanın gerçekleşmesi için eşlerin dört yıldır ayrı yaşıyor olması ve tekrar bir araya gelme ihtimâllerinin olmadığına mahkeme tarafından hükmedilmesi gibi koşullar aranabilmektedir. 16 BAARSMA, Nynke, The Europeanisation of International Family Law, T.M.C. Asser Press, Springer, Groningen, 2011, s. 146-147. 17 BAARSMA, The Europeanisation, s. 146-147.  18 YETANO, Toni Marzal, The Constitutionalisation of Party Autonomy in European Family Law, Journal of Private International Law, C. 6.N.1, s. 156. ; NAGY, Csongor Istvan, What Functions May Party Autonomy Have in International Family and Succession Law? An EU Perspective, Nederlands Internationaal Privaatrecht, 4, 2012, s. 576. 6 Gazi Üniversitesi Hukuk Fakültesi Dergisi C. XIX, Y. 2015, Sa. 3Aslı Bayata CANYAŞ irade muhtariyetini öne çıkarmanın, Birlik nezdindeki bütünleşmeye katkıda bulunacağı savunulmaktadır19. Bu çerçevede, aile hukuku alanında Common law ülkelerindeki yabancı hukuku hiç uygulamamak yönündeki hâkim anlayış ile Kıta Avrupası ülkelerinde öne çıkan ve eşlerin tâbiiyeti gibi bağlama noktalarından hareket eden ve sonuç olarak yabancı hukukun uygulanmasını mümkün kılan anlayışı uzlaştırmak amacıyla, irade muhtariyetinin ön plana çıkartılması üzerinde durulmaktadır20. Avrupa Birliği Adalet Divanı ve Avrupa İnsan  Hakları  Mahkemesi  içtihatlarında  açıkça  irade  muhtariyetinden bahsedilmese  de,  menşe  ülke  ilkesi  gereğince  (country-of-origin principle), bireylerin, aile hukuku ile ilgili uyuşmazlıklarında hangi hukukun uygulanacağını kararlaştırma hakkına sahip olduklarından söz edilmektedir21. II. Hukuk Seçimi Kanunlar ihtilâfı hukukundaki irade muhtariyeti kavramının geleneksel olarak,  hukukî  güvenlik  fikri  ile  bağlantılı  olduğu  ileri  sürülmektedir22. Taraﬂ ara  hukuk  seçimi  imkânı  tanınmakla,  aralarındaki  kanunlar  ihtilâfı meselesinin pratik ve doğrudan etkili bir şekilde çözüme ulaşabildiği; bu şekilde taraf beklentisinin ve adaletin hızlı teşekkülünün sağlandığı iddia edilmektedir23. Kanunlar ihtilâfı hukukunda taraﬂ arca hukuk seçimi olanağına genel olarak,  sözleşmeden  doğan  borç  ilişkileri  ile  haksız  fiil  alanlarında  etki tanınmış olduğunu söylemek mümkündür24. Taraﬂ ar, irade muhtariyeti ilkesi gereği, örneğin, aralarındaki sözleşmeden doğan uyuşmazlığa uygulanacak hukuku  seçebilmekte;  bu  şekilde  öngörülebilirliği  sağlayabilmektedir. Böylelikle, taraﬂ ar hak ve borçlarının hangi devlet hukuku uyarınca ve nasıl şekillendirileceğini bilmekte; bir uyuşmazlığın gündeme gelmesi olasılığında seçmiş oldukları hukukun, bu uyuşmazlığa ilişkin olarak ne tür sonuçlar doğuracağını öngörebilmektedir. Bu da belirlilik, kesinlik ve hukukî güvenliği beraberinde getirmektedir.  19 JAYME, Erik, Party Autonomy in International Family and Succession Law: New Tendencies, Yearbook of Private International Law, C. 11, 2009, s. 3. 20 JAYME, s. 3. 21 Konu hakkında bkz. YETANO, s. 157. 22 FRANZINA, Pietro , The Law Applicable to Divorce and Legal Separation Under Regulation (EU) No. 1259/2010 of 20 December 2010, Cuadernos de Derecho Transnacional (Octubre 2011), C.3, N.2, 2011, s. 109.  23 FRANZINA, s. 109. İrade muhtariyetinin günümüzde kazandığı öneme ilişkin olarak NOMER, s. 313. 24 Konu hak. bkz. JAYME, s. 1. Gazi Üniversitesi Hukuk Fakültesi Dergisi C. XIX, Y. 2015, Sa. 3 7Yabancı Unsurlu Boşanma Davalarında Hukuk Seçimi Genel olarak sözleşmeler hukuku alanında öne çıkan irade muhtariyeti ilkesinin, hukukun her alanında aynı genişlik ve esneklikle yorumlandığını  söylemek mümkün gözükmemektedir. Özellikle, aile hukuku alanında hukuk seçimi ya son derece sınırlı olarak gündeme gelmekte ya da bu konuda, irade muhtariyetinin önü tamamen kesilerek, uygulanacak hukuk, forum un bağlama kuralları uyarınca objektif olarak tayin edilmektedir. Bu yaklaşım, aile hukukunun kimi devlet anayasalarında da koruma altına alınan kurumsal bir yapısının olması ve bu nedenle bireysel düzeyde anlaşmalar yoluyla düzenlenmeye uygun olmaması gibi gerekçelerle desteklenmektedir25. Ayrıca, örneğin çocuklar gibi zayıf taraﬂ arın korunması düşüncesiyle de konunun, bireysel düzeydeki anlaşmalara açık olamayacağı üzerinde durulmaktadır26. Aşağıda ele alınacağı üzere, aile hukuku alanında hukuk seçiminin mümkün kılındığı hallerde dahi, sınırlandırıcı bir anlayış öne çıkabilmektedir. Örneğin, salt hâkimin hukuku, eşlerin müşterek millî hukuku ya da müşterek mutad  mesken  hukukundan  birinin  seçilebileceği  şeklinde  düzenlemelere yer  verilebilmektedir.  Bir  diğer  kısıtlama  ise,  konu  bazında  gündeme gelebilmektedir. Bu çerçevede, hukuk seçimi imkânı, malvarlığına ilişkin konularla sınırlı kalmak kaydıyla tanınabilmektedir. Dolayısıyla, boşanma, çocukların velayeti, evliliğin genel hüküm ve sonuçları gibi konularda hukuk seçimine yer verilmemektedir. Aile hukuku alanında hukuk seçimi konusunda çekimser ve sınırlı bir bakış açısı çizilmiş olmasının gerekçesini, Savigny etkisi ile açıklayan bir görüşe27 göre,  aile hukuku konusunda  sadece hukukî bir perspektif yeterli olmamakta; toplumsal ve etik boyutları da içeren karma bir yapı öne çıkmaktadır28. Bu durumda, aile hukuku söz konusu olduğunda konu ile bağlantılı devletlerin emredici nitelikteki kuralları da devreye girmekte ve irade muhtariyeti sınırlı hale gelmektedir. Aile hukuku alanında irade muhtariyetinin sınırlılığına ilişkin bu katı yaklaşıma karşıt düşecek şekilde, konu hakkında irade muhtariyetini egemen kılmanın çeşitli avantajları üzerinde durulmaktadır. Örneğin, aile hukukundan 25 Konu hak. bkz. JAYME, s. 2 26 Bkz. JAYME, s. 2. 27 PEARI, Sagi, Choice of Law in Family Law: Kant, Savigny and the Parties Autonomy Principle, Nederlands Internationaal Privaatrecht, 4, 2012, s. 604. 28 Evliliğin  varlığı  ve  sona  ermesi  konusunda  devletin  de  maddî  anlamda  menfaatinin söz konusu olduğu ile ilgili olarak bkz. WILLS, Mary M., Conﬂ icts of Law in Divorce Litigation: A Looking-Glass World?, Campbell Law Review, V. 10/1, 1987, s. 149. 8 Gazi Üniversitesi Hukuk Fakültesi Dergisi C. XIX, Y. 2015, Sa. 3Aslı Bayata CANYAŞ doğan uyuşmazlıklar açısından yeknesak bir kanunlar ihtilâfı anlayışının yokluğu karşısında, irade muhtariyetinin, yeknesaklığı sağlayıcı bir çözüm olabileceği  ileri  sürülmektedir29.  Bu  çerçevede,  hukuk  seçimi  yoluyla, taraﬂ ara hukukî kesinlik ve öngörülebilirlik imkânı sunulacağı ve aile hukuku gibi kişisel statüyle doğrudan ya da çok yakın ilgili bir konuda, taraﬂ arın kendilerini en yakın hissettikleri hukukun uygulanmasının mümkün kılınacağı da belirtilmektedir30. Ayrıca, taraﬂ arın, hukuk seçimi yoluyla kendi davalarının ve durumlarının ihtiyaçlarına en tatmin edici şekilde yanıt verebilecek hukuka ulaşabilecekleri  üzerinde  durulmaktadır31.  Örneğin,  taraﬂ arın  seçtikleri  hukukun avantaj ve  dezavantajlarını irdelemiş olacaklarından menfaatlerini en iyi şekilde tatmin eden hukukun uygulanmasını sağlayabilecekleri ileri sürülmektedir32. Ek olarak, irade muhtariyeti yoluyla, taraﬂ arın, boşanmanın en hızlı ve ucuz şekilde gerçekleşmesini sağlayabilecek hukuka yönelmelerinin de  mümkün  olabileceği  ifade  edilmektedir33.  Son  olarak, Avrupa  Birliği gibi iç göç oranlarının yüksek olduğu yapılanmalarda, taraﬂ arın kültürel kimliklerinin korunması yönündeki isteklerinin çok güçlü olabildiğinden yola çıkılmaktadır. Dolayısıyla, örneğin, hâkimin hukukun değil de hukuk seçimi yoluyla, müşterek millî hukukun uygulanabilmesinin taraﬂ arın istek ve beklentileri ile uyum içinde olacağı üzerinde durulmaktadır34. III. Çeşitli Hukuk Düzenlerinde Yabancı Unsurlu Boşanma Davalarında Hukuk  Seçimi Konusundaki Yaklaşımlar Yabancı unsurlu boşanma davalarında, kimi hukuk düzenlerinde eşlere, uygulanacak hukuku seçme imkânının tanındığı; kimi hukuk düzenlerinde ise uygulanacak hukukun salt objektif olarak tespit edildiği ve bu konuda eşlerin iradesine etki tanınmadığı görülmektedir. Hukuk seçiminin mümkün olduğu düzenlemelerin bazılarında ise,  sınırlı bir hukuk seçimi imkânı kabul edilmekte ve bu noktada eşlerin müşterek millî hukukunun veya, müşterek mutad mesken hukukunun uygulanacak hukuk olarak seçilmesine imkân tanınmaktadır. 29 PFEIFFER, s. 303. 30 PFEIFFER, s. 303; FRANZINA, s. 110. 31 NAGY, s. 579. 32 VIARENGO, Ilaria, The Role of Party Autonomy In Cross-Border Divorces, Nederlands Internationaal Privaatrecht, 4, 2012, s.  557. 33 VIARENGO, s. 557. 34 VIARENGO, s. 557. Gazi Üniversitesi Hukuk Fakültesi Dergisi C. XIX, Y. 2015, Sa. 3 9Yabancı Unsurlu Boşanma Davalarında Hukuk Seçimi Bu  çerçevede,  aşağıda,  hem  Kıta Avrupası  hukuku  hem  Common law açısından, boşanma davalarında hukuk seçimi ile ilgili genel yaklaşımı ortaya  koyabilmek  amacıyla  kimi  Avrupa  devletlerinin,  İngiltere nin, Amerika  Birleşik  Devletleri nin  ve  Çin in  konuya  ilişkin  düzenlemeleri değerlendirilmiştir. A. Avrupa Birliği Hukuku Avrupa  Birliği  bünyesinde,  boşanma  konusunda  üye  ülke  hukuk düzenlemelerinde  ciddî  farklılıkların  olması,  konu  hakkında  ortak  bir hukukî düzenlemenin varlığını gerektirmiştir35. Bu amaçla, 20 Aralık 2010 tarihli Boşanma ve Ayrılığa Uygulanacak Hukuk Alanında Güçlendirilmiş İşbirliğinin Uygulanmasına İlişkin Konsey Tüzüğü36 yürürlüğe sokulmuştur. Tüzük, Avrupa Birliği nde yabancı unsurlu boşanma ve ayrılığa uygulanacak hukuk konusunda yeknesak37 bir düzenleme öngörmektedir.38.  Tüzüğün 1. maddesinin 1. paragrafında, Tüzüğün kanunlar ihtilâfı içeren durumlarda boşanma ve ayrılık bakımından uygulanacağı düzenlemesine yer verilmiştir. Tüzük, sadece katılan devletler bakımından doğrudan uygulanacak; Birleşik Krallık, İrlanda ve Danimarka da ise uygulama alanı bulmayacaktır39. Avrupa Birliği bünyesinde, boşanmanın kolaylaşmasına yönelik bir anlayışın (favor divortii) yerleşmeye başladığı yönündeki iddia40 kapsamında, Tüzüğün temel prensiplerinden biri olarak favor divortii anlayışına yer verildiği 35 MCELEAVY, Peter, The Communitarization of Divorce Rules: What Impact for English and Scottish Law?, International and Comparative Law Quarterly, 53, 2004, s. 642. 36 Council Regulation (EU) No 1259/2010 of 20 December 2010 Implementing Enhanced Cooperation in the Area of the Law Applicable to Divorce and Legal Separation, O.J. L 343/10, 29.12.2010. Bundan sonra Tüzük ya da Roma 3 Tüzüğü olarak ifade olunacaktır. 37 Avrupa Birliği bünyesindeki yeknesaklaştırmanın tarihçesi ile ilgili olarak bkz. KALKAN OĞUZTÜRK, Burcu, A General Perspective to the History and the Harmonisation Idea of Family Law in Europe, Annales de la Faculté de Droit d Istanbul, C. 41, S. 58, 2009, s. 181 vd. 38 Konu hakkında bkz. PFEIFFER, s. 297; BAYRAKTAROĞLU ÖZÇELİK, Gülüm, Roma III Tüzüğü Uyarınca Boşanma ve Ayrılığa Uygulanacak Hukukun Tayini ve Uygulanması, Ankara Üniversitesi Hukuk Fakültesi Dergisi, 61(2) 2012, s. 505 vd.; FIORINI, s. 178 vd. 39 Tüzüğe katılan devletler, Belçika, Bulgaristan, Almanya, İspanya, Fransa, İtalya, Letonya, Lüksemburg, Macaristan, Malta, Avusturya, Portekiz, Romanya, Slovenya dır. Litvanya da 2012/714/EU kararı ile 22.05.2014 tarihinden itibaren geçerli olmak üzere katılmıştır: www. ec.europa.eu/justice_home/judicialatlascivil/html/di_information_en.html  (Erişim  Tarihi: 15.06.2015). 40 DE VIDO, Sara, The Relevance of Double Nationality to Conﬂ ict of Laws Issues Relating to Divorce and Legal Separation in Europe, Cuadernos de Derecho Transnacional, C.4, N.1, 2012, s. 224. 10 Gazi Üniversitesi Hukuk Fakültesi Dergisi C. XIX, Y. 2015, Sa. 3Aslı Bayata CANYAŞ belirtilmekte  ve  eşlerin  boşanma  hakkının  varlığının  altı  çizilmektedir41. Bu  çıkarıma,  özellikle  Tüzüğün  10.  maddesindeki  düzenleme  dayanak gösterilmektedir. Nitekim, Tüzüğün  10. maddesi uyarınca, Tüzüğün 5. ya da 8. maddesi uyarınca uygulanacak olan hukukun, boşanmaya yer vermediği ya da boşanma hakkı konusunda eşler arasında cinsiyete dayalı ayrım öngördüğü durumlarda, forum hukukunun uygulanması hükme bağlanmıştır. Bu şekilde, boşanmanın forum hukukuna dayalı olarak elde edilebilmesi ve eşler arasında ayrım yapılmaksızın gerçekleştirilebilmesi amaçlanmıştır. Tüzüğün 5. maddesinde ise taraﬂ ara sınırlı da olsa hukuk seçimi imkânı tanınmıştır. Buna göre, taraﬂ ar, hukuk seçimi anlaşmasının yapıldığı sırada müşterek mutad meskenlerinin bulunduğu yer hukukunu; anlaşma yapıldığı sırada eşlerden birinin halen orada yerleşik olması koşuluyla son müşterek mutad  meskenlerinin  bulunduğu  yer  hukukunu,  anlaşmanın  yapıldığı sırada eşlerden birinin millî hukukunu ve son olarak da  hâkimin hukukunu seçebilirler. Tüzüğün sunmuş olduğu esneklik42 sonucunda taraﬂ arca seçilen hukuk, Tüzüğe katılan üye bir devletin hukuku olmasa dahi uygulanacaktır43. Taraﬂ ara seçebilecekleri hukuk bakımından sınırlama getirilmiş olmasının sebebinin ise taraﬂ arla çok az ilgili ya da tamamen ilgisiz bir hukukun uygulanmasının önüne geçmek olduğu belirtilmektedir44. Taraﬂ ara hukuk seçme  imkânı  getirmenin,  özellikle  mutad  meskenin  objektif  tespitine yönelik  zorlukları  yenmede  anlamlı  olabileceği  üzerinde  durulmaktadır 45.  Şeklî açıdan ise yazılı olarak yapılması şart koşulan  hukuk seçimi anlaşmasının, taraﬂ arca imzalanması noktası belirtilmiş ve anlaşma metninde tarihe de yer verilmesi gerektiği düzenlenmiştir (Tüzük m. 7/1) 46.   Taraﬂ arın 41 FRANZINA, s. 99. 42 Tüzüğün Dibacesinin 12. paragrafında ve Tüzüğün 4. maddesinde  yer alan bu esnekliğe bağlı olarak, uygulanacak hukuk, ister taraﬂ arca belirlenmiş ister objektif olarak tayin edilmiş olsun,  Tüzüğe katılmamış, üye bir devlet hukuku olsa dahi uygulanacaktır. Ayrıca AB üyesi olmayan üçüncü bir devlet hukuku da uygulanacak hukuk olabilecektir: MARINA, Simone, Matrimonial Matters and the Harmonization of Conﬂ ict of Laws: A Way to Reduce the Role of Public Policy As A Ground For Non-Recognition of Judgments, Yearbook of Private International Law (Ed. BONOMI, Andrea/ ROMANO, Gian Paolo),  C. 13, 2011, s. 262. 43 VIARENGO, s. 557. 44 BAARSMA, Nynke, Communitarisation of Choice of Law Rules on Divorce and Termination of Registered Partnerships, s. 5. www.rug.nl/research/gradschool-law/phd/paper-nynke-baarsma.pdf,  (Erişim Tarihi: 18.06.2015); Ayrıca bkz. UYANIK ÇAVUŞOĞLU, Ayfer, Avrupa Birliği nde Aile Hukukunu Birleştirme Çalışmaları, Ata Sakmar a Armağan, Galatasaray Üniversitesi Hukuk Fakültesi Dergisi, 2011/1, s. 240. 45 VIARENGO, s.  556. 46 KRVAVAC, Marija/ BELOVIC, Jelena, Communitarisation of Private International Law Gazi Üniversitesi Hukuk Fakültesi Dergisi C. XIX, Y. 2015, Sa. 3 11Yabancı Unsurlu Boşanma Davalarında Hukuk Seçimi seçmiş oldukları hukukun, boşanmaya yer vermemesi ya da boşanma hakkı konusunda eşler arasında cinsiyete dayalı eşitsizlik öngördüğü durumlarda ise seçilmiş olan hukuk uygulanmayacaktır. Bunun yerine Tüzüğün 10. maddesi uyarınca hâkimin hukuku uygulanacaktır. Bu şekilde, boşanma konusunda daha liberal ve esnek bir anlayış benimsemiş olan hâkimin hukukun uygulanması söz konusu olabilecektir47. Taraﬂ arın  hukuk  seçimi  yapmamaları  durumunda  ise  uygulanacak hukuk, objektif olarak tayin edilecektir. Objektif bağlama kuralı48 kapsamında, basamaklı bir yapı kabul edilmiş ve son olasılık olarak hâkimin hukukunun uygulanacağı belirtilmiştir. Tüzüğe katılmamış olan üye ülkelerde örneğin, Hollanda da kendi bağlama kuralları uygulanmaya devam edecektir49.  Bu çerçevede, Hollanda Medenî  Kanununun50  Kanunlar  İhtilâfı  Hukuku  başlıklı  10.  Kitabının 10:56 maddesinin ilk fıkrası kapsamında, hukuk seçimi olasılığının gündeme gelmediği  durumlarda,  boşanmaya  Hollanda  hukukunun  uygulanacağı düzenlenmiştir.  Lex  fori nin  bu  şekilde  uygulanması  ile,  boşanmaya olabildiğince  kolay  bir  şekilde  hükmedilmesi  amaçlanmaktadır51.  Anılan maddenin ikinci fıkrasında ise taraﬂ ara hukuk seçimi imkânı getirilmiştir. Buna göre, taraﬂ arın ortak iradeleri yoluyla ya da bir tarafın iradesine diğerinin Rules on Party Autonomy in European Union, International Journal of Business, Humanities and Technology, C. 4, N.3, 2014, s. 67. 47 TORGA, Maarja, Party Autonomy of the Spouses Under the Rome III Regulation in Estonia-Can Private International Law Change Substantive Law?, Nederlands Internationaal Privaatrecht, 4, 2012, s. 548. 48 Roma 3 Tüzüğünün 8. maddesi uyarınca, taraﬂ arın hukuk seçimi yapmadıkları durumlarda boşanma ve ayrılığa uygulanacak hukuk, a. davanın açıldığı tarihte eşlerin müşterek mutad meskeninin bulunduğu yer hukuku, bulunmaması durumunda, b.  davanın açıldığı tarihten geriye doğru bir yıldan daha uzun bir süre önce değiştirilmemiş olmak ve eşlerden birinin dava açıldığı tarihte hâlen söz konusu devlette yerleşik olması koşuluyla eşlerin son müşterek mutad meskenlerinin bulunduğu yer hukuku, bulunmaması durumunda, c. davanın açıldığı sırada eşlerin müşterek millî hukuku, onun da bulunmaması durumunda, d. davanın açıldığı devlet hukuku olacaktır. 49 VIARENGO, s. 561. 50 Burgerlijk Wetboek, Act of 19.5.2011 Adopting and Implementing Book 10 (Private International Law) of the Dutch Civil Code için bkz. SYMEONIDES, Symeon C., Codifying Choice of Law Around the World- An International Comparative Analysis, Oxford University Press, New York, 2014, s. 368. 51 BOELE-WOELKI, K./ VAN ITERSON, D., The Dutch Private International Law Codiﬁ cation: Principles, Objectives and Opportunities, Electronic Journal of Comparative Law, C. 14/3, 2010, s. 20; Ayrıca bkz. SYMEONIDES, s. 321. 12 Gazi Üniversitesi Hukuk Fakültesi Dergisi C. XIX, Y. 2015, Sa. 3Aslı Bayata CANYAŞ itiraz etmemesi üzerine, taraﬂ arın müşterek millî hukuku uygulanabilecektir52. Taraﬂ ara sınırlı da olsa hukuk seçimi olanağı sağlamakla, esas itibariyle, yabancı boşanma kararını tanımak için millî hukukun uygulanmış olmasını şart  koşan  hukuk  düzenleri  ile  ters  düşmemek  ve  Hollanda  mahkemesi kararının yabancı ülkede tanınmasını sağlamak amaçlanmaktadır53. B. İngiliz Hukuku ve Amerika Birleşik Devletleri Hukuku İngiliz  hukukunda  boşanma  davalarında,  lex  fori nin  münhasıran uygulandığı görülmektedir54. Boşanma davasında lex fori nin uygulanması ile yargılamanın kısa sürede tamamlanması ve iç karar uyumunun sağlanması amaçlanmaktadır55. Bu anlayış çerçevesinde hâkimin, en çok kendi hukuku hakkında bilgi sahibi olacağı gerçeğinden hareket edilmektedir56. Dolayısıyla, irade muhtariyetine yer verilmediği görülmektedir. Amerika  Birleşik  Devletleri  hukukunda  ise,  boşanma  davaları açısından  uygulanacak  hukuktan  ziyade,  yetki  ve  tanıma-tenfiz  konuları üzerinde yoğunlaşılmış olduğu görülmektedir57. Boşanma davalarında yetki, kişi  hallerine  ilişkin  çoğu  davanın  aksine,  davalının  forum  ile  ilişkisine dayandırılmamıştır58. Yetkiye ilişkin olarak evlilik esas alınarak taraﬂ arın evli olarak sahip olmuş oldukları oturma yerinin ya da taraﬂ ardan herhangi birinin oturma yerinin mahkemenin bulunduğu eyalette yer alması, yetkiyi tesis etmek için yeterli görülmüştür59. Uygulanacak hukuk konusunda ise çok fazla tartışmaya yer verilmediği görülmektedir ve boşanma davalarında çoğunlukla, lex fori nin uygulanması yoluna gidilmektedir60. Bu  uygulamanın tarihsel açıdan gerekçesi, bireylerin evlilik  ya  da  boşanmada  menfaatlerinin  güçlü  olması  ve  mahkemelerin, 52 Müşterek millî hukukunun ait olduğu devlet ile her iki tarafın da sıkı sosyal bağ içinde olması durumunda da tek tarafın seçimi ile bu hukuk uygulanabilecektir: Hollanda Medenî Kanunu m. 10: 56/2/b. 53 BOELE WOELKI/ VAN ITERSON, s. 20. 54 Konu hak. Bkz. BAARSMA, Europeanisation, s. 151. 55 Konu hak. bkz. FRANZINA, s. 94. 56 FRANZINA, s. 94. 57 SILBERMAN, Linda J.: Rethinkig Rules of Conﬂ ict of Laws in Marriage and Divorce in the United States: What Can We Learn From Europe?, Tulane Law Review, C. 82, 20072008, s. 2008.  58 SILBERMAN, s. 2008. 59 SILBERMAN, s. 2008. 60    SYMEONIDES, s. 269; SILBERMAN, s. 2008; WILLS, s. 151. Gazi Üniversitesi Hukuk Fakültesi Dergisi C. XIX, Y. 2015, Sa. 3 13Yabancı Unsurlu Boşanma Davalarında Hukuk Seçimi bu  menfaati  korumak  gerekçesiyle  kendi  hukuk  kurallarını  uygulamak istemeleridir61.  Günümüz  itibariyle  ise,  bir  kişinin  oturma  yerinin  onun medenî hali üzerinde önemli bir etkiye sahip olmasından yola çıkılarak, oturma yeri esas alınarak tespit edilecek yetkili  mahkemenin kendi hukukunu uygulamasının yerinde olacağı gerekçesine dayanılmaktadır62. Doktrinde ise, mahkemelerin boşanma davalarında hukuk seçimine etki tanımada oldukça çekimser kalacağı tahmin edilmekte ve bu tahmine, devletin de evlilik ilişkisi içinde rolünün ve menfaatinin olması gerekçe olarak gösterilmektedir.63 Amerikan hukukunda boşanma davalarında hukuk seçimi konusuna sıcak bakılmayacağı ifade olunsa bile, uygulamada, Roma III Tüzüğünün taraﬂ ara bahşettiği düzeydeki irade muhtariyetinin dolaylı olarak gündeme gelebileceği  üzerinde  durulmaktadır64.  Bunu  sağlayacak  olanın  da  esnek olarak ifade edilebilecek oturma yeri anlayışı olduğu ifade olunmaktadır. Oturma yerinin esnek olarak yorumlanmasına bağlı olarak taraﬂ ardan biri, geçici de olsa belli bir eyaleti oturma yeri olarak tayin edebilir ve davasını bu eyalet mahkemesinde açabilir. Dolayısıyla, boşanma davasında o eyaletin hukukunun uygulanmasını isteyen taraf, oturma yerini o eyalete taşıyarak, lex fori nin uygulanmasını mümkün kılabilir; bir başka deyişle, forum shopping yoluna başvurabilir65. C. İsviçre Hukuku İsviçre hukukunda, İsviçre Milletlerarası Özel Hukuk Kanununun66 59. maddesi uyarınca boşanma ve ayrılık davalarındaki genel yetki kuralı düzenlenmiştir. 59. maddeye göre, davalı eşin yerleşim yerindeki İsviçre mahkemesi ile davacı eşin bir yıldır İsviçre de yerleşik olması (m. 59/a) veya İsviçre vatandaşı olması koşuluyla yerleşik olduğu yer İsviçre mahkemesinin yetkili olduğu belirtilmiştir (m. 59/b).  İsviçre MÖHK un 61. maddesinde ise yetkili İsviçre mahkemesinin, boşanma ve ayrılığa uygulayacağı hukuk düzenlenmiştir. Anılan Kanunun 61. maddesinin ilk fıkrası uyarınca; boşanma ve ayrılığa İsviçre hukuku uygulanır. Bununla birlikte, eşlerin müşterek bir 61 SILBERMAN, s. 2008. 62 SILBERMAN, s. 2009. 63 SILBERMAN, s. 2009. 64 SILBERMAN, s. 2011. 65 SILBERMAN, s. 2011. 66 Federal Act on Private International Law, 18.12.1987 , 1 Temmuz 2014 tarihi itibariyle değişiklikleri içeren İngilizce metin için bkz. www.andreasbucher-law.ch/images/stroies/ pil_act_1987_as_amended_until_1_7_2014.pdf  (Erişim Tarihi: 25.06.2015). 14 Gazi Üniversitesi Hukuk Fakültesi Dergisi C. XIX, Y. 2015, Sa. 3Aslı Bayata CANYAŞ millî hukukunun olması ve bu hukukun, yabancı bir hukuk olması ve eşlerden sadece birinin İsviçre de yerleşim yerinin olması durumunda müşterek millî hukuk uygulanır (m. 61/2). Bu hüküm uyarınca İsviçre hukukunda boşanma davalarında uygulanacak hukukun objektif olarak tayin edildiği ve hukuk seçimi imkânına yer verilmediği açıkça görülmektedir. İsviçre MÖHK unda hukuk seçimi imkânı salt evlilik mallarına ilişkin olarak kabul edilmiştir; bu çerçevede, İsviçre MÖHK nun 52. maddenin ilk fıkrası uyarınca genel kural, evlilik mallarına uygulanacak hukuku taraﬂ arın seçmesidir. Söz konusu maddenin ikinci fıkrasında  eşlerin hukuk seçimine sınırlama  getirilerek  eşlerin,  her  ikisinin  de  yerleşim  yerinin  bulunduğu ya da evliliğin gerçekleşmesinden sonra bulunacağı yerin hukukunu ya da taraﬂ ardan birinin millî hukukunu seçebileceği öngörülmüştür67.  D. Çin Hukuku Çin hukukunda, boşanma davaları ile evliliğin anlaşmalı olarak evlilik kayıt makamı önünde sonlanması açısından bir ayrıma gidilerek boşanmaya uygulanacak hukuk farklı şekillerde düzenlenmiştir. Mahkeme huzurundaki boşanma davalarında hâkimin hukuku uygulanırken68; taraﬂ arın anlaşarak evlilik kayıt makamı önünde boşanmayı talep ettikleri durumlarda, sınırlı da olsa hukuk seçimi imkânı getirilmiştir ve taraﬂ ardan birinin mutad mesken hukuku ya da millî hukukunun seçilebilmesi mümkün kılınmıştır69. Taraﬂ arca bu tür bir anlaşmanın yapılmaması halinde ise taraﬂ arın müşterek mutad mesken hukuku, eğer yoksa müşterek millî hukuku, onun da olmaması halinde boşanma usûlünün yürütüldüğü yer hukukunun uygulanacağı düzenlenmiştir.  67 Millî  hukukun  uygulanmasında  ise  23.  maddenin  ikinci  fıkrasının  uygulanmayacağı belirtilmiştir. (İsviçre Milletlerarası Özel Hukuk Kanunu m. 23/2: Bu Kanun da aksi öngörülmedikçe, uygulanacak hukuk tespit edilirken, bir kişinin birden fazla tâbiiyete sahip olması durumunda, en yakın ilişki içinde olduğu tâbiiyeti münhasıran esas alınacaktır.) 68 Act on the Application of Laws Over Foreign-Related Civil Relationships, 2010, PRC, Order of the President of the People s Republic of China, NO. 36, m. 16 ve m. 17.  Konu hakkında bkz. HUO; Zhengxin, Highlights of China s New Private International Law Act: From the Perspective of Comparative Law, 45 R.J.T., 2011, s. 664. Ayrıca bkz. SYMEONIDES, s. 270. 69 Bkz.  SYMEONIDES, s. 270. Gazi Üniversitesi Hukuk Fakültesi Dergisi C. XIX, Y. 2015, Sa. 3 15Yabancı Unsurlu Boşanma Davalarında Hukuk Seçimi IV. Türk Milletlerarası Özel Hukuku ve Boşanma Davalarında Hukuk Seçimi A. Boşanmaya İlişkin Bağlama Kuralı ve Uygulanacak Hukukun Tespiti Türk  Kanunlar  İhtilâfı  Hukukunda,  yabancı  unsurlu  boşanma davalarında taraﬂ ara hukuk seçimi imkânı tanınmamıştır ve uygulanacak hukukun, Milletlerarası Özel Hukuk ve Usûl Hukuku Hakkında Kanununun (MÖHUK) 70 14. maddesinin ilk fıkrası uyarınca hâkim tarafından objektif olarak tespit edilmesi kabul edilmiştir. MÖHUK un  14.  maddesinin  ilk  fıkrası  uygulanırken,    öncelikle taraﬂ arın  müşterek  millî  hukukunun  olup  olmadığı  araştırılacaktır71. Taraﬂ arın müşterek millî hukuku yoksa, müşterek mutad mesken hukukunun varlığı  sorgulanacak;  bunun  da  bulunmaması  durumunda  Türk  hukuku uygulanacaktır. 14. madde uyarınca tespit edilen hukukun,  MÖHUK un 2. maddesinin üçüncü fıkrasında yer alan hüküm nedeniyle, bağlama kurallarının da  dikkate  alınması  gerekmektedir72.  Zira,  söz  konusu  hüküm  uyarınca, uygulanacak yabancı hukukun kanunlar ihtilâfı kurallarının başka bir hukuku yetkili kılması, sadece kişinin hukuku ve aile hukukuna ilişkin ihtilâﬂ arda dikkate alınır ve bu hukukun maddî hukuk hükümleri uygulanır. Örneğin, boşanacak eşlerin her ikisinin de X devletinde mutad mesken sahibi olan, farklı devlet vatandaşları olmaları halinde MÖHUK un 14. maddesinin ilk fıkrası çerçevesinde taraﬂ arın müşterek mutad meskeni hukuku sıfatıyla X devletinin hukuku yetkili hukuk olacaktır. Ancak, MÖHUK un 2. maddesinin üçüncü fıkrası uyarınca, hâkimin, X devletinin hukukunun bağlama kurallarını da dikkate alması zorunludur. Böyle bir durumda, X devletinin bağlama kuralları uyarınca  yabancı  unsurlu  boşanma  davalarında  öncelikli  olarak  taraﬂ ara hukuk seçimi imkânı tanınmışsa ve objektif bağlama kuralı ancak taraﬂ arın hukuk seçmediği hallerde uygulanacaksa,  taraﬂ ar da uygulanacak hukuku seçmişlerse, Türk hâkiminin seçilen hukuku uygulaması gerekecektir73. 70 Kanun No: 5718, Kabul Tarihi: 27.11.2007, RG 12.12.2007-26728. 71 Taraﬂ arın müşterek millî hukuku varsa, anlaşma yoluyla Türk hukukunun  uygulanmasını istemeleri halinde dahi Türk hukukunun uygulanmasının söz konusu olamayacağı ile ilişkili olarak TEKİNALP, Gülören, Milletlerarası Özel Hukuk Bağlama Kuralları, Vedat, İstanbul, 2009, s. 198. 72 MÖHUK un 2. maddesinin üçüncü fıkrasının uygulanışı ile ilgili olarak bkz. DOĞAN, Vahit, Milletlerarası Özel Hukuk, 3. B., Savaş, Ankara, 2015, s. 193-194;  AKINCI, Ziya/  DEMİR GÖKYAYLA, Cemile, Milletlerarası Aile Hukuku, Vedat, İstanbul, 2010, s. 3-4; UYANIK ÇAVUŞOĞLU, Boşanma, s. 37-39. 73 Hukuk seçimi yoluyla taraﬂ arın, hâkimin hukukunu (Türk hukuku) seçtiği durumlarda 16 Gazi Üniversitesi Hukuk Fakültesi Dergisi C. XIX, Y. 2015, Sa. 3Aslı Bayata CANYAŞ Boşanmaya ilişkin olarak Türk kanunlar ihtilâfı hukukunda hukuk seçimi imkânı öngörülmemiş olmakla birlikte,  MÖHUK m. 14 de yer alan basamaklı bağlama sisteminde, taraﬂ arın müşterek millî hukuku ve taraﬂ arın ayrı vatandaşlıkta olmaları halinde  müşterek mutad mesken hukukunun uygulanmasının söz konusu olduğu durumlarda, müşterek millî hukukun veya mutad mesken hukukunun hukuk seçimine imkân tanıması durumunda, hâkimin MÖHUK m. 2/3 hükmünün uygulanması sonucunda seçilen hukuku uygulaması, yani hukuk seçimine, seçilen hukukun izin verdiği ölçüde etki tanıması mümkündür. MÖHUK (m. 15/1) uyarınca  evlilik malları ile ilgili olarak ve sınırlı bir hukuk seçimi imkânına yer verilmiş iken, evliliğin şartları, hüküm ve sonuçları, velayet, boşanma gibi konularda getirilmiş olan bağlama kuralları uyarınca taraﬂ arın, uygulanacak hukuku seçme imkânına sahip olmadığı görülmektedir. Bununla birlikte, yukarıda verilen örnekte belirtildiği gibi, hukuk seçimine etki tanınması, MÖHUK un emredici nitelikteki74 2. maddesinin üçüncü fıkrasının uygulanması sonucu ortaya çıkabilmektedir. Bu durumda, yetkili yabancı hukukun ilgili bağlama kuralını ve bu kapsamda, boşanma davasında hukuk seçme imkânı getiren düzenlemesini dikkate almamak, MÖHUK un emredici nitelikteki 2. maddesinin üçüncü fıkrasına aykırı olacaktır.  Sonuç olarak, Türk hâkimin boşanmaya ilişkin bağlama kuralı uyarınca (MÖHUK m. 14) tespit edilen yabancı hukuku, re sen bulup uygulamasının gereği (MÖHUK m. 2/1) olarak hukuk seçme imkânının varlığına ulaşılmış olmaktadır. Bu noktada, Türk hukukunda boşanmaya uygulanacak hukuk konusunda taraﬂ ara uygulanacak hukuku belirleme imkânı tanınmadığı için, MÖHUK m. 2/3 ün uygulanması sonucunda, yetkili yabancı hukukun boşanma davasında hukuk seçimi olanağı sunan sübjektif bağlama kuralına değil de, uygulanacak hukukun hâkim tarafından belirlenmesi imkânını getiren objektif bağlama kuralına başvurulması düşünülebilir mi? Kanımızca, bu noktada sübjektif ve objektif bağlama kurallarından hangisinin öncelikli olduğu konusunda yabancı hukukun anlayışına göre hareket edilmelidir. Türk kanunlar ihtilâfı hukuku tek dereceli atıf (iade atıf, geriye dönen atıf, geri dönen atıf); taraﬂ arın üçüncü bir devlet hukukunu seçmeleri durumunda ise iki dereceli atıf (devam eden atıf) söz konusu olacaktır. Türk  hâkimi  her  durumda  seçilen  hukukun  maddî  hukuk  kurallarını  uygulayacaktır. (MÖHUK m. 2/3 ). Atıf hakkında bkz. NOMER, s. 151-152; ÇELİKEL/ ERDEM, s. 119; ŞANLI, s. 53; DOĞAN, s. 190; TEKİNALP, s. 41.  MÖHUK uyarınca salt  kişinin hukuku ve aile hukukuna ilişkin uyuşmazlıklarda Türk bağlama kuralının yollamada bulunmuş olduğu yabancı hukukun bağlama kurallarının başka bir hukuku yetkili kılmasının dikkate alınacağı ile ilgili olarak bkz. AYBAY/DARDAĞAN, s. 172-173. 74 DOĞAN, s. 194. Gazi Üniversitesi Hukuk Fakültesi Dergisi C. XIX, Y. 2015, Sa. 3 17Yabancı Unsurlu Boşanma Davalarında Hukuk Seçimi anlayışı çerçevesinde, yabancı hukukun, vakıa olarak değil de hukuk olarak uygulanması75 ve Türk hâkimin, yabancı hukuku, yabancı hâkimin onu uyguladığı şekliyle uygulamak zorunda oluşu da vardığımız sonucu desteklemektedir76. Bu durumda, örneğin, Türk mahkemesi önünde açılan bir davada, MÖHUK m. 14 den hareketle X devlet hukuku yetkili hukuk olarak tespit edildiğinde, bu hukukun  uygulanacak hukukun objektif olarak tespitini öngören hükmü, ancak taraﬂ arca hukuk seçimi yapılmadığında gündeme gelmektedir.  Bir  başka  deyişle,  yabancı  bağlama  kuralları  bünyesinde öncelikli olan, taraﬂ arın hukuk seçme yönündeki iradelerinin olup olmadığıdır. Dolayısıyla, Türk hukukunun bağlama kuralları ile yetkili kılınan  yabancı hukukun bağlama kuralları açısından öncelikle bakılması gereken, taraﬂ arın hukuk  seçme  yönünde  iradelerinin  olup  olmadığıdır.  Objektif  bağlama kuralının  uygulanması  ise  ancak  taraﬂ arın  böyle  bir  iradesinin  olmadığı durumlarda söz konusu olacaktır. Taraf iradesini öne çıkaran bu sonuç, boşanma hukuku alanında hem maddî hukuk hem kanunlar ihtilâfı hukuku alanında etkili olmaya başladığı ileri sürülen77 liberalleşme eğilimleri ile  uyumlu gözükmektedir.  B. Kamu Düzenine Aykırılık İhtimalinin Değerlendirilmesi Kamu düzenine aykırılık başlıklı MÖHUK un 5. maddesi uyarınca, yetkili yabancı hukukun somut olaya uygulanan hükmünün Türk kamu düzenine açıkça  aykırılık  teşkil  etmesi  durumunda,  bu  hükmün  uygulanmasından vazgeçilecektir. Bu noktadan itibaren, duruma göre, ya salt yetkili yabancı hukukun  Türk  kamu  düzenini  bozan  hükmünün  uygulanmaması  yeterli olabilecek  (kamu  düzeninin  olumsuz  etkisi)  ya  da  bazen  uygulanmayan bu hükmün yerine hâkimin hukukundan bir hükmün uygulanması (kamu düzeninin önce olumsuz; sonra olumlu etkisi) gereği ortaya çıkabilecektir78. 75 ŞANLI, Cemal/ ESEN, Emre/ ATAMAN FİGANMEŞE, İnci, Milletlerarası Özel Hukuk, 3.B., Vedat, 2014, s. 62-63; AYBAY, Rona/ DARDAĞAN, Esra, Uluslararası Düzeyde Yasaların Çatışması (Kanunlar İhtilafı), 2. B., İstanbul Bilgi Üniversitesi Yayınları, 2008, s. 114; NOMER, s. 193-194; ÇELİKEL/ERDEM, s. 174; DOĞAN, s. 212-213. 76 NOMER s. 196; ÇELİKEL/ ERDEM, s. 175. 77 Konu hak. bkz. GAERTNER, s. 112.  78 Kamu düzeninin etkisi, olumsuz veya önce olumsuz sonra olumlu olabilir. Yetkili yabancı hukukun uygulanmasından kamu düzenine aykırılık nedeniyle vazgeçilmesi olumsuz etkidir. Bu etkiden sonra ise, hâkim kendi hukukunu uygulayacaktır ve bu şekilde önce olumsuz, ardından olumlu etki gündeme gelecektir: BERKİ, Osman Fazıl, Devletler Hususî Hukuku, B.6, C. II, Ankara, 1966, s. 84; TİRYAKİOĞLU, Bilgin, Taşınır Mallara İlişkin Milletlerarası Unsurlu Satım Akitlerine Uygulanacak Hukuk, AÜHF Yayınları, Ankara, 1996, s. 77; TANRIBİLİR, Feriha Bilge, 5718 Sayılı Milletlerarası Özel Hukuk ve Usûl Hukuku 18 Gazi Üniversitesi Hukuk Fakültesi Dergisi C. XIX, Y. 2015, Sa. 3Aslı Bayata CANYAŞ Ancak,  kanunlar  ihtilâfı  hukukunda,  kamu  düzenine  aykırılık  sonucunda gerçekleşecek müdahalenin istisnaî niteliği ve amacın olabildiğince yetkili yabancı hukuku uygulamak olduğu gözden uzak tutulmamalıdır79. Bu noktada, yabancı hukukun Türk hukukundan farklı bir düzenleme öngörüyor oluşunun da doğrudan kamu düzenine aykırılık sonucunu doğurmaması gerektiğine dikkat edilmelidir80.  Yabancı unsurlu boşanma davasında, MÖHUK m. 14 uyarınca yetkili olan hukukun, MÖHUK un 2. maddesinin üçüncü fıkrasının gereği olarak, bağlama kurallarının hukuk seçimine yer vermesi halinde, seçilen hukukun uygulanmasının Türk kamu düzenine açıkça aykırılık teşkil edeceğini ileri sürerek  seçilen  hukuku  uygulamamak  kanunlar  ihtilâfı  hukukunda  kamu düzeninin istisnaî niteliğini inkâr etmek anlamına gelecektir. Burada asıl tartışılması gereken, seçilen hukukun, somut olaya uygulanan hükümlerinin Türk kamu düzenine açıkça aykırılık teşkil edip etmediğidir. Bu noktada, Türk hâkimi tarafından, yabancı unsurlu bir boşanma davasında MÖHUK m. 14 uyarınca yetkili hukukun bulunması ve yine MÖHUK m. 2/3 gereğince yetkili hukukun hukuk seçimine imkân veren sübjektif bağlama kuralının, dolayısıyla seçilen hukukun uygulanması söz konusudur. Yetkili yabancı hukukun hukuk seçimine imkân tanıyor olması, başlı başına kamu düzenine aykırılık olarak değerlendirilmemelidir. Bu doğrultuda, Türk hakiminin MÖHUK m. 14 çerçevesinde tespit ettiği yetkili hukukun, MÖHUK un 2. maddesinin 3. fıkrası çerçevesinde, bağlama kurallarının uygulanması sonucunda boşanmaya taraﬂ arın seçtiği hukukun uygulanmasının, başlı başına,  adalet anlayışımıza ilişkin temel kimi ilkeleri ve vazgeçilemeyecek nitelikteki hukukî ve toplumsal değerleri81 sarsacak bir durum olduğunu ileri sürmek, kanunlar ihtilâfı hukukunda kabul edilen kamu düzeni anlayışıyla bağdaşmaz. Önemli olan, seçilen hukukun uygulanması halinde,  örneğin aileye ilişkin kamusal ve toplumsal kimi menfaatlerin Hakkında Kanun un Genel Hükümlerinde Yapılan Değişiklikler Üzerine, TBB Dergisi, S. 87, 2010, s. 216.   79 Konu hakkında bkz. NOMER, s. 160-161; ÇELİKEL/ ERDEM, s. 153. 80 NOMER, s. 162; ÇELİKEL/ERDEM, s. 158; DOĞAN, s. 220. 81 Kamu düzeni müdahalesine ilişkin olarak bkz.  DOĞAN, s. 156; NOMER, s. 157; TİMUR, Hıfzı, Devletler Hususî Hukukunda Amme İntizamı, İÜHFM, C. 7, S.1, Y. 1941, s. 902; ÖKÇÜN, Ahmet Gündüz, Devletler Hususî Hukukunun Kaynakları ve Kamu Düzeni, Ankara, 1997, s. 102; GÜRZUMAR, Aydanur, Türk Devletler Özel Hukuku Açısından Boşanma Davalarında Kamu Düzeninin Etkileri, MHB, Yıl:14, S. 1-2, 1994, s. 22; UYANIK ÇAVUŞOĞLU, Boşanma, s. 32-36. Gazi Üniversitesi Hukuk Fakültesi Dergisi C. XIX, Y. 2015, Sa. 3 19Yabancı Unsurlu Boşanma Davalarında Hukuk Seçimi açıkça zedelenmesinin söz konusu olup olmayacağıdır. Örneğin, taraﬂ arca belirlenmiş olan yetkili yabancı hukukun zinaya dayalı olarak sadece erkeğe boşanma hakkı tanıması; kadın bakımından ise bu hakkı tanımaması kadınerkek eşitliğine aykırı olacağından Türk kamu düzenine aykırılık açısından değerlendirilebilir. SONUÇ Boşanma hukuku konusunda giderek daha liberal bir anlayışın (favor divortii) benimsenmeye başladığı ve bu anlayışın maddî hukuk alanında olduğu gibi  kanunlar ihtilâfı hukukunda da kendini hissettirdiği görülmektedir. Maddî hukuk çerçevesinde, yasak olduğu kimi ülkelerde boşanmanın mümkün hale gelebildiği, boşanma koşullarının daha esnek  hale getirilebildiği ya da  boşanma  usûlünün  daha  kolaylaştırılabildiği  görülmektedir.  Kanunlar ihtilâfı hukuku açısından ise kimi hukuk düzenlerinde genelde sınırlı da olsa boşanmaya uygulanacak hukuku seçme yönünde bir anlayışın yeşermeye başladığı görülmektedir.  Avrupa Birliğinde Roma 3 Tüzüğü kapsamında,  yabancı unsurlu boşanma davalarında hukuk seçimi imkânının sınırlı da olsa tanınmış olması bu gelişmenin en önemli yansımalarından biridir. Türk kanunlar ihtilâfı hukukunda boşanmaya  uygulanacak hukukun objektif olarak belirlendiği ve hukuk seçimine imkân verilmediği görülmekle birlikte (MÖHUK m. 14), taraﬂ arın yaptığı hukuk seçimine  MÖHUK un 2.  maddesinin  üçüncü  fıkrasının  uygulanması  sonucunda  etki  tanınması mümkündür.  Bu şekilde, Türk hâkimi, yabancı hukuku, yabancı hâkimin onu uyguladığı şekliyle de uygulamış olacaktır. Yabancı hukukun boşanma davalarında hukuk seçimi imkânı sunan hükmünün uygulanmasının, aileye ilişkin  kamusal  ve  toplumsal  menfaatleri  zedeleyebilecek  nitelikte  bir konu olarak düşünülmesi ise mümkün gözükmemektedir. Bununla birlikte, boşanmaya uygulanacak olan yetkili yabancı hukukun somut olaya uygulanan hükmünün, Türk kamu düzenine açıkça aykırı olması durumunda bir müdahale söz konusu olacaktır. 20 Gazi Üniversitesi Hukuk Fakültesi Dergisi C. XIX, Y. 2015, Sa. 3Aslı Bayata CANYAŞ KAYNAKÇA AKINCI,  Ziya/  DEMİR  GÖKYAYLA,  Cemile,  Milletlerarası Aile Hukuku, Vedat, İstanbul, 2010. AYBAY, Rona/ DARDAĞAN, Esra, Uluslararası Düzeyde Yasaların Çatışması (Kanunlar İhtilafı), 2. B., İstanbul Bilgi Üniversitesi Yayınları, 2008. BAARSMA,  Nynke,  The  Europeanisation  of  International  Family Law,  T.M.C.  Asser  Press,  Springer,  Groningen,  2011.  (Baarsma,  The Europeanisation) BAARSMA, Nynke, Communitarisation of Choice of Law Rules on Divorce and Termination of Registered Partnerships,  www.rug.nl/research/ gradschool-law/phd/paper-nynke-baarsma.pdf, s.1-7. BAYRAKTAROĞLU ÖZÇELİK, Gülüm, Roma III Tüzüğü Uyarınca Boşanma ve Ayrılığa Uygulanacak Hukukun Tayini ve Uygulanması, Ankara Üniversitesi Hukuk Fakültesi Dergisi, 61(2) 2012, s. 505-539. BERKİ, Osman Fazıl, Devletler Hususî Hukuku, B.6, C. II, Ankara, 1966. BOELE-WOELKI,  K./  VAN  ITERSON,  D.,  The  Dutch  Private International Law Codification: Principles, Objectives and Opportunities, Electronic Journal of Comparative Law, C. 14/3, 2010, s. 1-31. ÇELİKEL, Aysel/ ERDEM, Bahadır, Milletlerarası Özel Hukuk, 13.B., Beta, İstanbul, 2014. DETHLOFF, Nina, Arguments for the Unification and Harmonisation of Family Law in Europe, Perspectives for the Unification and Harmonisation in Europe (Ed. Katharina Boele- Woelki), Intersentia, Antwerp-Oxford-New York, 2003. DE VIDO, Sara, The Relevance of Double Nationality to Conﬂ ict of Laws Issues Relating to Divorce and Legal Separation in Europe, Cuadernos de Derecho Transnacional, C.4, N.1, 2012, s. 2222-2232. DOĞAN, Vahit, Milletlerarası Özel Hukuk, 3. B., Savaş, Ankara, 2015. EHRENZWEIG, Albert, The Lex Fori: Basic Rule in the Conﬂ ict of Laws, Michigan Law Review, 58/5, 1960, s. 637-688. Gazi Üniversitesi Hukuk Fakültesi Dergisi C. XIX, Y. 2015, Sa. 3 21Yabancı Unsurlu Boşanma Davalarında Hukuk Seçimi EKŞİ, Nuray, Milletlerarası Özel Hukukta Medeni Olmayan Evliliklerin ve Adli Olmayan Boşanmaların Tanınması, Seçkin, İstanbul, 2012. FIORINI,  Aude,  Rome  III-Choice  of  Law  in  Divorce:  Is  the Europeanization of Family Law Going Too Far?, International Journal of Law, Policy and the Family, 22, 2008, s. 178-205. FRANZINA,  Pietro,  The  Law  Applicable  to  Divorce  and  Legal Separation Under Regulation (EU) No. 1259/2010 of 20 December 2010, Cuadernos de Derecho Transnacional (Octubre 2011), C.3, N.2, 2011, s. 85129. GAERTNER, Veronika, European Choice of Law Rules in Divorce (Rome III): An Examination of the Possible Connecting Factors in Divorce Matters Against the Background of Private International Law Developments, Journal of Private International Law, 2006, C. 2, N. 1, s. 99-136. GÜRZUMAR,  Aydanur,  Türk  Devletler  Özel  Hukuku  Açısından Boşanma Davalarında Kamu Düzeninin Etkileri, MHB, Yıl:14, S. 1-2, 1994, s. 21-54. HUO, Zhengxin, Highlights of China s New Private International Law Act: From the Perspective of Comparative Law, 45 R.J.T., 2011, s. 641-684. JAYME, Erik, Party Autonomy in International Family and Succession Law: New Tendencies, Yearbook of Private International Law, C. 11, 2009, s. 1-10. KALKAN OĞUZTÜRK, Burcu, A General Perspective to the History and the Harmonisation Idea of Family Law in Europe, Annales de la Faculté de Droit d Istanbul, C. 41, S. 58, 2009, s. 181-195. KRVAVAC, Marija/ BELOVIC, Jelena, Communitarisation of Private International Law Rules on Party Autonomy in European Union, International Journal of Business, Humanities and Technology, C. 4, N.3, 2014, s. 54-68. MARINA, Simone, Matrimonial Matters and the Harmonization of Conﬂ ict of Laws: A Way to Reduce the Role of Public Policy As A Ground For Non-Recognition of Judgments, Yearbook of Private International Law (Ed. BONOMI, Andrea/ ROMANO, Gian Paolo),  C. 13, 2011, s. 255-272. MCELEAVY, Peter, The Communitarization of Divorce Rules: What Impact for English and Scottish Law?, International and Comparative Law Quarterly, 53, 2004, s. 605-642.  22 Gazi Üniversitesi Hukuk Fakültesi Dergisi C. XIX, Y. 2015, Sa. 3Aslı Bayata CANYAŞ MORRIS,  J.,  Conﬂ ict  of  Laws,  London,  Sweet&Maxwell,  5.  B., London, 2000. NAGY, Csongor Istvan, What Functions May Party Autonomy Have in International Family and Succession Law? An EU Perspective, Nederlands Internationaal Privaatrecht, 4, 2012, s. 576- 586. NOMER, Ergin, Devletler Hususî Hukuku, 21.B., Beta, 2015. ÖKÇÜN, Ahmet Gündüz, Devletler Hususî Hukukunun Kaynakları ve Kamu Düzeni, Ankara, 1997. PEARI, Sagi, Choice of Law in Family Law: Kant, Savigny and the Parties Autonomy Principle, Nederlands Internationaal Privaatrecht, 4, 2012, s. 597-604. PFEIFFER, Magdalena, Choice of Law in International Family and Succession Law, The Lawyer Quarterly, 4/2012, s. 291-305. SILBERMAN, Linda J., Rethinkig Rules of Conﬂ ict of Laws in Marriage and Divorce in the United States: What Can We Learn From Europe?, Tulane Law Review, C. 82, 2007-2008, s. 1999-2020.  SYMENONIDES, Symeon C., Codifying Choice of Law Around the World- An International Comparative Analysis, Oxford University Press, New York, 2014. ŞANLI,  Cemal/  ESEN,  Emre/  ATAMAN  FİGANMEŞE,  İnci, Milletlerarası Özel Hukuk, 3.B., Vedat, 2014. TANRIBİLİR, Feriha Bilge, 5718 Sayılı Milletlerarası Özel Hukuk ve Usûl Hukuku Hakkında Kanun un Genel Hükümlerinde Yapılan Değişiklikler Üzerine, TBB Dergisi, S. 87, 2010, s. 195-227.  TEKİNALP, Gülören, Milletlerarası Özel Hukuk Bağlama Kuralları, Vedat, İstanbul, 2009. TİMUR, Hıfzı, Devletler Hususî Hukukunda Amme İntizamı, İÜHFM, C. 7, S.1, Y. 1941, s. 866-905. TİRYAKİOĞLU, Bilgin, Taşınır Mallara İlişkin Milletlerarası Unsurlu Satım Akitlerine Uygulanacak Hukuk, AÜHF Yayınları, Ankara, 1996. TORGA, Maarja, Party Autonomy of the Spouses Under the Rome III Regulation in Estonia-Can Private International Law Change Substantive Gazi Üniversitesi Hukuk Fakültesi Dergisi C. XIX, Y. 2015, Sa. 3 23Yabancı Unsurlu Boşanma Davalarında Hukuk Seçimi Law?, Nederlands Internationaal Privaatrecht, 4, 2012, s. 547-554. UYANIK ÇAVUŞOĞLU, Ayfer, Avrupa Birliği nde Aile Hukukunu Birleştirme Çalışmaları, Ata Sakmar a Armağan, Galatasaray Üniversitesi Hukuk Fakültesi Dergisi, 2011/1, s. 213-240. UYANIK  ÇAVUŞOĞLU,  Ayfer  Uyanık,  Türk  Milletlerarası  Özel Hukukunda Boşanma, Beta, İstanbul, 2006. (Uyanık Çavuşoğlu, Boşanma) WESTCOTT, John (Ed.), Family Mediation: Past, Present and Future,  Jordan Publishing, Bristol, 2004. WILLS, Mary M., Conﬂ icts of Law in Divorce Litigation: A LookingGlass World?, Campbell Law Review, V. 10/1, 1987, s. 145-166. VIARENGO, Ilaria, The Role of Party Autonomy In Cross-Border Divorces, Nederlands Internationaal Privaatrecht, 4, 2012, s.  555-561. YETONA, Toni Marzal, The Constitutionalisation of Party Autonomy in European Family Law, Journal of Private International Law, C. 6.N.1, s. 155- 193. www.andreasbucherlaw.ch/images/stroies/pil_act_1987_as_amended_ until_1_7_2014.pdf (erişim 25.06.2015) www.doi.gov.mt (erişim 29.06.2015) www.ec.europa.eu/justice_home/judicialatlascivil/html/di_ information_en.html (erişim 15.06.2015) 24 Gazi Üniversitesi Hukuk Fakültesi Dergisi C. XIX, Y. 2015, Sa. 3",
     "Metin": "Ülke  sınırları  arasındaki  hareketlilik  arttıkça,  bu  hareket  hukukun her alanında olduğu gibi aile hukuku alanında da etkisini göstermekte ve uluslararası aile hukuku giderek daha büyük önem kazanmaktadır. Örneğin, Avrupa daki evliliklerin yaklaşık yüzde on beşinin farklı vatandaşlığa sahip kişiler  arasında  gerçekleştiği  görülmektedir.  Bu  evliliklerin  yürümediği durumlarda ise yabancı unsurlu boşanma davaları gündeme gelmekte ve boşanmayla birlikte çocukların velayeti, evlilik mallarının bölüşümü, nafaka gibi pek çok sorun ortaya çıkmaktadır. Bu sorunlardan biri de, boşanma davasının maddî anlamda çözüme ulaştırılabilmesi  için  öncelikle  hangi  devlet  hukukunun  uygulanacağının belirlenmesidir. Bu bağlamda, geleneksel anlamda, Common law ülkeleri ile  Kıta Avrupası  hukuk  sistemine  dahil  ülkelerde  birbirinden  farklı  iki yaklaşımın söz konusu olduğunu söylemek mümkündür. Yabancı unsurlu boşanma davalarında, Common law ülkelerinde, lex fori nin uygulanması anlayışının hâkim olduğu görülmektedir. Kıta Avrupası hukukunda ise daha ziyade Mancini etkisiyle tâbiiyet bağlama noktasından hareket edilerek uygulanacak hukuk tespit edilmektedir.  Lex fori nin uygulanması yoluyla, zaman ve emek anlamında pratiklik sağlanmak istenirken; tâbiiyet ise kişisel statüyü ilgilendiren boşanma gibi durumlarda en sıkı ilişkili bağlama noktası olarak görüldüğü için tercih edilebilmektedir. Bu çerçevede, Kıta Avrupası hukuk sistemi anlayışı içinde yetişmiş bir hukukçu için, yabancı unsurlu boşanma davasında lex fori nin uygulanacak 1  Ayrıntılı bilgi için bkz. DETHLOFF, Nina, Arguments for the Uniﬁ cation and Harmonisation of Family Law in Europe, Perspectives for the Uniﬁ cation and Harmonisation in Europe (Ed. Katharina Boele- Woelki), Intersentia, Antwerp-Oxford-New York, 2003, s. 37. 2  Örneğin, Avrupa Birliğinde her yıl ortalama 170.000 yabancı unsurlu boşanma davasının açıldığı belirtilmektedir: Konu hakkında bkz. FIORINI, Aude, Rome III-Choice of Law in Divorce: Is the Europeanization of Family Law Going Too Far?, International Journal of Law, Policy and the Family, 22, 2008, s. 178. 3  Konu hakkında ayrıntılı bilgi için bkz. GAERTNER,Veronika, European Choice of Law Rules in Divorce (Rome III): An Examination of the Possible Connecting Factors in Divorce Matters Against the Background of Private International Law Developments, Journal of Private International Law, 2006, C. 2, N. 1, s. 104 vd. 4  GAERTNER, s. 104. 5  Mancini doktrini hak. bkz. ÇELİKEL, Aysel/ ERDEM, Bahadır, Milletlerarası Özel Hukuk, 13.B., Beta, İstanbul, 2014, s. 54; NOMER, Ergin, Devletler Hususî Hukuku, 21.B., Beta, İstanbul, 2015, s. 55-56. 6  Konu hakkında bkz. GAERTNER, s. 104. 4 Gazi Üniversitesi Hukuk Fakültesi Dergisi C. XIX, Y. 2015, Sa. 3Aslı Bayata CANYAŞ olması  şaşırtıcı  bulunabilir.  Hatta,  lex  fori nin  uygulanması,  kanunlar ihtilâfı  hukukunu  tehdit  eden  bir  anlayış  olarak  dahi  görülebilir.  Zira, kişisel statüyü ilgilendiren böyle bir durumda, taraﬂ ar, kendilerini en yakın hissettikleri hukukun uygulanması beklentisi içinde olabilirler. Bu noktada, hâkimin  hukukunun  uygulanması,  taraf  beklentisini  karşılamayabileceği için taraf menfaatlerine aykırı olabilecektir. Diğer yandan, Common law anlayışı içinde ise, tâbiiyet bağlama noktasından hareket edilmesi sonucunda hâkimin hukukundan çok farklı nitelikteki bir hukukun uygulanması olasılığı kabul edilemez bulunabilir. Ayrıca, bu yaklaşım çerçevesinde lex fori nin uygulanması, yabancı hukukun araştırılmasını gerektirmediğinden hem zaman hem masraf kaybını önleyici bir formül olarak görülebilmektedir. Yabancı unsurlu boşanma davalarında uygulanacak hukukun bu şekilde objektif tespitinin yanı sıra, irade muhtariyetine etki tanıyan düzenlemelerin varlığı  da  gündeme  gelebilmektedir.  Çalışmada,  boşanma  hukukundaki liberalleşme  akımına  değinildikten  sonra,  aile  hukukuna  ilişkin  olarak hukuk seçimi konusundaki esnek ve katı yaklaşımlar üzerinde durulacaktır. Ardından, yabancı unsurlu boşanma davalarında hukuk seçimi imkânı, bazı hukuk düzenleri ile sınırlı olarak ele alınacaktır. Son olarak, Türk hukukunda boşanmaya uygulanacak hukuk değerlendirildikten sonra, yabancı unsurlu boşanma davalarında taraﬂ arca yapılan hukuk seçiminin etkisi tartışılmakta ve  bu  çerçevede,  kamu  düzenine  aykırılığın  ortaya  çıkıp  çıkmayacağı  değerlendirilmektedir. I. Boşanma Hukukunda Liberalleşme Boşanma hukuku alanında giderek daha esnek ve liberal bir anlayışın yerleşmekte olduğu ileri sürülmektedir. Örneğin, boşanmanın mahkeme 7  GAERTNER, s. 106. 8  D. Evrigenis, Tendances doctrineales actuelles en droit international privé (1966-II) 118 Recueil des Cours, 313 den aktaran GAERTNER, s. 106. 9  A. Vonken, Balancing Processes in International Family Law-On the Determination and Weighing of Interests in the Conﬂ ict of Laws and the ‘Openness  of the Choice of Law System, Forty Years On: The Evolution of Postwar Private International Law in Europe (Ed. T de Boer), Deventer, Kluwer, 1990, s. 178 den aktaran GAERTNER, s. 114. 10 Değerlendirmeler için bkz. MORRIS, J., Conﬂ ict of Laws, London, Sweet&Maxwell, 5. B., London, 2000, s. 23 vd. 11 Konu hak. bilgi için bkz. GAERTNER, s. 112; PFEIFFER, Magdalena, Choice of Law in International Family and Succession Law, The Lawyer Quarterly, 4/2012, s. 301. 12 Konu hak. bkz. GAERTNER, s. 112.  Boşanmanın yasak olduğu hukukların sayısının giderek azalmakta olduğuna ve boşanma konusunda maddî hukuk düzenlemelerine ilişkin karşılaştırmalı hukuk değerlendirmesine yönelik olarak bkz. UYANIK ÇAVUŞOĞLU, Ayfer, Türk Gazi Üniversitesi Hukuk Fakültesi Dergisi C. XIX, Y. 2015, Sa. 3 5Yabancı Unsurlu Boşanma Davalarında Hukuk Seçimi huzurunda gerçekleşen bir işlem olmasının yanı sıra, arabulucular nezdinde de  çözüme  kavuşturulmaya  başlanan  bir  konu  olarak  görülebilmesi  bu liberalleşmeye bir işaret olarak algılanmaktadır. Ayrıca, idarî makamlarca verilen kararlar yoluyla evliliğin sonlandırılabilmesi ya da çiftlerin anlaşma yoluyla boşanabilmeleri de bu esnek anlayışı yansıtır şekilde yorumlanmaktadır. Diğer  yandan,  boşanma  konusundaki  yasağın  kaldırılarak  mümkün  hale geldiği Malta gibi örnekler de boşanma konusundaki liberalleşme eğilimini destekler şekilde yorumlanmaktadır. Boşanma konusunda, maddî hukuktaki anlayış ile kanunlar ihtilâfı hukuku arasındaki etkileşimin yoğun olduğu ve iç hukukta, boşanmaya ilişkin esnek  bir  yaklaşımın  benimsendiği  (favor  divortii)  hukuk  düzenlerinde, kanunlar ihtilâfı hukuku alanında da bu esnekliğin yansımasının hissedildiği belirtilmektedir. Buna karşın, maddî hukukta evliliği olabildiğince ayakta tutmak yanlısı bir anlayış hâkimse (favor matrimonii), bu anlayışın yabancı unsurlu boşanma davalarında da etkisini hissettirdiği belirtilerek boşanmaya hükmedilmesinin zorlaşabildiği ifade olunmaktadır.  Boşanma  hukukundaki  liberalleşmenin  kanunlar  ihtilâfı  hukuku alanındaki en somut görünümü, taraﬂ arın, boşanmaya uygulanacak hukuku seçme  imkânına  kavuşturulması  şeklinde  ortaya  çıkmaktadır.  Örneğin, Avrupa Birliğinde, aile hukukuna ilişkin kanunlar ihtilâfı hukuku alanında irade  muhtariyetinin,  giderek  temel  ilke  haline  gelmekte  olduğu  ileri sürülmektedir. Hatta, Avrupa Birliğinde aile hukukuna ilişkin konularda Milletlerarası Özel Hukukunda Boşanma, Beta, İstanbul, 2006, s. 21-25. 13 WESTCOTT, John (Ed.), Family Mediation: Past, Present and Future, Jordan Publishing, Bristol, 2004, s. 5 vd.  14 Konu hakkında ayrıca  bkz. EKŞİ, Nuray, Milletlerarası Özel Hukukta Medeni Olmayan Evliliklerin ve Adli Olmayan Boşanmaların Tanınması, Seçkin, İstanbul, 2012, s. 39 vd. 15 1 Ekim 2011 tarihinde yürürlüğe giren Medenî Kanun değişikliği için bkz.  Civil Code (Amendment) Act, 2011, Government Gazette of Malta No. 18. 784, 29.07.201: www.doi. gov.mt (Erişim tarihi 29.06.2015) Malta hukuku uyarınca her ne kadar boşanma mümkün hale gelmişse de boşanmanın gerçekleşmesi için eşlerin dört yıldır ayrı yaşıyor olması ve tekrar bir araya gelme ihtimâllerinin olmadığına mahkeme tarafından hükmedilmesi gibi koşullar aranabilmektedir. 16 BAARSMA, Nynke, The Europeanisation of International Family Law, T.M.C. Asser Press, Springer, Groningen, 2011, s. 146-147. 17 BAARSMA, The Europeanisation, s. 146-147.  18 YETANO, Toni Marzal, The Constitutionalisation of Party Autonomy in European Family Law, Journal of Private International Law, C. 6.N.1, s. 156. ; NAGY, Csongor Istvan, What Functions May Party Autonomy Have in International Family and Succession Law? An EU Perspective, Nederlands Internationaal Privaatrecht, 4, 2012, s. 576. 6 Gazi Üniversitesi Hukuk Fakültesi Dergisi C. XIX, Y. 2015, Sa. 3Aslı Bayata CANYAŞ irade muhtariyetini öne çıkarmanın, Birlik nezdindeki bütünleşmeye katkıda bulunacağı savunulmaktadır. Bu çerçevede, aile hukuku alanında Common law ülkelerindeki yabancı hukuku hiç uygulamamak yönündeki hâkim anlayış ile Kıta Avrupası ülkelerinde öne çıkan ve eşlerin tâbiiyeti gibi bağlama noktalarından hareket eden ve sonuç olarak yabancı hukukun uygulanmasını mümkün kılan anlayışı uzlaştırmak amacıyla, irade muhtariyetinin ön plana çıkartılması üzerinde durulmaktadır. Avrupa Birliği Adalet Divanı ve Avrupa İnsan  Hakları  Mahkemesi  içtihatlarında  açıkça  irade  muhtariyetinden bahsedilmese  de,  menşe  ülke  ilkesi  gereğince  (country-of-origin principle), bireylerin, aile hukuku ile ilgili uyuşmazlıklarında hangi hukukun uygulanacağını kararlaştırma hakkına sahip olduklarından söz edilmektedir. II. Hukuk Seçimi Kanunlar ihtilâfı hukukundaki irade muhtariyeti kavramının geleneksel olarak,  hukukî  güvenlik  fikri  ile  bağlantılı  olduğu  ileri  sürülmektedir. Taraﬂ ara  hukuk  seçimi  imkânı  tanınmakla,  aralarındaki  kanunlar  ihtilâfı meselesinin pratik ve doğrudan etkili bir şekilde çözüme ulaşabildiği; bu şekilde taraf beklentisinin ve adaletin hızlı teşekkülünün sağlandığı iddia edilmektedir. Kanunlar ihtilâfı hukukunda taraﬂ arca hukuk seçimi olanağına genel olarak,  sözleşmeden  doğan  borç  ilişkileri  ile  haksız  fiil  alanlarında  etki tanınmış olduğunu söylemek mümkündür. Taraﬂ ar, irade muhtariyeti ilkesi gereği, örneğin, aralarındaki sözleşmeden doğan uyuşmazlığa uygulanacak hukuku  seçebilmekte;  bu  şekilde  öngörülebilirliği  sağlayabilmektedir. Böylelikle, taraﬂ ar hak ve borçlarının hangi devlet hukuku uyarınca ve nasıl şekillendirileceğini bilmekte; bir uyuşmazlığın gündeme gelmesi olasılığında seçmiş oldukları hukukun, bu uyuşmazlığa ilişkin olarak ne tür sonuçlar doğuracağını öngörebilmektedir. Bu da belirlilik, kesinlik ve hukukî güvenliği beraberinde getirmektedir.  19 JAYME, Erik, Party Autonomy in International Family and Succession Law: New Tendencies, Yearbook of Private International Law, C. 11, 2009, s. 3. 20 JAYME, s. 3. 21 Konu hakkında bkz. YETANO, s. 157. 22 FRANZINA, Pietro , The Law Applicable to Divorce and Legal Separation Under Regulation (EU) No. 1259/2010 of 20 December 2010, Cuadernos de Derecho Transnacional (Octubre 2011), C.3, N.2, 2011, s. 109.  23 FRANZINA, s. 109. İrade muhtariyetinin günümüzde kazandığı öneme ilişkin olarak NOMER, s. 313. 24 Konu hak. bkz. JAYME, s. 1. Gazi Üniversitesi Hukuk Fakültesi Dergisi C. XIX, Y. 2015, Sa. 3 7Yabancı Unsurlu Boşanma Davalarında Hukuk Seçimi Genel olarak sözleşmeler hukuku alanında öne çıkan irade muhtariyeti ilkesinin, hukukun her alanında aynı genişlik ve esneklikle yorumlandığını  söylemek mümkün gözükmemektedir. Özellikle, aile hukuku alanında hukuk seçimi ya son derece sınırlı olarak gündeme gelmekte ya da bu konuda, irade muhtariyetinin önü tamamen kesilerek, uygulanacak hukuk, forum un bağlama kuralları uyarınca objektif olarak tayin edilmektedir. Bu yaklaşım, aile hukukunun kimi devlet anayasalarında da koruma altına alınan kurumsal bir yapısının olması ve bu nedenle bireysel düzeyde anlaşmalar yoluyla düzenlenmeye uygun olmaması gibi gerekçelerle desteklenmektedir. Ayrıca, örneğin çocuklar gibi zayıf taraﬂ arın korunması düşüncesiyle de konunun, bireysel düzeydeki anlaşmalara açık olamayacağı üzerinde durulmaktadır. Aşağıda ele alınacağı üzere, aile hukuku alanında hukuk seçiminin mümkün kılındığı hallerde dahi, sınırlandırıcı bir anlayış öne çıkabilmektedir. Örneğin, salt hâkimin hukuku, eşlerin müşterek millî hukuku ya da müşterek mutad  mesken  hukukundan  birinin  seçilebileceği  şeklinde  düzenlemelere yer  verilebilmektedir.  Bir  diğer  kısıtlama  ise,  konu  bazında  gündeme gelebilmektedir. Bu çerçevede, hukuk seçimi imkânı, malvarlığına ilişkin konularla sınırlı kalmak kaydıyla tanınabilmektedir. Dolayısıyla, boşanma, çocukların velayeti, evliliğin genel hüküm ve sonuçları gibi konularda hukuk seçimine yer verilmemektedir. Aile hukuku alanında hukuk seçimi konusunda çekimser ve sınırlı bir bakış açısı çizilmiş olmasının gerekçesini, Savigny etkisi ile açıklayan bir görüşe göre,  aile hukuku konusunda  sadece hukukî bir perspektif yeterli olmamakta; toplumsal ve etik boyutları da içeren karma bir yapı öne çıkmaktadır. Bu durumda, aile hukuku söz konusu olduğunda konu ile bağlantılı devletlerin emredici nitelikteki kuralları da devreye girmekte ve irade muhtariyeti sınırlı hale gelmektedir. Aile hukuku alanında irade muhtariyetinin sınırlılığına ilişkin bu katı yaklaşıma karşıt düşecek şekilde, konu hakkında irade muhtariyetini egemen kılmanın çeşitli avantajları üzerinde durulmaktadır. Örneğin, aile hukukundan 25 Konu hak. bkz. JAYME, s. 2 26 Bkz. JAYME, s. 2. 27 PEARI, Sagi, Choice of Law in Family Law: Kant, Savigny and the Parties Autonomy Principle, Nederlands Internationaal Privaatrecht, 4, 2012, s. 604. 28 Evliliğin  varlığı  ve  sona  ermesi  konusunda  devletin  de  maddî  anlamda  menfaatinin söz konusu olduğu ile ilgili olarak bkz. WILLS, Mary M., Conﬂ icts of Law in Divorce Litigation: A Looking-Glass World?, Campbell Law Review, V. 10/1, 1987, s. 149. 8 Gazi Üniversitesi Hukuk Fakültesi Dergisi C. XIX, Y. 2015, Sa. 3Aslı Bayata CANYAŞ doğan uyuşmazlıklar açısından yeknesak bir kanunlar ihtilâfı anlayışının yokluğu karşısında, irade muhtariyetinin, yeknesaklığı sağlayıcı bir çözüm olabileceği  ileri  sürülmektedir.  Bu  çerçevede,  hukuk  seçimi  yoluyla, taraﬂ ara hukukî kesinlik ve öngörülebilirlik imkânı sunulacağı ve aile hukuku gibi kişisel statüyle doğrudan ya da çok yakın ilgili bir konuda, taraﬂ arın kendilerini en yakın hissettikleri hukukun uygulanmasının mümkün kılınacağı da belirtilmektedir. Ayrıca, taraﬂ arın, hukuk seçimi yoluyla kendi davalarının ve durumlarının ihtiyaçlarına en tatmin edici şekilde yanıt verebilecek hukuka ulaşabilecekleri  üzerinde  durulmaktadır.  Örneğin,  taraﬂ arın  seçtikleri  hukukun avantaj ve  dezavantajlarını irdelemiş olacaklarından menfaatlerini en iyi şekilde tatmin eden hukukun uygulanmasını sağlayabilecekleri ileri sürülmektedir. Ek olarak, irade muhtariyeti yoluyla, taraﬂ arın, boşanmanın en hızlı ve ucuz şekilde gerçekleşmesini sağlayabilecek hukuka yönelmelerinin de  mümkün  olabileceği  ifade  edilmektedir.  Son  olarak, Avrupa  Birliği gibi iç göç oranlarının yüksek olduğu yapılanmalarda, taraﬂ arın kültürel kimliklerinin korunması yönündeki isteklerinin çok güçlü olabildiğinden yola çıkılmaktadır. Dolayısıyla, örneğin, hâkimin hukukun değil de hukuk seçimi yoluyla, müşterek millî hukukun uygulanabilmesinin taraﬂ arın istek ve beklentileri ile uyum içinde olacağı üzerinde durulmaktadır. III. Çeşitli Hukuk Düzenlerinde Yabancı Unsurlu Boşanma Davalarında Hukuk  Seçimi Konusundaki Yaklaşımlar Yabancı unsurlu boşanma davalarında, kimi hukuk düzenlerinde eşlere, uygulanacak hukuku seçme imkânının tanındığı; kimi hukuk düzenlerinde ise uygulanacak hukukun salt objektif olarak tespit edildiği ve bu konuda eşlerin iradesine etki tanınmadığı görülmektedir. Hukuk seçiminin mümkün olduğu düzenlemelerin bazılarında ise,  sınırlı bir hukuk seçimi imkânı kabul edilmekte ve bu noktada eşlerin müşterek millî hukukunun veya, müşterek mutad mesken hukukunun uygulanacak hukuk olarak seçilmesine imkân tanınmaktadır. 29 PFEIFFER, s. 303. 30 PFEIFFER, s. 303; FRANZINA, s. 110. 31 NAGY, s. 579. 32 VIARENGO, Ilaria, The Role of Party Autonomy In Cross-Border Divorces, Nederlands Internationaal Privaatrecht, 4, 2012, s.  557. 33 VIARENGO, s. 557. 34 VIARENGO, s. 557. Gazi Üniversitesi Hukuk Fakültesi Dergisi C. XIX, Y. 2015, Sa. 3 9Yabancı Unsurlu Boşanma Davalarında Hukuk Seçimi Bu  çerçevede,  aşağıda,  hem  Kıta Avrupası  hukuku  hem  Common law açısından, boşanma davalarında hukuk seçimi ile ilgili genel yaklaşımı ortaya  koyabilmek  amacıyla  kimi  Avrupa  devletlerinin,  İngiltere nin, Amerika  Birleşik  Devletleri nin  ve  Çin in  konuya  ilişkin  düzenlemeleri değerlendirilmiştir. A. Avrupa Birliği Hukuku Avrupa  Birliği  bünyesinde,  boşanma  konusunda  üye  ülke  hukuk düzenlemelerinde  ciddî  farklılıkların  olması,  konu  hakkında  ortak  bir hukukî düzenlemenin varlığını gerektirmiştir. Bu amaçla, 20 Aralık 2010 tarihli Boşanma ve Ayrılığa Uygulanacak Hukuk Alanında Güçlendirilmiş İşbirliğinin Uygulanmasına İlişkin Konsey Tüzüğü yürürlüğe sokulmuştur. Tüzük, Avrupa Birliği nde yabancı unsurlu boşanma ve ayrılığa uygulanacak hukuk konusunda yeknesak bir düzenleme öngörmektedir.38.  Tüzüğün 1. maddesinin 1. paragrafında, Tüzüğün kanunlar ihtilâfı içeren durumlarda boşanma ve ayrılık bakımından uygulanacağı düzenlemesine yer verilmiştir. Tüzük, sadece katılan devletler bakımından doğrudan uygulanacak; Birleşik Krallık, İrlanda ve Danimarka da ise uygulama alanı bulmayacaktır. Avrupa Birliği bünyesinde, boşanmanın kolaylaşmasına yönelik bir anlayışın (favor divortii) yerleşmeye başladığı yönündeki iddia kapsamında, Tüzüğün temel prensiplerinden biri olarak favor divortii anlayışına yer verildiği 35 MCELEAVY, Peter, The Communitarization of Divorce Rules: What Impact for English and Scottish Law?, International and Comparative Law Quarterly, 53, 2004, s. 642. 36 Council Regulation (EU) No 1259/2010 of 20 December 2010 Implementing Enhanced Cooperation in the Area of the Law Applicable to Divorce and Legal Separation, O.J. L 343/10, 29.12.2010. Bundan sonra Tüzük ya da Roma 3 Tüzüğü olarak ifade olunacaktır. 37 Avrupa Birliği bünyesindeki yeknesaklaştırmanın tarihçesi ile ilgili olarak bkz. KALKAN OĞUZTÜRK, Burcu, A General Perspective to the History and the Harmonisation Idea of Family Law in Europe, Annales de la Faculté de Droit d Istanbul, C. 41, S. 58, 2009, s. 181 vd. 38 Konu hakkında bkz. PFEIFFER, s. 297; BAYRAKTAROĞLU ÖZÇELİK, Gülüm, Roma III Tüzüğü Uyarınca Boşanma ve Ayrılığa Uygulanacak Hukukun Tayini ve Uygulanması, Ankara Üniversitesi Hukuk Fakültesi Dergisi, 61(2) 2012, s. 505 vd.; FIORINI, s. 178 vd. 39 Tüzüğe katılan devletler, Belçika, Bulgaristan, Almanya, İspanya, Fransa, İtalya, Letonya, Lüksemburg, Macaristan, Malta, Avusturya, Portekiz, Romanya, Slovenya dır. Litvanya da 2012/714/EU kararı ile 22.05.2014 tarihinden itibaren geçerli olmak üzere katılmıştır: www. ec.europa.eu/justice_home/judicialatlascivil/html/di_information_en.html  (Erişim  Tarihi: 15.06.2015). 40 DE VIDO, Sara, The Relevance of Double Nationality to Conﬂ ict of Laws Issues Relating to Divorce and Legal Separation in Europe, Cuadernos de Derecho Transnacional, C.4, N.1, 2012, s. 224. 10 Gazi Üniversitesi Hukuk Fakültesi Dergisi C. XIX, Y. 2015, Sa. 3Aslı Bayata CANYAŞ belirtilmekte  ve  eşlerin  boşanma  hakkının  varlığının  altı  çizilmektedir. Bu  çıkarıma,  özellikle  Tüzüğün  10.  maddesindeki  düzenleme  dayanak gösterilmektedir. Nitekim, Tüzüğün  10. maddesi uyarınca, Tüzüğün 5. ya da 8. maddesi uyarınca uygulanacak olan hukukun, boşanmaya yer vermediği ya da boşanma hakkı konusunda eşler arasında cinsiyete dayalı ayrım öngördüğü durumlarda, forum hukukunun uygulanması hükme bağlanmıştır. Bu şekilde, boşanmanın forum hukukuna dayalı olarak elde edilebilmesi ve eşler arasında ayrım yapılmaksızın gerçekleştirilebilmesi amaçlanmıştır. Tüzüğün 5. maddesinde ise taraﬂ ara sınırlı da olsa hukuk seçimi imkânı tanınmıştır. Buna göre, taraﬂ ar, hukuk seçimi anlaşmasının yapıldığı sırada müşterek mutad meskenlerinin bulunduğu yer hukukunu; anlaşma yapıldığı sırada eşlerden birinin halen orada yerleşik olması koşuluyla son müşterek mutad  meskenlerinin  bulunduğu  yer  hukukunu,  anlaşmanın  yapıldığı sırada eşlerden birinin millî hukukunu ve son olarak da  hâkimin hukukunu seçebilirler. Tüzüğün sunmuş olduğu esneklik sonucunda taraﬂ arca seçilen hukuk, Tüzüğe katılan üye bir devletin hukuku olmasa dahi uygulanacaktır. Taraﬂ ara seçebilecekleri hukuk bakımından sınırlama getirilmiş olmasının sebebinin ise taraﬂ arla çok az ilgili ya da tamamen ilgisiz bir hukukun uygulanmasının önüne geçmek olduğu belirtilmektedir. Taraﬂ ara hukuk seçme  imkânı  getirmenin,  özellikle  mutad  meskenin  objektif  tespitine yönelik  zorlukları  yenmede  anlamlı  olabileceği  üzerinde  durulmaktadır 45.  Şeklî açıdan ise yazılı olarak yapılması şart koşulan  hukuk seçimi anlaşmasının, taraﬂ arca imzalanması noktası belirtilmiş ve anlaşma metninde tarihe de yer verilmesi gerektiği düzenlenmiştir (Tüzük m. 7/1) 46.   Taraﬂ arın 41 FRANZINA, s. 99. 42 Tüzüğün Dibacesinin 12. paragrafında ve Tüzüğün 4. maddesinde  yer alan bu esnekliğe bağlı olarak, uygulanacak hukuk, ister taraﬂ arca belirlenmiş ister objektif olarak tayin edilmiş olsun,  Tüzüğe katılmamış, üye bir devlet hukuku olsa dahi uygulanacaktır. Ayrıca AB üyesi olmayan üçüncü bir devlet hukuku da uygulanacak hukuk olabilecektir: MARINA, Simone, Matrimonial Matters and the Harmonization of Conﬂ ict of Laws: A Way to Reduce the Role of Public Policy As A Ground For Non-Recognition of Judgments, Yearbook of Private International Law (Ed. BONOMI, Andrea/ ROMANO, Gian Paolo),  C. 13, 2011, s. 262. 43 VIARENGO, s. 557. 44 BAARSMA, Nynke, Communitarisation of Choice of Law Rules on Divorce and Termination of Registered Partnerships, s. 5. www.rug.nl/research/gradschool-law/phd/paper-nynke-baarsma.pdf,  (Erişim Tarihi: 18.06.2015); Ayrıca bkz. UYANIK ÇAVUŞOĞLU, Ayfer, Avrupa Birliği nde Aile Hukukunu Birleştirme Çalışmaları, Ata Sakmar a Armağan, Galatasaray Üniversitesi Hukuk Fakültesi Dergisi, 2011/1, s. 240. 45 VIARENGO, s.  556. 46 KRVAVAC, Marija/ BELOVIC, Jelena, Communitarisation of Private International Law Gazi Üniversitesi Hukuk Fakültesi Dergisi C. XIX, Y. 2015, Sa. 3 11Yabancı Unsurlu Boşanma Davalarında Hukuk Seçimi seçmiş oldukları hukukun, boşanmaya yer vermemesi ya da boşanma hakkı konusunda eşler arasında cinsiyete dayalı eşitsizlik öngördüğü durumlarda ise seçilmiş olan hukuk uygulanmayacaktır. Bunun yerine Tüzüğün 10. maddesi uyarınca hâkimin hukuku uygulanacaktır. Bu şekilde, boşanma konusunda daha liberal ve esnek bir anlayış benimsemiş olan hâkimin hukukun uygulanması söz konusu olabilecektir. Taraﬂ arın  hukuk  seçimi  yapmamaları  durumunda  ise  uygulanacak hukuk, objektif olarak tayin edilecektir. Objektif bağlama kuralı kapsamında, basamaklı bir yapı kabul edilmiş ve son olasılık olarak hâkimin hukukunun uygulanacağı belirtilmiştir. Tüzüğe katılmamış olan üye ülkelerde örneğin, Hollanda da kendi bağlama kuralları uygulanmaya devam edecektir.  Bu çerçevede, Hollanda Medenî  Kanununun  Kanunlar  İhtilâfı  Hukuku  başlıklı  10.  Kitabının 10:56 maddesinin ilk fıkrası kapsamında, hukuk seçimi olasılığının gündeme gelmediği  durumlarda,  boşanmaya  Hollanda  hukukunun  uygulanacağı düzenlenmiştir.  Lex  fori nin  bu  şekilde  uygulanması  ile,  boşanmaya olabildiğince  kolay  bir  şekilde  hükmedilmesi  amaçlanmaktadır.  Anılan maddenin ikinci fıkrasında ise taraﬂ ara hukuk seçimi imkânı getirilmiştir. Buna göre, taraﬂ arın ortak iradeleri yoluyla ya da bir tarafın iradesine diğerinin Rules on Party Autonomy in European Union, International Journal of Business, Humanities and Technology, C. 4, N.3, 2014, s. 67. 47 TORGA, Maarja, Party Autonomy of the Spouses Under the Rome III Regulation in Estonia-Can Private International Law Change Substantive Law?, Nederlands Internationaal Privaatrecht, 4, 2012, s. 548. 48 Roma 3 Tüzüğünün 8. maddesi uyarınca, taraﬂ arın hukuk seçimi yapmadıkları durumlarda boşanma ve ayrılığa uygulanacak hukuk, a. davanın açıldığı tarihte eşlerin müşterek mutad meskeninin bulunduğu yer hukuku, bulunmaması durumunda, b.  davanın açıldığı tarihten geriye doğru bir yıldan daha uzun bir süre önce değiştirilmemiş olmak ve eşlerden birinin dava açıldığı tarihte hâlen söz konusu devlette yerleşik olması koşuluyla eşlerin son müşterek mutad meskenlerinin bulunduğu yer hukuku, bulunmaması durumunda, c. davanın açıldığı sırada eşlerin müşterek millî hukuku, onun da bulunmaması durumunda, d. davanın açıldığı devlet hukuku olacaktır. 49 VIARENGO, s. 561. 50 Burgerlijk Wetboek, Act of 19.5.2011 Adopting and Implementing Book 10 (Private International Law) of the Dutch Civil Code için bkz. SYMEONIDES, Symeon C., Codifying Choice of Law Around the World- An International Comparative Analysis, Oxford University Press, New York, 2014, s. 368. 51 BOELE-WOELKI, K./ VAN ITERSON, D., The Dutch Private International Law Codiﬁ cation: Principles, Objectives and Opportunities, Electronic Journal of Comparative Law, C. 14/3, 2010, s. 20; Ayrıca bkz. SYMEONIDES, s. 321. 12 Gazi Üniversitesi Hukuk Fakültesi Dergisi C. XIX, Y. 2015, Sa. 3Aslı Bayata CANYAŞ itiraz etmemesi üzerine, taraﬂ arın müşterek millî hukuku uygulanabilecektir. Taraﬂ ara sınırlı da olsa hukuk seçimi olanağı sağlamakla, esas itibariyle, yabancı boşanma kararını tanımak için millî hukukun uygulanmış olmasını şart  koşan  hukuk  düzenleri  ile  ters  düşmemek  ve  Hollanda  mahkemesi kararının yabancı ülkede tanınmasını sağlamak amaçlanmaktadır. B. İngiliz Hukuku ve Amerika Birleşik Devletleri Hukuku İngiliz  hukukunda  boşanma  davalarında,  lex  fori nin  münhasıran uygulandığı görülmektedir. Boşanma davasında lex fori nin uygulanması ile yargılamanın kısa sürede tamamlanması ve iç karar uyumunun sağlanması amaçlanmaktadır. Bu anlayış çerçevesinde hâkimin, en çok kendi hukuku hakkında bilgi sahibi olacağı gerçeğinden hareket edilmektedir. Dolayısıyla, irade muhtariyetine yer verilmediği görülmektedir. Amerika  Birleşik  Devletleri  hukukunda  ise,  boşanma  davaları açısından  uygulanacak  hukuktan  ziyade,  yetki  ve  tanıma-tenfiz  konuları üzerinde yoğunlaşılmış olduğu görülmektedir. Boşanma davalarında yetki, kişi  hallerine  ilişkin  çoğu  davanın  aksine,  davalının  forum  ile  ilişkisine dayandırılmamıştır. Yetkiye ilişkin olarak evlilik esas alınarak taraﬂ arın evli olarak sahip olmuş oldukları oturma yerinin ya da taraﬂ ardan herhangi birinin oturma yerinin mahkemenin bulunduğu eyalette yer alması, yetkiyi tesis etmek için yeterli görülmüştür. Uygulanacak hukuk konusunda ise çok fazla tartışmaya yer verilmediği görülmektedir ve boşanma davalarında çoğunlukla, lex fori nin uygulanması yoluna gidilmektedir. Bu  uygulamanın tarihsel açıdan gerekçesi, bireylerin evlilik  ya  da  boşanmada  menfaatlerinin  güçlü  olması  ve  mahkemelerin, 52 Müşterek millî hukukunun ait olduğu devlet ile her iki tarafın da sıkı sosyal bağ içinde olması durumunda da tek tarafın seçimi ile bu hukuk uygulanabilecektir: Hollanda Medenî Kanunu m. 10: 56/2/b. 53 BOELE WOELKI/ VAN ITERSON, s. 20. 54 Konu hak. Bkz. BAARSMA, Europeanisation, s. 151. 55 Konu hak. bkz. FRANZINA, s. 94. 56 FRANZINA, s. 94. 57 SILBERMAN, Linda J.: Rethinkig Rules of Conﬂ ict of Laws in Marriage and Divorce in the United States: What Can We Learn From Europe?, Tulane Law Review, C. 82, 20072008, s. 2008.  58 SILBERMAN, s. 2008. 59 SILBERMAN, s. 2008. 60    SYMEONIDES, s. 269; SILBERMAN, s. 2008; WILLS, s. 151. Gazi Üniversitesi Hukuk Fakültesi Dergisi C. XIX, Y. 2015, Sa. 3 13Yabancı Unsurlu Boşanma Davalarında Hukuk Seçimi bu  menfaati  korumak  gerekçesiyle  kendi  hukuk  kurallarını  uygulamak istemeleridir.  Günümüz  itibariyle  ise,  bir  kişinin  oturma  yerinin  onun medenî hali üzerinde önemli bir etkiye sahip olmasından yola çıkılarak, oturma yeri esas alınarak tespit edilecek yetkili  mahkemenin kendi hukukunu uygulamasının yerinde olacağı gerekçesine dayanılmaktadır. Doktrinde ise, mahkemelerin boşanma davalarında hukuk seçimine etki tanımada oldukça çekimser kalacağı tahmin edilmekte ve bu tahmine, devletin de evlilik ilişkisi içinde rolünün ve menfaatinin olması gerekçe olarak gösterilmektedir.63 Amerikan hukukunda boşanma davalarında hukuk seçimi konusuna sıcak bakılmayacağı ifade olunsa bile, uygulamada, Roma III Tüzüğünün taraﬂ ara bahşettiği düzeydeki irade muhtariyetinin dolaylı olarak gündeme gelebileceği  üzerinde  durulmaktadır.  Bunu  sağlayacak  olanın  da  esnek olarak ifade edilebilecek oturma yeri anlayışı olduğu ifade olunmaktadır. Oturma yerinin esnek olarak yorumlanmasına bağlı olarak taraﬂ ardan biri, geçici de olsa belli bir eyaleti oturma yeri olarak tayin edebilir ve davasını bu eyalet mahkemesinde açabilir. Dolayısıyla, boşanma davasında o eyaletin hukukunun uygulanmasını isteyen taraf, oturma yerini o eyalete taşıyarak, lex fori nin uygulanmasını mümkün kılabilir; bir başka deyişle, forum shopping yoluna başvurabilir. C. İsviçre Hukuku İsviçre hukukunda, İsviçre Milletlerarası Özel Hukuk Kanununun 59. maddesi uyarınca boşanma ve ayrılık davalarındaki genel yetki kuralı düzenlenmiştir. 59. maddeye göre, davalı eşin yerleşim yerindeki İsviçre mahkemesi ile davacı eşin bir yıldır İsviçre de yerleşik olması (m. 59/a) veya İsviçre vatandaşı olması koşuluyla yerleşik olduğu yer İsviçre mahkemesinin yetkili olduğu belirtilmiştir (m. 59/b).  İsviçre MÖHK un 61. maddesinde ise yetkili İsviçre mahkemesinin, boşanma ve ayrılığa uygulayacağı hukuk düzenlenmiştir. Anılan Kanunun 61. maddesinin ilk fıkrası uyarınca; boşanma ve ayrılığa İsviçre hukuku uygulanır. Bununla birlikte, eşlerin müşterek bir 61 SILBERMAN, s. 2008. 62 SILBERMAN, s. 2009. 63 SILBERMAN, s. 2009. 64 SILBERMAN, s. 2011. 65 SILBERMAN, s. 2011. 66 Federal Act on Private International Law, 18.12.1987 , 1 Temmuz 2014 tarihi itibariyle değişiklikleri içeren İngilizce metin için bkz. www.andreasbucher-law.ch/images/stroies/ pil_act_1987_as_amended_until_1_7_2014.pdf  (Erişim Tarihi: 25.06.2015). 14 Gazi Üniversitesi Hukuk Fakültesi Dergisi C. XIX, Y. 2015, Sa. 3Aslı Bayata CANYAŞ millî hukukunun olması ve bu hukukun, yabancı bir hukuk olması ve eşlerden sadece birinin İsviçre de yerleşim yerinin olması durumunda müşterek millî hukuk uygulanır (m. 61/2). Bu hüküm uyarınca İsviçre hukukunda boşanma davalarında uygulanacak hukukun objektif olarak tayin edildiği ve hukuk seçimi imkânına yer verilmediği açıkça görülmektedir. İsviçre MÖHK unda hukuk seçimi imkânı salt evlilik mallarına ilişkin olarak kabul edilmiştir; bu çerçevede, İsviçre MÖHK nun 52. maddenin ilk fıkrası uyarınca genel kural, evlilik mallarına uygulanacak hukuku taraﬂ arın seçmesidir. Söz konusu maddenin ikinci fıkrasında  eşlerin hukuk seçimine sınırlama  getirilerek  eşlerin,  her  ikisinin  de  yerleşim  yerinin  bulunduğu ya da evliliğin gerçekleşmesinden sonra bulunacağı yerin hukukunu ya da taraﬂ ardan birinin millî hukukunu seçebileceği öngörülmüştür.  D. Çin Hukuku Çin hukukunda, boşanma davaları ile evliliğin anlaşmalı olarak evlilik kayıt makamı önünde sonlanması açısından bir ayrıma gidilerek boşanmaya uygulanacak hukuk farklı şekillerde düzenlenmiştir. Mahkeme huzurundaki boşanma davalarında hâkimin hukuku uygulanırken; taraﬂ arın anlaşarak evlilik kayıt makamı önünde boşanmayı talep ettikleri durumlarda, sınırlı da olsa hukuk seçimi imkânı getirilmiştir ve taraﬂ ardan birinin mutad mesken hukuku ya da millî hukukunun seçilebilmesi mümkün kılınmıştır. Taraﬂ arca bu tür bir anlaşmanın yapılmaması halinde ise taraﬂ arın müşterek mutad mesken hukuku, eğer yoksa müşterek millî hukuku, onun da olmaması halinde boşanma usûlünün yürütüldüğü yer hukukunun uygulanacağı düzenlenmiştir.  67 Millî  hukukun  uygulanmasında  ise  23.  maddenin  ikinci  fıkrasının  uygulanmayacağı belirtilmiştir. (İsviçre Milletlerarası Özel Hukuk Kanunu m. 23/2: Bu Kanun da aksi öngörülmedikçe, uygulanacak hukuk tespit edilirken, bir kişinin birden fazla tâbiiyete sahip olması durumunda, en yakın ilişki içinde olduğu tâbiiyeti münhasıran esas alınacaktır.) 68 Act on the Application of Laws Over Foreign-Related Civil Relationships, 2010, PRC, Order of the President of the People s Republic of China, NO. 36, m. 16 ve m. 17.  Konu hakkında bkz. HUO; Zhengxin, Highlights of China s New Private International Law Act: From the Perspective of Comparative Law, 45 R.J.T., 2011, s. 664. Ayrıca bkz. SYMEONIDES, s. 270. 69 Bkz.  SYMEONIDES, s. 270. Gazi Üniversitesi Hukuk Fakültesi Dergisi C. XIX, Y. 2015, Sa. 3 15Yabancı Unsurlu Boşanma Davalarında Hukuk Seçimi IV. Türk Milletlerarası Özel Hukuku ve Boşanma Davalarında Hukuk Seçimi A. Boşanmaya İlişkin Bağlama Kuralı ve Uygulanacak Hukukun Tespiti Türk  Kanunlar  İhtilâfı  Hukukunda,  yabancı  unsurlu  boşanma davalarında taraﬂ ara hukuk seçimi imkânı tanınmamıştır ve uygulanacak hukukun, Milletlerarası Özel Hukuk ve Usûl Hukuku Hakkında Kanununun (MÖHUK) 70 14. maddesinin ilk fıkrası uyarınca hâkim tarafından objektif olarak tespit edilmesi kabul edilmiştir. MÖHUK un  14.  maddesinin  ilk  fıkrası  uygulanırken,    öncelikle taraﬂ arın  müşterek  millî  hukukunun  olup  olmadığı  araştırılacaktır. Taraﬂ arın müşterek millî hukuku yoksa, müşterek mutad mesken hukukunun varlığı  sorgulanacak;  bunun  da  bulunmaması  durumunda  Türk  hukuku uygulanacaktır. 14. madde uyarınca tespit edilen hukukun,  MÖHUK un 2. maddesinin üçüncü fıkrasında yer alan hüküm nedeniyle, bağlama kurallarının da  dikkate  alınması  gerekmektedir.  Zira,  söz  konusu  hüküm  uyarınca, uygulanacak yabancı hukukun kanunlar ihtilâfı kurallarının başka bir hukuku yetkili kılması, sadece kişinin hukuku ve aile hukukuna ilişkin ihtilâﬂ arda dikkate alınır ve bu hukukun maddî hukuk hükümleri uygulanır. Örneğin, boşanacak eşlerin her ikisinin de X devletinde mutad mesken sahibi olan, farklı devlet vatandaşları olmaları halinde MÖHUK un 14. maddesinin ilk fıkrası çerçevesinde taraﬂ arın müşterek mutad meskeni hukuku sıfatıyla X devletinin hukuku yetkili hukuk olacaktır. Ancak, MÖHUK un 2. maddesinin üçüncü fıkrası uyarınca, hâkimin, X devletinin hukukunun bağlama kurallarını da dikkate alması zorunludur. Böyle bir durumda, X devletinin bağlama kuralları uyarınca  yabancı  unsurlu  boşanma  davalarında  öncelikli  olarak  taraﬂ ara hukuk seçimi imkânı tanınmışsa ve objektif bağlama kuralı ancak taraﬂ arın hukuk seçmediği hallerde uygulanacaksa,  taraﬂ ar da uygulanacak hukuku seçmişlerse, Türk hâkiminin seçilen hukuku uygulaması gerekecektir. 70 Kanun No: 5718, Kabul Tarihi: 27.11.2007, RG 12.12.2007-26728. 71 Taraﬂ arın müşterek millî hukuku varsa, anlaşma yoluyla Türk hukukunun  uygulanmasını istemeleri halinde dahi Türk hukukunun uygulanmasının söz konusu olamayacağı ile ilişkili olarak TEKİNALP, Gülören, Milletlerarası Özel Hukuk Bağlama Kuralları, Vedat, İstanbul, 2009, s. 198. 72 MÖHUK un 2. maddesinin üçüncü fıkrasının uygulanışı ile ilgili olarak bkz. DOĞAN, Vahit, Milletlerarası Özel Hukuk, 3. B., Savaş, Ankara, 2015, s. 193-194;  AKINCI, Ziya/  DEMİR GÖKYAYLA, Cemile, Milletlerarası Aile Hukuku, Vedat, İstanbul, 2010, s. 3-4; UYANIK ÇAVUŞOĞLU, Boşanma, s. 37-39. 73 Hukuk seçimi yoluyla taraﬂ arın, hâkimin hukukunu (Türk hukuku) seçtiği durumlarda 16 Gazi Üniversitesi Hukuk Fakültesi Dergisi C. XIX, Y. 2015, Sa. 3Aslı Bayata CANYAŞ Boşanmaya ilişkin olarak Türk kanunlar ihtilâfı hukukunda hukuk seçimi imkânı öngörülmemiş olmakla birlikte,  MÖHUK m. 14 de yer alan basamaklı bağlama sisteminde, taraﬂ arın müşterek millî hukuku ve taraﬂ arın ayrı vatandaşlıkta olmaları halinde  müşterek mutad mesken hukukunun uygulanmasının söz konusu olduğu durumlarda, müşterek millî hukukun veya mutad mesken hukukunun hukuk seçimine imkân tanıması durumunda, hâkimin MÖHUK m. 2/3 hükmünün uygulanması sonucunda seçilen hukuku uygulaması, yani hukuk seçimine, seçilen hukukun izin verdiği ölçüde etki tanıması mümkündür. MÖHUK (m. 15/1) uyarınca  evlilik malları ile ilgili olarak ve sınırlı bir hukuk seçimi imkânına yer verilmiş iken, evliliğin şartları, hüküm ve sonuçları, velayet, boşanma gibi konularda getirilmiş olan bağlama kuralları uyarınca taraﬂ arın, uygulanacak hukuku seçme imkânına sahip olmadığı görülmektedir. Bununla birlikte, yukarıda verilen örnekte belirtildiği gibi, hukuk seçimine etki tanınması, MÖHUK un emredici nitelikteki 2. maddesinin üçüncü fıkrasının uygulanması sonucu ortaya çıkabilmektedir. Bu durumda, yetkili yabancı hukukun ilgili bağlama kuralını ve bu kapsamda, boşanma davasında hukuk seçme imkânı getiren düzenlemesini dikkate almamak, MÖHUK un emredici nitelikteki 2. maddesinin üçüncü fıkrasına aykırı olacaktır.  Sonuç olarak, Türk hâkimin boşanmaya ilişkin bağlama kuralı uyarınca (MÖHUK m. 14) tespit edilen yabancı hukuku, re sen bulup uygulamasının gereği (MÖHUK m. 2/1) olarak hukuk seçme imkânının varlığına ulaşılmış olmaktadır. Bu noktada, Türk hukukunda boşanmaya uygulanacak hukuk konusunda taraﬂ ara uygulanacak hukuku belirleme imkânı tanınmadığı için, MÖHUK m. 2/3 ün uygulanması sonucunda, yetkili yabancı hukukun boşanma davasında hukuk seçimi olanağı sunan sübjektif bağlama kuralına değil de, uygulanacak hukukun hâkim tarafından belirlenmesi imkânını getiren objektif bağlama kuralına başvurulması düşünülebilir mi? Kanımızca, bu noktada sübjektif ve objektif bağlama kurallarından hangisinin öncelikli olduğu konusunda yabancı hukukun anlayışına göre hareket edilmelidir. Türk kanunlar ihtilâfı hukuku tek dereceli atıf (iade atıf, geriye dönen atıf, geri dönen atıf); taraﬂ arın üçüncü bir devlet hukukunu seçmeleri durumunda ise iki dereceli atıf (devam eden atıf) söz konusu olacaktır. Türk  hâkimi  her  durumda  seçilen  hukukun  maddî  hukuk  kurallarını  uygulayacaktır. (MÖHUK m. 2/3 ). Atıf hakkında bkz. NOMER, s. 151-152; ÇELİKEL/ ERDEM, s. 119; ŞANLI, s. 53; DOĞAN, s. 190; TEKİNALP, s. 41.  MÖHUK uyarınca salt  kişinin hukuku ve aile hukukuna ilişkin uyuşmazlıklarda Türk bağlama kuralının yollamada bulunmuş olduğu yabancı hukukun bağlama kurallarının başka bir hukuku yetkili kılmasının dikkate alınacağı ile ilgili olarak bkz. AYBAY/DARDAĞAN, s. 172-173. 74 DOĞAN, s. 194. Gazi Üniversitesi Hukuk Fakültesi Dergisi C. XIX, Y. 2015, Sa. 3 17Yabancı Unsurlu Boşanma Davalarında Hukuk Seçimi anlayışı çerçevesinde, yabancı hukukun, vakıa olarak değil de hukuk olarak uygulanması ve Türk hâkimin, yabancı hukuku, yabancı hâkimin onu uyguladığı şekliyle uygulamak zorunda oluşu da vardığımız sonucu desteklemektedir. Bu durumda, örneğin, Türk mahkemesi önünde açılan bir davada, MÖHUK m. 14 den hareketle X devlet hukuku yetkili hukuk olarak tespit edildiğinde, bu hukukun  uygulanacak hukukun objektif olarak tespitini öngören hükmü, ancak taraﬂ arca hukuk seçimi yapılmadığında gündeme gelmektedir.  Bir  başka  deyişle,  yabancı  bağlama  kuralları  bünyesinde öncelikli olan, taraﬂ arın hukuk seçme yönündeki iradelerinin olup olmadığıdır. Dolayısıyla, Türk hukukunun bağlama kuralları ile yetkili kılınan  yabancı hukukun bağlama kuralları açısından öncelikle bakılması gereken, taraﬂ arın hukuk  seçme  yönünde  iradelerinin  olup  olmadığıdır.  Objektif  bağlama kuralının  uygulanması  ise  ancak  taraﬂ arın  böyle  bir  iradesinin  olmadığı durumlarda söz konusu olacaktır. Taraf iradesini öne çıkaran bu sonuç, boşanma hukuku alanında hem maddî hukuk hem kanunlar ihtilâfı hukuku alanında etkili olmaya başladığı ileri sürülen liberalleşme eğilimleri ile  uyumlu gözükmektedir.  B. Kamu Düzenine Aykırılık İhtimalinin Değerlendirilmesi Kamu düzenine aykırılık başlıklı MÖHUK un 5. maddesi uyarınca, yetkili yabancı hukukun somut olaya uygulanan hükmünün Türk kamu düzenine açıkça  aykırılık  teşkil  etmesi  durumunda,  bu  hükmün  uygulanmasından vazgeçilecektir. Bu noktadan itibaren, duruma göre, ya salt yetkili yabancı hukukun  Türk  kamu  düzenini  bozan  hükmünün  uygulanmaması  yeterli olabilecek  (kamu  düzeninin  olumsuz  etkisi)  ya  da  bazen  uygulanmayan bu hükmün yerine hâkimin hukukundan bir hükmün uygulanması (kamu düzeninin önce olumsuz; sonra olumlu etkisi) gereği ortaya çıkabilecektir. 75 ŞANLI, Cemal/ ESEN, Emre/ ATAMAN FİGANMEŞE, İnci, Milletlerarası Özel Hukuk, 3.B., Vedat, 2014, s. 62-63; AYBAY, Rona/ DARDAĞAN, Esra, Uluslararası Düzeyde Yasaların Çatışması (Kanunlar İhtilafı), 2. B., İstanbul Bilgi Üniversitesi Yayınları, 2008, s. 114; NOMER, s. 193-194; ÇELİKEL/ERDEM, s. 174; DOĞAN, s. 212-213. 76 NOMER s. 196; ÇELİKEL/ ERDEM, s. 175. 77 Konu hak. bkz. GAERTNER, s. 112.  78 Kamu düzeninin etkisi, olumsuz veya önce olumsuz sonra olumlu olabilir. Yetkili yabancı hukukun uygulanmasından kamu düzenine aykırılık nedeniyle vazgeçilmesi olumsuz etkidir. Bu etkiden sonra ise, hâkim kendi hukukunu uygulayacaktır ve bu şekilde önce olumsuz, ardından olumlu etki gündeme gelecektir: BERKİ, Osman Fazıl, Devletler Hususî Hukuku, B.6, C. II, Ankara, 1966, s. 84; TİRYAKİOĞLU, Bilgin, Taşınır Mallara İlişkin Milletlerarası Unsurlu Satım Akitlerine Uygulanacak Hukuk, AÜHF Yayınları, Ankara, 1996, s. 77; TANRIBİLİR, Feriha Bilge, 5718 Sayılı Milletlerarası Özel Hukuk ve Usûl Hukuku 18 Gazi Üniversitesi Hukuk Fakültesi Dergisi C. XIX, Y. 2015, Sa. 3Aslı Bayata CANYAŞ Ancak,  kanunlar  ihtilâfı  hukukunda,  kamu  düzenine  aykırılık  sonucunda gerçekleşecek müdahalenin istisnaî niteliği ve amacın olabildiğince yetkili yabancı hukuku uygulamak olduğu gözden uzak tutulmamalıdır. Bu noktada, yabancı hukukun Türk hukukundan farklı bir düzenleme öngörüyor oluşunun da doğrudan kamu düzenine aykırılık sonucunu doğurmaması gerektiğine dikkat edilmelidir.  Yabancı unsurlu boşanma davasında, MÖHUK m. 14 uyarınca yetkili olan hukukun, MÖHUK un 2. maddesinin üçüncü fıkrasının gereği olarak, bağlama kurallarının hukuk seçimine yer vermesi halinde, seçilen hukukun uygulanmasının Türk kamu düzenine açıkça aykırılık teşkil edeceğini ileri sürerek  seçilen  hukuku  uygulamamak  kanunlar  ihtilâfı  hukukunda  kamu düzeninin istisnaî niteliğini inkâr etmek anlamına gelecektir. Burada asıl tartışılması gereken, seçilen hukukun, somut olaya uygulanan hükümlerinin Türk kamu düzenine açıkça aykırılık teşkil edip etmediğidir. Bu noktada, Türk hâkimi tarafından, yabancı unsurlu bir boşanma davasında MÖHUK m. 14 uyarınca yetkili hukukun bulunması ve yine MÖHUK m. 2/3 gereğince yetkili hukukun hukuk seçimine imkân veren sübjektif bağlama kuralının, dolayısıyla seçilen hukukun uygulanması söz konusudur. Yetkili yabancı hukukun hukuk seçimine imkân tanıyor olması, başlı başına kamu düzenine aykırılık olarak değerlendirilmemelidir. Bu doğrultuda, Türk hakiminin MÖHUK m. 14 çerçevesinde tespit ettiği yetkili hukukun, MÖHUK un 2. maddesinin 3. fıkrası çerçevesinde, bağlama kurallarının uygulanması sonucunda boşanmaya taraﬂ arın seçtiği hukukun uygulanmasının, başlı başına,  adalet anlayışımıza ilişkin temel kimi ilkeleri ve vazgeçilemeyecek nitelikteki hukukî ve toplumsal değerleri sarsacak bir durum olduğunu ileri sürmek, kanunlar ihtilâfı hukukunda kabul edilen kamu düzeni anlayışıyla bağdaşmaz. Önemli olan, seçilen hukukun uygulanması halinde,  örneğin aileye ilişkin kamusal ve toplumsal kimi menfaatlerin Hakkında Kanun un Genel Hükümlerinde Yapılan Değişiklikler Üzerine, TBB Dergisi, S. 87, 2010, s. 216.   79 Konu hakkında bkz. NOMER, s. 160-161; ÇELİKEL/ ERDEM, s. 153. 80 NOMER, s. 162; ÇELİKEL/ERDEM, s. 158; DOĞAN, s. 220. 81 Kamu düzeni müdahalesine ilişkin olarak bkz.  DOĞAN, s. 156; NOMER, s. 157; TİMUR, Hıfzı, Devletler Hususî Hukukunda Amme İntizamı, İÜHFM, C. 7, S.1, Y. 1941, s. 902; ÖKÇÜN, Ahmet Gündüz, Devletler Hususî Hukukunun Kaynakları ve Kamu Düzeni, Ankara, 1997, s. 102; GÜRZUMAR, Aydanur, Türk Devletler Özel Hukuku Açısından Boşanma Davalarında Kamu Düzeninin Etkileri, MHB, Yıl:14, S. 1-2, 1994, s. 22; UYANIK ÇAVUŞOĞLU, Boşanma, s. 32-36. Gazi Üniversitesi Hukuk Fakültesi Dergisi C. XIX, Y. 2015, Sa. 3 19Yabancı Unsurlu Boşanma Davalarında Hukuk Seçimi açıkça zedelenmesinin söz konusu olup olmayacağıdır. Örneğin, taraﬂ arca belirlenmiş olan yetkili yabancı hukukun zinaya dayalı olarak sadece erkeğe boşanma hakkı tanıması; kadın bakımından ise bu hakkı tanımaması kadınerkek eşitliğine aykırı olacağından Türk kamu düzenine aykırılık açısından değerlendirilebilir. SONUÇ Boşanma hukuku konusunda giderek daha liberal bir anlayışın (favor divortii) benimsenmeye başladığı ve bu anlayışın maddî hukuk alanında olduğu gibi  kanunlar ihtilâfı hukukunda da kendini hissettirdiği görülmektedir. Maddî hukuk çerçevesinde, yasak olduğu kimi ülkelerde boşanmanın mümkün hale gelebildiği, boşanma koşullarının daha esnek  hale getirilebildiği ya da  boşanma  usûlünün  daha  kolaylaştırılabildiği  görülmektedir.  Kanunlar ihtilâfı hukuku açısından ise kimi hukuk düzenlerinde genelde sınırlı da olsa boşanmaya uygulanacak hukuku seçme yönünde bir anlayışın yeşermeye başladığı görülmektedir.  Avrupa Birliğinde Roma 3 Tüzüğü kapsamında,  yabancı unsurlu boşanma davalarında hukuk seçimi imkânının sınırlı da olsa tanınmış olması bu gelişmenin en önemli yansımalarından biridir. Türk kanunlar ihtilâfı hukukunda boşanmaya  uygulanacak hukukun objektif olarak belirlendiği ve hukuk seçimine imkân verilmediği görülmekle birlikte (MÖHUK m. 14), taraﬂ arın yaptığı hukuk seçimine  MÖHUK un 2.  maddesinin  üçüncü  fıkrasının  uygulanması  sonucunda  etki  tanınması mümkündür.  Bu şekilde, Türk hâkimi, yabancı hukuku, yabancı hâkimin onu uyguladığı şekliyle de uygulamış olacaktır. Yabancı hukukun boşanma davalarında hukuk seçimi imkânı sunan hükmünün uygulanmasının, aileye ilişkin  kamusal  ve  toplumsal  menfaatleri  zedeleyebilecek  nitelikte  bir konu olarak düşünülmesi ise mümkün gözükmemektedir. Bununla birlikte, boşanmaya uygulanacak olan yetkili yabancı hukukun somut olaya uygulanan hükmünün, Türk kamu düzenine açıkça aykırı olması durumunda bir müdahale söz konusu olacaktır. 20 Gazi Üniversitesi Hukuk Fakültesi Dergisi C. XIX, Y. 2015, Sa. 3Aslı Bayata CANYAŞ",
     "Kaynakça": "AKINCI,  Ziya/  DEMİR  GÖKYAYLA,  Cemile,  Milletlerarası Aile Hukuku, Vedat, İstanbul, 2010. AYBAY, Rona/ DARDAĞAN, Esra, Uluslararası Düzeyde Yasaların Çatışması (Kanunlar İhtilafı), 2. B., İstanbul Bilgi Üniversitesi Yayınları, 2008. BAARSMA,  Nynke,  The  Europeanisation  of  International  Family Law,  T.M.C.  Asser  Press,  Springer,  Groningen,  2011.  (Baarsma,  The Europeanisation) BAARSMA, Nynke, Communitarisation of Choice of Law Rules on Divorce and Termination of Registered Partnerships,  www.rug.nl/research/ gradschool-law/phd/paper-nynke-baarsma.pdf, s.1-7. BAYRAKTAROĞLU ÖZÇELİK, Gülüm, Roma III Tüzüğü Uyarınca Boşanma ve Ayrılığa Uygulanacak Hukukun Tayini ve Uygulanması, Ankara Üniversitesi Hukuk Fakültesi Dergisi, 61(2) 2012, s. 505-539. BERKİ, Osman Fazıl, Devletler Hususî Hukuku, B.6, C. II, Ankara, 1966. BOELE-WOELKI,  K./  VAN  ITERSON,  D.,  The  Dutch  Private International Law Codification: Principles, Objectives and Opportunities, Electronic Journal of Comparative Law, C. 14/3, 2010, s. 1-31. ÇELİKEL, Aysel/ ERDEM, Bahadır, Milletlerarası Özel Hukuk, 13.B., Beta, İstanbul, 2014. DETHLOFF, Nina, Arguments for the Unification and Harmonisation of Family Law in Europe, Perspectives for the Unification and Harmonisation in Europe (Ed. Katharina Boele- Woelki), Intersentia, Antwerp-Oxford-New York, 2003. DE VIDO, Sara, The Relevance of Double Nationality to Conﬂ ict of Laws Issues Relating to Divorce and Legal Separation in Europe, Cuadernos de Derecho Transnacional, C.4, N.1, 2012, s. 2222-2232. DOĞAN, Vahit, Milletlerarası Özel Hukuk, 3. B., Savaş, Ankara, 2015. EHRENZWEIG, Albert, The Lex Fori: Basic Rule in the Conﬂ ict of Laws, Michigan Law Review, 58/5, 1960, s. 637-688. Gazi Üniversitesi Hukuk Fakültesi Dergisi C. XIX, Y. 2015, Sa. 3 21Yabancı Unsurlu Boşanma Davalarında Hukuk Seçimi EKŞİ, Nuray, Milletlerarası Özel Hukukta Medeni Olmayan Evliliklerin ve Adli Olmayan Boşanmaların Tanınması, Seçkin, İstanbul, 2012. FIORINI,  Aude,  Rome  III-Choice  of  Law  in  Divorce:  Is  the Europeanization of Family Law Going Too Far?, International Journal of Law, Policy and the Family, 22, 2008, s. 178-205. FRANZINA,  Pietro,  The  Law  Applicable  to  Divorce  and  Legal Separation Under Regulation (EU) No. 1259/2010 of 20 December 2010, Cuadernos de Derecho Transnacional (Octubre 2011), C.3, N.2, 2011, s. 85129. GAERTNER, Veronika, European Choice of Law Rules in Divorce (Rome III): An Examination of the Possible Connecting Factors in Divorce Matters Against the Background of Private International Law Developments, Journal of Private International Law, 2006, C. 2, N. 1, s. 99-136. GÜRZUMAR,  Aydanur,  Türk  Devletler  Özel  Hukuku  Açısından Boşanma Davalarında Kamu Düzeninin Etkileri, MHB, Yıl:14, S. 1-2, 1994, s. 21-54. HUO, Zhengxin, Highlights of China s New Private International Law Act: From the Perspective of Comparative Law, 45 R.J.T., 2011, s. 641-684. JAYME, Erik, Party Autonomy in International Family and Succession Law: New Tendencies, Yearbook of Private International Law, C. 11, 2009, s. 1-10. KALKAN OĞUZTÜRK, Burcu, A General Perspective to the History and the Harmonisation Idea of Family Law in Europe, Annales de la Faculté de Droit d Istanbul, C. 41, S. 58, 2009, s. 181-195. KRVAVAC, Marija/ BELOVIC, Jelena, Communitarisation of Private International Law Rules on Party Autonomy in European Union, International Journal of Business, Humanities and Technology, C. 4, N.3, 2014, s. 54-68. MARINA, Simone, Matrimonial Matters and the Harmonization of Conﬂ ict of Laws: A Way to Reduce the Role of Public Policy As A Ground For Non-Recognition of Judgments, Yearbook of Private International Law (Ed. BONOMI, Andrea/ ROMANO, Gian Paolo),  C. 13, 2011, s. 255-272. MCELEAVY, Peter, The Communitarization of Divorce Rules: What Impact for English and Scottish Law?, International and Comparative Law Quarterly, 53, 2004, s. 605-642.  22 Gazi Üniversitesi Hukuk Fakültesi Dergisi C. XIX, Y. 2015, Sa. 3Aslı Bayata CANYAŞ MORRIS,  J.,  Conﬂ ict  of  Laws,  London,  Sweet&Maxwell,  5.  B., London, 2000. NAGY, Csongor Istvan, What Functions May Party Autonomy Have in International Family and Succession Law? An EU Perspective, Nederlands Internationaal Privaatrecht, 4, 2012, s. 576- 586. NOMER, Ergin, Devletler Hususî Hukuku, 21.B., Beta, 2015. ÖKÇÜN, Ahmet Gündüz, Devletler Hususî Hukukunun Kaynakları ve Kamu Düzeni, Ankara, 1997. PEARI, Sagi, Choice of Law in Family Law: Kant, Savigny and the Parties Autonomy Principle, Nederlands Internationaal Privaatrecht, 4, 2012, s. 597-604. PFEIFFER, Magdalena, Choice of Law in International Family and Succession Law, The Lawyer Quarterly, 4/2012, s. 291-305. SILBERMAN, Linda J., Rethinkig Rules of Conﬂ ict of Laws in Marriage and Divorce in the United States: What Can We Learn From Europe?, Tulane Law Review, C. 82, 2007-2008, s. 1999-2020.  SYMENONIDES, Symeon C., Codifying Choice of Law Around the World- An International Comparative Analysis, Oxford University Press, New York, 2014. ŞANLI,  Cemal/  ESEN,  Emre/  ATAMAN  FİGANMEŞE,  İnci, Milletlerarası Özel Hukuk, 3.B., Vedat, 2014. TANRIBİLİR, Feriha Bilge, 5718 Sayılı Milletlerarası Özel Hukuk ve Usûl Hukuku Hakkında Kanun un Genel Hükümlerinde Yapılan Değişiklikler Üzerine, TBB Dergisi, S. 87, 2010, s. 195-227.  TEKİNALP, Gülören, Milletlerarası Özel Hukuk Bağlama Kuralları, Vedat, İstanbul, 2009. TİMUR, Hıfzı, Devletler Hususî Hukukunda Amme İntizamı, İÜHFM, C. 7, S.1, Y. 1941, s. 866-905. TİRYAKİOĞLU, Bilgin, Taşınır Mallara İlişkin Milletlerarası Unsurlu Satım Akitlerine Uygulanacak Hukuk, AÜHF Yayınları, Ankara, 1996. TORGA, Maarja, Party Autonomy of the Spouses Under the Rome III Regulation in Estonia-Can Private International Law Change Substantive Gazi Üniversitesi Hukuk Fakültesi Dergisi C. XIX, Y. 2015, Sa. 3 23Yabancı Unsurlu Boşanma Davalarında Hukuk Seçimi Law?, Nederlands Internationaal Privaatrecht, 4, 2012, s. 547-554. UYANIK ÇAVUŞOĞLU, Ayfer, Avrupa Birliği nde Aile Hukukunu Birleştirme Çalışmaları, Ata Sakmar a Armağan, Galatasaray Üniversitesi Hukuk Fakültesi Dergisi, 2011/1, s. 213-240. UYANIK  ÇAVUŞOĞLU,  Ayfer  Uyanık,  Türk  Milletlerarası  Özel Hukukunda Boşanma, Beta, İstanbul, 2006. (Uyanık Çavuşoğlu, Boşanma) WESTCOTT, John (Ed.), Family Mediation: Past, Present and Future,  Jordan Publishing, Bristol, 2004. WILLS, Mary M., Conﬂ icts of Law in Divorce Litigation: A LookingGlass World?, Campbell Law Review, V. 10/1, 1987, s. 145-166. VIARENGO, Ilaria, The Role of Party Autonomy In Cross-Border Divorces, Nederlands Internationaal Privaatrecht, 4, 2012, s.  555-561. YETONA, Toni Marzal, The Constitutionalisation of Party Autonomy in European Family Law, Journal of Private International Law, C. 6.N.1, s. 155- 193. www.andreasbucherlaw.ch/images/stroies/pil_act_1987_as_amended_ until_1_7_2014.pdf (erişim 25.06.2015) www.doi.gov.mt (erişim 29.06.2015) www.ec.europa.eu/justice_home/judicialatlascivil/html/di_ information_en.html (erişim 15.06.2015) 24 Gazi Üniversitesi Hukuk Fakültesi Dergisi C. XIX, Y. 2015, Sa. 3"
}