{
     "Tip": "Makale",
     "Dergi İsmi": "Sakarya Üniversitesi Hukuk Fakültesi Dergisi",
     "Üniversite İsmi": " ",
     "Gün": "10",
     "Ay": "05",
     "Yıl": "2021",
     "Cilt": "8",
     "Sayı": "1-2",
     "Başlık": "İngiltere ve Galler Ceza Muhakemesi Hukukunda Yargılama Makam ve Süjeleri",
     "Title": "Judicial Authorities and Agents in the Criminal Procedure Law of England and Wales",
     "Yazar İsmi": [

          "Dr. Öğr. Üyesi Mehmet MADEN"
     ],
     "Danışman İsmi": "",
     "Anahtar Kelimeler": [
          "İngiltere ve Galler Ceza Muhakemesi Hukuku", "Jüri Yargılaması", "Sulh Mahkemesi", "Kraliyet Mahkemesi", "Yargıç"
     ],
     "Keywords": [
          "Criminal Procedure Law of England and Wales", "Jury Trial", "Magistrates’ Court,", "Crown Court", "Judge"
     ],
     "Özet": "İngiltere ve Galler ceza muhakemesi, yargılama makam ve süjeleri bakımından oldukça farklı özelliklere sahiptir. Yarı zamanlı yargıçların; gönüllü yargıçların ve hukukçu olmayan yargıçların bulunması ve jüri yargılaması dikkat çekicidir. Sulh mahkemelerinde kısa yargılama; Kraliyet Mahkemesi nde jürili yargılama usulü uygulanmakta ve suçlar, yargılama usulüne göre tasnif edilmektedir. Zanlının, suçluluk veya suçsuzluk beyanında bulunması, uygulanacak usul ve verilecek yaptırım hükmü açısından önem arz etmektedir. Yargıçlara farklı ünvanlar verilmiştir. Bu çalışmada, belirtilen yargılama makam ve süjeleri ana hatlarıyla izah edilmeye çalışılmış; yargılama süreci hakkında da kısmi açıklamalarda bulunulmuştur. Bu bağlamda, sulh mahkemeleri; Kraliyet Mahkemesi; Yüksek Mahkeme; Temyiz Mahkemesi ve Yüksek Temyiz Mahkemesi, teşekkülleri ve yetkileri bakımından incelenmiştir.",
     "Abstract": "Criminal procedure of England and Wales has quite different features with regards to judicial authorities and agents. Existence of part time judges, voluntary judges and lay judges and the jury trial are remarkable. Summary trial takes place in the magistrates  courts and trial with jury takes place in the Crown Court and the offences are classified according to their way of trial. Pleading guilty or not guilty of the defendant is important for the procedure to be implemented and the sentence to be given. Judges are given different titles. In this study, an overview of the mentioned judicial authorities and agents has been tried to be given and partial explanations upon the judicial process have been made. In this context, magistrates  courts; Crown Court; High Court; Court of Appeal and the Supreme Court have been examined with regards to their composition and jurisdiction.",
     "Metin": "İngiltere ve Galler, ceza yargılaması bakımından, birçok hususta özellik arz etmektedir. Bu çalışmada, İngiltere ve Galler ceza muhakemesi yargılama makam ve süjeleri ile ceza yargılamasının işleyişi, genel hatlarıyla ortaya konulmaya çalışılmıştır. Bu bağlamda, sulh mahkemeleri (magistrates  courts); Kraliyet Mahkemesi (Crown Court); Yüksek Mahkeme (High Court); Temyiz Mahkemesi (Court of Appeal) ve Yüksek Temyiz Mahkemesi (Supreme Court), görevleri ve personeli bakımından ele alınmıştır.Common law sistemine dâhil olan diğer ülkeler -diğer Birleşik Krallık ülkeleri olan İskoçya ve Kuzey İrlanda da dâhil olmak üzere-, bu çalışmanın konusunu oluşturmamaktadır. İddia ve savunma makamlarıyla ve süjeleriyle ilgili konular da bu çalışmanın esas konusu içinde yer almamaktadır. Yine, sadece gençler için kurulmuş bir mahkeme olmanın ötesinde, çok sayıda farklı usulün uygulandığı, oturumlara yalnızca özel eğitimli sulh yargıçlarının ve yargıçların katılabildiği Gençlik Mahkemesi de bu çalışmada ayrıca ele alınmamıştır.Aşağıda, yargılama usulüne göre suçların tasnifi konusu ele alındıktan sonra, sırasıyla, sulh mahkemeleri, Kraliyet Mahkemesi ve temyiz başvurularını incelemekle görevli mahkemeler inceleme konusu yapılmıştır.2. Yargılama Usulüne Göre Suçların Tasnifiİngiltere de ve Galler de, neredeyse bütün ceza davalarının ilk görüldüğü mahkeme, sulh mahkemesidir.Yargılama  usulü  bakımından  suçlar,  Ceza  Hukuku  Yasası  1977  ile  üçe ayrılmıştır. Bunlar; sadece ithamnameye dayalı olarak yargılanabilen (triable only on indictment) suçlar; sadece kısa yargılamaya tâbi (triable only summarily) suçlar ve her iki şekilde yargılanması mümkün olan (triable either way) suçlardır.En ağır olarak telakkî edilen suçlarla ilgili yargılama, sadece ithamnameye dayalı olarak, Kraliyet Mahkemesi nde yapılır; her iki şekilde yargılanması mümkün olan suçlar ise orta şiddette olduğu telakkî edilen suçlardır. Her iki şekilde 1  Howard Riddle/Robert Zara, Essential Magistrates  Courts Law, Waterside Press, 2019, s. 228-229.2  Criminal Procedure Rule Committee, Criminal Procedure Rules and Practice Directions 2020 (Guidance), <www.gov.uk/guidance/rules-and-practice-directions-2020> Erişim Tarihi 28 Mart 2021.3   Summary trial  için, sulh mahkemelerinde işleyen yargılama usulü olduğu;  summary justice  için de, basit ve hızlı olmasının amaçlandığı ifade edilmiştir: Riddle/Zara, s. 226. Türkçemize,  summary conviction ,  jürisiz yargılama yoluyla mahkûmiyet  şeklinde;  summary procedure  ise  hızlı yargılama usulü  şeklinde tercüme edilmiştir: Rona Aybay, An Introduction to Law, Alfa Basım Yayım Dağıtım, 2013, s. 320.4  Andrew Ashworth, Sentencing and Criminal Justice, 5th Edition, Cambridge University Press, 2010, s. 1.Sakarya Üniversitesi Hukuk Fakültesi Dergisiİngiltere ve Galler Ceza Muhakemesi Hukukunda Yargılama Makam ve Süjeleri 13yargılanması mümkün olan suçlar bakımından, zanlının suçluluk veya suçsuzluk beyanında (plea) bulunması, mahkemelerin yargılama yetkisinin tespitinde önem arz etmektedir. Suçluluk beyanında bulunulması durumunda, yargılama sulh mahkemesinde yapılır ancak sulh mahkemesi kendi yetkisinin dışında bir yaptırım hükmü (sentence) verilebileceği kanaatine ulaşırsa, yaptırım hükmünün verilmesi Kraliyet Mahkemesi ne bırakılır. Diğer bir anlatımla, zanlı, bir suçtan dolayı sulh mahkemesince mahkûm edilse bile, dava, bu suçtan dolayı yaptırım hükmünün verilmesi için Kraliyet Mahkemesi ne sevk edilebilir. Suçsuzluk beyanında bulunulması hâlinde, davanın nerede görüleceğine sulh yargıçları karar verir ancak, suçsuzluk beyanında bulunma düşüncesinde olan zanlının, Kraliyet Mahkemesi nde yargılanmayı tercih etme hakkı bulunmaktadır.En hafif suçlar, sadece kısa yargılamaya tâbi olarak sulh mahkemelerinde görülür. Bu suçlar, hapis cezası gerektirmeyen ya da altı ay veya daha kısa süreli hapis cezasıyla karşılık bulan suçlardır. Sulh Mahkemeleri Yasası 1980 in 132 nci maddesine göre, sulh mahkemelerinin verebileceği hapis cezasının alt sınırı beş gündür. Bu mahkemelerde, nispeten nadir olarak hapis cezası verilir ve şartla salıverme bir seçenek olarak sıklıkla tercih edilir.3. Sulh MahkemeleriSulh mahkemelerinde ceza yargılaması, jürisiz olarak, sulh yargıçları veya bir sulh mahkemesi bölge yargıcı tarafından yapılır.Sulh yargıçları, nadiren hukukçudur ve görevleri karşılığında kendilerine bir ödeme yapılmaz, fakat masraflarının karşılanmasını talep edebilirler. Gerek dava bakmaya başlamadan önce gerekse kariyerleri boyunca eğitim verilen sulh yargıçları, düzenli olarak değerlendirmeye tâbi tutulurlar.5  Michael Cavadino/James Dignan, The Penal System an Introduction, 4th Edition, Sage Publications, 2007, s. 3-4, 9; Ashworth, s. 1.6  Criminal Procedure Rule Committee, <www.gov.uk/guidance/rules-and-practice-directions-2020> Erişim Tarihi 28 Mart 2021.7  Cavadino/Dignan, s. 3-4; Ashworth, s. 1.8  Ashworth, s. 1. Bu suçların ithama dayalı olarak yargılanabilen suçlarla bağlantı içinde olması durumunda farklı hükümler uygulanır: Riddle/Zara, s. 21.9  Riddle/Zara, s. 21.10  Peter Joyce, Criminal Justice an Introduction, Routledge, 2013, s. 317.11  Riddle/Zara, s. 19.12  Riddle/Zara, s. 19.13  Judicial Office, Judiciary UK Website (Courts and Tribunals Judiciary), <www.judiciary.uk/about-the-judiciary/judges-career-paths/becoming-a-magistrate/> Erişim Tarihi 19 Mart 2021.14  Judicial Office, <www.judiciary.uk/about-the-judiciary/judges-career-paths/becoming-a-magistrate/> Erişim Tarihi 20 Mart 2021.Cilt: 8 | Sayı: 1-2 | Temmuz-Aralık 202014 Dr. Öğr. Üyesi Mehmet MADENİçinde bulundukları cemiyetin sorumlu ve saygı duyulan kişilerinden belirlenen sulh yargıçlarının sayısı yirmi üç bin civarındadır. Sulh yargıçlığı için aranan ölçütler, iyi karakter; kavrama ve iletişim; sosyal farkındalık; olgunluk ve sağlam mizaçlılık; kuvvetli muhakeme; işe bağlılık ve güvenilirliktir. Kamunun, yargının tarafsızlığına olan güvenini korumak için, belli işlerde çalışanlar (örneğin polis görevlileri) sulh yargıcı olamazlar. Atanabilme yaşı on sekiz, emeklilik yaşı yetmiş olarak belirlenmiş olan sulh yargıçları, yılda en az yirmi altı yarım gün mahkeme oturumlarına katılmak için vakit ayırabilmelidir.Sulh yargıçları, hukuki konularda, Mahkemeler ve Yargı Heyetleri (Yargı Erki ve Personelin Görevleri) Yasası 2018 de  atanmış görevli  (designated officer) olarak geçen, daha önceleri  yargıçların kâtibi  (justices  clerk) ünvanı taşıyan, günlük kullanımda hukuk müşaviri (legal adviser) olarak anılan mahkeme personeli tarafından bilgilendirilir. Bu kişilerin görevi, davadaki olgular hakkında karar vermek veya bunlarla ilgili olarak heyeti etkilemek değildir. Hukuk müşavirleri, Lord Baş Yargıç tarafından tayin edilirler ve bütün hukuksal ve yargısal konularda sadece ona karşı sorumludurlar.Lord Baş Yargıç, yargı erkinin başıdır ve bu görevini Lord Chancellor dan devralmıştır. Yüzyıllardır baş yargıç, yargı erkinin başı ve kabine bakanı olan Lord Chancellor ın statüsü, Anayasal Reform Yasası 2005 ile, esaslı biçimde değiştirilmiştir; kendisi, hükümetin, yargı erkinden ve mahkeme sisteminden sorumlu bakanı olmaya devam etse de yargıçlık ve yargı erkinin başı olma görevleri sona ermiştir. Belirtelim ki İngiltere de, Mayıs 2007 ye kadar bir Adalet Bakanlığı (Ministry of Justice) da mevcut değildir.Yaptırım  hükmünü  belirlerken  sulh  yargıçlarına  yardım  etmek  üzere  yaptırım hükmü öncesi rapor un hazırlanması, denetimli serbestlik görevli15  Helen Gubby, English Legal Terminology Legal Concepts in Language, 4th Edition, Eleven International Publishing, 2016, s. 25.16  Judicial Office, <www.judiciary.uk/about-the-judiciary/judges-career-paths/becoming-a-magistrate/> Erişim Tarihi 19 Mart 2021.17  Judicial Office, <www.judiciary.uk/about-the-judiciary/judges-career-paths/becoming-a-magistrate/> Erişim Tarihi 20 Mart 2021.18  Judicial Office, <www.judiciary.uk/about-the-judiciary/judges-career-paths/becoming-a-magistrate/> Erişim Tarihi 20 Mart 2021.19  Judicial Office, <www.judiciary.uk/about-the-judiciary/judges-career-paths/becoming-a-magistrate/> Erişim Tarihi 20 Mart 2021.20  Riddle/Zara, s. 20 ve 222.21  Riddle/Zara, s. 222.22  Riddle/Zara, s. 222.23  Gubby, s. 25.24  Gubby, s. 25.25  Gubby, s. 25.Sakarya Üniversitesi Hukuk Fakültesi Dergisiİngiltere ve Galler Ceza Muhakemesi Hukukunda Yargılama Makam ve Süjeleri 15sinin vazifesidir. Bu rapor, ilgili suçun analizini; suçluya dair ilgili bilgileri ve suçlunun zarar verme ve yeniden suç işleme riskinin değerlendirmesini içerir ve yaptırım hükmü için açık ve gerçekçi bir öneriyle son bulur.Önceleri  maaşlı sulh yargıcı  olarak bilinen tam zamanlı ve yarı zamanlı sulh mahkemeleri bölge yargıçları, en az on yıllık tecrübeye sahip barrister veya solicitor statüsünde bir avukat olmalıdır. Bu yargıçlar tek başına görev yaparlar ve genellikle daha uzun veya daha karmaşık kısa yargılama davalarına bakarlar. Bölge yargıçları, bağımsız bir komisyon olan Yargısal Atamalar Komisyonu tarafından, hukukçular arasından seçilir.İlk oturumda suçluluk beyanında bulunan zanlının, yaptırım hükmünden üçte bir oranında indirim hakkı olur; bu beyan geciktikçe indirim azalır. Başka bir hafifletme sebebinin (mitigation), örneğin gerçek bir pişmanlığın bulunması halinde, bu indirim daha da artabilir. Zanlının, suçüstü yakalandığı düşünülse bile indirim uygulanır. Bu sistem, ABD de uygulanan  beyan pazarlığı  sisteminden farklıdır. Yaptırım hükmü için açıktan beyan pazarlığı, Turner ([1970] Q.B. 321) kuralları ile yasaklanmıştır. Zanlı, Goodyear bildirimi olarak adlandırılan süreç vasıtasıyla mahkemeye, suçluluk beyanında bulunması hâlinde alacağı yaptırım hükmü hakkında soru sorabilir. Goodyear ([2005] EWCA Crim 888) kararını takiben uygulanan bu süreç, doktrinde  pazarlık la ilişkilendirilmiştir.26  Riddle/Zara, s. 224.27  Bob Bearne,  Pre-Sentence Report (PSR) , iç. Rob Canton/David Hancock (Ed.), Dictionary of Probation and Offender Management, Willan Publishing, 2007, s. 212.28  Ashworth, s. 2. Bu iki grup avukatlık, mesleğe kabul şartları ve kullanılan yetkiler bakımından farklılık arz eder. Bkz. Jonathan Law/Elizabeth A. Martin (Ed.), A Dictionary of Law, 7th Edition, Oxford University Press, 2009, s. 23, 56 ve 516.29  Ashworth, s. 2.30  Riddle/Zara, s. 19.31  Doktrinde, Birleşik Krallık taki ve Amerika Birleşik Devletleri ndeki, polisle ve soruşturmayla ilgili yargılama öncesi pratiklerin, suçluluk beyanında bulunulmasını sağlama almaya yönelik olduğu ifade edilmiştir. Buna göre, itiraflar özellikle önemlidir, zira polis huzurunda suçunu kabul etmiş bulunan kişi için bunu inkâr etmek zordur. Böylece itiraflar, çoğu davada suçluluk beyanını garanti altına almaktadır: Andrew Sanders/Richard Young,  From Suspect to Trial , iç. Mike Maguire/Rod Morgan/Robert Reiner, The Oxford Handbook of Criminology, 4th Edition, Oxford University Press, 2007, s. 979.32  Riddle/Zara, s. 221.33  Riddle/Zara, s. 221.34  Riddle/Zara, s. 221.35  Riddle/Zara, s. 221.36  Sanders/Young, s. 979-980.37  Riddle/Zara, s. 221.38  Sanders/Young, s. 979-980.Cilt: 8 | Sayı: 1-2 | Temmuz-Aralık 202016 Dr. Öğr. Üyesi Mehmet MADEN4. Kraliyet MahkemesiSulh mahkemelerinin kararlarına karşı yapılan temyiz başvurularının incelenmesi; yaptırım hükmü verilmesi için sulh mahkemesinden sevk edilen davaların karara bağlanması; jüri yargılamaları ve Kraliyet Mahkemesi nde mahkûm edilenler için yaptırım hükmü verilmesi, 1972 de kurulmuş olan ve İngiltere nin ve Galler in farklı yerlerinde merkezleri bulunan Kraliyet Mahkemesi nin görev alanlarıdır.Bu mahkemede tam zamanlı olarak görev yapan yargıçlar,  daire yargıcı  (circuit judge) olarak; yarı zamanlı görev yapan yargıçlar ise  mukayyit  (recorder) olarak adlandırılır. Yüksek Mahkeme yargıçları, bazen, özellikle en ciddi davalarda, Kraliyet Mahkemesi ne katılır.Daire yargıçları ve mukayyitler, Yargısal Atamalar Komisyonu tarafından düzenlenen dürüst ve açık bir yarışmanın ardından, Lord Chancellor ın önerisi üzerine Kraliçe tarafından atanırlar. On beş üyeden oluşan Yargısal Atamalar Komisyonu, yargısal görevler için aday seçme sorumluluğunu Lord Chancellor dan alarak ve atama süreçlerini daha şeffaf ve daha hesap sorulabilir hale getirerek yargı bağımsızlığını korumak ve güçlendirmek için oluşturulmuştur. Komisyon üyeleri, beş yıla kadar uzanan dönemler için görev yaparlar. Başkan dahil on iki üye, açık yarışmayla atanır; üç üye ise Yargıçlar Konseyi tarafından aday gösterilir.Daire yargıçları, en az on yıldır  huzurda bulunma (mahkemede avukatlık yapma) hakkı na ( right of audiance ) sahip olan hukukçular içinden atanırlar ve genellikle, atanmalarından önce mukayyit olarak çalışmış olmaları aranır. Bazı emekli yargıçlar, yarı zamanlı daire yargıcı olarak görev yaparlar ve bu kişiler yardımcı daire yargıcı olarak anılırlar. Mukayyitler beş yıl için atanırlar ve atamaları Lord Chancellor tarafından genellikle otomatik olarak beş yılda bir uzatılır.39  Riddle/Zara, s. 218.40  Riddle/Zara, s. 218.41  Riddle/Zara, s. 218.42  Judicial Office, <www.judiciary.uk/about-the-judiciary/who-are-the-judiciary/judicial-roles/judges/ciruitjudge/> Erişim Tarihi 20 Mart 2021; Judicial Office, <www.judiciary.uk/about-the-judiciary/who-are-thejudiciary/judicial-roles/judges/recorder/> Erişim Tarihi 20 Mart 2021.43  Judicial Office, <www.judiciary.uk/about-the-judiciary/judges-career-paths/appointments-diversity/> Erişim Tarihi 21 Mart 2021.44  Judicial Office, <www.judiciary.uk/about-the-judiciary/judges-career-paths/appointments-diversity/> Erişim Tarihi 21 Mart 2021.45  Judicial Office, <www.judiciary.uk/about-the-judiciary/judges-career-paths/appointments-diversity/> Erişim Tarihi 21 Mart 2021.46  Judicial Office, <www.judiciary.uk/about-the-judiciary/who-are-the-judiciary/judicial-roles/judges/ciruit-judge/> Erişim Tarihi 21 Mart 2021.47  Judicial Office, <www.judiciary.uk/about-the-judiciary/who-are-the-judiciary/judicial-roles/judges/ciruit-judge/> Erişim Tarihi 21 Mart 2021.48  Judicial Office, <www.judiciary.uk/about-the-judiciary/who-are-the-judiciary/judicial-roles/judges/recorder/> Erişim Tarihi 20 Mart 2021.Sakarya Üniversitesi Hukuk Fakültesi Dergisiİngiltere ve Galler Ceza Muhakemesi Hukukunda Yargılama Makam ve Süjeleri 17Yukarıda, yargılama usulüne göre suçların tasnif edilmesiyle ilgili açıklamaların bulunduğu bölümde işaret edildiği üzere; ithamnameye dayalı olarak yargılanabilen suçlar hakkındaki yargılama, Kraliyet Mahkemesi nde yapılır. Elektronik ortamda bulunan veya kâğıt üzerine yazılı olan ithamname, bir veya birden fazla suçlama içerir; zanlıdan, bu suçlamalar hakkında suçluluk veya suçsuzluk beyanında bulunması, jüriden ise bu suçlamalar hakkında hükmünü vermesi istenir.Jüri,  cemiyetin  bütün  kesimlerini  temsil  ettiği  farz  edilen  ve  hukuk mesleğinden olmayan on iki üyeden oluşur. Bu üyeler, bilgisayar tarafından, seçmen  listesinden  rastgele  seçilirler.  Jüri  üyeliği,  gerek  savunma  gerekse soruşturma makamı tarafından reddedilebilir.Jürinin görevi, olgusal konularda karar vermektir; hukuki meselelerin veya hukuki usulle ilgili meselelerin çözümünde ya da yaptırım hükmünün verilmesinde jürinin bir görevi yoktur; hukuki konularda karar vermek, yargıcın işidir. Davayla ilgili olguları dinleyen jüri, soruşturma ve savunma makamlarının görüşleri yargıç tarafından özetlendikten sonra,  suçlu  veya  suçlu değil  şeklinde bir hüküm verir. Jürinin hüküm verebilmesi, önceleri oybirliği ile mümkünken, Ceza Adaleti Yasası 1967 ile, yargılamanın neticesinin on oya iki oy şeklindeki çoğunlukla belirlenmesinin yolu açılmıştır.5. Temyiz Başvurularını İncelemekle Görevli MahkemelerSulh mahkemesince verilen mahkûmiyet kararları ve teminatla salıvermeyle (bail) veya yaptırım hükmüyle ilgili kararlar, Kraliyet Mahkemesi nde temyiz (appeal) edilebilir. Temyiz davası, Kraliyet Mahkemesi nde, bir daire yargıcı (veya bir mukayyit) ile önceki davanın görülmesinde yer almayan iki sulh yargıcının katılımıyla görülür. Temyiz aşamasında dava baştan görülür ve taraflar, mahkemenin önüne yeni veya farklı olgular getirmekte serbesttir. Uygulamada, çok az sayıda karar temyiz edilmektedir. Bu temyiz yolu, soruşturma makamına açık değildir.49  Riddle/Zara, s. 221-222.50  Gubby, s. 27.51  Peter Joyce/Neil Wain, A Dictionary of Criminal Justice, Routledge, 2010, s. 114.52  Gubby, s. 27.53  Gubby, s. 26-27.54  Gubby, s. 27.55  Joyce/Wain, s. 114.56  Riddle/Zara, s. 21-22.57  Riddle/Zara, s. 216.58  Riddle/Zara, s. 216.59  Riddle/Zara, s. 216.60  Riddle/Zara, s. 216.Cilt: 8 | Sayı: 1-2 | Temmuz-Aralık 202018 Dr. Öğr. Üyesi Mehmet MADENKraliyet Mahkemesi nce mahkum edilenler, gerek mahkumiyet kararını gerekse yaptırım hükmünü Temyiz Mahkemesi nde temyiz edebilirler. Kraliyet Mahkemesi nin diğer kararları bakımından, bazı durumlarda, soruşturma veya savunma makamının, Temyiz  Mahkemesi ne  temyiz  başvurusunda  bulunması  mümkündür.  Kraliyet Mahkemesi nden gelen temyiz davaları, Temyiz Mahkemesi nde üç yargıç tarafından görülür. Bu yargıçların başkanlığını bir lord/leydi temyiz yargıcı yapar; diğer üyeler ise Yüksek Mahkeme yargıcı veya daire yargıcıdır. Bazı durumlarda, Kraliyet Baş Hukuk Müşavirinin (Attorney General) de davayı Temyiz Mahkemesi ne taşıma yetkisi vardır. Zanlının Kraliyet Mahkemesi nde beraat etmiş olduğu bazı hâllerde, Kraliyet Baş Hukuk Müşaviri, Temyiz Mahkemesi nden, Kraliyet Mahkemesi nin hukuku yorumlama biçimini gözden geçirmesini talep edebilir. Yine, Kraliyet Mahkemesi nin çok hafif bir yaptırım hükmü verdiği düşüncesinde ise, Kraliyet Baş Hukuk Müşavirinin, Temyiz Mahkemesi nden yaptırım hükmünü ağırlaştırmasını talep edebileceği haller vardır.Bazı durumlarda, soruşturma veya savunma makamı, sulh mahkemesinin veya Kraliyet Mahkemesi nin kararında hukuki bir hata olduğu düşüncesiyle, Yüksek Mahkeme ye temyiz başvurusunda bulunabilir,70. Böyle durumlarda, Yüksek Mahkeme ye temyiz başvurusunda bulunmak için, sulh mahkemesinden veya Kraliyet Mahkemesi nden, olup bitenin bir özetine muvafakat etmesi talep edilir. Bu özete,  dava takdimi  (case stated) denilir.61  Bryan Gibson, Criminal Justice a Beginner s Guide, Waterside Press, 2014, s. 93.62  Criminal  Procedure  Rule  Committee,  <www.gov.uk/guidance/rules-and-practice-directions2020#appeal> Erişim Tarihi 28 Mart 2021.63  His Honour Judge Teare,  Judges , iç. Rob Canton/David Hancock (Ed.), Dictionary of Probation and Offender Management, Willan Publishing, 2007, s. 149.64  Teare, s. 149.65  Bu kelime, daha önceki bir çalışmada ve yine İngiltere ve Galler bağlamında  Başsavcı  olarak tercüme edilmiştir: Mehmet Maden,  İngiltere ve Galler de Ceza Hukuku Sorumluluğuna Mâni Olan Bir Kurum Olarak Otomatizm , 2020, 24(4), Ankara Hacı Bayram Veli Üniversitesi Hukuk Fakültesi Dergisi, s. 593-594, <https://dergipark.org.tr/tr/download/article-file/1354834> Erişim Tarihi 30 Mart 2021. Hâlbuki İngiltere ve Galler bağlamında, bu kelimenin  Başsavcı  yerine  Kraliyet Baş Hukuk Müşaviri  olarak tercüme edilmesi uygun gözükmektedir: Bkz. Government Digital Service, GOV.UK İnternet Sitesi, <www.gov.uk/government/ministers/attorney-general> Erişim Tarihi 30 Mart 2021.66  Gibson, s. 93.67  Criminal Procedure Rule Committee, <www.gov.uk/guidance/rules-and-practice-directions-2020# appeal> Erişim Tarihi 28 Mart 2021.68  Criminal Procedure Rule Committee, <www.gov.uk/guidance/rules-and-practice-directions-2020# appeal> Erişim Tarihi 28 Mart 2021.69  Criminal Procedure Rule Committee, <www.gov.uk/guidance/rules-and-practice-directions-2020# appeal> Erişim Tarihi 28 Mart 2021.70  Yüksek Mahkeme nin, Kraliçe nin Kürsüsü (Queen s Bench); Chancery ve Aile isimli üç bölümü vardır: Gubby, s. 17.71  Criminal Procedure Rule Committee, <www.gov.uk/guidance/rules-and-practice-directions-2020# appeal> Erişim Tarihi 28 Mart 2021.72  Criminal Procedure Rule Committee, <www.gov.uk/guidance/rules-and-practice-directions-2020# appeal> Erişim Tarihi 28 Mart 2021.Sakarya Üniversitesi Hukuk Fakültesi Dergisiİngiltere ve Galler Ceza Muhakemesi Hukukunda Yargılama Makam ve Süjeleri 19Sulh mahkemelerinin kararları için Yüksek Mahkeme de temyiz yolu, nadiren kullanılır. Hem savunma makamına hem de soruşturma makamına açık olan bu temyiz yolu, sulh yargıçlarının kararının hukuki yetkilerinin dışında olduğu veya açıkça gayrimakul olduğu belirtilerek kullanılır. Yüksek Mahkeme de temyiz yolu başarısızlıkla sonuçlandığı zaman, genelde, Kraliyet Mahkemesi ne temyiz başvurusunda bulunmak için belirlenmiş olan süre tükenmiş ve bu imkân kaybedilmiş olur. Çoğu durumda, savunma makamı, davayı Kraliyet Mahkemesi ne götürmeyi, Yüksek Mahkeme ye ise sadece buradan çıkan karardan hoşnut olmama durumunda başvurmayı tercih etmektedir.Yüksek  Mahkeme  için,  Temyiz  Mahkemesi nin  ve  Yüksek  Temyiz  Mahkemesi nin  kararları  bağlayıcıdır  ancak  kendi  kararları  bağlayıcı değildir. Temyiz Mahkemesi için de Yüksek Temyiz Mahkemesi nin kararları bağlayıcıdır; ayrıca, Temyiz Mahkemesi nin özel hukuk ve ceza bölümleri için, belirli istisnalar söz konusu değilse, kendilerinin önceki kararları bağlayıcıdır.Bazı  durumlarda,  Temyiz  Mahkemesi nin  hukuki  bir  hata  yaptığı düşüncesiyle Yüksek Temyiz Mahkemesine temyiz başvurusunda bulunulabilir. Böyle bir durumda, Temyiz Mahkemesi nden,  kamunun geneli için önemli olan bir hukuki konu yla ilgili olduğunu bildiren bir belge talep edilmelidir.Yüksek Temyiz Mahkemesi, Birleşik Krallık taki en yüksek mahkeme olarak, Lordlar Kamarası Temyiz Komitesi nin yerini Ekim 2009 da almıştır. On iki yargıçtan müteşekkil mahkeme (ki bu yargıçlardan birisi mahkemenin başkanlık görevini yürütür), hukuk davalarında bütün Birleşik Krallık bakımından, ceza davalarında ise İngiltere, Galler ve Kuzey İrlanda bakımından, kamu için en önemli olarak görülen hukuki konulardaki temyizleri incelemekle görevlidir. Bir Birleşik Krallık kurumu olan Yüksek Temyiz Mahkemesi, İngiltere ve Galler 73  Riddle/Zara, s. 22 ve 216.74  Riddle/Zara, s. 216.75  Riddle/Zara, s. 216.76  Riddle/Zara, s. 216.77  Gubby, s. 17.78  Gubby, s. 17.79  Criminal Procedure Rule Committee, <www.gov.uk/guidance/rules-and-practice-directions-2020# appeal> Erişim Tarihi 28 Mart 2021.80  Criminal Procedure Rule Committee, <www.gov.uk/guidance/rules-and-practice-directions-2020# appeal> Erişim Tarihi 28 Mart 2021.81  Riddle/Zara, s. 226.82  Gubby, s. 25.83  Riddle/Zara, s. 226-227.Cilt: 8 | Sayı: 1-2 | Temmuz-Aralık 202020 Dr. Öğr. Üyesi Mehmet MADENmahkeme sistemine dahil değildir ve bu itibarla yargı erkinin başı olma görevi verilen İngiltere ve Galler Lord Baş Yargıcının görev kapsamı dışında kalmaktadır. Yüksek Temyiz Mahkemesi nde görülecek hukuki bir konunun sulh mahkemesi kaynaklı bir davadan neşet etmesi çok beklenmez ancak imkân dahilindedir.6. Sonuçİngiltere ve Galler, ceza yargılamasının işleyişi, yargılama süjelerinin göreve gelme biçimleri ve çalışma usulleri gibi birçok hususta özellik arz etmektedir. Suçlar, yargılama usulüne göre üç gruba ayrılmakta; bunlardan bir grubun somut olayda yargılanma usulünün belirlenmesi için özel usuller uygulanmaktadır. Zanlının, suçluluk veya suçsuzluk beyanında bulunması, uygulanacak usul ve verilecek hüküm açısından önem arz etmektedir. Yarı zamanlı yargıçlık, hususiyet arz eden bir diğer uygulamadır. Gönüllü yargıçlık ve hukukçu olmayan yargıçlık da dikkat çeken diğer uygulamalardır. Hukukçu olmayan sulh yargıçlarını, ihtiyaç hâlinde hukuki konularda bilgilendirmek üzere, sulh mahkemelerinde hukuk müşaviri istihdam edilmektedir. Neredeyse bütün ceza davaları, sulh mahkemesinde görülmeye başlanmakta, bunların içinden Kraliyet Mahkemesi ne gidecek davalar bu mahkemede belirlenmektedir. Kraliyet Mahkemesi nde yargılamaya jüri iştirak etmekte; yaptırım hükmüne değilse de, zanlının suçlu olup olmadığına jüri karar vermektedir. Bazı durumlarda, yargılama sulh mahkemesinde yapılmasına ve zanlı hakkında bu mahkemede mahkûmiyet kararı verilmesine rağmen, yaptırım hükmünün belirlenmesi, Kraliyet Mahkemesi ne bırakılmaktadır. Temyiz yoluna başvurmak bakımından, mahkûmiyet hükmü ile yaptırım hükmünün birbirinden ayrı olarak ele alınması da özellik arz eden bir başka konu olarak karşımıza çıkmaktadır. Son olarak, yargıçların, (magistrate (sulh yargıcı); sulh mahkemesi bölge yargıcı; daire yargıcı; mukayyit; Lord Baş Yargıç gibi) farklı şekillerde isimlendirildiği görülmektedir.84  Judicial Office, <www.judiciary.uk/about-the-judiciary/the-justice-system/the-supreme-court/> Erişim Tarihi 19 Mart 2021.85  Riddle/Zara, s. 227.Sakarya Üniversitesi Hukuk Fakültesi Dergisiİngiltere ve Galler Ceza Muhakemesi Hukukunda Yargılama Makam ve Süjeleri 21",
     "Kaynakça": "Ashworth A, Sentencing and Criminal Justice, 5th Edition, Cambridge University Press, 2010.Aybay R, An Introduction to Law, Alfa Basım Yayım Dağıtım, 1 inci Basım, 2013.Bearne B,  Pre Sentence Report (PSR) , iç. Canton R/Hancock D (Ed.), Dictionary of Probation and Offender Management, Willan Publishing, 2007, s. 212 214.Cavadino M/Dignan J, The Penal System an Introduction, 4th Edition, Sage Publications, 2007.Criminal Procedure Rule Committee, Criminal Procedure Rules and Practice Directions 2020 (Guidance), <www.gov.uk/guidance/rules and practice directions 2020> Erişim Tarihi 28 Mart 2021.Gibson B, Criminal Justice a Beginner s Guide, Waterside Press, 2014.Government Digital Service, GOV.UK İnternet Sitesi, <www.gov.uk/government/ministers/attorney general> Erişim Tarihi 30 Mart 2021.Gubby H, English Legal Terminology Legal Concepts in Language, 4th Edition, Eleven International Publishing, 2016.Joyce P/Wain N, A Dictionary of Criminal Justice, Routledge, 2010.Joyce P, Criminal Justice an Introduction, Routledge, 2013.Judicial Office, Judiciary UK Website (Courts and Tribunals Judiciary), <www.judiciary.uk/> Son Erişim Tarihi 21 Mart 2021.Law J/Martin E A (Ed.), A Dictionary of Law, 7th Edition, Oxford University Press, 2009.Maden M,  İngiltere ve Galler de Ceza Hukuku Sorumluluğuna Mâni Olan Bir Kurum Olarak Otomatizm , 2020, 24(4), Ankara Hacı Bayram Veli Üniversitesi Hukuk Fakültesi Dergisi, s. 585 611, <https://dergipark.org.tr/tr/download/articlefile/1354834> Erişim Tarihi 30 Mart 2021.Riddle H/Zara R, Essential Magistrates  Courts Law, Waterside Press, 2019.Sanders A/Young R,  From Suspect to Trial , iç. Maguire M/Morgan R/Reiner R, The Oxford Handbook of Criminology, 4th Edition, Oxford University Press, 2007, s. 953 989.Teare His Honour Judge,  Judges , iç. Canton R/Hancock D (Ed.), Dictionary of Probation and Offender Management, Willan Publishing, 2007, s. 149 149.Cilt: 8 | Sayı: 1 2 | Temmuz Aralık 2020"
}